I2: Current Individual Scores
A3: 2006 | X3: YEARLY
A4: Player \Wk | B4: 1 | C4: 2 | D4: 3 | E4: 4 | F4: 5 | G4: 6 | H4: 7 | I4: 8 | J4: 9 | K4: 10 | M4: 11 | N4: 12 | O4: 13 | P4: 14 | Q4: 15 | R4: 16 | S4: 17 | T4: 18 | U4: 19 | V4: 20 | X4: AVERAGE
A5: T. Reese 4 | B5: 42 | C5: 40 | D5: 43 | E5: A | F5: A | G5: 47 | H5: 42 | I5: 46 | J5: 43 | K5: 42 | M5: 45 | N5: 47 | O5: 42 | P5: 41 | Q5: 41 | R5: 39 | S5: 42 | T5: 45 | U5: _ | W5: =AVERAGE(B5:T5)-37 -> 5.9375 | X5: =(+B5+C5+D5+E5+F5+G5+H5+I5+J5+K5+M5+N5+O5+P5+Q5+R5+S5+T5+U5+V5)/20 -> #VALUE!
A6: Avg | C6: =AVERAGE(B5,C5) -> 41 | D6: =AVERAGE(B5:D5) -> 41.666666666666664 | E6: =AVERAGE(B5:E5) -> 41.666666666666664 | F6: =AVERAGE(B5:F5) -> 41.666666666666664 | G6: =AVERAGE(B5:G5) -> 43 | H6: =AVERAGE(B5:H5) -> 42.8 | I6: =AVERAGE(B5:I5) -> 43.333333333333336 | J6: =AVERAGE(B5:J5) -> 43.285714285714285 | K6: =AVERAGE(B5:K5) -> 43.125 | M6: =AVERAGE(B5:M5) -> 43.333333333333336 | N6: =AVERAGE(B5:N5) -> 43.7 | O6: =AVERAGE(B5:O5) -> 43.545454545454547 | P6: =AVERAGE(B5:P5) -> 43.333333333333336 | Q6: =AVERAGE(B5:Q5) -> 43.153846153846153 | R6: =AVERAGE(B5:R5) -> 42.857142857142854 | S6: =AVERAGE(B5:S5) -> 42.8 | T6: =AVERAGE(B5:T5) -> 42.9375 | U6: =AVERAGE(B5:U5) -> 42.9375 | V6: =AVERAGE(B5:V5) -> 42.9375
A7: HC | B7: =B5-37 -> 5 | C7: =C6-37 -> 4 | D7: =D6-37 -> 4.6666666666666643 | E7: =E6-37 -> 4.6666666666666643 | F7: =F6-37 -> 4.6666666666666643 | G7: =G6-37 -> 6 | H7: =H6-37 -> 5.8 | I7: =I6-37 -> 6.3333333333333357 | J7: =J6-37 -> 6.2857142857142847 | K7: =K6-37 -> 6.125 | M7: =M6-37 -> 6.3333333333333357 | N7: =N6-37 -> 6.7 | O7: =O6-37 -> 6.5454545454545467 | P7: =P6-37 -> 6.3333333333333357 | Q7: =Q6-37 -> 6.1538461538461533 | R7: =R6-37 -> 5.8571428571428541 | S7: =S6-37 -> 5.8 | T7: =T6-37 -> 5.9375 | U7: =U6-37 -> 5.9375 | V7: =V6-37 -> 5.9375
A9: A. Wilks 7 | B9: 47 | C9: 48 | D9: 44 | E9: 43 | F9: 48 | G9: 44 | H9: 47 | I9: 52 | J9: 45 | K9: 45 | M9: 47 | N9: 46 | O9: 47 | P9: 45 | Q9: 45 | R9: 50 | S9: 51 | T9: 42 | U9: _ | W9: =AVERAGE(B9:T9)-37 -> 9.4444444444444429 | X9: =(+B9+C9+D9+E9+F9+G9+H9+I9+J9+K9+M9+N9+O9+P9+Q9+R9+S9+T9+V9)/19 -> 44.00
A10: Avg | C10: =AVERAGE(B9:C9) -> 47.5 | D10: =AVERAGE(B9:D9) -> 46.333333333333336 | E10: =AVERAGE(B9:E9) -> 45.5 | F10: =AVERAGE(B9:F9) -> 46 | G10: =AVERAGE(B9:G9) -> 45.666666666666664 | H10: =AVERAGE(B9:H9) -> 45.857142857142854 | I10: =AVERAGE(B9:I9) -> 46.625 | J10: =AVERAGE(B9:J9) -> 46.444444444444443 | K10: =AVERAGE(B9:K9) -> 46.3 | M10: =AVERAGE(B9:M9) -> 46.363636363636367 | N10: =AVERAGE(B9:N9) -> 46.333333333333336 | O10: =AVERAGE(B9:O9) -> 46.384615384615387 | P10: =AVERAGE(B9:P9) -> 46.285714285714285 | Q10: =AVERAGE(B9:Q9) -> 46.2 | R10: =AVERAGE(B9:R9) -> 46.4375 | S10: =AVERAGE(B9:S9) -> 46.705882352941174 | T10: =AVERAGE(B9:T9) -> 46.444444444444443 | U10: =AVERAGE(B9:U9) -> 46.444444444444443 | V10: =AVERAGE(B9:V9) -> 46.444444444444443
A11: HC | B11: =B9-37 -> 10 | C11: =C10-37 -> 10.5 | D11: =D10-37 -> 9.3333333333333357 | E11: =E10-37 -> 8.5 | F11: =F10-37 -> 9 | G11: =G10-37 -> 8.6666666666666643 | H11: =H10-37 -> 8.8571428571428541 | I11: =I10-37 -> 9.625 | J11: =J10-37 -> 9.4444444444444429 | K11: =K10-37 -> 9.3 | M11: =M10-37 -> 9.3636363636363669 | N11: =N10-37 -> 9.3333333333333357 | O11: =O10-37 -> 9.3846153846153868 | P11: =P10-37 -> 9.2857142857142847 | Q11: =Q10-37 -> 9.2 | R11: =R10-37 -> 9.4375 | S11: =S10-37 -> 9.705882352941174 | T11: =T10-37 -> 9.4444444444444429 | U11: =U10-37 -> 9.4444444444444429 | V11: =V10-37 -> 9.4444444444444429
A13: B. Meadows 12 | B13: 49 | C13: 51 | D13: A | E13: 56 | F13: 51 | G13: 50 | H13: 51 | I13: A | J13: 47 | K13: 48 | M13: 52 | N13: 50 | O13: 50 | P13: 50 | Q13: 46 | R13: 53 | S13: 49 | T13: 55 | U13: _ | W13: =AVERAGE(B13:T13)-37 -> 13.50 | X13: =(+B13+C13+D13+E13+F13+G13+H13+I13+J13+K13+N13+O13+P13+Q13+R13+S13+T13+U13+V13)/19 -> #VALUE!
A14: Avg | C14: =AVERAGE(B13,C13) -> 50 | D14: =AVERAGE(B13:D13) -> 50 | E14: =AVERAGE(B13:E13) -> 52 | F14: =AVERAGE(B13:F13) -> 51.75 | G14: =AVERAGE(B13:G13) -> 51.4 | H14: =AVERAGE(B13:H13) -> 51.333333333333336 | I14: =AVERAGE(B13:I13) -> 51.333333333333336 | J14: =AVERAGE(B13:J13) -> 50.714285714285715 | K14: =AVERAGE(B13:K13) -> 50.375 | M14: =AVERAGE(B13:M13) -> 50.555555555555557 | N14: =AVERAGE(B13:N13) -> 50.5 | O14: =AVERAGE(B13:O13) -> 50.454545454545453 | P14: =AVERAGE(B13:P13) -> 50.416666666666664 | Q14: =AVERAGE(B13:Q13) -> 50.07692307692308 | R14: =AVERAGE(B13:R13) -> 50.285714285714285 | S14: =AVERAGE(B13:S13) -> 50.2 | T14: =AVERAGE(B13:T13) -> 50.5 | U14: =AVERAGE(B13:U13) -> 50.5 | V14: =AVERAGE(B13:V13) -> 50.5
A15: HC | B15: =B13-37 -> 12 | C15: =C14-37 -> 13 | D15: =D14-37 -> 13 | E15: =E14-37 -> 15 | F15: =F14-37 -> 14.75 | G15: =G14-37 -> 14.4 | H15: =H14-37 -> 14.333333333333336 | I15: =I14-37 -> 14.333333333333336 | J15: =J14-37 -> 13.714285714285715 | K15: =K14-37 -> 13.375 | M15: =M14-37 -> 13.555555555555557 | N15: =N14-37 -> 13.5 | O15: =O14-37 -> 13.454545454545453 | P15: =P14-37 -> 13.416666666666664 | Q15: =Q14-37 -> 13.07692307692308 | R15: =R14-37 -> 13.285714285714285 | S15: =S14-37 -> 13.2 | T15: =T14-37 -> 13.5 | U15: =U14-37 -> 13.5 | V15: =V14-37 -> 13.5
A17: L. Chiles 15 | B17: 54 | C17: 63 | D17: 50 | E17: 54 | F17: A | G17: 57 | H17: 53 | I17: 55 | J17: 51 | K17: 55 | M17: 55 | N17: 55 | O17: 52 | P17: 51 | Q17: 52 | R17: 56 | S17: A | T17: A | U17: _ | W17: =AVERAGE(B17:T17)-37 -> 17.20 | X17: =(+B17+C17+D17+E17+F17+G17+H17+I17+J17+K17+M17+O17+P17+Q17+S17+T17+U17+V17)/18 -> #VALUE!
A18: Avg | C18: =AVERAGE(B17,C17) -> 58.5 | D18: =AVERAGE(B17:D17) -> 55.666666666666664 | E18: =AVERAGE(B17:E17) -> 55.25 | F18: =AVERAGE(B17:F17) -> 55.25 | G18: =AVERAGE(B17:G17) -> 55.6 | H18: =AVERAGE(B17:H17) -> 55.166666666666664 | I18: =AVERAGE(B17:I17) -> 55.142857142857146 | J18: =AVERAGE(B17:J17) -> 54.625 | K18: =AVERAGE(B17:K17) -> 54.666666666666664 | M18: =AVERAGE(B17:M17) -> 54.7 | N18: =AVERAGE(B17:N17) -> 54.727272727272727 | O18: =AVERAGE(B17:O17) -> 54.5 | P18: =AVERAGE(B17:P17) -> 54.230769230769234 | Q18: =AVERAGE(B17:Q17) -> 54.071428571428569 | R18: =AVERAGE(B17:R17) -> 54.2 | S18: =AVERAGE(B17:S17) -> 54.2 | T18: =AVERAGE(B17:T17) -> 54.2 | U18: =AVERAGE(B17:U17) -> 54.2 | V18: =AVERAGE(B17:V17) -> 54.2
A19: HC | B19: =B17-37 -> 17 | C19: =C18-37 -> 21.5 | D19: =D18-37 -> 18.666666666666664 | E19: =E18-37 -> 18.25 | F19: =F18-37 -> 18.25 | G19: =G18-37 -> 18.6 | H19: =H18-37 -> 18.166666666666664 | I19: =I18-37 -> 18.142857142857146 | J19: =J18-37 -> 17.625 | K19: =K18-37 -> 17.666666666666664 | M19: =M18-37 -> 17.7 | N19: =N18-37 -> 17.727272727272727 | O19: =O18-37 -> 17.5 | P19: =P18-37 -> 17.230769230769234 | Q19: =Q18-37 -> 17.071428571428569 | R19: =R18-37 -> 17.2 | S19: =S18-37 -> 17.2 | T19: =T18-37 -> 17.2 | U19: =U18-37 -> 17.2 | V19: =V18-37 -> 17.2
A21: Player \Wk | B21: 1 | C21: 2 | D21: 3 | E21: 4 | F21: 5 | G21: 6 | H21: 7 | I21: 8 | J21: 9 | K21: 10 | M21: 11 | N21: 12 | O21: 13 | P21: 14 | Q21: 15 | R21: 16 | S21: 17 | T21: 18 | U21: 19 | V21: 20
A22: T. Wilson 3 | B22: 43 | C22: A | D22: 48 | E22: A | F22: A | G22: 40 | H22: A | I22: A | J22: A | K22: 38 | M22: 42 | N22: 40 | O22: 42 | P22: 44 | Q22: 39 | R22: A | S22: 48 | T22: 40 | U22: _ | W22: =AVERAGE(B22:T22)-37 -> 5.1818181818181799 | X22: =(+B22+C22+D22+E22+F22+G22+H22+I22+J22+K22+M22+N22+O22+P22+Q22+R22+S22+T22+U22+V22)/20 -> #VALUE!
A23: Avg | C23: =AVERAGE(B22,C22) -> 43 | D23: =AVERAGE(B22:D22) -> 45.5 | E23: =AVERAGE(B22:E22) -> 45.5 | F23: =AVERAGE(B22:F22) -> 45.5 | G23: =AVERAGE(B22:G22) -> 43.666666666666664 | H23: =AVERAGE(B22:H22) -> 43.666666666666664 | I23: =AVERAGE(B22:I22) -> 43.666666666666664 | J23: =AVERAGE(B22:J22) -> 43.666666666666664 | K23: =AVERAGE(B22:K22) -> 42.25 | M23: =AVERAGE(B22:M22) -> 42.2 | N23: =AVERAGE(B22:N22) -> 41.833333333333336 | O23: =AVERAGE(B22:O22) -> 41.857142857142854 | P23: =AVERAGE(C22:P22) -> 42 | Q23: =AVERAGE(B22:Q22) -> 41.777777777777779 | R23: =AVERAGE(B22:R22) -> 41.777777777777779 | S23: =AVERAGE(B22:S22) -> 42.4 | T23: =AVERAGE(B22:T22) -> 42.18181818181818 | U23: =AVERAGE(B22:U22) -> 42.18181818181818 | V23: =AVERAGE(B22:V22) -> 42.18181818181818
A24: HC | B24: =B22-37 -> 6 | C24: =C23-37 -> 6 | D24: =D23-37 -> 8.5 | E24: =E23-37 -> 8.5 | F24: =F23-37 -> 8.5 | G24: =G23-37 -> 6.6666666666666643 | H24: =H23-37 -> 6.6666666666666643 | I24: =I23-37 -> 6.6666666666666643 | J24: =J23-37 -> 6.6666666666666643 | K24: =K23-37 -> 5.25 | M24: =M23-37 -> 5.2 | N24: =N23-37 -> 4.8333333333333357 | O24: =O23-37 -> 4.8571428571428541 | P24: =P23-37 -> 5 | Q24: =Q23-37 -> 4.7777777777777786 | R24: =R23-37 -> 4.7777777777777786 | S24: =S23-37 -> 5.4 | T24: =T23-37 -> 5.1818181818181799 | U24: =U23-37 -> 5.1818181818181799 | V24: =V23-37 -> 5.1818181818181799
A26: B. Craig 7 | B26: 42 | C26: 48 | D26: 51 | E26: 44 | F26: 47 | G26: 42 | H26: 45 | I26: 46 | J26: A | K26: A | M26: 45 | N26: 44 | O26: 45 | P26: 45 | Q26: 43 | R26: 44 | S26: 47 | T26: A | U26: _ | W26: =AVERAGE(B26:T26)-37 -> 8.20 | X26: =(+B26+C26+D26+E26+F26+G26+H26+I26+J26+K26+N26+O26+P26+R26+S26+T26+U26+V26)/18 -> #VALUE!
A27: Avg | C27: =AVERAGE(B26,C26) -> 45 | D27: =AVERAGE(B26:D26) -> 47 | E27: =AVERAGE(B26:E26) -> 46.25 | F27: =AVERAGE(B26:F26) -> 46.4 | G27: =AVERAGE(B26:G26) -> 45.666666666666664 | H27: =AVERAGE(B26:H26) -> 45.571428571428569 | I27: =AVERAGE(B26:I26) -> 45.625 | J27: =AVERAGE(B26:J26) -> 45.625 | K27: =AVERAGE(B26:K26) -> 45.625 | M27: =AVERAGE(B26:M26) -> 45.555555555555557 | N27: =AVERAGE(B26:N26) -> 45.4 | O27: =AVERAGE(B26:O26) -> 45.363636363636367 | P27: =AVERAGE(B26:P26) -> 45.333333333333336 | Q27: =AVERAGE(B26:Q26) -> 45.153846153846153 | R27: =AVERAGE(B26:R26) -> 45.071428571428569 | S27: =AVERAGE(B26:S26) -> 45.2 | T27: =AVERAGE(B26:T26) -> 45.2 | U27: =AVERAGE(B26:U26) -> 45.2 | V27: =AVERAGE(B26:V26) -> 45.2
A28: HC | B28: =B26-37 -> 5 | C28: =C27-37 -> 8 | D28: =D27-37 -> 10 | E28: =E27-37 -> 9.25 | F28: =F27-37 -> 9.4 | G28: =G27-37 -> 8.6666666666666643 | H28: =H27-37 -> 8.5714285714285694 | I28: =I27-37 -> 8.625 | J28: =J27-37 -> 8.625 | K28: =K27-37 -> 8.625 | M28: =M27-37 -> 8.5555555555555571 | N28: =N27-37 -> 8.4 | O28: =O27-37 -> 8.3636363636363669 | P28: =P27-37 -> 8.3333333333333357 | Q28: =Q27-37 -> 8.1538461538461533 | R28: =R27-37 -> 8.0714285714285694 | S28: =S27-37 -> 8.2 | T28: =T27-37 -> 8.2 | U28: =U27-37 -> 8.2 | V28: =V27-37 -> 8.2
A30: B. Hall 10 | B30: 43 | C30: 49 | D30: 46 | E30: 49 | F30: 47 | G30: 52 | H30: 50 | I30: 57 | J30: 50 | K30: 51 | M30: 49 | N30: 52 | O30: 54 | P30: 51 | Q30: 48 | R30: 46 | S30: 50 | T30: 47 | U30: 52 | W30: =AVERAGE(B30:T30)-37 -> 12.50 | X30: =(+B30+C30+D30+E30+G30+H30+J30+M30+O30+P30+Q30+R30+S30+T30+U30+V30)/16 -> 46.00
A31: Avg | C31: =AVERAGE(B30,C30) -> 46 | D31: =AVERAGE(B30:D30) -> 46 | E31: =AVERAGE(B30:E30) -> 46.75 | F31: =AVERAGE(B30:F30) -> 46.8 | G31: =AVERAGE(B30:G30) -> 47.666666666666664 | H31: =AVERAGE(B30:H30) -> 48 | I31: =AVERAGE(B30:I30) -> 49.125 | J31: =AVERAGE(B30:J30) -> 49.222222222222221 | K31: =AVERAGE(B30:K30) -> 49.4 | M31: =AVERAGE(B30:M30) -> 49.363636363636367 | N31: =AVERAGE(B30:N30) -> 49.583333333333336 | O31: =AVERAGE(B30:O30) -> 49.92307692307692 | P31: =AVERAGE(B30:P30) -> 50 | Q31: =AVERAGE(B30:Q30) -> 49.866666666666667 | R31: =AVERAGE(B30:R30) -> 49.625 | S31: =AVERAGE(B30:S30) -> 49.647058823529413 | T31: =AVERAGE(B30:T30) -> 49.5 | U31: =AVERAGE(B30:U30) -> 49.631578947368418 | V31: =AVERAGE(B30:V30) -> 49.631578947368418
A32: HC | B32: =B30-37 -> 6 | C32: =C31-37 -> 9 | D32: =D31-37 -> 9 | E32: =E31-37 -> 9.75 | F32: =F31-37 -> 9.8 | G32: =G31-37 -> 10.666666666666664 | H32: =H31-37 -> 11 | I32: =I31-37 -> 12.125 | J32: =J31-37 -> 12.222222222222221 | K32: =K31-37 -> 12.4 | M32: =M31-37 -> 12.363636363636367 | N32: =N31-37 -> 12.583333333333336 | O32: =O31-37 -> 12.92307692307692 | P32: =P31-37 -> 13 | Q32: =Q31-37 -> 12.866666666666667 | R32: =R31-37 -> 12.625 | S32: =S31-37 -> 12.647058823529413 | T32: =T31-37 -> 12.5 | U32: =U31-37 -> 12.631578947368418 | V32: =V31-37 -> 12.631578947368418
G33: *
A34: J. Landers 13 | B34: 56 | C34: 48 | D34: 53 | E34: 51 | F34: 47 | G34: 50 | H34: 44 | I34: 50 | J34: 49 | K34: A | M34: 51 | N34: 52 | O34: A | P34: 52 | Q34: 64 | R34: 52 | S34: 50 | T34: 51 | U34: 58 | W34: =AVERAGE(B34:T34)-37 -> 14.25 | X34: =(+C34+E34+F34+G34+H34+I34+J34+K34+M34+N34+O34+P34+Q34+R34+S34+T34+U34+V34)/18 -> #VALUE!
A35: Avg | C35: =AVERAGE(B34,C34) -> 52 | D35: =AVERAGE(B34:D34) -> 52.333333333333336 | E35: =AVERAGE(B34:E34) -> 52 | F35: =AVERAGE(B34:F34) -> 51 | G35: =AVERAGE(B34:G34) -> 50.833333333333336 | H35: =AVERAGE(B34:H34) -> 49.857142857142854 | I35: =AVERAGE(B34:I34) -> 49.875 | J35: =AVERAGE(B34:J34) -> 49.777777777777779 | K35: =AVERAGE(B34:K34) -> 49.777777777777779 | M35: =AVERAGE(B34:M34) -> 49.9 | N35: =AVERAGE(B34:N34) -> 50.090909090909093 | O35: =AVERAGE(B34:O34) -> 50.090909090909093 | P35: =AVERAGE(B34:P34) -> 50.25 | Q35: =AVERAGE(B34:Q34) -> 51.307692307692307 | R35: =AVERAGE(B34:R34) -> 51.357142857142854 | S35: =AVERAGE(B34:S34) -> 51.266666666666666 | T35: =AVERAGE(B34:T34) -> 51.25 | U35: =AVERAGE(B34:U34) -> 51.647058823529413 | V35: =AVERAGE(B34:V34) -> 51.647058823529413
A36: HC | B36: =B34-37 -> 19 | C36: =C35-37 -> 15 | D36: =D35-37 -> 15.333333333333336 | E36: =E35-37 -> 15 | F36: =F35-37 -> 14 | G36: =G35-37 -> 13.833333333333336 | H36: =H35-37 -> 12.857142857142854 | I36: =I35-37 -> 12.875 | J36: =J35-37 -> 12.777777777777779 | K36: =K35-37 -> 12.777777777777779 | M36: =M35-37 -> 12.9 | N36: =N35-37 -> 13.090909090909093 | O36: =O35-37 -> 13.090909090909093 | P36: =P35-37 -> 13.25 | Q36: =Q35-37 -> 14.307692307692307 | R36: =R35-37 -> 14.357142857142854 | S36: =S35-37 -> 14.266666666666666 | T36: =T35-37 -> 14.25 | U36: =U35-37 -> 14.647058823529413 | V36: =V35-37 -> 14.647058823529413
A38: Player \Wk | B38: 1 | C38: 2 | D38: 3 | E38: 4 | F38: 5 | G38: 6 | H38: 7 | I38: 8 | J38: 9 | K38: 10 | M38: 11 | N38: 12 | O38: 13 | P38: 14 | Q38: 15 | R38: 16 | S38: 17 | T38: 18 | U38: 19 | V38: 20
A39: M. Rutherford 3 | B39: 44 | C39: 44 | D39: 42 | E39: 39 | F39: 41 | G39: 43 | H39: 44 | I39: 44 | J39: 38 | K39: 41 | M39: 41 | N39: 44 | O39: 39 | P39: A | Q39: 44 | R39: 42 | S39: 38 | T39: 41 | U39: 43 | W39: =AVERAGE(B39:T39)-37 -> 4.705882352941174 | X39: =(+C39+D39+E39+F39+G39+H39+J39+K39+M39+N39+O39+P39+R39+S39+T39+U39+V39)/17 -> #VALUE!
A40: Avg | C40: =AVERAGE(B39,C39) -> 44 | D40: =AVERAGE(B39:D39) -> 43.333333333333336 | E40: =AVERAGE(B39:E39) -> 42.25 | F40: =AVERAGE(B39:F39) -> 42 | G40: =AVERAGE(B39:G39) -> 42.166666666666664 | H40: =AVERAGE(B39:H39) -> 42.428571428571431 | I40: =AVERAGE(B39:I39) -> 42.625 | J40: =AVERAGE(B39:J39) -> 42.111111111111114 | K40: =AVERAGE(B39:K39) -> 42 | M40: =AVERAGE(B39:M39) -> 41.909090909090907 | N40: =AVERAGE(B39:N39) -> 42.083333333333336 | O40: =AVERAGE(B39:O39) -> 41.846153846153847 | P40: =AVERAGE(B39:P39) -> 41.846153846153847 | Q40: =AVERAGE(B39:Q39) -> 42 | R40: =AVERAGE(B39:R39) -> 42 | S40: =AVERAGE(B39:S39) -> 41.75 | T40: =AVERAGE(B39:T39) -> 41.705882352941174 | U40: =AVERAGE(B39:U39) -> 41.777777777777779 | V40: =AVERAGE(B39:V39) -> 41.777777777777779
A41: HC | B41: =B39-37 -> 7 | C41: =C40-37 -> 7 | D41: =D40-37 -> 6.3333333333333357 | E41: =E40-37 -> 5.25 | F41: =F40-37 -> 5 | G41: =G40-37 -> 5.1666666666666643 | H41: =H40-37 -> 5.4285714285714306 | I41: =I40-37 -> 5.625 | J41: =J40-37 -> 5.1111111111111143 | K41: =K40-37 -> 5 | M41: =M40-37 -> 4.9090909090909065 | N41: =N40-37 -> 5.0833333333333357 | O41: =O40-37 -> 4.8461538461538467 | P41: =P40-37 -> 4.8461538461538467 | Q41: =Q40-37 -> 5 | R41: =R40-37 -> 5 | S41: =S40-37 -> 4.75 | T41: =T40-37 -> 4.705882352941174 | U41: =U40-37 -> 4.7777777777777786 | V41: =V40-37 -> 4.7777777777777786
A43: M. McComas 6 | B43: 43 | C43: 42 | D43: 48 | E43: 41 | F43: A | G43: 47 | H43: 47 | I43: 42 | J43: 45 | K43: 43 | M43: 45 | N43: 50 | O43: 46 | P43: 42 | Q43: 48 | R43: A | S43: 45 | T43: 44 | U43: 41 | W43: =AVERAGE(B43:T43)-37 -> 7.875 | X43: =(+B43+D43+E43+H43+I43+J43+K43+M43+N43+O43+P43+Q43+R43+S43+U43+V43)/16 -> #VALUE!
A44: Avg | C44: =AVERAGE(B43,C43) -> 42.5 | D44: =AVERAGE(B43:D43) -> 44.333333333333336 | E44: =AVERAGE(B43:E43) -> 43.5 | F44: =AVERAGE(B43:F43) -> 43.5 | G44: =AVERAGE(B43:G43) -> 44.2 | H44: =AVERAGE(B43:H43) -> 44.666666666666664 | I44: =AVERAGE(B43:I43) -> 44.285714285714285 | J44: =AVERAGE(B43:J43) -> 44.375 | K44: =AVERAGE(B43:K43) -> 44.222222222222221 | M44: =AVERAGE(B43:M43) -> 44.3 | N44: =AVERAGE(B43:N43) -> 44.81818181818182 | O44: =AVERAGE(B43:O43) -> 44.916666666666664 | P44: =AVERAGE(B43:P43) -> 44.692307692307693 | Q44: =AVERAGE(B43:Q43) -> 44.928571428571431 | R44: =AVERAGE(B43:R43) -> 44.928571428571431 | S44: =AVERAGE(B43:S43) -> 44.93333333333333 | T44: =AVERAGE(B43:T43) -> 44.875 | U44: =AVERAGE(B43:U43) -> 44.647058823529413 | V44: =AVERAGE(B43:V43) -> 44.647058823529413
A45: HC | B45: =B43-37 -> 6 | C45: =C44-37 -> 5.5 | D45: =D44-37 -> 7.3333333333333357 | E45: =E44-37 -> 6.5 | F45: =F44-37 -> 6.5 | G45: =G44-37 -> 7.2 | H45: =H44-37 -> 7.6666666666666643 | I45: =I44-37 -> 7.2857142857142847 | J45: =J44-37 -> 7.375 | K45: =K44-37 -> 7.2222222222222214 | M45: =M44-37 -> 7.3 | N45: =N44-37 -> 7.8181818181818201 | O45: =O44-37 -> 7.9166666666666643 | P45: =P44-37 -> 7.6923076923076934 | Q45: =Q44-37 -> 7.9285714285714306 | R45: =R44-37 -> 7.9285714285714306 | S45: =S44-37 -> 7.93333333333333 | T45: =T44-37 -> 7.875 | U45: =U44-37 -> 7.647058823529413 | V45: =V44-37 -> 7.647058823529413
A47: M. Kyle 8 | B47: 50 | C47: 46 | D47: 48 | E47: 46 | F47: 45 | G47: 49 | H47: 49 | I47: 51 | J47: 46 | K47: 44 | M47: 53 | N47: 55 | O47: 42 | P47: 47 | Q47: 51 | R47: 41 | S47: A | T47: 48 | U47: 50 | W47: =AVERAGE(B47:T47)-37 -> 10.705882352941174 | X47: =(+M47+N47+O47+P47+Q47+R47+S47+T47+U47+V47)/10 -> #VALUE!
A48: Avg | C48: =AVERAGE(B47,C47) -> 48 | D48: =AVERAGE(B47:D47) -> 48 | E48: =AVERAGE(B47:E47) -> 47.5 | F48: =AVERAGE(B47:F47) -> 47 | G48: =AVERAGE(B47:G47) -> 47.333333333333336 | H48: =AVERAGE(B47:H47) -> 47.571428571428569 | I48: =AVERAGE(B47:I47) -> 48 | J48: =AVERAGE(B47:J47) -> 47.777777777777779 | K48: =AVERAGE(B47:K47) -> 47.4 | M48: =AVERAGE(B47:M47) -> 47.909090909090907 | N48: =AVERAGE(B47:N47) -> 48.5 | O48: =AVERAGE(B47:O47) -> 48 | P48: =AVERAGE(B47:P47) -> 47.928571428571431 | Q48: =AVERAGE(B47:Q47) -> 48.133333333333333 | R48: =AVERAGE(B47:R47) -> 47.6875 | S48: =AVERAGE(B47:S47) -> 47.6875 | T48: =AVERAGE(B47:T47) -> 47.705882352941174 | U48: =AVERAGE(B47:U47) -> 47.833333333333336 | V48: =AVERAGE(B47:V47) -> 47.833333333333336
A49: HC | B49: =B47-37 -> 13 | C49: =C48-37 -> 11 | D49: =D48-37 -> 11 | E49: =E48-37 -> 10.5 | F49: =F48-37 -> 10 | G49: =G48-37 -> 10.333333333333336 | H49: =H48-37 -> 10.571428571428569 | I49: =I48-37 -> 11 | J49: =J48-37 -> 10.777777777777779 | K49: =K48-37 -> 10.4 | M49: =M48-37 -> 10.909090909090907 | N49: =N48-37 -> 11.5 | O49: =O48-37 -> 11 | P49: =P48-37 -> 10.928571428571431 | Q49: =Q48-37 -> 11.133333333333333 | R49: =R48-37 -> 10.6875 | S49: =S48-37 -> 10.6875 | T49: =T48-37 -> 10.705882352941174 | U49: =U48-37 -> 10.833333333333336 | V49: =V48-37 -> 10.833333333333336
A51: B. Kyle 13 | B51: 50 | C51: 52 | D51: 60 | E51: 55 | F51: 50 | G51: 52 | H51: 52 | I51: 53 | J51: 47 | K51: 51 | M51: 51 | N51: 55 | O51: 49 | P51: 56 | Q51: 58 | R51: 52 | S51: 56 | T51: 46 | U51: _ | W51: =AVERAGE(B51:T51)-37 -> 15.50 | X51: =(+B51+C51+D51+E51+F51+G51+H51+I51+J51+K51+N51+O51+Q51+R51+S51+T51+U51+V51)/18 -> #VALUE!
A52: Avg | C52: =AVERAGE(B51,C51) -> 51 | D52: =AVERAGE(B51:D51) -> 54 | E52: =AVERAGE(B51:E51) -> 54.25 | F52: =AVERAGE(B51:F51) -> 53.4 | G52: =AVERAGE(B51:G51) -> 53.166666666666664 | H52: =AVERAGE(B51:H51) -> 53 | I52: =AVERAGE(B51:I51) -> 53 | J52: =AVERAGE(B51:J51) -> 52.333333333333336 | K52: =AVERAGE(B51:K51) -> 52.2 | M52: =AVERAGE(B51:M51) -> 52.090909090909093 | N52: =AVERAGE(B51:N51) -> 52.333333333333336 | O52: =AVERAGE(B51:O51) -> 52.07692307692308 | P52: =AVERAGE(B51:P51) -> 52.357142857142854 | Q52: =AVERAGE(B51:Q51) -> 52.733333333333334 | R52: =AVERAGE(B51:R51) -> 52.6875 | S52: =AVERAGE(B51:S51) -> 52.882352941176471 | T52: =AVERAGE(B51:T51) -> 52.5 | U52: =AVERAGE(B51:U51) -> 52.5 | V52: =AVERAGE(B51:V51) -> 52.5
A53: HC | B53: =B51-37 -> 13 | C53: =C52-37 -> 14 | D53: =D52-37 -> 17 | E53: =E52-37 -> 17.25 | F53: =F52-37 -> 16.4 | G53: =G52-37 -> 16.166666666666664 | H53: =H52-37 -> 16 | I53: =I52-37 -> 16 | J53: =J52-37 -> 15.333333333333336 | K53: =K52-37 -> 15.2 | M53: =M52-37 -> 15.090909090909093 | N53: =N52-37 -> 15.333333333333336 | O53: =O52-37 -> 15.07692307692308 | P53: =P52-37 -> 15.357142857142854 | Q53: =Q52-37 -> 15.733333333333334 | R53: =R52-37 -> 15.6875 | S53: =S52-37 -> 15.882352941176471 | T53: =T52-37 -> 15.5 | U53: =U52-37 -> 15.5 | V53: =V52-37 -> 15.5
A55: Player \Wk | B55: 1 | C55: 2 | D55: 3 | E55: 4 | F55: 5 | G55: 6 | H55: 7 | I55: 8 | J55: 9 | K55: 10 | M55: 11 | N55: 12 | O55: 13 | P55: 14 | Q55: 15 | R55: 16 | S55: 17 | T55: 18 | U55: 19 | V55: 20
A56: R. Keeney 3 | B56: 47 | C56: 39 | D56: 42 | E56: 39 | F56: 44 | G56: 41 | H56: 41 | I56: 42 | J56: 44 | K56: 40 | M56: 41 | N56: 41 | O56: 44 | P56: A | Q56: 41 | R56: 39 | S56: 41 | T56: 41 | U56: _ | W56: =AVERAGE(B56:T56)-37 -> 4.588235294117645 | X56: =(+B56+C56+D56+F56+G56+H56+I56+J56+K56+M56+N56+O56+P56+Q56+R56+S56+T56+U56)/18 -> #VALUE!
A57: Avg | C57: =AVERAGE(B56,C56) -> 43 | D57: =AVERAGE(B56:D56) -> 42.666666666666664 | E57: =AVERAGE(B56:E56) -> 41.75 | F57: =AVERAGE(B56:F56) -> 42.2 | G57: =AVERAGE(B56:G56) -> 42 | H57: =AVERAGE(B56:H56) -> 41.857142857142854 | I57: =AVERAGE(B56:I56) -> 41.875 | J57: =AVERAGE(B56:J56) -> 42.111111111111114 | K57: =AVERAGE(B56:K56) -> 41.9 | M57: =AVERAGE(B56:M56) -> 41.81818181818182 | N57: =AVERAGE(B56:N56) -> 41.75 | O57: =AVERAGE(B56:O56) -> 41.92307692307692 | P57: =AVERAGE(B56:P56) -> 41.92307692307692 | Q57: =AVERAGE(B56:Q56) -> 41.857142857142854 | R57: =AVERAGE(B56:R56) -> 41.666666666666664 | S57: =AVERAGE(B56:S56) -> 41.625 | T57: =AVERAGE(B56:T56) -> 41.588235294117645 | U57: =AVERAGE(B56:U56) -> 41.588235294117645 | V57: =AVERAGE(B56:V56) -> 41.588235294117645
A58: HC | B58: =B56-37 -> 10 | C58: =C57-37 -> 6 | D58: =D57-37 -> 5.6666666666666643 | E58: =E57-37 -> 4.75 | F58: =F57-37 -> 5.2 | G58: =G57-37 -> 5 | H58: =H57-37 -> 4.8571428571428541 | I58: =I57-37 -> 4.875 | J58: =J57-37 -> 5.1111111111111143 | K58: =K57-37 -> 4.9 | M58: =M57-37 -> 4.8181818181818201 | N58: =N57-37 -> 4.75 | O58: =O57-37 -> 4.9230769230769198 | P58: =P57-37 -> 4.9230769230769198 | Q58: =Q57-37 -> 4.8571428571428541 | R58: =R57-37 -> 4.6666666666666643 | S58: =S57-37 -> 4.625 | T58: =T57-37 -> 4.588235294117645 | U58: =U57-37 -> 4.588235294117645 | V58: =V57-37 -> 4.588235294117645
A60: T. Proctor 6 | B60: 41 | C60: 50 | D60: 44 | E60: 41 | F60: 44 | G60: 47 | H60: 42 | I60: 43 | J60: A | K60: 45 | M60: 45 | N60: 46 | O60: 46 | P60: 43 | Q60: 45 | R60: 42 | S60: 45 | T60: 45 | U60: 44 | W60: =AVERAGE(B60:T60)-37 -> 7.352941176470587 | X60: =(+B60+C60+D60+E60+F60+G60+H60+I60+J60+K60+M60+N60+O60+P60+Q60+R60+S60+T60+U60+V60)/20 -> #VALUE!
A61: Avg | C61: =AVERAGE(B60,C60) -> 45.5 | D61: =AVERAGE(B60:D60) -> 45 | E61: =AVERAGE(B60:E60) -> 44 | F61: =AVERAGE(B60:F60) -> 44 | G61: =AVERAGE(B60:G60) -> 44.5 | H61: =AVERAGE(B60:H60) -> 44.142857142857146 | I61: =AVERAGE(B60:I60) -> 44 | J61: =AVERAGE(B60:J60) -> 44 | K61: =AVERAGE(B60:K60) -> 44.111111111111114 | M61: =AVERAGE(B60:M60) -> 44.2 | N61: =AVERAGE(B60:N60) -> 44.363636363636367 | O61: =AVERAGE(B60:O60) -> 44.5 | P61: =AVERAGE(B60:P60) -> 44.384615384615387 | Q61: =AVERAGE(B60:Q60) -> 44.428571428571431 | R61: =AVERAGE(B60:R60) -> 44.266666666666666 | S61: =AVERAGE(B60:S60) -> 44.3125 | T61: =AVERAGE(B60:T60) -> 44.352941176470587 | U61: =AVERAGE(B60:U60) -> 44.333333333333336 | V61: =AVERAGE(B60:V60) -> 44.333333333333336
A62: HC | B62: =B60-37 -> 4 | C62: =C61-37 -> 8.5 | D62: =D61-37 -> 8 | E62: =E61-37 -> 7 | F62: =F61-37 -> 7 | G62: =G61-37 -> 7.5 | H62: =H61-37 -> 7.1428571428571459 | I62: =I61-37 -> 7 | J62: =J61-37 -> 7 | K62: =K61-37 -> 7.1111111111111143 | M62: =M61-37 -> 7.2 | N62: =N61-37 -> 7.3636363636363669 | O62: =O61-37 -> 7.5 | P62: =P61-37 -> 7.3846153846153868 | Q62: =Q61-37 -> 7.4285714285714306 | R62: =R61-37 -> 7.2666666666666657 | S62: =S61-37 -> 7.3125 | T62: =T61-37 -> 7.352941176470587 | U62: =U61-37 -> 7.3333333333333357 | V62: =V61-37 -> 7.3333333333333357
A64: S. Jones 8 | B64: 47 | C64: 48 | D64: 43 | E64: 44 | F64: 47 | G64: 50 | H64: 44 | I64: 47 | J64: 50 | K64: 43 | M64: 48 | N64: 42 | O64: 44 | P64: 47 | Q64: 46 | R64: 48 | S64: 46 | T64: 48 | U64: 46 | W64: =AVERAGE(B64:T64)-37 -> 9.2222222222222214 | X64: =(+B64+C64+D64+E64+F64+G64+H64+I64+J64+K64+M64+N64+O64+P64+Q64+R64+S64+T64+U64+V64)/20 -> 43.90
A65: Avg | C65: =AVERAGE(B64,C64) -> 47.5 | D65: =AVERAGE(B64:D64) -> 46 | E65: =AVERAGE(B64:E64) -> 45.5 | F65: =AVERAGE(B64:F64) -> 45.8 | G65: =AVERAGE(B64:G64) -> 46.5 | H65: =AVERAGE(B64:H64) -> 46.142857142857146 | I65: =AVERAGE(B64:I64) -> 46.25 | J65: =AVERAGE(B64:J64) -> 46.666666666666664 | K65: =AVERAGE(B64:K64) -> 46.3 | M65: =AVERAGE(B64:M64) -> 46.454545454545453 | N65: =AVERAGE(B64:N64) -> 46.083333333333336 | O65: =AVERAGE(B64:O64) -> 45.92307692307692 | P65: =AVERAGE(B64:P64) -> 46 | Q65: =AVERAGE(B64:Q64) -> 46 | R65: =AVERAGE(B64:R64) -> 46.125 | S65: =AVERAGE(B64:S64) -> 46.117647058823529 | T65: =AVERAGE(B64:T64) -> 46.222222222222221 | U65: =AVERAGE(B64:U64) -> 46.210526315789473 | V65: =AVERAGE(B64:V64) -> 46.210526315789473
A66: HC | B66: =B64-37 -> 10 | C66: =C65-37 -> 10.5 | D66: =D65-37 -> 9 | E66: =E65-37 -> 8.5 | F66: =F65-37 -> 8.8 | G66: =G65-37 -> 9.5 | H66: =H65-37 -> 9.1428571428571459 | I66: =I65-37 -> 9.25 | J66: =J65-37 -> 9.6666666666666643 | K66: =K65-37 -> 9.3 | M66: =M65-37 -> 9.4545454545454533 | N66: =N65-37 -> 9.0833333333333357 | O66: =O65-37 -> 8.9230769230769198 | P66: =P65-37 -> 9 | Q66: =Q65-37 -> 9 | R66: =R65-37 -> 9.125 | S66: =S65-37 -> 9.117647058823529 | T66: =T65-37 -> 9.2222222222222214 | U66: =U65-37 -> 9.2105263157894726 | V66: =V65-37 -> 9.2105263157894726
A68: T. Baumgarner 12 | B68: 43 | C68: 54 | D68: 50 | E68: 52 | F68: 57 | G68: 49 | H68: 52 | I68: 47 | J68: A | K68: 48 | M68: 52 | N68: 51 | O68: 49 | P68: 50 | Q68: 53 | R68: 57 | S68: 54 | T68: 56 | U68: _ | W68: =AVERAGE(B68:T68)-37 -> 14.411764705882355 | X68: =(+B68+C68+D68+E68+F68+G68+H68+I68+J68+K68+M68+N68+O68+P68+Q68+R68+S68+T68+U68+V68)/20 -> #VALUE!
A69: Avg | C69: =AVERAGE(B68,C68) -> 48.5 | D69: =AVERAGE(B68:D68) -> 49 | E69: =AVERAGE(B68:E68) -> 49.75 | F69: =AVERAGE(B68:F68) -> 51.2 | G69: =AVERAGE(B68:G68) -> 50.833333333333336 | H69: =AVERAGE(B68:H68) -> 51 | I69: =AVERAGE(B68:I68) -> 50.5 | J69: =AVERAGE(B68:J68) -> 50.5 | K69: =AVERAGE(B68:K68) -> 50.222222222222221 | M69: =AVERAGE(B68:M68) -> 50.4 | N69: =AVERAGE(B68:N68) -> 50.454545454545453 | O69: =AVERAGE(B68:O68) -> 50.333333333333336 | P69: =AVERAGE(B68:P68) -> 50.307692307692307 | Q69: =AVERAGE(B68:Q68) -> 50.5 | R69: =AVERAGE(B68:R68) -> 50.93333333333333 | S69: =AVERAGE(B68:S68) -> 51.125 | T69: =AVERAGE(B68:T68) -> 51.411764705882355 | U69: =AVERAGE(B68:U68) -> 51.411764705882355 | V69: =AVERAGE(B68:V68) -> 51.411764705882355
A70: HC | B70: =B68-37 -> 6 | C70: =C69-37 -> 11.5 | D70: =D69-37 -> 12 | E70: =E69-37 -> 12.75 | F70: =F69-37 -> 14.2 | G70: =G69-37 -> 13.833333333333336 | H70: =H69-37 -> 14 | I70: =I69-37 -> 13.5 | J70: =J69-37 -> 13.5 | K70: =K69-37 -> 13.222222222222221 | M70: =M69-37 -> 13.4 | N70: =N69-37 -> 13.454545454545453 | O70: =O69-37 -> 13.333333333333336 | P70: =P69-37 -> 13.307692307692307 | Q70: =Q69-37 -> 13.5 | R70: =R69-37 -> 13.93333333333333 | S70: =S69-37 -> 14.125 | T70: =T69-37 -> 14.411764705882355 | U70: =U69-37 -> 14.411764705882355 | V70: =V69-37 -> 14.411764705882355
A72: Player \Wk | B72: 1 | C72: 2 | D72: 3 | E72: 4 | F72: 5 | G72: 6 | H72: 7 | I72: 8 | J72: 9 | K72: 10 | M72: 11 | N72: 12 | O72: 13 | P72: 14 | Q72: 15 | R72: 16 | S72: 17 | T72: 18 | U72: 19 | V72: 20
A73: D. Smith 3 | B73: 42 | C73: 43 | D73: 45 | E73: 41 | F73: 46 | G73: 41 | H73: 45 | I73: 40 | J73: 41 | K73: 36 | M73: 43 | N73: 41 | O73: 43 | P73: 44 | Q73: 44 | R73: 37 | S73: 41 | T73: 44 | U73: _ | W73: =AVERAGE(B73:T73)-37 -> 5.0555555555555571 | X73: =(+B73+C73+D73+E73+F73+G73+J73+K73+M73+N73+O73+P73+Q73+R73+S73+T73+U73+V73)/18 -> #VALUE!
A74: Avg | C74: =AVERAGE(B73,C73) -> 42.5 | D74: =AVERAGE(B73:D73) -> 43.333333333333336 | E74: =AVERAGE(B73:E73) -> 42.75 | F74: =AVERAGE(B73:F73) -> 43.4 | G74: =AVERAGE(B73:G73) -> 43 | H74: =AVERAGE(B73:H73) -> 43.285714285714285 | I74: =AVERAGE(B73:I73) -> 42.875 | J74: =AVERAGE(B73:J73) -> 42.666666666666664 | K74: =AVERAGE(B73:K73) -> 42 | M74: =AVERAGE(B73:M73) -> 42.090909090909093 | N74: =AVERAGE(B73:N73) -> 42 | O74: =AVERAGE(B73:O73) -> 42.07692307692308 | P74: =AVERAGE(B73:P73) -> 42.214285714285715 | Q74: =AVERAGE(B73:Q73) -> 42.333333333333336 | R74: =AVERAGE(B73:R73) -> 42 | S74: =AVERAGE(B73:S73) -> 41.941176470588232 | T74: =AVERAGE(B73:T73) -> 42.055555555555557 | U74: =AVERAGE(B73:U73) -> 42.055555555555557 | V74: =AVERAGE(B73:V73) -> 42.055555555555557
A75: HC | B75: =B73-37 -> 5 | C75: =C74-37 -> 5.5 | D75: =D74-37 -> 6.3333333333333357 | E75: =E74-37 -> 5.75 | F75: =F74-37 -> 6.4 | G75: =G74-37 -> 6 | H75: =H74-37 -> 6.2857142857142847 | I75: =I74-37 -> 5.875 | J75: =J74-37 -> 5.6666666666666643 | K75: =K74-37 -> 5 | M75: =M74-37 -> 5.0909090909090935 | N75: =N74-37 -> 5 | O75: =O74-37 -> 5.0769230769230802 | P75: =P74-37 -> 5.2142857142857153 | Q75: =Q74-37 -> 5.3333333333333357 | R75: =R74-37 -> 5 | S75: =S74-37 -> 4.941176470588232 | T75: =T74-37 -> 5.0555555555555571 | U75: =U74-37 -> 5.0555555555555571 | V75: =V74-37 -> 5.0555555555555571
A77: G. White 4 | B77: 44 | C77: 45 | D77: 42 | E77: A | F77: 40 | G77: 46 | H77: 45 | I77: 42 | J77: 41 | K77: 44 | M77: 40 | N77: 43 | O77: 43 | P77: 44 | Q77: 39 | R77: 44 | S77: 39 | T77: 43 | U77: 45 | W77: =AVERAGE(B77:T77)-37 -> 5.588235294117645 | X77: =(+B77+C77+D77+E77+F77+G77+H77+I77+J77+K77+M77+N77+O77+Q77+R77+S77+U77)/17 -> #VALUE!
C78: =AVERAGE(B77,C77) -> 44.5 | D78: =AVERAGE(B77:D77) -> 43.666666666666664 | E78: =AVERAGE(B77:E77) -> 43.666666666666664 | F78: =AVERAGE(B77:F77) -> 42.75 | G78: =AVERAGE(B77:G77) -> 43.4 | H78: =AVERAGE(B77:H77) -> 43.666666666666664 | I78: =AVERAGE(B77:I77) -> 43.428571428571431 | J78: =AVERAGE(B77:J77) -> 43.125 | K78: =AVERAGE(B77:K77) -> 43.222222222222221 | M78: =AVERAGE(B77:M77) -> 42.9 | N78: =AVERAGE(B77:N77) -> 42.909090909090907 | O78: =AVERAGE(B77:O77) -> 42.916666666666664 | P78: =AVERAGE(B77:P77) -> 43 | Q78: =AVERAGE(B77:Q77) -> 42.714285714285715 | R78: =AVERAGE(B77:R77) -> 42.8 | S78: =AVERAGE(B77:S77) -> 42.5625 | T78: =AVERAGE(B77:T77) -> 42.588235294117645 | U78: =AVERAGE(B77:U77) -> 42.722222222222221 | V78: =AVERAGE(B77:V77) -> 42.722222222222221
A79: HC | B79: =B77-37 -> 7 | C79: =C78-37 -> 7.5 | D79: =D78-37 -> 6.6666666666666643 | E79: =E78-37 -> 6.6666666666666643 | F79: =F78-37 -> 5.75 | G79: =G78-37 -> 6.4 | H79: =H78-37 -> 6.6666666666666643 | I79: =I78-37 -> 6.4285714285714306 | J79: =J78-37 -> 6.125 | K79: =K78-37 -> 6.2222222222222214 | M79: =M78-37 -> 5.9 | N79: =N78-37 -> 5.9090909090909065 | O79: =O78-37 -> 5.9166666666666643 | P79: =P78-37 -> 6 | Q79: =Q78-37 -> 5.7142857142857153 | R79: =R78-37 -> 5.8 | S79: =S78-37 -> 5.5625 | T79: =T78-37 -> 5.588235294117645 | U79: =U78-37 -> 5.7222222222222214 | V79: =V78-37 -> 5.7222222222222214
A81: G. Taylor 9 | B81: 47 | C81: 51 | D81: 54 | E81: 50 | F81: 49 | G81: 43 | H81: 52 | I81: 50 | J81: 46 | K81: 47 | M81: 49 | N81: 51 | O81: 45 | P81: 47 | Q81: 45 | R81: 49 | S81: 46 | T81: 48 | U81: 50 | W81: =AVERAGE(B81:T81)-37 -> 11.277777777777779 | X81: =(+B81+C81+D81+F81+G81+H81+K81+M81+N81+O81+P81+Q81+R81+S81+T81+U81+V81)/17 -> 45.470588235294116
A82: Avg | C82: =AVERAGE(B81,C81) -> 49 | D82: =AVERAGE(B81:D81) -> 50.666666666666664 | E82: =AVERAGE(B81:E81) -> 50.5 | F82: =AVERAGE(B81:F81) -> 50.2 | G82: =AVERAGE(B81:G81) -> 49 | H82: =AVERAGE(B81:H81) -> 49.428571428571431 | I82: =AVERAGE(B81:I81) -> 49.5 | J82: =AVERAGE(B81:J81) -> 49.111111111111114 | K82: =AVERAGE(B81:K81) -> 48.9 | M82: =AVERAGE(B81:M81) -> 48.909090909090907 | N82: =AVERAGE(B81:N81) -> 49.083333333333336 | O82: =AVERAGE(B81:O81) -> 48.769230769230766 | P82: =AVERAGE(B81:P81) -> 48.642857142857146 | Q82: =AVERAGE(B81:Q81) -> 48.4 | R82: =AVERAGE(B81:R81) -> 48.4375 | S82: =AVERAGE(B81:S81) -> 48.294117647058826 | T82: =AVERAGE(B81:T81) -> 48.277777777777779 | U82: =AVERAGE(B81:U81) -> 48.368421052631582 | V82: =AVERAGE(B81:V81) -> 48.368421052631582
A83: HC | B83: =B81-37 -> 10 | C83: =C82-37 -> 12 | D83: =D82-37 -> 13.666666666666664 | E83: =E82-37 -> 13.5 | F83: =F82-37 -> 13.2 | G83: =G82-37 -> 12 | H83: =H82-37 -> 12.428571428571431 | I83: =I82-37 -> 12.5 | J83: =J82-37 -> 12.111111111111114 | K83: =K82-37 -> 11.9 | M83: =M82-37 -> 11.909090909090907 | N83: =N82-37 -> 12.083333333333336 | O83: =O82-37 -> 11.769230769230766 | P83: =P82-37 -> 11.642857142857146 | Q83: =Q82-37 -> 11.4 | R83: =R82-37 -> 11.4375 | S83: =S82-37 -> 11.294117647058826 | T83: =T82-37 -> 11.277777777777779 | U83: =U82-37 -> 11.368421052631582 | V83: =V82-37 -> 11.368421052631582
A85: B. Harbour 15 | B85: 54 | C85: 57 | D85: 58 | E85: 51 | F85: 55 | G85: 60 | H85: 53 | I85: 54 | J85: 55 | K85: 58 | M85: 50 | N85: 58 | O85: 58 | P85: 50 | Q85: 53 | R85: 53 | S85: 47 | T85: 54 | U85: 50 | W85: =AVERAGE(B85:T85)-37 -> 17.333333333333336 | X85: =(+B85+C85+D85+E85+F85+H85+I85+J85+K85+M85+N85+O85)/12 -> 55.083333333333336
A86: Avg | C86: =AVERAGE(B85,C85) -> 55.5 | D86: =AVERAGE(B85:D85) -> 56.333333333333336 | E86: =AVERAGE(B85:E85) -> 55 | F86: =AVERAGE(B85:F85) -> 55 | G86: =AVERAGE(B85:G85) -> 55.833333333333336 | H86: =AVERAGE(B85:H85) -> 55.428571428571431 | I86: =AVERAGE(B85:I85) -> 55.25 | J86: =AVERAGE(B85:J85) -> 55.222222222222221 | K86: =AVERAGE(B85:K85) -> 55.5 | M86: =AVERAGE(B85:M85) -> 55 | N86: =AVERAGE(B85:N85) -> 55.25 | O86: =AVERAGE(B85:O85) -> 55.46153846153846 | P86: =AVERAGE(B85:P85) -> 55.071428571428569 | Q86: =AVERAGE(B85:Q85) -> 54.93333333333333 | R86: =AVERAGE(B85:R85) -> 54.8125 | S86: =AVERAGE(B85:S85) -> 54.352941176470587 | T86: =AVERAGE(B85:T85) -> 54.333333333333336 | U86: =AVERAGE(B85:U85) -> 54.10526315789474 | V86: =AVERAGE(B85:V85) -> 54.10526315789474
A87: HC | B87: =B85-37 -> 17 | C87: =C86-37 -> 18.5 | D87: =D86-37 -> 19.333333333333336 | E87: =E86-37 -> 18 | F87: =F86-37 -> 18 | G87: =G86-37 -> 18.833333333333336 | H87: =H86-37 -> 18.428571428571431 | I87: =I86-37 -> 18.25 | J87: =J86-37 -> 18.222222222222221 | K87: =K86-37 -> 18.5 | M87: =M86-37 -> 18 | N87: =N86-37 -> 18.25 | O87: =O86-37 -> 18.46153846153846 | P87: =P86-37 -> 18.071428571428569 | Q87: =Q86-37 -> 17.93333333333333 | R87: =R86-37 -> 17.8125 | S87: =S86-37 -> 17.352941176470587 | T87: =T86-37 -> 17.333333333333336 | U87: =U86-37 -> 17.10526315789474 | V87: =V86-37 -> 17.10526315789474
A89: Player \Wk | B89: 1 | C89: 2 | D89: 3 | E89: 4 | F89: 5 | G89: 6 | H89: 7 | I89: 8 | J89: 9 | K89: 10 | M89: 11 | N89: 12 | O89: 13 | P89: 14 | Q89: 15 | R89: 16 | S89: 17 | T89: 18 | U89: 19 | V89: 20
A90: R. Ours 1 | B90: 37 | C90: 41 | D90: 38 | E90: 39 | F90: 38 | G90: 38 | H90: 39 | I90: 45 | J90: 41 | K90: 38 | M90: 40 | N90: 40 | O90: 41 | P90: 40 | Q90: A | R90: 40 | S90: 38 | T90: 35 | U90: 39 | W90: =AVERAGE(B90:T90)-37 -> 2.294117647058826 | X90: =(+C90+D90+E90+F90+J90+K90+N90+O90+P90+R90+S90+T90+U90)/13 -> 39.07692307692308
A91: Avg | C91: =AVERAGE(B90,C90) -> 39 | D91: =AVERAGE(B90:D90) -> 38.666666666666664 | E91: =AVERAGE(B90:E90) -> 38.75 | F91: =AVERAGE(B90:F90) -> 38.6 | G91: =AVERAGE(B90:G90) -> 38.5 | H91: =AVERAGE(B90:H90) -> 38.571428571428569 | I91: =AVERAGE(B90:I90) -> 39.375 | J91: =AVERAGE(B90:J90) -> 39.555555555555557 | K91: =AVERAGE(B90:K90) -> 39.4 | M91: =AVERAGE(B90:M90) -> 39.454545454545453 | N91: =AVERAGE(B90:N90) -> 39.5 | O91: =AVERAGE(B90:O90) -> 39.615384615384613 | P91: =AVERAGE(B90:P90) -> 39.642857142857146 | Q91: =AVERAGE(B90:Q90) -> 39.642857142857146 | R91: =AVERAGE(B90:R90) -> 39.666666666666664 | S91: =AVERAGE(B90:S90) -> 39.5625 | T91: =AVERAGE(B90:T90) -> 39.294117647058826 | U91: =AVERAGE(B90:U90) -> 39.277777777777779 | V91: =AVERAGE(B90:V90) -> 39.277777777777779
A92: HC | B92: =B90-37 -> 0 | C92: =C91-37 -> 2 | D92: =D91-37 -> 1.6666666666666643 | E92: =E91-37 -> 1.75 | F92: =F91-37 -> 1.6 | G92: =G91-37 -> 1.5 | H92: =H91-37 -> 1.5714285714285694 | I92: =I91-37 -> 2.375 | J92: =J91-37 -> 2.5555555555555571 | K92: =K91-37 -> 2.4 | M92: =M91-37 -> 2.4545454545454533 | N92: =N91-37 -> 2.5 | O92: =O91-37 -> 2.6153846153846132 | P92: =P91-37 -> 2.6428571428571459 | Q92: =Q91-37 -> 2.6428571428571459 | R92: =R91-37 -> 2.6666666666666643 | S92: =S91-37 -> 2.5625 | T92: =T91-37 -> 2.294117647058826 | U92: =U91-37 -> 2.2777777777777786 | V92: =V91-37 -> 2.2777777777777786
A94: T. Way 6 | B94: 41 | C94: 45 | D94: 49 | E94: 43 | F94: 47 | G94: 45 | H94: 45 | I94: 44 | J94: 45 | K94: A | M94: A | N94: 47 | O94: 48 | P94: 41 | Q94: 49 | R94: 45 | S94: 43 | T94: 48 | U94: 42 | W94: =AVERAGE(B94:T94)-37 -> 8.3125 | X94: =(+B94+C94+D94+F94+G94+H94+I94+J94+K94+M94+N94+O94+R94+S94+T94+U94+V94)/17 -> #VALUE!
C95: =AVERAGE(B94,C94) -> 43 | D95: =AVERAGE(B94:D94) -> 45 | E95: =AVERAGE(B94:E94) -> 44.5 | F95: =AVERAGE(B94:F94) -> 45 | G95: =AVERAGE(B94:G94) -> 45 | H95: =AVERAGE(B94:H94) -> 45 | I95: =AVERAGE(B94:I94) -> 44.875 | J95: =AVERAGE(B94:J94) -> 44.888888888888886 | K95: =AVERAGE(B94:K94) -> 44.888888888888886 | M95: =AVERAGE(B94:M94) -> 44.888888888888886 | N95: =AVERAGE(B94:N94) -> 45.1 | O95: =AVERAGE(B94:O94) -> 45.363636363636367 | P95: =AVERAGE(B94:P94) -> 45 | Q95: =AVERAGE(B94:Q94) -> 45.307692307692307 | R95: =AVERAGE(B94:R94) -> 45.285714285714285 | S95: =AVERAGE(B94:S94) -> 45.133333333333333 | T95: =AVERAGE(B94:T94) -> 45.3125 | U95: =AVERAGE(B94:U94) -> 45.117647058823529 | V95: =AVERAGE(B94:V94) -> 45.117647058823529
A96: HC | B96: =B94-37 -> 4 | C96: =C95-37 -> 6 | D96: =D95-37 -> 8 | E96: =E95-37 -> 7.5 | F96: =F95-37 -> 8 | G96: =G95-37 -> 8 | H96: =H95-37 -> 8 | I96: =I95-37 -> 7.875 | J96: =J95-37 -> 7.8888888888888857 | K96: =K95-37 -> 7.8888888888888857 | M96: =M95-37 -> 7.8888888888888857 | N96: =N95-37 -> 8.1 | O96: =O95-37 -> 8.3636363636363669 | P96: =P95-37 -> 8 | Q96: =Q95-37 -> 8.3076923076923066 | R96: =R95-37 -> 8.2857142857142847 | S96: =S95-37 -> 8.1333333333333329 | T96: =T95-37 -> 8.3125 | U96: =U95-37 -> 8.117647058823529 | V96: =V95-37 -> 8.117647058823529
A98: L. Baumgarner 11 | B98: 50 | C98: 54 | D98: 50 | E98: 51 | F98: 52 | G98: 50 | H98: 47 | I98: 53 | J98: 51 | K98: 55 | M98: 45 | N98: 49 | O98: 46 | P98: 52 | Q98: 47 | R98: 49 | S98: 49 | T98: 53 | U98: _ | W98: =AVERAGE(B98:T98)-37 -> 13.166666666666664 | X98: =(+B98+C98+D98+E98+G98+H98+I98+J98+K98+M98+N98+O98+P98+Q98+R98+S98+T98+U98+V98)/19 -> #VALUE!
A99: Avg | C99: =AVERAGE(B98,C98) -> 52 | D99: =AVERAGE(B98:D98) -> 51.333333333333336 | E99: =AVERAGE(B98:E98) -> 51.25 | F99: =AVERAGE(B98:F98) -> 51.4 | G99: =AVERAGE(B98:G98) -> 51.166666666666664 | H99: =AVERAGE(B98:H98) -> 50.571428571428569 | I99: =AVERAGE(B98:I98) -> 50.875 | J99: =AVERAGE(B98:J98) -> 50.888888888888886 | K99: =AVERAGE(B98:K98) -> 51.3 | M99: =AVERAGE(B98:M98) -> 50.727272727272727 | N99: =AVERAGE(B98:N98) -> 50.583333333333336 | O99: =AVERAGE(B98:O98) -> 50.230769230769234 | P99: =AVERAGE(B98:P98) -> 50.357142857142854 | Q99: =AVERAGE(B98:Q98) -> 50.133333333333333 | R99: =AVERAGE(B98:R98) -> 50.0625 | S99: =AVERAGE(B98:S98) -> 50 | T99: =AVERAGE(B98:T98) -> 50.166666666666664 | U99: =AVERAGE(B98:U98) -> 50.166666666666664 | V99: =AVERAGE(B98:V98) -> 50.166666666666664
A100: HC | B100: =B98-37 -> 13 | C100: =C99-37 -> 15 | D100: =D99-37 -> 14.333333333333336 | E100: =E99-37 -> 14.25 | F100: =F99-37 -> 14.4 | G100: =G99-37 -> 14.166666666666664 | H100: =H99-37 -> 13.571428571428569 | I100: =I99-37 -> 13.875 | J100: =J99-37 -> 13.888888888888886 | K100: =K99-37 -> 14.3 | M100: =M99-37 -> 13.727272727272727 | N100: =N99-37 -> 13.583333333333336 | O100: =O99-37 -> 13.230769230769234 | P100: =P99-37 -> 13.357142857142854 | Q100: =Q99-37 -> 13.133333333333333 | R100: =R99-37 -> 13.0625 | S100: =S99-37 -> 13 | T100: =T99-37 -> 13.166666666666664 | U100: =U99-37 -> 13.166666666666664 | V100: =V99-37 -> 13.166666666666664
A102: J. Dodrill 15 | B102: 50 | C102: 57 | D102: 51 | E102: 53 | F102: X | G102: 55 | H102: A | I102: 52 | J102: 54 | K102: A | M102: 55 | N102: 56 | O102: 50 | P102: 53 | Q102: 58 | R102: 50 | S102: 51 | T102: 53 | U102: 58 | W102: =AVERAGE(B102:T102)-37 -> 16.20 | X102: =(+B102+C102+D102+E102+F102+G102+H102+I102+J102+K102+M102+N102+O102+P102+Q102+R102+S102+T102+U102+V102)/20 -> #VALUE!
A103: Avg | C103: =AVERAGE(B102,C102) -> 53.5 | D103: =AVERAGE(B102:D102) -> 52.666666666666664 | E103: =AVERAGE(B102:E102) -> 52.75 | F103: =AVERAGE(B102:F102) -> 52.75 | G103: =AVERAGE(B102:G102) -> 53.2 | H103: =AVERAGE(B102:H102) -> 53.2 | I103: =AVERAGE(B102:I102) -> 53 | J103: =AVERAGE(B102:J102) -> 53.142857142857146 | K103: =AVERAGE(B102:K102) -> 53.142857142857146 | M103: =AVERAGE(B102:M102) -> 53.375 | N103: =AVERAGE(B102:N102) -> 53.666666666666664 | O103: =AVERAGE(B102:O102) -> 53.3 | P103: =AVERAGE(B102:P102) -> 53.272727272727273 | Q103: =AVERAGE(B102:Q102) -> 53.666666666666664 | R103: =AVERAGE(B102:R102) -> 53.384615384615387 | S103: =AVERAGE(B102:S102) -> 53.214285714285715 | T103: =AVERAGE(B102:T102) -> 53.2 | U103: =AVERAGE(B102:U102) -> 53.5 | V103: =AVERAGE(B102:V102) -> 53.5
A104: HC | B104: =B102-37 -> 13 | C104: =C103-37 -> 16.5 | D104: =D103-37 -> 15.666666666666664 | E104: =E103-37 -> 15.75 | F104: =F103-37 -> 15.75 | G104: =G103-37 -> 16.2 | H104: =H103-37 -> 16.2 | I104: =I103-37 -> 16 | J104: =J103-37 -> 16.142857142857146 | K104: =K103-37 -> 16.142857142857146 | M104: =M103-37 -> 16.375 | N104: =N103-37 -> 16.666666666666664 | O104: =O103-37 -> 16.3 | P104: =P103-37 -> 16.272727272727273 | Q104: =Q103-37 -> 16.666666666666664 | R104: =R103-37 -> 16.384615384615387 | S104: =S103-37 -> 16.214285714285715 | T104: =T103-37 -> 16.2 | U104: =U103-37 -> 16.5 | V104: =V103-37 -> 16.5