J2: Current Team Scores
A4: 2006
A5: FIRST HALF | M5: SECOND HALF
A6: Team Pts \Wk | B6: 1 | C6: 2 | D6: 3 | E6: 4 | F6: 5 | G6: 6 | H6: 7 | I6: 8 | J6: 9 | K6: 10 | L6: Total | M6: 11 | N6: 12 | O6: 13 | P6: 14 | Q6: 15 | R6: 16 | S6: 17 | T6: 18 | U6: 19 | V6: 20 | W6: Total | X6: YTD | Y6: PCT | Z6: Win | AA6: Loss | AB6: Tie
A7: Troy Reese | B7: 1 | C7: 2 | D7: 0 | E7: A | F7: A | G7: 0 | H7: 2 | I7: 0 | J7: 0 | K7: 0 | L7: =SUM(B7:K7) -> 5 | M7: 0 | N7: 0 | O7: 2 | P7: 2 | Q7: 2 | R7: 2 | S7: 0 | T7: 0 | U7: 0 | W7: =SUM(M7:V7) -> 8 | X7: =L7+W7 -> 13 | Y7: =Z7/(SUM(Z7:AB7)) -> 0.35294117647058826 | Z7: 6 | AA7: 10 | AB7: 1
A8: Alex Wilks | B8: 0 | C8: 0 | D8: 2 | E8: 2 | F8: 0 | G8: 1 | H8: 2 | I8: 0 | J8: 1 | K8: 2 | L8: =SUM(B8:K8) -> 10 | M8: 1 | N8: 2 | O8: 2 | P8: 2 | Q8: 2 | R8: 0 | S8: 0 | T8: 2 | U8: 0 | W8: =SUM(M8:V8) -> 11 | X8: =L8+W8 -> 21 | Y8: =Z8/(SUM(Z8:AB8)) -> 0.47368421052631576 | Z8: 9 | AA8: 7 | AB8: 3
A9: Bill Meadows | B9: 0 | C9: 0 | D9: A | E9: 0 | F9: 0 | G9: 2 | H9: 1 | I9: A | J9: 2 | K9: 2 | L9: =SUM(B9:K9) -> 7 | M9: 2 | N9: 2 | O9: 0 | P9: 0 | Q9: 0 | R9: 0 | S9: 2 | T9: 0 | U9: 0 | W9: =SUM(M9:V9) -> 6 | X9: =L9+W9 -> 13 | Y9: =Z9/(SUM(Z9:AB9)) -> 0.35294117647058826 | Z9: 6 | AA9: 10 | AB9: 1
A10: Linden Chiles | B10: 2 | C10: 0 | D10: 2 | E10: 0 | F10: A | G10: 0 | H10: 0 | I10: 0 | J10: 2 | K10: 2 | L10: =SUM(B10:K10) -> 8 | M10: 2 | N10: 2 | O10: 2 | P10: 0 | Q10: 2 | R10: 0 | S10: A | T10: A | U10: 0 | W10: =SUM(M10:V10) -> 8 | X10: =L10+W10 -> 16 | Y10: =Z10/(SUM(Z10:AB10)) -> 0.5 | Z10: 8 | AA10: 8 | AB10: 0
B11: =SUM(B7:B10) -> 3 | C11: =SUM(C7:C10) -> 2 | D11: =SUM(D7:D10) -> 4 | E11: =SUM(E7:E10) -> 2 | F11: =SUM(F7:F10) -> 0 | G11: =SUM(G7:G10) -> 3 | H11: =SUM(H7:H10) -> 5 | I11: =SUM(I7:I10) -> 0 | J11: =SUM(J7:J10) -> 5 | K11: =SUM(K7:K10) -> 6 | L11: =SUM(B11:K11) -> 30 | M11: =SUM(M7:M10) -> 5 | N11: =SUM(N7:N10) -> 6 | O11: =SUM(O7:O10) -> 6 | P11: =SUM(P7:P10) -> 4 | Q11: =SUM(Q7:Q10) -> 6 | R11: =SUM(R7:R10) -> 2 | S11: =SUM(S7:S10) -> 2 | T11: =SUM(T7:T10) -> 2 | U11: =SUM(U7:U10) -> 0 | V11: =SUM(V7:V10) -> 0 | W11: =SUM(M11:V11) -> 33 | X11: =L11+W11 -> 63
A14: Tom Wilson | B14: 1 | C14: A | D14: 0 | E14: A | F14: A | G14: 2 | H14: A | I14: A | J14: A | K14: 2 | L14: =SUM(B14:K14) -> 5 | M14: 2 | N14: 1 | O14: 2 | P14: 1 | Q14: 2 | R14: A | S14: 0 | T14: 0 | U14: 0 | W14: =SUM(M14:V14) -> 8 | X14: =L14+W14 -> 13 | Y14: =Z14/(SUM(Z14:AB14)) -> 0.41666666666666669 | Z14: 5 | AA14: 4 | AB14: 3
A15: Bill Craig | B15: 2 | C15: 0 | D15: 0 | E15: 0 | F15: 1 | G15: 1 | H15: 2 | I15: 0 | J15: A | K15: A | L15: =SUM(B15:K15) -> 6 | M15: 1 | N15: 1 | O15: 2 | P15: 1 | Q15: 2 | R15: 2 | S15: 0 | T15: A | U15: 0 | W15: =SUM(M15:V15) -> 9 | X15: =L15+W15 -> 15 | Y15: =Z15/(SUM(Z15:AB15)) -> 0.3125 | Z15: 5 | AA15: 6 | AB15: 5
A16: Benton Hall | B16: 2 | C16: 2 | D16: 2 | E16: 0 | F16: 0 | G16: 0 | H16: 2 | I16: 0 | J16: 2 | K16: 0 | L16: =SUM(B16:K16) -> 10 | M16: 0 | N16: 2 | O16: 0 | P16: 0 | Q16: 2 | R16: 2 | S16: 0 | T16: 2 | U16: 2 | W16: =SUM(M16:V16) -> 10 | X16: =L16+W16 -> 20 | Y16: =Z16/(SUM(Z16:AB16)) -> 0.52631578947368418 | Z16: 10 | AA16: 9 | AB16: 0
A17: John Landers | B17: 0 | C17: 2 | D17: 0 | E17: 1 | F17: 0 | G17: 2 | H17: 2 | I17: 0 | J17: 2 | K17: A | L17: =SUM(B17:K17) -> 9 | M17: 0 | N17: 1 | O17: A | P17: 0 | Q17: 0 | R17: 2 | S17: 0 | T17: 0 | U17: 1 | W17: =SUM(M17:V17) -> 4 | X17: =L17+W17 -> 13 | Y17: =Z17/(SUM(Z17:AB17)) -> 0.29411764705882354 | Z17: 5 | AA17: 9 | AB17: 3
B18: =SUM(B14:B17) -> 5 | C18: =SUM(C14:C17) -> 4 | D18: =SUM(D14:D17) -> 2 | E18: =SUM(E14:E17) -> 1 | F18: =SUM(F14:F17) -> 1 | G18: =SUM(G14:G17) -> 5 | H18: =SUM(H14:H17) -> 6 | I18: =SUM(I14:I17) -> 0 | J18: =SUM(J14:J17) -> 4 | K18: =SUM(K14:K17) -> 2 | L18: =SUM(B18:K18) -> 30 | M18: =SUM(M14:M17) -> 3 | N18: =SUM(N14:N17) -> 5 | O18: =SUM(O14:O17) -> 4 | P18: =SUM(P14:P17) -> 2 | Q18: =SUM(Q14:Q17) -> 6 | R18: =SUM(R14:R17) -> 6 | S18: =SUM(S14:S17) -> 0 | T18: =SUM(T14:T17) -> 2 | U18: =SUM(U14:U17) -> 3 | V18: =SUM(V14:V17) -> 0 | W18: =SUM(M18:V18) -> 31 | X18: =L18+W18 -> 61
G19: *
A21: Marc Rutherford | B21: 2 | C21: 0 | D21: 2 | E21: 2 | F21: 2 | G21: 0 | H21: 0 | I21: 0 | J21: 2 | K21: 0 | L21: =SUM(B21:K21) -> 10 | M21: 1 | N21: 2 | O21: 2 | P21: A | Q21: 0 | R21: 0 | S21: 2 | T21: 2 | U21: 0 | W21: =SUM(M21:V21) -> 9 | X21: =L21+W21 -> 19 | Y21: =Z21/(SUM(Z21:AB21)) -> 0.5 | Z21: 9 | AA21: 8 | AB21: 1
A22: Matt McComas | B22: 0 | C22: 2 | D22: 0 | E22: 2 | F22: A | G22: 0 | H22: 0 | I22: 1 | J22: 1 | K22: 2 | L22: =SUM(B22:K22) -> 8 | M22: 1 | N22: 0 | O22: 0 | P22: 0 | Q22: 0 | R22: A | S22: 2 | T22: 1 | U22: 2 | W22: =SUM(M22:V22) -> 6 | X22: =L22+W22 -> 14 | Y22: =Z22/(SUM(Z22:AB22)) -> 0.29411764705882354 | Z22: 5 | AA22: 8 | AB22: 4
A23: Matt Kyle | B23: 0 | C23: 2 | D23: 2 | E23: 2 | F23: 2 | G23: 2 | H23: 1 | I23: 1 | J23: 2 | K23: 2 | L23: =SUM(B23:K23) -> 16 | M23: 0 | N23: 0 | O23: 2 | P23: 2 | Q23: 0 | R23: 2 | S23: A | T23: 0 | U23: 2 | W23: =SUM(M23:V23) -> 8 | X23: =L23+W23 -> 24 | Y23: =Z23/(SUM(Z23:AB23)) -> 0.58823529411764708 | Z23: 10 | AA23: 5 | AB23: 2
A24: Butch Kyle | B24: 0 | C24: 2 | D24: 1 | E24: 0 | F24: 2 | G24: 1 | H24: 2 | I24: 2 | J24: 2 | K24: 2 | L24: =SUM(B24:K24) -> 14 | M24: 2 | N24: 0 | O24: 2 | P24: 0 | Q24: 2 | R24: 2 | S24: 1 | T24: 2 | U24: 0 | W24: =SUM(M24:V24) -> 11 | X24: =L24+W24 -> 25 | Y24: =Z24/(SUM(Z24:AB24)) -> 0.57894736842105265 | Z24: 11 | AA24: 5 | AB24: 3
B25: =SUM(B21:B24) -> 2 | C25: =SUM(C21:C24) -> 6 | D25: =SUM(D21:D24) -> 5 | E25: =SUM(E21:E24) -> 6 | F25: =SUM(F21:F24) -> 6 | G25: =SUM(G21:G24) -> 3 | H25: =SUM(H21:H24) -> 3 | I25: =SUM(I21:I24) -> 4 | J25: =SUM(J21:J24) -> 7 | K25: =SUM(K21:K24) -> 6 | L25: =SUM(B25:K25) -> 48 | M25: =SUM(M21:M24) -> 4 | N25: =SUM(N21:N24) -> 2 | O25: =SUM(O21:O24) -> 6 | P25: =SUM(P21:P24) -> 2 | Q25: =SUM(Q21:Q24) -> 2 | R25: =SUM(R21:R24) -> 4 | S25: =SUM(S21:S24) -> 5 | T25: =SUM(T21:T24) -> 5 | U25: =SUM(U21:U24) -> 4 | V25: =SUM(V21:V24) -> 0 | W25: =SUM(M25:V25) -> 34 | X25: =L25+W25 -> 82
A28: Randy Keeney | B28: 0 | C28: 2 | D28: 2 | E28: 2 | F28: 2 | G28: 2 | H28: 1 | I28: 2 | J28: 2 | K28: 0 | L28: =SUM(B28:K28) -> 15 | M28: 1 | N28: 2 | O28: 0 | P28: A | Q28: 2 | R28: 2 | S28: 0 | T28: 2 | U28: 0 | W28: =SUM(M28:V28) -> 9 | X28: =L28+W28 -> 24 | Y28: =Z28/(SUM(Z28:AB28)) -> 0.61111111111111116 | Z28: 11 | AA28: 5 | AB28: 2
A29: Tom Proctor | B29: 2 | C29: 0 | D29: 0 | E29: 2 | F29: 0 | G29: 2 | H29: 2 | I29: 2 | J29: A | K29: 0 | L29: =SUM(B29:K29) -> 10 | M29: 1 | N29: 0 | O29: 0 | P29: 1 | Q29: 0 | R29: 2 | S29: 0 | T29: 0 | U29: 1 | W29: =SUM(M29:V29) -> 5 | X29: =L29+W29 -> 15 | Y29: =Z29/(SUM(Z29:AB29)) -> 0.33333333333333331 | Z29: 6 | AA29: 9 | AB29: 3
A30: Stephen Jones | B30: 2 | C30: 2 | D30: 2 | E30: 2 | F30: 1 | G30: 0 | H30: 2 | I30: 2 | J30: 0 | K30: 2 | L30: =SUM(B30:K30) -> 15 | M30: 2 | N30: 1 | O30: 2 | P30: 2 | Q30: 0 | R30: 0 | S30: 0 | T30: 2 | U30: 0 | W30: =SUM(M30:V30) -> 9 | X30: =L30+W30 -> 24 | Y30: =Z30/(SUM(Z30:AB30)) -> 0.57894736842105265 | Z30: 11 | AA30: 6 | AB30: 2
A31: Tres Baumgarner | B31: 2 | C31: 1 | D31: 0 | E31: 1 | F31: 0 | G31: 1 | H31: 1 | I31: 2 | J31: A | K31: 2 | L31: =SUM(B31:K31) -> 10 | M31: 0 | N31: 0 | O31: 0 | P31: 2 | Q31: 0 | R31: 0 | S31: 0 | T31: 1 | U31: 0 | W31: =SUM(M31:V31) -> 3 | X31: =L31+W31 -> 13 | Y31: =Z31/(SUM(Z31:AB31)) -> 0.22222222222222221 | Z31: 4 | AA31: 9 | AB31: 5
B32: =SUM(B28:B31) -> 6 | C32: =SUM(C28:C31) -> 5 | D32: =SUM(D28:D31) -> 4 | E32: =SUM(E28:E31) -> 7 | F32: =SUM(F28:F31) -> 3 | G32: =SUM(G28:G31) -> 5 | H32: =SUM(H28:H31) -> 6 | I32: =SUM(I28:I31) -> 8 | J32: =SUM(J28:J31) -> 2 | K32: =SUM(K28:K31) -> 4 | L32: =SUM(B32:K32) -> 50 | M32: =SUM(M28:M31) -> 4 | N32: =SUM(N28:N31) -> 3 | O32: =SUM(O28:O31) -> 2 | P32: =SUM(P28:P31) -> 5 | Q32: =SUM(Q28:Q31) -> 2 | R32: =SUM(R28:R31) -> 4 | S32: =SUM(S28:S31) -> 0 | T32: =SUM(T28:T31) -> 5 | U32: =SUM(U28:U31) -> 1 | V32: =SUM(V28:V31) -> 0 | W32: =SUM(M32:V32) -> 26 | X32: =L32+W32 -> 76
A35: Dave Smith | B35: 0 | C35: 2 | D35: 0 | E35: 0 | F35: 0 | G35: 2 | H35: 2 | I35: 2 | J35: 2 | K35: 2 | L35: =SUM(B35:K35) -> 12 | M35: 1 | N35: 1 | O35: 0 | P35: 0 | Q35: 0 | R35: 2 | S35: 2 | T35: 0 | U35: 0 | W35: =SUM(M35:V35) -> 6 | X35: =L35+W35 -> 18 | Y35: =Z35/(SUM(Z35:AB35)) -> 0.42105263157894735 | Z35: 8 | AA35: 9 | AB35: 2
A36: George White | B36: 0 | C36: 2 | D36: 2 | E36: A | F36: 2 | G36: 0 | H36: 0 | I36: 1 | J36: 1 | K36: 2 | L36: =SUM(B36:K36) -> 10 | M36: 1 | N36: 1 | O36: 2 | P36: 0 | Q36: 2 | R36: 0 | S36: 2 | T36: 1 | U36: 2 | W36: =SUM(M36:V36) -> 11 | X36: =L36+W36 -> 21 | Y36: =Z36/(SUM(Z36:AB36)) -> 0.44444444444444442 | Z36: 8 | AA36: 5 | AB36: 5
A37: Gary Taylor | B37: 2 | C37: 0 | D37: 0 | E37: 2 | F37: 1 | G37: 2 | H37: 0 | I37: 1 | J37: 0 | K37: 0 | L37: =SUM(B37:K37) -> 8 | M37: 0 | N37: 0 | O37: 0 | P37: 2 | Q37: 2 | R37: 2 | S37: 2 | T37: 2 | U37: 2 | W37: =SUM(M37:V37) -> 12 | X37: =L37+W37 -> 20 | Y37: =Z37/(SUM(Z37:AB37)) -> 0.47368421052631576 | Z37: 9 | AA37: 8 | AB37: 2
A38: Bob Harbour | B38: 0 | C38: 0 | D38: 1 | E38: 2 | F38: 2 | G38: 0 | H38: 0 | I38: 0 | J38: 0 | K38: 0 | L38: =SUM(B38:K38) -> 5 | M38: 2 | N38: 1 | O38: 0 | P38: 2 | Q38: 2 | R38: 0 | S38: 2 | T38: 0 | U38: 2 | W38: =SUM(M38:V38) -> 11 | X38: =L38+W38 -> 16 | Y38: =Z38/(SUM(Z38:AB38)) -> 0.36842105263157893 | Z38: 7 | AA38: 10 | AB38: 2
B39: =SUM(B35:B38) -> 2 | C39: =SUM(C35:C38) -> 4 | D39: =SUM(D35:D38) -> 3 | E39: =SUM(E35:E38) -> 4 | F39: =SUM(F35:F38) -> 5 | G39: =SUM(G35:G38) -> 4 | H39: =SUM(H35:H38) -> 2 | I39: =SUM(I35:I38) -> 4 | J39: =SUM(J35:J38) -> 3 | K39: =SUM(K35:K38) -> 4 | L39: =SUM(B39:K39) -> 35 | M39: =SUM(M35:M38) -> 4 | N39: =SUM(N35:N38) -> 3 | O39: =SUM(O35:O38) -> 2 | P39: =SUM(P35:P38) -> 4 | Q39: =SUM(Q35:Q38) -> 6 | R39: =SUM(R35:R38) -> 4 | S39: =SUM(S35:S38) -> 8 | T39: =SUM(T35:T38) -> 3 | U39: =SUM(U35:U38) -> 6 | V39: =SUM(V35:V38) -> 0 | W39: =SUM(M39:V39) -> 40 | X39: =L39+W39 -> 75
A42: Raymond Ours | B42: 2 | C42: 0 | D42: 2 | E42: 0 | F42: 2 | G42: 0 | H42: 1 | I42: 2 | J42: 0 | K42: 2 | L42: =SUM(B42:K42) -> 11 | M42: 1 | N42: 0 | O42: 0 | P42: 1 | Q42: A | R42: 0 | S42: 2 | T42: 2 | U42: 2 | W42: =SUM(M42:V42) -> 8 | X42: =L42+W42 -> 19 | Y42: =Z42/(SUM(Z42:AB42)) -> 0.44444444444444442 | Z42: 8 | AA42: 7 | AB42: 3
A43: Tim Way | B43: 2 | C43: 2 | D43: 2 | E43: 0 | F43: 2 | G43: 2 | H43: 0 | I43: 2 | J43: 1 | L43: =SUM(B43:K43) -> 13 | M43: A | N43: 2 | O43: 0 | P43: 2 | Q43: 0 | R43: 2 | S43: 2 | T43: 1 | U43: 0 | W43: =SUM(M43:V43) -> 9 | X43: =L43+W43 -> 22 | Y43: =Z43/(SUM(Z43:AB43)) -> 0.58823529411764708 | Z43: 10 | AA43: 5 | AB43: 2
A44: Lewis Baumgarner | B44: 0 | C44: 0 | D44: 0 | E44: 0 | F44: 2 | G44: 0 | H44: 0 | I44: 2 | J44: 0 | K44: 0 | L44: =SUM(B44:K44) -> 4 | M44: 2 | N44: 1 | O44: 2 | P44: 0 | Q44: 2 | R44: 0 | S44: 2 | T44: 0 | U44: 0 | W44: =SUM(M44:V44) -> 9 | X44: =L44+W44 -> 13 | Y44: =Z44/(SUM(Z44:AB44)) -> 0.31578947368421051 | Z44: 6 | AA44: 12 | AB44: 1
A45: Jim Dodrill | B45: 2 | C45: 1 | D45: 2 | E45: 2 | F45: 1 | G45: 2 | H45: A | I45: 2 | J45: 0 | L45: =SUM(B45:K45) -> 12 | M45: 0 | N45: 2 | O45: 2 | P45: 2 | Q45: 0 | R45: 2 | S45: 2 | T45: 2 | U45: 1 | W45: =SUM(M45:V45) -> 13 | X45: =L45+W45 -> 25 | Y45: =Z45/(SUM(Z45:AB45)) -> 0.6470588235294118 | Z45: 11 | AA45: 3 | AB45: 3
B46: =SUM(B42:B45) -> 6 | C46: =SUM(C42:C45) -> 3 | D46: =SUM(D42:D45) -> 6 | E46: =SUM(E42:E45) -> 2 | F46: =SUM(F42:F45) -> 7 | G46: =SUM(G42:G45) -> 4 | H46: =SUM(H42:H45) -> 1 | I46: =SUM(I42:I45) -> 8 | J46: =SUM(J42:J45) -> 1 | K46: =SUM(K42:K45) -> 2 | L46: =SUM(B46:K46) -> 40 | M46: =SUM(M42:M45) -> 3 | N46: =SUM(N42:N45) -> 5 | O46: =SUM(O42:O45) -> 4 | P46: =SUM(P42:P45) -> 5 | Q46: =SUM(Q42:Q45) -> 2 | R46: =SUM(R42:R45) -> 4 | S46: =SUM(S42:S45) -> 8 | T46: =SUM(T42:T45) -> 5 | U46: =SUM(U42:U45) -> 3 | V46: =SUM(V42:V45) -> 0 | W46: =SUM(M46:V46) -> 39 | X46: =L46+W46 -> 79