E3: Handicaps 2006
H6: New
H7: Handicap
C8: Raymond Ours | D8: =(J8+K8+L8+M8+N8+O8+P8+Q8+R8)/9 -> 37.777777777777779 | F8: =D8-37 -> 0.77777777777777857 | H8: 1 | J8: 35 | K8: 37 | L8: 38 | M8: 38 | N8: 38 | O8: 38 | P8: 38 | Q8: 39 | R8: 39
C9: Wilson, Tom | D9: =(J9+K9+L9+M9+N9+O9)/6 -> 39.833333333333336 | F9: =D9-37 -> 2.8333333333333357 | H9: 3 | J9: 38 | K9: 39 | L9: 40 | M9: 40 | N9: 40 | O9: 42
C10: Rutherford, Mark | D10: =(J10+K10+L10+M10+N10+O10+P10+Q10+R10)/9 -> 40.000 | F10: =D10-37 -> 3.0 | H10: 3 | J10: 38 | K10: 38 | L10: 39 | M10: 39 | N10: 41 | O10: 41 | P10: 41 | Q10: 41 | R10: 42
C11: Reese, Troy | D11: =(J11+K11+L11+M11+N11+O11+P11+Q11+R11)/9 -> 41.222222222222221 | F11: =D11-37 -> 4.2222222222222214 | H11: 4 | J11: 39 | K11: 40 | L11: 41 | M11: 41 | N11: 42 | O11: 42 | P11: 42 | Q11: 42 | R11: 42
C12: Keeney, Randy | D12: =(J12+K12+L12+M12+N12+O12+P12+Q12+R12)/9 -> 40.222222222222221 | F12: =D12-37 -> 3.2222222222222214 | H12: 3 | J12: 39 | K12: 39 | L12: 39 | M12: 40 | N12: 41 | O12: 41 | P12: 41 | Q12: 41 | R12: 41
C13: Smith, Dave | D13: =(J13+K13+L13+M13+N13+O13+P13+Q13+R13)/9 -> 40.000 | F13: =D13-37 -> 3.0 | H13: 3 | J13: 36 | K13: 37 | L13: 40 | M13: 41 | N13: 41 | O13: 41 | P13: 41 | Q13: 41 | R13: 42
C15: White, George | D15: =(J15+K15+L15+M15+N15+O15+P15+Q15+R15)/9 -> 41.000 | F15: =D15-37 -> 4.0 | H15: 4 | J15: 39 | K15: 39 | L15: 40 | M15: 40 | N15: 41 | O15: 42 | P15: 42 | Q15: 43 | R15: 43
C16: Proctor, Tom | D16: =(J16+K16+L16+M16+N16+O16+P16+Q16+R16)/9 -> 42.666666666666664 | F16: =D16-37 -> 5.6666666666666643 | H16: 6 | J16: 41 | K16: 41 | L16: 42 | M16: 42 | N16: 43 | O16: 43 | P16: 44 | Q16: 44 | R16: 44
C17: McComas, Matt | D17: =(J17+K17+L17+M17+N17+O17+P17+Q17+R17)/9 -> 42.555555555555557 | F17: =D17-37 -> 5.5555555555555571 | H17: 6 | J17: 41 | K17: 41 | L17: 42 | M17: 42 | N17: 42 | O17: 43 | P17: 43 | Q17: 44 | R17: 45
C18: Craig, Bill | D18: =(J18+K18+L18+M18+N18+O18+P18+Q18)/8 -> 43.625 | F18: =D18-37 -> 6.625 | H18: 7 | J18: 42 | K18: 42 | L18: 43 | M18: 44 | N18: 44 | O18: 44 | P18: 45 | Q18: 45
C19: Way, Tim | D19: =(J19+K19+L19+M19+N19+O19+P19+Q19+R19)/9 -> 43.222222222222221 | F19: =D19-37 -> 6.2222222222222214 | H19: 6 | J19: 41 | K19: 41 | L19: 42 | M19: 43 | N19: 43 | O19: 44 | P19: 45 | Q19: 45 | R19: 45
C20: Wilks, Alex | D20: =(J20+K20+L20+M20+N20+O20+P20+Q20+R20)/9 -> 44.333333333333336 | F20: =D20-37 -> 7.3333333333333357 | H20: 7 | J20: 42 | K20: 43 | L20: 44 | M20: 44 | N20: 45 | O20: 45 | P20: 45 | Q20: 45 | R20: 46
C22: Jones, Stephen | D22: =(J22+K22+L22+M22+N22+O22+P22+Q22+R22+S22)/10 -> 44.500 | F22: =D22-37 -> 7.5 | H22: 8 | J22: 42 | K22: 43 | L22: 43 | M22: 44 | N22: 44 | O22: 44 | P22: 46 | Q22: 46 | R22: 46 | S22: 47
C23: Kyle, Matt | D23: =(J23+K23+L23+M23+N23+O23+P23+Q23+R23)/9 -> 45.000 | F23: =D23-37 -> 8.0 | H23: 8 | J23: 41 | K23: 42 | L23: 44 | M23: 45 | N23: 46 | O23: 46 | P23: 46 | Q23: 47 | R23: 48
C24: Taylor, Gary | D24: =(J24+K24+L24+M24+N24+O24+P24+Q24+R24+S24)/10 -> 46.400 | F24: =D24-37 -> 9.4 | H24: 9 | J24: 43 | K24: 45 | L24: 45 | M24: 46 | N24: 46 | O24: 47 | P24: 47 | Q24: 47 | R24: 49 | S24: 49
C25: Meadows, Bill | D25: =(J25+K25+L25+M25+N25+O25+P25+Q25)/8 -> 48.625 | F25: =D25-37 -> 11.625 | H25: 12 | J25: 46 | K25: 47 | L25: 48 | M25: 49 | N25: 49 | O25: 50 | P25: 50 | Q25: 50
C26: Baumgarner, Lewis | D26: =(J26+K26+L26+M26+N26+O26+P26+Q26+R26)/9 -> 48.000 | F26: =D26-37 -> 11.0 | H26: 11 | J26: 45 | K26: 46 | L26: 47 | M26: 47 | N26: 49 | O26: 49 | P26: 49 | Q26: 50 | R26: 50
C27: Hall, Benton | D27: =(J27+K27+L27+M27+N27+O27+P27+Q27+R27+S27)/10 -> 47.400 | F27: =D27-37 -> 10.4 | H27: 10 | J27: 43 | K27: 46 | L27: 46 | M27: 47 | N27: 47 | O27: 48 | P27: 49 | Q27: 49 | R27: 49 | S27: 50
C29: Landers, John | D29: =(J29+K29+L29+M29+N29+O29)/6 -> 49.833333333333336 | F29: =D29-37 -> 12.833333333333336 | H29: 13 | J29: 47 | K29: 48 | L29: 50 | M29: 51 | N29: 51 | O29: 52
C30: Baumgarner, Tres | D30: =(J30+K30+L30+M30+N30+O30+P30+Q30+R30)/9 -> 48.777777777777779 | F30: =D30-37 -> 11.777777777777779 | H30: 12 | J30: 43 | K30: 47 | L30: 48 | M30: 49 | N30: 49 | O30: 50 | P30: 50 | Q30: 51 | R30: 52
C31: Harbour, Bob | D31: =(J31+K31+L31+M31+N31+O31+P31+Q31+R31+S31)/10 -> 51.500 | F31: =D31-37 -> 14.5 | H31: 15 | J31: 47 | K31: 50 | L31: 50 | M31: 50 | N31: 51 | O31: 53 | P31: 53 | Q31: 53 | R31: 54 | S31: 54
C32: Chiles, Linden | D32: =(J32+K32+L32+M32+N32+O32+P32+Q32)/8 -> 52.125 | F32: =D32-37 -> 15.125 | H32: 15 | J32: 50 | K32: 51 | L32: 51 | M32: 52 | N32: 52 | O32: 53 | P32: 54 | Q32: 54
C33: Dodrill, Jim | D33: =(J33+K33+L33+M33+N33+O33+P33+Q33)/8 -> 51.625 | F33: =D33-37 -> 14.625 | H33: 15 | J33: 50 | K33: 50 | L33: 51 | M33: 51 | N33: 52 | O33: 53 | P33: 53 | Q33: 53
C34: Kyle, Butch | D34: =(J34+K34+L34+M34+N34+O34+P34+Q34+R34)/9 -> 49.777777777777779 | F34: =D34-37 -> 12.777777777777779 | H34: 13 | J34: 46 | K34: 47 | L34: 49 | M34: 50 | N34: 50 | O34: 51 | P34: 51 | Q34: 52 | R34: 52