A2: =MID(CELL("filename",A1),FIND("]",CELL("filename",A1))+1,LEN(CELL("filename",A1))-FIND("]",CELL("filename",A1))) -> Playoff Bracket
A4: =Standings!$A$4 -> 2009
B11: Team 5 | C11: ='Playoff Round'!$W$20 -> 5 | I11: Team 6 | J11: ='Playoff Round'!$W$37 -> 5
D17: Team 5 | E17: ='Team Championship Round'!$W$20 -> 4 | F17: VS | G17: Team 6 | H17: ='Team Championship Round'!$W$21 -> 4
D19: Team 6
D21: League Champion
B23: Team 1 | C23: ='Playoff Round'!$W$21 -> 3 | I23: Team 2 | J23: ='Playoff Round'!$W$38 -> 3