A1: =MID(CELL("filename",A1),FIND("]",CELL("filename",A1))+1,LEN(CELL("filename",A1))-FIND("]",CELL("filename",A1))) -> Team Championship Round
A3: Scoresheet
A5: =Standings!$A$4 -> 2009
A6: Team 5 VS Team 6
A7: One and Two Players
A8: Par | B8: 4 | C8: 3 | D8: 4 | E8: 4 | F8: 5 | G8: 3 | H8: 5 | I8: 4 | J8: 5
A9: Hole | B9: 1 | C9: 2 | D9: 3 | E9: 4 | F9: 5 | G9: 6 | H9: 7 | I9: 8 | J9: 9 | K9: Actual | L9: Par | M9: HC | N9: Net | O9: Par | P9: Points | Q9: Eg | R9: Br | S9: Pr | T9: Bg | U9: Dbl Bg+
A10: M. Rutherford | B10: 4 | C10: 3 | D10: 5 | E10: 5 | F10: 5 | G10: 3 | H10: 4 | I10: 4 | J10: 5 | K10: =IF(SUM(B10:J10)=0,"-",SUM(B10:J10)) -> 38 | L10: =IF(ISERROR(IF(K10-37=-37, "-", K10-37)),"-",(IF(K10-37=-37,"-",K10-37))) -> 1 | M10: 3 | N10: =IF(ISERROR(IF(K10-M10=-M10, 0, K10-M10)),"-",(IF(K10-M10=-M10, 0, K10-M10))) -> 35 | O10: =IF(ISERROR(IF(N10-37=-37, "-", N10-37)),"-",(IF(N10-37=-37,"-",N10-37))) -> -2 | P10: 2 | Q10: =SUM(IF(B10=2,1,0),IF(D10=2,1,0),IF(E10=2,1,0),IF(F10=3,1,0),IF(H10=3,1,0),IF(I10=2,1,0),IF(J10=3,1,0)) -> 0 | R10: =SUM(IF(B10=3,1,0),IF(C10=2,1,0),IF(D10=3,1,0),IF(E10=3,1,0),IF(F10=4,1,0),IF(G10=2,1,0),IF(H10=4,1,0),IF(I10=3,1,0),IF(J10=4,1,0)) -> 1 | S10: =SUM(IF(B10=4,1,0),IF(C10=3,1,0),IF(D10=4,1,0),IF(E10=4,1,0),IF(F10=5,1,0),IF(G10=3,1,0),IF(H10=5,1,0),IF(I10=4,1,0),IF(J10=5,1,0)) -> 6 | T10: =SUM(IF(B10=5,1,0),IF(C10=4,1,0),IF(D10=5,1,0),IF(E10=5,1,0),IF(F10=6,1,0),IF(G10=4,1,0),IF(H10=6,1,0),IF(I10=5,1,0),IF(J10=6,1,0)) -> 2 | U10: =SUM(IF(B10=6,1,0),IF(C10=5,1,0),IF(D10=6,1,0),IF(E10=6,1,0),IF(F10=7,1,0),IF(G10=5,1,0),IF(H10=7,1,0),IF(I10=6,1,0),IF(J10=7,1,0),IF(B10=7,1,0),IF(C10=6,1,0),IF(D10=7,1,0),IF(E10=7,1,0),IF(F10=8,1,0),IF(G10=6,1,0),IF(H10=8,1,0),IF(I10=7,1,0),IF(J10=8,1,0),IF(B10=8,1,0),IF(C10=7,1,0),IF(D10=8,1,0),IF(E10=8,1,0),IF(F10=9,1,0),IF(G10=7,1,0),IF(H10=9,1,0),IF(I10=8,1,0),IF(J10=9,1,0)) -> 0
A11: R. Crowder | B11: 4 | C11: 4 | D11: 5 | E11: 4 | F11: 5 | G11: 4 | H11: 5 | I11: 4 | J11: 5 | K11: =IF(SUM(B11:J11)=0,"-",SUM(B11:J11)) -> 40 | L11: =IF(ISERROR(IF(K11-37=-37, "-", K11-37)),"-",(IF(K11-37=-37,"-",K11-37))) -> 3 | M11: 2 | N11: =IF(ISERROR(IF(K11-M11=-M11, 0, K11-M11)),"-",(IF(K11-M11=-M11, 0, K11-M11))) -> 38 | O11: =IF(ISERROR(IF(N11-37=-37, "-", N11-37)),"-",(IF(N11-37=-37,"-",N11-37))) -> 1 | P11: 0 | Q11: =SUM(IF(B11=2,1,0),IF(D11=2,1,0),IF(E11=2,1,0),IF(F11=3,1,0),IF(H11=3,1,0),IF(I11=2,1,0),IF(J11=3,1,0)) -> 0 | R11: =SUM(IF(B11=3,1,0),IF(C11=2,1,0),IF(D11=3,1,0),IF(E11=3,1,0),IF(F11=4,1,0),IF(G11=2,1,0),IF(H11=4,1,0),IF(I11=3,1,0),IF(J11=4,1,0)) -> 0 | S11: =SUM(IF(B11=4,1,0),IF(C11=3,1,0),IF(D11=4,1,0),IF(E11=4,1,0),IF(F11=5,1,0),IF(G11=3,1,0),IF(H11=5,1,0),IF(I11=4,1,0),IF(J11=5,1,0)) -> 6 | T11: =SUM(IF(B11=5,1,0),IF(C11=4,1,0),IF(D11=5,1,0),IF(E11=5,1,0),IF(F11=6,1,0),IF(G11=4,1,0),IF(H11=6,1,0),IF(I11=5,1,0),IF(J11=6,1,0)) -> 3 | U11: =SUM(IF(B11=6,1,0),IF(C11=5,1,0),IF(D11=6,1,0),IF(E11=6,1,0),IF(F11=7,1,0),IF(G11=5,1,0),IF(H11=7,1,0),IF(I11=6,1,0),IF(J11=7,1,0),IF(B11=7,1,0),IF(C11=6,1,0),IF(D11=7,1,0),IF(E11=7,1,0),IF(F11=8,1,0),IF(G11=6,1,0),IF(H11=8,1,0),IF(I11=7,1,0),IF(J11=8,1,0),IF(B11=8,1,0),IF(C11=7,1,0),IF(D11=8,1,0),IF(E11=8,1,0),IF(F11=9,1,0),IF(G11=7,1,0),IF(H11=9,1,0),IF(I11=8,1,0),IF(J11=9,1,0)) -> 0
A12: D. Freeman | B12: 5 | C12: 5 | D12: 4 | E12: 5 | F12: 6 | G12: 4 | H12: 4 | I12: 5 | J12: 6 | K12: =IF(SUM(B12:J12)=0,"-",SUM(B12:J12)) -> 44 | L12: =IF(ISERROR(IF(K12-37=-37, "-", K12-37)),"-",(IF(K12-37=-37,"-",K12-37))) -> 7 | M12: 5 | N12: =IF(ISERROR(IF(K12-M12=-M12, 0, K12-M12)),"-",(IF(K12-M12=-M12, 0, K12-M12))) -> 39 | O12: =IF(ISERROR(IF(N12-37=-37, "-", N12-37)),"-",(IF(N12-37=-37,"-",N12-37))) -> 2 | P12: 0 | Q12: =SUM(IF(B12=2,1,0),IF(D12=2,1,0),IF(E12=2,1,0),IF(F12=3,1,0),IF(H12=3,1,0),IF(I12=2,1,0),IF(J12=3,1,0)) -> 0 | R12: =SUM(IF(B12=3,1,0),IF(C12=2,1,0),IF(D12=3,1,0),IF(E12=3,1,0),IF(F12=4,1,0),IF(G12=2,1,0),IF(H12=4,1,0),IF(I12=3,1,0),IF(J12=4,1,0)) -> 1 | S12: =SUM(IF(B12=4,1,0),IF(C12=3,1,0),IF(D12=4,1,0),IF(E12=4,1,0),IF(F12=5,1,0),IF(G12=3,1,0),IF(H12=5,1,0),IF(I12=4,1,0),IF(J12=5,1,0)) -> 1 | T12: =SUM(IF(B12=5,1,0),IF(C12=4,1,0),IF(D12=5,1,0),IF(E12=5,1,0),IF(F12=6,1,0),IF(G12=4,1,0),IF(H12=6,1,0),IF(I12=5,1,0),IF(J12=6,1,0)) -> 6 | U12: =SUM(IF(B12=6,1,0),IF(C12=5,1,0),IF(D12=6,1,0),IF(E12=6,1,0),IF(F12=7,1,0),IF(G12=5,1,0),IF(H12=7,1,0),IF(I12=6,1,0),IF(J12=7,1,0),IF(B12=7,1,0),IF(C12=6,1,0),IF(D12=7,1,0),IF(E12=7,1,0),IF(F12=8,1,0),IF(G12=6,1,0),IF(H12=8,1,0),IF(I12=7,1,0),IF(J12=8,1,0),IF(B12=8,1,0),IF(C12=7,1,0),IF(D12=8,1,0),IF(E12=8,1,0),IF(F12=9,1,0),IF(G12=7,1,0),IF(H12=9,1,0),IF(I12=8,1,0),IF(J12=9,1,0)) -> 1
A13: M. Fairburn | B13: 4 | C13: 3 | D13: 5 | E13: 4 | F13: 5 | G13: 3 | H13: 5 | I13: 4 | J13: 5 | K13: =IF(SUM(B13:J13)=0,"-",SUM(B13:J13)) -> 38 | L13: =IF(ISERROR(IF(K13-37=-37, "-", K13-37)),"-",(IF(K13-37=-37,"-",K13-37))) -> 1 | M13: 3 | N13: =IF(ISERROR(IF(K13-M13=-M13, 0, K13-M13)),"-",(IF(K13-M13=-M13, 0, K13-M13))) -> 35 | O13: =IF(ISERROR(IF(N13-37=-37, "-", N13-37)),"-",(IF(N13-37=-37,"-",N13-37))) -> -2 | P13: 2 | Q13: =SUM(IF(B13=2,1,0),IF(D13=2,1,0),IF(E13=2,1,0),IF(F13=3,1,0),IF(H13=3,1,0),IF(I13=2,1,0),IF(J13=3,1,0)) -> 0 | R13: =SUM(IF(B13=3,1,0),IF(C13=2,1,0),IF(D13=3,1,0),IF(E13=3,1,0),IF(F13=4,1,0),IF(G13=2,1,0),IF(H13=4,1,0),IF(I13=3,1,0),IF(J13=4,1,0)) -> 0 | S13: =SUM(IF(B13=4,1,0),IF(C13=3,1,0),IF(D13=4,1,0),IF(E13=4,1,0),IF(F13=5,1,0),IF(G13=3,1,0),IF(H13=5,1,0),IF(I13=4,1,0),IF(J13=5,1,0)) -> 8 | T13: =SUM(IF(B13=5,1,0),IF(C13=4,1,0),IF(D13=5,1,0),IF(E13=5,1,0),IF(F13=6,1,0),IF(G13=4,1,0),IF(H13=6,1,0),IF(I13=5,1,0),IF(J13=6,1,0)) -> 1 | U13: =SUM(IF(B13=6,1,0),IF(C13=5,1,0),IF(D13=6,1,0),IF(E13=6,1,0),IF(F13=7,1,0),IF(G13=5,1,0),IF(H13=7,1,0),IF(I13=6,1,0),IF(J13=7,1,0),IF(B13=7,1,0),IF(C13=6,1,0),IF(D13=7,1,0),IF(E13=7,1,0),IF(F13=8,1,0),IF(G13=6,1,0),IF(H13=8,1,0),IF(I13=7,1,0),IF(J13=8,1,0),IF(B13=8,1,0),IF(C13=7,1,0),IF(D13=8,1,0),IF(E13=8,1,0),IF(F13=9,1,0),IF(G13=7,1,0),IF(H13=9,1,0),IF(I13=8,1,0),IF(J13=9,1,0)) -> 0
A15: Three and Four Players
A16: Par | B16: 4 | C16: 3 | D16: 4 | E16: 4 | F16: 5 | G16: 3 | H16: 5 | I16: 4 | J16: 5
A17: Hole | B17: 1 | C17: 2 | D17: 3 | E17: 4 | F17: 5 | G17: 6 | H17: 7 | I17: 8 | J17: 9 | K17: Actual | L17: Par | M17: HC | N17: Net | O17: Par | P17: Points | Q17: Eg | R17: Br | S17: Pr | T17: Bg | U17: Dbl Bg+
A18: B. Hall | B18: 4 | C18: 3 | D18: 4 | E18: 5 | F18: 6 | G18: 3 | H18: 7 | I18: 7 | J18: 5 | K18: =IF(SUM(B18:J18)=0,"-",SUM(B18:J18)) -> 44 | L18: =IF(ISERROR(IF(K18-37=-37, "-", K18-37)),"-",(IF(K18-37=-37,"-",K18-37))) -> 7 | M18: 7 | N18: =IF(ISERROR(IF(K18-M18=-M18, 0, K18-M18)),"-",(IF(K18-M18=-M18, 0, K18-M18))) -> 37 | O18: =IF(ISERROR(IF(N18-37=-37, "-", N18-37)),"-",(IF(N18-37=-37,"-",N18-37))) -> 0 | P18: 2 | Q18: =SUM(IF(B18=2,1,0),IF(D18=2,1,0),IF(E18=2,1,0),IF(F18=3,1,0),IF(H18=3,1,0),IF(I18=2,1,0),IF(J18=3,1,0)) -> 0 | R18: =SUM(IF(B18=3,1,0),IF(C18=2,1,0),IF(D18=3,1,0),IF(E18=3,1,0),IF(F18=4,1,0),IF(G18=2,1,0),IF(H18=4,1,0),IF(I18=3,1,0),IF(J18=4,1,0)) -> 0 | S18: =SUM(IF(B18=4,1,0),IF(C18=3,1,0),IF(D18=4,1,0),IF(E18=4,1,0),IF(F18=5,1,0),IF(G18=3,1,0),IF(H18=5,1,0),IF(I18=4,1,0),IF(J18=5,1,0)) -> 5 | T18: =SUM(IF(B18=5,1,0),IF(C18=4,1,0),IF(D18=5,1,0),IF(E18=5,1,0),IF(F18=6,1,0),IF(G18=4,1,0),IF(H18=6,1,0),IF(I18=5,1,0),IF(J18=6,1,0)) -> 2 | U18: =SUM(IF(B18=6,1,0),IF(C18=5,1,0),IF(D18=6,1,0),IF(E18=6,1,0),IF(F18=7,1,0),IF(G18=5,1,0),IF(H18=7,1,0),IF(I18=6,1,0),IF(J18=7,1,0),IF(B18=7,1,0),IF(C18=6,1,0),IF(D18=7,1,0),IF(E18=7,1,0),IF(F18=8,1,0),IF(G18=6,1,0),IF(H18=8,1,0),IF(I18=7,1,0),IF(J18=8,1,0),IF(B18=8,1,0),IF(C18=7,1,0),IF(D18=8,1,0),IF(E18=8,1,0),IF(F18=9,1,0),IF(G18=7,1,0),IF(H18=9,1,0),IF(I18=8,1,0),IF(J18=9,1,0)) -> 2
A19: G. Yablonski | B19: 4 | C19: 5 | D19: 5 | E19: 6 | F19: 5 | G19: 3 | H19: 5 | I19: 6 | J19: 7 | K19: =IF(SUM(B19:J19)=0,"-",SUM(B19:J19)) -> 46 | L19: =IF(ISERROR(IF(K19-37=-37, "-", K19-37)),"-",(IF(K19-37=-37,"-",K19-37))) -> 9 | M19: 8 | N19: =IF(ISERROR(IF(K19-M19=-M19, 0, K19-M19)),"-",(IF(K19-M19=-M19, 0, K19-M19))) -> 38 | O19: =IF(ISERROR(IF(N19-37=-37, "-", N19-37)),"-",(IF(N19-37=-37,"-",N19-37))) -> 1 | P19: 0 | Q19: =SUM(IF(B19=2,1,0),IF(D19=2,1,0),IF(E19=2,1,0),IF(F19=3,1,0),IF(H19=3,1,0),IF(I19=2,1,0),IF(J19=3,1,0)) -> 0 | R19: =SUM(IF(B19=3,1,0),IF(C19=2,1,0),IF(D19=3,1,0),IF(E19=3,1,0),IF(F19=4,1,0),IF(G19=2,1,0),IF(H19=4,1,0),IF(I19=3,1,0),IF(J19=4,1,0)) -> 0 | S19: =SUM(IF(B19=4,1,0),IF(C19=3,1,0),IF(D19=4,1,0),IF(E19=4,1,0),IF(F19=5,1,0),IF(G19=3,1,0),IF(H19=5,1,0),IF(I19=4,1,0),IF(J19=5,1,0)) -> 4 | T19: =SUM(IF(B19=5,1,0),IF(C19=4,1,0),IF(D19=5,1,0),IF(E19=5,1,0),IF(F19=6,1,0),IF(G19=4,1,0),IF(H19=6,1,0),IF(I19=5,1,0),IF(J19=6,1,0)) -> 1 | U19: =SUM(IF(B19=6,1,0),IF(C19=5,1,0),IF(D19=6,1,0),IF(E19=6,1,0),IF(F19=7,1,0),IF(G19=5,1,0),IF(H19=7,1,0),IF(I19=6,1,0),IF(J19=7,1,0),IF(B19=7,1,0),IF(C19=6,1,0),IF(D19=7,1,0),IF(E19=7,1,0),IF(F19=8,1,0),IF(G19=6,1,0),IF(H19=8,1,0),IF(I19=7,1,0),IF(J19=8,1,0),IF(B19=8,1,0),IF(C19=7,1,0),IF(D19=8,1,0),IF(E19=8,1,0),IF(F19=9,1,0),IF(G19=7,1,0),IF(H19=9,1,0),IF(I19=8,1,0),IF(J19=9,1,0)) -> 4
A20: B. Kyle | B20: 3 | C20: 3 | D20: 5 | E20: 6 | F20: 6 | G20: 4 | H20: 7 | I20: 5 | J20: 5 | K20: =IF(SUM(B20:J20)=0,"-",SUM(B20:J20)) -> 44 | L20: =IF(ISERROR(IF(K20-37=-37, "-", K20-37)),"-",(IF(K20-37=-37,"-",K20-37))) -> 7 | M20: 14 | N20: =IF(ISERROR(IF(K20-M20=-M20, 0, K20-M20)),"-",(IF(K20-M20=-M20, 0, K20-M20))) -> 30 | O20: =IF(ISERROR(IF(N20-37=-37, "-", N20-37)),"-",(IF(N20-37=-37,"-",N20-37))) -> -7 | P20: 0 | Q20: =SUM(IF(B20=2,1,0),IF(D20=2,1,0),IF(E20=2,1,0),IF(F20=3,1,0),IF(H20=3,1,0),IF(I20=2,1,0),IF(J20=3,1,0)) -> 0 | R20: =SUM(IF(B20=3,1,0),IF(C20=2,1,0),IF(D20=3,1,0),IF(E20=3,1,0),IF(F20=4,1,0),IF(G20=2,1,0),IF(H20=4,1,0),IF(I20=3,1,0),IF(J20=4,1,0)) -> 1 | S20: =SUM(IF(B20=4,1,0),IF(C20=3,1,0),IF(D20=4,1,0),IF(E20=4,1,0),IF(F20=5,1,0),IF(G20=3,1,0),IF(H20=5,1,0),IF(I20=4,1,0),IF(J20=5,1,0)) -> 2 | T20: =SUM(IF(B20=5,1,0),IF(C20=4,1,0),IF(D20=5,1,0),IF(E20=5,1,0),IF(F20=6,1,0),IF(G20=4,1,0),IF(H20=6,1,0),IF(I20=5,1,0),IF(J20=6,1,0)) -> 4 | U20: =SUM(IF(B20=6,1,0),IF(C20=5,1,0),IF(D20=6,1,0),IF(E20=6,1,0),IF(F20=7,1,0),IF(G20=5,1,0),IF(H20=7,1,0),IF(I20=6,1,0),IF(J20=7,1,0),IF(B20=7,1,0),IF(C20=6,1,0),IF(D20=7,1,0),IF(E20=7,1,0),IF(F20=8,1,0),IF(G20=6,1,0),IF(H20=8,1,0),IF(I20=7,1,0),IF(J20=8,1,0),IF(B20=8,1,0),IF(C20=7,1,0),IF(D20=8,1,0),IF(E20=8,1,0),IF(F20=9,1,0),IF(G20=7,1,0),IF(H20=9,1,0),IF(I20=8,1,0),IF(J20=9,1,0)) -> 2 | V20: Team 1 Total | W20: =SUM(P10,P12,P18,P20) -> 4
A21: B. Harbour | B21: 4 | C21: 4 | D21: 3 | E21: 5 | F21: 7 | G21: 3 | H21: 5 | I21: 7 | J21: 6 | K21: =IF(SUM(B21:J21)=0,"-",SUM(B21:J21)) -> 44 | L21: =IF(ISERROR(IF(K21-37=-37, "-", K21-37)),"-",(IF(K21-37=-37,"-",K21-37))) -> 7 | M21: 16 | N21: =IF(ISERROR(IF(K21-M21=-M21, 0, K21-M21)),"-",(IF(K21-M21=-M21, 0, K21-M21))) -> 28 | O21: =IF(ISERROR(IF(N21-37=-37, "-", N21-37)),"-",(IF(N21-37=-37,"-",N21-37))) -> -9 | P21: 2 | Q21: =SUM(IF(B21=2,1,0),IF(D21=2,1,0),IF(E21=2,1,0),IF(F21=3,1,0),IF(H21=3,1,0),IF(I21=2,1,0),IF(J21=3,1,0)) -> 0 | R21: =SUM(IF(B21=3,1,0),IF(C21=2,1,0),IF(D21=3,1,0),IF(E21=3,1,0),IF(F21=4,1,0),IF(G21=2,1,0),IF(H21=4,1,0),IF(I21=3,1,0),IF(J21=4,1,0)) -> 1 | S21: =SUM(IF(B21=4,1,0),IF(C21=3,1,0),IF(D21=4,1,0),IF(E21=4,1,0),IF(F21=5,1,0),IF(G21=3,1,0),IF(H21=5,1,0),IF(I21=4,1,0),IF(J21=5,1,0)) -> 3 | T21: =SUM(IF(B21=5,1,0),IF(C21=4,1,0),IF(D21=5,1,0),IF(E21=5,1,0),IF(F21=6,1,0),IF(G21=4,1,0),IF(H21=6,1,0),IF(I21=5,1,0),IF(J21=6,1,0)) -> 3 | U21: =SUM(IF(B21=6,1,0),IF(C21=5,1,0),IF(D21=6,1,0),IF(E21=6,1,0),IF(F21=7,1,0),IF(G21=5,1,0),IF(H21=7,1,0),IF(I21=6,1,0),IF(J21=7,1,0),IF(B21=7,1,0),IF(C21=6,1,0),IF(D21=7,1,0),IF(E21=7,1,0),IF(F21=8,1,0),IF(G21=6,1,0),IF(H21=8,1,0),IF(I21=7,1,0),IF(J21=8,1,0),IF(B21=8,1,0),IF(C21=7,1,0),IF(D21=8,1,0),IF(E21=8,1,0),IF(F21=9,1,0),IF(G21=7,1,0),IF(H21=9,1,0),IF(I21=8,1,0),IF(J21=9,1,0)) -> 2 | V21: Team 4 Total | W21: =SUM(P11,P13,P19,P21) -> 4