A2: =MID(CELL("filename",A1),FIND("]",CELL("filename",A1))+1,LEN(CELL("filename",A1))-FIND("]",CELL("filename",A1))) -> Team Scores
A4: =Standings!$A$4 -> 2009
A5: FIRST HALF | M5: SECOND HALF
A6: Team 1
A7: Week | B7: 1 | C7: 2 | D7: 3 | E7: 4 | F7: 5 | G7: 6 | H7: 7 | I7: 8 | J7: 9 | K7: 10 | L7: Total | M7: 11 | N7: 12 | O7: 13 | P7: 14 | Q7: 15 | R7: 16 | S7: 17 | T7: 18 | U7: 19 | V7: 20 | W7: Total | X7: YTD | Y7: Win PCT | Z7: Win | AA7: Loss | AB7: Tie | AC7: Player Win Rank | AD7: 1st Half Team Rank | AE7: 2nd Half Team Rank | AF7: *Overall Team Rank
A8: ='R. Keeney'!$A$1 -> R. Keeney | B8: ='R. Keeney'!$O$10 -> 0 | C8: ='R. Keeney'!$O$11 -> 2 | D8: ='R. Keeney'!$O$12 -> 2 | E8: ='R. Keeney'!$O$13 -> 0 | F8: ='R. Keeney'!$O$14 -> 0 | G8: ='R. Keeney'!$O$21 -> 0 | H8: ='R. Keeney'!$O$22 -> 0 | I8: ='R. Keeney'!$O$23 -> 2 | J8: ='R. Keeney'!$O$24 -> 0 | K8: ='R. Keeney'!$O$25 -> 0 | L8: =SUM(B8:K8) -> 6 | M8: ='R. Keeney'!$O$34 -> 2 | N8: ='R. Keeney'!$O$35 -> 2 | O8: ='R. Keeney'!$O$36 -> 2 | P8: ='R. Keeney'!$O$37 -> 0 | Q8: ='R. Keeney'!$O$38 -> 0 | R8: ='R. Keeney'!$O$45 -> A | S8: ='R. Keeney'!$O$46 -> 0 | T8: ='R. Keeney'!$O$47 -> 0 | U8: ='R. Keeney'!$O$48 -> 2 | V8: ='R. Keeney'!$O$49 -> 2 | W8: =SUM(M8:V8) -> 10 | X8: =L8+W8 -> 16 | Y8: =IF(ISERROR(Z8/(SUM(Z8:AB8))),"0",(Z8/(SUM(Z8:AB8)))) -> 0.42105263157894735 | Z8: =COUNTIF(B8:K8,2)+COUNTIF(M8:V8,2) -> 8 | AA8: =COUNTIF(B8:K8,0)+COUNTIF(M8:V8,0) -> 11 | AB8: =COUNTIF(B8:K8,1)+COUNTIF(M8:V8,1) -> 0 | AC8: =AQ33 -> 14 | AD8: =AQ8 -> 6 | AE8: =AQ16 -> 4 | AF8: =AQ24 -> 5 | AJ8: =$L$12 -> 30 | AL8: =COUNTIF(B8:K11,2) -> 12 | AN8: =COUNTIF(B8:K11,1) -> 6 | AP8: =VLOOKUP(AO8,$AI$8:$AJ$13,2,FALSE)+(VLOOKUP(AO8,$AK$8:$AL$13,2,FALSE)/100)+(VLOOKUP(AO8,$AM$8:$AN$13,2,FALSE)/1000) -> 30.126000000000001 | AQ8: =RANK(AJ8,$AJ$8:$AJ$13) -> 6 | AR8: =RANK(AP8,$AP$8:$AP$13) -> 6 | AS8: =OFFSET(AI$8,MATCH(SMALL(AQ$8:AQ$13,ROW()-ROW(AS$8)+1),AQ$8:AQ$13,0)-1,0) ->  | AT8: =OFFSET(AJ8,MATCH(AU8,$AJ$8:$AJ$13,0)-1,-1,1,1) ->  | AU8: =MAX(AJ8:AJ13) -> 55
A9: ='Matt McComas'!$A$1 -> Matt McComas | B9: ='Matt McComas'!$O$10 -> 0 | C9: ='Matt McComas'!$O$11 -> 0 | D9: ='Matt McComas'!$O$12 -> 0 | E9: ='Matt McComas'!$O$13 -> 0 | F9: ='Matt McComas'!$O$14 -> 0 | G9: ='Matt McComas'!$O$21 -> 0 | H9: ='Matt McComas'!$O$22 -> 2 | I9: ='Matt McComas'!$O$23 -> 0 | J9: ='Matt McComas'!$O$24 -> 1 | K9: ='Matt McComas'!$O$25 -> 2 | L9: =SUM(B9:K9) -> 5 | M9: ='Matt McComas'!$O$34 -> 0 | N9: ='Matt McComas'!$O$35 -> A | O9: ='Matt McComas'!$O$36 -> 2 | P9: ='Matt McComas'!$O$37 -> 0 | Q9: ='Matt McComas'!$O$38 -> 1 | R9: ='Matt McComas'!$O$45 -> 0 | S9: ='Matt McComas'!$O$46 -> 0 | T9: ='Matt McComas'!$O$47 -> 2 | U9: ='Matt McComas'!$O$48 -> 1 | V9: ='Matt McComas'!$O$49 -> 2 | W9: =SUM(M9:V9) -> 8 | X9: =L9+W9 -> 13 | Y9: =IF(ISERROR(Z9/(SUM(Z9:AB9))),"0",(Z9/(SUM(Z9:AB9)))) -> 0.26315789473684209 | Z9: =COUNTIF(B9:K9,2)+COUNTIF(M9:V9,2) -> 5 | AA9: =COUNTIF(B9:K9,0)+COUNTIF(M9:V9,0) -> 11 | AB9: =COUNTIF(B9:K9,1)+COUNTIF(M9:V9,1) -> 3 | AC9: =AQ34 -> 23 | AJ9: =$L$20 -> 45 | AL9: =COUNTIF(B16:K19,2) -> 20 | AN9: =COUNTIF(B16:K19,1) -> 5 | AP9: =VLOOKUP(AO9,$AI$8:$AJ$13,2,FALSE)+(VLOOKUP(AO9,$AK$8:$AL$13,2,FALSE)/100)+(VLOOKUP(AO9,$AM$8:$AN$13,2,FALSE)/1000) -> 45.204999999999998 | AQ9: =RANK(AJ9,$AJ$8:$AJ$13) -> 2 | AR9: =RANK(AP9,$AP$8:$AP$13) -> 2 | AS9: =OFFSET(AI$8,MATCH(SMALL(AQ$8:AQ$13,ROW()-ROW(AS$8)+1),AQ$8:AQ$13,0)-1,0) -> 
A10: ='R. Adkins'!$A$1 -> R. Adkins | B10: ='R. Adkins'!$O$10 -> 0 | C10: ='R. Adkins'!$O$11 -> 0 | D10: ='R. Adkins'!$O$12 -> 2 | E10: ='R. Adkins'!$O$13 -> 0 | F10: ='R. Adkins'!$O$14 -> 2 | G10: ='R. Adkins'!$O$21 -> 0 | H10: ='R. Adkins'!$O$22 -> 2 | I10: ='R. Adkins'!$O$23 -> 1 | J10: ='R. Adkins'!$O$24 -> 0 | K10: ='R. Adkins'!$O$25 -> 0 | L10: =SUM(B10:K10) -> 7 | M10: ='R. Adkins'!$O$34 -> 2 | N10: ='R. Adkins'!$O$35 -> A | O10: ='R. Adkins'!$O$36 -> 1 | P10: ='R. Adkins'!$O$37 -> 2 | Q10: ='R. Adkins'!$O$38 -> 0 | R10: ='R. Adkins'!$O$45 -> 1 | S10: ='R. Adkins'!$O$46 -> 2 | T10: ='R. Adkins'!$O$47 -> 2 | U10: ='R. Adkins'!$O$48 -> 1 | V10: ='R. Adkins'!$O$49 -> 1 | W10: =SUM(M10:V10) -> 12 | X10: =L10+W10 -> 19 | Y10: =IF(ISERROR(Z10/(SUM(Z10:AB10))),"0",(Z10/(SUM(Z10:AB10)))) -> 0.36842105263157893 | Z10: =COUNTIF(B10:K10,2)+COUNTIF(M10:V10,2) -> 7 | AA10: =COUNTIF(B10:K10,0)+COUNTIF(M10:V10,0) -> 7 | AB10: =COUNTIF(B10:K10,1)+COUNTIF(M10:V10,1) -> 5 | AC10: =AQ35 -> 16 | AJ10: =$L$28 -> 34 | AL10: =COUNTIF(B24:K27,2) -> 14 | AN10: =COUNTIF(B24:K27,1) -> 6 | AP10: =VLOOKUP(AO10,$AI$8:$AJ$13,2,FALSE)+(VLOOKUP(AO10,$AK$8:$AL$13,2,FALSE)/100)+(VLOOKUP(AO10,$AM$8:$AN$13,2,FALSE)/1000) -> 34.146000000000001 | AQ10: =RANK(AJ10,$AJ$8:$AJ$13) -> 4 | AR10: =RANK(AP10,$AP$8:$AP$13) -> 5 | AS10: =OFFSET(AI$8,MATCH(SMALL(AQ$8:AQ$13,ROW()-ROW(AS$8)+1),AQ$8:AQ$13,0)-1,0) -> 
A11: ='L. Baumgarner'!$A$1 -> L. Baumgarner | B11: ='L. Baumgarner'!$O$10 -> 1 | C11: ='L. Baumgarner'!$O$11 -> 1 | D11: ='L. Baumgarner'!$O$12 -> 1 | E11: ='L. Baumgarner'!$O$13 -> 0 | F11: ='L. Baumgarner'!$O$14 -> 2 | G11: ='L. Baumgarner'!$O$21 -> 0 | H11: ='L. Baumgarner'!$O$22 -> 2 | I11: ='L. Baumgarner'!$O$23 -> 2 | J11: ='L. Baumgarner'!$O$24 -> 2 | K11: ='L. Baumgarner'!$O$25 -> 1 | L11: =SUM(B11:K11) -> 12 | M11: ='L. Baumgarner'!$O$34 -> 2 | N11: ='L. Baumgarner'!$O$35 -> 1 | O11: ='L. Baumgarner'!$O$36 -> 1 | P11: ='L. Baumgarner'!$O$37 -> 0 | Q11: ='L. Baumgarner'!$O$38 -> 0 | R11: ='L. Baumgarner'!$O$45 -> 0 | S11: ='L. Baumgarner'!$O$46 -> 2 | T11: ='L. Baumgarner'!$O$47 -> 0 | U11: ='L. Baumgarner'!$O$48 -> 2 | V11: ='L. Baumgarner'!$O$49 -> 1 | W11: =SUM(M11:V11) -> 9 | X11: =L11+W11 -> 21 | Y11: =IF(ISERROR(Z11/(SUM(Z11:AB11))),"0",(Z11/(SUM(Z11:AB11)))) -> 0.35 | Z11: =COUNTIF(B11:K11,2)+COUNTIF(M11:V11,2) -> 7 | AA11: =COUNTIF(B11:K11,0)+COUNTIF(M11:V11,0) -> 6 | AB11: =COUNTIF(B11:K11,1)+COUNTIF(M11:V11,1) -> 7 | AC11: =AQ36 -> 15 | AJ11: =$L$36 -> 35 | AL11: =COUNTIF(B32:K35,2) -> 12 | AN11: =COUNTIF(D32:M35,1) -> 11 | AP11: =VLOOKUP(AO11,$AI$8:$AJ$13,2,FALSE)+(VLOOKUP(AO11,$AK$8:$AL$13,2,FALSE)/100)+(VLOOKUP(AO11,$AM$8:$AN$13,2,FALSE)/1000) -> 35.131 | AQ11: =RANK(AJ11,$AJ$8:$AJ$13) -> 3 | AR11: =RANK(AP11,$AP$8:$AP$13) -> 3 | AS11: =OFFSET(AI$8,MATCH(SMALL(AQ$8:AQ$13,ROW()-ROW(AS$8)+1),AQ$8:AQ$13,0)-1,0) -> 
B12: =SUM(B8:B11) -> 1 | C12: =SUM(C8:C11) -> 3 | D12: =SUM(D8:D11) -> 5 | E12: =SUM(E8:E11) -> 0 | F12: =SUM(F8:F11) -> 4 | G12: =SUM(G8:G11) -> 0 | H12: =SUM(H8:H11) -> 6 | I12: =SUM(I8:I11) -> 5 | J12: =SUM(J8:J11) -> 3 | K12: =SUM(K8:K11) -> 3 | L12: =SUM(B12:K12) -> 30 | M12: =SUM(M8:M11) -> 6 | N12: =SUM(N8:N11) -> 3 | O12: =SUM(O8:O11) -> 6 | P12: =SUM(P8:P11) -> 2 | Q12: =SUM(Q8:Q11) -> 1 | R12: =SUM(R8:R11) -> 1 | S12: =SUM(S8:S11) -> 4 | T12: =SUM(T8:T11) -> 4 | U12: =SUM(U8:U11) -> 6 | V12: =SUM(V8:V11) -> 6 | W12: =SUM(M12:V12) -> 39 | X12: =L12+W12 -> 69 | Y12: =IF(ISERROR(AVERAGE(Y8:Y11)),"0",AVERAGE(Y8:Y11)) -> 0.35065789473684206 | Z12: =SUM(Z8:Z11) -> 27 | AA12: =SUM(AA8:AA11) -> 35 | AB12: =SUM(AB8:AB11) -> 15 | AJ12: =$L$44 -> 55 | AL12: =COUNTIF(B40:K43,2) -> 26 | AN12: =COUNTIF(B40:K43,1) -> 3 | AP12: =VLOOKUP(AO12,$AI$8:$AJ$13,2,FALSE)+(VLOOKUP(AO12,$AK$8:$AL$13,2,FALSE)/100)+(VLOOKUP(AO12,$AM$8:$AN$13,2,FALSE)/1000) -> 55.262999999999998 | AQ12: =RANK(AJ12,$AJ$8:$AJ$13) -> 1 | AR12: =RANK(AP12,$AP$8:$AP$13) -> 1 | AS12: =OFFSET(AI$8,MATCH(SMALL(AQ$8:AQ$13,ROW()-ROW(AS$8)+1),AQ$8:AQ$13,0)-1,0) -> 
AJ13: =$L$52 -> 34 | AL13: =COUNTIF(B48:K51,2) -> 16 | AN13: =COUNTIF(B48:K51,1) -> 2 | AP13: =VLOOKUP(AO13,$AI$8:$AJ$13,2,FALSE)+(VLOOKUP(AO13,$AK$8:$AL$13,2,FALSE)/100)+(VLOOKUP(AO13,$AM$8:$AN$13,2,FALSE)/1000) -> 34.161999999999999 | AQ13: =RANK(AJ13,$AJ$8:$AJ$13) -> 4 | AR13: =RANK(AP13,$AP$8:$AP$13) -> 4 | AS13: =OFFSET(AI$8,MATCH(SMALL(AQ$8:AQ$13,ROW()-ROW(AS$8)+1),AQ$8:AQ$13,0)-1,0) -> 
A14: Team 2
A15: Week | B15: 1 | C15: 2 | D15: 3 | E15: 4 | F15: 5 | G15: 6 | H15: 7 | I15: 8 | J15: 9 | K15: 10 | L15: Total | M15: 11 | N15: 12 | O15: 13 | P15: 14 | Q15: 15 | R15: 16 | S15: 17 | T15: 18 | U15: 19 | V15: 20 | W15: Total | X15: YTD | Y15: Win PCT | Z15: Win | AA15: Loss | AB15: Tie | AC15: Player Win Rank | AD15: 1st Half Team Rank | AE15: 2nd Half Team Rank | AF15: *Overall Team Rank
A16: ='D. Smith'!$A$1 -> D. Smith | B16: ='D. Smith'!$O$10 -> 2 | C16: ='D. Smith'!$O$11 -> 1 | D16: ='D. Smith'!$O$12 -> 1 | E16: ='D. Smith'!$O$13 -> 0 | F16: ='D. Smith'!$O$14 -> 0 | G16: ='D. Smith'!$O$21 -> 2 | H16: ='D. Smith'!$O$22 -> 0 | I16: ='D. Smith'!$O$23 -> 2 | J16: ='D. Smith'!$O$24 -> 1 | K16: ='D. Smith'!$O$25 -> 2 | L16: =SUM(B16:K16) -> 11 | M16: ='D. Smith'!$O$34 -> 0 | N16: ='D. Smith'!$O$35 -> 2 | O16: ='D. Smith'!$O$36 -> 0 | P16: ='D. Smith'!$O$37 -> 0 | Q16: ='D. Smith'!$O$38 -> 2 | R16: ='D. Smith'!$O$45 -> 1 | S16: ='D. Smith'!$O$46 -> 0 | T16: ='D. Smith'!$O$47 -> 0 | U16: ='D. Smith'!$O$48 -> 2 | V16: ='D. Smith'!$O$49 -> 0 | W16: =SUM(M16:V16) -> 7 | X16: =L16+W16 -> 18 | Y16: =IF(ISERROR(Z16/(SUM(Z16:AB16))),"0",(Z16/(SUM(Z16:AB16)))) -> 0.35 | Z16: =COUNTIF(B16:K16,2)+COUNTIF(M16:V16,2) -> 7 | AA16: =COUNTIF(B16:K16,0)+COUNTIF(M16:V16,0) -> 9 | AB16: =COUNTIF(B16:K16,1)+COUNTIF(M16:V16,1) -> 4 | AC16: =AQ37 -> 18 | AD16: =AQ9 -> 2 | AE16: =AQ17 -> 2 | AF16: =AQ25 -> 2 | AJ16: =$W$12 -> 39 | AL16: =COUNTIF(M8:V11,2) -> 15 | AN16: =COUNTIF(M8:V11,1) -> 9 | AP16: =VLOOKUP(AO16,$AI$16:$AJ$21,2,FALSE)+(VLOOKUP(AO16,$AK$16:$AL$21,2,FALSE)/100)+(VLOOKUP(AO16,$AM$16:$AN$21,2,FALSE)/1000) -> 39.158999999999999 | AQ16: =RANK(AJ16,$AJ$16:$AJ$21) -> 4 | AR16: =RANK(AP16,$AP$16:$AP$21) -> 4 | AS16: =OFFSET(AI$8,MATCH(SMALL(AQ$16:AQ$21,ROW()-ROW(AS$16)+1),AQ$16:AQ$21,0)-1,0) ->  | AT16: =OFFSET(AJ16,MATCH(AU16,$AJ$16:$AJ$21,0)-1,-1,1,1) ->  | AU16: =MAX(AJ16:AJ21) -> 48
A17: ='G. White'!$A$1 -> G. White | B17: ='G. White'!$O$10 -> 2 | C17: ='G. White'!$O$11 -> 2 | D17: ='G. White'!$O$12 -> 2 | E17: ='G. White'!$O$13 -> 2 | F17: ='G. White'!$O$14 -> 2 | G17: ='G. White'!$O$21 -> 2 | H17: ='G. White'!$O$22 -> 0 | I17: ='G. White'!$O$23 -> 2 | J17: ='G. White'!$O$24 -> 1 | K17: ='G. White'!$O$25 -> 2 | L17: =SUM(B17:K17) -> 17 | M17: ='G. White'!$O$34 -> 2 | N17: ='G. White'!$O$35 -> 2 | O17: ='G. White'!$O$36 -> 0 | P17: ='G. White'!$O$37 -> 2 | Q17: ='G. White'!$O$38 -> 2 | R17: ='G. White'!$O$45 -> 2 | S17: ='G. White'!$O$46 -> 2 | T17: ='G. White'!$O$47 -> 0 | U17: ='G. White'!$O$48 -> 2 | V17: ='G. White'!$O$49 -> 1 | W17: =SUM(M17:V17) -> 15 | X17: =L17+W17 -> 32 | Y17: =IF(ISERROR(Z17/(SUM(Z17:AB17))),"0",(Z17/(SUM(Z17:AB17)))) -> 0.75 | Z17: =COUNTIF(B17:K17,2)+COUNTIF(M17:V17,2) -> 15 | AA17: =COUNTIF(B17:K17,0)+COUNTIF(M17:V17,0) -> 3 | AB17: =COUNTIF(B17:K17,1)+COUNTIF(M17:V17,1) -> 2 | AC17: =AQ38 -> 1 | AJ17: =$W$20 -> 43 | AL17: =COUNTIF(M16:V19,2) -> 20 | AN17: =COUNTIF(M16:V19,1) -> 3 | AP17: =VLOOKUP(AO17,$AI$16:$AJ$21,2,FALSE)+(VLOOKUP(AO17,$AK$16:$AL$21,2,FALSE)/100)+(VLOOKUP(AO17,$AM$16:$AN$21,2,FALSE)/1000) -> 43.203000000000003 | AQ17: =RANK(AJ17,$AJ$16:$AJ$21) -> 2 | AR17: =RANK(AP17,$AP$16:$AP$21) -> 2 | AS17: =OFFSET(AI$8,MATCH(SMALL(AQ$16:AQ$21,ROW()-ROW(AS$16)+1),AQ$16:AQ$21,0)-1,0) -> 
A18: ='G. Taylor'!$A$1 -> G. Taylor | B18: ='G. Taylor'!$O$10 -> 2 | C18: ='G. Taylor'!$O$11 -> 0 | D18: ='G. Taylor'!$O$12 -> 0 | E18: ='G. Taylor'!$O$13 -> 0 | F18: ='G. Taylor'!$O$14 -> 2 | G18: ='G. Taylor'!$O$21 -> 2 | H18: ='G. Taylor'!$O$22 -> 0 | I18: ='G. Taylor'!$O$23 -> 0 | J18: ='G. Taylor'!$O$24 -> 2 | K18: ='G. Taylor'!$O$25 -> 2 | L18: =SUM(B18:K18) -> 10 | M18: ='G. Taylor'!$O$34 -> 0 | N18: ='G. Taylor'!$O$35 -> 0 | O18: ='G. Taylor'!$O$36 -> 2 | P18: ='G. Taylor'!$O$37 -> 0 | Q18: ='G. Taylor'!$O$38 -> 0 | R18: ='G. Taylor'!$O$45 -> 1 | S18: ='G. Taylor'!$O$46 -> 2 | T18: ='G. Taylor'!$O$47 -> 2 | U18: ='G. Taylor'!$O$48 -> 0 | V18: ='G. Taylor'!$O$49 -> 2 | W18: =SUM(M18:V18) -> 9 | X18: =L18+W18 -> 19 | Y18: =IF(ISERROR(Z18/(SUM(Z18:AB18))),"0",(Z18/(SUM(Z18:AB18)))) -> 0.45 | Z18: =COUNTIF(B18:K18,2)+COUNTIF(M18:V18,2) -> 9 | AA18: =COUNTIF(B18:K18,0)+COUNTIF(M18:V18,0) -> 10 | AB18: =COUNTIF(B18:K18,1)+COUNTIF(M18:V18,1) -> 1 | AC18: =AQ39 -> 12 | AJ18: =$W$28 -> 29 | AL18: =COUNTIF(M24:V27,2) -> 12 | AN18: =COUNTIF(M24:V27,1) -> 5 | AP18: =VLOOKUP(AO18,$AI$16:$AJ$21,2,FALSE)+(VLOOKUP(AO18,$AK$16:$AL$21,2,FALSE)/100)+(VLOOKUP(AO18,$AM$16:$AN$21,2,FALSE)/1000) -> 29.125 | AQ18: =RANK(AJ18,$AJ$16:$AJ$21) -> 6 | AR18: =RANK(AP18,$AP$16:$AP$21) -> 6 | AS18: =OFFSET(AI$8,MATCH(SMALL(AQ$16:AQ$21,ROW()-ROW(AS$16)+1),AQ$16:AQ$21,0)-1,0) -> 
A19: ='B. Meadows'!$A$1 -> B. Meadows | B19: ='B. Meadows'!$O$10 -> A | C19: ='B. Meadows'!$O$11 -> 0 | D19: ='B. Meadows'!$O$12 -> 0 | E19: ='B. Meadows'!$O$13 -> 1 | F19: ='B. Meadows'!$O$14 -> 0 | G19: ='B. Meadows'!$O$21 -> 2 | H19: ='B. Meadows'!$O$22 -> 0 | I19: ='B. Meadows'!$O$23 -> 2 | J19: ='B. Meadows'!$O$24 -> 2 | K19: ='B. Meadows'!$O$25 -> A | L19: =SUM(B19:K19) -> 7 | M19: ='B. Meadows'!$O$34 -> 0 | N19: ='B. Meadows'!$O$35 -> 0 | O19: ='B. Meadows'!$O$36 -> 2 | P19: ='B. Meadows'!$O$37 -> A | Q19: ='B. Meadows'!$O$38 -> 2 | R19: ='B. Meadows'!$O$45 -> 2 | S19: ='B. Meadows'!$O$46 -> 2 | T19: ='B. Meadows'!$O$47 -> 0 | U19: ='B. Meadows'!$O$48 -> 2 | V19: ='B. Meadows'!$O$49 -> 2 | W19: =SUM(M19:V19) -> 12 | X19: =L19+W19 -> 19 | Y19: =IF(ISERROR(Z19/(SUM(Z19:AB19))),"0",(Z19/(SUM(Z19:AB19)))) -> 0.52941176470588236 | Z19: =COUNTIF(B19:K19,2)+COUNTIF(M19:V19,2) -> 9 | AA19: =COUNTIF(B19:K19,0)+COUNTIF(M19:V19,0) -> 7 | AB19: =COUNTIF(B19:K19,1)+COUNTIF(M19:V19,1) -> 1 | AC19: =AQ40 -> 10 | AJ19: =$W$36 -> 35 | AL19: =COUNTIF(M32:V35,2) -> 15 | AN19: =COUNTIF(M32:V35,1) -> 5 | AP19: =VLOOKUP(AO19,$AI$16:$AJ$21,2,FALSE)+(VLOOKUP(AO19,$AK$16:$AL$21,2,FALSE)/100)+(VLOOKUP(AO19,$AM$16:$AN$21,2,FALSE)/1000) -> 35.155000000000001 | AQ19: =RANK(AJ19,$AJ$16:$AJ$21) -> 5 | AR19: =RANK(AP19,$AP$16:$AP$21) -> 5 | AS19: =OFFSET(AI$8,MATCH(SMALL(AQ$16:AQ$21,ROW()-ROW(AS$16)+1),AQ$16:AQ$21,0)-1,0) -> 
B20: =SUM(B16:B19) -> 6 | C20: =SUM(C16:C19) -> 3 | D20: =SUM(D16:D19) -> 3 | E20: =SUM(E16:E19) -> 3 | F20: =SUM(F16:F19) -> 4 | G20: =SUM(G16:G19) -> 8 | H20: =SUM(H16:H19) -> 0 | I20: =SUM(I16:I19) -> 6 | J20: =SUM(J16:J19) -> 6 | K20: =SUM(K16:K19) -> 6 | L20: =SUM(B20:K20) -> 45 | M20: =SUM(M16:M19) -> 2 | N20: =SUM(N16:N19) -> 4 | O20: =SUM(O16:O19) -> 4 | P20: =SUM(P16:P19) -> 2 | Q20: =SUM(Q16:Q19) -> 6 | R20: =SUM(R16:R19) -> 6 | S20: =SUM(S16:S19) -> 6 | T20: =SUM(T16:T19) -> 2 | U20: =SUM(U16:U19) -> 6 | V20: =SUM(V16:V19) -> 5 | W20: =SUM(M20:V20) -> 43 | X20: =L20+W20 -> 88 | Y20: =IF(ISERROR(AVERAGE(Y16:Y19)),"0",AVERAGE(Y16:Y19)) -> 0.51985294117647063 | Z20: =SUM(Z16:Z19) -> 40 | AA20: =SUM(AA16:AA19) -> 29 | AB20: =SUM(AB16:AB19) -> 8 | AJ20: =$W$44 -> 40 | AL20: =COUNTIF(M40:V43,2) -> 17 | AN20: =COUNTIF(M40:V43,1) -> 6 | AP20: =VLOOKUP(AO20,$AI$16:$AJ$21,2,FALSE)+(VLOOKUP(AO20,$AK$16:$AL$21,2,FALSE)/100)+(VLOOKUP(AO20,$AM$16:$AN$21,2,FALSE)/1000) -> 40.176000000000002 | AQ20: =RANK(AJ20,$AJ$16:$AJ$21) -> 3 | AR20: =RANK(AP20,$AP$16:$AP$21) -> 3 | AS20: =OFFSET(AI$8,MATCH(SMALL(AQ$16:AQ$21,ROW()-ROW(AS$16)+1),AQ$16:AQ$21,0)-1,0) -> 
AJ21: =$W$52 -> 48 | AL21: =COUNTIF(M48:V51,2) -> 22 | AN21: =COUNTIF(M48:V51,1) -> 4 | AP21: =VLOOKUP(AO21,$AI$16:$AJ$21,2,FALSE)+(VLOOKUP(AO21,$AK$16:$AL$21,2,FALSE)/100)+(VLOOKUP(AO21,$AM$16:$AN$21,2,FALSE)/1000) -> 48.223999999999997 | AQ21: =RANK(AJ21,$AJ$16:$AJ$21) -> 1 | AR21: =RANK(AP21,$AP$16:$AP$21) -> 1 | AS21: =OFFSET(AI$8,MATCH(SMALL(AQ$16:AQ$21,ROW()-ROW(AS$16)+1),AQ$16:AQ$21,0)-1,0) -> 
A22: Team 3
A23: Week | B23: 1 | C23: 2 | D23: 3 | E23: 4 | F23: 5 | G23: 6 | H23: 7 | I23: 8 | J23: 9 | K23: 10 | L23: Total | M23: 11 | N23: 12 | O23: 13 | P23: 14 | Q23: 15 | R23: 16 | S23: 17 | T23: 18 | U23: 19 | V23: 20 | W23: Total | X23: YTD | Y23: Win PCT | Z23: Win | AA23: Loss | AB23: Tie | AC23: Player Win Rank | AD23: 1st Half Team Rank | AE23: 2nd Half Team Rank | AF23: *Overall Team Rank
A24: ='R. Ours'!$A$1 -> R. Ours | B24: ='R. Ours'!$O$10 -> 2 | C24: ='R. Ours'!$O$11 -> 0 | D24: ='R. Ours'!$O$12 -> 0 | E24: ='R. Ours'!$O$13 -> 2 | F24: ='R. Ours'!$O$14 -> 2 | G24: ='R. Ours'!$O$21 -> 1 | H24: ='R. Ours'!$O$22 -> 2 | I24: ='R. Ours'!$O$23 -> 0 | J24: ='R. Ours'!$O$24 -> A | K24: ='R. Ours'!$O$25 -> 0 | L24: =SUM(B24:K24) -> 9 | M24: ='R. Ours'!$O$34 -> 2 | N24: ='R. Ours'!$O$35 -> 0 | O24: ='R. Ours'!$O$36 -> 0 | P24: ='R. Ours'!$O$37 -> 0 | Q24: ='R. Ours'!$O$38 -> 0 | R24: ='R. Ours'!$O$45 -> 0 | S24: ='R. Ours'!$O$46 -> 2 | T24: ='R. Ours'!$O$47 -> 0 | U24: ='R. Ours'!$O$48 -> 2 | V24: ='R. Ours'!$O$49 -> 2 | W24: =SUM(M24:V24) -> 8 | X24: =L24+W24 -> 17 | Y24: =IF(ISERROR(Z24/(SUM(Z24:AB24))),"0",(Z24/(SUM(Z24:AB24)))) -> 0.42105263157894735 | Z24: =COUNTIF(B24:K24,2)+COUNTIF(M24:V24,2) -> 8 | AA24: =COUNTIF(B24:K24,0)+COUNTIF(M24:V24,0) -> 10 | AB24: =COUNTIF(B24:K24,1)+COUNTIF(M24:V24,1) -> 1 | AC24: =AQ41 -> 13 | AD24: =AQ10 -> 4 | AE24: =AQ18 -> 6 | AF24: =AQ26 -> 6 | AJ24: =$X$12 -> 69 | AL24: =$Z$12 -> 27 | AN24: =$AB$12 -> 15 | AP24: =VLOOKUP(AO24,$AI$24:$AJ$29,2,FALSE)+(VLOOKUP(AO24,$AK$24:$AL$29,2,FALSE)/100)+(VLOOKUP(AO24,$AM$24:$AN$29,2,FALSE)/1000) -> 69.284999999999997 | AQ24: =RANK(AJ24,$AJ$24:$AJ$29) -> 5 | AR24: =RANK(AP24,$AP$24:$AP$29) -> 5 | AS24: =OFFSET(AI$8,MATCH(SMALL(AQ$24:AQ$29,ROW()-ROW(AS$24)+1),AQ$24:AQ$29,0)-1,0) ->  | AT24: =OFFSET(AJ24,MATCH(AU24,$AJ$24:$AJ$29,0)-1,-1,1,1) ->  | AU24: =MAX(AJ24:AJ29) -> 95
A25: ='T. Proctor'!$A$1 -> T. Proctor | B25: ='T. Proctor'!$O$10 -> 1 | C25: ='T. Proctor'!$O$11 -> 2 | D25: ='T. Proctor'!$O$12 -> 2 | E25: ='T. Proctor'!$O$13 -> 2 | F25: ='T. Proctor'!$O$14 -> 0 | G25: ='T. Proctor'!$O$21 -> 1 | H25: ='T. Proctor'!$O$22 -> 0 | I25: ='T. Proctor'!$O$23 -> 0 | J25: ='T. Proctor'!$O$24 -> 2 | K25: ='T. Proctor'!$O$25 -> 0 | L25: =SUM(B25:K25) -> 10 | M25: ='T. Proctor'!$O$34 -> 0 | N25: ='T. Proctor'!$O$35 -> 2 | O25: ='T. Proctor'!$O$36 -> 2 | P25: ='T. Proctor'!$O$37 -> 2 | Q25: ='T. Proctor'!$O$38 -> 0 | R25: ='T. Proctor'!$O$45 -> 2 | S25: ='T. Proctor'!$O$46 -> 2 | T25: ='T. Proctor'!$O$47 -> 0 | U25: ='T. Proctor'!$O$48 -> 0 | V25: ='T. Proctor'!$O$49 -> 1 | W25: =SUM(M25:V25) -> 11 | X25: =L25+W25 -> 21 | Y25: =IF(ISERROR(Z25/(SUM(Z25:AB25))),"0",(Z25/(SUM(Z25:AB25)))) -> 0.45 | Z25: =COUNTIF(B25:K25,2)+COUNTIF(M25:V25,2) -> 9 | AA25: =COUNTIF(B25:K25,0)+COUNTIF(M25:V25,0) -> 8 | AB25: =COUNTIF(B25:K25,1)+COUNTIF(M25:V25,1) -> 3 | AC25: =AQ42 -> 11 | AJ25: =$X$20 -> 88 | AL25: =$Z$20 -> 40 | AN25: =$AB$20 -> 8 | AP25: =VLOOKUP(AO25,$AI$24:$AJ$29,2,FALSE)+(VLOOKUP(AO25,$AK$24:$AL$29,2,FALSE)/100)+(VLOOKUP(AO25,$AM$24:$AN$29,2,FALSE)/1000) -> 88.408000000000001 | AQ25: =RANK(AJ25,$AJ$24:$AJ$29) -> 2 | AR25: =RANK(AP25,$AP$24:$AP$29) -> 2 | AS25: =OFFSET(AI$8,MATCH(SMALL(AQ$24:AQ$29,ROW()-ROW(AS$24)+1),AQ$24:AQ$29,0)-1,0) -> 
A26: ='J. Landers'!$A$1 -> J. Landers | B26: ='J. Landers'!$O$10 -> 2 | C26: ='J. Landers'!$O$11 -> 2 | D26: ='J. Landers'!$O$12 -> 2 | E26: ='J. Landers'!$O$13 -> 2 | F26: ='J. Landers'!$O$14 -> 0 | G26: ='J. Landers'!$O$21 -> 0 | H26: ='J. Landers'!$O$22 -> 0 | I26: ='J. Landers'!$O$23 -> 1 | J26: ='J. Landers'!$O$24 -> 0 | K26: ='J. Landers'!$O$25 -> A | L26: =SUM(B26:K26) -> 9 | M26: ='J. Landers'!$O$34 -> 1 | N26: ='J. Landers'!$O$35 -> A | O26: ='J. Landers'!$O$36 -> 1 | P26: ='J. Landers'!$O$37 -> 0 | Q26: ='J. Landers'!$O$38 -> 2 | R26: ='J. Landers'!$O$45 -> A | S26: ='J. Landers'!$O$46 -> A | T26: ='J. Landers'!$O$47 -> 2 | U26: ='J. Landers'!$O$48 -> A | V26: ='J. Landers'!$O$49 -> 0 | W26: =SUM(M26:V26) -> 6 | X26: =L26+W26 -> 15 | Y26: =IF(ISERROR(Z26/(SUM(Z26:AB26))),"0",(Z26/(SUM(Z26:AB26)))) -> 0.4 | Z26: =COUNTIF(B26:K26,2)+COUNTIF(M26:V26,2) -> 6 | AA26: =COUNTIF(B26:K26,0)+COUNTIF(M26:V26,0) -> 6 | AB26: =COUNTIF(B26:K26,1)+COUNTIF(M26:V26,1) -> 3 | AC26: =AQ43 -> 19 | AJ26: =$X$28 -> 63 | AL26: =$Z$28 -> 26 | AN26: =$AB$28 -> 11 | AP26: =VLOOKUP(AO26,$AI$24:$AJ$29,2,FALSE)+(VLOOKUP(AO26,$AK$24:$AL$29,2,FALSE)/100)+(VLOOKUP(AO26,$AM$24:$AN$29,2,FALSE)/1000) -> 63.271000000000001 | AQ26: =RANK(AJ26,$AJ$24:$AJ$29) -> 6 | AR26: =RANK(AP26,$AP$24:$AP$29) -> 6 | AS26: =OFFSET(AI$8,MATCH(SMALL(AQ$24:AQ$29,ROW()-ROW(AS$24)+1),AQ$24:AQ$29,0)-1,0) -> 
A27: ='J. Dodrill'!$A$1 -> J. Dodrill | B27: ='J. Dodrill'!$O$10 -> 0 | C27: ='J. Dodrill'!$O$11 -> A | D27: ='J. Dodrill'!$O$12 -> 0 | E27: ='J. Dodrill'!$O$13 -> 0 | F27: ='J. Dodrill'!$O$14 -> 2 | G27: ='J. Dodrill'!$O$21 -> 1 | H27: ='J. Dodrill'!$O$22 -> 0 | I27: ='J. Dodrill'!$O$23 -> 0 | J27: ='J. Dodrill'!$O$24 -> 2 | K27: ='J. Dodrill'!$O$25 -> 1 | L27: =SUM(B27:K27) -> 6 | M27: ='J. Dodrill'!$O$34 -> 1 | N27: ='J. Dodrill'!$O$35 -> A | O27: ='J. Dodrill'!$O$36 -> 2 | P27: ='J. Dodrill'!$O$37 -> 0 | Q27: ='J. Dodrill'!$O$38 -> A | R27: ='J. Dodrill'!$O$45 -> 1 | S27: ='J. Dodrill'!$O$46 -> 0 | T27: ='J. Dodrill'!$O$47 -> 0 | U27: ='J. Dodrill'!$O$48 -> 0 | V27: ='J. Dodrill'!$O$49 -> A | W27: =SUM(M27:V27) -> 4 | X27: =L27+W27 -> 10 | Y27: =IF(ISERROR(Z27/(SUM(Z27:AB27))),"0",(Z27/(SUM(Z27:AB27)))) -> 0.1875 | Z27: =COUNTIF(B27:K27,2)+COUNTIF(M27:V27,2) -> 3 | AA27: =COUNTIF(B27:K27,0)+COUNTIF(M27:V27,0) -> 9 | AB27: =COUNTIF(B27:K27,1)+COUNTIF(M27:V27,1) -> 4 | AC27: =AQ44 -> 24 | AJ27: =$X$36 -> 70 | AL27: =$Z$36 -> 27 | AN27: =$AB$36 -> 16 | AP27: =VLOOKUP(AO27,$AI$24:$AJ$29,2,FALSE)+(VLOOKUP(AO27,$AK$24:$AL$29,2,FALSE)/100)+(VLOOKUP(AO27,$AM$24:$AN$29,2,FALSE)/1000) -> 70.286000000000001 | AQ27: =RANK(AJ27,$AJ$24:$AJ$29) -> 4 | AR27: =RANK(AP27,$AP$24:$AP$29) -> 4 | AS27: =OFFSET(AI$8,MATCH(SMALL(AQ$24:AQ$29,ROW()-ROW(AS$24)+1),AQ$24:AQ$29,0)-1,0) -> 
B28: =SUM(B24:B27) -> 5 | C28: =SUM(C24:C27) -> 4 | D28: =SUM(D24:D27) -> 4 | E28: =SUM(E24:E27) -> 6 | F28: =SUM(F24:F27) -> 4 | G28: =SUM(G24:G27) -> 3 | H28: =SUM(H24:H27) -> 2 | I28: =SUM(I24:I27) -> 1 | J28: =SUM(J24:J27) -> 4 | K28: =SUM(K24:K27) -> 1 | L28: =SUM(B28:K28) -> 34 | M28: =SUM(M24:M27) -> 4 | N28: =SUM(N24:N27) -> 2 | O28: =SUM(O24:O27) -> 5 | P28: =SUM(P24:P27) -> 2 | Q28: =SUM(Q24:Q27) -> 2 | R28: =SUM(R24:R27) -> 3 | S28: =SUM(S24:S27) -> 4 | T28: =SUM(T24:T27) -> 2 | U28: =SUM(U24:U27) -> 2 | V28: =SUM(V24:V27) -> 3 | W28: =SUM(M28:V28) -> 29 | X28: =L28+W28 -> 63 | Y28: =IF(ISERROR(AVERAGE(Y24:Y27)),"0",AVERAGE(Y24:Y27)) -> 0.36463815789473686 | Z28: =SUM(Z24:Z27) -> 26 | AA28: =SUM(AA24:AA27) -> 33 | AB28: =SUM(AB24:AB27) -> 11 | AJ28: =$X$44 -> 95 | AL28: =$Z$44 -> 43 | AN28: =$AB$44 -> 9 | AP28: =VLOOKUP(AO28,$AI$24:$AJ$29,2,FALSE)+(VLOOKUP(AO28,$AK$24:$AL$29,2,FALSE)/100)+(VLOOKUP(AO28,$AM$24:$AN$29,2,FALSE)/1000) -> 95.439000000000007 | AQ28: =RANK(AJ28,$AJ$24:$AJ$29) -> 1 | AR28: =RANK(AP28,$AP$24:$AP$29) -> 1 | AS28: =OFFSET(AI$8,MATCH(SMALL(AQ$24:AQ$29,ROW()-ROW(AS$24)+1),AQ$24:AQ$29,0)-1,0) -> 
AJ29: =$X$52 -> 82 | AL29: =$Z$52 -> 38 | AN29: =$AB$52 -> 6 | AP29: =VLOOKUP(AO29,$AI$24:$AJ$29,2,FALSE)+(VLOOKUP(AO29,$AK$24:$AL$29,2,FALSE)/100)+(VLOOKUP(AO29,$AM$24:$AN$29,2,FALSE)/1000) -> 82.385999999999996 | AQ29: =RANK(AJ29,$AJ$24:$AJ$29) -> 3 | AR29: =RANK(AP29,$AP$24:$AP$29) -> 3 | AS29: =OFFSET(AI$8,MATCH(SMALL(AQ$24:AQ$29,ROW()-ROW(AS$24)+1),AQ$24:AQ$29,0)-1,0) -> 
A30: Team 4
A31: Week | B31: 1 | C31: 2 | D31: 3 | E31: 4 | F31: 5 | G31: 6 | H31: 7 | I31: 8 | J31: 9 | K31: 10 | L31: Total | M31: 11 | N31: 12 | O31: 13 | P31: 14 | Q31: 15 | R31: 16 | S31: 17 | T31: 18 | U31: 19 | V31: 20 | W31: Total | X31: YTD | Y31: Win PCT | Z31: Win | AA31: Loss | AB31: Tie | AC31: Player Win Rank | AD31: 1st Half Team Rank | AE31: 2nd Half Team Rank | AF31: *Overall Team Rank
A32: ='V. Bunn'!$A$1 -> V. Bunn | B32: ='V. Bunn'!$O$10 -> 0 | C32: ='V. Bunn'!$O$11 -> 2 | D32: ='V. Bunn'!$O$12 -> 0 | E32: ='V. Bunn'!$O$13 -> 2 | F32: ='V. Bunn'!$O$14 -> 0 | G32: ='V. Bunn'!$O$21 -> 1 | H32: ='V. Bunn'!$O$22 -> 2 | I32: ='V. Bunn'!$O$23 -> 0 | J32: ='V. Bunn'!$O$24 -> 1 | K32: ='V. Bunn'!$O$25 -> 1 | L32: =SUM(B32:K32) -> 9 | M32: ='V. Bunn'!$O$34 -> A | N32: ='V. Bunn'!$O$35 -> 0 | O32: ='V. Bunn'!$O$36 -> 0 | P32: ='V. Bunn'!$O$37 -> 2 | Q32: ='V. Bunn'!$O$38 -> 2 | R32: ='V. Bunn'!$O$45 -> 2 | S32: ='V. Bunn'!$O$46 -> 2 | T32: ='V. Bunn'!$O$47 -> 2 | U32: ='V. Bunn'!$O$48 -> 0 | V32: ='V. Bunn'!$O$49 -> 2 | W32: =SUM(M32:V32) -> 12 | X32: =L32+W32 -> 21 | Y32: =IF(ISERROR(Z32/(SUM(Z32:AB32))),"0",(Z32/(SUM(Z32:AB32)))) -> 0.47368421052631576 | Z32: =COUNTIF(B32:K32,2)+COUNTIF(M32:V32,2) -> 9 | AA32: =COUNTIF(B32:K32,0)+COUNTIF(M32:V32,0) -> 7 | AB32: =COUNTIF(B32:K32,1)+COUNTIF(M32:V32,1) -> 3 | AC32: =AQ45 -> 9 | AD32: =AQ11 -> 3 | AE32: =AQ19 -> 5 | AF32: =AQ27 -> 4
A33: ='S. Jones'!$A$1 -> S. Jones | B33: ='S. Jones'!$O$10 -> 1 | C33: ='S. Jones'!$O$11 -> 1 | D33: ='S. Jones'!$O$12 -> 2 | E33: ='S. Jones'!$O$13 -> 0 | F33: ='S. Jones'!$O$14 -> 2 | G33: ='S. Jones'!$O$21 -> A | H33: ='S. Jones'!$O$22 -> 2 | I33: ='S. Jones'!$O$23 -> 2 | J33: ='S. Jones'!$O$24 -> 1 | K33: ='S. Jones'!$O$25 -> 2 | L33: =SUM(B33:K33) -> 13 | M33: ='S. Jones'!$O$34 -> 2 | N33: ='S. Jones'!$O$35 -> 0 | O33: ='S. Jones'!$O$36 -> 0 | P33: ='S. Jones'!$O$37 -> 0 | Q33: ='S. Jones'!$O$38 -> 0 | R33: ='S. Jones'!$O$45 -> 0 | S33: ='S. Jones'!$O$46 -> 0 | T33: ='S. Jones'!$O$47 -> 0 | U33: ='S. Jones'!$O$48 -> 0 | V33: ='S. Jones'!$O$49 -> 0 | W33: =SUM(M33:V33) -> 2 | X33: =L33+W33 -> 15 | Y33: =IF(ISERROR(Z33/(SUM(Z33:AB33))),"0",(Z33/(SUM(Z33:AB33)))) -> 0.31578947368421051 | Z33: =COUNTIF(B33:K33,2)+COUNTIF(M33:V33,2) -> 6 | AA33: =COUNTIF(B33:K33,0)+COUNTIF(M33:V33,0) -> 10 | AB33: =COUNTIF(B33:K33,1)+COUNTIF(M33:V33,1) -> 3 | AC33: =AQ46 -> 22 | AI33: =A8 ->  | AJ33: =Z8 -> 8 | AK33: =AI33 ->  | AL33: =AB8 -> 0 | AM33: =AI33 ->  | AN33: =AA8 -> 11 | AO33: =AI33 ->  | AP33: =VLOOKUP(AO33,$AI$33:$AJ$56,2,FALSE)+(VLOOKUP(AO33,$AK$33:$AL$56,2,FALSE)/10000)-(VLOOKUP(AO33,$AM$33:$AN$56,2,FALSE)/1000) -> 7.9889999999999999 | AQ33: =IF(ISERROR(RANK(AP33,$AP$33:$AP$56)),"-",RANK(AP33,$AP$33:$AP$56)) -> 14
A34: ='C. Edwards'!$A$1 -> C. Edwards | B34: ='C. Edwards'!$O$10 -> 0 | C34: ='C. Edwards'!$O$11 -> 0 | D34: ='C. Edwards'!$O$12 -> 0 | E34: ='C. Edwards'!$O$13 -> 2 | F34: ='C. Edwards'!$O$14 -> 1 | G34: ='C. Edwards'!$O$21 -> 2 | H34: ='C. Edwards'!$O$22 -> 0 | I34: ='C. Edwards'!$O$23 -> 1 | J34: ='C. Edwards'!$O$24 -> 0 | K34: ='C. Edwards'!$O$25 -> 0 | L34: =SUM(B34:K34) -> 6 | M34: ='C. Edwards'!$O$34 -> 1 | N34: ='C. Edwards'!$O$35 -> 2 | O34: ='C. Edwards'!$O$36 -> 1 | P34: ='C. Edwards'!$O$37 -> 2 | Q34: ='C. Edwards'!$O$38 -> 0 | R34: ='C. Edwards'!$O$45 -> 2 | S34: ='C. Edwards'!$O$46 -> 0 | T34: ='C. Edwards'!$O$47 -> 0 | U34: ='C. Edwards'!$O$48 -> 2 | V34: ='C. Edwards'!$O$49 -> 1 | W34: =SUM(M34:V34) -> 11 | X34: =L34+W34 -> 17 | Y34: =IF(ISERROR(Z34/(SUM(Z34:AB34))),"0",(Z34/(SUM(Z34:AB34)))) -> 0.3 | Z34: =COUNTIF(B34:K34,2)+COUNTIF(M34:V34,2) -> 6 | AA34: =COUNTIF(B34:K34,0)+COUNTIF(M34:V34,0) -> 9 | AB34: =COUNTIF(B34:K34,1)+COUNTIF(M34:V34,1) -> 5 | AC34: =AQ47 -> 21 | AI34: =A9 ->  | AJ34: =Z9 -> 5 | AK34: =AI34 ->  | AL34: =AB9 -> 3 | AM34: =AI34 ->  | AN34: =AA9 -> 11 | AO34: =AI34 ->  | AP34: =VLOOKUP(AO34,$AI$33:$AJ$56,2,FALSE)+(VLOOKUP(AO34,$AK$33:$AL$56,2,FALSE)/10000)-(VLOOKUP(AO34,$AM$33:$AN$56,2,FALSE)/1000) -> 4.9893000000000001 | AQ34: =IF(ISERROR(RANK(AP34,$AP$33:$AP$56)),"-",RANK(AP34,$AP$33:$AP$56)) -> 23
A35: ='Mike McComas'!$A$1 -> Mike McComas | B35: ='Mike McComas'!$O$10 -> 2 | C35: ='Mike McComas'!$O$11 -> 2 | D35: ='Mike McComas'!$O$12 -> 1 | E35: ='Mike McComas'!$O$13 -> 1 | F35: ='Mike McComas'!$O$14 -> 0 | G35: ='Mike McComas'!$O$21 -> 1 | H35: ='Mike McComas'!$O$22 -> 0 | I35: ='Mike McComas'!$O$23 -> 0 | J35: ='Mike McComas'!$O$24 -> 0 | K35: ='Mike McComas'!$O$25 -> A | L35: =SUM(B35:K35) -> 7 | M35: ='Mike McComas'!$O$34 -> 1 | N35: ='Mike McComas'!$O$35 -> 0 | O35: ='Mike McComas'!$O$36 -> 1 | P35: ='Mike McComas'!$O$37 -> 2 | Q35: ='Mike McComas'!$O$38 -> 0 | R35: ='Mike McComas'!$O$45 -> A | S35: ='Mike McComas'!$O$46 -> 2 | T35: ='Mike McComas'!$O$47 -> 2 | U35: ='Mike McComas'!$O$48 -> 0 | V35: ='Mike McComas'!$O$49 -> 2 | W35: =SUM(M35:V35) -> 10 | X35: =L35+W35 -> 17 | Y35: =IF(ISERROR(Z35/(SUM(Z35:AB35))),"0",(Z35/(SUM(Z35:AB35)))) -> 0.33333333333333331 | Z35: =COUNTIF(B35:K35,2)+COUNTIF(M35:V35,2) -> 6 | AA35: =COUNTIF(B35:K35,0)+COUNTIF(M35:V35,0) -> 7 | AB35: =COUNTIF(B35:K35,1)+COUNTIF(M35:V35,1) -> 5 | AC35: =AQ48 -> 20 | AI35: =A10 ->  | AJ35: =Z10 -> 7 | AK35: =AI35 ->  | AL35: =AB10 -> 5 | AM35: =AI35 ->  | AN35: =AA10 -> 7 | AO35: =AI35 ->  | AP35: =VLOOKUP(AO35,$AI$33:$AJ$56,2,FALSE)+(VLOOKUP(AO35,$AK$33:$AL$56,2,FALSE)/10000)-(VLOOKUP(AO35,$AM$33:$AN$56,2,FALSE)/1000) -> 6.9935 | AQ35: =IF(ISERROR(RANK(AP35,$AP$33:$AP$56)),"-",RANK(AP35,$AP$33:$AP$56)) -> 16
B36: =SUM(B32:B35) -> 3 | C36: =SUM(C32:C35) -> 5 | D36: =SUM(D32:D35) -> 3 | E36: =SUM(E32:E35) -> 5 | F36: =SUM(F32:F35) -> 3 | G36: =SUM(G32:G35) -> 4 | H36: =SUM(H32:H35) -> 4 | I36: =SUM(I32:I35) -> 3 | J36: =SUM(J32:J35) -> 2 | K36: =SUM(K32:K35) -> 3 | L36: =SUM(B36:K36) -> 35 | M36: =SUM(M32:M35) -> 4 | N36: =SUM(N32:N35) -> 2 | O36: =SUM(O32:O35) -> 2 | P36: =SUM(P32:P35) -> 6 | Q36: =SUM(Q32:Q35) -> 2 | R36: =SUM(R32:R35) -> 4 | S36: =SUM(S32:S35) -> 4 | T36: =SUM(T32:T35) -> 4 | U36: =SUM(U32:U35) -> 2 | V36: =SUM(V32:V35) -> 5 | W36: =SUM(M36:V36) -> 35 | X36: =L36+W36 -> 70 | Y36: =IF(ISERROR(AVERAGE(Y32:Y35)),"0",AVERAGE(Y32:Y35)) -> 0.35570175438596491 | Z36: =SUM(Z32:Z35) -> 27 | AA36: =SUM(AA32:AA35) -> 33 | AB36: =SUM(AB32:AB35) -> 16 | AI36: =A11 ->  | AJ36: =Z11 -> 7 | AK36: =AI36 ->  | AL36: =AB11 -> 7 | AM36: =AI36 ->  | AN36: =AA11 -> 6 | AO36: =AI36 ->  | AP36: =VLOOKUP(AO36,$AI$33:$AJ$56,2,FALSE)+(VLOOKUP(AO36,$AK$33:$AL$56,2,FALSE)/10000)-(VLOOKUP(AO36,$AM$33:$AN$56,2,FALSE)/1000) -> 6.9946999999999999 | AQ36: =IF(ISERROR(RANK(AP36,$AP$33:$AP$56)),"-",RANK(AP36,$AP$33:$AP$56)) -> 15
AI37: =A16 ->  | AJ37: =Z16 -> 7 | AK37: =AI37 ->  | AL37: =AB16 -> 4 | AM37: =AI37 ->  | AN37: =AA16 -> 9 | AO37: =AI37 ->  | AP37: =VLOOKUP(AO37,$AI$33:$AJ$56,2,FALSE)+(VLOOKUP(AO37,$AK$33:$AL$56,2,FALSE)/10000)-(VLOOKUP(AO37,$AM$33:$AN$56,2,FALSE)/1000) -> 6.9913999999999996 | AQ37: =IF(ISERROR(RANK(AP37,$AP$33:$AP$56)),"-",RANK(AP37,$AP$33:$AP$56)) -> 18
A38: Team 5 | AI38: =A17 ->  | AJ38: =Z17 -> 15 | AK38: =AI38 ->  | AL38: =AB17 -> 2 | AM38: =AI38 ->  | AN38: =AA17 -> 3 | AO38: =AI38 ->  | AP38: =VLOOKUP(AO38,$AI$33:$AJ$56,2,FALSE)+(VLOOKUP(AO38,$AK$33:$AL$56,2,FALSE)/10000)-(VLOOKUP(AO38,$AM$33:$AN$56,2,FALSE)/1000) -> 14.997199999999999 | AQ38: =IF(ISERROR(RANK(AP38,$AP$33:$AP$56)),"-",RANK(AP38,$AP$33:$AP$56)) -> 1
A39: Week | B39: 1 | C39: 2 | D39: 3 | E39: 4 | F39: 5 | G39: 6 | H39: 7 | I39: 8 | J39: 9 | K39: 10 | L39: Total | M39: 11 | N39: 12 | O39: 13 | P39: 14 | Q39: 15 | R39: 16 | S39: 17 | T39: 18 | U39: 19 | V39: 20 | W39: Total | X39: YTD | Y39: Win PCT | Z39: Win | AA39: Loss | AB39: Tie | AC39: Player Win Rank | AD39: 1st Half Team Rank | AE39: 2nd Half Team Rank | AF39: *Overall Team Rank | AI39: =A18 ->  | AJ39: =Z18 -> 9 | AK39: =AI39 ->  | AL39: =AB18 -> 1 | AM39: =AI39 ->  | AN39: =AA18 -> 10 | AO39: =AI39 ->  | AP39: =VLOOKUP(AO39,$AI$33:$AJ$56,2,FALSE)+(VLOOKUP(AO39,$AK$33:$AL$56,2,FALSE)/10000)-(VLOOKUP(AO39,$AM$33:$AN$56,2,FALSE)/1000) -> 8.9901 | AQ39: =IF(ISERROR(RANK(AP39,$AP$33:$AP$56)),"-",RANK(AP39,$AP$33:$AP$56)) -> 12
A40: ='M. Rutherford'!$A$1 -> M. Rutherford | B40: ='M. Rutherford'!$O$10 -> 0 | C40: ='M. Rutherford'!$O$11 -> A | D40: ='M. Rutherford'!$O$12 -> 2 | E40: ='M. Rutherford'!$O$13 -> 2 | F40: ='M. Rutherford'!$O$14 -> 2 | G40: ='M. Rutherford'!$O$21 -> 0 | H40: ='M. Rutherford'!$O$22 -> 2 | I40: ='M. Rutherford'!$O$23 -> 2 | J40: ='M. Rutherford'!$O$24 -> 2 | K40: ='M. Rutherford'!$O$25 -> 1 | L40: =SUM(B40:K40) -> 13 | M40: ='M. Rutherford'!$O$34 -> 1 | N40: ='M. Rutherford'!$O$35 -> 0 | O40: ='M. Rutherford'!$O$36 -> 2 | P40: ='M. Rutherford'!$O$37 -> 2 | Q40: ='M. Rutherford'!$O$38 -> A | R40: ='M. Rutherford'!$O$45 -> 0 | S40: ='M. Rutherford'!$O$46 -> 2 | T40: ='M. Rutherford'!$O$47 -> 2 | U40: ='M. Rutherford'!$O$48 -> 0 | V40: ='M. Rutherford'!$O$49 -> 0 | W40: =SUM(M40:V40) -> 9 | X40: =L40+W40 -> 22 | Y40: =IF(ISERROR(Z40/(SUM(Z40:AB40))),"0",(Z40/(SUM(Z40:AB40)))) -> 0.55555555555555558 | Z40: =COUNTIF(B40:K40,2)+COUNTIF(M40:V40,2) -> 10 | AA40: =COUNTIF(B40:K40,0)+COUNTIF(M40:V40,0) -> 6 | AB40: =COUNTIF(B40:K40,1)+COUNTIF(M40:V40,1) -> 2 | AC40: =AQ49 -> 5 | AD40: =AQ12 -> 1 | AE40: =AQ20 -> 3 | AF40: =AQ28 -> 1 | AI40: =A19 ->  | AJ40: =Z19 -> 9 | AK40: =AI40 ->  | AL40: =AB19 -> 1 | AM40: =AI40 ->  | AN40: =AA19 -> 7 | AO40: =AI40 ->  | AP40: =VLOOKUP(AO40,$AI$33:$AJ$56,2,FALSE)+(VLOOKUP(AO40,$AK$33:$AL$56,2,FALSE)/10000)-(VLOOKUP(AO40,$AM$33:$AN$56,2,FALSE)/1000) -> 8.9931000000000001 | AQ40: =IF(ISERROR(RANK(AP40,$AP$33:$AP$56)),"-",RANK(AP40,$AP$33:$AP$56)) -> 10
A41: ='D. Freeman'!$A$1 -> D. Freeman | B41: ='D. Freeman'!$O$10 -> 2 | C41: ='D. Freeman'!$O$11 -> 0 | D41: ='D. Freeman'!$O$12 -> 0 | E41: ='D. Freeman'!$O$13 -> 2 | F41: ='D. Freeman'!$O$14 -> 0 | G41: ='D. Freeman'!$O$21 -> 0 | H41: ='D. Freeman'!$O$22 -> 2 | I41: ='D. Freeman'!$O$23 -> 2 | J41: ='D. Freeman'!$O$24 -> A | K41: ='D. Freeman'!$O$25 -> 0 | L41: =SUM(B41:K41) -> 8 | M41: ='D. Freeman'!$O$34 -> 2 | N41: ='D. Freeman'!$O$35 -> A | O41: ='D. Freeman'!$O$36 -> A | P41: ='D. Freeman'!$O$37 -> 2 | Q41: ='D. Freeman'!$O$38 -> 2 | R41: ='D. Freeman'!$O$45 -> 1 | S41: ='D. Freeman'!$O$46 -> 0 | T41: ='D. Freeman'!$O$47 -> 2 | U41: ='D. Freeman'!$O$48 -> 1 | V41: ='D. Freeman'!$O$49 -> 2 | W41: =SUM(M41:V41) -> 12 | X41: =L41+W41 -> 20 | Y41: =IF(ISERROR(Z41/(SUM(Z41:AB41))),"0",(Z41/(SUM(Z41:AB41)))) -> 0.52941176470588236 | Z41: =COUNTIF(B41:K41,2)+COUNTIF(M41:V41,2) -> 9 | AA41: =COUNTIF(B41:K41,0)+COUNTIF(M41:V41,0) -> 6 | AB41: =COUNTIF(B41:K41,1)+COUNTIF(M41:V41,1) -> 2 | AC41: =AQ50 -> 8 | AI41: =A24 ->  | AJ41: =Z24 -> 8 | AK41: =AI41 ->  | AL41: =AB24 -> 1 | AM41: =AI41 ->  | AN41: =AA24 -> 10 | AO41: =AI41 ->  | AP41: =VLOOKUP(AO41,$AI$33:$AJ$56,2,FALSE)+(VLOOKUP(AO41,$AK$33:$AL$56,2,FALSE)/10000)-(VLOOKUP(AO41,$AM$33:$AN$56,2,FALSE)/1000) -> 7.9901 | AQ41: =IF(ISERROR(RANK(AP41,$AP$33:$AP$56)),"-",RANK(AP41,$AP$33:$AP$56)) -> 13
A42: ='B. Hall'!$A$1 -> B. Hall | B42: ='B. Hall'!$O$10 -> 2 | C42: ='B. Hall'!$O$11 -> 2 | D42: ='B. Hall'!$O$12 -> 0 | E42: ='B. Hall'!$O$13 -> 2 | F42: ='B. Hall'!$O$14 -> 1 | G42: ='B. Hall'!$O$21 -> 2 | H42: ='B. Hall'!$O$22 -> 2 | I42: ='B. Hall'!$O$23 -> 1 | J42: ='B. Hall'!$O$24 -> 2 | K42: ='B. Hall'!$O$25 -> 2 | L42: =SUM(B42:K42) -> 16 | M42: ='B. Hall'!$O$34 -> 2 | N42: ='B. Hall'!$O$35 -> 2 | O42: ='B. Hall'!$O$36 -> 1 | P42: ='B. Hall'!$O$37 -> 0 | Q42: ='B. Hall'!$O$38 -> 2 | R42: ='B. Hall'!$O$45 -> 2 | S42: ='B. Hall'!$O$46 -> 0 | T42: ='B. Hall'!$O$47 -> 0 | U42: ='B. Hall'!$O$48 -> 1 | V42: ='B. Hall'!$O$49 -> 1 | W42: =SUM(M42:V42) -> 11 | X42: =L42+W42 -> 27 | Y42: =IF(ISERROR(Z42/(SUM(Z42:AB42))),"0",(Z42/(SUM(Z42:AB42)))) -> 0.55 | Z42: =COUNTIF(B42:K42,2)+COUNTIF(M42:V42,2) -> 11 | AA42: =COUNTIF(B42:K42,0)+COUNTIF(M42:V42,0) -> 4 | AB42: =COUNTIF(B42:K42,1)+COUNTIF(M42:V42,1) -> 5 | AC42: =AQ51 -> 3 | AI42: =A25 ->  | AJ42: =Z25 -> 9 | AK42: =AI42 ->  | AL42: =AB25 -> 3 | AM42: =AI42 ->  | AN42: =AA25 -> 8 | AO42: =AI42 ->  | AP42: =VLOOKUP(AO42,$AI$33:$AJ$56,2,FALSE)+(VLOOKUP(AO42,$AK$33:$AL$56,2,FALSE)/10000)-(VLOOKUP(AO42,$AM$33:$AN$56,2,FALSE)/1000) -> 8.9923000000000002 | AQ42: =IF(ISERROR(RANK(AP42,$AP$33:$AP$56)),"-",RANK(AP42,$AP$33:$AP$56)) -> 11
A43: ='B. Kyle'!$A$1 -> B. Kyle | B43: ='B. Kyle'!$O$10 -> 2 | C43: ='B. Kyle'!$O$11 -> 2 | D43: ='B. Kyle'!$O$12 -> 2 | E43: ='B. Kyle'!$O$13 -> 2 | F43: ='B. Kyle'!$O$14 -> 2 | G43: ='B. Kyle'!$O$21 -> 2 | H43: ='B. Kyle'!$O$22 -> 2 | I43: ='B. Kyle'!$O$23 -> 2 | J43: ='B. Kyle'!$O$24 -> 0 | K43: ='B. Kyle'!$O$25 -> 2 | L43: =SUM(B43:K43) -> 18 | M43: ='B. Kyle'!$O$34 -> 0 | N43: ='B. Kyle'!$O$35 -> 2 | O43: ='B. Kyle'!$O$36 -> 0 | P43: ='B. Kyle'!$O$37 -> 2 | Q43: ='B. Kyle'!$O$38 -> 2 | R43: ='B. Kyle'!$O$45 -> 0 | S43: ='B. Kyle'!$O$46 -> A | T43: ='B. Kyle'!$O$47 -> 2 | U43: ='B. Kyle'!$O$48 -> 0 | V43: ='B. Kyle'!$O$49 -> 0 | W43: =SUM(M43:V43) -> 8 | X43: =L43+W43 -> 26 | Y43: =IF(ISERROR(Z43/(SUM(Z43:AB43))),"0",(Z43/(SUM(Z43:AB43)))) -> 0.68421052631578949 | Z43: =COUNTIF(B43:K43,2)+COUNTIF(M43:V43,2) -> 13 | AA43: =COUNTIF(B43:K43,0)+COUNTIF(M43:V43,0) -> 6 | AB43: =COUNTIF(B43:K43,1)+COUNTIF(M43:V43,1) -> 0 | AC43: =AQ52 -> 2 | AI43: =A26 ->  | AJ43: =Z26 -> 6 | AK43: =AI43 ->  | AL43: =AB26 -> 3 | AM43: =AI43 ->  | AN43: =AA26 -> 6 | AO43: =AI43 ->  | AP43: =VLOOKUP(AO43,$AI$33:$AJ$56,2,FALSE)+(VLOOKUP(AO43,$AK$33:$AL$56,2,FALSE)/10000)-(VLOOKUP(AO43,$AM$33:$AN$56,2,FALSE)/1000) -> 5.9943 | AQ43: =IF(ISERROR(RANK(AP43,$AP$33:$AP$56)),"-",RANK(AP43,$AP$33:$AP$56)) -> 19
B44: =SUM(B40:B43) -> 6 | C44: =SUM(C40:C43) -> 4 | D44: =SUM(D40:D43) -> 4 | E44: =SUM(E40:E43) -> 8 | F44: =SUM(F40:F43) -> 5 | G44: =SUM(G40:G43) -> 4 | H44: =SUM(H40:H43) -> 8 | I44: =SUM(I40:I43) -> 7 | J44: =SUM(J40:J43) -> 4 | K44: =SUM(K40:K43) -> 5 | L44: =SUM(B44:K44) -> 55 | M44: =SUM(M40:M43) -> 5 | N44: =SUM(N40:N43) -> 4 | O44: =SUM(O40:O43) -> 3 | P44: =SUM(P40:P43) -> 6 | Q44: =SUM(Q40:Q43) -> 6 | R44: =SUM(R40:R43) -> 3 | S44: =SUM(S40:S43) -> 2 | T44: =SUM(T40:T43) -> 6 | U44: =SUM(U40:U43) -> 2 | V44: =SUM(V40:V43) -> 3 | W44: =SUM(M44:V44) -> 40 | X44: =L44+W44 -> 95 | Y44: =IF(ISERROR(AVERAGE(Y40:Y43)),"0",AVERAGE(Y40:Y43)) -> 0.57979446164430692 | Z44: =SUM(Z40:Z43) -> 43 | AA44: =SUM(AA40:AA43) -> 22 | AB44: =SUM(AB40:AB43) -> 9 | AI44: =A27 ->  | AJ44: =Z27 -> 3 | AK44: =AI44 ->  | AL44: =AB27 -> 4 | AM44: =AI44 ->  | AN44: =AA27 -> 9 | AO44: =AI44 ->  | AP44: =VLOOKUP(AO44,$AI$33:$AJ$56,2,FALSE)+(VLOOKUP(AO44,$AK$33:$AL$56,2,FALSE)/10000)-(VLOOKUP(AO44,$AM$33:$AN$56,2,FALSE)/1000) -> 2.9914000000000001 | AQ44: =IF(ISERROR(RANK(AP44,$AP$33:$AP$56)),"-",RANK(AP44,$AP$33:$AP$56)) -> 24
AI45: =A32 ->  | AJ45: =Z32 -> 9 | AK45: =AI45 ->  | AL45: =AB32 -> 3 | AM45: =AI45 ->  | AN45: =AA32 -> 7 | AO45: =AI45 ->  | AP45: =VLOOKUP(AO45,$AI$33:$AJ$56,2,FALSE)+(VLOOKUP(AO45,$AK$33:$AL$56,2,FALSE)/10000)-(VLOOKUP(AO45,$AM$33:$AN$56,2,FALSE)/1000) -> 8.9932999999999996 | AQ45: =IF(ISERROR(RANK(AP45,$AP$33:$AP$56)),"-",RANK(AP45,$AP$33:$AP$56)) -> 9
A46: Team 6 | AI46: =A33 ->  | AJ46: =Z33 -> 6 | AK46: =AI46 ->  | AL46: =AB33 -> 3 | AM46: =AI46 ->  | AN46: =AA33 -> 10 | AO46: =AI46 ->  | AP46: =VLOOKUP(AO46,$AI$33:$AJ$56,2,FALSE)+(VLOOKUP(AO46,$AK$33:$AL$56,2,FALSE)/10000)-(VLOOKUP(AO46,$AM$33:$AN$56,2,FALSE)/1000) -> 5.9903000000000004 | AQ46: =IF(ISERROR(RANK(AP46,$AP$33:$AP$56)),"-",RANK(AP46,$AP$33:$AP$56)) -> 22
A47: Week | B47: 1 | C47: 2 | D47: 3 | E47: 4 | F47: 5 | G47: 6 | H47: 7 | I47: 8 | J47: 9 | K47: 10 | L47: Total | M47: 11 | N47: 12 | O47: 13 | P47: 14 | Q47: 15 | R47: 16 | S47: 17 | T47: 18 | U47: 19 | V47: 20 | W47: Total | X47: YTD | Y47: Win PCT | Z47: Win | AA47: Loss | AB47: Tie | AC47: Player Win Rank | AD47: 1st Half Team Rank | AE47: 2nd Half Team Rank | AF47: *Overall Team Rank | AI47: =A34 ->  | AJ47: =Z34 -> 6 | AK47: =AI47 ->  | AL47: =AB34 -> 5 | AM47: =AI47 ->  | AN47: =AA34 -> 9 | AO47: =AI47 ->  | AP47: =VLOOKUP(AO47,$AI$33:$AJ$56,2,FALSE)+(VLOOKUP(AO47,$AK$33:$AL$56,2,FALSE)/10000)-(VLOOKUP(AO47,$AM$33:$AN$56,2,FALSE)/1000) -> 5.9914999999999994 | AQ47: =IF(ISERROR(RANK(AP47,$AP$33:$AP$56)),"-",RANK(AP47,$AP$33:$AP$56)) -> 21
A48: ='R. Crowder'!$A$1 -> R. Crowder | B48: ='R. Crowder'!$O$10 -> 2 | C48: ='R. Crowder'!$O$11 -> 0 | D48: ='R. Crowder'!$O$12 -> 1 | E48: ='R. Crowder'!$O$13 -> 0 | F48: ='R. Crowder'!$O$14 -> 2 | G48: ='R. Crowder'!$O$21 -> 2 | H48: ='R. Crowder'!$O$22 -> 0 | I48: ='R. Crowder'!$O$23 -> 0 | J48: ='R. Crowder'!$O$24 -> 2 | K48: ='R. Crowder'!$O$25 -> 2 | L48: =SUM(B48:K48) -> 11 | M48: ='R. Crowder'!$O$34 -> 1 | N48: ='R. Crowder'!$O$35 -> 2 | O48: ='R. Crowder'!$O$36 -> 2 | P48: ='R. Crowder'!$O$37 -> 2 | Q48: ='R. Crowder'!$O$38 -> 2 | R48: ='R. Crowder'!$O$45 -> 2 | S48: ='R. Crowder'!$O$46 -> 0 | T48: ='R. Crowder'!$O$47 -> 2 | U48: ='R. Crowder'!$O$48 -> 0 | V48: ='R. Crowder'!$O$49 -> 0 | W48: =SUM(M48:V48) -> 13 | X48: =L48+W48 -> 24 | Y48: =IF(ISERROR(Z48/(SUM(Z48:AB48))),"0",(Z48/(SUM(Z48:AB48)))) -> 0.55 | Z48: =COUNTIF(B48:K48,2)+COUNTIF(M48:V48,2) -> 11 | AA48: =COUNTIF(B48:K48,0)+COUNTIF(M48:V48,0) -> 7 | AB48: =COUNTIF(B48:K48,1)+COUNTIF(M48:V48,1) -> 2 | AC48: =AQ53 -> 4 | AD48: =AQ13 -> 4 | AE48: =AQ21 -> 1 | AF48: =AQ29 -> 3 | AI48: =A35 ->  | AJ48: =Z35 -> 6 | AK48: =AI48 ->  | AL48: =AB35 -> 5 | AM48: =AI48 ->  | AN48: =AA35 -> 7 | AO48: =AI48 ->  | AP48: =VLOOKUP(AO48,$AI$33:$AJ$56,2,FALSE)+(VLOOKUP(AO48,$AK$33:$AL$56,2,FALSE)/10000)-(VLOOKUP(AO48,$AM$33:$AN$56,2,FALSE)/1000) -> 5.9935 | AQ48: =IF(ISERROR(RANK(AP48,$AP$33:$AP$56)),"-",RANK(AP48,$AP$33:$AP$56)) -> 20
A49: ='M. Fairburn'!$A$1 -> M. Fairburn | B49: ='M. Fairburn'!$O$10 -> 0 | C49: ='M. Fairburn'!$O$11 -> A | D49: ='M. Fairburn'!$O$12 -> 0 | E49: ='M. Fairburn'!$O$13 -> 0 | F49: ='M. Fairburn'!$O$14 -> 2 | G49: ='M. Fairburn'!$O$21 -> 2 | H49: ='M. Fairburn'!$O$22 -> 0 | I49: ='M. Fairburn'!$O$23 -> A | J49: ='M. Fairburn'!$O$24 -> 0 | K49: ='M. Fairburn'!$O$25 -> A | L49: =SUM(B49:K49) -> 4 | M49: ='M. Fairburn'!$O$34 -> A | N49: ='M. Fairburn'!$O$35 -> 2 | O49: ='M. Fairburn'!$O$36 -> 2 | P49: ='M. Fairburn'!$O$37 -> 0 | Q49: ='M. Fairburn'!$O$38 -> A | R49: ='M. Fairburn'!$O$45 -> 1 | S49: ='M. Fairburn'!$O$46 -> 2 | T49: ='M. Fairburn'!$O$47 -> 2 | U49: ='M. Fairburn'!$O$48 -> 2 | V49: ='M. Fairburn'!$O$49 -> 0 | W49: =SUM(M49:V49) -> 11 | X49: =L49+W49 -> 15 | Y49: =IF(ISERROR(Z49/(SUM(Z49:AB49))),"0",(Z49/(SUM(Z49:AB49)))) -> 0.46666666666666667 | Z49: =COUNTIF(B49:K49,2)+COUNTIF(M49:V49,2) -> 7 | AA49: =COUNTIF(B49:K49,0)+COUNTIF(M49:V49,0) -> 7 | AB49: =COUNTIF(B49:K49,1)+COUNTIF(M49:V49,1) -> 1 | AC49: =AQ54 -> 17 | AI49: =A40 ->  | AJ49: =Z40 -> 10 | AK49: =AI49 ->  | AL49: =AB40 -> 2 | AM49: =AI49 ->  | AN49: =AA40 -> 6 | AO49: =AI49 ->  | AP49: =VLOOKUP(AO49,$AI$33:$AJ$56,2,FALSE)+(VLOOKUP(AO49,$AK$33:$AL$56,2,FALSE)/10000)-(VLOOKUP(AO49,$AM$33:$AN$56,2,FALSE)/1000) -> 9.9941999999999993 | AQ49: =IF(ISERROR(RANK(AP49,$AP$33:$AP$56)),"-",RANK(AP49,$AP$33:$AP$56)) -> 5
A50: ='G. Yablonski'!$A$1 -> G. Yablonski | B50: ='G. Yablonski'!$O$10 -> 0 | C50: ='G. Yablonski'!$O$11 -> 2 | D50: ='G. Yablonski'!$O$12 -> 2 | E50: ='G. Yablonski'!$O$13 -> 0 | F50: ='G. Yablonski'!$O$14 -> 0 | G50: ='G. Yablonski'!$O$21 -> 0 | H50: ='G. Yablonski'!$O$22 -> 2 | I50: ='G. Yablonski'!$O$23 -> 2 | J50: ='G. Yablonski'!$O$24 -> 2 | K50: ='G. Yablonski'!$O$25 -> 2 | L50: =SUM(B50:K50) -> 12 | M50: ='G. Yablonski'!$O$34 -> 0 | N50: ='G. Yablonski'!$O$35 -> 0 | O50: ='G. Yablonski'!$O$36 -> 0 | P50: ='G. Yablonski'!$O$37 -> 2 | Q50: ='G. Yablonski'!$O$38 -> 2 | R50: ='G. Yablonski'!$O$45 -> 0 | S50: ='G. Yablonski'!$O$46 -> 2 | T50: ='G. Yablonski'!$O$47 -> 0 | U50: ='G. Yablonski'!$O$48 -> 2 | V50: ='G. Yablonski'!$O$49 -> 1 | W50: =SUM(M50:V50) -> 9 | X50: =L50+W50 -> 21 | Y50: =IF(ISERROR(Z50/(SUM(Z50:AB50))),"0",(Z50/(SUM(Z50:AB50)))) -> 0.5 | Z50: =COUNTIF(B50:K50,2)+COUNTIF(M50:V50,2) -> 10 | AA50: =COUNTIF(B50:K50,0)+COUNTIF(M50:V50,0) -> 9 | AB50: =COUNTIF(B50:K50,1)+COUNTIF(M50:V50,1) -> 1 | AC50: =AQ55 -> 7 | AI50: =A41 ->  | AJ50: =Z41 -> 9 | AK50: =AI50 ->  | AL50: =AB41 -> 2 | AM50: =AI50 ->  | AN50: =AA41 -> 6 | AO50: =AI50 ->  | AP50: =VLOOKUP(AO50,$AI$33:$AJ$56,2,FALSE)+(VLOOKUP(AO50,$AK$33:$AL$56,2,FALSE)/10000)-(VLOOKUP(AO50,$AM$33:$AN$56,2,FALSE)/1000) -> 8.9941999999999993 | AQ50: =IF(ISERROR(RANK(AP50,$AP$33:$AP$56)),"-",RANK(AP50,$AP$33:$AP$56)) -> 8
A51: ='B. Harbour'!$A$1 -> B. Harbour | B51: ='B. Harbour'!$O$10 -> 0 | C51: ='B. Harbour'!$O$11 -> 0 | D51: ='B. Harbour'!$O$12 -> 2 | E51: ='B. Harbour'!$O$13 -> 2 | F51: ='B. Harbour'!$O$14 -> 0 | G51: ='B. Harbour'!$O$21 -> 0 | H51: ='B. Harbour'!$O$22 -> 2 | I51: ='B. Harbour'!$O$23 -> 0 | J51: ='B. Harbour'!$O$24 -> 0 | K51: ='B. Harbour'!$O$25 -> 1 | L51: =SUM(B51:K51) -> 7 | M51: ='B. Harbour'!$O$34 -> 2 | N51: ='B. Harbour'!$O$35 -> 2 | O51: ='B. Harbour'!$O$36 -> 0 | P51: ='B. Harbour'!$O$37 -> 2 | Q51: ='B. Harbour'!$O$38 -> 2 | R51: ='B. Harbour'!$O$45 -> 2 | S51: ='B. Harbour'!$O$46 -> 0 | T51: ='B. Harbour'!$O$47 -> 2 | U51: ='B. Harbour'!$O$48 -> 2 | V51: ='B. Harbour'!$O$49 -> 1 | W51: =SUM(M51:V51) -> 15 | X51: =L51+W51 -> 22 | Y51: =IF(ISERROR(Z51/(SUM(Z51:AB51))),"0",(Z51/(SUM(Z51:AB51)))) -> 0.5 | Z51: =COUNTIF(B51:K51,2)+COUNTIF(M51:V51,2) -> 10 | AA51: =COUNTIF(B51:K51,0)+COUNTIF(M51:V51,0) -> 8 | AB51: =COUNTIF(B51:K51,1)+COUNTIF(M51:V51,1) -> 2 | AC51: =AQ56 -> 6 | AI51: =A42 ->  | AJ51: =Z42 -> 11 | AK51: =AI51 ->  | AL51: =AB42 -> 5 | AM51: =AI51 ->  | AN51: =AA42 -> 4 | AO51: =AI51 ->  | AP51: =VLOOKUP(AO51,$AI$33:$AJ$56,2,FALSE)+(VLOOKUP(AO51,$AK$33:$AL$56,2,FALSE)/10000)-(VLOOKUP(AO51,$AM$33:$AN$56,2,FALSE)/1000) -> 10.996500000000001 | AQ51: =IF(ISERROR(RANK(AP51,$AP$33:$AP$56)),"-",RANK(AP51,$AP$33:$AP$56)) -> 3
B52: =SUM(B48:B51) -> 2 | C52: =SUM(C48:C51) -> 2 | D52: =SUM(D48:D51) -> 5 | E52: =SUM(E48:E51) -> 2 | F52: =SUM(F48:F51) -> 4 | G52: =SUM(G48:G51) -> 4 | H52: =SUM(H48:H51) -> 4 | I52: =SUM(I48:I51) -> 2 | J52: =SUM(J48:J51) -> 4 | K52: =SUM(K48:K51) -> 5 | L52: =SUM(B52:K52) -> 34 | M52: =SUM(M48:M51) -> 3 | N52: =SUM(N48:N51) -> 6 | O52: =SUM(O48:O51) -> 4 | P52: =SUM(P48:P51) -> 6 | Q52: =SUM(Q48:Q51) -> 6 | R52: =SUM(R48:R51) -> 5 | S52: =SUM(S48:S51) -> 4 | T52: =SUM(T48:T51) -> 6 | U52: =SUM(U48:U51) -> 6 | V52: =SUM(V48:V51) -> 2 | W52: =SUM(M52:V52) -> 48 | X52: =L52+W52 -> 82 | Y52: =IF(ISERROR(AVERAGE(Y48:Y51)),"0",AVERAGE(Y48:Y51)) -> 0.50416666666666665 | Z52: =SUM(Z48:Z51) -> 38 | AA52: =SUM(AA48:AA51) -> 31 | AB52: =SUM(AB48:AB51) -> 6 | AI52: =A43 ->  | AJ52: =Z43 -> 13 | AK52: =AI52 ->  | AL52: =AB43 -> 0 | AM52: =AI52 ->  | AN52: =AA43 -> 6 | AO52: =AI52 ->  | AP52: =VLOOKUP(AO52,$AI$33:$AJ$56,2,FALSE)+(VLOOKUP(AO52,$AK$33:$AL$56,2,FALSE)/10000)-(VLOOKUP(AO52,$AM$33:$AN$56,2,FALSE)/1000) -> 12.994 | AQ52: =IF(ISERROR(RANK(AP52,$AP$33:$AP$56)),"-",RANK(AP52,$AP$33:$AP$56)) -> 2
T53: Player w/Most Points | X53: =MAX(X8:X11,X16:X19,X24:X27,X32:X35,X40:X43,X48:X51) -> 32 | Y53: =IF(ISERROR(OFFSET(X8,MATCH(X53,$X$8:$X$52,0)-1,-23,1,1)),"-",OFFSET(X8,MATCH(X53,$X$8:$X$52,0)-1,-23,1,1)) -> G. White | AI53: =A48 ->  | AJ53: =Z48 -> 11 | AK53: =AI53 ->  | AL53: =AB48 -> 2 | AM53: =AI53 ->  | AN53: =AA48 -> 7 | AO53: =AI53 ->  | AP53: =VLOOKUP(AO53,$AI$33:$AJ$56,2,FALSE)+(VLOOKUP(AO53,$AK$33:$AL$56,2,FALSE)/10000)-(VLOOKUP(AO53,$AM$33:$AN$56,2,FALSE)/1000) -> 10.9932 | AQ53: =IF(ISERROR(RANK(AP53,$AP$33:$AP$56)),"-",RANK(AP53,$AP$33:$AP$56)) -> 4
AI54: =A49 ->  | AJ54: =Z49 -> 7 | AK54: =AI54 ->  | AL54: =AB49 -> 1 | AM54: =AI54 ->  | AN54: =AA49 -> 7 | AO54: =AI54 ->  | AP54: =VLOOKUP(AO54,$AI$33:$AJ$56,2,FALSE)+(VLOOKUP(AO54,$AK$33:$AL$56,2,FALSE)/10000)-(VLOOKUP(AO54,$AM$33:$AN$56,2,FALSE)/1000) -> 6.9931000000000001 | AQ54: =IF(ISERROR(RANK(AP54,$AP$33:$AP$56)),"-",RANK(AP54,$AP$33:$AP$56)) -> 17
AI55: =A50 ->  | AJ55: =Z50 -> 10 | AK55: =AI55 ->  | AL55: =AB50 -> 1 | AM55: =AI55 ->  | AN55: =AA50 -> 9 | AO55: =AI55 ->  | AP55: =VLOOKUP(AO55,$AI$33:$AJ$56,2,FALSE)+(VLOOKUP(AO55,$AK$33:$AL$56,2,FALSE)/10000)-(VLOOKUP(AO55,$AM$33:$AN$56,2,FALSE)/1000) -> 9.9910999999999994 | AQ55: =IF(ISERROR(RANK(AP55,$AP$33:$AP$56)),"-",RANK(AP55,$AP$33:$AP$56)) -> 7
B56: *Overall Team Rank holds no value in determining playoff participants and is for informational purposes only. | AI56: =A51 ->  | AJ56: =Z51 -> 10 | AK56: =AI56 ->  | AL56: =AB51 -> 2 | AM56: =AI56 ->  | AN56: =AA51 -> 8 | AO56: =AI56 ->  | AP56: =VLOOKUP(AO56,$AI$33:$AJ$56,2,FALSE)+(VLOOKUP(AO56,$AK$33:$AL$56,2,FALSE)/10000)-(VLOOKUP(AO56,$AM$33:$AN$56,2,FALSE)/1000) -> 9.9922000000000004 | AQ56: =IF(ISERROR(RANK(AP56,$AP$33:$AP$56)),"-",RANK(AP56,$AP$33:$AP$56)) -> 6