A2: =MID(CELL("filename",A1),FIND("]",CELL("filename",A1))+1,LEN(CELL("filename",A1))-FIND("]",CELL("filename",A1))) -> Individual Stats by Group
A3: =Standings!$A$4 -> 2009
A4: One Players
A5: Week | B5: 1 | C5: 2 | D5: 3 | E5: 4 | F5: 5 | G5: 6 | H5: 7 | I5: 8 | J5: 9 | K5: 10 | M5: 11 | N5: 12 | O5: 13 | P5: 14 | Q5: 15 | R5: 16 | S5: 17 | T5: 18 | U5: 19 | V5: 20 | W5: Avg. | X5: Par | Y5: Net Avg. | Z5: Rank | AA5: Low Rnd. | AB5: Max Rnd. | AC5: Low Net Rnd.
A6: ='R. Keeney'!$A$1 -> R. Keeney | B6: ='R. Keeney'!$K$10 -> 45 | C6: ='R. Keeney'!$K$11 -> 40 | D6: ='R. Keeney'!$K$12 -> 39 | E6: ='R. Keeney'!$K$13 -> 45 | F6: ='R. Keeney'!$K$14 -> 45 | G6: ='R. Keeney'!$K$21 -> 46 | H6: ='R. Keeney'!$K$22 -> 42 | I6: ='R. Keeney'!$K$23 -> 39 | J6: ='R. Keeney'!$K$24 -> 44 | K6: ='R. Keeney'!$K$25 -> 43 | M6: ='R. Keeney'!$K$34 -> 42 | N6: ='R. Keeney'!$K$35 -> 36 | O6: ='R. Keeney'!$K$36 -> 39 | P6: ='R. Keeney'!$K$37 -> 40 | Q6: ='R. Keeney'!$K$38 -> 37 | R6: ='R. Keeney'!$K$45 -> - | S6: ='R. Keeney'!$K$46 -> 44 | T6: ='R. Keeney'!$K$47 -> 42 | U6: ='R. Keeney'!$K$48 -> 39 | V6: ='R. Keeney'!$K$49 -> 41 | W6: =IF(ISERROR(AVERAGE(IF(B6:V6<>0,B6:V6,""))),"-",(AVERAGE(IF(B6:V6<>0,B6:V6,"")))) -> 41.473684210526315 | X6: =IF(ISERROR(W6-37),"-",(W6-37)) -> 4.473684210526315 | Y6: ='R. Keeney'!$M$52 -> 38.421052631578945 | Z6: =IF(ISERROR(RANK(Y6,Y$6:Y$16,1)),"-",RANK(Y6,Y$6:Y$16,1)) -> 3 | AA6: =IF(MIN(B6:V6)=0,"-",MIN(B6:V6)) -> 36 | AB6: =IF(MAX(B6:V6)=0,"-",MAX(B6:V6)) -> 46 | AC6: ='R. Keeney'!$N$53 -> 32
A8: ='D. Smith'!$A$1 -> D. Smith | B8: ='D. Smith'!$K$10 -> 42 | C8: ='D. Smith'!$K$11 -> 49 | D8: ='D. Smith'!$K$12 -> 43 | E8: ='D. Smith'!$K$13 -> 46 | F8: ='D. Smith'!$K$14 -> 44 | G8: ='D. Smith'!$K$21 -> 45 | H8: ='D. Smith'!$K$22 -> 47 | I8: ='D. Smith'!$K$23 -> 39 | J8: ='D. Smith'!$K$24 -> 49 | K8: ='D. Smith'!$K$25 -> 41 | M8: ='D. Smith'!$K$34 -> 44 | N8: ='D. Smith'!$K$35 -> 41 | O8: ='D. Smith'!$K$36 -> 40 | P8: ='D. Smith'!$K$37 -> 45 | Q8: ='D. Smith'!$K$38 -> 40 | R8: ='D. Smith'!$K$45 -> 44 | S8: ='D. Smith'!$K$46 -> 43 | T8: ='D. Smith'!$K$47 -> 44 | U8: ='D. Smith'!$K$48 -> 38 | V8: ='D. Smith'!$K$49 -> 41 | W8: =IF(ISERROR(AVERAGE(IF(B8:V8<>0,B8:V8,""))),"-",(AVERAGE(IF(B8:V8<>0,B8:V8,"")))) -> 43.25 | X8: =IF(ISERROR(W8-37),"-",(W8-37)) -> 6.25 | Y8: ='D. Smith'!$M$52 -> 39.00 | Z8: =IF(ISERROR(RANK(Y8,Y$6:Y$16,1)),"-",RANK(Y8,Y$6:Y$16,1)) -> 6 | AA8: =IF(MIN(B8:V8)=0,"-",MIN(B8:V8)) -> 38 | AB8: =IF(MAX(B8:V8)=0,"-",MAX(B8:V8)) -> 49 | AC8: ='D. Smith'!$N$53 -> 33
A10: ='R. Ours'!$A$1 -> R. Ours | B10: ='R. Ours'!$K$10 -> 39 | C10: ='R. Ours'!$K$11 -> 45 | D10: ='R. Ours'!$K$12 -> 44 | E10: ='R. Ours'!$K$13 -> 40 | F10: ='R. Ours'!$K$14 -> 39 | G10: ='R. Ours'!$K$21 -> 40 | H10: ='R. Ours'!$K$22 -> 38 | I10: ='R. Ours'!$K$23 -> 44 | J10: ='R. Ours'!$K$24 -> - | K10: ='R. Ours'!$K$25 -> 45 | M10: ='R. Ours'!$K$34 -> 36 | N10: ='R. Ours'!$K$35 -> 41 | O10: ='R. Ours'!$K$36 -> 41 | P10: ='R. Ours'!$K$37 -> 42 | Q10: ='R. Ours'!$K$38 -> 43 | R10: ='R. Ours'!$K$45 -> 38 | S10: ='R. Ours'!$K$46 -> 40 | T10: ='R. Ours'!$K$47 -> 45 | U10: ='R. Ours'!$K$48 -> 36 | V10: ='R. Ours'!$K$49 -> 37 | W10: =IF(ISERROR(AVERAGE(IF(B10:V10<>0,B10:V10,""))),"-",(AVERAGE(IF(B10:V10<>0,B10:V10,"")))) -> 40.684210526315788 | X10: =IF(ISERROR(W10-37),"-",(W10-37)) -> 3.6842105263157876 | Y10: ='R. Ours'!$M$52 -> 38.684210526315788 | Z10: =IF(ISERROR(RANK(Y10,Y$6:Y$16,1)),"-",RANK(Y10,Y$6:Y$16,1)) -> 5 | AA10: =IF(MIN(B10:V10)=0,"-",MIN(B10:V10)) -> 36 | AB10: =IF(MAX(B10:V10)=0,"-",MAX(B10:V10)) -> 45 | AC10: ='R. Ours'!$N$53 -> 34
A12: ='V. Bunn'!$A$1 -> V. Bunn | B12: ='V. Bunn'!$K$10 -> 42 | C12: ='V. Bunn'!$K$11 -> 39 | D12: ='V. Bunn'!$K$12 -> 44 | E12: ='V. Bunn'!$K$13 -> 40 | F12: ='V. Bunn'!$K$14 -> 43 | G12: ='V. Bunn'!$K$21 -> 40 | H12: ='V. Bunn'!$K$22 -> 39 | I12: ='V. Bunn'!$K$23 -> 44 | J12: ='V. Bunn'!$K$24 -> 45 | K12: ='V. Bunn'!$K$25 -> 40 | M12: ='V. Bunn'!$K$34 -> - | N12: ='V. Bunn'!$K$35 -> 41 | O12: ='V. Bunn'!$K$36 -> 43 | P12: ='V. Bunn'!$K$37 -> 37 | Q12: ='V. Bunn'!$K$38 -> 41 | R12: ='V. Bunn'!$K$45 -> 37 | S12: ='V. Bunn'!$K$46 -> 40 | T12: ='V. Bunn'!$K$47 -> 43 | U12: ='V. Bunn'!$K$48 -> 40 | V12: ='V. Bunn'!$K$49 -> 41 | W12: =IF(ISERROR(AVERAGE(IF(B12:V12<>0,B12:V12,""))),"-",(AVERAGE(IF(B12:V12<>0,B12:V12,"")))) -> 41.00 | X12: =IF(ISERROR(W12-37),"-",(W12-37)) -> 4.00 | Y12: ='V. Bunn'!$M$52 -> 38.526315789473685 | Z12: =IF(ISERROR(RANK(Y12,Y$6:Y$16,1)),"-",RANK(Y12,Y$6:Y$16,1)) -> 4 | AA12: =IF(MIN(B12:V12)=0,"-",MIN(B12:V12)) -> 37 | AB12: =IF(MAX(B12:V12)=0,"-",MAX(B12:V12)) -> 45 | AC12: ='V. Bunn'!$N$53 -> 34
A14: ='M. Rutherford'!$A$1 -> M. Rutherford | B14: ='M. Rutherford'!$K$10 -> 42 | C14: ='M. Rutherford'!$K$11 -> - | D14: ='M. Rutherford'!$K$12 -> 38 | E14: ='M. Rutherford'!$K$13 -> 40 | F14: ='M. Rutherford'!$K$14 -> 42 | G14: ='M. Rutherford'!$K$21 -> 42 | H14: ='M. Rutherford'!$K$22 -> 40 | I14: ='M. Rutherford'!$K$23 -> 42 | J14: ='M. Rutherford'!$K$24 -> 42 | K14: ='M. Rutherford'!$K$25 -> 40 | M14: ='M. Rutherford'!$K$34 -> 40 | N14: ='M. Rutherford'!$K$35 -> 40 | O14: ='M. Rutherford'!$K$36 -> 40 | P14: ='M. Rutherford'!$K$37 -> 38 | Q14: ='M. Rutherford'!$K$38 -> - | R14: ='M. Rutherford'!$K$45 -> 43 | S14: ='M. Rutherford'!$K$46 -> 40 | T14: ='M. Rutherford'!$K$47 -> 41 | U14: ='M. Rutherford'!$K$48 -> 41 | V14: ='M. Rutherford'!$K$49 -> 44 | W14: =IF(ISERROR(AVERAGE(IF(B14:V14<>0,B14:V14,""))),"-",(AVERAGE(IF(B14:V14<>0,B14:V14,"")))) -> 40.833333333333336 | X14: =IF(ISERROR(W14-37),"-",(W14-37)) -> 3.8333333333333357 | Y14: ='M. Rutherford'!$M$52 -> 38.388888888888886 | Z14: =IF(ISERROR(RANK(Y14,Y$6:Y$16,1)),"-",RANK(Y14,Y$6:Y$16,1)) -> 2 | AA14: =IF(MIN(B14:V14)=0,"-",MIN(B14:V14)) -> 38 | AB14: =IF(MAX(B14:V14)=0,"-",MAX(B14:V14)) -> 44 | AC14: ='M. Rutherford'!$N$53 -> 35
A16: ='R. Crowder'!$A$1 -> R. Crowder | B16: ='R. Crowder'!$K$10 -> - | C16: ='R. Crowder'!$K$11 -> - | D16: ='R. Crowder'!$K$12 -> - | E16: ='R. Crowder'!$K$13 -> - | F16: ='R. Crowder'!$K$14 -> - | G16: ='R. Crowder'!$K$21 -> - | H16: ='R. Crowder'!$K$22 -> - | I16: ='R. Crowder'!$K$23 -> 44 | J16: ='R. Crowder'!$K$24 -> 42 | K16: ='R. Crowder'!$K$25 -> 40 | M16: ='R. Crowder'!$K$34 -> 42 | N16: ='R. Crowder'!$K$35 -> 39 | O16: ='R. Crowder'!$K$36 -> 41 | P16: ='R. Crowder'!$K$37 -> 43 | Q16: ='R. Crowder'!$K$38 -> 37 | R16: ='R. Crowder'!$K$45 -> 38 | S16: ='R. Crowder'!$K$46 -> 41 | T16: ='R. Crowder'!$K$47 -> 40 | U16: ='R. Crowder'!$K$48 -> 37 | V16: ='R. Crowder'!$K$49 -> 46 | W16: =IF(ISERROR(AVERAGE(IF(B16:V16<>0,B16:V16,""))),"-",(AVERAGE(IF(B16:V16<>0,B16:V16,"")))) -> 40.769230769230766 | X16: =IF(ISERROR(W16-37),"-",(W16-37)) -> 3.7692307692307665 | Y16: ='R. Crowder'!$M$52 -> 37.769230769230766 | Z16: =IF(ISERROR(RANK(Y16,Y$6:Y$16,1)),"-",RANK(Y16,Y$6:Y$16,1)) -> 1 | AA16: =IF(MIN(B16:V16)=0,"-",MIN(B16:V16)) -> 37 | AB16: =IF(MAX(B16:V16)=0,"-",MAX(B16:V16)) -> 46 | AC16: ='R. Crowder'!$N$53 -> 33
X17: Lowest Round | AA17: =IF(MIN(AA6,AA8,AA10,AA12,AA14,AA16)=0,"-",MIN(AA6,AA8,AA10,AA12,AA14,AA16)) -> 36 | AB17: =IF(ISERROR(OFFSET(AA6,MATCH(AA17,$AA$6:$AA$16,0)-1,-26,1,1)),"-",OFFSET(AA6,MATCH(AA17,$AA$6:$AA$16,0)-1,-26,1,1)) -> R. Keeney
A18: Two Players
A19: Week | B19: 1 | C19: 2 | D19: 3 | E19: 4 | F19: 5 | G19: 6 | H19: 7 | I19: 8 | J19: 9 | K19: 10 | M19: 11 | N19: 12 | O19: 13 | P19: 14 | Q19: 15 | R19: 16 | S19: 17 | T19: 18 | U19: 19 | V19: 20 | W19: Avg. | X19: Par | Y19: Net Avg. | Z19: Rank | AA19: Low Rnd. | AB19: Max Rnd. | AC19: Low Net Rnd.
A20: ='Matt McComas'!$A$1 -> Matt McComas | B20: ='Matt McComas'!$K$10 -> 43 | C20: ='Matt McComas'!$K$11 -> 45 | D20: ='Matt McComas'!$K$12 -> 45 | E20: ='Matt McComas'!$K$13 -> 45 | F20: ='Matt McComas'!$K$14 -> 49 | G20: ='Matt McComas'!$K$21 -> 44 | H20: ='Matt McComas'!$K$22 -> 40 | I20: ='Matt McComas'!$K$23 -> 48 | J20: ='Matt McComas'!$K$24 -> 48 | K20: ='Matt McComas'!$K$25 -> 44 | M20: ='Matt McComas'!$K$34 -> 47 | N20: ='Matt McComas'!$K$35 -> - | O20: ='Matt McComas'!$K$36 -> 41 | P20: ='Matt McComas'!$K$37 -> 44 | Q20: ='Matt McComas'!$K$38 -> 44 | R20: ='Matt McComas'!$K$45 -> 47 | S20: ='Matt McComas'!$K$46 -> 47 | T20: ='Matt McComas'!$K$47 -> 40 | U20: ='Matt McComas'!$K$48 -> 48 | V20: ='Matt McComas'!$K$49 -> 42 | W20: =IF(ISERROR(AVERAGE(IF(B20:V20<>0,B20:V20,""))),"-",(AVERAGE(IF(B20:V20<>0,B20:V20,"")))) -> 44.789473684210527 | X20: =IF(ISERROR(W20-37),"-",(W20-37)) -> 7.7894736842105274 | Y20: ='Matt McComas'!$M$52 -> 38.789473684210527 | Z20: =IF(ISERROR(RANK(Y20,Y$20:Y$30,1)),"-",RANK(Y20,Y$20:Y$30,1)) -> 4 | AA20: =IF(MIN(B20:V20)=0,"-",MIN(B20:V20)) -> 40 | AB20: =IF(MAX(B20:V20)=0,"-",MAX(B20:V20)) -> 49 | AC20: ='Matt McComas'!$N$53 -> 33
A22: ='G. White'!$A$1 -> G. White | B22: ='G. White'!$K$10 -> 41 | C22: ='G. White'!$K$11 -> 43 | D22: ='G. White'!$K$12 -> 45 | E22: ='G. White'!$K$13 -> 42 | F22: ='G. White'!$K$14 -> 39 | G22: ='G. White'!$K$21 -> 45 | H22: ='G. White'!$K$22 -> 41 | I22: ='G. White'!$K$23 -> 40 | J22: ='G. White'!$K$24 -> 42 | K22: ='G. White'!$K$25 -> 43 | M22: ='G. White'!$K$34 -> 43 | N22: ='G. White'!$K$35 -> 37 | O22: ='G. White'!$K$36 -> 48 | P22: ='G. White'!$K$37 -> 39 | Q22: ='G. White'!$K$38 -> 42 | R22: ='G. White'!$K$45 -> 41 | S22: ='G. White'!$K$46 -> 44 | T22: ='G. White'!$K$47 -> 43 | U22: ='G. White'!$K$48 -> 41 | V22: ='G. White'!$K$49 -> 42 | W22: =IF(ISERROR(AVERAGE(IF(B22:V22<>0,B22:V22,""))),"-",(AVERAGE(IF(B22:V22<>0,B22:V22,"")))) -> 42.05 | X22: =IF(ISERROR(W22-37),"-",(W22-37)) -> 5.05 | Y22: ='G. White'!$M$52 -> 38.30 | Z22: =IF(ISERROR(RANK(Y22,Y$20:Y$30,1)),"-",RANK(Y22,Y$20:Y$30,1)) -> 2 | AA22: =IF(MIN(B22:V22)=0,"-",MIN(B22:V22)) -> 37 | AB22: =IF(MAX(B22:V22)=0,"-",MAX(B22:V22)) -> 48 | AC22: ='G. White'!$N$53 -> 33
A24: ='T. Proctor'!$A$1 -> T. Proctor | B24: ='T. Proctor'!$K$10 -> 40 | C24: ='T. Proctor'!$K$11 -> 40 | D24: ='T. Proctor'!$K$12 -> 44 | E24: ='T. Proctor'!$K$13 -> 46 | F24: ='T. Proctor'!$K$14 -> 44 | G24: ='T. Proctor'!$K$21 -> 48 | H24: ='T. Proctor'!$K$22 -> 44 | I24: ='T. Proctor'!$K$23 -> 46 | J24: ='T. Proctor'!$K$24 -> 44 | K24: ='T. Proctor'!$K$25 -> 46 | M24: ='T. Proctor'!$K$34 -> 43 | N24: ='T. Proctor'!$K$35 -> 44 | O24: ='T. Proctor'!$K$36 -> 40 | P24: ='T. Proctor'!$K$37 -> 43 | Q24: ='T. Proctor'!$K$38 -> 47 | R24: ='T. Proctor'!$K$45 -> 45 | S24: ='T. Proctor'!$K$46 -> 45 | T24: ='T. Proctor'!$K$47 -> 45 | U24: ='T. Proctor'!$K$48 -> 45 | V24: ='T. Proctor'!$K$49 -> 43 | W24: =IF(ISERROR(AVERAGE(IF(B24:V24<>0,B24:V24,""))),"-",(AVERAGE(IF(B24:V24<>0,B24:V24,"")))) -> 44.10 | X24: =IF(ISERROR(W24-37),"-",(W24-37)) -> 7.10 | Y24: ='T. Proctor'!$M$52 -> 39.35 | Z24: =IF(ISERROR(RANK(Y24,Y$20:Y$30,1)),"-",RANK(Y24,Y$20:Y$30,1)) -> 5 | AA24: =IF(MIN(B24:V24)=0,"-",MIN(B24:V24)) -> 40 | AB24: =IF(MAX(B24:V24)=0,"-",MAX(B24:V24)) -> 48 | AC24: ='T. Proctor'!$N$53 -> 35
A26: ='S. Jones'!$A$1 -> S. Jones | B26: ='S. Jones'!$K$10 -> 42 | C26: ='S. Jones'!$K$11 -> 48 | D26: ='S. Jones'!$K$12 -> 44 | E26: ='S. Jones'!$K$13 -> 45 | F26: ='S. Jones'!$K$14 -> 46 | G26: ='S. Jones'!$K$21 -> - | H26: ='S. Jones'!$K$22 -> 43 | I26: ='S. Jones'!$K$23 -> 41 | J26: ='S. Jones'!$K$24 -> 42 | K26: ='S. Jones'!$K$25 -> 43 | M26: ='S. Jones'!$K$34 -> 42 | N26: ='S. Jones'!$K$35 -> 45 | O26: ='S. Jones'!$K$36 -> 44 | P26: ='S. Jones'!$K$37 -> 43 | Q26: ='S. Jones'!$K$38 -> 52 | R26: ='S. Jones'!$K$45 -> 45 | S26: ='S. Jones'!$K$46 -> 46 | T26: ='S. Jones'!$K$47 -> 45 | U26: ='S. Jones'!$K$48 -> 46 | V26: ='S. Jones'!$K$49 -> 42 | W26: =IF(ISERROR(AVERAGE(IF(B26:V26<>0,B26:V26,""))),"-",(AVERAGE(IF(B26:V26<>0,B26:V26,"")))) -> 44.421052631578945 | X26: =IF(ISERROR(W26-37),"-",(W26-37)) -> 7.4210526315789451 | Y26: ='S. Jones'!$M$52 -> 38.473684210526315 | Z26: =IF(ISERROR(RANK(Y26,Y$20:Y$30,1)),"-",RANK(Y26,Y$20:Y$30,1)) -> 3 | AA26: =IF(MIN(B26:V26)=0,"-",MIN(B26:V26)) -> 41 | AB26: =IF(MAX(B26:V26)=0,"-",MAX(B26:V26)) -> 52 | AC26: ='S. Jones'!$N$53 -> 34
A28: ='D. Freeman'!$A$1 -> D. Freeman | B28: ='D. Freeman'!$K$10 -> 44 | C28: ='D. Freeman'!$K$11 -> 46 | D28: ='D. Freeman'!$K$12 -> 48 | E28: ='D. Freeman'!$K$13 -> 44 | F28: ='D. Freeman'!$K$14 -> 47 | G28: ='D. Freeman'!$K$21 -> 45 | H28: ='D. Freeman'!$K$22 -> 42 | I28: ='D. Freeman'!$K$23 -> 46 | J28: ='D. Freeman'!$K$24 -> - | K28: ='D. Freeman'!$K$25 -> 45 | M28: ='D. Freeman'!$K$34 -> 40 | N28: ='D. Freeman'!$K$35 -> - | O28: ='D. Freeman'!$K$36 -> - | P28: ='D. Freeman'!$K$37 -> 41 | Q28: ='D. Freeman'!$K$38 -> 48 | R28: ='D. Freeman'!$K$45 -> 40 | S28: ='D. Freeman'!$K$46 -> 45 | T28: ='D. Freeman'!$K$47 -> 42 | U28: ='D. Freeman'!$K$48 -> 47 | V28: ='D. Freeman'!$K$49 -> 40 | W28: =IF(ISERROR(AVERAGE(IF(B28:V28<>0,B28:V28,""))),"-",(AVERAGE(IF(B28:V28<>0,B28:V28,"")))) -> 44.117647058823529 | X28: =IF(ISERROR(W28-37),"-",(W28-37)) -> 7.117647058823529 | Y28: ='D. Freeman'!$M$52 -> 37.470588235294116 | Z28: =IF(ISERROR(RANK(Y28,Y$20:Y$30,1)),"-",RANK(Y28,Y$20:Y$30,1)) -> 1 | AA28: =IF(MIN(B28:V28)=0,"-",MIN(B28:V28)) -> 40 | AB28: =IF(MAX(B28:V28)=0,"-",MAX(B28:V28)) -> 48 | AC28: ='D. Freeman'!$N$53 -> 33
A30: ='M. Fairburn'!$A$1 -> M. Fairburn | B30: ='M. Fairburn'!$K$10 -> 40 | C30: ='M. Fairburn'!$K$11 -> 40 | D30: ='M. Fairburn'!$K$12 -> 43 | E30: ='M. Fairburn'!$K$13 -> 46 | F30: ='M. Fairburn'!$K$14 -> 44 | G30: ='M. Fairburn'!$K$21 -> 41 | H30: ='M. Fairburn'!$K$22 -> 44 | I30: ='M. Fairburn'!$K$23 -> - | J30: ='M. Fairburn'!$K$24 -> - | K30: ='M. Fairburn'!$K$25 -> - | M30: ='M. Fairburn'!$K$34 -> - | N30: ='M. Fairburn'!$K$35 -> - | O30: ='M. Fairburn'!$K$36 -> - | P30: ='M. Fairburn'!$K$37 -> - | Q30: ='M. Fairburn'!$K$38 -> - | R30: ='M. Fairburn'!$K$45 -> 38 | S30: ='M. Fairburn'!$K$46 -> 42 | T30: ='M. Fairburn'!$K$47 -> 39 | U30: ='M. Fairburn'!$K$48 -> 43 | V30: ='M. Fairburn'!$K$49 -> 41 | W30: =IF(ISERROR(AVERAGE(IF(B30:V30<>0,B30:V30,""))),"-",(AVERAGE(IF(B30:V30<>0,B30:V30,"")))) -> 41.75 | X30: =IF(ISERROR(W30-37),"-",(W30-37)) -> 4.75 | Y30: ='M. Fairburn'!$M$52 -> 39.583333333333336 | Z30: =IF(ISERROR(RANK(Y30,Y$20:Y$30,1)),"-",RANK(Y30,Y$20:Y$30,1)) -> 6 | AA30: =IF(MIN(B30:V30)=0,"-",MIN(B30:V30)) -> 38 | AB30: =IF(MAX(B30:V30)=0,"-",MAX(B30:V30)) -> 46 | AC30: ='M. Fairburn'!$N$53 -> 34
X31: Lowest Round | AA31: =IF(MIN(AA20,AA22,AA24,AA26,AA28,AA30)=0,"-",MIN(AA20,AA22,AA24,AA26,AA28,AA30)) -> 37 | AB31: =IF(ISERROR(OFFSET(AA20,MATCH(AA31,$AA$20:$AA$30,0)-1,-26,1,1)),"-",OFFSET(AA20,MATCH(AA31,$AA$20:$AA$30,0)-1,-26,1,1)) -> G. White
A32: Three Players
A33: Week | B33: 1 | C33: 2 | D33: 3 | E33: 4 | F33: 5 | G33: 6 | H33: 7 | I33: 8 | J33: 9 | K33: 10 | M33: 11 | N33: 12 | O33: 13 | P33: 14 | Q33: 15 | R33: 16 | S33: 17 | T33: 18 | U33: 19 | V33: 20 | W33: Avg. | X33: Par | Y33: Net Avg. | Z33: Rank | AA33: Low Rnd. | AB33: Max Rnd. | AC33: Low Net Rnd.
A34: ='R. Adkins'!$A$1 -> R. Adkins | B34: ='R. Adkins'!$K$10 -> 51 | C34: ='R. Adkins'!$K$11 -> 52 | D34: ='R. Adkins'!$K$12 -> 51 | E34: ='R. Adkins'!$K$13 -> 55 | F34: ='R. Adkins'!$K$14 -> 55 | G34: ='R. Adkins'!$K$21 -> 54 | H34: ='R. Adkins'!$K$22 -> 50 | I34: ='R. Adkins'!$K$23 -> 51 | J34: ='R. Adkins'!$K$24 -> 54 | K34: ='R. Adkins'!$K$25 -> 49 | M34: ='R. Adkins'!$K$34 -> 45 | N34: ='R. Adkins'!$K$35 -> - | O34: ='R. Adkins'!$K$36 -> 52 | P34: ='R. Adkins'!$K$37 -> 52 | Q34: ='R. Adkins'!$K$38 -> 50 | R34: ='R. Adkins'!$K$45 -> 52 | S34: ='R. Adkins'!$K$46 -> 52 | T34: ='R. Adkins'!$K$47 -> 52 | U34: ='R. Adkins'!$K$48 -> 48 | V34: ='R. Adkins'!$K$49 -> 50 | W34: =IF(ISERROR(AVERAGE(IF(B34:V34<>0,B34:V34,""))),"-",(AVERAGE(IF(B34:V34<>0,B34:V34,"")))) -> 51.315789473684212 | X34: =IF(ISERROR(W34-37),"-",(W34-37)) -> 14.315789473684212 | Y34: ='R. Adkins'!$M$52 -> 38.315789473684212 | Z34: =IF(ISERROR(RANK(Y34,Y$34:Y$44,1)),"-",RANK(Y34,Y$34:Y$44,1)) -> 2 | AA34: =IF(MIN(B34:V34)=0,"-",MIN(B34:V34)) -> 45 | AB34: =IF(MAX(B34:V34)=0,"-",MAX(B34:V34)) -> 55 | AC34: ='R. Adkins'!$N$53 -> 32
A36: ='G. Taylor'!$A$1 -> G. Taylor | B36: ='G. Taylor'!$K$10 -> 40 | C36: ='G. Taylor'!$K$11 -> 51 | D36: ='G. Taylor'!$K$12 -> 50 | E36: ='G. Taylor'!$K$13 -> 50 | F36: ='G. Taylor'!$K$14 -> 45 | G36: ='G. Taylor'!$K$21 -> 47 | H36: ='G. Taylor'!$K$22 -> 47 | I36: ='G. Taylor'!$K$23 -> 44 | J36: ='G. Taylor'!$K$24 -> 43 | K36: ='G. Taylor'!$K$25 -> 49 | M36: ='G. Taylor'!$K$34 -> 45 | N36: ='G. Taylor'!$K$35 -> 43 | O36: ='G. Taylor'!$K$36 -> 42 | P36: ='G. Taylor'!$K$37 -> 43 | Q36: ='G. Taylor'!$K$38 -> 49 | R36: ='G. Taylor'!$K$45 -> 46 | S36: ='G. Taylor'!$K$46 -> 47 | T36: ='G. Taylor'!$K$47 -> 45 | U36: ='G. Taylor'!$K$48 -> 52 | V36: ='G. Taylor'!$K$49 -> 43 | W36: =IF(ISERROR(AVERAGE(IF(B36:V36<>0,B36:V36,""))),"-",(AVERAGE(IF(B36:V36<>0,B36:V36,"")))) -> 46.05 | X36: =IF(ISERROR(W36-37),"-",(W36-37)) -> 9.05 | Y36: ='G. Taylor'!$M$52 -> 39.05 | Z36: =IF(ISERROR(RANK(Y36,Y$34:Y$44,1)),"-",RANK(Y36,Y$34:Y$44,1)) -> 4 | AA36: =IF(MIN(B36:V36)=0,"-",MIN(B36:V36)) -> 40 | AB36: =IF(MAX(B36:V36)=0,"-",MAX(B36:V36)) -> 52 | AC36: ='G. Taylor'!$N$53 -> 33
A38: ='J. Landers'!$A$1 -> J. Landers | B38: ='J. Landers'!$K$10 -> 50 | C38: ='J. Landers'!$K$11 -> 47 | D38: ='J. Landers'!$K$12 -> 47 | E38: ='J. Landers'!$K$13 -> 51 | F38: ='J. Landers'!$K$14 -> 51 | G38: ='J. Landers'!$K$21 -> 55 | H38: ='J. Landers'!$K$22 -> 56 | I38: ='J. Landers'!$K$23 -> 48 | J38: ='J. Landers'!$K$24 -> 53 | K38: ='J. Landers'!$K$25 -> - | M38: ='J. Landers'!$K$34 -> 51 | N38: ='J. Landers'!$K$35 -> - | O38: ='J. Landers'!$K$36 -> 47 | P38: ='J. Landers'!$K$37 -> 49 | Q38: ='J. Landers'!$K$38 -> 51 | R38: ='J. Landers'!$K$45 -> - | S38: ='J. Landers'!$K$46 -> - | T38: ='J. Landers'!$K$47 -> 50 | U38: ='J. Landers'!$K$48 -> - | V38: ='J. Landers'!$K$49 -> 57 | W38: =IF(ISERROR(AVERAGE(IF(B38:V38<>0,B38:V38,""))),"-",(AVERAGE(IF(B38:V38<>0,B38:V38,"")))) -> 50.866666666666667 | X38: =IF(ISERROR(W38-37),"-",(W38-37)) -> 13.866666666666667 | Y38: ='J. Landers'!$M$52 -> 39.60 | Z38: =IF(ISERROR(RANK(Y38,Y$34:Y$44,1)),"-",RANK(Y38,Y$34:Y$44,1)) -> 6 | AA38: =IF(MIN(B38:V38)=0,"-",MIN(B38:V38)) -> 47 | AB38: =IF(MAX(B38:V38)=0,"-",MAX(B38:V38)) -> 57 | AC38: ='J. Landers'!$N$53 -> 35
A40: ='C. Edwards'!$A$1 -> C. Edwards | B40: ='C. Edwards'!$K$10 -> 50 | C40: ='C. Edwards'!$K$11 -> 57 | D40: ='C. Edwards'!$K$12 -> 59 | E40: ='C. Edwards'!$K$13 -> 46 | F40: ='C. Edwards'!$K$14 -> 51 | G40: ='C. Edwards'!$K$21 -> 46 | H40: ='C. Edwards'!$K$22 -> 46 | I40: ='C. Edwards'!$K$23 -> 50 | J40: ='C. Edwards'!$K$24 -> 47 | K40: ='C. Edwards'!$K$25 -> 54 | M40: ='C. Edwards'!$K$34 -> 48 | N40: ='C. Edwards'!$K$35 -> 43 | O40: ='C. Edwards'!$K$36 -> 51 | P40: ='C. Edwards'!$K$37 -> 39 | Q40: ='C. Edwards'!$K$38 -> 47 | R40: ='C. Edwards'!$K$45 -> 51 | S40: ='C. Edwards'!$K$46 -> 51 | T40: ='C. Edwards'!$K$47 -> 51 | U40: ='C. Edwards'!$K$48 -> 47 | V40: ='C. Edwards'!$K$49 -> 49 | W40: =IF(ISERROR(AVERAGE(IF(B40:V40<>0,B40:V40,""))),"-",(AVERAGE(IF(B40:V40<>0,B40:V40,"")))) -> 49.15 | X40: =IF(ISERROR(W40-37),"-",(W40-37)) -> 12.15 | Y40: ='C. Edwards'!$M$52 -> 39.15 | Z40: =IF(ISERROR(RANK(Y40,Y$34:Y$44,1)),"-",RANK(Y40,Y$34:Y$44,1)) -> 5 | AA40: =IF(MIN(B40:V40)=0,"-",MIN(B40:V40)) -> 39 | AB40: =IF(MAX(B40:V40)=0,"-",MAX(B40:V40)) -> 59 | AC40: ='C. Edwards'!$N$53 -> 29
A42: ='B. Hall'!$A$1 -> B. Hall | B42: ='B. Hall'!$K$10 -> 50 | C42: ='B. Hall'!$K$11 -> 46 | D42: ='B. Hall'!$K$12 -> 49 | E42: ='B. Hall'!$K$13 -> 49 | F42: ='B. Hall'!$K$14 -> 49 | G42: ='B. Hall'!$K$21 -> 47 | H42: ='B. Hall'!$K$22 -> 46 | I42: ='B. Hall'!$K$23 -> 46 | J42: ='B. Hall'!$K$24 -> 49 | K42: ='B. Hall'!$K$25 -> 45 | M42: ='B. Hall'!$K$34 -> 45 | N42: ='B. Hall'!$K$35 -> 42 | O42: ='B. Hall'!$K$36 -> 45 | P42: ='B. Hall'!$K$37 -> 48 | Q42: ='B. Hall'!$K$38 -> 44 | R42: ='B. Hall'!$K$45 -> 42 | S42: ='B. Hall'!$K$46 -> 51 | T42: ='B. Hall'!$K$47 -> 49 | U42: ='B. Hall'!$K$48 -> 43 | V42: ='B. Hall'!$K$49 -> 46 | W42: =IF(ISERROR(AVERAGE(IF(B42:V42<>0,B42:V42,""))),"-",(AVERAGE(IF(B42:V42<>0,B42:V42,"")))) -> 46.55 | X42: =IF(ISERROR(W42-37),"-",(W42-37)) -> 9.55 | Y42: ='B. Hall'!$M$52 -> 37.05 | Z42: =IF(ISERROR(RANK(Y42,Y$34:Y$44,1)),"-",RANK(Y42,Y$34:Y$44,1)) -> 1 | AA42: =IF(MIN(B42:V42)=0,"-",MIN(B42:V42)) -> 42 | AB42: =IF(MAX(B42:V42)=0,"-",MAX(B42:V42)) -> 51 | AC42: ='B. Hall'!$N$53 -> 33
A44: ='G. Yablonski'!$A$1 -> G. Yablonski | B44: ='G. Yablonski'!$K$10 -> 51 | C44: ='G. Yablonski'!$K$11 -> 51 | D44: ='G. Yablonski'!$K$12 -> 45 | E44: ='G. Yablonski'!$K$13 -> 50 | F44: ='G. Yablonski'!$K$14 -> 56 | G44: ='G. Yablonski'!$K$21 -> 54 | H44: ='G. Yablonski'!$K$22 -> 42 | I44: ='G. Yablonski'!$K$23 -> 46 | J44: ='G. Yablonski'!$K$24 -> 49 | K44: ='G. Yablonski'!$K$25 -> 46 | M44: ='G. Yablonski'!$K$34 -> 48 | N44: ='G. Yablonski'!$K$35 -> 49 | O44: ='G. Yablonski'!$K$36 -> 48 | P44: ='G. Yablonski'!$K$37 -> 44 | Q44: ='G. Yablonski'!$K$38 -> 39 | R44: ='G. Yablonski'!$K$45 -> 48 | S44: ='G. Yablonski'!$K$46 -> 50 | T44: ='G. Yablonski'!$K$47 -> 51 | U44: ='G. Yablonski'!$K$48 -> 44 | V44: ='G. Yablonski'!$K$49 -> 47 | W44: =IF(ISERROR(AVERAGE(IF(B44:V44<>0,B44:V44,""))),"-",(AVERAGE(IF(B44:V44<>0,B44:V44,"")))) -> 47.90 | X44: =IF(ISERROR(W44-37),"-",(W44-37)) -> 10.90 | Y44: ='G. Yablonski'!$M$52 -> 38.90 | Z44: =IF(ISERROR(RANK(Y44,Y$34:Y$44,1)),"-",RANK(Y44,Y$34:Y$44,1)) -> 3 | AA44: =IF(MIN(B44:V44)=0,"-",MIN(B44:V44)) -> 39 | AB44: =IF(MAX(B44:V44)=0,"-",MAX(B44:V44)) -> 56 | AC44: ='G. Yablonski'!$N$53 -> 30
X45: Lowest Round | AA45: =IF(MIN(AA34,AA36,AA38,AA40,AA42,AA44)=0,"-",MIN(AA34,AA36,AA38,AA40,AA42,AA44)) -> 39 | AB45: =IF(ISERROR(OFFSET(AA34,MATCH(AA45,$AA$34:$AA$44,0)-1,-26,1,1)),"-",OFFSET(AA34,MATCH(AA45,$AA$34:$AA$44,0)-1,-26,1,1)) -> C. Edwards
A46: Four Players
A47: Week | B47: 1 | C47: 2 | D47: 3 | E47: 4 | F47: 5 | G47: 6 | H47: 7 | I47: 8 | J47: 9 | K47: 10 | M47: 11 | N47: 12 | O47: 13 | P47: 14 | Q47: 15 | R47: 16 | S47: 17 | T47: 18 | U47: 19 | V47: 20 | W47: Avg. | X47: Par | Y47: Net Avg. | Z47: Rank | AA47: Low Rnd. | AB47: Max Rnd. | AC47: Low Net Rnd.
A48: ='L. Baumgarner'!$A$1 -> L. Baumgarner | B48: ='L. Baumgarner'!$K$10 -> 54 | C48: ='L. Baumgarner'!$K$11 -> 52 | D48: ='L. Baumgarner'!$K$12 -> 50 | E48: ='L. Baumgarner'!$K$13 -> 57 | F48: ='L. Baumgarner'!$K$14 -> 54 | G48: ='L. Baumgarner'!$K$21 -> 54 | H48: ='L. Baumgarner'!$K$22 -> 47 | I48: ='L. Baumgarner'!$K$23 -> 47 | J48: ='L. Baumgarner'!$K$24 -> 50 | K48: ='L. Baumgarner'!$K$25 -> 53 | M48: ='L. Baumgarner'!$K$34 -> 48 | N48: ='L. Baumgarner'!$K$35 -> 53 | O48: ='L. Baumgarner'!$K$36 -> 52 | P48: ='L. Baumgarner'!$K$37 -> 52 | Q48: ='L. Baumgarner'!$K$38 -> 54 | R48: ='L. Baumgarner'!$K$45 -> 51 | S48: ='L. Baumgarner'!$K$46 -> 56 | T48: ='L. Baumgarner'!$K$47 -> 58 | U48: ='L. Baumgarner'!$K$48 -> 54 | V48: ='L. Baumgarner'!$K$49 -> 52 | W48: =IF(ISERROR(AVERAGE(IF(B48:V48<>0,B48:V48,""))),"-",(AVERAGE(IF(B48:V48<>0,B48:V48,"")))) -> 52.40 | X48: =IF(ISERROR(W48-37),"-",(W48-37)) -> 15.40 | Y48: ='L. Baumgarner'!$M$52 -> 39.40 | Z48: =IF(ISERROR(RANK(Y48,Y$48:Y$58,1)),"-",RANK(Y48,Y$48:Y$58,1)) -> 5 | AA48: =IF(MIN(B48:V48)=0,"-",MIN(B48:V48)) -> 47 | AB48: =IF(MAX(B48:V48)=0,"-",MAX(B48:V48)) -> 58 | AC48: ='L. Baumgarner'!$N$53 -> 32
A50: ='B. Meadows'!$A$1 -> B. Meadows | B50: ='B. Meadows'!$K$10 -> - | C50: ='B. Meadows'!$K$11 -> 57 | D50: ='B. Meadows'!$K$12 -> 56 | E50: ='B. Meadows'!$K$13 -> 50 | F50: ='B. Meadows'!$K$14 -> 56 | G50: ='B. Meadows'!$K$21 -> 51 | H50: ='B. Meadows'!$K$22 -> 55 | I50: ='B. Meadows'!$K$23 -> 52 | J50: ='B. Meadows'!$K$24 -> 54 | K50: ='B. Meadows'!$K$25 -> - | M50: ='B. Meadows'!$K$34 -> 60 | N50: ='B. Meadows'!$K$35 -> 55 | O50: ='B. Meadows'!$K$36 -> 50 | P50: ='B. Meadows'!$K$37 -> - | Q50: ='B. Meadows'!$K$38 -> 46 | R50: ='B. Meadows'!$K$45 -> 49 | S50: ='B. Meadows'!$K$46 -> 58 | T50: ='B. Meadows'!$K$47 -> 53 | U50: ='B. Meadows'!$K$48 -> 53 | V50: ='B. Meadows'!$K$49 -> 51 | W50: =IF(ISERROR(AVERAGE(IF(B50:V50<>0,B50:V50,""))),"-",(AVERAGE(IF(B50:V50<>0,B50:V50,"")))) -> 53.294117647058826 | X50: =IF(ISERROR(W50-37),"-",(W50-37)) -> 16.294117647058826 | Y50: ='B. Meadows'!$M$52 -> 38.588235294117645 | Z50: =IF(ISERROR(RANK(Y50,Y$48:Y$58,1)),"-",RANK(Y50,Y$48:Y$58,1)) -> 3 | AA50: =IF(MIN(B50:V50)=0,"-",MIN(B50:V50)) -> 46 | AB50: =IF(MAX(B50:V50)=0,"-",MAX(B50:V50)) -> 60 | AC50: ='B. Meadows'!$N$53 -> 31
A52: ='J. Dodrill'!$A$1 -> J. Dodrill | B52: ='J. Dodrill'!$K$10 -> 52 | C52: ='J. Dodrill'!$K$11 -> - | D52: ='J. Dodrill'!$K$12 -> 50 | E52: ='J. Dodrill'!$K$13 -> 54 | F52: ='J. Dodrill'!$K$14 -> 49 | G52: ='J. Dodrill'!$K$21 -> 51 | H52: ='J. Dodrill'!$K$22 -> 51 | I52: ='J. Dodrill'!$K$23 -> 53 | J52: ='J. Dodrill'!$K$24 -> 53 | K52: ='J. Dodrill'!$K$25 -> 56 | M52: ='J. Dodrill'!$K$34 -> 53 | N52: ='J. Dodrill'!$K$35 -> - | O52: ='J. Dodrill'!$K$36 -> 49 | P52: ='J. Dodrill'!$K$37 -> 53 | Q52: ='J. Dodrill'!$K$38 -> - | R52: ='J. Dodrill'!$K$45 -> 58 | S52: ='J. Dodrill'!$K$46 -> 56 | T52: ='J. Dodrill'!$K$47 -> 52 | U52: ='J. Dodrill'!$K$48 -> 52 | V52: ='J. Dodrill'!$K$49 -> - | W52: =IF(ISERROR(AVERAGE(IF(B52:V52<>0,B52:V52,""))),"-",(AVERAGE(IF(B52:V52<>0,B52:V52,"")))) -> 52.625 | X52: =IF(ISERROR(W52-37),"-",(W52-37)) -> 15.625 | Y52: ='J. Dodrill'!$M$52 -> 39.4375 | Z52: =IF(ISERROR(RANK(Y52,Y$48:Y$58,1)),"-",RANK(Y52,Y$48:Y$58,1)) -> 6 | AA52: =IF(MIN(B52:V52)=0,"-",MIN(B52:V52)) -> 49 | AB52: =IF(MAX(B52:V52)=0,"-",MAX(B52:V52)) -> 58 | AC52: ='J. Dodrill'!$N$53 -> 35
A54: ='Mike McComas'!$A$1 -> Mike McComas | B54: ='Mike McComas'!$K$10 -> 52 | C54: ='Mike McComas'!$K$11 -> 55 | D54: ='Mike McComas'!$K$12 -> 54 | E54: ='Mike McComas'!$K$13 -> 54 | F54: ='Mike McComas'!$K$14 -> 56 | G54: ='Mike McComas'!$K$21 -> 56 | H54: ='Mike McComas'!$K$22 -> 49 | I54: ='Mike McComas'!$K$23 -> 54 | J54: ='Mike McComas'!$K$24 -> 58 | K54: ='Mike McComas'!$K$25 -> - | M54: ='Mike McComas'!$K$34 -> 54 | N54: ='Mike McComas'!$K$35 -> 56 | O54: ='Mike McComas'!$K$36 -> 53 | P54: ='Mike McComas'!$K$37 -> 51 | Q54: ='Mike McComas'!$K$38 -> 56 | R54: ='Mike McComas'!$K$45 -> - | S54: ='Mike McComas'!$K$46 -> 55 | T54: ='Mike McComas'!$K$47 -> 58 | U54: ='Mike McComas'!$K$48 -> 57 | V54: ='Mike McComas'!$K$49 -> 47 | W54: =IF(ISERROR(AVERAGE(IF(B54:V54<>0,B54:V54,""))),"-",(AVERAGE(IF(B54:V54<>0,B54:V54,"")))) -> 54.166666666666664 | X54: =IF(ISERROR(W54-37),"-",(W54-37)) -> 17.166666666666664 | Y54: ='Mike McComas'!$M$52 -> 37.833333333333336 | Z54: =IF(ISERROR(RANK(Y54,Y$48:Y$58,1)),"-",RANK(Y54,Y$48:Y$58,1)) -> 1 | AA54: =IF(MIN(B54:V54)=0,"-",MIN(B54:V54)) -> 47 | AB54: =IF(MAX(B54:V54)=0,"-",MAX(B54:V54)) -> 58 | AC54: ='Mike McComas'!$N$53 -> 32
A56: ='B. Kyle'!$A$1 -> B. Kyle | B56: ='B. Kyle'!$K$10 -> 53 | C56: ='B. Kyle'!$K$11 -> 60 | D56: ='B. Kyle'!$K$12 -> 49 | E56: ='B. Kyle'!$K$13 -> 59 | F56: ='B. Kyle'!$K$14 -> 53 | G56: ='B. Kyle'!$K$21 -> 54 | H56: ='B. Kyle'!$K$22 -> 52 | I56: ='B. Kyle'!$K$23 -> 53 | J56: ='B. Kyle'!$K$24 -> 52 | K56: ='B. Kyle'!$K$25 -> 49 | M56: ='B. Kyle'!$K$34 -> 53 | N56: ='B. Kyle'!$K$35 -> 51 | O56: ='B. Kyle'!$K$36 -> 55 | P56: ='B. Kyle'!$K$37 -> 51 | Q56: ='B. Kyle'!$K$38 -> 51 | R56: ='B. Kyle'!$K$45 -> 61 | S56: ='B. Kyle'!$K$46 -> - | T56: ='B. Kyle'!$K$47 -> 45 | U56: ='B. Kyle'!$K$48 -> 56 | V56: ='B. Kyle'!$K$49 -> 52 | W56: =IF(ISERROR(AVERAGE(IF(B56:V56<>0,B56:V56,""))),"-",(AVERAGE(IF(B56:V56<>0,B56:V56,"")))) -> 53.10526315789474 | X56: =IF(ISERROR(W56-37),"-",(W56-37)) -> 16.10526315789474 | Y56: ='B. Kyle'!$M$52 -> 38.05263157894737 | Z56: =IF(ISERROR(RANK(Y56,Y$48:Y$58,1)),"-",RANK(Y56,Y$48:Y$58,1)) -> 2 | AA56: =IF(MIN(B56:V56)=0,"-",MIN(B56:V56)) -> 45 | AB56: =IF(MAX(B56:V56)=0,"-",MAX(B56:V56)) -> 61 | AC56: ='B. Kyle'!$N$53 -> 31
A58: ='B. Harbour'!$A$1 -> B. Harbour | B58: ='B. Harbour'!$K$10 -> 54 | C58: ='B. Harbour'!$K$11 -> 57 | D58: ='B. Harbour'!$K$12 -> 56 | E58: ='B. Harbour'!$K$13 -> 54 | F58: ='B. Harbour'!$K$14 -> 57 | G58: ='B. Harbour'!$K$21 -> 60 | H58: ='B. Harbour'!$K$22 -> 50 | I58: ='B. Harbour'!$K$23 -> 56 | J58: ='B. Harbour'!$K$24 -> 64 | K58: ='B. Harbour'!$K$25 -> 54 | M58: ='B. Harbour'!$K$34 -> 52 | N58: ='B. Harbour'!$K$35 -> 51 | O58: ='B. Harbour'!$K$36 -> 58 | P58: ='B. Harbour'!$K$37 -> 54 | Q58: ='B. Harbour'!$K$38 -> 51 | R58: ='B. Harbour'!$K$45 -> 59 | S58: ='B. Harbour'!$K$46 -> 60 | T58: ='B. Harbour'!$K$47 -> 54 | U58: ='B. Harbour'!$K$48 -> 54 | V58: ='B. Harbour'!$K$49 -> 56 | W58: =IF(ISERROR(AVERAGE(IF(B58:V58<>0,B58:V58,""))),"-",(AVERAGE(IF(B58:V58<>0,B58:V58,"")))) -> 55.55 | X58: =IF(ISERROR(W58-37),"-",(W58-37)) -> 18.55 | Y58: ='B. Harbour'!$M$52 -> 39.05 | Z58: =IF(ISERROR(RANK(Y58,Y$48:Y$58,1)),"-",RANK(Y58,Y$48:Y$58,1)) -> 4 | AA58: =IF(MIN(B58:V58)=0,"-",MIN(B58:V58)) -> 50 | AB58: =IF(MAX(B58:V58)=0,"-",MAX(B58:V58)) -> 64 | AC58: ='B. Harbour'!$N$53 -> 32
X59: Lowest Round | AA59: =IF(MIN(AA48,AA50,AA52,AA54,AA56,AA58)=0,"-",MIN(AA48,AA50,AA52,AA54,AA56,AA58)) -> 45 | AB59: =IF(ISERROR(OFFSET(AA48,MATCH(AA59,$AA$48:$AA$58,0)-1,-26,1,1)),"-",OFFSET(AA48,MATCH(AA59,$AA$48:$AA$58,0)-1,-26,1,1)) -> B. Kyle