A2: =MID(CELL("filename",A1),FIND("]",CELL("filename",A1))+1,LEN(CELL("filename",A1))-FIND("]",CELL("filename",A1))) -> Standings
A4: 2009
A6: ='Team Scores'!AI7 -> Teams | B6: ='Team Scores'!AJ7 -> 1st Half Points | C6: ='Team Scores'!AL7 -> 1st Half Wins | D6: ='Team Scores'!AQ7 -> 1st Half Rank | E6: ='Team Scores'!AT7 -> 1st Half Leader | F6: ='Team Scores'!AU7 -> Points
A7: ='Team Scores'!AI8 -> Team 1 | B7: ='Team Scores'!AJ8 -> 30 | C7: ='Team Scores'!AL8 -> 12 | D7: ='Team Scores'!AQ8 -> 6 | E7: ='Team Scores'!AT8 -> Team 5 | F7: ='Team Scores'!AU8 -> 55
A8: ='Team Scores'!AI9 -> Team 2 | B8: ='Team Scores'!AJ9 -> 45 | C8: ='Team Scores'!AL9 -> 20 | D8: ='Team Scores'!AQ9 -> 2
A9: ='Team Scores'!AI10 -> Team 3 | B9: ='Team Scores'!AJ10 -> 34 | C9: ='Team Scores'!AL10 -> 14 | D9: ='Team Scores'!AQ10 -> 4
A10: ='Team Scores'!AI11 -> Team 4 | B10: ='Team Scores'!AJ11 -> 35 | C10: ='Team Scores'!AL11 -> 12 | D10: ='Team Scores'!AQ11 -> 3
A11: ='Team Scores'!AI12 -> Team 5 | B11: ='Team Scores'!AJ12 -> 55 | C11: ='Team Scores'!AL12 -> 26 | D11: ='Team Scores'!AQ12 -> 1
A12: ='Team Scores'!AI13 -> Team 6 | B12: ='Team Scores'!AJ13 -> 34 | C12: ='Team Scores'!AL13 -> 16 | D12: ='Team Scores'!AQ13 -> 4
A16: ='Team Scores'!AI15 -> Teams | B16: ='Team Scores'!AJ15 -> 2nd Half Points | C16: ='Team Scores'!AL15 -> 2nd Half Wins | D16: ='Team Scores'!AQ15 -> 2nd Half Rank | E16: ='Team Scores'!AT15 -> 2nd Half Leader | F16: ='Team Scores'!AU15 -> Points
A17: ='Team Scores'!AI16 -> Team 1 | B17: ='Team Scores'!AJ16 -> 39 | C17: ='Team Scores'!AL16 -> 15 | D17: ='Team Scores'!AQ16 -> 4 | E17: ='Team Scores'!AT16 -> Team 6 | F17: ='Team Scores'!AU16 -> 48
A18: ='Team Scores'!AI17 -> Team 2 | B18: ='Team Scores'!AJ17 -> 43 | C18: ='Team Scores'!AL17 -> 20 | D18: ='Team Scores'!AQ17 -> 2
A19: ='Team Scores'!AI18 -> Team 3 | B19: ='Team Scores'!AJ18 -> 29 | C19: ='Team Scores'!AL18 -> 12 | D19: ='Team Scores'!AQ18 -> 6
A20: ='Team Scores'!AI19 -> Team 4 | B20: ='Team Scores'!AJ19 -> 35 | C20: ='Team Scores'!AL19 -> 15 | D20: ='Team Scores'!AQ19 -> 5
A21: ='Team Scores'!AI20 -> Team 5 | B21: ='Team Scores'!AJ20 -> 40 | C21: ='Team Scores'!AL20 -> 17 | D21: ='Team Scores'!AQ20 -> 3
A22: ='Team Scores'!AI21 -> Team 6 | B22: ='Team Scores'!AJ21 -> 48 | C22: ='Team Scores'!AL21 -> 22 | D22: ='Team Scores'!AQ21 -> 1