A2: =MID(CELL("filename",A1),FIND("]",CELL("filename",A1))+1,LEN(CELL("filename",A1))-FIND("]",CELL("filename",A1))) -> Individual Championship Round
A5: =Standings!$A$4 -> 2009
A8: One Players
A9: Par | B9: 4 | C9: 3 | D9: 4 | E9: 4 | F9: 5 | G9: 3 | H9: 5 | I9: 4 | J9: 5 | K9: 37 | L9: 4 | M9: 4 | N9: 4 | O9: 3 | P9: 4 | Q9: 4 | R9: 3 | S9: 3 | T9: 4 | U9: 33
A10: Hole | B10: 1 | C10: 2 | D10: 3 | E10: 4 | F10: 5 | G10: 6 | H10: 7 | I10: 8 | J10: 9 | L10: 10 | M10: 11 | N10: 12 | O10: 13 | P10: 14 | Q10: 15 | R10: 16 | S10: 17 | T10: 18 | V10: Actual | W10: Par | X10: HC | Y10: Net | Z10: Par | AA10: Rank | AB10: Putts
A11: ='R. Keeney'!$A$1 -> R. Keeney | B11: 4 | C11: 5 | D11: 4 | E11: 4 | F11: 4 | G11: 4 | H11: 5 | I11: 5 | J11: 5 | K11: =IF(SUM(B11:J11)=0,"-",SUM(B11:J11)) -> 40 | L11: 6 | M11: 5 | N11: 5 | O11: 3 | P11: 4 | Q11: 4 | R11: 3 | S11: 2 | T11: 5 | U11: =IF(SUM(L11:T11)=0,"-",SUM(L11:T11)) -> 37 | V11: =IF(SUM(K11,U11)=0,"-",SUM(K11,U11)) -> 77 | W11: =IF(ISERROR(IF(V11-37=-70, "-", V11-70)),"-",(IF(V11-70=-70,"-",V11-70))) -> 7 | X11: =Handicaps!G7 -> 3 | Y11: =IF(ISERROR(IF(V11-(ROUND(X11,0))=-X11, 0, V11-(ROUND(X11,0)))),"-",(IF(V11-(ROUND(X11,0))=-X11, 0, V11-(ROUND(X11,0))))) -> 74 | Z11: =IF(ISERROR(IF(Y11-70=-70, "-", Y11-70)),"-",(IF(Y11-70=-70,"-",Y11-70))) -> 4 | AA11: =IF(ISERROR(RANK(Z11,Z$11:Z$46,1)),"-",RANK(Z11,Z$11:Z$46,1)) -> 6 | AB11: 28
A12: ='D. Smith'!$A$1 -> D. Smith | B12: 4 | C12: 5 | D12: 3 | E12: 4 | F12: 5 | G12: 3 | H12: 4 | I12: 4 | J12: 5 | K12: =IF(SUM(B12:J12)=0,"-",SUM(B12:J12)) -> 37 | L12: 4 | M12: 5 | N12: 5 | O12: 3 | P12: 5 | Q12: 5 | R12: 4 | S12: 4 | T12: 5 | U12: =IF(SUM(L12:T12)=0,"-",SUM(L12:T12)) -> 40 | V12: =IF(SUM(K12,U12)=0,"-",SUM(K12,U12)) -> 77 | W12: =IF(ISERROR(IF(V12-37=-70, "-", V12-70)),"-",(IF(V12-70=-70,"-",V12-70))) -> 7 | X12: =Handicaps!G8 -> 6 | Y12: =IF(ISERROR(IF(V12-(ROUND(X12,0))=-X12, 0, V12-(ROUND(X12,0)))),"-",(IF(V12-(ROUND(X12,0))=-X12, 0, V12-(ROUND(X12,0))))) -> 71 | Z12: =IF(ISERROR(IF(Y12-70=-70, "-", Y12-70)),"-",(IF(Y12-70=-70,"-",Y12-70))) -> 1 | AA12: =IF(ISERROR(RANK(Z12,Z$11:Z$46,1)),"-",RANK(Z12,Z$11:Z$46,1)) -> 2 | AB12: 32
A13: ='R. Ours'!$A$1 -> R. Ours | B13: 4 | C13: 4 | D13: 3 | E13: 3 | F13: 5 | G13: 5 | H13: 6 | I13: 4 | J13: 8 | K13: =IF(SUM(B13:J13)=0,"-",SUM(B13:J13)) -> 42 | L13: 4 | M13: 4 | N13: 4 | O13: 3 | P13: 4 | Q13: 4 | R13: 5 | S13: 3 | T13: 4 | U13: =IF(SUM(L13:T13)=0,"-",SUM(L13:T13)) -> 35 | V13: =IF(SUM(K13,U13)=0,"-",SUM(K13,U13)) -> 77 | W13: =IF(ISERROR(IF(V13-37=-70, "-", V13-70)),"-",(IF(V13-70=-70,"-",V13-70))) -> 7 | X13: =Handicaps!G9 -> 1.5 | Y13: =IF(ISERROR(IF(V13-(ROUND(X13,0))=-X13, 0, V13-(ROUND(X13,0)))),"-",(IF(V13-(ROUND(X13,0))=-X13, 0, V13-(ROUND(X13,0))))) -> 75 | Z13: =IF(ISERROR(IF(Y13-70=-70, "-", Y13-70)),"-",(IF(Y13-70=-70,"-",Y13-70))) -> 5 | AA13: =IF(ISERROR(RANK(Z13,Z$11:Z$46,1)),"-",RANK(Z13,Z$11:Z$46,1)) -> 8 | AB13: 30
A14: ='V. Bunn'!$A$1 -> V. Bunn | B14: 4 | C14: 3 | D14: 4 | E14: 4 | F14: 4 | G14: 3 | H14: 7 | I14: 4 | J14: 6 | K14: =IF(SUM(B14:J14)=0,"-",SUM(B14:J14)) -> 39 | L14: 4 | M14: 4 | N14: 4 | O14: 4 | P14: 4 | Q14: 4 | R14: 4 | S14: 3 | T14: 3 | U14: =IF(SUM(L14:T14)=0,"-",SUM(L14:T14)) -> 34 | V14: =IF(SUM(K14,U14)=0,"-",SUM(K14,U14)) -> 73 | W14: =IF(ISERROR(IF(V14-37=-70, "-", V14-70)),"-",(IF(V14-70=-70,"-",V14-70))) -> 3 | X14: =Handicaps!G10 -> 3 | Y14: =IF(ISERROR(IF(V14-(ROUND(X14,0))=-X14, 0, V14-(ROUND(X14,0)))),"-",(IF(V14-(ROUND(X14,0))=-X14, 0, V14-(ROUND(X14,0))))) -> 70 | Z14: =IF(ISERROR(IF(Y14-70=-70, "-", Y14-70)),"-",(IF(Y14-70=-70,"-",Y14-70))) -> 0 | AA14: =IF(ISERROR(RANK(Z14,Z$11:Z$46,1)),"-",RANK(Z14,Z$11:Z$46,1)) -> 1 | AB14: 33
A15: ='M. Rutherford'!$A$1 -> M. Rutherford | K15: =IF(SUM(B15:J15)=0,"-",SUM(B15:J15)) -> - | U15: =IF(SUM(L15:T15)=0,"-",SUM(L15:T15)) -> - | V15: =IF(SUM(K15,U15)=0,"-",SUM(K15,U15)) -> - | W15: =IF(ISERROR(IF(V15-37=-70, "-", V15-70)),"-",(IF(V15-70=-70,"-",V15-70))) -> - | X15: =Handicaps!G11 -> 4.5 | Y15: =IF(ISERROR(IF(V15-(ROUND(X15,0))=-X15, 0, V15-(ROUND(X15,0)))),"-",(IF(V15-(ROUND(X15,0))=-X15, 0, V15-(ROUND(X15,0))))) -> - | Z15: =IF(ISERROR(IF(Y15-70=-70, "-", Y15-70)),"-",(IF(Y15-70=-70,"-",Y15-70))) -> - | AA15: =IF(ISERROR(RANK(Z15,Z$11:Z$46,1)),"-",RANK(Z15,Z$11:Z$46,1)) -> -
A16: ='R. Crowder'!$A$1 -> R. Crowder | B16: 5 | C16: 4 | D16: 4 | E16: 5 | F16: 5 | G16: 3 | H16: 5 | I16: 6 | J16: 5 | K16: =IF(SUM(B16:J16)=0,"-",SUM(B16:J16)) -> 42 | L16: 4 | M16: 4 | N16: 4 | O16: 4 | P16: 5 | Q16: 4 | R16: 5 | S16: 5 | T16: 3 | U16: =IF(SUM(L16:T16)=0,"-",SUM(L16:T16)) -> 38 | V16: =IF(SUM(K16,U16)=0,"-",SUM(K16,U16)) -> 80 | W16: =IF(ISERROR(IF(V16-37=-70, "-", V16-70)),"-",(IF(V16-70=-70,"-",V16-70))) -> 10 | X16: =Handicaps!G12 -> 3 | Y16: =IF(ISERROR(IF(V16-(ROUND(X16,0))=-X16, 0, V16-(ROUND(X16,0)))),"-",(IF(V16-(ROUND(X16,0))=-X16, 0, V16-(ROUND(X16,0))))) -> 77 | Z16: =IF(ISERROR(IF(Y16-70=-70, "-", Y16-70)),"-",(IF(Y16-70=-70,"-",Y16-70))) -> 7 | AA16: =IF(ISERROR(RANK(Z16,Z$11:Z$46,1)),"-",RANK(Z16,Z$11:Z$46,1)) -> 12 | AB16: 31
A18: Two Players
A19: Par | B19: 4 | C19: 3 | D19: 4 | E19: 4 | F19: 5 | G19: 3 | H19: 5 | I19: 4 | J19: 5 | K19: 37 | L19: 4 | M19: 4 | N19: 4 | O19: 3 | P19: 4 | Q19: 4 | R19: 3 | S19: 3 | T19: 4 | U19: 33
A20: Hole | B20: 1 | C20: 2 | D20: 3 | E20: 4 | F20: 5 | G20: 6 | H20: 7 | I20: 8 | J20: 9 | L20: 10 | M20: 11 | N20: 12 | O20: 13 | P20: 14 | Q20: 15 | R20: 16 | S20: 17 | T20: 18 | V20: Actual | W20: Par | X20: HC | Y20: Net | Z20: Par | AA20: Rank | AB20: Putts
A21: ='Matt McComas'!$A$1 -> Matt McComas | B21: 4 | C21: 4 | D21: 5 | E21: 5 | F21: 9 | G21: 4 | H21: 5 | I21: 5 | J21: 6 | K21: =IF(SUM(B21:J21)=0,"-",SUM(B21:J21)) -> 47 | L21: 3 | M21: 5 | N21: 4 | O21: 3 | P21: 4 | Q21: 6 | R21: 7 | S21: 4 | T21: 4 | U21: =IF(SUM(L21:T21)=0,"-",SUM(L21:T21)) -> 40 | V21: =IF(SUM(K21,U21)=0,"-",SUM(K21,U21)) -> 87 | W21: =IF(ISERROR(IF(V21-37=-70, "-", V21-70)),"-",(IF(V21-70=-70,"-",V21-70))) -> 17 | X21: =Handicaps!G16 -> 9 | Y21: =IF(ISERROR(IF(V21-(ROUND(X21,0))=-X21, 0, V21-(ROUND(X21,0)))),"-",(IF(V21-(ROUND(X21,0))=-X21, 0, V21-(ROUND(X21,0))))) -> 78 | Z21: =IF(ISERROR(IF(Y21-70=-70, "-", Y21-70)),"-",(IF(Y21-70=-70,"-",Y21-70))) -> 8 | AA21: =IF(ISERROR(RANK(Z21,Z$11:Z$46,1)),"-",RANK(Z21,Z$11:Z$46,1)) -> 14 | AB21: 30
A22: ='G. White'!$A$1 -> G. White | K22: =IF(SUM(B22:J22)=0,"-",SUM(B22:J22)) -> - | U22: =IF(SUM(L22:T22)=0,"-",SUM(L22:T22)) -> - | V22: =IF(SUM(K22,U22)=0,"-",SUM(K22,U22)) -> - | W22: =IF(ISERROR(IF(V22-37=-70, "-", V22-70)),"-",(IF(V22-70=-70,"-",V22-70))) -> - | X22: =Handicaps!G17 -> 4.5 | Y22: =IF(ISERROR(IF(V22-(ROUND(X22,0))=-X22, 0, V22-(ROUND(X22,0)))),"-",(IF(V22-(ROUND(X22,0))=-X22, 0, V22-(ROUND(X22,0))))) -> - | Z22: =IF(ISERROR(IF(Y22-70=-70, "-", Y22-70)),"-",(IF(Y22-70=-70,"-",Y22-70))) -> - | AA22: =IF(ISERROR(RANK(Z22,Z$11:Z$46,1)),"-",RANK(Z22,Z$11:Z$46,1)) -> -
A23: ='T. Proctor'!$A$1 -> T. Proctor | B23: 4 | C23: 3 | D23: 4 | E23: 5 | F23: 6 | G23: 4 | H23: 5 | I23: 4 | J23: 7 | K23: =IF(SUM(B23:J23)=0,"-",SUM(B23:J23)) -> 42 | L23: 6 | M23: 6 | N23: 4 | O23: 2 | P23: 4 | Q23: 5 | R23: 4 | S23: 3 | T23: 4 | U23: =IF(SUM(L23:T23)=0,"-",SUM(L23:T23)) -> 38 | V23: =IF(SUM(K23,U23)=0,"-",SUM(K23,U23)) -> 80 | W23: =IF(ISERROR(IF(V23-37=-70, "-", V23-70)),"-",(IF(V23-70=-70,"-",V23-70))) -> 10 | X23: =Handicaps!G18 -> 9 | Y23: =IF(ISERROR(IF(V23-(ROUND(X23,0))=-X23, 0, V23-(ROUND(X23,0)))),"-",(IF(V23-(ROUND(X23,0))=-X23, 0, V23-(ROUND(X23,0))))) -> 71 | Z23: =IF(ISERROR(IF(Y23-70=-70, "-", Y23-70)),"-",(IF(Y23-70=-70,"-",Y23-70))) -> 1 | AA23: =IF(ISERROR(RANK(Z23,Z$11:Z$46,1)),"-",RANK(Z23,Z$11:Z$46,1)) -> 2 | AB23: 29
A24: ='S. Jones'!$A$1 -> S. Jones | B24: 4 | C24: 4 | D24: 5 | E24: 4 | F24: 6 | G24: 4 | H24: 5 | I24: 5 | J24: 5 | K24: =IF(SUM(B24:J24)=0,"-",SUM(B24:J24)) -> 42 | L24: 5 | M24: 4 | N24: 4 | O24: 3 | P24: 5 | Q24: 7 | R24: 4 | S24: 4 | T24: 5 | U24: =IF(SUM(L24:T24)=0,"-",SUM(L24:T24)) -> 41 | V24: =IF(SUM(K24,U24)=0,"-",SUM(K24,U24)) -> 83 | W24: =IF(ISERROR(IF(V24-37=-70, "-", V24-70)),"-",(IF(V24-70=-70,"-",V24-70))) -> 13 | X24: =Handicaps!G19 -> 9 | Y24: =IF(ISERROR(IF(V24-(ROUND(X24,0))=-X24, 0, V24-(ROUND(X24,0)))),"-",(IF(V24-(ROUND(X24,0))=-X24, 0, V24-(ROUND(X24,0))))) -> 74 | Z24: =IF(ISERROR(IF(Y24-70=-70, "-", Y24-70)),"-",(IF(Y24-70=-70,"-",Y24-70))) -> 4 | AA24: =IF(ISERROR(RANK(Z24,Z$11:Z$46,1)),"-",RANK(Z24,Z$11:Z$46,1)) -> 6 | AB24: 30
A25: ='D. Freeman'!$A$1 -> D. Freeman | B25: 4 | C25: 4 | D25: 4 | E25: 5 | F25: 5 | G25: 4 | H25: 6 | I25: 4 | J25: 6 | K25: =IF(SUM(B25:J25)=0,"-",SUM(B25:J25)) -> 42 | L25: 6 | M25: 5 | N25: 7 | O25: 4 | P25: 5 | Q25: 4 | R25: 3 | S25: 3 | T25: 6 | U25: =IF(SUM(L25:T25)=0,"-",SUM(L25:T25)) -> 43 | V25: =IF(SUM(K25,U25)=0,"-",SUM(K25,U25)) -> 85 | W25: =IF(ISERROR(IF(V25-37=-70, "-", V25-70)),"-",(IF(V25-70=-70,"-",V25-70))) -> 15 | X25: =Handicaps!G20 -> 7.5 | Y25: =IF(ISERROR(IF(V25-(ROUND(X25,0))=-X25, 0, V25-(ROUND(X25,0)))),"-",(IF(V25-(ROUND(X25,0))=-X25, 0, V25-(ROUND(X25,0))))) -> 77 | Z25: =IF(ISERROR(IF(Y25-70=-70, "-", Y25-70)),"-",(IF(Y25-70=-70,"-",Y25-70))) -> 7 | AA25: =IF(ISERROR(RANK(Z25,Z$11:Z$46,1)),"-",RANK(Z25,Z$11:Z$46,1)) -> 12 | AB25: 33
A26: ='M. Fairburn'!$A$1 -> M. Fairburn | K26: =IF(SUM(B26:J26)=0,"-",SUM(B26:J26)) -> - | U26: =IF(SUM(L26:T26)=0,"-",SUM(L26:T26)) -> - | V26: =IF(SUM(K26,U26)=0,"-",SUM(K26,U26)) -> - | W26: =IF(ISERROR(IF(V26-37=-70, "-", V26-70)),"-",(IF(V26-70=-70,"-",V26-70))) -> - | X26: =Handicaps!G21 -> 4.5 | Y26: =IF(ISERROR(IF(V26-(ROUND(X26,0))=-X26, 0, V26-(ROUND(X26,0)))),"-",(IF(V26-(ROUND(X26,0))=-X26, 0, V26-(ROUND(X26,0))))) -> - | Z26: =IF(ISERROR(IF(Y26-70=-70, "-", Y26-70)),"-",(IF(Y26-70=-70,"-",Y26-70))) -> - | AA26: =IF(ISERROR(RANK(Z26,Z$11:Z$46,1)),"-",RANK(Z26,Z$11:Z$46,1)) -> -
A28: Three Players
A29: Par | B29: 4 | C29: 3 | D29: 4 | E29: 4 | F29: 5 | G29: 3 | H29: 5 | I29: 4 | J29: 5 | K29: 37 | L29: 4 | M29: 4 | N29: 4 | O29: 3 | P29: 4 | Q29: 4 | R29: 3 | S29: 3 | T29: 4 | U29: 33
A30: Hole | B30: 1 | C30: 2 | D30: 3 | E30: 4 | F30: 5 | G30: 6 | H30: 7 | I30: 8 | J30: 9 | L30: 10 | M30: 11 | N30: 12 | O30: 13 | P30: 14 | Q30: 15 | R30: 16 | S30: 17 | T30: 18 | V30: Actual | W30: Par | X30: HC | Y30: Net | Z30: Par | AA30: Rank | AB30: Putts
A31: ='R. Adkins'!$A$1 -> R. Adkins | B31: 5 | C31: 4 | D31: 6 | E31: 5 | F31: 6 | G31: 5 | H31: 7 | I31: 7 | J31: 8 | K31: =IF(SUM(B31:J31)=0,"-",SUM(B31:J31)) -> 53 | L31: 5 | M31: 4 | N31: 5 | O31: 4 | P31: 5 | Q31: 7 | R31: 4 | S31: 3 | T31: 5 | U31: =IF(SUM(L31:T31)=0,"-",SUM(L31:T31)) -> 42 | V31: =IF(SUM(K31,U31)=0,"-",SUM(K31,U31)) -> 95 | W31: =IF(ISERROR(IF(V31-37=-70, "-", V31-70)),"-",(IF(V31-70=-70,"-",V31-70))) -> 25 | X31: =Handicaps!G25 -> 19.5 | Y31: =IF(ISERROR(IF(V31-(ROUND(X31,0))=-X31, 0, V31-(ROUND(X31,0)))),"-",(IF(V31-(ROUND(X31,0))=-X31, 0, V31-(ROUND(X31,0))))) -> 75 | Z31: =IF(ISERROR(IF(Y31-70=-70, "-", Y31-70)),"-",(IF(Y31-70=-70,"-",Y31-70))) -> 5 | AA31: =IF(ISERROR(RANK(Z31,Z$11:Z$46,1)),"-",RANK(Z31,Z$11:Z$46,1)) -> 8 | AB31: 37
A32: ='G. Taylor'!$A$1 -> G. Taylor | B32: 5 | C32: 4 | D32: 5 | E32: 7 | F32: 7 | G32: 4 | H32: 5 | I32: 4 | J32: 5 | K32: =IF(SUM(B32:J32)=0,"-",SUM(B32:J32)) -> 46 | L32: 4 | M32: 4 | N32: 5 | O32: 3 | P32: 4 | Q32: 5 | R32: 4 | S32: 3 | T32: 4 | U32: =IF(SUM(L32:T32)=0,"-",SUM(L32:T32)) -> 36 | V32: =IF(SUM(K32,U32)=0,"-",SUM(K32,U32)) -> 82 | W32: =IF(ISERROR(IF(V32-37=-70, "-", V32-70)),"-",(IF(V32-70=-70,"-",V32-70))) -> 12 | X32: =Handicaps!G26 -> 9 | Y32: =IF(ISERROR(IF(V32-(ROUND(X32,0))=-X32, 0, V32-(ROUND(X32,0)))),"-",(IF(V32-(ROUND(X32,0))=-X32, 0, V32-(ROUND(X32,0))))) -> 73 | Z32: =IF(ISERROR(IF(Y32-70=-70, "-", Y32-70)),"-",(IF(Y32-70=-70,"-",Y32-70))) -> 3 | AA32: =IF(ISERROR(RANK(Z32,Z$11:Z$46,1)),"-",RANK(Z32,Z$11:Z$46,1)) -> 4 | AB32: 29
A33: ='J. Landers'!$A$1 -> J. Landers | B33: 5 | C33: 6 | D33: 5 | E33: 7 | F33: 7 | G33: 3 | H33: 5 | I33: 6 | J33: 8 | K33: =IF(SUM(B33:J33)=0,"-",SUM(B33:J33)) -> 52 | L33: 7 | M33: 5 | N33: 6 | O33: 5 | P33: 5 | Q33: 6 | R33: 5 | S33: 5 | T33: 6 | U33: =IF(SUM(L33:T33)=0,"-",SUM(L33:T33)) -> 50 | V33: =IF(SUM(K33,U33)=0,"-",SUM(K33,U33)) -> 102 | W33: =IF(ISERROR(IF(V33-37=-70, "-", V33-70)),"-",(IF(V33-70=-70,"-",V33-70))) -> 32 | X33: =Handicaps!G27 -> 18 | Y33: =IF(ISERROR(IF(V33-(ROUND(X33,0))=-X33, 0, V33-(ROUND(X33,0)))),"-",(IF(V33-(ROUND(X33,0))=-X33, 0, V33-(ROUND(X33,0))))) -> 84 | Z33: =IF(ISERROR(IF(Y33-70=-70, "-", Y33-70)),"-",(IF(Y33-70=-70,"-",Y33-70))) -> 14 | AA33: =IF(ISERROR(RANK(Z33,Z$11:Z$46,1)),"-",RANK(Z33,Z$11:Z$46,1)) -> 19 | AB33: 32
A34: ='C. Edwards'!$A$1 -> C. Edwards | K34: =IF(SUM(B34:J34)=0,"-",SUM(B34:J34)) -> - | U34: =IF(SUM(L34:T34)=0,"-",SUM(L34:T34)) -> - | V34: =IF(SUM(K34,U34)=0,"-",SUM(K34,U34)) -> - | W34: =IF(ISERROR(IF(V34-37=-70, "-", V34-70)),"-",(IF(V34-70=-70,"-",V34-70))) -> - | X34: =Handicaps!G28 -> 13.5 | Y34: =IF(ISERROR(IF(V34-(ROUND(X34,0))=-X34, 0, V34-(ROUND(X34,0)))),"-",(IF(V34-(ROUND(X34,0))=-X34, 0, V34-(ROUND(X34,0))))) -> - | Z34: =IF(ISERROR(IF(Y34-70=-70, "-", Y34-70)),"-",(IF(Y34-70=-70,"-",Y34-70))) -> - | AA34: =IF(ISERROR(RANK(Z34,Z$11:Z$46,1)),"-",RANK(Z34,Z$11:Z$46,1)) -> -
A35: ='B. Hall'!$A$1 -> B. Hall | B35: 5 | C35: 4 | D35: 5 | E35: 7 | F35: 6 | G35: 3 | H35: 6 | I35: 8 | J35: 8 | K35: =IF(SUM(B35:J35)=0,"-",SUM(B35:J35)) -> 52 | L35: 3 | M35: 4 | N35: 5 | O35: 3 | P35: 5 | Q35: 5 | R35: 4 | S35: 4 | T35: 4 | U35: =IF(SUM(L35:T35)=0,"-",SUM(L35:T35)) -> 37 | V35: =IF(SUM(K35,U35)=0,"-",SUM(K35,U35)) -> 89 | W35: =IF(ISERROR(IF(V35-37=-70, "-", V35-70)),"-",(IF(V35-70=-70,"-",V35-70))) -> 19 | X35: =Handicaps!G29 -> 10.5 | Y35: =IF(ISERROR(IF(V35-(ROUND(X35,0))=-X35, 0, V35-(ROUND(X35,0)))),"-",(IF(V35-(ROUND(X35,0))=-X35, 0, V35-(ROUND(X35,0))))) -> 78 | Z35: =IF(ISERROR(IF(Y35-70=-70, "-", Y35-70)),"-",(IF(Y35-70=-70,"-",Y35-70))) -> 8 | AA35: =IF(ISERROR(RANK(Z35,Z$11:Z$46,1)),"-",RANK(Z35,Z$11:Z$46,1)) -> 14 | AB35: 35
A36: ='G. Yablonski'!$A$1 -> G. Yablonski | K36: =IF(SUM(B36:J36)=0,"-",SUM(B36:J36)) -> - | U36: =IF(SUM(L36:T36)=0,"-",SUM(L36:T36)) -> - | V36: =IF(SUM(K36,U36)=0,"-",SUM(K36,U36)) -> - | W36: =IF(ISERROR(IF(V36-37=-70, "-", V36-70)),"-",(IF(V36-70=-70,"-",V36-70))) -> - | X36: =Handicaps!G30 -> 12 | Y36: =IF(ISERROR(IF(V36-(ROUND(X36,0))=-X36, 0, V36-(ROUND(X36,0)))),"-",(IF(V36-(ROUND(X36,0))=-X36, 0, V36-(ROUND(X36,0))))) -> - | Z36: =IF(ISERROR(IF(Y36-70=-70, "-", Y36-70)),"-",(IF(Y36-70=-70,"-",Y36-70))) -> - | AA36: =IF(ISERROR(RANK(Z36,Z$11:Z$46,1)),"-",RANK(Z36,Z$11:Z$46,1)) -> -
A38: Four Players
A39: Par | B39: 4 | C39: 3 | D39: 4 | E39: 4 | F39: 5 | G39: 3 | H39: 5 | I39: 4 | J39: 5 | K39: 37 | L39: 4 | M39: 4 | N39: 4 | O39: 3 | P39: 4 | Q39: 4 | R39: 3 | S39: 3 | T39: 4 | U39: 33
A40: Hole | B40: 1 | C40: 2 | D40: 3 | E40: 4 | F40: 5 | G40: 6 | H40: 7 | I40: 8 | J40: 9 | L40: 10 | M40: 11 | N40: 12 | O40: 13 | P40: 14 | Q40: 15 | R40: 16 | S40: 17 | T40: 18 | V40: Actual | W40: Par | X40: HC | Y40: Net | Z40: Par | AA40: Rank | AB40: Putts
A41: ='L. Baumgarner'!$A$1 -> L. Baumgarner | B41: 4 | C41: 4 | D41: 5 | E41: 4 | F41: 7 | G41: 3 | H41: 6 | I41: 5 | J41: 7 | K41: =IF(SUM(B41:J41)=0,"-",SUM(B41:J41)) -> 45 | L41: 7 | M41: 5 | N41: 8 | O41: 4 | P41: 5 | Q41: 8 | R41: 7 | S41: 2 | T41: 4 | U41: =IF(SUM(L41:T41)=0,"-",SUM(L41:T41)) -> 50 | V41: =IF(SUM(K41,U41)=0,"-",SUM(K41,U41)) -> 95 | W41: =IF(ISERROR(IF(V41-37=-70, "-", V41-70)),"-",(IF(V41-70=-70,"-",V41-70))) -> 25 | X41: =Handicaps!G34 -> 19.5 | Y41: =IF(ISERROR(IF(V41-(ROUND(X41,0))=-X41, 0, V41-(ROUND(X41,0)))),"-",(IF(V41-(ROUND(X41,0))=-X41, 0, V41-(ROUND(X41,0))))) -> 75 | Z41: =IF(ISERROR(IF(Y41-70=-70, "-", Y41-70)),"-",(IF(Y41-70=-70,"-",Y41-70))) -> 5 | AA41: =IF(ISERROR(RANK(Z41,Z$11:Z$46,1)),"-",RANK(Z41,Z$11:Z$46,1)) -> 8 | AB41: 31
A42: ='B. Meadows'!$A$1 -> B. Meadows | B42: 5 | C42: 5 | D42: 4 | E42: 7 | F42: 7 | G42: 4 | H42: 7 | I42: 6 | J42: 8 | K42: =IF(SUM(B42:J42)=0,"-",SUM(B42:J42)) -> 53 | L42: 6 | M42: 4 | N42: 8 | O42: 4 | P42: 7 | Q42: 6 | R42: 4 | S42: 4 | T42: 5 | U42: =IF(SUM(L42:T42)=0,"-",SUM(L42:T42)) -> 48 | V42: =IF(SUM(K42,U42)=0,"-",SUM(K42,U42)) -> 101 | W42: =IF(ISERROR(IF(V42-37=-70, "-", V42-70)),"-",(IF(V42-70=-70,"-",V42-70))) -> 31 | X42: =Handicaps!G35 -> 21 | Y42: =IF(ISERROR(IF(V42-(ROUND(X42,0))=-X42, 0, V42-(ROUND(X42,0)))),"-",(IF(V42-(ROUND(X42,0))=-X42, 0, V42-(ROUND(X42,0))))) -> 80 | Z42: =IF(ISERROR(IF(Y42-70=-70, "-", Y42-70)),"-",(IF(Y42-70=-70,"-",Y42-70))) -> 10 | AA42: =IF(ISERROR(RANK(Z42,Z$11:Z$46,1)),"-",RANK(Z42,Z$11:Z$46,1)) -> 18 | AB42: 34
A43: ='J. Dodrill'!$A$1 -> J. Dodrill | B43: 6 | C43: 4 | D43: 6 | E43: 6 | F43: 5 | G43: 4 | H43: 9 | I43: 4 | J43: 8 | K43: =IF(SUM(B43:J43)=0,"-",SUM(B43:J43)) -> 52 | L43: 4 | M43: 6 | N43: 6 | O43: 4 | P43: 6 | Q43: 5 | R43: 5 | S43: 4 | T43: 7 | U43: =IF(SUM(L43:T43)=0,"-",SUM(L43:T43)) -> 47 | V43: =IF(SUM(K43,U43)=0,"-",SUM(K43,U43)) -> 99 | W43: =IF(ISERROR(IF(V43-37=-70, "-", V43-70)),"-",(IF(V43-70=-70,"-",V43-70))) -> 29 | X43: =Handicaps!G36 -> 21 | Y43: =IF(ISERROR(IF(V43-(ROUND(X43,0))=-X43, 0, V43-(ROUND(X43,0)))),"-",(IF(V43-(ROUND(X43,0))=-X43, 0, V43-(ROUND(X43,0))))) -> 78 | Z43: =IF(ISERROR(IF(Y43-70=-70, "-", Y43-70)),"-",(IF(Y43-70=-70,"-",Y43-70))) -> 8 | AA43: =IF(ISERROR(RANK(Z43,Z$11:Z$46,1)),"-",RANK(Z43,Z$11:Z$46,1)) -> 14 | AB43: 36
A44: ='Mike McComas'!$A$1 -> Mike McComas | B44: 5 | C44: 6 | D44: 6 | E44: 5 | F44: 7 | G44: 3 | H44: 6 | I44: 6 | J44: 8 | K44: =IF(SUM(B44:J44)=0,"-",SUM(B44:J44)) -> 52 | L44: 4 | M44: 6 | N44: 5 | O44: 5 | P44: 6 | Q44: 6 | R44: 6 | S44: 5 | T44: 4 | U44: =IF(SUM(L44:T44)=0,"-",SUM(L44:T44)) -> 47 | V44: =IF(SUM(K44,U44)=0,"-",SUM(K44,U44)) -> 99 | W44: =IF(ISERROR(IF(V44-37=-70, "-", V44-70)),"-",(IF(V44-70=-70,"-",V44-70))) -> 29 | X44: =Handicaps!G37 -> 22.5 | Y44: =IF(ISERROR(IF(V44-(ROUND(X44,0))=-X44, 0, V44-(ROUND(X44,0)))),"-",(IF(V44-(ROUND(X44,0))=-X44, 0, V44-(ROUND(X44,0))))) -> 76 | Z44: =IF(ISERROR(IF(Y44-70=-70, "-", Y44-70)),"-",(IF(Y44-70=-70,"-",Y44-70))) -> 6 | AA44: =IF(ISERROR(RANK(Z44,Z$11:Z$46,1)),"-",RANK(Z44,Z$11:Z$46,1)) -> 11 | AB44: 38
A45: ='B. Kyle'!$A$1 -> B. Kyle | B45: 3 | C45: 4 | D45: 4 | E45: 5 | F45: 5 | G45: 4 | H45: 5 | I45: 6 | J45: 9 | K45: =IF(SUM(B45:J45)=0,"-",SUM(B45:J45)) -> 45 | L45: 7 | M45: 5 | N45: 5 | O45: 5 | P45: 5 | Q45: 6 | R45: 5 | S45: 5 | T45: 6 | U45: =IF(SUM(L45:T45)=0,"-",SUM(L45:T45)) -> 49 | V45: =IF(SUM(K45,U45)=0,"-",SUM(K45,U45)) -> 94 | W45: =IF(ISERROR(IF(V45-37=-70, "-", V45-70)),"-",(IF(V45-70=-70,"-",V45-70))) -> 24 | X45: =Handicaps!G38 -> 21 | Y45: =IF(ISERROR(IF(V45-(ROUND(X45,0))=-X45, 0, V45-(ROUND(X45,0)))),"-",(IF(V45-(ROUND(X45,0))=-X45, 0, V45-(ROUND(X45,0))))) -> 73 | Z45: =IF(ISERROR(IF(Y45-70=-70, "-", Y45-70)),"-",(IF(Y45-70=-70,"-",Y45-70))) -> 3 | AA45: =IF(ISERROR(RANK(Z45,Z$11:Z$46,1)),"-",RANK(Z45,Z$11:Z$46,1)) -> 4 | AB45: 36
A46: ='B. Harbour'!$A$1 -> B. Harbour | B46: 6 | C46: 6 | D46: 6 | E46: 7 | F46: 5 | G46: 4 | H46: 6 | I46: 5 | J46: 7 | K46: =IF(SUM(B46:J46)=0,"-",SUM(B46:J46)) -> 52 | L46: 5 | M46: 6 | N46: 5 | O46: 4 | P46: 7 | Q46: 7 | R46: 8 | S46: 3 | T46: 5 | U46: =IF(SUM(L46:T46)=0,"-",SUM(L46:T46)) -> 50 | V46: =IF(SUM(K46,U46)=0,"-",SUM(K46,U46)) -> 102 | W46: =IF(ISERROR(IF(V46-37=-70, "-", V46-70)),"-",(IF(V46-70=-70,"-",V46-70))) -> 32 | X46: =Handicaps!G39 -> 24 | Y46: =IF(ISERROR(IF(V46-(ROUND(X46,0))=-X46, 0, V46-(ROUND(X46,0)))),"-",(IF(V46-(ROUND(X46,0))=-X46, 0, V46-(ROUND(X46,0))))) -> 78 | Z46: =IF(ISERROR(IF(Y46-70=-70, "-", Y46-70)),"-",(IF(Y46-70=-70,"-",Y46-70))) -> 8 | AA46: =IF(ISERROR(RANK(Z46,Z$11:Z$46,1)),"-",RANK(Z46,Z$11:Z$46,1)) -> 14 | AB46: 35
Z47: Low Putts | AB47: =IF(MIN(AB11,AB12,AB13,AB13,AB14,AB15,AB16,AB21,AB22,AB23,AB24,AB25,AB26,AB31,AB32,AB33,AB34,AB35,AB36,AB41,AB42,AB43,AB44,AB45,AB46)=0,"-",MIN(AB11,AB12,AB13,AB13,AB14,AB15,AB16,AB21,AB22,AB23,AB24,AB25,AB26,AB31,AB32,AB33,AB34,AB35,AB36,AB41,AB42,AB43,AB44,AB45,AB46)) -> 28 | AC47: =IF(ISERROR(OFFSET(AB11,MATCH(AB47,$AB$11:$AB$46,0)-1,-27,1,1)),"-",OFFSET(AB11,MATCH(AB47,$AB$11:$AB$46,0)-1,-27,1,1)) -> R. Keeney