A2: =MID(CELL("filename",A1),FIND("]",CELL("filename",A1))+1,LEN(CELL("filename",A1))-FIND("]",CELL("filename",A1))) -> Handicaps
A4: =Standings!$A$4 -> 2009
A5: One Players | K5: 2010 Player Breakdown
B6: 1st Quarter | C6: 2nd Quarter | D6: 3rd Quarter | E6: 4th Quarter | F6: EOY | G6: 18 Hole | K6: 1 Players
A7: ='R. Keeney'!$A$1 -> R. Keeney | B7: =IF('R. Keeney'!$C$7=" ","-",'R. Keeney'!$C$7) -> 2 | C7: ='R. Keeney'!$C$18 -> 4 | D7: ='R. Keeney'!$C$31 -> 4 | E7: ='R. Keeney'!$C$42 -> 2 | F7: ='R. Keeney'!$T$53 -> 2.2 | G7: =IF(ISERROR(ROUND(F7,0)*1.5),"-",ROUND(F7,0)*1.5) -> 3 | J7: ='R. Ours'!$A$1 -> R. Ours | K7: ='R. Ours'!$T$53 -> 1.30
A8: ='D. Smith'!$A$1 -> D. Smith | B8: =IF('D. Smith'!$C$7=" ","-",'D. Smith'!$C$7) -> 2 | C8: ='D. Smith'!$C$18 -> 6 | D8: ='D. Smith'!$C$31 -> 5 | E8: ='D. Smith'!$C$42 -> 4 | F8: ='D. Smith'!$T$53 -> 3.8 | G8: =IF(ISERROR(ROUND(F8,0)*1.5),"-",ROUND(F8,0)*1.5) -> 6 | J8: ='R. Crowder'!$A$1 -> R. Crowder | K8: ='R. Crowder'!$T$53 -> 1.8571428571428541
A9: ='R. Ours'!$A$1 -> R. Ours | B9: =IF('R. Ours'!$C$7=" ","-",'R. Ours'!$C$7) -> 2 | C9: ='R. Ours'!$C$18 -> 2 | D9: ='R. Ours'!$C$31 -> 2 | E9: ='R. Ours'!$C$42 -> 2 | F9: ='R. Ours'!$T$53 -> 1.3 | G9: =IF(ISERROR(ROUND(F9,0)*1.5),"-",ROUND(F9,0)*1.5) -> 1.5 | J9: ='R. Keeney'!$A$1 -> R. Keeney | K9: ='R. Keeney'!$T$53 -> 2.20
A10: ='V. Bunn'!$A$1 -> V. Bunn | B10: =IF('V. Bunn'!$C$7=" ","-",'V. Bunn'!$C$7) -> 2 | C10: ='V. Bunn'!$C$18 -> 3 | D10: ='V. Bunn'!$C$31 -> 3 | E10: ='V. Bunn'!$C$42 -> 2 | F10: ='V. Bunn'!$T$53 -> 2.3 | G10: =IF(ISERROR(ROUND(F10,0)*1.5),"-",ROUND(F10,0)*1.5) -> 3 | J10: ='V. Bunn'!$A$1 -> V. Bunn | K10: ='V. Bunn'!$T$53 -> 2.30
A11: ='M. Rutherford'!$A$1 -> M. Rutherford | B11: =IF('M. Rutherford'!$C$7=" ","-",'M. Rutherford'!$C$7) -> 3 | C11: ='M. Rutherford'!$C$18 -> 2 | D11: ='M. Rutherford'!$C$31 -> 3 | E11: ='M. Rutherford'!$C$42 -> 2 | F11: ='M. Rutherford'!$T$53 -> 2.5555555555555571 | G11: =IF(ISERROR(ROUND(F11,0)*1.5),"-",ROUND(F11,0)*1.5) -> 4.5 | J11: ='M. Rutherford'!$A$1 -> M. Rutherford | K11: ='M. Rutherford'!$T$53 -> 2.5555555555555571
A12: ='R. Crowder'!$A$1 -> R. Crowder | B12: =IF('R. Crowder'!$C$7=" ","-",'R. Crowder'!$C$7) -> 4 | C12: ='R. Crowder'!$C$18 -> 3 | D12: ='R. Crowder'!$C$31 -> 4 | E12: ='R. Crowder'!$C$42 -> 2 | F12: ='R. Crowder'!$T$53 -> 1.8571428571428541 | G12: =IF(ISERROR(ROUND(F12,0)*1.5),"-",ROUND(F12,0)*1.5) -> 3 | J12: ='G. White'!$A$1 -> G. White | K12: ='G. White'!$T$53 -> 3.30
K13: 2 Players
A14: Two Players | J14: ='D. Smith'!$A$1 -> D. Smith | K14: ='D. Smith'!$T$53 -> 3.80
B15: 1st Quarter | C15: 2nd Quarter | D15: 3rd Quarter | E15: 4th Quarter | F15: EOY | G15: 18 Hole | J15: ='D. Freeman'!$A$1 -> D. Freeman | K15: ='D. Freeman'!$T$53 -> 5.00
A16: ='Matt McComas'!$A$1 -> Matt McComas | B16: =IF('Matt McComas'!$C$7=" ","-",'Matt McComas'!$C$7) -> 5 | C16: ='Matt McComas'!$C$18 -> 7 | D16: ='Matt McComas'!$C$31 -> 6 | E16: ='Matt McComas'!$C$42 -> 6 | F16: ='Matt McComas'!$T$53 -> 5.7 | G16: =IF(ISERROR(ROUND(F16,0)*1.5),"-",ROUND(F16,0)*1.5) -> 9 | J16: ='T. Proctor'!$A$1 -> T. Proctor | K16: ='T. Proctor'!$T$53 -> 5.50
A17: ='G. White'!$A$1 -> G. White | B17: =IF('G. White'!$C$7=" ","-",'G. White'!$C$7) -> 4 | C17: ='G. White'!$C$18 -> 4 | D17: ='G. White'!$C$31 -> 4 | E17: ='G. White'!$C$42 -> 3 | F17: ='G. White'!$T$53 -> 3.3 | G17: =IF(ISERROR(ROUND(F17,0)*1.5),"-",ROUND(F17,0)*1.5) -> 4.5 | J17: ='S. Jones'!$A$1 -> S. Jones | K17: ='S. Jones'!$T$53 -> 5.60
A18: ='T. Proctor'!$A$1 -> T. Proctor | B18: =IF('T. Proctor'!$C$7=" ","-",'T. Proctor'!$C$7) -> 5 | C18: ='T. Proctor'!$C$18 -> 4 | D18: ='T. Proctor'!$C$31 -> 5 | E18: ='T. Proctor'!$C$42 -> 5 | F18: ='T. Proctor'!$T$53 -> 5.5 | G18: =IF(ISERROR(ROUND(F18,0)*1.5),"-",ROUND(F18,0)*1.5) -> 9 | J18: ='Matt McComas'!$A$1 -> Matt McComas | K18: ='Matt McComas'!$T$53 -> 5.70
A19: ='S. Jones'!$A$1 -> S. Jones | B19: =IF('S. Jones'!$C$7=" ","-",'S. Jones'!$C$7) -> 7 | C19: ='S. Jones'!$C$18 -> 7 | D19: ='S. Jones'!$C$31 -> 5 | E19: ='S. Jones'!$C$42 -> 5 | F19: ='S. Jones'!$T$53 -> 5.6 | G19: =IF(ISERROR(ROUND(F19,0)*1.5),"-",ROUND(F19,0)*1.5) -> 9 | J19: ='G. Taylor'!$A$1 -> G. Taylor | K19: ='G. Taylor'!$T$53 -> 6.30
A20: ='D. Freeman'!$A$1 -> D. Freeman | B20: =IF('D. Freeman'!$C$7=" ","-",'D. Freeman'!$C$7) -> 6 | C20: ='D. Freeman'!$C$18 -> 8 | D20: ='D. Freeman'!$C$31 -> 7 | E20: ='D. Freeman'!$C$42 -> 6 | F20: ='D. Freeman'!$T$53 -> 5 | G20: =IF(ISERROR(ROUND(F20,0)*1.5),"-",ROUND(F20,0)*1.5) -> 7.5 | K20: 3 Players
A21: ='M. Fairburn'!$A$1 -> M. Fairburn | B21: =IF('M. Fairburn'!$C$7=" ","-",'M. Fairburn'!$C$7) -> 0 | C21: ='M. Fairburn'!$C$18 -> 3 | D21: ='M. Fairburn'!$C$31 -> 4 | E21: ='M. Fairburn'!$C$42 -> 4 | F21: ='M. Fairburn'!$T$53 -> 2.8333333333333357 | G21: =IF(ISERROR(ROUND(F21,0)*1.5),"-",ROUND(F21,0)*1.5) -> 4.5 | J21: ='B. Hall'!$A$1 -> B. Hall | K21: ='B. Hall'!$T$53 -> 7.40
J22: ='T. Way'!$A$1 -> T. Way | K22: ='T. Way'!$T$53 -> 7.80
A23: Three Players | J23: ='G. Yablonski'!$A$1 -> G. Yablonski | K23: ='G. Yablonski'!$T$53 -> 7.90
B24: 1st Quarter | C24: 2nd Quarter | D24: 3rd Quarter | E24: 4th Quarter | F24: EOY | G24: 18 Hole | J24: ='C. Edwards'!$A$1 -> C. Edwards | K24: ='C. Edwards'!$T$53 -> 8.80
A25: ='R. Adkins'!$A$1 -> R. Adkins | B25: =IF('R. Adkins'!$C$7=" ","-",'R. Adkins'!$C$7) -> 12 | C25: ='R. Adkins'!$C$18 -> 14 | D25: ='R. Adkins'!$C$31 -> 13 | E25: ='R. Adkins'!$C$42 -> 13 | F25: ='R. Adkins'!$T$53 -> 12.7 | G25: =IF(ISERROR(ROUND(F25,0)*1.5),"-",ROUND(F25,0)*1.5) -> 19.5 | J25: ='J. Landers'!$A$1 -> J. Landers | K25: ='J. Landers'!$T$53 -> 11.625
A26: ='G. Taylor'!$A$1 -> G. Taylor | B26: =IF('G. Taylor'!$C$7=" ","-",'G. Taylor'!$C$7) -> 7 | C26: ='G. Taylor'!$C$18 -> 8 | D26: ='G. Taylor'!$C$31 -> 7 | E26: ='G. Taylor'!$C$42 -> 6 | F26: ='G. Taylor'!$T$53 -> 6.3 | G26: =IF(ISERROR(ROUND(F26,0)*1.5),"-",ROUND(F26,0)*1.5) -> 9 | J26: ='R. Adkins'!$A$1 -> R. Adkins | K26: ='R. Adkins'!$T$53 -> 12.70
A27: ='J. Landers'!$A$1 -> J. Landers | B27: =IF('J. Landers'!$C$7=" ","-",'J. Landers'!$C$7) -> 11 | C27: ='J. Landers'!$C$18 -> 11 | D27: ='J. Landers'!$C$31 -> 12 | E27: ='J. Landers'!$C$42 -> 11 | F27: ='J. Landers'!$T$53 -> 11.625 | G27: =IF(ISERROR(ROUND(F27,0)*1.5),"-",ROUND(F27,0)*1.5) -> 18 | K27: 4 Players
A28: ='C. Edwards'!$A$1 -> C. Edwards | B28: =IF('C. Edwards'!$C$7=" ","-",'C. Edwards'!$C$7) -> 10 | C28: ='C. Edwards'!$C$18 -> 12 | D28: ='C. Edwards'!$C$31 -> 10 | E28: ='C. Edwards'!$C$42 -> 8 | F28: ='C. Edwards'!$T$53 -> 8.8 | G28: =IF(ISERROR(ROUND(F28,0)*1.5),"-",ROUND(F28,0)*1.5) -> 13.5 | J28: ='L. Baumgarner'!$A$1 -> L. Baumgarner | K28: ='L. Baumgarner'!$T$53 -> 13.10
A29: ='B. Hall'!$A$1 -> B. Hall | B29: =IF('B. Hall'!$C$7=" ","-",'B. Hall'!$C$7) -> 10 | C29: ='B. Hall'!$C$18 -> 11 | D29: ='B. Hall'!$C$31 -> 9 | E29: ='B. Hall'!$C$42 -> 8 | F29: ='B. Hall'!$T$53 -> 7.4 | G29: =IF(ISERROR(ROUND(F29,0)*1.5),"-",ROUND(F29,0)*1.5) -> 10.5 | J29: ='B. Kyle'!$A$1 -> B. Kyle | K29: ='B. Kyle'!$T$53 -> 13.50
A30: ='G. Yablonski'!$A$1 -> G. Yablonski | B30: =IF('G. Yablonski'!$C$7=" ","-",'G. Yablonski'!$C$7) -> 7 | C30: ='G. Yablonski'!$C$18 -> 12 | D30: ='G. Yablonski'!$C$31 -> 9 | E30: ='G. Yablonski'!$C$42 -> 8 | F30: ='G. Yablonski'!$T$53 -> 7.9 | G30: =IF(ISERROR(ROUND(F30,0)*1.5),"-",ROUND(F30,0)*1.5) -> 12 | J30: ='B. Meadows'!$A$1 -> B. Meadows | K30: ='B. Meadows'!$T$53 -> 13.555555555555557
J31: ='J. Dodrill'!$A$1 -> J. Dodrill | K31: ='J. Dodrill'!$T$53 -> 13.75
A32: Four Players | J32: ='Mike McComas'!$A$1 -> Mike McComas | K32: ='Mike McComas'!$T$53 -> 15.00
B33: 1st Quarter | C33: 2nd Quarter | D33: 3rd Quarter | E33: 4th Quarter | F33: EOY | G33: 18 Hole | J33: ='B. Harbour'!$A$1 -> B. Harbour | K33: ='B. Harbour'!$T$53 -> 15.80
A34: ='L. Baumgarner'!$A$1 -> L. Baumgarner | B34: =IF('L. Baumgarner'!$C$7=" ","-",'L. Baumgarner'!$C$7) -> 12 | C34: ='L. Baumgarner'!$C$18 -> 15 | D34: ='L. Baumgarner'!$C$31 -> 12 | E34: ='L. Baumgarner'!$C$42 -> 13 | F34: ='L. Baumgarner'!$T$53 -> 13.1 | G34: =IF(ISERROR(ROUND(F34,0)*1.5),"-",ROUND(F34,0)*1.5) -> 19.5
A35: ='B. Meadows'!$A$1 -> B. Meadows | B35: =IF('B. Meadows'!$C$7=" ","-",'B. Meadows'!$C$7) -> 14 | C35: ='B. Meadows'!$C$18 -> 16 | D35: ='B. Meadows'!$C$31 -> 15 | E35: ='B. Meadows'!$C$42 -> 14 | F35: ='B. Meadows'!$T$53 -> 13.555555555555557 | G35: =IF(ISERROR(ROUND(F35,0)*1.5),"-",ROUND(F35,0)*1.5) -> 21
A36: ='J. Dodrill'!$A$1 -> J. Dodrill | B36: =IF('J. Dodrill'!$C$7=" ","-",'J. Dodrill'!$C$7) -> 13 | C36: ='J. Dodrill'!$C$18 -> 13 | D36: ='J. Dodrill'!$C$31 -> 14 | E36: ='J. Dodrill'!$C$42 -> 13 | F36: ='J. Dodrill'!$T$53 -> 13.75 | G36: =IF(ISERROR(ROUND(F36,0)*1.5),"-",ROUND(F36,0)*1.5) -> 21
A37: ='Mike McComas'!$A$1 -> Mike McComas | B37: =IF('Mike McComas'!$C$7=" ","-",'Mike McComas'!$C$7) -> 18 | C37: ='Mike McComas'!$C$18 -> 16 | D37: ='Mike McComas'!$C$31 -> 16 | E37: ='Mike McComas'!$C$42 -> 15 | F37: ='Mike McComas'!$T$53 -> 15 | G37: =IF(ISERROR(ROUND(F37,0)*1.5),"-",ROUND(F37,0)*1.5) -> 22.5
A38: ='B. Kyle'!$A$1 -> B. Kyle | B38: =IF('B. Kyle'!$C$7=" ","-",'B. Kyle'!$C$7) -> 17 | C38: ='B. Kyle'!$C$18 -> 15 | D38: ='B. Kyle'!$C$31 -> 14 | E38: ='B. Kyle'!$C$42 -> 14 | F38: ='B. Kyle'!$T$53 -> 13.5 | G38: =IF(ISERROR(ROUND(F38,0)*1.5),"-",ROUND(F38,0)*1.5) -> 21
A39: ='B. Harbour'!$A$1 -> B. Harbour | B39: =IF('B. Harbour'!$C$7=" ","-",'B. Harbour'!$C$7) -> 15 | C39: ='B. Harbour'!$C$18 -> 18 | D39: ='B. Harbour'!$C$31 -> 17 | E39: ='B. Harbour'!$C$42 -> 16 | F39: ='B. Harbour'!$T$53 -> 15.8 | G39: =IF(ISERROR(ROUND(F39,0)*1.5),"-",ROUND(F39,0)*1.5) -> 24