A2: =MID(CELL("filename",A1),FIND("]",CELL("filename",A1))+1,LEN(CELL("filename",A1))-FIND("]",CELL("filename",A1))) -> Individual Stats by Group
A3: =Standings!$A$4 -> 2008
A4: One Players
A5: Week | B5: 1 | C5: 2 | D5: 3 | E5: 4 | F5: 5 | G5: 6 | H5: 7 | I5: 8 | J5: 9 | K5: 10 | M5: 11 | N5: 12 | O5: 13 | P5: 14 | Q5: 15 | R5: 16 | S5: 17 | T5: 18 | U5: 19 | V5: 20 | W5: Avg. | X5: Par | Y5: Net Avg. | Z5: Rank | AA5: Low Rnd. | AB5: Max Rnd. | AC5: Low Net Rnd.
A6: ='R. Ours'!$A$1 -> R. Ours | B6: ='R. Ours'!$K$10 -> 41 | C6: ='R. Ours'!$K$11 -> 38 | D6: ='R. Ours'!$K$12 -> 44 | E6: ='R. Ours'!$K$13 -> - | F6: ='R. Ours'!$K$14 -> 42 | G6: ='R. Ours'!$K$21 -> 43 | H6: ='R. Ours'!$K$22 -> 41 | I6: ='R. Ours'!$K$23 -> - | J6: ='R. Ours'!$K$24 -> 42 | K6: ='R. Ours'!$K$25 -> 38 | M6: ='R. Ours'!$K$34 -> 42 | N6: ='R. Ours'!$K$35 -> 40 | O6: ='R. Ours'!$K$36 -> 43 | P6: ='R. Ours'!$K$37 -> 38 | Q6: ='R. Ours'!$K$38 -> 38 | R6: ='R. Ours'!$K$45 -> 40 | S6: ='R. Ours'!$K$46 -> 41 | T6: ='R. Ours'!$K$47 -> 43 | U6: ='R. Ours'!$K$48 -> 41 | V6: ='R. Ours'!$K$49 -> 35 | W6: =IF(ISERROR(AVERAGE(IF(B6:V6<>0,B6:V6,""))),"-",(AVERAGE(IF(B6:V6<>0,B6:V6,"")))) -> 40.555555555555557 | X6: =IF(ISERROR(W6-37),"-",(W6-37)) -> 3.5555555555555571 | Y6: ='R. Ours'!$M$52 -> 38.277777777777779 | Z6: =IF(ISERROR(RANK(Y6,Y$6:Y$16,1)),"-",RANK(Y6,Y$6:Y$16,1)) -> 3 | AA6: =IF(MIN(B6:V6)=0,"-",MIN(B6:V6)) -> 35 | AB6: =IF(MAX(C6:W6)=0,"-",MAX(C6:W6)) -> 44 | AC6: ='R. Ours'!$N$53 -> 33
A8: ='G. White'!$A$1 -> G. White | B8: ='G. White'!$K$10 -> 42 | C8: ='G. White'!$K$11 -> 45 | D8: ='G. White'!$K$12 -> 42 | E8: ='G. White'!$K$13 -> 42 | F8: ='G. White'!$K$14 -> 48 | G8: ='G. White'!$K$21 -> 43 | H8: ='G. White'!$K$22 -> 48 | I8: ='G. White'!$K$23 -> 44 | J8: ='G. White'!$K$24 -> 39 | K8: ='G. White'!$K$25 -> 40 | M8: ='G. White'!$K$34 -> 43 | N8: ='G. White'!$K$35 -> 37 | O8: ='G. White'!$K$36 -> 48 | P8: ='G. White'!$K$37 -> - | Q8: ='G. White'!$K$38 -> 41 | R8: ='G. White'!$K$45 -> 47 | S8: ='G. White'!$K$46 -> 43 | T8: ='G. White'!$K$47 -> 45 | U8: ='G. White'!$K$48 -> 46 | V8: ='G. White'!$K$49 -> - | W8: =IF(ISERROR(AVERAGE(IF(B8:V8<>0,B8:V8,""))),"-",(AVERAGE(IF(B8:V8<>0,B8:V8,"")))) -> 43.50 | X8: =IF(ISERROR(W8-37),"-",(W8-37)) -> 6.50 | Y8: ='G. White'!$M$52 -> 39.722222222222221 | Z8: =IF(ISERROR(RANK(Y8,Y$6:Y$16,1)),"-",RANK(Y8,Y$6:Y$16,1)) -> 6 | AA8: =IF(MIN(B8:V8)=0,"-",MIN(B8:V8)) -> 37 | AB8: =IF(MAX(C8:W8)=0,"-",MAX(C8:W8)) -> 48 | AC8: ='G. White'!$N$53 -> 33
A10: ='R. Keeney'!$A$1 -> R. Keeney | B10: ='R. Keeney'!$K$10 -> 35 | C10: ='R. Keeney'!$K$11 -> 40 | D10: ='R. Keeney'!$K$12 -> - | E10: ='R. Keeney'!$K$13 -> 41 | F10: ='R. Keeney'!$K$14 -> 41 | G10: ='R. Keeney'!$K$21 -> 38 | H10: ='R. Keeney'!$K$22 -> 47 | I10: ='R. Keeney'!$K$23 -> 41 | J10: ='R. Keeney'!$K$24 -> 36 | K10: ='R. Keeney'!$K$25 -> 38 | M10: ='R. Keeney'!$K$34 -> 40 | N10: ='R. Keeney'!$K$35 -> 41 | O10: ='R. Keeney'!$K$36 -> 38 | P10: ='R. Keeney'!$K$37 -> 42 | Q10: ='R. Keeney'!$K$38 -> - | R10: ='R. Keeney'!$K$45 -> 42 | S10: ='R. Keeney'!$K$46 -> 46 | T10: ='R. Keeney'!$K$47 -> 41 | U10: ='R. Keeney'!$K$48 -> 46 | V10: ='R. Keeney'!$K$49 -> 42 | W10: =IF(ISERROR(AVERAGE(IF(B10:V10<>0,B10:V10,""))),"-",(AVERAGE(IF(B10:V10<>0,B10:V10,"")))) -> 40.833333333333336 | X10: =IF(ISERROR(W10-37),"-",(W10-37)) -> 3.8333333333333357 | Y10: ='R. Keeney'!$M$52 -> 39.611111111111114 | Z10: =IF(ISERROR(RANK(Y10,Y$6:Y$16,1)),"-",RANK(Y10,Y$6:Y$16,1)) -> 5 | AA10: =IF(MIN(B10:V10)=0,"-",MIN(B10:V10)) -> 35 | AB10: =IF(MAX(C10:W10)=0,"-",MAX(C10:W10)) -> 47 | AC10: ='R. Keeney'!$N$53 -> 32
A12: ='V. Bunn'!$A$1 -> V. Bunn | B12: ='V. Bunn'!$K$10 -> 40 | C12: ='V. Bunn'!$K$11 -> 40 | D12: ='V. Bunn'!$K$12 -> 41 | E12: ='V. Bunn'!$K$13 -> 41 | F12: ='V. Bunn'!$K$14 -> 42 | G12: ='V. Bunn'!$K$21 -> 37 | H12: ='V. Bunn'!$K$22 -> 43 | I12: ='V. Bunn'!$K$23 -> 45 | J12: ='V. Bunn'!$K$24 -> - | K12: ='V. Bunn'!$K$25 -> 39 | M12: ='V. Bunn'!$K$34 -> 41 | N12: ='V. Bunn'!$K$35 -> 38 | O12: ='V. Bunn'!$K$36 -> 41 | P12: ='V. Bunn'!$K$37 -> 36 | Q12: ='V. Bunn'!$K$38 -> 40 | R12: ='V. Bunn'!$K$45 -> 40 | S12: ='V. Bunn'!$K$46 -> 42 | T12: ='V. Bunn'!$K$47 -> 41 | U12: ='V. Bunn'!$K$48 -> 44 | V12: ='V. Bunn'!$K$49 -> 40 | W12: =IF(ISERROR(AVERAGE(IF(B12:V12<>0,B12:V12,""))),"-",(AVERAGE(IF(B12:V12<>0,B12:V12,"")))) -> 40.578947368421055 | X12: =IF(ISERROR(W12-37),"-",(W12-37)) -> 3.5789473684210549 | Y12: ='V. Bunn'!$M$52 -> 38.10526315789474 | Z12: =IF(ISERROR(RANK(Y12,Y$6:Y$16,1)),"-",RANK(Y12,Y$6:Y$16,1)) -> 2 | AA12: =IF(MIN(B12:V12)=0,"-",MIN(B12:V12)) -> 36 | AB12: =IF(MAX(C12:W12)=0,"-",MAX(C12:W12)) -> 45 | AC12: ='V. Bunn'!$N$53 -> 34
A14: ='D. Smith'!$A$1 -> D. Smith | B14: ='D. Smith'!$K$10 -> 46 | C14: ='D. Smith'!$K$11 -> 46 | D14: ='D. Smith'!$K$12 -> 40 | E14: ='D. Smith'!$K$13 -> 45 | F14: ='D. Smith'!$K$14 -> 39 | G14: ='D. Smith'!$K$21 -> 37 | H14: ='D. Smith'!$K$22 -> 43 | I14: ='D. Smith'!$K$23 -> 44 | J14: ='D. Smith'!$K$24 -> 37 | K14: ='D. Smith'!$K$25 -> 41 | M14: ='D. Smith'!$K$34 -> 39 | N14: ='D. Smith'!$K$35 -> - | O14: ='D. Smith'!$K$36 -> 39 | P14: ='D. Smith'!$K$37 -> 39 | Q14: ='D. Smith'!$K$38 -> 40 | R14: ='D. Smith'!$K$45 -> 38 | S14: ='D. Smith'!$K$46 -> 38 | T14: ='D. Smith'!$K$47 -> 42 | U14: ='D. Smith'!$K$48 -> 41 | V14: ='D. Smith'!$K$49 -> 44 | W14: =IF(ISERROR(AVERAGE(IF(B14:V14<>0,B14:V14,""))),"-",(AVERAGE(IF(B14:V14<>0,B14:V14,"")))) -> 40.94736842105263 | X14: =IF(ISERROR(W14-37),"-",(W14-37)) -> 3.9473684210526301 | Y14: ='D. Smith'!$M$52 -> 37.89473684210526 | Z14: =IF(ISERROR(RANK(Y14,Y$6:Y$16,1)),"-",RANK(Y14,Y$6:Y$16,1)) -> 1 | AA14: =IF(MIN(B14:V14)=0,"-",MIN(B14:V14)) -> 37 | AB14: =IF(MAX(C14:W14)=0,"-",MAX(C14:W14)) -> 46 | AC14: ='D. Smith'!$N$53 -> 33
A16: ='T. Proctor'!$A$1 -> T. Proctor | B16: ='T. Proctor'!$K$10 -> 42 | C16: ='T. Proctor'!$K$11 -> 41 | D16: ='T. Proctor'!$K$12 -> 43 | E16: ='T. Proctor'!$K$13 -> 44 | F16: ='T. Proctor'!$K$14 -> 44 | G16: ='T. Proctor'!$K$21 -> 43 | H16: ='T. Proctor'!$K$22 -> 42 | I16: ='T. Proctor'!$K$23 -> 45 | J16: ='T. Proctor'!$K$24 -> 42 | K16: ='T. Proctor'!$K$25 -> 44 | M16: ='T. Proctor'!$K$34 -> 42 | N16: ='T. Proctor'!$K$35 -> 41 | O16: ='T. Proctor'!$K$36 -> 47 | P16: ='T. Proctor'!$K$37 -> 46 | Q16: ='T. Proctor'!$K$38 -> 41 | R16: ='T. Proctor'!$K$45 -> 44 | S16: ='T. Proctor'!$K$46 -> 42 | T16: ='T. Proctor'!$K$47 -> 41 | U16: ='T. Proctor'!$K$48 -> 47 | V16: ='T. Proctor'!$K$49 -> 41 | W16: =IF(ISERROR(AVERAGE(IF(B16:V16<>0,B16:V16,""))),"-",(AVERAGE(IF(B16:V16<>0,B16:V16,"")))) -> 43.10 | X16: =IF(ISERROR(W16-37),"-",(W16-37)) -> 6.10 | Y16: ='T. Proctor'!$M$52 -> 38.35 | Z16: =IF(ISERROR(RANK(Y16,Y$6:Y$16,1)),"-",RANK(Y16,Y$6:Y$16,1)) -> 4 | AA16: =IF(MIN(B16:V16)=0,"-",MIN(B16:V16)) -> 41 | AB16: =IF(MAX(C16:W16)=0,"-",MAX(C16:W16)) -> 47 | AC16: ='T. Proctor'!$N$53 -> 36
X17: Lowest Round | AA17: =IF(MIN(AA6,AA8,AA10,AA12,AA14,AA16)=0,"-",MIN(AA6,AA8,AA10,AA12,AA14,AA16)) -> 35 | AB17: =IF(ISERROR(OFFSET(AA6,MATCH(AA17,$AA$6:$AA$16,0)-1,-26,1,1)),"-",OFFSET(AA6,MATCH(AA17,$AA$6:$AA$16,0)-1,-26,1,1)) -> R. Ours
A18: Two Players
A19: Week | B19: 1 | C19: 2 | D19: 3 | E19: 4 | F19: 5 | G19: 6 | H19: 7 | I19: 8 | J19: 9 | K19: 10 | M19: 11 | N19: 12 | O19: 13 | P19: 14 | Q19: 15 | R19: 16 | S19: 17 | T19: 18 | U19: 19 | V19: 20 | W19: Avg. | X19: Par | Y19: Net Avg. | Z19: Rank | AA19: Low Rnd. | AB19: Max Rnd. | AC19: Low Net Rnd.
A20: ='S. Jones'!$A$1 -> S. Jones | B20: ='S. Jones'!$K$10 -> 45 | C20: ='S. Jones'!$K$11 -> 43 | D20: ='S. Jones'!$K$12 -> 46 | E20: ='S. Jones'!$K$13 -> 50 | F20: ='S. Jones'!$K$14 -> 49 | G20: ='S. Jones'!$K$21 -> 50 | H20: ='S. Jones'!$K$22 -> 44 | I20: ='S. Jones'!$K$23 -> 46 | J20: ='S. Jones'!$K$24 -> 46 | K20: ='S. Jones'!$K$25 -> 44 | M20: ='S. Jones'!$K$34 -> 46 | N20: ='S. Jones'!$K$35 -> - | O20: ='S. Jones'!$K$36 -> 48 | P20: ='S. Jones'!$K$37 -> 41 | Q20: ='S. Jones'!$K$38 -> 47 | R20: ='S. Jones'!$K$45 -> 44 | S20: ='S. Jones'!$K$46 -> 46 | T20: ='S. Jones'!$K$47 -> 40 | U20: ='S. Jones'!$K$48 -> 43 | V20: ='S. Jones'!$K$49 -> 49 | W20: =IF(ISERROR(AVERAGE(IF(B20:V20<>0,B20:V20,""))),"-",(AVERAGE(IF(B20:V20<>0,B20:V20,"")))) -> 45.631578947368418 | X20: =IF(ISERROR(W20-37),"-",(W20-37)) -> 8.6315789473684177 | Y20: ='S. Jones'!$M$52 -> 38.631578947368418 | Z20: =IF(ISERROR(RANK(Y20,Y$20:Y$30,1)),"-",RANK(Y20,Y$20:Y$30,1)) -> 4 | AA20: =IF(MIN(B20:V20)=0,"-",MIN(B20:V20)) -> 40 | AB20: =IF(MAX(C20:W20)=0,"-",MAX(C20:W20)) -> 50 | AC20: ='S. Jones'!$N$53 -> 33
A22: ='R. Crowder'!$A$1 -> R. Crowder | B22: ='R. Crowder'!$K$10 -> 46 | C22: ='R. Crowder'!$K$11 -> 44 | D22: ='R. Crowder'!$K$12 -> 43 | E22: ='R. Crowder'!$K$13 -> 44 | F22: ='R. Crowder'!$K$14 -> 43 | G22: ='R. Crowder'!$K$21 -> 45 | H22: ='R. Crowder'!$K$22 -> 41 | I22: ='R. Crowder'!$K$23 -> 43 | J22: ='R. Crowder'!$K$24 -> - | K22: ='R. Crowder'!$K$25 -> 39 | M22: ='R. Crowder'!$K$34 -> 40 | N22: ='R. Crowder'!$K$35 -> 41 | O22: ='R. Crowder'!$K$36 -> 44 | P22: ='R. Crowder'!$K$37 -> 44 | Q22: ='R. Crowder'!$K$38 -> 44 | R22: ='R. Crowder'!$K$45 -> 33 | S22: ='R. Crowder'!$K$46 -> 45 | T22: ='R. Crowder'!$K$47 -> 41 | U22: ='R. Crowder'!$K$48 -> 40 | V22: ='R. Crowder'!$K$49 -> 44 | W22: =IF(ISERROR(AVERAGE(IF(B22:V22<>0,B22:V22,""))),"-",(AVERAGE(IF(B22:V22<>0,B22:V22,"")))) -> 42.315789473684212 | X22: =IF(ISERROR(W22-37),"-",(W22-37)) -> 5.3157894736842124 | Y22: ='R. Crowder'!$M$52 -> 37.631578947368418 | Z22: =IF(ISERROR(RANK(Y22,Y$20:Y$30,1)),"-",RANK(Y22,Y$20:Y$30,1)) -> 1 | AA22: =IF(MIN(B22:V22)=0,"-",MIN(B22:V22)) -> 33 | AB22: =IF(MAX(C22:W22)=0,"-",MAX(C22:W22)) -> 45 | AC22: ='R. Crowder'!$N$53 -> 29
A24: ='M. Kyle'!$A$1 -> M. Kyle | B24: ='M. Kyle'!$K$10 -> 49 | C24: ='M. Kyle'!$K$11 -> 48 | D24: ='M. Kyle'!$K$12 -> 50 | E24: ='M. Kyle'!$K$13 -> 45 | F24: ='M. Kyle'!$K$14 -> - | G24: ='M. Kyle'!$K$21 -> 48 | H24: ='M. Kyle'!$K$22 -> 48 | I24: ='M. Kyle'!$K$23 -> - | J24: ='M. Kyle'!$K$24 -> 45 | K24: ='M. Kyle'!$K$25 -> 44 | M24: ='M. Kyle'!$K$34 -> 46 | N24: ='M. Kyle'!$K$35 -> 45 | O24: ='M. Kyle'!$K$36 -> 45 | P24: ='M. Kyle'!$K$37 -> - | Q24: ='M. Kyle'!$K$38 -> - | R24: ='M. Kyle'!$K$45 -> 46 | S24: ='M. Kyle'!$K$46 -> 43 | T24: ='M. Kyle'!$K$47 -> 46 | U24: ='M. Kyle'!$K$48 -> - | V24: ='M. Kyle'!$K$49 -> - | W24: =IF(ISERROR(AVERAGE(IF(B24:V24<>0,B24:V24,""))),"-",(AVERAGE(IF(B24:V24<>0,B24:V24,"")))) -> 46.285714285714285 | X24: =IF(ISERROR(W24-37),"-",(W24-37)) -> 9.2857142857142847 | Y24: ='M. Kyle'!$M$52 -> 38.642857142857146 | Z24: =IF(ISERROR(RANK(Y24,Y$20:Y$30,1)),"-",RANK(Y24,Y$20:Y$30,1)) -> 5 | AA24: =IF(MIN(B24:V24)=0,"-",MIN(B24:V24)) -> 43 | AB24: =IF(MAX(C24:W24)=0,"-",MAX(C24:W24)) -> 50 | AC24: ='M. Kyle'!$N$53 -> 34
A26: ='M. Rutherford'!$A$1 -> M. Rutherford | B26: ='M. Rutherford'!$K$10 -> 43 | C26: ='M. Rutherford'!$K$11 -> 44 | D26: ='M. Rutherford'!$K$12 -> 44 | E26: ='M. Rutherford'!$K$13 -> 42 | F26: ='M. Rutherford'!$K$14 -> 48 | G26: ='M. Rutherford'!$K$21 -> 44 | H26: ='M. Rutherford'!$K$22 -> - | I26: ='M. Rutherford'!$K$23 -> 40 | J26: ='M. Rutherford'!$K$24 -> 39 | K26: ='M. Rutherford'!$K$25 -> 39 | M26: ='M. Rutherford'!$K$34 -> 42 | N26: ='M. Rutherford'!$K$35 -> 38 | O26: ='M. Rutherford'!$K$36 -> 44 | P26: ='M. Rutherford'!$K$37 -> 41 | Q26: ='M. Rutherford'!$K$38 -> 42 | R26: ='M. Rutherford'!$K$45 -> 43 | S26: ='M. Rutherford'!$K$46 -> 47 | T26: ='M. Rutherford'!$K$47 -> 44 | U26: ='M. Rutherford'!$K$48 -> 39 | V26: ='M. Rutherford'!$K$49 -> 41 | W26: =IF(ISERROR(AVERAGE(IF(B26:V26<>0,B26:V26,""))),"-",(AVERAGE(IF(B26:V26<>0,B26:V26,"")))) -> 42.315789473684212 | X26: =IF(ISERROR(W26-37),"-",(W26-37)) -> 5.3157894736842124 | Y26: ='M. Rutherford'!$M$52 -> 38.157894736842103 | Z26: =IF(ISERROR(RANK(Y26,Y$20:Y$30,1)),"-",RANK(Y26,Y$20:Y$30,1)) -> 2 | AA26: =IF(MIN(B26:V26)=0,"-",MIN(B26:V26)) -> 38 | AB26: =IF(MAX(C26:W26)=0,"-",MAX(C26:W26)) -> 48 | AC26: ='M. Rutherford'!$N$53 -> 33
A28: ='T. Way'!$A$1 -> T. Way | B28: ='T. Way'!$K$10 -> - | C28: ='T. Way'!$K$11 -> 51 | D28: ='T. Way'!$K$12 -> 45 | E28: ='T. Way'!$K$13 -> 48 | F28: ='T. Way'!$K$14 -> 45 | G28: ='T. Way'!$K$21 -> 45 | H28: ='T. Way'!$K$22 -> 48 | I28: ='T. Way'!$K$23 -> 49 | J28: ='T. Way'!$K$24 -> 48 | K28: ='T. Way'!$K$25 -> 40 | M28: ='T. Way'!$K$34 -> 42 | N28: ='T. Way'!$K$35 -> 44 | O28: ='T. Way'!$K$36 -> - | P28: ='T. Way'!$K$37 -> 45 | Q28: ='T. Way'!$K$38 -> 42 | R28: ='T. Way'!$K$45 -> 46 | S28: ='T. Way'!$K$46 -> 43 | T28: ='T. Way'!$K$47 -> 43 | U28: ='T. Way'!$K$48 -> 44 | V28: ='T. Way'!$K$49 -> 46 | W28: =IF(ISERROR(AVERAGE(IF(B28:V28<>0,B28:V28,""))),"-",(AVERAGE(IF(B28:V28<>0,B28:V28,"")))) -> 45.222222222222221 | X28: =IF(ISERROR(W28-37),"-",(W28-37)) -> 8.2222222222222214 | Y28: ='T. Way'!$M$52 -> 38.222222222222221 | Z28: =IF(ISERROR(RANK(Y28,Y$20:Y$30,1)),"-",RANK(Y28,Y$20:Y$30,1)) -> 3 | AA28: =IF(MIN(B28:V28)=0,"-",MIN(B28:V28)) -> 40 | AB28: =IF(MAX(C28:W28)=0,"-",MAX(C28:W28)) -> 51 | AC28: ='T. Way'!$N$53 -> 32
A30: ='Matt McComas'!$A$1 -> Matt McComas | B30: ='Matt McComas'!$K$10 -> 42 | C30: ='Matt McComas'!$K$11 -> 46 | D30: ='Matt McComas'!$K$12 -> 43 | E30: ='Matt McComas'!$K$13 -> 43 | F30: ='Matt McComas'!$K$14 -> 40 | G30: ='Matt McComas'!$K$21 -> 50 | H30: ='Matt McComas'!$K$22 -> 50 | I30: ='Matt McComas'!$K$23 -> 42 | J30: ='Matt McComas'!$K$24 -> 47 | K30: ='Matt McComas'!$K$25 -> 44 | M30: ='Matt McComas'!$K$34 -> 44 | N30: ='Matt McComas'!$K$35 -> 43 | O30: ='Matt McComas'!$K$36 -> 46 | P30: ='Matt McComas'!$K$37 -> 39 | Q30: ='Matt McComas'!$K$38 -> 45 | R30: ='Matt McComas'!$K$45 -> 46 | S30: ='Matt McComas'!$K$46 -> 47 | T30: ='Matt McComas'!$K$47 -> 40 | U30: ='Matt McComas'!$K$48 -> 47 | V30: ='Matt McComas'!$K$49 -> 47 | W30: =IF(ISERROR(AVERAGE(IF(B30:V30<>0,B30:V30,""))),"-",(AVERAGE(IF(B30:V30<>0,B30:V30,"")))) -> 44.55 | X30: =IF(ISERROR(W30-37),"-",(W30-37)) -> 7.55 | Y30: ='Matt McComas'!$M$52 -> 39.80 | Z30: =IF(ISERROR(RANK(Y30,Y$20:Y$30,1)),"-",RANK(Y30,Y$20:Y$30,1)) -> 6 | AA30: =IF(MIN(B30:V30)=0,"-",MIN(B30:V30)) -> 39 | AB30: =IF(MAX(C30:W30)=0,"-",MAX(C30:W30)) -> 50 | AC30: ='Matt McComas'!$N$53 -> 34
X31: Lowest Round | AA31: =IF(MIN(AA20,AA22,AA24,AA26,AA28,AA30)=0,"-",MIN(AA20,AA22,AA24,AA26,AA28,AA30)) -> 33 | AB31: =IF(ISERROR(OFFSET(AA20,MATCH(AA31,$AA$20:$AA$30,0)-1,-26,1,1)),"-",OFFSET(AA20,MATCH(AA31,$AA$20:$AA$30,0)-1,-26,1,1)) -> R. Crowder
A32: Three Players
A33: Week | B33: 1 | C33: 2 | D33: 3 | E33: 4 | F33: 5 | G33: 6 | H33: 7 | I33: 8 | J33: 9 | K33: 10 | M33: 11 | N33: 12 | O33: 13 | P33: 14 | Q33: 15 | R33: 16 | S33: 17 | T33: 18 | U33: 19 | V33: 20 | W33: Avg. | X33: Par | Y33: Net Avg. | Z33: Rank | AA33: Low Rnd. | AB33: Max Rnd. | AC33: Low Net Rnd.
A34: ='G. Taylor'!$A$1 -> G. Taylor | B34: ='G. Taylor'!$K$10 -> - | C34: ='G. Taylor'!$K$11 -> 50 | D34: ='G. Taylor'!$K$12 -> 48 | E34: ='G. Taylor'!$K$13 -> 45 | F34: ='G. Taylor'!$K$14 -> 49 | G34: ='G. Taylor'!$K$21 -> 45 | H34: ='G. Taylor'!$K$22 -> 47 | I34: ='G. Taylor'!$K$23 -> 47 | J34: ='G. Taylor'!$K$24 -> 52 | K34: ='G. Taylor'!$K$25 -> 50 | M34: ='G. Taylor'!$K$34 -> 45 | N34: ='G. Taylor'!$K$35 -> 41 | O34: ='G. Taylor'!$K$36 -> 44 | P34: ='G. Taylor'!$K$37 -> 43 | Q34: ='G. Taylor'!$K$38 -> 43 | R34: ='G. Taylor'!$K$45 -> 49 | S34: ='G. Taylor'!$K$46 -> - | T34: ='G. Taylor'!$K$47 -> 42 | U34: ='G. Taylor'!$K$48 -> 46 | V34: ='G. Taylor'!$K$49 -> 45 | W34: =IF(ISERROR(AVERAGE(IF(B34:V34<>0,B34:V34,""))),"-",(AVERAGE(IF(B34:V34<>0,B34:V34,"")))) -> 46.166666666666664 | X34: =IF(ISERROR(W34-37),"-",(W34-37)) -> 9.1666666666666643 | Y34: ='G. Taylor'!$M$52 -> 37.555555555555557 | Z34: =IF(ISERROR(RANK(Y34,Y$34:Y$44,1)),"-",RANK(Y34,Y$34:Y$44,1)) -> 1 | AA34: =IF(MIN(B34:V34)=0,"-",MIN(B34:V34)) -> 41 | AB34: =IF(MAX(C34:W34)=0,"-",MAX(C34:W34)) -> 52 | AC34: ='G. Taylor'!$N$53 -> 32
A36: ='R. Adkins'!$A$1 -> R. Adkins | B36: ='R. Adkins'!$K$10 -> - | C36: ='R. Adkins'!$K$11 -> 49 | D36: ='R. Adkins'!$K$12 -> 52 | E36: ='R. Adkins'!$K$13 -> 53 | F36: ='R. Adkins'!$K$14 -> 51 | G36: ='R. Adkins'!$K$21 -> 51 | H36: ='R. Adkins'!$K$22 -> 55 | I36: ='R. Adkins'!$K$23 -> 52 | J36: ='R. Adkins'!$K$24 -> 49 | K36: ='R. Adkins'!$K$25 -> 52 | M36: ='R. Adkins'!$K$34 -> 51 | N36: ='R. Adkins'!$K$35 -> 49 | O36: ='R. Adkins'!$K$36 -> 50 | P36: ='R. Adkins'!$K$37 -> 50 | Q36: ='R. Adkins'!$K$38 -> 49 | R36: ='R. Adkins'!$K$45 -> 49 | S36: ='R. Adkins'!$K$46 -> 49 | T36: ='R. Adkins'!$K$47 -> 46 | U36: ='R. Adkins'!$K$48 -> 49 | V36: ='R. Adkins'!$K$49 -> 49 | W36: =IF(ISERROR(AVERAGE(IF(B36:V36<>0,B36:V36,""))),"-",(AVERAGE(IF(B36:V36<>0,B36:V36,"")))) -> 50.263157894736842 | X36: =IF(ISERROR(W36-37),"-",(W36-37)) -> 13.263157894736842 | Y36: ='R. Adkins'!$M$52 -> 37.684210526315788 | Z36: =IF(ISERROR(RANK(Y36,Y$34:Y$44,1)),"-",RANK(Y36,Y$34:Y$44,1)) -> 3 | AA36: =IF(MIN(B36:V36)=0,"-",MIN(B36:V36)) -> 46 | AB36: =IF(MAX(C36:W36)=0,"-",MAX(C36:W36)) -> 55 | AC36: ='R. Adkins'!$N$53 -> 33
A38: ='D. Freeman'!$A$1 -> D. Freeman | B38: ='D. Freeman'!$K$10 -> 45 | C38: ='D. Freeman'!$K$11 -> 46 | D38: ='D. Freeman'!$K$12 -> 45 | E38: ='D. Freeman'!$K$13 -> 47 | F38: ='D. Freeman'!$K$14 -> 44 | G38: ='D. Freeman'!$K$21 -> 48 | H38: ='D. Freeman'!$K$22 -> 47 | I38: ='D. Freeman'!$K$23 -> 48 | J38: ='D. Freeman'!$K$24 -> 47 | K38: ='D. Freeman'!$K$25 -> 41 | M38: ='D. Freeman'!$K$34 -> 44 | N38: ='D. Freeman'!$K$35 -> 47 | O38: ='D. Freeman'!$K$36 -> 46 | P38: ='D. Freeman'!$K$37 -> 43 | Q38: ='D. Freeman'!$K$38 -> 49 | R38: ='D. Freeman'!$K$45 -> 47 | S38: ='D. Freeman'!$K$46 -> 40 | T38: ='D. Freeman'!$K$47 -> 40 | U38: ='D. Freeman'!$K$48 -> 46 | V38: ='D. Freeman'!$K$49 -> 48 | W38: =IF(ISERROR(AVERAGE(IF(B38:V38<>0,B38:V38,""))),"-",(AVERAGE(IF(B38:V38<>0,B38:V38,"")))) -> 45.40 | X38: =IF(ISERROR(W38-37),"-",(W38-37)) -> 8.40 | Y38: ='D. Freeman'!$M$52 -> 37.65 | Z38: =IF(ISERROR(RANK(Y38,Y$34:Y$44,1)),"-",RANK(Y38,Y$34:Y$44,1)) -> 2 | AA38: =IF(MIN(B38:V38)=0,"-",MIN(B38:V38)) -> 40 | AB38: =IF(MAX(C38:W38)=0,"-",MAX(C38:W38)) -> 49 | AC38: ='D. Freeman'!$N$53 -> 33
A40: ='B. Hall'!$A$1 -> B. Hall | B40: ='B. Hall'!$K$10 -> 48 | C40: ='B. Hall'!$K$11 -> 52 | D40: ='B. Hall'!$K$12 -> 51 | E40: ='B. Hall'!$K$13 -> 51 | F40: ='B. Hall'!$K$14 -> 52 | G40: ='B. Hall'!$K$21 -> - | H40: ='B. Hall'!$K$22 -> 50 | I40: ='B. Hall'!$K$23 -> 46 | J40: ='B. Hall'!$K$24 -> 45 | K40: ='B. Hall'!$K$25 -> 49 | M40: ='B. Hall'!$K$34 -> 48 | N40: ='B. Hall'!$K$35 -> 48 | O40: ='B. Hall'!$K$36 -> 50 | P40: ='B. Hall'!$K$37 -> 50 | Q40: ='B. Hall'!$K$38 -> 45 | R40: ='B. Hall'!$K$45 -> 50 | S40: ='B. Hall'!$K$46 -> 49 | T40: ='B. Hall'!$K$47 -> 44 | U40: ='B. Hall'!$K$48 -> 44 | V40: ='B. Hall'!$K$49 -> 48 | W40: =IF(ISERROR(AVERAGE(IF(B40:V40<>0,B40:V40,""))),"-",(AVERAGE(IF(B40:V40<>0,B40:V40,"")))) -> 48.421052631578945 | X40: =IF(ISERROR(W40-37),"-",(W40-37)) -> 11.421052631578945 | Y40: ='B. Hall'!$M$52 -> 38.05263157894737 | Z40: =IF(ISERROR(RANK(Y40,Y$34:Y$44,1)),"-",RANK(Y40,Y$34:Y$44,1)) -> 5 | AA40: =IF(MIN(B40:V40)=0,"-",MIN(B40:V40)) -> 44 | AB40: =IF(MAX(C40:W40)=0,"-",MAX(C40:W40)) -> 52 | AC40: ='B. Hall'!$N$53 -> 32
A42: ='L. Baumgarner'!$A$1 -> L. Baumgarner | B42: ='L. Baumgarner'!$K$10 -> 49 | C42: ='L. Baumgarner'!$K$11 -> 52 | D42: ='L. Baumgarner'!$K$12 -> 54 | E42: ='L. Baumgarner'!$K$13 -> 50 | F42: ='L. Baumgarner'!$K$14 -> 52 | G42: ='L. Baumgarner'!$K$21 -> - | H42: ='L. Baumgarner'!$K$22 -> 49 | I42: ='L. Baumgarner'!$K$23 -> 53 | J42: ='L. Baumgarner'!$K$24 -> 52 | K42: ='L. Baumgarner'!$K$25 -> 50 | M42: ='L. Baumgarner'!$K$34 -> 52 | N42: ='L. Baumgarner'!$K$35 -> 48 | O42: ='L. Baumgarner'!$K$36 -> 48 | P42: ='L. Baumgarner'!$K$37 -> 49 | Q42: ='L. Baumgarner'!$K$38 -> 51 | R42: ='L. Baumgarner'!$K$45 -> 50 | S42: ='L. Baumgarner'!$K$46 -> 53 | T42: ='L. Baumgarner'!$K$47 -> 48 | U42: ='L. Baumgarner'!$K$48 -> 48 | V42: ='L. Baumgarner'!$K$49 -> 51 | W42: =IF(ISERROR(AVERAGE(IF(B42:V42<>0,B42:V42,""))),"-",(AVERAGE(IF(B42:V42<>0,B42:V42,"")))) -> 50.473684210526315 | X42: =IF(ISERROR(W42-37),"-",(W42-37)) -> 13.473684210526315 | Y42: ='L. Baumgarner'!$M$52 -> 38.526315789473685 | Z42: =IF(ISERROR(RANK(Y42,Y$34:Y$44,1)),"-",RANK(Y42,Y$34:Y$44,1)) -> 6 | AA42: =IF(MIN(B42:V42)=0,"-",MIN(B42:V42)) -> 48 | AB42: =IF(MAX(C42:W42)=0,"-",MAX(C42:W42)) -> 54 | AC42: ='L. Baumgarner'!$N$53 -> 35
A44: ='C. Edwards'!$A$1 -> C. Edwards | B44: ='C. Edwards'!$K$10 -> - | C44: ='C. Edwards'!$K$11 -> - | D44: ='C. Edwards'!$K$12 -> - | E44: ='C. Edwards'!$K$13 -> - | F44: ='C. Edwards'!$K$14 -> - | G44: ='C. Edwards'!$K$21 -> - | H44: ='C. Edwards'!$K$22 -> - | I44: ='C. Edwards'!$K$23 -> - | J44: ='C. Edwards'!$K$24 -> 48 | K44: ='C. Edwards'!$K$25 -> 50 | M44: ='C. Edwards'!$K$34 -> 47 | N44: ='C. Edwards'!$K$35 -> 50 | O44: ='C. Edwards'!$K$36 -> 46 | P44: ='C. Edwards'!$K$37 -> 46 | Q44: ='C. Edwards'!$K$38 -> 47 | R44: ='C. Edwards'!$K$45 -> 49 | S44: ='C. Edwards'!$K$46 -> 53 | T44: ='C. Edwards'!$K$47 -> 50 | U44: ='C. Edwards'!$K$48 -> 49 | V44: ='C. Edwards'!$K$49 -> 47 | W44: =IF(ISERROR(AVERAGE(IF(B44:V44<>0,B44:V44,""))),"-",(AVERAGE(IF(B44:V44<>0,B44:V44,"")))) -> 48.50 | X44: =IF(ISERROR(W44-37),"-",(W44-37)) -> 11.50 | Y44: ='C. Edwards'!$M$52 -> 37.833333333333336 | Z44: =IF(ISERROR(RANK(Y44,Y$34:Y$44,1)),"-",RANK(Y44,Y$34:Y$44,1)) -> 4 | AA44: =IF(MIN(B44:V44)=0,"-",MIN(B44:V44)) -> 46 | AB44: =IF(MAX(C44:W44)=0,"-",MAX(C44:W44)) -> 53 | AC44: ='C. Edwards'!$N$53 -> 34
X45: Lowest Round | AA45: =IF(MIN(AA34,AA36,AA38,AA40,AA42,AA44)=0,"-",MIN(AA34,AA36,AA38,AA40,AA42,AA44)) -> 40 | AB45: =IF(ISERROR(OFFSET(AA34,MATCH(AA45,$AA$34:$AA$44,0)-1,-26,1,1)),"-",OFFSET(AA34,MATCH(AA45,$AA$34:$AA$44,0)-1,-26,1,1)) -> D. Freeman
A46: Four Players
A47: Week | B47: 1 | C47: 2 | D47: 3 | E47: 4 | F47: 5 | G47: 6 | H47: 7 | I47: 8 | J47: 9 | K47: 10 | M47: 11 | N47: 12 | O47: 13 | P47: 14 | Q47: 15 | R47: 16 | S47: 17 | T47: 18 | U47: 19 | V47: 20 | W47: Avg. | X47: Par | Y47: Net Avg. | Z47: Rank | AA47: Low Rnd. | AB47: Max Rnd. | AC47: Low Net Rnd.
A48: ='Mike McComas'!$A$1 -> Mike McComas | B48: ='Mike McComas'!$K$10 -> - | C48: ='Mike McComas'!$K$11 -> - | D48: ='Mike McComas'!$K$12 -> - | E48: ='Mike McComas'!$K$13 -> - | F48: ='Mike McComas'!$K$14 -> - | G48: ='Mike McComas'!$K$21 -> 56 | H48: ='Mike McComas'!$K$22 -> 57 | I48: ='Mike McComas'!$K$23 -> 58 | J48: ='Mike McComas'!$K$24 -> 55 | K48: ='Mike McComas'!$K$25 -> 54 | M48: ='Mike McComas'!$K$34 -> 55 | N48: ='Mike McComas'!$K$35 -> 53 | O48: ='Mike McComas'!$K$36 -> 58 | P48: ='Mike McComas'!$K$37 -> - | Q48: ='Mike McComas'!$K$38 -> 55 | R48: ='Mike McComas'!$K$45 -> - | S48: ='Mike McComas'!$K$46 -> 58 | T48: ='Mike McComas'!$K$47 -> 56 | U48: ='Mike McComas'!$K$48 -> 54 | V48: ='Mike McComas'!$K$49 -> 57 | W48: =IF(ISERROR(AVERAGE(IF(B48:V48<>0,B48:V48,""))),"-",(AVERAGE(IF(B48:V48<>0,B48:V48,"")))) -> 55.846153846153847 | X48: =IF(ISERROR(W48-37),"-",(W48-37)) -> 18.846153846153847 | Y48: ='Mike McComas'!$M$52 -> 39.307692307692307 | Z48: =IF(ISERROR(RANK(Y48,Y$48:Y$58,1)),"-",RANK(Y48,Y$48:Y$58,1)) -> 6 | AA48: =IF(MIN(B48:V48)=0,"-",MIN(B48:V48)) -> 53 | AB48: =IF(MAX(C48:W48)=0,"-",MAX(C48:W48)) -> 58 | AC48: ='Mike McComas'!$N$53 -> 35
A50: ='G. Yablonsky'!$A$1 -> G. Yablonsky | B50: ='G. Yablonsky'!$K$10 -> - | C50: ='G. Yablonsky'!$K$11 -> - | D50: ='G. Yablonsky'!$K$12 -> - | E50: ='G. Yablonsky'!$K$13 -> - | F50: ='G. Yablonsky'!$K$14 -> - | G50: ='G. Yablonsky'!$K$21 -> - | H50: ='G. Yablonsky'!$K$22 -> - | I50: ='G. Yablonsky'!$K$23 -> - | J50: ='G. Yablonsky'!$K$24 -> - | K50: ='G. Yablonsky'!$K$25 -> - | M50: ='G. Yablonsky'!$K$34 -> - | N50: ='G. Yablonsky'!$K$35 -> - | O50: ='G. Yablonsky'!$K$36 -> - | P50: ='G. Yablonsky'!$K$37 -> - | Q50: ='G. Yablonsky'!$K$38 -> - | R50: ='G. Yablonsky'!$K$45 -> - | S50: ='G. Yablonsky'!$K$46 -> - | T50: ='G. Yablonsky'!$K$47 -> 44 | U50: ='G. Yablonsky'!$K$48 -> 44 | V50: ='G. Yablonsky'!$K$49 -> 52 | W50: =IF(ISERROR(AVERAGE(IF(B50:V50<>0,B50:V50,""))),"-",(AVERAGE(IF(B50:V50<>0,B50:V50,"")))) -> 46.666666666666664 | X50: =IF(ISERROR(W50-37),"-",(W50-37)) -> 9.6666666666666643 | Y50: ='G. Yablonsky'!$M$52 -> 38.666666666666664 | Z50: =IF(ISERROR(RANK(Y50,Y$48:Y$58,1)),"-",RANK(Y50,Y$48:Y$58,1)) -> 4 | AA50: =IF(MIN(B50:V50)=0,"-",MIN(B50:V50)) -> 44 | AB50: =IF(MAX(C50:W50)=0,"-",MAX(C50:W50)) -> 52 | AC50: ='G. Yablonsky'!$N$53 -> 36
A52: ='J. Landers'!$A$1 -> J. Landers | B52: ='J. Landers'!$K$10 -> 50 | C52: ='J. Landers'!$K$11 -> 53 | D52: ='J. Landers'!$K$12 -> 47 | E52: ='J. Landers'!$K$13 -> - | F52: ='J. Landers'!$K$14 -> 51 | G52: ='J. Landers'!$K$21 -> 57 | H52: ='J. Landers'!$K$22 -> - | I52: ='J. Landers'!$K$23 -> 58 | J52: ='J. Landers'!$K$24 -> 52 | K52: ='J. Landers'!$K$25 -> 50 | M52: ='J. Landers'!$K$34 -> 50 | N52: ='J. Landers'!$K$35 -> 45 | O52: ='J. Landers'!$K$36 -> 52 | P52: ='J. Landers'!$K$37 -> 54 | Q52: ='J. Landers'!$K$38 -> 49 | R52: ='J. Landers'!$K$45 -> - | S52: ='J. Landers'!$K$46 -> 46 | T52: ='J. Landers'!$K$47 -> 58 | U52: ='J. Landers'!$K$48 -> 48 | V52: ='J. Landers'!$K$49 -> 52 | W52: =IF(ISERROR(AVERAGE(IF(B52:V52<>0,B52:V52,""))),"-",(AVERAGE(IF(B52:V52<>0,B52:V52,"")))) -> 51.294117647058826 | X52: =IF(ISERROR(W52-37),"-",(W52-37)) -> 14.294117647058826 | Y52: ='J. Landers'!$M$52 -> 38.764705882352942 | Z52: =IF(ISERROR(RANK(Y52,Y$48:Y$58,1)),"-",RANK(Y52,Y$48:Y$58,1)) -> 5 | AA52: =IF(MIN(B52:V52)=0,"-",MIN(B52:V52)) -> 45 | AB52: =IF(MAX(C52:W52)=0,"-",MAX(C52:W52)) -> 58 | AC52: ='J. Landers'!$N$53 -> 32
A54: ='B. Meadows'!$A$1 -> B. Meadows | B54: ='B. Meadows'!$K$10 -> 57 | C54: ='B. Meadows'!$K$11 -> 58 | D54: ='B. Meadows'!$K$12 -> 57 | E54: ='B. Meadows'!$K$13 -> 52 | F54: ='B. Meadows'!$K$14 -> 56 | G54: ='B. Meadows'!$K$21 -> 61 | H54: ='B. Meadows'!$K$22 -> 51 | I54: ='B. Meadows'!$K$23 -> 57 | J54: ='B. Meadows'!$K$24 -> - | K54: ='B. Meadows'!$K$25 -> 52 | M54: ='B. Meadows'!$K$34 -> 52 | N54: ='B. Meadows'!$K$35 -> - | O54: ='B. Meadows'!$K$36 -> 52 | P54: ='B. Meadows'!$K$37 -> 49 | Q54: ='B. Meadows'!$K$38 -> 58 | R54: ='B. Meadows'!$K$45 -> 54 | S54: ='B. Meadows'!$K$46 -> 55 | T54: ='B. Meadows'!$K$47 -> 56 | U54: ='B. Meadows'!$K$48 -> 46 | V54: ='B. Meadows'!$K$49 -> 55 | W54: =IF(ISERROR(AVERAGE(IF(B54:V54<>0,B54:V54,""))),"-",(AVERAGE(IF(B54:V54<>0,B54:V54,"")))) -> 54.333333333333336 | X54: =IF(ISERROR(W54-37),"-",(W54-37)) -> 17.333333333333336 | Y54: ='B. Meadows'!$M$52 -> 38.50 | Z54: =IF(ISERROR(RANK(Y54,Y$48:Y$58,1)),"-",RANK(Y54,Y$48:Y$58,1)) -> 3 | AA54: =IF(MIN(B54:V54)=0,"-",MIN(B54:V54)) -> 46 | AB54: =IF(MAX(C54:W54)=0,"-",MAX(C54:W54)) -> 61 | AC54: ='B. Meadows'!$N$53 -> 31
A56: ='J. Dodrill'!$A$1 -> J. Dodrill | B56: ='J. Dodrill'!$K$10 -> 53 | C56: ='J. Dodrill'!$K$11 -> 49 | D56: ='J. Dodrill'!$K$12 -> 54 | E56: ='J. Dodrill'!$K$13 -> 57 | F56: ='J. Dodrill'!$K$14 -> 55 | G56: ='J. Dodrill'!$K$21 -> 53 | H56: ='J. Dodrill'!$K$22 -> 51 | I56: ='J. Dodrill'!$K$23 -> 57 | J56: ='J. Dodrill'!$K$24 -> 55 | K56: ='J. Dodrill'!$K$25 -> - | M56: ='J. Dodrill'!$K$34 -> 54 | N56: ='J. Dodrill'!$K$35 -> 48 | O56: ='J. Dodrill'!$K$36 -> 49 | P56: ='J. Dodrill'!$K$37 -> 50 | Q56: ='J. Dodrill'!$K$38 -> 58 | R56: ='J. Dodrill'!$K$45 -> 52 | S56: ='J. Dodrill'!$K$46 -> 58 | T56: ='J. Dodrill'!$K$47 -> 48 | U56: ='J. Dodrill'!$K$48 -> 47 | V56: ='J. Dodrill'!$K$49 -> - | W56: =IF(ISERROR(AVERAGE(IF(B56:V56<>0,B56:V56,""))),"-",(AVERAGE(IF(B56:V56<>0,B56:V56,"")))) -> 52.666666666666664 | X56: =IF(ISERROR(W56-37),"-",(W56-37)) -> 15.666666666666664 | Y56: ='J. Dodrill'!$M$52 -> 38.388888888888886 | Z56: =IF(ISERROR(RANK(Y56,Y$48:Y$58,1)),"-",RANK(Y56,Y$48:Y$58,1)) -> 2 | AA56: =IF(MIN(B56:V56)=0,"-",MIN(B56:V56)) -> 47 | AB56: =IF(MAX(C56:W56)=0,"-",MAX(C56:W56)) -> 58 | AC56: ='J. Dodrill'!$N$53 -> 33
A58: ='Tres Baumgarner'!$A$1 -> Tres Baumgarner | B58: ='Tres Baumgarner'!$K$10 -> 50 | C58: ='Tres Baumgarner'!$K$11 -> 49 | D58: ='Tres Baumgarner'!$K$12 -> 49 | E58: ='Tres Baumgarner'!$K$13 -> 53 | F58: ='Tres Baumgarner'!$K$14 -> 54 | G58: ='Tres Baumgarner'!$K$21 -> - | H58: ='Tres Baumgarner'!$K$22 -> - | I58: ='Tres Baumgarner'!$K$23 -> - | J58: ='Tres Baumgarner'!$K$24 -> - | K58: ='Tres Baumgarner'!$K$25 -> - | M58: ='Tres Baumgarner'!$K$34 -> - | N58: ='Tres Baumgarner'!$K$35 -> - | O58: ='Tres Baumgarner'!$K$36 -> - | P58: ='Tres Baumgarner'!$K$37 -> - | Q58: ='Tres Baumgarner'!$K$38 -> - | R58: ='Tres Baumgarner'!$K$45 -> - | S58: ='Tres Baumgarner'!$K$46 -> - | T58: ='Tres Baumgarner'!$K$47 -> - | U58: ='Tres Baumgarner'!$K$48 -> - | V58: ='Tres Baumgarner'!$K$49 -> 53 | W58: =IF(ISERROR(AVERAGE(IF(B58:V58<>0,B58:V58,""))),"-",(AVERAGE(IF(B58:V58<>0,B58:V58,"")))) -> 51.333333333333336 | X58: =IF(ISERROR(W58-37),"-",(W58-37)) -> 14.333333333333336 | Y58: ='Tres Baumgarner'!$M$52 -> 37.666666666666664 | Z58: =IF(ISERROR(RANK(Y58,Y$48:Y$58,1)),"-",RANK(Y58,Y$48:Y$58,1)) -> 1 | AA58: =IF(MIN(B58:V58)=0,"-",MIN(B58:V58)) -> 49 | AB58: =IF(MAX(C58:W58)=0,"-",MAX(C58:W58)) -> 54 | AC58: ='Tres Baumgarner'!$N$53 -> 35
X59: Lowest Round | AA59: =IF(MIN(AA48,AA50,AA52,AA54,AA56,AA58)=0,"-",MIN(AA48,AA50,AA52,AA54,AA56,AA58)) -> 44 | AB59: =IF(ISERROR(OFFSET(AA48,MATCH(AA59,$AA$48:$AA$58,0)-1,-26,1,1)),"-",OFFSET(AA48,MATCH(AA59,$AA$48:$AA$58,0)-1,-26,1,1)) -> G. Yablonsky