A2: =MID(CELL("filename",A1),FIND("]",CELL("filename",A1))+1,LEN(CELL("filename",A1))-FIND("]",CELL("filename",A1))) -> Standings
A4: 2008
A6: ='Team Scores'!AI7 -> Teams | B6: ='Team Scores'!AJ7 -> 1st Half Points | C6: ='Team Scores'!AL7 -> 1st Half Wins | D6: ='Team Scores'!AQ7 -> 1st Half Rank | E6: ='Team Scores'!AT7 -> 1st Half Leader | F6: ='Team Scores'!AU7 -> Points
A7: ='Team Scores'!AI8 -> Team 1 | B7: ='Team Scores'!AJ8 -> 41 | C7: ='Team Scores'!AL8 -> 19 | D7: ='Team Scores'!AQ8 -> 2 | E7: ='Team Scores'!AT8 -> Team 5 | F7: ='Team Scores'!AU8 -> 47
A8: ='Team Scores'!AI9 -> Team 2 | B8: ='Team Scores'!AJ9 -> 32 | C8: ='Team Scores'!AL9 -> 12 | D8: ='Team Scores'!AQ9 -> 5
A9: ='Team Scores'!AI10 -> Team 3 | B9: ='Team Scores'!AJ10 -> 36 | C9: ='Team Scores'!AL10 -> 15 | D9: ='Team Scores'!AQ10 -> 4
A10: ='Team Scores'!AI11 -> Team 4 | B10: ='Team Scores'!AJ11 -> 39 | C10: ='Team Scores'!AL11 -> 17 | D10: ='Team Scores'!AQ11 -> 3
A11: ='Team Scores'!AI12 -> Team 5 | B11: ='Team Scores'!AJ12 -> 47 | C11: ='Team Scores'!AL12 -> 21 | D11: ='Team Scores'!AQ12 -> 1
A12: ='Team Scores'!AI13 -> Team 6 | B12: ='Team Scores'!AJ13 -> 29 | C12: ='Team Scores'!AL13 -> 10 | D12: ='Team Scores'!AQ13 -> 6
A16: ='Team Scores'!AI15 -> Teams | B16: ='Team Scores'!AJ15 -> 2nd Half Points | C16: ='Team Scores'!AL15 -> 2nd Half Wins | D16: ='Team Scores'!AQ15 -> 2nd Half Rank | E16: ='Team Scores'!AT15 -> 2nd Half Leader | F16: ='Team Scores'!AU15 -> Points
A17: ='Team Scores'!AI16 -> Team 1 | B17: ='Team Scores'!AJ16 -> 35 | C17: ='Team Scores'!AL16 -> 14 | D17: ='Team Scores'!AQ16 -> 4 | E17: ='Team Scores'!AT16 -> Team 4 | F17: ='Team Scores'!AU16 -> 50
A18: ='Team Scores'!AI17 -> Team 2 | B18: ='Team Scores'!AJ17 -> 33 | C18: ='Team Scores'!AL17 -> 12 | D18: ='Team Scores'!AQ17 -> 5
A19: ='Team Scores'!AI18 -> Team 3 | B19: ='Team Scores'!AJ18 -> 33 | C19: ='Team Scores'!AL18 -> 13 | D19: ='Team Scores'!AQ18 -> 5
A20: ='Team Scores'!AI19 -> Team 4 | B20: ='Team Scores'!AJ19 -> 50 | C20: ='Team Scores'!AL19 -> 19 | D20: ='Team Scores'!AQ19 -> 1
A21: ='Team Scores'!AI20 -> Team 5 | B21: ='Team Scores'!AJ20 -> 40 | C21: ='Team Scores'!AL20 -> 16 | D21: ='Team Scores'!AQ20 -> 2
A22: ='Team Scores'!AI21 -> Team 6 | B22: ='Team Scores'!AJ21 -> 37 | C22: ='Team Scores'!AL21 -> 13 | D22: ='Team Scores'!AQ21 -> 3