A2: =MID(CELL("filename",A1),FIND("]",CELL("filename",A1))+1,LEN(CELL("filename",A1))-FIND("]",CELL("filename",A1))) -> Handicaps
A4: =Standings!$A$4 -> 2008
A5: One Players | J5: 2009 Player Breakdown*
B6: 1st Quarter | C6: 2nd Quarter | D6: 3rd Quarter | E6: 4th Quarter | F6: EOY | G6: 18 Hole | K6: Player | L6: Raw HC
A7: ='R. Ours'!$A$1 -> R. Ours | B7: =IF('R. Ours'!$C$7=" ","-",'R. Ours'!$C$7) -> 1 | C7: ='R. Ours'!$C$18 -> 3 | D7: ='R. Ours'!$C$31 -> 3 | E7: ='R. Ours'!$C$42 -> 2 | F7: ='R. Ours'!$T$53 -> 1.7777777777777786 | G7: =IF(ISERROR(ROUND(F7,0)*1.5),"-",ROUND(F7,0)*1.5) -> 3 | J7: One Players | K7: ='R. Keeney'!$A$1 -> R. Keeney | L7: ='R. Keeney'!$T$53 -> 1.5555555555555571
A8: ='G. White'!$A$1 -> G. White | B8: =IF('G. White'!$C$7=" ","-",'G. White'!$C$7) -> 3 | C8: ='G. White'!$C$18 -> 5 | D8: ='G. White'!$C$31 -> 4 | E8: ='G. White'!$C$42 -> 3 | F8: ='G. White'!$T$53 -> 4 | G8: =IF(ISERROR(ROUND(F8,0)*1.5),"-",ROUND(F8,0)*1.5) -> 6 | K8: ='D. Smith'!$A$1 -> D. Smith | L8: ='D. Smith'!$T$53 -> 1.60
A9: ='R. Keeney'!$A$1 -> R. Keeney | B9: =IF('R. Keeney'!$C$7=" ","-",'R. Keeney'!$C$7) -> 3 | C9: ='R. Keeney'!$C$18 -> 1 | D9: ='R. Keeney'!$C$31 -> 0 | E9: ='R. Keeney'!$C$42 -> 1 | F9: ='R. Keeney'!$T$53 -> 1.5555555555555571 | G9: =IF(ISERROR(ROUND(F9,0)*1.5),"-",ROUND(F9,0)*1.5) -> 3 | K9: ='R. Ours'!$A$1 -> R. Ours | L9: ='R. Ours'!$T$53 -> 1.7777777777777786
A10: ='V. Bunn'!$A$1 -> V. Bunn | B10: =IF('V. Bunn'!$C$7=" ","-",'V. Bunn'!$C$7) -> 3 | C10: ='V. Bunn'!$C$18 -> 3 | D10: ='V. Bunn'!$C$31 -> 2 | E10: ='V. Bunn'!$C$42 -> 2 | F10: ='V. Bunn'!$T$53 -> 2.1 | G10: =IF(ISERROR(ROUND(F10,0)*1.5),"-",ROUND(F10,0)*1.5) -> 3 | K10: ='V. Bunn'!$A$1 -> V. Bunn | L10: ='V. Bunn'!$T$53 -> 2.10
A11: ='D. Smith'!$A$1 -> D. Smith | B11: =IF('D. Smith'!$C$7=" ","-",'D. Smith'!$C$7) -> 4 | C11: ='D. Smith'!$C$18 -> 4 | D11: ='D. Smith'!$C$31 -> 2 | E11: ='D. Smith'!$C$42 -> 2 | F11: ='D. Smith'!$T$53 -> 1.6 | G11: =IF(ISERROR(ROUND(F11,0)*1.5),"-",ROUND(F11,0)*1.5) -> 3 | K11: ='M. Rutherford'!$A$1 -> M. Rutherford | L11: ='M. Rutherford'!$T$53 -> 3.30
A12: ='T. Proctor'!$A$1 -> T. Proctor | B12: =IF('T. Proctor'!$C$7=" ","-",'T. Proctor'!$C$7) -> 4 | C12: ='T. Proctor'!$C$18 -> 5 | D12: ='T. Proctor'!$C$31 -> 5 | E12: ='T. Proctor'!$C$42 -> 5 | F12: ='T. Proctor'!$T$53 -> 4.5 | G12: =IF(ISERROR(ROUND(F12,0)*1.5),"-",ROUND(F12,0)*1.5) -> 7.5 | K12: ='R. Crowder'!$A$1 -> R. Crowder | L12: ='R. Crowder'!$T$53 -> 3.40
J13: Two Players | K13: ='G. White'!$A$1 -> G. White | L13: ='G. White'!$T$53 -> 4.00
A14: Two Players | K14: ='T. Proctor'!$A$1 -> T. Proctor | L14: ='T. Proctor'!$T$53 -> 4.50
B15: 1st Quarter | C15: 2nd Quarter | D15: 3rd Quarter | E15: 4th Quarter | F15: EOY | G15: 18 Hole | K15: ='Matt McComas'!$A$1 -> Matt McComas | L15: ='Matt McComas'!$T$53 -> 5.00
A16: ='S. Jones'!$A$1 -> S. Jones | B16: =IF('S. Jones'!$C$7=" ","-",'S. Jones'!$C$7) -> 6 | C16: ='S. Jones'!$C$18 -> 8 | D16: ='S. Jones'!$C$31 -> 7 | E16: ='S. Jones'!$C$42 -> 7 | F16: ='S. Jones'!$T$53 -> 6.6 | G16: =IF(ISERROR(ROUND(F16,0)*1.5),"-",ROUND(F16,0)*1.5) -> 10.5 | K16: ='T. Way'!$A$1 -> T. Way | L16: ='T. Way'!$T$53 -> 6.1111111111111143
A17: ='R. Crowder'!$A$1 -> R. Crowder | B17: =IF('R. Crowder'!$C$7=" ","-",'R. Crowder'!$C$7) -> 4 | C17: ='R. Crowder'!$C$18 -> 6 | D17: ='R. Crowder'!$C$31 -> 5 | E17: ='R. Crowder'!$C$42 -> 4 | F17: ='R. Crowder'!$T$53 -> 3.4 | G17: =IF(ISERROR(ROUND(F17,0)*1.5),"-",ROUND(F17,0)*1.5) -> 4.5 | K17: ='D. Freeman'!$A$1 -> D. Freeman | L17: ='D. Freeman'!$T$53 -> 6.40
A18: ='M. Kyle'!$A$1 -> M. Kyle | B18: =IF('M. Kyle'!$C$7=" ","-",'M. Kyle'!$C$7) -> 4 | C18: ='M. Kyle'!$C$18 -> 10 | D18: ='M. Kyle'!$C$31 -> 9 | E18: ='M. Kyle'!$C$42 -> 8 | F18: ='M. Kyle'!$T$53 -> 7.7142857142857153 | G18: =IF(ISERROR(ROUND(F18,0)*1.5),"-",ROUND(F18,0)*1.5) -> 12 | K18: ='S. Jones'!$A$1 -> S. Jones | L18: ='S. Jones'!$T$53 -> 6.60
A19: ='M. Rutherford'!$A$1 -> M. Rutherford | B19: =IF('M. Rutherford'!$C$7=" ","-",'M. Rutherford'!$C$7) -> 4 | C19: ='M. Rutherford'!$C$18 -> 6 | D19: ='M. Rutherford'!$C$31 -> 4 | E19: ='M. Rutherford'!$C$42 -> 3 | F19: ='M. Rutherford'!$T$53 -> 3.3 | G19: =IF(ISERROR(ROUND(F19,0)*1.5),"-",ROUND(F19,0)*1.5) -> 4.5 | J19: Three Players | K19: ='G. Taylor'!$A$1 -> G. Taylor | L19: ='G. Taylor'!$T$53 -> 6.6666666666666643
A20: ='T. Way'!$A$1 -> T. Way | B20: =IF('T. Way'!$C$7=" ","-",'T. Way'!$C$7) -> 6 | C20: ='T. Way'!$C$18 -> 8 | D20: ='T. Way'!$C$31 -> 8 | E20: ='T. Way'!$C$42 -> 6 | F20: ='T. Way'!$T$53 -> 6.1111111111111143 | G20: =IF(ISERROR(ROUND(F20,0)*1.5),"-",ROUND(F20,0)*1.5) -> 9 | K20: ='G. Yablonsky'!$A$1 -> G. Yablonsky | L20: ='G. Yablonsky'!$T$53 -> 7.00
A21: ='Matt McComas'!$A$1 -> Matt McComas | B21: =IF('Matt McComas'!$C$7=" ","-",'Matt McComas'!$C$7) -> 4 | C21: ='Matt McComas'!$C$18 -> 5 | D21: ='Matt McComas'!$C$31 -> 5 | E21: ='Matt McComas'!$C$42 -> 5 | F21: ='Matt McComas'!$T$53 -> 5 | G21: =IF(ISERROR(ROUND(F21,0)*1.5),"-",ROUND(F21,0)*1.5) -> 7.5 | K21: ='M. Kyle'!$A$1 -> M. Kyle | L21: ='M. Kyle'!$T$53 -> 7.7142857142857153
K22: ='B. Hall'!$A$1 -> B. Hall | L22: ='B. Hall'!$T$53 -> 9.50
A23: Three Players | K23: ='C. Edwards'!$A$1 -> C. Edwards | L23: ='C. Edwards'!$T$53 -> 9.8333333333333357
B24: 1st Quarter | C24: 2nd Quarter | D24: 3rd Quarter | E24: 4th Quarter | F24: EOY | G24: 18 Hole | K24: ='J. Landers'!$A$1 -> J. Landers | L24: ='J. Landers'!$T$53 -> 11.444444444444443
A25: ='G. Taylor'!$A$1 -> G. Taylor | B25: =IF('G. Taylor'!$C$7=" ","-",'G. Taylor'!$C$7) -> 8 | C25: ='G. Taylor'!$C$18 -> 10 | D25: ='G. Taylor'!$C$31 -> 9 | E25: ='G. Taylor'!$C$42 -> 7 | F25: ='G. Taylor'!$T$53 -> 6.6666666666666643 | G25: =IF(ISERROR(ROUND(F25,0)*1.5),"-",ROUND(F25,0)*1.5) -> 10.5 | J25: Four Players | K25: ='R. Adkins'!$A$1 -> R. Adkins | L25: ='R. Adkins'!$T$53 -> 11.80
A26: ='R. Adkins'!$A$1 -> R. Adkins | B26: =IF('R. Adkins'!$C$7=" ","-",'R. Adkins'!$C$7) -> 11 | C26: ='R. Adkins'!$C$18 -> 13 | D26: ='R. Adkins'!$C$31 -> 13 | E26: ='R. Adkins'!$C$42 -> 13 | F26: ='R. Adkins'!$T$53 -> 11.8 | G26: =IF(ISERROR(ROUND(F26,0)*1.5),"-",ROUND(F26,0)*1.5) -> 18 | K26: ='L. Baumgarner'!$A$1 -> L. Baumgarner | L26: ='L. Baumgarner'!$T$53 -> 11.90
A27: ='D. Freeman'!$A$1 -> D. Freeman | B27: =IF('D. Freeman'!$C$7=" ","-",'D. Freeman'!$C$7) -> 9 | C27: ='D. Freeman'!$C$18 -> 8 | D27: ='D. Freeman'!$C$31 -> 7 | E27: ='D. Freeman'!$C$42 -> 7 | F27: ='D. Freeman'!$T$53 -> 6.4 | G27: =IF(ISERROR(ROUND(F27,0)*1.5),"-",ROUND(F27,0)*1.5) -> 9 | K27: ='Tres Baumgarner'!$A$1 -> Tres Baumgarner | L27: ='Tres Baumgarner'!$T$53 -> 12.333333333333336
A28: ='B. Hall'!$A$1 -> B. Hall | B28: =IF('B. Hall'!$C$7=" ","-",'B. Hall'!$C$7) -> 8 | C28: ='B. Hall'!$C$18 -> 13 | D28: ='B. Hall'!$C$31 -> 11 | E28: ='B. Hall'!$C$42 -> 10 | F28: ='B. Hall'!$T$53 -> 9.5 | G28: =IF(ISERROR(ROUND(F28,0)*1.5),"-",ROUND(F28,0)*1.5) -> 15 | K28: ='J. Dodrill'!$A$1 -> J. Dodrill | L28: ='J. Dodrill'!$T$53 -> 12.666666666666664
A29: ='L. Baumgarner'!$A$1 -> L. Baumgarner | B29: =IF('L. Baumgarner'!$C$7=" ","-",'L. Baumgarner'!$C$7) -> 10 | C29: ='L. Baumgarner'!$C$18 -> 13 | D29: ='L. Baumgarner'!$C$31 -> 13 | E29: ='L. Baumgarner'!$C$42 -> 12 | F29: ='L. Baumgarner'!$T$53 -> 11.9 | G29: =IF(ISERROR(ROUND(F29,0)*1.5),"-",ROUND(F29,0)*1.5) -> 18 | K29: ='B. Meadows'!$A$1 -> B. Meadows | L29: ='B. Meadows'!$T$53 -> 14.444444444444443
A30: ='C. Edwards'!$A$1 -> C. Edwards | B30: =IF('C. Edwards'!$C$7=" ","-",'C. Edwards'!$C$7) -> - | C30: ='C. Edwards'!$C$18 -> 9 | D30: ='C. Edwards'!$C$31 -> 12 | E30: ='C. Edwards'!$C$42 -> 10 | F30: ='C. Edwards'!$T$53 -> 9.8333333333333357 | G30: =IF(ISERROR(ROUND(F30,0)*1.5),"-",ROUND(F30,0)*1.5) -> 15 | K30: ='Mike McComas'!$A$1 -> Mike McComas | L30: ='Mike McComas'!$T$53 -> 17.571428571428569
K31: * Sorted from lowest to highest HC
A32: Four Players
B33: 1st Quarter | C33: 2nd Quarter | D33: 3rd Quarter | E33: 4th Quarter | F33: EOY | G33: 18 Hole
A34: ='Mike McComas'!$A$1 -> Mike McComas | B34: =IF('Mike McComas'!$C$7=" ","-",'Mike McComas'!$C$7) -> - | C34: ='Mike McComas'!$C$18 -> 15 | D34: ='Mike McComas'!$C$31 -> 18 | E34: ='Mike McComas'!$C$42 -> 17 | F34: ='Mike McComas'!$T$53 -> 17.571428571428569 | G34: =IF(ISERROR(ROUND(F34,0)*1.5),"-",ROUND(F34,0)*1.5) -> 27
A35: ='G. Yablonsky'!$A$1 -> G. Yablonsky | B35: =IF('G. Yablonsky'!$C$7=" ","-",'G. Yablonsky'!$C$7) -> - | C35: ='G. Yablonsky'!$C$18 -> - | D35: ='G. Yablonsky'!$C$31 -> - | E35: ='G. Yablonsky'!$C$42 -> 8 | F35: ='G. Yablonsky'!$T$53 -> 7 | G35: =IF(ISERROR(ROUND(F35,0)*1.5),"-",ROUND(F35,0)*1.5) -> 10.5
A36: ='J. Landers'!$A$1 -> J. Landers | B36: =IF('J. Landers'!$C$7=" ","-",'J. Landers'!$C$7) -> 13 | C36: ='J. Landers'!$C$18 -> 12 | D36: ='J. Landers'!$C$31 -> 13 | E36: ='J. Landers'!$C$42 -> 12 | F36: ='J. Landers'!$T$53 -> 11.444444444444443 | G36: =IF(ISERROR(ROUND(F36,0)*1.5),"-",ROUND(F36,0)*1.5) -> 16.5
A37: ='B. Meadows'!$A$1 -> B. Meadows | B37: =IF('B. Meadows'!$C$7=" ","-",'B. Meadows'!$C$7) -> 14 | C37: ='B. Meadows'!$C$18 -> 18 | D37: ='B. Meadows'!$C$31 -> 17 | E37: ='B. Meadows'!$C$42 -> 15 | F37: ='B. Meadows'!$T$53 -> 14.444444444444443 | G37: =IF(ISERROR(ROUND(F37,0)*1.5),"-",ROUND(F37,0)*1.5) -> 21
A38: ='J. Dodrill'!$A$1 -> J. Dodrill | B38: =IF('J. Dodrill'!$C$7=" ","-",'J. Dodrill'!$C$7) -> 14 | C38: ='J. Dodrill'!$C$18 -> 15 | D38: ='J. Dodrill'!$C$31 -> 15 | E38: ='J. Dodrill'!$C$42 -> 13 | F38: ='J. Dodrill'!$T$53 -> 12.666666666666664 | G38: =IF(ISERROR(ROUND(F38,0)*1.5),"-",ROUND(F38,0)*1.5) -> 19.5
A39: ='Tres Baumgarner'!$A$1 -> Tres Baumgarner | B39: =IF('Tres Baumgarner'!$C$7=" ","-",'Tres Baumgarner'!$C$7) -> 14 | C39: ='Tres Baumgarner'!$C$18 -> 12 | D39: ='Tres Baumgarner'!$C$31 -> - | E39: ='Tres Baumgarner'!$C$42 -> 12 | F39: ='Tres Baumgarner'!$T$53 -> 12.333333333333336 | G39: =IF(ISERROR(ROUND(F39,0)*1.5),"-",ROUND(F39,0)*1.5) -> 18