A1: =MID(CELL("filename",A1),FIND("]",CELL("filename",A1))+1,LEN(CELL("filename",A1))-FIND("]",CELL("filename",A1))) -> V. Bunn
A3: Scoresheet
A5: =Standings!$A$4 -> 2008
A6: FIRST HALF
B7: HC | C7: 3 | L7: Week 1-5 | AB7: 0.5
A8: Par | B8: 4 | C8: 3 | D8: 4 | E8: 4 | F8: 5 | G8: 3 | H8: 5 | I8: 4 | J8: 5 | Y8: =COUNTIF(O10:O14,"A") -> 0 | Z8: 1 | AA8: =5-Z8 -> 4 | AB8: =AA8*0.5 -> 2 | AC8: =IF(ISERROR(AVERAGE(SMALL(AE8:AE12,{1,2}))-37),"-",(AVERAGE(SMALL(AE8:AE12,{1,2}))-37)) -> 3 | AD8: 1 | AE8: =K10 -> 40
A9: Hole | B9: 1 | C9: 2 | D9: 3 | E9: 4 | F9: 5 | G9: 6 | H9: 7 | I9: 8 | J9: 9 | K9: Actual | L9: Par | M9: Net | N9: Par | O9: Points | P9: Eg | Q9: Br | R9: Pr | S9: Bg | T9: Dbl Bg+ | U9: Against | V9: Wins | W9: Loss | X9: Tie | Z9: 2 | AA9: =5-Z9 -> 3 | AB9: =AA9*0.5 -> 1.5 | AC9: =IF(ISERROR(AVERAGE(SMALL(AE8:AE12,{1,2}))-37),"-",(AVERAGE(SMALL(AE8:AE12,{1,2}))-37)) -> 3 | AD9: 2 | AE9: =K11 -> 40
A10: Week 1 | B10: 5 | C10: 6 | D10: 4 | E10: 4 | F10: 4 | G10: 3 | H10: 4 | I10: 4 | J10: 6 | K10: =IF(SUM(B10:J10)=0,"-",SUM(B10:J10)) -> 40 | L10: =IF(ISERROR(IF(K10-37=-37, "-", K10-37)),"-",(IF(K10-37=-37,"-",K10-37))) -> 3 | M10: =IF(ISERROR(IF(K10-C7=-C7, 0, K10-C7)),"-",(IF(K10-C7=-C7, 0, K10-C7))) -> 37 | N10: =IF(ISERROR(IF(M10-37=-37, "-", M10-37)),"-",(IF(M10-37=-37,"-",M10-37))) -> 0 | O10: 0 | P10: =SUM(IF(B10=2,1,0),IF(D10=2,1,0),IF(E10=2,1,0),IF(F10=3,1,0),IF(H10=3,1,0),IF(I10=2,1,0),IF(J10=3,1,0)) -> 0 | Q10: =SUM(IF(B10=3,1,0),IF(C10=2,1,0),IF(D10=3,1,0),IF(E10=3,1,0),IF(F10=4,1,0),IF(G10=2,1,0),IF(H10=4,1,0),IF(I10=3,1,0),IF(J10=4,1,0)) -> 2 | R10: =SUM(IF(B10=4,1,0),IF(C10=3,1,0),IF(D10=4,1,0),IF(E10=4,1,0),IF(F10=5,1,0),IF(G10=3,1,0),IF(H10=5,1,0),IF(I10=4,1,0),IF(J10=5,1,0)) -> 4 | S10: =SUM(IF(B10=5,1,0),IF(C10=4,1,0),IF(D10=5,1,0),IF(E10=5,1,0),IF(F10=6,1,0),IF(G10=4,1,0),IF(H10=6,1,0),IF(I10=5,1,0),IF(J10=6,1,0)) -> 2 | T10: =SUM(IF(B10=6,1,0),IF(C10=5,1,0),IF(D10=6,1,0),IF(E10=6,1,0),IF(F10=7,1,0),IF(G10=5,1,0),IF(H10=7,1,0),IF(I10=6,1,0),IF(J10=7,1,0),IF(B10=7,1,0),IF(C10=6,1,0),IF(D10=7,1,0),IF(E10=7,1,0),IF(F10=8,1,0),IF(G10=6,1,0),IF(H10=8,1,0),IF(I10=7,1,0),IF(J10=8,1,0),IF(B10=8,1,0),IF(C10=7,1,0),IF(D10=8,1,0),IF(E10=8,1,0),IF(F10=9,1,0),IF(G10=7,1,0),IF(H10=9,1,0),IF(I10=8,1,0),IF(J10=9,1,0)) -> 1 | U10: ='R. Keeney'!$A$1 -> R. Keeney | V10: =SUM(IF(O10=2,1,0),IF(O21=2,1,0),IF(O34=2,1,0),IF(O45=2,1,0)) -> 3 | W10: =SUM(IF(O10=0,1,0),IF(O21=0,1,0),IF(O34=0,1,0),IF(O45=0,1,0)) -> 1 | X10: =SUM(IF(O10=1,1,0),IF(O21=1,1,0),IF(O34=1,1,0),IF(O45=1,1,0)) -> 0 | Z10: 3 | AA10: =5-Z10 -> 2 | AB10: =AA10*0.5 -> 1 | AC10: =IF(ISERROR(AVERAGE(SMALL(AE8:AE12,{1}))-37),"-",AVERAGE(SMALL(AE8:AE12,{1}))-37) -> 3 | AD10: 3 | AE10: =K12 -> 41
A11: Week 2 | B11: 4 | C11: 3 | D11: 4 | E11: 5 | F11: 5 | G11: 3 | H11: 5 | I11: 5 | J11: 6 | K11: =IF(SUM(B11:J11)=0,"-",SUM(B11:J11)) -> 40 | L11: =IF(ISERROR(IF(K11-37=-37, "-", K11-37)),"-",(IF(K11-37=-37,"-",K11-37))) -> 3 | M11: =IF(ISERROR(IF(K11-C7=-C7, 0, K11-C7)),"-",(IF(K11-C7=-C7, 0, K11-C7))) -> 37 | N11: =IF(ISERROR(IF(M11-37=-37, "-", M11-37)),"-",(IF(M11-37=-37,"-",M11-37))) -> 0 | O11: 2 | P11: =SUM(IF(B11=2,1,0),IF(D11=2,1,0),IF(E11=2,1,0),IF(F11=3,1,0),IF(H11=3,1,0),IF(I11=2,1,0),IF(J11=3,1,0)) -> 0 | Q11: =SUM(IF(B11=3,1,0),IF(C11=2,1,0),IF(D11=3,1,0),IF(E11=3,1,0),IF(F11=4,1,0),IF(G11=2,1,0),IF(H11=4,1,0),IF(I11=3,1,0),IF(J11=4,1,0)) -> 0 | R11: =SUM(IF(B11=4,1,0),IF(C11=3,1,0),IF(D11=4,1,0),IF(E11=4,1,0),IF(F11=5,1,0),IF(G11=3,1,0),IF(H11=5,1,0),IF(I11=4,1,0),IF(J11=5,1,0)) -> 6 | S11: =SUM(IF(B11=5,1,0),IF(C11=4,1,0),IF(D11=5,1,0),IF(E11=5,1,0),IF(F11=6,1,0),IF(G11=4,1,0),IF(H11=6,1,0),IF(I11=5,1,0),IF(J11=6,1,0)) -> 3 | T11: =SUM(IF(B11=6,1,0),IF(C11=5,1,0),IF(D11=6,1,0),IF(E11=6,1,0),IF(F11=7,1,0),IF(G11=5,1,0),IF(H11=7,1,0),IF(I11=6,1,0),IF(J11=7,1,0),IF(B11=7,1,0),IF(C11=6,1,0),IF(D11=7,1,0),IF(E11=7,1,0),IF(F11=8,1,0),IF(G11=6,1,0),IF(H11=8,1,0),IF(I11=7,1,0),IF(J11=8,1,0),IF(B11=8,1,0),IF(C11=7,1,0),IF(D11=8,1,0),IF(E11=8,1,0),IF(F11=9,1,0),IF(G11=7,1,0),IF(H11=9,1,0),IF(I11=8,1,0),IF(J11=9,1,0)) -> 0 | U11: ='T. Proctor'!$A$1 -> T. Proctor | V11: =SUM(IF(O11=2,1,0),IF(O22=2,1,0),IF(O35=2,1,0),IF(O46=2,1,0)) -> 1 | W11: =SUM(IF(O11=0,1,0),IF(O22=0,1,0),IF(O35=0,1,0),IF(O46=0,1,0)) -> 1 | X11: =SUM(IF(O11=1,1,0),IF(O22=1,1,0),IF(O35=1,1,0),IF(O46=1,1,0)) -> 2 | Z11: 4 | AA11: =5-Z11 -> 1 | AB11: =AA11*0.5 -> 0.5 | AC11: =IF(ISERROR(AVERAGE(SMALL(AE8:AE12,{1}))-37),"-",AVERAGE(SMALL(AE8:AE12,{1}))-37) -> 3 | AD11: 4 | AE11: =K13 -> 41
A12: Week 3 | B12: 4 | C12: 4 | D12: 4 | E12: 6 | F12: 5 | G12: 3 | H12: 5 | I12: 5 | J12: 5 | K12: =IF(SUM(B12:J12)=0,"-",SUM(B12:J12)) -> 41 | L12: =IF(ISERROR(IF(K12-37=-37, "-", K12-37)),"-",(IF(K12-37=-37,"-",K12-37))) -> 4 | M12: =IF(ISERROR(IF(K12-C7=-C7, 0, K12-C7)),"-",(IF(K12-C7=-C7, 0, K12-C7))) -> 38 | N12: =IF(ISERROR(IF(M12-37=-37, "-", M12-37)),"-",(IF(M12-37=-37,"-",M12-37))) -> 1 | O12: 2 | P12: =SUM(IF(B12=2,1,0),IF(D12=2,1,0),IF(E12=2,1,0),IF(F12=3,1,0),IF(H12=3,1,0),IF(I12=2,1,0),IF(J12=3,1,0)) -> 0 | Q12: =SUM(IF(B12=3,1,0),IF(C12=2,1,0),IF(D12=3,1,0),IF(E12=3,1,0),IF(F12=4,1,0),IF(G12=2,1,0),IF(H12=4,1,0),IF(I12=3,1,0),IF(J12=4,1,0)) -> 0 | R12: =SUM(IF(B12=4,1,0),IF(C12=3,1,0),IF(D12=4,1,0),IF(E12=4,1,0),IF(F12=5,1,0),IF(G12=3,1,0),IF(H12=5,1,0),IF(I12=4,1,0),IF(J12=5,1,0)) -> 6 | S12: =SUM(IF(B12=5,1,0),IF(C12=4,1,0),IF(D12=5,1,0),IF(E12=5,1,0),IF(F12=6,1,0),IF(G12=4,1,0),IF(H12=6,1,0),IF(I12=5,1,0),IF(J12=6,1,0)) -> 2 | T12: =SUM(IF(B12=6,1,0),IF(C12=5,1,0),IF(D12=6,1,0),IF(E12=6,1,0),IF(F12=7,1,0),IF(G12=5,1,0),IF(H12=7,1,0),IF(I12=6,1,0),IF(J12=7,1,0),IF(B12=7,1,0),IF(C12=6,1,0),IF(D12=7,1,0),IF(E12=7,1,0),IF(F12=8,1,0),IF(G12=6,1,0),IF(H12=8,1,0),IF(I12=7,1,0),IF(J12=8,1,0),IF(B12=8,1,0),IF(C12=7,1,0),IF(D12=8,1,0),IF(E12=8,1,0),IF(F12=9,1,0),IF(G12=7,1,0),IF(H12=9,1,0),IF(I12=8,1,0),IF(J12=9,1,0)) -> 1 | U12: ='R. Ours'!$A$1 -> R. Ours | V12: =SUM(IF(O12=2,1,0),IF(O23=2,1,0),IF(O36=2,1,0),IF(O47=2,1,0)) -> 3 | W12: =SUM(IF(O12=0,1,0),IF(O23=0,1,0),IF(O36=0,1,0),IF(O47=0,1,0)) -> 0 | X12: =SUM(IF(O12=1,1,0),IF(O23=1,1,0),IF(O36=1,1,0),IF(O47=1,1,0)) -> 1 | AD12: 5 | AE12: =K14 -> 42
A13: Week 4 | B13: 4 | C13: 5 | D13: 5 | E13: 5 | F13: 4 | G13: 3 | H13: 5 | I13: 5 | J13: 5 | K13: =IF(SUM(B13:J13)=0,"-",SUM(B13:J13)) -> 41 | L13: =IF(ISERROR(IF(K13-37=-37, "-", K13-37)),"-",(IF(K13-37=-37,"-",K13-37))) -> 4 | M13: =IF(ISERROR(IF(K13-C7=-C7, 0, K13-C7)),"-",(IF(K13-C7=-C7, 0, K13-C7))) -> 38 | N13: =IF(ISERROR(IF(M13-37=-37, "-", M13-37)),"-",(IF(M13-37=-37,"-",M13-37))) -> 1 | O13: 2 | P13: =SUM(IF(B13=2,1,0),IF(D13=2,1,0),IF(E13=2,1,0),IF(F13=3,1,0),IF(H13=3,1,0),IF(I13=2,1,0),IF(J13=3,1,0)) -> 0 | Q13: =SUM(IF(B13=3,1,0),IF(C13=2,1,0),IF(D13=3,1,0),IF(E13=3,1,0),IF(F13=4,1,0),IF(G13=2,1,0),IF(H13=4,1,0),IF(I13=3,1,0),IF(J13=4,1,0)) -> 1 | R13: =SUM(IF(B13=4,1,0),IF(C13=3,1,0),IF(D13=4,1,0),IF(E13=4,1,0),IF(F13=5,1,0),IF(G13=3,1,0),IF(H13=5,1,0),IF(I13=4,1,0),IF(J13=5,1,0)) -> 4 | S13: =SUM(IF(B13=5,1,0),IF(C13=4,1,0),IF(D13=5,1,0),IF(E13=5,1,0),IF(F13=6,1,0),IF(G13=4,1,0),IF(H13=6,1,0),IF(I13=5,1,0),IF(J13=6,1,0)) -> 3 | T13: =SUM(IF(B13=6,1,0),IF(C13=5,1,0),IF(D13=6,1,0),IF(E13=6,1,0),IF(F13=7,1,0),IF(G13=5,1,0),IF(H13=7,1,0),IF(I13=6,1,0),IF(J13=7,1,0),IF(B13=7,1,0),IF(C13=6,1,0),IF(D13=7,1,0),IF(E13=7,1,0),IF(F13=8,1,0),IF(G13=6,1,0),IF(H13=8,1,0),IF(I13=7,1,0),IF(J13=8,1,0),IF(B13=8,1,0),IF(C13=7,1,0),IF(D13=8,1,0),IF(E13=8,1,0),IF(F13=9,1,0),IF(G13=7,1,0),IF(H13=9,1,0),IF(I13=8,1,0),IF(J13=9,1,0)) -> 1 | U13: ='G. White'!$A$1 -> G. White | V13: =SUM(IF(O13=2,1,0),IF(O24=2,1,0),IF(O37=2,1,0),IF(O48=2,1,0)) -> 2 | W13: =SUM(IF(O13=0,1,0),IF(O24=0,1,0),IF(O37=0,1,0),IF(O48=0,1,0)) -> 0 | X13: =SUM(IF(O13=1,1,0),IF(O24=1,1,0),IF(O37=1,1,0),IF(O48=1,1,0)) -> 1 | AD13: 6 | AE13: =K21 -> 37
A14: Week 5 | B14: 5 | C14: 5 | D14: 4 | E14: 5 | F14: 6 | G14: 3 | H14: 4 | I14: 5 | J14: 5 | K14: =IF(SUM(B14:J14)=0,"-",SUM(B14:J14)) -> 42 | L14: =IF(ISERROR(IF(K14-37=-37, "-", K14-37)),"-",(IF(K14-37=-37,"-",K14-37))) -> 5 | M14: =IF(ISERROR(IF(K14-C7=-C7, 0, K14-C7)),"-",(IF(K14-C7=-C7, 0, K14-C7))) -> 39 | N14: =IF(ISERROR(IF(M14-37=-37, "-", M14-37)),"-",(IF(M14-37=-37,"-",M14-37))) -> 2 | O14: 0 | P14: =SUM(IF(B14=2,1,0),IF(D14=2,1,0),IF(E14=2,1,0),IF(F14=3,1,0),IF(H14=3,1,0),IF(I14=2,1,0),IF(J14=3,1,0)) -> 0 | Q14: =SUM(IF(B14=3,1,0),IF(C14=2,1,0),IF(D14=3,1,0),IF(E14=3,1,0),IF(F14=4,1,0),IF(G14=2,1,0),IF(H14=4,1,0),IF(I14=3,1,0),IF(J14=4,1,0)) -> 1 | R14: =SUM(IF(B14=4,1,0),IF(C14=3,1,0),IF(D14=4,1,0),IF(E14=4,1,0),IF(F14=5,1,0),IF(G14=3,1,0),IF(H14=5,1,0),IF(I14=4,1,0),IF(J14=5,1,0)) -> 3 | S14: =SUM(IF(B14=5,1,0),IF(C14=4,1,0),IF(D14=5,1,0),IF(E14=5,1,0),IF(F14=6,1,0),IF(G14=4,1,0),IF(H14=6,1,0),IF(I14=5,1,0),IF(J14=6,1,0)) -> 4 | T14: =SUM(IF(B14=6,1,0),IF(C14=5,1,0),IF(D14=6,1,0),IF(E14=6,1,0),IF(F14=7,1,0),IF(G14=5,1,0),IF(H14=7,1,0),IF(I14=6,1,0),IF(J14=7,1,0),IF(B14=7,1,0),IF(C14=6,1,0),IF(D14=7,1,0),IF(E14=7,1,0),IF(F14=8,1,0),IF(G14=6,1,0),IF(H14=8,1,0),IF(I14=7,1,0),IF(J14=8,1,0),IF(B14=8,1,0),IF(C14=7,1,0),IF(D14=8,1,0),IF(E14=8,1,0),IF(F14=9,1,0),IF(G14=7,1,0),IF(H14=9,1,0),IF(I14=8,1,0),IF(J14=9,1,0)) -> 1 | U14: ='D. Smith'!$A$1 -> D. Smith | V14: =SUM(IF(O14=2,1,0),IF(O25=2,1,0),IF(O38=2,1,0),IF(O49=2,1,0)) -> 1 | W14: =SUM(IF(O14=0,1,0),IF(O25=0,1,0),IF(O38=0,1,0),IF(O49=0,1,0)) -> 1 | X14: =SUM(IF(O14=1,1,0),IF(O25=1,1,0),IF(O38=1,1,0),IF(O49=1,1,0)) -> 2 | AB14: 0.5 | AD14: 7 | AE14: =K22 -> 43
A15: 5 Week Average | B15: =IF(ISERROR(AVERAGE(B10:B14)),"-",AVERAGE(B10:B14)) -> 4.4 | C15: =IF(ISERROR(AVERAGE(C10:C14)),"-",AVERAGE(C10:C14)) -> 4.6 | D15: =IF(ISERROR(AVERAGE(D10:D14)),"-",AVERAGE(D10:D14)) -> 4.2 | E15: =IF(ISERROR(AVERAGE(E10:E14)),"-",AVERAGE(E10:E14)) -> 5 | F15: =IF(ISERROR(AVERAGE(F10:F14)),"-",AVERAGE(F10:F14)) -> 4.8 | G15: =IF(ISERROR(AVERAGE(G10:G14)),"-",AVERAGE(G10:G14)) -> 3 | H15: =IF(ISERROR(AVERAGE(H10:H14)),"-",AVERAGE(H10:H14)) -> 4.6 | I15: =IF(ISERROR(AVERAGE(I10:I14)),"-",AVERAGE(I10:I14)) -> 4.8 | J15: =IF(ISERROR(AVERAGE(J10:J14)),"-",AVERAGE(J10:J14)) -> 5.4 | K15: =IF(ISERROR(AVERAGE(IF(K10:K14<>0,K10:K14,""))),"-",(AVERAGE(IF(K10:K14<>0,K10:K14,"")))) -> 40.80 | L15: =IF(ISERROR(AVERAGE(L10:L14)),"-",(AVERAGE(L10:L14))) -> 3.80 | M15: =IF(ISERROR(AVERAGE(IF(M10:M14<>0,M10:M14,""))),"-",(AVERAGE(IF(M10:M14<>0,M10:M14,"")))) -> 37.80 | N15: =IF(ISERROR(AVERAGE(N10:N14)),"-",(AVERAGE(N10:N14))) -> 0.80 | O15: =SUM(O10:O14) -> 6 | P15: =SUM(P10:P14) -> 0 | Q15: =SUM(Q10:Q14) -> 4 | R15: =SUM(R10:R14) -> 23 | S15: =SUM(S10:S14) -> 14 | T15: =SUM(T10:T14) -> 4 | U15: 5 Week Total | Y15: =Y8+COUNTIF(O21:O25,"A") -> 1 | Z15: 1 | AA15: =10-Z15 -> 9 | AB15: =AA15*0.5 -> 4.5 | AC15: =IF(ISERROR(AVERAGE(SMALL(AE8:AE17,{1,2,3,4,5}))-37),"-",AVERAGE(SMALL(AE8:AE17,{1,2,3,4,5}))-37) -> 2.4 | AD15: 8 | AE15: =K23 -> 45
R16: New HC | T16: =IF(ISERROR(IF(Y8=0,(AVERAGE(SMALL(AE8:AE12,{1,2,3}))-37),VLOOKUP(Y8,$Z$8:$AC$11,4))),"-",IF(Y8=0,(AVERAGE(SMALL(AE8:AE12,{1,2,3}))-37),VLOOKUP(Y8,$Z$8:$AC$11,4))) -> 3.3333333333333357 | Z16: 2 | AA16: =10-Z16 -> 8 | AB16: =AA16*0.5 -> 4 | AC16: =IF(ISERROR(AVERAGE(SMALL(AE8:AE17,{1,2,3,4}))-37),"-",AVERAGE(SMALL(AE8:AE17,{1,2,3,4}))-37) -> 2 | AD16: 9 | AE16: =K24 -> 
Z17: 3 | AA17: =10-Z17 -> 7 | AB17: =AA17*0.5 -> 3.5 | AC17: =IF(ISERROR(AVERAGE(SMALL(AE8:AE17,{1,2,3,4}))-37),"-",AVERAGE(SMALL(AE8:AE17,{1,2,3,4}))-37) -> 2 | AD17: 10 | AE17: =K25 -> 39
B18: HC | C18: =IF(ISERROR(ROUND($T$16,0)),"-",ROUND($T$16,0)) -> 3 | L18: Week 6-10 | Z18: 4 | AA18: =10-Z18 -> 6 | AB18: =AA18*0.5 -> 3 | AC18: =IF(ISERROR(AVERAGE(SMALL(AE8:AE17,{1,2,3}))-37),"-",AVERAGE(SMALL(AE8:AE17,{1,2,3}))-37) -> 1.6666666666666643 | AD18: 11 | AE18: =K34 -> 41
A19: Par | B19: 4 | C19: 3 | D19: 4 | E19: 4 | F19: 5 | G19: 3 | H19: 5 | I19: 4 | J19: 5 | Z19: 5 | AA19: =10-Z19 -> 5 | AB19: =AA19*0.5 -> 2.5 | AC19: =IF(ISERROR(AVERAGE(SMALL(AE8:AE17,{1,2,3}))-37),"-",AVERAGE(SMALL(AE8:AE17,{1,2,3}))-37) -> 1.6666666666666643 | AD19: 12 | AE19: =K35 -> 38
A20: Hole | B20: 1 | C20: 2 | D20: 3 | E20: 4 | F20: 5 | G20: 6 | H20: 7 | I20: 8 | J20: 9 | K20: Actual | L20: Par | M20: Net | N20: Par | O20: Points | P20: Eg | Q20: Br | R20: Pr | S20: Bg | T20: Dbl Bg+ | Z20: 6 | AA20: =10-Z20 -> 4 | AB20: =AA20*0.5 -> 2 | AC20: =IF(ISERROR(AVERAGE(SMALL(AE8:AE17,{1,2}))-37),"-",AVERAGE(SMALL(AE8:AE17,{1,2}))-37) -> 1 | AD20: 13 | AE20: =K36 -> 41
A21: Week 6 | B21: 4 | C21: 3 | D21: 4 | E21: 5 | F21: 5 | G21: 3 | H21: 4 | I21: 4 | J21: 5 | K21: =IF(SUM(B21:J21)=0,"-",SUM(B21:J21)) -> 37 | L21: =IF(ISERROR(IF(K21-37=-37, "-", K21-37)),"-",(IF(K21-37=-37,"-",K21-37))) -> 0 | M21: =IF(ISERROR(IF(K21-C18=-C18, 0, K21-C18)),"-",(IF(K21-C18=-C18, 0, K21-C18))) -> 34 | N21: =IF(ISERROR(IF(M21-37=-37, "-", M21-37)),"-",(IF(M21-37=-37,"-",M21-37))) -> -3 | O21: 2 | P21: =SUM(IF(B21=2,1,0),IF(D21=2,1,0),IF(E21=2,1,0),IF(F21=3,1,0),IF(H21=3,1,0),IF(I21=2,1,0),IF(J21=3,1,0)) -> 0 | Q21: =SUM(IF(B21=3,1,0),IF(C21=2,1,0),IF(D21=3,1,0),IF(E21=3,1,0),IF(F21=4,1,0),IF(G21=2,1,0),IF(H21=4,1,0),IF(I21=3,1,0),IF(J21=4,1,0)) -> 1 | R21: =SUM(IF(B21=4,1,0),IF(C21=3,1,0),IF(D21=4,1,0),IF(E21=4,1,0),IF(F21=5,1,0),IF(G21=3,1,0),IF(H21=5,1,0),IF(I21=4,1,0),IF(J21=5,1,0)) -> 7 | S21: =SUM(IF(B21=5,1,0),IF(C21=4,1,0),IF(D21=5,1,0),IF(E21=5,1,0),IF(F21=6,1,0),IF(G21=4,1,0),IF(H21=6,1,0),IF(I21=5,1,0),IF(J21=6,1,0)) -> 1 | T21: =SUM(IF(B21=6,1,0),IF(C21=5,1,0),IF(D21=6,1,0),IF(E21=6,1,0),IF(F21=7,1,0),IF(G21=5,1,0),IF(H21=7,1,0),IF(I21=6,1,0),IF(J21=7,1,0),IF(B21=7,1,0),IF(C21=6,1,0),IF(D21=7,1,0),IF(E21=7,1,0),IF(F21=8,1,0),IF(G21=6,1,0),IF(H21=8,1,0),IF(I21=7,1,0),IF(J21=8,1,0),IF(B21=8,1,0),IF(C21=7,1,0),IF(D21=8,1,0),IF(E21=8,1,0),IF(F21=9,1,0),IF(G21=7,1,0),IF(H21=9,1,0),IF(I21=8,1,0),IF(J21=9,1,0)) -> 0 | Z21: 7 | AA21: =10-Z21 -> 3 | AB21: =AA21*0.5 -> 1.5 | AC21: =IF(ISERROR(AVERAGE(SMALL(AE8:AE17,{1,2}))-37),"-",AVERAGE(SMALL(AE8:AE17,{1,2}))-37) -> 1 | AD21: 14 | AE21: =K37 -> 36
A22: Week 7 | B22: 4 | C22: 4 | D22: 5 | E22: 7 | F22: 5 | G22: 4 | H22: 5 | I22: 5 | J22: 4 | K22: =IF(SUM(B22:J22)=0,"-",SUM(B22:J22)) -> 43 | L22: =IF(ISERROR(IF(K22-37=-37, "-", K22-37)),"-",(IF(K22-37=-37,"-",K22-37))) -> 6 | M22: =IF(ISERROR(IF(K22-C18=-C18, 0, K22-C18)),"-",(IF(K22-C18=-C18, 0, K22-C18))) -> 40 | N22: =IF(ISERROR(IF(M22-37=-37, "-", M22-37)),"-",(IF(M22-37=-37,"-",M22-37))) -> 3 | O22: 0 | P22: =SUM(IF(B22=2,1,0),IF(D22=2,1,0),IF(E22=2,1,0),IF(F22=3,1,0),IF(H22=3,1,0),IF(I22=2,1,0),IF(J22=3,1,0)) -> 0 | Q22: =SUM(IF(B22=3,1,0),IF(C22=2,1,0),IF(D22=3,1,0),IF(E22=3,1,0),IF(F22=4,1,0),IF(G22=2,1,0),IF(H22=4,1,0),IF(I22=3,1,0),IF(J22=4,1,0)) -> 1 | R22: =SUM(IF(B22=4,1,0),IF(C22=3,1,0),IF(D22=4,1,0),IF(E22=4,1,0),IF(F22=5,1,0),IF(G22=3,1,0),IF(H22=5,1,0),IF(I22=4,1,0),IF(J22=5,1,0)) -> 3 | S22: =SUM(IF(B22=5,1,0),IF(C22=4,1,0),IF(D22=5,1,0),IF(E22=5,1,0),IF(F22=6,1,0),IF(G22=4,1,0),IF(H22=6,1,0),IF(I22=5,1,0),IF(J22=6,1,0)) -> 4 | T22: =SUM(IF(B22=6,1,0),IF(C22=5,1,0),IF(D22=6,1,0),IF(E22=6,1,0),IF(F22=7,1,0),IF(G22=5,1,0),IF(H22=7,1,0),IF(I22=6,1,0),IF(J22=7,1,0),IF(B22=7,1,0),IF(C22=6,1,0),IF(D22=7,1,0),IF(E22=7,1,0),IF(F22=8,1,0),IF(G22=6,1,0),IF(H22=8,1,0),IF(I22=7,1,0),IF(J22=8,1,0),IF(B22=8,1,0),IF(C22=7,1,0),IF(D22=8,1,0),IF(E22=8,1,0),IF(F22=9,1,0),IF(G22=7,1,0),IF(H22=9,1,0),IF(I22=8,1,0),IF(J22=9,1,0)) -> 1 | Z22: 8 | AA22: =10-Z22 -> 2 | AB22: =AA22*0.5 -> 1 | AC22: =IF(ISERROR(AVERAGE(SMALL(AE8:AE17,{1}))-37),"-",AVERAGE(SMALL(AE8:AE17,{1}))-37) -> 0 | AD22: 15 | AE22: =K38 -> 40
A23: Week 8 | B23: 6 | C23: 5 | D23: 6 | E23: 4 | F23: 5 | G23: 3 | H23: 4 | I23: 6 | J23: 6 | K23: =IF(SUM(B23:J23)=0,"-",SUM(B23:J23)) -> 45 | L23: =IF(ISERROR(IF(K23-37=-37, "-", K23-37)),"-",(IF(K23-37=-37,"-",K23-37))) -> 8 | M23: =IF(ISERROR(IF(K23-C18=-C18, 0, K23-C18)),"-",(IF(K23-C18=-C18, 0, K23-C18))) -> 42 | N23: =IF(ISERROR(IF(M23-37=-37, "-", M23-37)),"-",(IF(M23-37=-37,"-",M23-37))) -> 5 | O23: 1 | P23: =SUM(IF(B23=2,1,0),IF(D23=2,1,0),IF(E23=2,1,0),IF(F23=3,1,0),IF(H23=3,1,0),IF(I23=2,1,0),IF(J23=3,1,0)) -> 0 | Q23: =SUM(IF(B23=3,1,0),IF(C23=2,1,0),IF(D23=3,1,0),IF(E23=3,1,0),IF(F23=4,1,0),IF(G23=2,1,0),IF(H23=4,1,0),IF(I23=3,1,0),IF(J23=4,1,0)) -> 1 | R23: =SUM(IF(B23=4,1,0),IF(C23=3,1,0),IF(D23=4,1,0),IF(E23=4,1,0),IF(F23=5,1,0),IF(G23=3,1,0),IF(H23=5,1,0),IF(I23=4,1,0),IF(J23=5,1,0)) -> 3 | S23: =SUM(IF(B23=5,1,0),IF(C23=4,1,0),IF(D23=5,1,0),IF(E23=5,1,0),IF(F23=6,1,0),IF(G23=4,1,0),IF(H23=6,1,0),IF(I23=5,1,0),IF(J23=6,1,0)) -> 1 | T23: =SUM(IF(B23=6,1,0),IF(C23=5,1,0),IF(D23=6,1,0),IF(E23=6,1,0),IF(F23=7,1,0),IF(G23=5,1,0),IF(H23=7,1,0),IF(I23=6,1,0),IF(J23=7,1,0),IF(B23=7,1,0),IF(C23=6,1,0),IF(D23=7,1,0),IF(E23=7,1,0),IF(F23=8,1,0),IF(G23=6,1,0),IF(H23=8,1,0),IF(I23=7,1,0),IF(J23=8,1,0),IF(B23=8,1,0),IF(C23=7,1,0),IF(D23=8,1,0),IF(E23=8,1,0),IF(F23=9,1,0),IF(G23=7,1,0),IF(H23=9,1,0),IF(I23=8,1,0),IF(J23=9,1,0)) -> 4 | Z23: 9 | AA23: =10-Z23 -> 1 | AB23: =AA23*0.5 -> 0.5 | AC23: =IF(ISERROR(AVERAGE(SMALL(AE8:AE17,{1}))-37),"-",AVERAGE(SMALL(AE8:AE17,{1}))-37) -> 0 | AD23: 16 | AE23: =K45 -> 40
A24: Week 9 | K24: =IF(SUM(B24:J24)=0,"-",SUM(B24:J24)) -> - | L24: =IF(ISERROR(IF(K24-37=-37, "-", K24-37)),"-",(IF(K24-37=-37,"-",K24-37))) -> - | M24: =IF(ISERROR(IF(K24-C18=-C18, 0, K24-C18)),"-",(IF(K24-C18=-C18, 0, K24-C18))) -> - | N24: =IF(ISERROR(IF(M24-37=-37, "-", M24-37)),"-",(IF(M24-37=-37,"-",M24-37))) -> - | O24: A | P24: =SUM(IF(B24=2,1,0),IF(D24=2,1,0),IF(E24=2,1,0),IF(F24=3,1,0),IF(H24=3,1,0),IF(I24=2,1,0),IF(J24=3,1,0)) -> 0 | Q24: =SUM(IF(B24=3,1,0),IF(C24=2,1,0),IF(D24=3,1,0),IF(E24=3,1,0),IF(F24=4,1,0),IF(G24=2,1,0),IF(H24=4,1,0),IF(I24=3,1,0),IF(J24=4,1,0)) -> 0 | R24: =SUM(IF(B24=4,1,0),IF(C24=3,1,0),IF(D24=4,1,0),IF(E24=4,1,0),IF(F24=5,1,0),IF(G24=3,1,0),IF(H24=5,1,0),IF(I24=4,1,0),IF(J24=5,1,0)) -> 0 | S24: =SUM(IF(B24=5,1,0),IF(C24=4,1,0),IF(D24=5,1,0),IF(E24=5,1,0),IF(F24=6,1,0),IF(G24=4,1,0),IF(H24=6,1,0),IF(I24=5,1,0),IF(J24=6,1,0)) -> 0 | T24: =SUM(IF(B24=6,1,0),IF(C24=5,1,0),IF(D24=6,1,0),IF(E24=6,1,0),IF(F24=7,1,0),IF(G24=5,1,0),IF(H24=7,1,0),IF(I24=6,1,0),IF(J24=7,1,0),IF(B24=7,1,0),IF(C24=6,1,0),IF(D24=7,1,0),IF(E24=7,1,0),IF(F24=8,1,0),IF(G24=6,1,0),IF(H24=8,1,0),IF(I24=7,1,0),IF(J24=8,1,0),IF(B24=8,1,0),IF(C24=7,1,0),IF(D24=8,1,0),IF(E24=8,1,0),IF(F24=9,1,0),IF(G24=7,1,0),IF(H24=9,1,0),IF(I24=8,1,0),IF(J24=9,1,0)) -> 0 | AD24: 17 | AE24: =K46 -> 42
A25: Week 10 | B25: 4 | C25: 4 | D25: 5 | E25: 5 | F25: 4 | G25: 3 | H25: 5 | I25: 4 | J25: 5 | K25: =IF(SUM(B25:J25)=0,"-",SUM(B25:J25)) -> 39 | L25: =IF(ISERROR(IF(K25-37=-37, "-", K25-37)),"-",(IF(K25-37=-37,"-",K25-37))) -> 2 | M25: =IF(ISERROR(IF(K25-C18=-C18, 0, K25-C18)),"-",(IF(K25-C18=-C18, 0, K25-C18))) -> 36 | N25: =IF(ISERROR(IF(M25-37=-37, "-", M25-37)),"-",(IF(M25-37=-37,"-",M25-37))) -> -1 | O25: 1 | P25: =SUM(IF(B25=2,1,0),IF(D25=2,1,0),IF(E25=2,1,0),IF(F25=3,1,0),IF(H25=3,1,0),IF(I25=2,1,0),IF(J25=3,1,0)) -> 0 | Q25: =SUM(IF(B25=3,1,0),IF(C25=2,1,0),IF(D25=3,1,0),IF(E25=3,1,0),IF(F25=4,1,0),IF(G25=2,1,0),IF(H25=4,1,0),IF(I25=3,1,0),IF(J25=4,1,0)) -> 1 | R25: =SUM(IF(B25=4,1,0),IF(C25=3,1,0),IF(D25=4,1,0),IF(E25=4,1,0),IF(F25=5,1,0),IF(G25=3,1,0),IF(H25=5,1,0),IF(I25=4,1,0),IF(J25=5,1,0)) -> 5 | S25: =SUM(IF(B25=5,1,0),IF(C25=4,1,0),IF(D25=5,1,0),IF(E25=5,1,0),IF(F25=6,1,0),IF(G25=4,1,0),IF(H25=6,1,0),IF(I25=5,1,0),IF(J25=6,1,0)) -> 3 | T25: =SUM(IF(B25=6,1,0),IF(C25=5,1,0),IF(D25=6,1,0),IF(E25=6,1,0),IF(F25=7,1,0),IF(G25=5,1,0),IF(H25=7,1,0),IF(I25=6,1,0),IF(J25=7,1,0),IF(B25=7,1,0),IF(C25=6,1,0),IF(D25=7,1,0),IF(E25=7,1,0),IF(F25=8,1,0),IF(G25=6,1,0),IF(H25=8,1,0),IF(I25=7,1,0),IF(J25=8,1,0),IF(B25=8,1,0),IF(C25=7,1,0),IF(D25=8,1,0),IF(E25=8,1,0),IF(F25=9,1,0),IF(G25=7,1,0),IF(H25=9,1,0),IF(I25=8,1,0),IF(J25=9,1,0)) -> 0 | AD25: 18 | AE25: =K47 -> 41
A26: 5 Week Average | B26: =IF(ISERROR(AVERAGE(B21:B25)),"-",AVERAGE(B21:B25)) -> 4.5 | C26: =IF(ISERROR(AVERAGE(C21:C25)),"-",AVERAGE(C21:C25)) -> 4 | D26: =IF(ISERROR(AVERAGE(D21:D25)),"-",AVERAGE(D21:D25)) -> 5 | E26: =IF(ISERROR(AVERAGE(E21:E25)),"-",AVERAGE(E21:E25)) -> 5.25 | F26: =IF(ISERROR(AVERAGE(F21:F25)),"-",AVERAGE(F21:F25)) -> 4.75 | G26: =IF(ISERROR(AVERAGE(G21:G25)),"-",AVERAGE(G21:G25)) -> 3.25 | H26: =IF(ISERROR(AVERAGE(H21:H25)),"-",AVERAGE(H21:H25)) -> 4.5 | I26: =IF(ISERROR(AVERAGE(I21:I25)),"-",AVERAGE(I21:I25)) -> 4.75 | J26: =IF(ISERROR(AVERAGE(J21:J25)),"-",AVERAGE(J21:J25)) -> 5 | K26: =IF(ISERROR(AVERAGE(IF(K21:K25<>0,K21:K25,""))),"-",(AVERAGE(IF(K21:K25<>0,K21:K25,"")))) -> 41.00 | L26: =IF(ISERROR(AVERAGE(L21:L25)),"-",(AVERAGE(L21:L25))) -> 4.00 | M26: =IF(ISERROR(AVERAGE(IF(M21:M25<>0,M21:M25,""))),"-",(AVERAGE(IF(M21:M25<>0,M21:M25,"")))) -> 38.00 | N26: =IF(ISERROR(AVERAGE(N21:N25)),"-",(AVERAGE(N21:N25))) -> 1.00 | O26: =SUM(O21:O25) -> 4 | P26: =SUM(P21:P25) -> 0 | Q26: =SUM(Q21:Q25) -> 4 | R26: =SUM(R21:R25) -> 18 | S26: =SUM(S21:S25) -> 9 | T26: =SUM(T21:T25) -> 5 | U26: 5 Week Total | AB26: 0.5 | AD26: 19 | AE26: =K48 -> 44
A27: 1st Half Average | B27: =IF(ISERROR(AVERAGE(B10:B14,B21:B25)),"-",AVERAGE(B10:B14,B21:B25)) -> 4.4444444444444446 | C27: =IF(ISERROR(AVERAGE(C10:C14,C21:C25)),"-",AVERAGE(C10:C14,C21:C25)) -> 4.333333333333333 | D27: =IF(ISERROR(AVERAGE(D10:D14,D21:D25)),"-",AVERAGE(D10:D14,D21:D25)) -> 4.5555555555555554 | E27: =IF(ISERROR(AVERAGE(E10:E14,E21:E25)),"-",AVERAGE(E10:E14,E21:E25)) -> 5.1111111111111107 | F27: =IF(ISERROR(AVERAGE(F10:F14,F21:F25)),"-",AVERAGE(F10:F14,F21:F25)) -> 4.7777777777777777 | G27: =IF(ISERROR(AVERAGE(G10:G14,G21:G25)),"-",AVERAGE(G10:G14,G21:G25)) -> 3.1111111111111112 | H27: =IF(ISERROR(AVERAGE(H10:H14,H21:H25)),"-",AVERAGE(H10:H14,H21:H25)) -> 4.5555555555555554 | I27: =IF(ISERROR(AVERAGE(I10:I14,I21:I25)),"-",AVERAGE(I10:I14,I21:I25)) -> 4.7777777777777777 | J27: =IF(ISERROR(AVERAGE(J10:J14,J21:J25)),"-",AVERAGE(J10:J14,J21:J25)) -> 5.2222222222222223 | K27: =IF(ISERROR(AVERAGE(K10:K14,K21:K25)),"-",AVERAGE(K10:K14,K21:K25)) -> 40.888888888888886 | L27: =IF(ISERROR(AVERAGE(L10:L14,L21:L25)),"-",AVERAGE(L10:L14,L21:L25)) -> 3.8888888888888888 | M27: =IF(ISERROR(AVERAGE(M10:M14,M21:M25)),"-",AVERAGE(M10:M14,M21:M25)) -> 37.888888888888886 | N27: =IF(ISERROR(AVERAGE(N10:N14,N21:N25)),"-",AVERAGE(N10:N14,N21:N25)) -> 0.88888888888888884 | O27: =SUM(O15,O26) -> 10 | P27: =SUM(P22:P26) -> 0 | Q27: =SUM(Q15,Q26) -> 8 | R27: =SUM(R15,R26) -> 41 | S27: =SUM(S15,S26) -> 23 | T27: =SUM(T15,T26) -> 9 | U27: 1st Half Total | Y27: =Y15+COUNTIF(O34:O38,"A") -> 1 | Z27: 1 | AA27: =15-Z27 -> 14 | AB27: =AA27*0.5 -> 7 | AC27: =IF(ISERROR(AVERAGE(SMALL(AE8:AE22,{1,2,3,4,5,6,7}))-37),"-",AVERAGE(SMALL(AE8:AE22,{1,2,3,4,5,6,7}))-37) -> 1.5714285714285694 | AD27: 20 | AE27: =K49 -> 40
R28: New HC | T28: =IF(ISERROR(IF(Y15=0,(AVERAGE(SMALL(AE8:AE17,{1,2,3,4,5}))-37),VLOOKUP(Y15,$Z$15:$AC$23,4))),"-",IF(Y15=0,(AVERAGE(SMALL(AE8:AE17,{1,2,3,4,5}))-37),VLOOKUP(Y15,$Z$15:$AC$23,4))) -> 2.40 | Z28: 2 | AA28: =15-Z28 -> 13 | AB28: =AA28*0.5 -> 6.5 | AC28: =IF(ISERROR(AVERAGE(SMALL(AE8:AE22,{1,2,3,4,5,6,7}))-37),"-",AVERAGE(SMALL(AE8:AE22,{1,2,3,4,5,6,7}))-37) -> 1.5714285714285694
Z29: 3 | AA29: =15-Z29 -> 12 | AB29: =AA29*0.5 -> 6 | AC29: =IF(ISERROR(AVERAGE(SMALL(AE8:AE22,{1,2,3,4,5,6}))-37),"-",AVERAGE(SMALL(AE8:AE22,{1,2,3,4,5,6}))-37) -> 1.3333333333333357
A30: SECOND HALF | Z30: 4 | AA30: =15-Z30 -> 11 | AB30: =AA30*0.5 -> 5.5 | AC30: =IF(ISERROR(AVERAGE(SMALL(AE8:AE22,{1,2,3,4,5,6}))-37),"-",AVERAGE(SMALL(AE8:AE22,{1,2,3,4,5,6}))-37) -> 1.3333333333333357
B31: HC | C31: =IF(ISERROR(ROUND($T$28,0)),"-",ROUND($T$28,0)) -> 2 | L31: Week 11-15 | Z31: 5 | AA31: =15-Z31 -> 10 | AB31: =AA31*0.5 -> 5 | AC31: =IF(ISERROR(AVERAGE(SMALL(AE8:AE22,{1,2,3,4,5}))-37),"-",AVERAGE(SMALL(AE8:AE22,{1,2,3,4,5}))-37) -> 1
A32: Par | B32: 4 | C32: 3 | D32: 4 | E32: 4 | F32: 5 | G32: 3 | H32: 5 | I32: 4 | J32: 5 | Z32: 6 | AA32: =15-Z32 -> 9 | AB32: =AA32*0.5 -> 4.5 | AC32: =IF(ISERROR(AVERAGE(SMALL(AE8:AE22,{1,2,3,4,5}))-37),"-",AVERAGE(SMALL(AE8:AE22,{1,2,3,4,5}))-37) -> 1
A33: Hole | B33: 1 | C33: 2 | D33: 3 | E33: 4 | F33: 5 | G33: 6 | H33: 7 | I33: 8 | J33: 9 | K33: Actual | L33: Par | M33: Net | N33: Par | O33: Points | P33: Eg | Q33: Br | R33: Pr | S33: Bg | T33: Dbl Bg+ | Z33: 7 | AA33: =15-Z33 -> 8 | AB33: =AA33*0.5 -> 4 | AC33: =IF(ISERROR(AVERAGE(SMALL(AE8:AE22,{1,2,3,4}))-37),"-",AVERAGE(SMALL(AE8:AE22,{1,2,3,4}))-37) -> 0.5
A34: Week 11 | B34: 4 | C34: 4 | D34: 4 | E34: 6 | F34: 8 | G34: 3 | H34: 4 | I34: 4 | J34: 4 | K34: =IF(SUM(B34:J34)=0,"-",SUM(B34:J34)) -> 41 | L34: =IF(ISERROR(IF(K34-37=-37, "-", K34-37)),"-",(IF(K34-37=-37,"-",K34-37))) -> 4 | M34: =IF(ISERROR(IF(K34-C31=-C31, 0, K34-C31)),"-",(IF(K34-C31=-C31, 0, K34-C31))) -> 39 | N34: =IF(ISERROR(IF(M34-37=-37, "-", M34-37)),"-",(IF(M34-37=-37,"-",M34-37))) -> 2 | O34: 2 | P34: =SUM(IF(B34=2,1,0),IF(D34=2,1,0),IF(E34=2,1,0),IF(F34=3,1,0),IF(H34=3,1,0),IF(I34=2,1,0),IF(J34=3,1,0)) -> 0 | Q34: =SUM(IF(B34=3,1,0),IF(C34=2,1,0),IF(D34=3,1,0),IF(E34=3,1,0),IF(F34=4,1,0),IF(G34=2,1,0),IF(H34=4,1,0),IF(I34=3,1,0),IF(J34=4,1,0)) -> 2 | R34: =SUM(IF(B34=4,1,0),IF(C34=3,1,0),IF(D34=4,1,0),IF(E34=4,1,0),IF(F34=5,1,0),IF(G34=3,1,0),IF(H34=5,1,0),IF(I34=4,1,0),IF(J34=5,1,0)) -> 4 | S34: =SUM(IF(B34=5,1,0),IF(C34=4,1,0),IF(D34=5,1,0),IF(E34=5,1,0),IF(F34=6,1,0),IF(G34=4,1,0),IF(H34=6,1,0),IF(I34=5,1,0),IF(J34=6,1,0)) -> 1 | T34: =SUM(IF(B34=6,1,0),IF(C34=5,1,0),IF(D34=6,1,0),IF(E34=6,1,0),IF(F34=7,1,0),IF(G34=5,1,0),IF(H34=7,1,0),IF(I34=6,1,0),IF(J34=7,1,0),IF(B34=7,1,0),IF(C34=6,1,0),IF(D34=7,1,0),IF(E34=7,1,0),IF(F34=8,1,0),IF(G34=6,1,0),IF(H34=8,1,0),IF(I34=7,1,0),IF(J34=8,1,0),IF(B34=8,1,0),IF(C34=7,1,0),IF(D34=8,1,0),IF(E34=8,1,0),IF(F34=9,1,0),IF(G34=7,1,0),IF(H34=9,1,0),IF(I34=8,1,0),IF(J34=9,1,0)) -> 2 | Z34: 8 | AA34: =15-Z34 -> 7 | AB34: =AA34*0.5 -> 3.5 | AC34: =IF(ISERROR(AVERAGE(SMALL(AE8:AE22,{1,2,3,4}))-37),"-",AVERAGE(SMALL(AE8:AE22,{1,2,3,4}))-37) -> 0.5
A35: Week 12 | B35: 4 | C35: 3 | D35: 5 | E35: 4 | F35: 5 | G35: 3 | H35: 4 | I35: 5 | J35: 5 | K35: =IF(SUM(B35:J35)=0,"-",SUM(B35:J35)) -> 38 | L35: =IF(ISERROR(IF(K35-37=-37, "-", K35-37)),"-",(IF(K35-37=-37,"-",K35-37))) -> 1 | M35: =IF(ISERROR(IF(K35-C31=-C31, 0, K35-C31)),"-",(IF(K35-C31=-C31, 0, K35-C31))) -> 36 | N35: =IF(ISERROR(IF(M35-37=-37, "-", M35-37)),"-",(IF(M35-37=-37,"-",M35-37))) -> -1 | O35: 1 | P35: =SUM(IF(B35=2,1,0),IF(D35=2,1,0),IF(E35=2,1,0),IF(F35=3,1,0),IF(H35=3,1,0),IF(I35=2,1,0),IF(J35=3,1,0)) -> 0 | Q35: =SUM(IF(B35=3,1,0),IF(C35=2,1,0),IF(D35=3,1,0),IF(E35=3,1,0),IF(F35=4,1,0),IF(G35=2,1,0),IF(H35=4,1,0),IF(I35=3,1,0),IF(J35=4,1,0)) -> 1 | R35: =SUM(IF(B35=4,1,0),IF(C35=3,1,0),IF(D35=4,1,0),IF(E35=4,1,0),IF(F35=5,1,0),IF(G35=3,1,0),IF(H35=5,1,0),IF(I35=4,1,0),IF(J35=5,1,0)) -> 6 | S35: =SUM(IF(B35=5,1,0),IF(C35=4,1,0),IF(D35=5,1,0),IF(E35=5,1,0),IF(F35=6,1,0),IF(G35=4,1,0),IF(H35=6,1,0),IF(I35=5,1,0),IF(J35=6,1,0)) -> 2 | T35: =SUM(IF(B35=6,1,0),IF(C35=5,1,0),IF(D35=6,1,0),IF(E35=6,1,0),IF(F35=7,1,0),IF(G35=5,1,0),IF(H35=7,1,0),IF(I35=6,1,0),IF(J35=7,1,0),IF(B35=7,1,0),IF(C35=6,1,0),IF(D35=7,1,0),IF(E35=7,1,0),IF(F35=8,1,0),IF(G35=6,1,0),IF(H35=8,1,0),IF(I35=7,1,0),IF(J35=8,1,0),IF(B35=8,1,0),IF(C35=7,1,0),IF(D35=8,1,0),IF(E35=8,1,0),IF(F35=9,1,0),IF(G35=7,1,0),IF(H35=9,1,0),IF(I35=8,1,0),IF(J35=9,1,0)) -> 0 | Z35: 9 | AA35: =15-Z35 -> 6 | AB35: =AA35*0.5 -> 3 | AC35: =IF(ISERROR(AVERAGE(SMALL(AE8:AE22,{1,2,3}))-37),"-",AVERAGE(SMALL(AE8:AE22,{1,2,3}))-37) -> 0
A36: Week 13 | B36: 4 | C36: 4 | D36: 4 | E36: 5 | F36: 6 | G36: 4 | H36: 4 | I36: 4 | J36: 6 | K36: =IF(SUM(B36:J36)=0,"-",SUM(B36:J36)) -> 41 | L36: =IF(ISERROR(IF(K36-37=-37, "-", K36-37)),"-",(IF(K36-37=-37,"-",K36-37))) -> 4 | M36: =IF(ISERROR(IF(K36-C31=-C31, 0, K36-C31)),"-",(IF(K36-C31=-C31, 0, K36-C31))) -> 39 | N36: =IF(ISERROR(IF(M36-37=-37, "-", M36-37)),"-",(IF(M36-37=-37,"-",M36-37))) -> 2 | O36: 2 | P36: =SUM(IF(B36=2,1,0),IF(D36=2,1,0),IF(E36=2,1,0),IF(F36=3,1,0),IF(H36=3,1,0),IF(I36=2,1,0),IF(J36=3,1,0)) -> 0 | Q36: =SUM(IF(B36=3,1,0),IF(C36=2,1,0),IF(D36=3,1,0),IF(E36=3,1,0),IF(F36=4,1,0),IF(G36=2,1,0),IF(H36=4,1,0),IF(I36=3,1,0),IF(J36=4,1,0)) -> 1 | R36: =SUM(IF(B36=4,1,0),IF(C36=3,1,0),IF(D36=4,1,0),IF(E36=4,1,0),IF(F36=5,1,0),IF(G36=3,1,0),IF(H36=5,1,0),IF(I36=4,1,0),IF(J36=5,1,0)) -> 3 | S36: =SUM(IF(B36=5,1,0),IF(C36=4,1,0),IF(D36=5,1,0),IF(E36=5,1,0),IF(F36=6,1,0),IF(G36=4,1,0),IF(H36=6,1,0),IF(I36=5,1,0),IF(J36=6,1,0)) -> 5 | T36: =SUM(IF(B36=6,1,0),IF(C36=5,1,0),IF(D36=6,1,0),IF(E36=6,1,0),IF(F36=7,1,0),IF(G36=5,1,0),IF(H36=7,1,0),IF(I36=6,1,0),IF(J36=7,1,0),IF(B36=7,1,0),IF(C36=6,1,0),IF(D36=7,1,0),IF(E36=7,1,0),IF(F36=8,1,0),IF(G36=6,1,0),IF(H36=8,1,0),IF(I36=7,1,0),IF(J36=8,1,0),IF(B36=8,1,0),IF(C36=7,1,0),IF(D36=8,1,0),IF(E36=8,1,0),IF(F36=9,1,0),IF(G36=7,1,0),IF(H36=9,1,0),IF(I36=8,1,0),IF(J36=9,1,0)) -> 0 | Z36: 10 | AA36: =15-Z36 -> 5 | AB36: =AA36*0.5 -> 2.5 | AC36: =IF(ISERROR(AVERAGE(SMALL(AE8:AE22,{1,2,3}))-37),"-",AVERAGE(SMALL(AE8:AE22,{1,2,3}))-37) -> 0
A37: Week 14 | B37: 3 | C37: 3 | D37: 4 | E37: 4 | F37: 5 | G37: 4 | H37: 4 | I37: 4 | J37: 5 | K37: =IF(SUM(B37:J37)=0,"-",SUM(B37:J37)) -> 36 | L37: =IF(ISERROR(IF(K37-37=-37, "-", K37-37)),"-",(IF(K37-37=-37,"-",K37-37))) -> -1 | M37: =IF(ISERROR(IF(K37-C31=-C31, 0, K37-C31)),"-",(IF(K37-C31=-C31, 0, K37-C31))) -> 34 | N37: =IF(ISERROR(IF(M37-37=-37, "-", M37-37)),"-",(IF(M37-37=-37,"-",M37-37))) -> -3 | O37: 2 | P37: =SUM(IF(B37=2,1,0),IF(D37=2,1,0),IF(E37=2,1,0),IF(F37=3,1,0),IF(H37=3,1,0),IF(I37=2,1,0),IF(J37=3,1,0)) -> 0 | Q37: =SUM(IF(B37=3,1,0),IF(C37=2,1,0),IF(D37=3,1,0),IF(E37=3,1,0),IF(F37=4,1,0),IF(G37=2,1,0),IF(H37=4,1,0),IF(I37=3,1,0),IF(J37=4,1,0)) -> 2 | R37: =SUM(IF(B37=4,1,0),IF(C37=3,1,0),IF(D37=4,1,0),IF(E37=4,1,0),IF(F37=5,1,0),IF(G37=3,1,0),IF(H37=5,1,0),IF(I37=4,1,0),IF(J37=5,1,0)) -> 6 | S37: =SUM(IF(B37=5,1,0),IF(C37=4,1,0),IF(D37=5,1,0),IF(E37=5,1,0),IF(F37=6,1,0),IF(G37=4,1,0),IF(H37=6,1,0),IF(I37=5,1,0),IF(J37=6,1,0)) -> 1 | T37: =SUM(IF(B37=6,1,0),IF(C37=5,1,0),IF(D37=6,1,0),IF(E37=6,1,0),IF(F37=7,1,0),IF(G37=5,1,0),IF(H37=7,1,0),IF(I37=6,1,0),IF(J37=7,1,0),IF(B37=7,1,0),IF(C37=6,1,0),IF(D37=7,1,0),IF(E37=7,1,0),IF(F37=8,1,0),IF(G37=6,1,0),IF(H37=8,1,0),IF(I37=7,1,0),IF(J37=8,1,0),IF(B37=8,1,0),IF(C37=7,1,0),IF(D37=8,1,0),IF(E37=8,1,0),IF(F37=9,1,0),IF(G37=7,1,0),IF(H37=9,1,0),IF(I37=8,1,0),IF(J37=9,1,0)) -> 0 | Z37: 11 | AA37: =15-Z37 -> 4 | AB37: =AA37*0.5 -> 2 | AC37: =IF(ISERROR(AVERAGE(SMALL(AE8:AE22,{1,2}))-37),"-",AVERAGE(SMALL(AE8:AE22,{1,2}))-37) -> -0.5
A38: Week 15 | B38: 5 | C38: 3 | D38: 4 | E38: 5 | F38: 5 | G38: 4 | H38: 5 | I38: 4 | J38: 5 | K38: =IF(SUM(B38:J38)=0,"-",SUM(B38:J38)) -> 40 | L38: =IF(ISERROR(IF(K38-37=-37, "-", K38-37)),"-",(IF(K38-37=-37,"-",K38-37))) -> 3 | M38: =IF(ISERROR(IF(K38-C31=-C31, 0, K38-C31)),"-",(IF(K38-C31=-C31, 0, K38-C31))) -> 38 | N38: =IF(ISERROR(IF(M38-37=-37, "-", M38-37)),"-",(IF(M38-37=-37,"-",M38-37))) -> 1 | O38: 1 | P38: =SUM(IF(B38=2,1,0),IF(D38=2,1,0),IF(E38=2,1,0),IF(F38=3,1,0),IF(H38=3,1,0),IF(I38=2,1,0),IF(J38=3,1,0)) -> 0 | Q38: =SUM(IF(B38=3,1,0),IF(C38=2,1,0),IF(D38=3,1,0),IF(E38=3,1,0),IF(F38=4,1,0),IF(G38=2,1,0),IF(H38=4,1,0),IF(I38=3,1,0),IF(J38=4,1,0)) -> 0 | R38: =SUM(IF(B38=4,1,0),IF(C38=3,1,0),IF(D38=4,1,0),IF(E38=4,1,0),IF(F38=5,1,0),IF(G38=3,1,0),IF(H38=5,1,0),IF(I38=4,1,0),IF(J38=5,1,0)) -> 6 | S38: =SUM(IF(B38=5,1,0),IF(C38=4,1,0),IF(D38=5,1,0),IF(E38=5,1,0),IF(F38=6,1,0),IF(G38=4,1,0),IF(H38=6,1,0),IF(I38=5,1,0),IF(J38=6,1,0)) -> 3 | T38: =SUM(IF(B38=6,1,0),IF(C38=5,1,0),IF(D38=6,1,0),IF(E38=6,1,0),IF(F38=7,1,0),IF(G38=5,1,0),IF(H38=7,1,0),IF(I38=6,1,0),IF(J38=7,1,0),IF(B38=7,1,0),IF(C38=6,1,0),IF(D38=7,1,0),IF(E38=7,1,0),IF(F38=8,1,0),IF(G38=6,1,0),IF(H38=8,1,0),IF(I38=7,1,0),IF(J38=8,1,0),IF(B38=8,1,0),IF(C38=7,1,0),IF(D38=8,1,0),IF(E38=8,1,0),IF(F38=9,1,0),IF(G38=7,1,0),IF(H38=9,1,0),IF(I38=8,1,0),IF(J38=9,1,0)) -> 0 | Z38: 12 | AA38: =15-Z38 -> 3 | AB38: =AA38*0.5 -> 1.5 | AC38: =IF(ISERROR(AVERAGE(SMALL(AE8:AE22,{1,2}))-37),"-",AVERAGE(SMALL(AE8:AE22,{1,2}))-37) -> -0.5
A39: 5 Week Average | B39: =IF(ISERROR(AVERAGE(B34:B38)),"-",AVERAGE(B34:B38)) -> 4 | C39: =IF(ISERROR(AVERAGE(C34:C38)),"-",AVERAGE(C34:C38)) -> 3.4 | D39: =IF(ISERROR(AVERAGE(D34:D38)),"-",AVERAGE(D34:D38)) -> 4.2 | E39: =IF(ISERROR(AVERAGE(E34:E38)),"-",AVERAGE(E34:E38)) -> 4.8 | F39: =IF(ISERROR(AVERAGE(F34:F38)),"-",AVERAGE(F34:F38)) -> 5.8 | G39: =IF(ISERROR(AVERAGE(G34:G38)),"-",AVERAGE(G34:G38)) -> 3.6 | H39: =IF(ISERROR(AVERAGE(H34:H38)),"-",AVERAGE(H34:H38)) -> 4.2 | I39: =IF(ISERROR(AVERAGE(I34:I38)),"-",AVERAGE(I34:I38)) -> 4.2 | J39: =IF(ISERROR(AVERAGE(J34:J38)),"-",AVERAGE(J34:J38)) -> 5 | K39: =IF(ISERROR(AVERAGE(IF(K34:K38<>0,K34:K38,""))),"-",(AVERAGE(IF(K34:K38<>0,K34:K38,"")))) -> 39.20 | L39: =IF(ISERROR(AVERAGE(L34:L38)),"-",(AVERAGE(L34:L38))) -> 2.20 | M39: =IF(ISERROR(AVERAGE(IF(M34:M38<>0,M34:M38,""))),"-",(AVERAGE(IF(M34:M38<>0,M34:M38,"")))) -> 37.20 | N39: =IF(ISERROR(AVERAGE(N34:N38)),"-",(AVERAGE(N34:N38))) -> 0.20 | O39: =SUM(O34:O38) -> 8 | P39: =SUM(P34:P38) -> 0 | Q39: =SUM(Q34:Q38) -> 6 | R39: =SUM(R34:R38) -> 25 | S39: =SUM(S34:S38) -> 12 | T39: =SUM(T34:T38) -> 2 | U39: 5 Week Total | Z39: 13 | AA39: =15-Z39 -> 2 | AB39: =AA39*0.5 -> 1 | AC39: =IF(ISERROR(AVERAGE(SMALL(AE8:AE22,{1}))-37),"-",AVERAGE(SMALL(AE8:AE22,{1}))-37) -> -1
R40: New HC | T40: =IF(ISERROR(IF(Y27=0,(AVERAGE(SMALL(AE8:AE22,{1,2,3,4,5,6,7,8}))-37),VLOOKUP(Y27,$Z$27:$AC$40,4))),"-",IF(Y27=0,(AVERAGE(SMALL(AE8:AE22,{1,2,3,4,5,6,7,8}))-37),VLOOKUP(Y27,$Z$27:$AC$40,4))) -> 1.5714285714285694 | Z40: 14 | AA40: =15-Z40 -> 1 | AB40: =AA40*0.5 -> 0.5 | AC40: =IF(ISERROR(AVERAGE(SMALL(AE8:AE22,{1}))-37),"-",AVERAGE(SMALL(AE8:AE22,{1}))-37) -> -1
B42: HC | C42: =IF(ISERROR(ROUND($T$40,0)),"-",ROUND($T$40,0)) -> 2 | L42: Week 16-20
A43: Par | B43: 4 | C43: 3 | D43: 4 | E43: 4 | F43: 5 | G43: 3 | H43: 5 | I43: 4 | J43: 5 | AB43: 0.5
A44: Hole | B44: 1 | C44: 2 | D44: 3 | E44: 4 | F44: 5 | G44: 6 | H44: 7 | I44: 8 | J44: 9 | K44: Actual | L44: Par | M44: Net | N44: Par | O44: Points | P44: Eg | Q44: Br | R44: Pr | S44: Bg | T44: Dbl Bg+ | Y44: =Y27+COUNTIF(O45:O49,"A") -> 1 | Z44: 1 | AA44: =20-Z44 -> 19 | AB44: =AA44*0.5 -> 9.5 | AC44: =IF(ISERROR(AVERAGE(SMALL(AE8:AE27,{1,2,3,4,5,6,7,8,9,10}))-37),"-",AVERAGE(SMALL(AE8:AE27,{1,2,3,4,5,6,7,8,9,10}))-37) -> 2.1
A45: Week 16 | B45: 4 | C45: 4 | D45: 3 | E45: 5 | F45: 5 | G45: 4 | H45: 4 | I45: 5 | J45: 6 | K45: =IF(SUM(B45:J45)=0,"-",SUM(B45:J45)) -> 40 | L45: =IF(ISERROR(IF(K45-37=-37, "-", K45-37)),"-",(IF(K45-37=-37,"-",K45-37))) -> 3 | M45: =IF(ISERROR(IF(K45-C42=-C42, 0, K45-C42)),"-",(IF(K45-C42=-C42, 0, K45-C42))) -> 38 | N45: =IF(ISERROR(IF(M45-37=-37, "-", M45-37)),"-",(IF(M45-37=-37,"-",M45-37))) -> 1 | O45: 2 | P45: =SUM(IF(B45=2,1,0),IF(D45=2,1,0),IF(E45=2,1,0),IF(F45=3,1,0),IF(H45=3,1,0),IF(I45=2,1,0),IF(J45=3,1,0)) -> 0 | Q45: =SUM(IF(B45=3,1,0),IF(C45=2,1,0),IF(D45=3,1,0),IF(E45=3,1,0),IF(F45=4,1,0),IF(G45=2,1,0),IF(H45=4,1,0),IF(I45=3,1,0),IF(J45=4,1,0)) -> 2 | R45: =SUM(IF(B45=4,1,0),IF(C45=3,1,0),IF(D45=4,1,0),IF(E45=4,1,0),IF(F45=5,1,0),IF(G45=3,1,0),IF(H45=5,1,0),IF(I45=4,1,0),IF(J45=5,1,0)) -> 2 | S45: =SUM(IF(B45=5,1,0),IF(C45=4,1,0),IF(D45=5,1,0),IF(E45=5,1,0),IF(F45=6,1,0),IF(G45=4,1,0),IF(H45=6,1,0),IF(I45=5,1,0),IF(J45=6,1,0)) -> 5 | T45: =SUM(IF(B45=6,1,0),IF(C45=5,1,0),IF(D45=6,1,0),IF(E45=6,1,0),IF(F45=7,1,0),IF(G45=5,1,0),IF(H45=7,1,0),IF(I45=6,1,0),IF(J45=7,1,0),IF(B45=7,1,0),IF(C45=6,1,0),IF(D45=7,1,0),IF(E45=7,1,0),IF(F45=8,1,0),IF(G45=6,1,0),IF(H45=8,1,0),IF(I45=7,1,0),IF(J45=8,1,0),IF(B45=8,1,0),IF(C45=7,1,0),IF(D45=8,1,0),IF(E45=8,1,0),IF(F45=9,1,0),IF(G45=7,1,0),IF(H45=9,1,0),IF(I45=8,1,0),IF(J45=9,1,0)) -> 0 | Z45: 2 | AA45: =20-Z45 -> 18 | AB45: =AA45*0.5 -> 9 | AC45: =IF(ISERROR(AVERAGE(SMALL(AE8:AE27,{1,2,3,4,5,6,7,8,9}))-37),"-",AVERAGE(SMALL(AE8:AE27,{1,2,3,4,5,6,7,8,9}))-37) -> 1.8888888888888857
A46: Week 17 | B46: 4 | C46: 4 | D46: 4 | E46: 5 | F46: 5 | G46: 4 | H46: 4 | I46: 4 | J46: 8 | K46: =IF(SUM(B46:J46)=0,"-",SUM(B46:J46)) -> 42 | L46: =IF(ISERROR(IF(K46-37=-37, "-", K46-37)),"-",(IF(K46-37=-37,"-",K46-37))) -> 5 | M46: =IF(ISERROR(IF(K46-C42=-C42, 0, K46-C42)),"-",(IF(K46-C42=-C42, 0, K46-C42))) -> 40 | N46: =IF(ISERROR(IF(M46-37=-37, "-", M46-37)),"-",(IF(M46-37=-37,"-",M46-37))) -> 3 | O46: 1 | P46: =SUM(IF(B46=2,1,0),IF(D46=2,1,0),IF(E46=2,1,0),IF(F46=3,1,0),IF(H46=3,1,0),IF(I46=2,1,0),IF(J46=3,1,0)) -> 0 | Q46: =SUM(IF(B46=3,1,0),IF(C46=2,1,0),IF(D46=3,1,0),IF(E46=3,1,0),IF(F46=4,1,0),IF(G46=2,1,0),IF(H46=4,1,0),IF(I46=3,1,0),IF(J46=4,1,0)) -> 1 | R46: =SUM(IF(B46=4,1,0),IF(C46=3,1,0),IF(D46=4,1,0),IF(E46=4,1,0),IF(F46=5,1,0),IF(G46=3,1,0),IF(H46=5,1,0),IF(I46=4,1,0),IF(J46=5,1,0)) -> 4 | S46: =SUM(IF(B46=5,1,0),IF(C46=4,1,0),IF(D46=5,1,0),IF(E46=5,1,0),IF(F46=6,1,0),IF(G46=4,1,0),IF(H46=6,1,0),IF(I46=5,1,0),IF(J46=6,1,0)) -> 3 | T46: =SUM(IF(B46=6,1,0),IF(C46=5,1,0),IF(D46=6,1,0),IF(E46=6,1,0),IF(F46=7,1,0),IF(G46=5,1,0),IF(H46=7,1,0),IF(I46=6,1,0),IF(J46=7,1,0),IF(B46=7,1,0),IF(C46=6,1,0),IF(D46=7,1,0),IF(E46=7,1,0),IF(F46=8,1,0),IF(G46=6,1,0),IF(H46=8,1,0),IF(I46=7,1,0),IF(J46=8,1,0),IF(B46=8,1,0),IF(C46=7,1,0),IF(D46=8,1,0),IF(E46=8,1,0),IF(F46=9,1,0),IF(G46=7,1,0),IF(H46=9,1,0),IF(I46=8,1,0),IF(J46=9,1,0)) -> 1 | Z46: 3 | AA46: =20-Z46 -> 17 | AB46: =AA46*0.5 -> 8.5 | AC46: =IF(ISERROR(AVERAGE(SMALL(AE8:AE27,{1,2,3,4,5,6,7,8,9}))-37),"-",AVERAGE(SMALL(AE8:AE27,{1,2,3,4,5,6,7,8,9}))-37) -> 1.8888888888888857
A47: Week 18 | B47: 4 | C47: 2 | D47: 5 | E47: 6 | F47: 6 | G47: 3 | H47: 4 | I47: 4 | J47: 7 | K47: =IF(SUM(B47:J47)=0,"-",SUM(B47:J47)) -> 41 | L47: =IF(ISERROR(IF(K47-37=-37, "-", K47-37)),"-",(IF(K47-37=-37,"-",K47-37))) -> 4 | M47: =IF(ISERROR(IF(K47-C42=-C42, 0, K47-C42)),"-",(IF(K47-C42=-C42, 0, K47-C42))) -> 39 | N47: =IF(ISERROR(IF(M47-37=-37, "-", M47-37)),"-",(IF(M47-37=-37,"-",M47-37))) -> 2 | O47: 2 | P47: =SUM(IF(B47=2,1,0),IF(D47=2,1,0),IF(E47=2,1,0),IF(F47=3,1,0),IF(H47=3,1,0),IF(I47=2,1,0),IF(J47=3,1,0)) -> 0 | Q47: =SUM(IF(B47=3,1,0),IF(C47=2,1,0),IF(D47=3,1,0),IF(E47=3,1,0),IF(F47=4,1,0),IF(G47=2,1,0),IF(H47=4,1,0),IF(I47=3,1,0),IF(J47=4,1,0)) -> 2 | R47: =SUM(IF(B47=4,1,0),IF(C47=3,1,0),IF(D47=4,1,0),IF(E47=4,1,0),IF(F47=5,1,0),IF(G47=3,1,0),IF(H47=5,1,0),IF(I47=4,1,0),IF(J47=5,1,0)) -> 3 | S47: =SUM(IF(B47=5,1,0),IF(C47=4,1,0),IF(D47=5,1,0),IF(E47=5,1,0),IF(F47=6,1,0),IF(G47=4,1,0),IF(H47=6,1,0),IF(I47=5,1,0),IF(J47=6,1,0)) -> 2 | T47: =SUM(IF(B47=6,1,0),IF(C47=5,1,0),IF(D47=6,1,0),IF(E47=6,1,0),IF(F47=7,1,0),IF(G47=5,1,0),IF(H47=7,1,0),IF(I47=6,1,0),IF(J47=7,1,0),IF(B47=7,1,0),IF(C47=6,1,0),IF(D47=7,1,0),IF(E47=7,1,0),IF(F47=8,1,0),IF(G47=6,1,0),IF(H47=8,1,0),IF(I47=7,1,0),IF(J47=8,1,0),IF(B47=8,1,0),IF(C47=7,1,0),IF(D47=8,1,0),IF(E47=8,1,0),IF(F47=9,1,0),IF(G47=7,1,0),IF(H47=9,1,0),IF(I47=8,1,0),IF(J47=9,1,0)) -> 2 | Z47: 4 | AA47: =20-Z47 -> 16 | AB47: =AA47*0.5 -> 8 | AC47: =IF(ISERROR(AVERAGE(SMALL(AE8:AE27,{1,2,3,4,5,6,7,8}))-37),"-",AVERAGE(SMALL(AE8:AE27,{1,2,3,4,5,6,7,8}))-37) -> 1.75
A48: Week 19 | B48: 4 | C48: 3 | D48: 6 | E48: 5 | F48: 5 | G48: 4 | H48: 7 | I48: 5 | J48: 5 | K48: =IF(SUM(B48:J48)=0,"-",SUM(B48:J48)) -> 44 | L48: =IF(ISERROR(IF(K48-37=-37, "-", K48-37)),"-",(IF(K48-37=-37,"-",K48-37))) -> 7 | M48: =IF(ISERROR(IF(K48-C42=-C42, 0, K48-C42)),"-",(IF(K48-C42=-C42, 0, K48-C42))) -> 42 | N48: =IF(ISERROR(IF(M48-37=-37, "-", M48-37)),"-",(IF(M48-37=-37,"-",M48-37))) -> 5 | O48: 1 | P48: =SUM(IF(B48=2,1,0),IF(D48=2,1,0),IF(E48=2,1,0),IF(F48=3,1,0),IF(H48=3,1,0),IF(I48=2,1,0),IF(J48=3,1,0)) -> 0 | Q48: =SUM(IF(B48=3,1,0),IF(C48=2,1,0),IF(D48=3,1,0),IF(E48=3,1,0),IF(F48=4,1,0),IF(G48=2,1,0),IF(H48=4,1,0),IF(I48=3,1,0),IF(J48=4,1,0)) -> 0 | R48: =SUM(IF(B48=4,1,0),IF(C48=3,1,0),IF(D48=4,1,0),IF(E48=4,1,0),IF(F48=5,1,0),IF(G48=3,1,0),IF(H48=5,1,0),IF(I48=4,1,0),IF(J48=5,1,0)) -> 4 | S48: =SUM(IF(B48=5,1,0),IF(C48=4,1,0),IF(D48=5,1,0),IF(E48=5,1,0),IF(F48=6,1,0),IF(G48=4,1,0),IF(H48=6,1,0),IF(I48=5,1,0),IF(J48=6,1,0)) -> 3 | T48: =SUM(IF(B48=6,1,0),IF(C48=5,1,0),IF(D48=6,1,0),IF(E48=6,1,0),IF(F48=7,1,0),IF(G48=5,1,0),IF(H48=7,1,0),IF(I48=6,1,0),IF(J48=7,1,0),IF(B48=7,1,0),IF(C48=6,1,0),IF(D48=7,1,0),IF(E48=7,1,0),IF(F48=8,1,0),IF(G48=6,1,0),IF(H48=8,1,0),IF(I48=7,1,0),IF(J48=8,1,0),IF(B48=8,1,0),IF(C48=7,1,0),IF(D48=8,1,0),IF(E48=8,1,0),IF(F48=9,1,0),IF(G48=7,1,0),IF(H48=9,1,0),IF(I48=8,1,0),IF(J48=9,1,0)) -> 2 | Z48: 5 | AA48: =20-Z48 -> 15 | AB48: =AA48*0.5 -> 7.5 | AC48: =IF(ISERROR(AVERAGE(SMALL(AE8:AE27,{1,2,3,4,5,6,7,8}))-37),"-",AVERAGE(SMALL(AE8:AE27,{1,2,3,4,5,6,7,8}))-37) -> 1.75
A49: Week 20 | B49: 4 | C49: 4 | D49: 5 | E49: 4 | F49: 4 | G49: 4 | H49: 5 | I49: 4 | J49: 6 | K49: =IF(SUM(B49:J49)=0,"-",SUM(B49:J49)) -> 40 | L49: =IF(ISERROR(IF(K49-37=-37, "-", K49-37)),"-",(IF(K49-37=-37,"-",K49-37))) -> 3 | M49: =IF(ISERROR(IF(K49-C42=-C42, 0, K49-C42)),"-",(IF(K49-C42=-C42, 0, K49-C42))) -> 38 | N49: =IF(ISERROR(IF(M49-37=-37, "-", M49-37)),"-",(IF(M49-37=-37,"-",M49-37))) -> 1 | O49: 2 | P49: =SUM(IF(B49=2,1,0),IF(D49=2,1,0),IF(E49=2,1,0),IF(F49=3,1,0),IF(H49=3,1,0),IF(I49=2,1,0),IF(J49=3,1,0)) -> 0 | Q49: =SUM(IF(B49=3,1,0),IF(C49=2,1,0),IF(D49=3,1,0),IF(E49=3,1,0),IF(F49=4,1,0),IF(G49=2,1,0),IF(H49=4,1,0),IF(I49=3,1,0),IF(J49=4,1,0)) -> 1 | R49: =SUM(IF(B49=4,1,0),IF(C49=3,1,0),IF(D49=4,1,0),IF(E49=4,1,0),IF(F49=5,1,0),IF(G49=3,1,0),IF(H49=5,1,0),IF(I49=4,1,0),IF(J49=5,1,0)) -> 4 | S49: =SUM(IF(B49=5,1,0),IF(C49=4,1,0),IF(D49=5,1,0),IF(E49=5,1,0),IF(F49=6,1,0),IF(G49=4,1,0),IF(H49=6,1,0),IF(I49=5,1,0),IF(J49=6,1,0)) -> 4 | T49: =SUM(IF(B49=6,1,0),IF(C49=5,1,0),IF(D49=6,1,0),IF(E49=6,1,0),IF(F49=7,1,0),IF(G49=5,1,0),IF(H49=7,1,0),IF(I49=6,1,0),IF(J49=7,1,0),IF(B49=7,1,0),IF(C49=6,1,0),IF(D49=7,1,0),IF(E49=7,1,0),IF(F49=8,1,0),IF(G49=6,1,0),IF(H49=8,1,0),IF(I49=7,1,0),IF(J49=8,1,0),IF(B49=8,1,0),IF(C49=7,1,0),IF(D49=8,1,0),IF(E49=8,1,0),IF(F49=9,1,0),IF(G49=7,1,0),IF(H49=9,1,0),IF(I49=8,1,0),IF(J49=9,1,0)) -> 0 | Z49: 6 | AA49: =20-Z49 -> 14 | AB49: =AA49*0.5 -> 7 | AC49: =IF(ISERROR(AVERAGE(SMALL(AE8:AE27,{1,2,3,4,5,6,7}))-37),"-",AVERAGE(SMALL(AE8:AE27,{1,2,3,4,5,6,7}))-37) -> 1.5714285714285694
A50: 5 Week Average | B50: =IF(ISERROR(AVERAGE(B45:B49)),"-",AVERAGE(B45:B49)) -> 4 | C50: =IF(ISERROR(AVERAGE(C45:C49)),"-",AVERAGE(C45:C49)) -> 3.4 | D50: =IF(ISERROR(AVERAGE(D45:D49)),"-",AVERAGE(D45:D49)) -> 4.6 | E50: =IF(ISERROR(AVERAGE(E45:E49)),"-",AVERAGE(E45:E49)) -> 5 | F50: =IF(ISERROR(AVERAGE(F45:F49)),"-",AVERAGE(F45:F49)) -> 5 | G50: =IF(ISERROR(AVERAGE(G45:G49)),"-",AVERAGE(G45:G49)) -> 3.8 | H50: =IF(ISERROR(AVERAGE(H45:H49)),"-",AVERAGE(H45:H49)) -> 4.8 | I50: =IF(ISERROR(AVERAGE(I45:I49)),"-",AVERAGE(I45:I49)) -> 4.4 | J50: =IF(ISERROR(AVERAGE(J45:J49)),"-",AVERAGE(J45:J49)) -> 6.4 | K50: =IF(ISERROR(AVERAGE(IF(K45:K49<>0,K45:K49,""))),"-",(AVERAGE(IF(K45:K49<>0,K45:K49,"")))) -> 41.40 | L50: =IF(ISERROR(AVERAGE(L45:L49)),"-",(AVERAGE(L45:L49))) -> 4.40 | M50: =IF(ISERROR(AVERAGE(IF(M45:M49<>0,M45:M49,""))),"-",(AVERAGE(IF(M45:M49<>0,M45:M49,"")))) -> 39.40 | N50: =IF(ISERROR(AVERAGE(N45:N49)),"-",(AVERAGE(N45:N49))) -> 2.40 | O50: =SUM(O45:O49) -> 8 | P50: =SUM(P45:P49) -> 0 | Q50: =SUM(Q45:Q49) -> 6 | R50: =SUM(R45:R49) -> 17 | S50: =SUM(S45:S49) -> 17 | T50: =SUM(T45:T49) -> 5 | U50: 5 Week Total | Z50: 7 | AA50: =20-Z50 -> 13 | AB50: =AA50*0.5 -> 6.5 | AC50: =IF(ISERROR(AVERAGE(SMALL(AE8:AE27,{1,2,3,4,5,6,7}))-37),"-",AVERAGE(SMALL(AE8:AE27,{1,2,3,4,5,6,7}))-37) -> 1.5714285714285694
A51: 2nd Half Average | B51: =IF(ISERROR(AVERAGE(B34:B38,B45:B49)),"-",AVERAGE(B34:B38,B45:B49)) -> 4 | C51: =IF(ISERROR(AVERAGE(C34:C38,C45:C49)),"-",AVERAGE(C34:C38,C45:C49)) -> 3.4 | D51: =IF(ISERROR(AVERAGE(D34:D38,D45:D49)),"-",AVERAGE(D34:D38,D45:D49)) -> 4.4 | E51: =IF(ISERROR(AVERAGE(E34:E38,E45:E49)),"-",AVERAGE(E34:E38,E45:E49)) -> 4.9 | F51: =IF(ISERROR(AVERAGE(F34:F38,F45:F49)),"-",AVERAGE(F34:F38,F45:F49)) -> 5.4 | G51: =IF(ISERROR(AVERAGE(G34:G38,G45:G49)),"-",AVERAGE(G34:G38,G45:G49)) -> 3.7 | H51: =IF(ISERROR(AVERAGE(H34:H38,H45:H49)),"-",AVERAGE(H34:H38,H45:H49)) -> 4.5 | I51: =IF(ISERROR(AVERAGE(I34:I38,I45:I49)),"-",AVERAGE(I34:I38,I45:I49)) -> 4.3 | J51: =IF(ISERROR(AVERAGE(J34:J38,J45:J49)),"-",AVERAGE(J34:J38,J45:J49)) -> 5.7 | K51: =IF(ISERROR(AVERAGE(K34:K38,K45:K49)),"-",AVERAGE(K34:K38,K45:K49)) -> 40.30 | L51: =IF(ISERROR(AVERAGE(L34:L38,L45:L49)),"-",AVERAGE(L34:L38,L45:L49)) -> 3.30 | M51: =IF(ISERROR(AVERAGE(M34:M38,M45:M49)),"-",AVERAGE(M34:M38,M45:M49)) -> 38.30 | N51: =IF(ISERROR(AVERAGE(N34:N38,N45:N49)),"-",AVERAGE(N34:N38,N45:N49)) -> 1.30 | O51: =SUM(O39,O50) -> 16 | P51: =SUM(P39,P50) -> 0 | Q51: =SUM(Q39,Q50) -> 12 | R51: =SUM(R39,R50) -> 42 | S51: =SUM(S39,S50) -> 29 | T51: =SUM(T39,T50) -> 7 | U51: 2nd Half Total | Z51: 8 | AA51: =20-Z51 -> 12 | AB51: =AA51*0.5 -> 6 | AC51: =IF(ISERROR(AVERAGE(SMALL(AE8:AE27,{1,2,3,4,5,6}))-37),"-",AVERAGE(SMALL(AE8:AE27,{1,2,3,4,5,6}))-37) -> 1.3333333333333357
A52: YTD Average | B52: =IF(ISERROR(AVERAGE(B10:B14,B21:B25,B34:B38,B45:B49)),"-",AVERAGE(B10:B14,B21:B25,B34:B38,B45:B49)) -> 4.2105263157894735 | C52: =IF(ISERROR(AVERAGE(C10:C14,C21:C25,C34:C38,C45:C49)),"-",AVERAGE(C10:C14,C21:C25,C34:C38,C45:C49)) -> 3.8421052631578947 | D52: =IF(ISERROR(AVERAGE(D10:D14,D21:D25,D34:D38,D45:D49)),"-",AVERAGE(D10:D14,D21:D25,D34:D38,D45:D49)) -> 4.4736842105263159 | E52: =IF(ISERROR(AVERAGE(E10:E14,E21:E25,E34:E38,E45:E49)),"-",AVERAGE(E10:E14,E21:E25,E34:E38,E45:E49)) -> 5 | F52: =IF(ISERROR(AVERAGE(F10:F14,F21:F25,F34:F38,F45:F49)),"-",AVERAGE(F10:F14,F21:F25,F34:F38,F45:F49)) -> 5.1052631578947372 | G52: =IF(ISERROR(AVERAGE(G10:G14,G21:G25,G34:G38,G45:G49)),"-",AVERAGE(G10:G14,G21:G25,G34:G38,G45:G49)) -> 3.4210526315789473 | H52: =IF(ISERROR(AVERAGE(H10:H14,H21:H25,H34:H38,H45:H49)),"-",AVERAGE(H10:H14,H21:H25,H34:H38,H45:H49)) -> 4.5263157894736841 | I52: =IF(ISERROR(AVERAGE(I10:I14,I21:I25,I34:I38,I45:I49)),"-",AVERAGE(I10:I14,I21:I25,I34:I38,I45:I49)) -> 4.5263157894736841 | J52: =IF(ISERROR(AVERAGE(J10:J14,J21:J25,J34:J38,J45:J49)),"-",AVERAGE(J10:J14,J21:J25,J34:J38,J45:J49)) -> 5.4736842105263159 | K52: =IF(ISERROR(AVERAGE(K10:K14,K21:K25,K34:K38,K45:K49)),"-",AVERAGE(K10:K14,K21:K25,K34:K38,K45:K49)) -> 40.578947368421055 | L52: =IF(ISERROR(AVERAGE(L10:L14,L21:L25,L34:L38,L45:L49)),"-",AVERAGE(L10:L14,L21:L25,L34:L38,L45:L49)) -> 3.5789473684210527 | M52: =IF(ISERROR(AVERAGE(M10:M14,M21:M25,M34:M38,M45:M49)),"-",AVERAGE(M10:M14,M21:M25,M34:M38,M45:M49)) -> 38.10526315789474 | N52: =IF(ISERROR(AVERAGE(N10:N14,N21:N25,N34:N38,N45:N49)),"-",AVERAGE(N10:N14,N21:N25,N34:N38,N45:N49)) -> 1.1052631578947369 | O52: =SUM(O27,O51) -> 26 | P52: =SUM(P27,P51) -> 0 | Q52: =SUM(Q27,Q51) -> 20 | R52: =SUM(R27,R51) -> 83 | S52: =SUM(S27,S51) -> 52 | T52: =SUM(T27,T51) -> 16 | U52: YTD Total | Z52: 9 | AA52: =20-Z52 -> 11 | AB52: =AA52*0.5 -> 5.5 | AC52: =IF(ISERROR(AVERAGE(SMALL(AE8:AE27,{1,2,3,4,5,6}))-37),"-",AVERAGE(SMALL(AE8:AE27,{1,2,3,4,5,6}))-37) -> 1.3333333333333357
H53: Low Round | K53: =IF(MIN(K10:K14,K21:K25,K34:K38,K45:K49)=0,"-",(MIN(K10:K14,K21:K25,K34:K38,K45:K49))) -> 36 | L53: Low Net Round | N53: =IF(MIN(M10:M14,M21:M25,M34:M38,M45:M49)=0,"-",MIN(M10:M14,M21:M25,M34:M38,M45:M49)) -> 34 | Q53: Year Ending HC | T53: =IF(ISERROR(IF(Y44=0,(AVERAGE(SMALL(AE8:AE27,{1,2,3,4,5,6,7,8,9,10}))-37),VLOOKUP(Y44,$Z$44:$AC$62,4))),"-",IF(Y44=0,(AVERAGE(SMALL(AE8:AE27,{1,2,3,4,5,6,7,8,9,10}))-37),VLOOKUP(Y44,$Z$44:$AC$62,4))) -> 2.10 | Z53: 10 | AA53: =20-Z53 -> 10 | AB53: =AA53*0.5 -> 5 | AC53: =IF(ISERROR(AVERAGE(SMALL(AE8:AE27,{1,2,3,4,5}))-37),"-",AVERAGE(SMALL(AE8:AE27,{1,2,3,4,5}))-37) -> 1
Z54: 11 | AA54: =20-Z54 -> 9 | AB54: =AA54*0.5 -> 4.5 | AC54: =IF(ISERROR(AVERAGE(SMALL(AE8:AE27,{1,2,3,4,5}))-37),"-",AVERAGE(SMALL(AE8:AE27,{1,2,3,4,5}))-37) -> 1
Z55: 12 | AA55: =20-Z55 -> 8 | AB55: =AA55*0.5 -> 4 | AC55: =IF(ISERROR(AVERAGE(SMALL(AE8:AE27,{1,2,3,4}))-37),"-",AVERAGE(SMALL(AE8:AE27,{1,2,3,4}))-37) -> 0.5
Z56: 13 | AA56: =20-Z56 -> 7 | AB56: =AA56*0.5 -> 3.5 | AC56: =IF(ISERROR(AVERAGE(SMALL(AE8:AE27,{1,2,3,4}))-37),"-",AVERAGE(SMALL(AE8:AE27,{1,2,3,4}))-37) -> 0.5
Z57: 14 | AA57: =20-Z57 -> 6 | AB57: =AA57*0.5 -> 3 | AC57: =IF(ISERROR(AVERAGE(SMALL(AE8:AE27,{1,2,3}))-37),"-",AVERAGE(SMALL(AE8:AE27,{1,2,3}))-37) -> 0
Z58: 15 | AA58: =20-Z58 -> 5 | AB58: =AA58*0.5 -> 2.5 | AC58: =IF(ISERROR(AVERAGE(SMALL(AE8:AE27,{1,2,3}))-37),"-",AVERAGE(SMALL(AE8:AE27,{1,2,3}))-37) -> 0
Z59: 16 | AA59: =20-Z59 -> 4 | AB59: =AA59*0.5 -> 2 | AC59: =IF(ISERROR(AVERAGE(SMALL(AE8:AE27,{1,2}))-37),"-",AVERAGE(SMALL(AE8:AE27,{1,2}))-37) -> -0.5
Z60: 17 | AA60: =20-Z60 -> 3 | AB60: =AA60*0.5 -> 1.5 | AC60: =IF(ISERROR(AVERAGE(SMALL(AE8:AE27,{1,2}))-37),"-",AVERAGE(SMALL(AE8:AE27,{1,2}))-37) -> -0.5
Z61: 18 | AA61: =20-Z61 -> 2 | AB61: =AA61*0.5 -> 1 | AC61: =IF(ISERROR(AVERAGE(SMALL(AE8:AE27,{1}))-37),"-",AVERAGE(SMALL(AE8:AE27,{1}))-37) -> -1
Z62: 19 | AA62: =20-Z62 -> 1 | AB62: =AA62*0.5 -> 0.5 | AC62: =IF(ISERROR(AVERAGE(SMALL(AE8:AE27,{1}))-37),"-",AVERAGE(SMALL(AE8:AE27,{1}))-37) -> -1