A2: =MID(CELL("filename",A1),FIND("]",CELL("filename",A1))+1,LEN(CELL("filename",A1))-FIND("]",CELL("filename",A1))) -> Individual Stats by Team
A3: =Standings!$A$4 -> 2008
A4: Team 1
A5: Week | B5: 1 | C5: 2 | D5: 3 | E5: 4 | F5: 5 | G5: 6 | H5: 7 | I5: 8 | J5: 9 | K5: 10 | M5: 11 | N5: 12 | O5: 13 | P5: 14 | Q5: 15 | R5: 16 | S5: 17 | T5: 18 | U5: 19 | V5: 20 | W5: Avg. | X5: Par | Y5: Net Avg. | Z5: Overall Rank | AA5: Low Rnd. | AB5: Max Rnd. | AC5: Low Net Rnd.
A6: ='R. Ours'!$A$1 -> R. Ours | B6: ='R. Ours'!$K$10 -> 41 | C6: ='R. Ours'!$K$11 -> 38 | D6: ='R. Ours'!$K$12 -> 44 | E6: ='R. Ours'!$K$13 -> - | F6: ='R. Ours'!$K$14 -> 42 | G6: ='R. Ours'!$K$21 -> 43 | H6: ='R. Ours'!$K$22 -> 41 | I6: ='R. Ours'!$K$23 -> - | J6: ='R. Ours'!$K$24 -> 42 | K6: ='R. Ours'!$K$25 -> 38 | M6: ='R. Ours'!$K$34 -> 42 | N6: ='R. Ours'!$K$35 -> 40 | O6: ='R. Ours'!$K$36 -> 43 | P6: ='R. Ours'!$K$37 -> 38 | Q6: ='R. Ours'!$K$38 -> 38 | R6: ='R. Ours'!$K$45 -> 40 | S6: ='R. Ours'!$K$46 -> 41 | T6: ='R. Ours'!$K$47 -> 43 | U6: ='R. Ours'!$K$48 -> 41 | V6: ='R. Ours'!$K$49 -> 35 | W6: =IF(ISERROR(AVERAGE(IF(B6:V6<>0,B6:V6,""))),"-",(AVERAGE(IF(B6:V6<>0,B6:V6,"")))) -> 40.555555555555557 | X6: =IF(ISERROR(W6-37),"-",(W6-37)) -> 3.5555555555555571 | Y6: ='R. Ours'!$M$52 -> 38.277777777777779 | Z6: =IF(ISERROR(RANK(Y6,Y$6:Y$85,1)),"-",RANK(Y6,Y$6:Y$85,1)) -> 12 | AA6: =IF(MIN(B6:V6)=0,"-",MIN(B6:V6)) -> 35 | AB6: =IF(MAX(C6:W6)=0,"-",MAX(C6:W6)) -> 44 | AC6: ='R. Ours'!$N$53 -> 33
A7: Avg | C7: =IF(ISERROR(AVERAGE(IF(B6:C6<>0,B6:C6,""))),"-",(AVERAGE(IF(B6:C6<>0,B6:C6,"")))) -> 39.5 | D7: =IF(ISERROR(AVERAGE(IF(B6:D6<>0,B6:D6,""))),"-",(AVERAGE(IF(B6:D6<>0,B6:D6,"")))) -> 41 | E7: =IF(ISERROR(AVERAGE(IF(B6:E6<>0,B6:E6,""))),"-",(AVERAGE(IF(B6:E6<>0,B6:E6,"")))) -> 41 | F7: =IF(ISERROR(AVERAGE(IF(B6:F6<>0,B6:F6,""))),"-",(AVERAGE(IF(B6:F6<>0,B6:F6,"")))) -> 41.25 | G7: =IF(ISERROR(AVERAGE(IF(B6:G6<>0,B6:G6,""))),"-",(AVERAGE(IF(B6:G6<>0,B6:G6,"")))) -> 41.6 | H7: =IF(ISERROR(AVERAGE(IF(B6:H6<>0,B6:H6,""))),"-",(AVERAGE(IF(B6:H6<>0,B6:H6,"")))) -> 41.5 | I7: =IF(ISERROR(AVERAGE(IF(B6:I6<>0,B6:I6,""))),"-",(AVERAGE(IF(B6:I6<>0,B6:I6,"")))) -> 41.5 | J7: =IF(ISERROR(AVERAGE(IF(B6:J6<>0,B6:J6,""))),"-",(AVERAGE(IF(B6:J6<>0,B6:J6,"")))) -> 41.571428571428569 | K7: =IF(ISERROR(AVERAGE(IF(B6:K6<>0,B6:K6,""))),"-",(AVERAGE(IF(B6:K6<>0,B6:K6,"")))) -> 41.125 | M7: =IF(ISERROR(AVERAGE(IF(B6:M6<>0,B6:M6,""))),"-",(AVERAGE(IF(B6:M6<>0,B6:M6,"")))) -> 41.222222222222221 | N7: =IF(ISERROR(AVERAGE(IF(B6:N6<>0,B6:N6,""))),"-",(AVERAGE(IF(B6:N6<>0,B6:N6,"")))) -> 41.1 | O7: =IF(ISERROR(AVERAGE(IF(B6:O6<>0,B6:O6,""))),"-",(AVERAGE(IF(B6:O6<>0,B6:O6,"")))) -> 41.272727272727273 | P7: =IF(ISERROR(AVERAGE(IF(B6:P6<>0,B6:P6,""))),"-",(AVERAGE(IF(B6:P6<>0,B6:P6,"")))) -> 41 | Q7: =IF(ISERROR(AVERAGE(IF(B6:Q6<>0,B6:Q6,""))),"-",(AVERAGE(IF(B6:Q6<>0,B6:Q6,"")))) -> 40.769230769230766 | R7: =IF(ISERROR(AVERAGE(IF(B6:R6<>0,B6:R6,""))),"-",(AVERAGE(IF(B6:R6<>0,B6:R6,"")))) -> 40.714285714285715 | S7: =IF(ISERROR(AVERAGE(IF(B6:S6<>0,B6:S6,""))),"-",(AVERAGE(IF(B6:S6<>0,B6:S6,"")))) -> 40.733333333333334 | T7: =IF(ISERROR(AVERAGE(IF(B6:T6<>0,B6:T6,""))),"-",(AVERAGE(IF(B6:T6<>0,B6:T6,"")))) -> 40.875 | U7: =IF(ISERROR(AVERAGE(IF(B6:U6<>0,B6:U6,""))),"-",(AVERAGE(IF(B6:U6<>0,B6:U6,"")))) -> 40.882352941176471 | V7: =IF(ISERROR(AVERAGE(IF(B6:V6<>0,B6:V6,""))),"-",(AVERAGE(IF(B6:V6<>0,B6:V6,"")))) -> 40.555555555555557
A9: ='S. Jones'!$A$1 -> S. Jones | B9: ='S. Jones'!$K$10 -> 45 | C9: ='S. Jones'!$K$11 -> 43 | D9: ='S. Jones'!$K$12 -> 46 | E9: ='S. Jones'!$K$13 -> 50 | F9: ='S. Jones'!$K$14 -> 49 | G9: ='S. Jones'!$K$21 -> 50 | H9: ='S. Jones'!$K$22 -> 44 | I9: ='S. Jones'!$K$23 -> 46 | J9: ='S. Jones'!$K$24 -> 46 | K9: ='S. Jones'!$K$25 -> 44 | M9: ='S. Jones'!$K$34 -> 46 | N9: ='S. Jones'!$K$35 -> - | O9: ='S. Jones'!$K$36 -> 48 | P9: ='S. Jones'!$K$37 -> 41 | Q9: ='S. Jones'!$K$38 -> 47 | R9: ='S. Jones'!$K$45 -> 44 | S9: ='S. Jones'!$K$46 -> 46 | T9: ='S. Jones'!$K$47 -> 40 | U9: ='S. Jones'!$K$48 -> 43 | V9: ='S. Jones'!$K$49 -> 49 | W9: =IF(ISERROR(AVERAGE(IF(B9:V9<>0,B9:V9,""))),"-",(AVERAGE(IF(B9:V9<>0,B9:V9,"")))) -> 45.631578947368418 | X9: =IF(ISERROR(W9-37),"-",(W9-37)) -> 8.6315789473684177 | Y9: ='S. Jones'!$M$52 -> 38.631578947368418 | Z9: =IF(ISERROR(RANK(Y9,Y$6:Y$85,1)),"-",RANK(Y9,Y$6:Y$85,1)) -> 17 | AA9: =IF(MIN(B9:V9)=0,"-",MIN(B9:V9)) -> 40 | AB9: =IF(MAX(C9:W9)=0,"-",MAX(C9:W9)) -> 50 | AC9: ='S. Jones'!$N$53 -> 33
A10: Avg | C10: =IF(ISERROR(AVERAGE(B9:C9)),"-",(AVERAGE(B9:C9))) -> 44 | D10: =IF(ISERROR(AVERAGE(B9:D9)),"-",(AVERAGE(B9:D9))) -> 44.666666666666664 | E10: =IF(ISERROR(AVERAGE(B9:E9)),"-",(AVERAGE(B9:E9))) -> 46 | F10: =IF(ISERROR(AVERAGE(B9:F9)),"-",(AVERAGE(B9:F9))) -> 46.6 | G10: =IF(ISERROR(AVERAGE(B9:G9)),"-",(AVERAGE(B9:G9))) -> 47.166666666666664 | H10: =IF(ISERROR(AVERAGE(B9:H9)),"-",(AVERAGE(B9:H9))) -> 46.714285714285715 | I10: =IF(ISERROR(AVERAGE(B9:I9)),"-",(AVERAGE(B9:I9))) -> 46.625 | J10: =IF(ISERROR(AVERAGE(B9:J9)),"-",(AVERAGE(B9:J9))) -> 46.555555555555557 | K10: =IF(ISERROR(AVERAGE(B9:K9)),"-",(AVERAGE(B9:K9))) -> 46.3 | M10: =IF(ISERROR(AVERAGE(B9:M9)),"-",(AVERAGE(B9:M9))) -> 46.272727272727273 | N10: =IF(ISERROR(AVERAGE(B9:N9)),"-",(AVERAGE(B9:N9))) -> 46.272727272727273 | O10: =IF(ISERROR(AVERAGE(B9:O9)),"-",(AVERAGE(B9:O9))) -> 46.416666666666664 | P10: =IF(ISERROR(AVERAGE(B9:P9)),"-",(AVERAGE(B9:P9))) -> 46 | Q10: =IF(ISERROR(AVERAGE(B9:Q9)),"-",(AVERAGE(B9:Q9))) -> 46.071428571428569 | R10: =IF(ISERROR(AVERAGE(B9:R9)),"-",(AVERAGE(B9:R9))) -> 45.93333333333333 | S10: =IF(ISERROR(AVERAGE(B9:S9)),"-",(AVERAGE(B9:S9))) -> 45.9375 | T10: =IF(ISERROR(AVERAGE(B9:T9)),"-",(AVERAGE(B9:T9))) -> 45.588235294117645 | U10: =IF(ISERROR(AVERAGE(B9:U9)),"-",(AVERAGE(B9:U9))) -> 45.444444444444443 | V10: =IF(ISERROR(AVERAGE(B9:V9)),"-",(AVERAGE(B9:V9))) -> 45.631578947368418
A12: ='G. Taylor'!$A$1 -> G. Taylor | B12: ='G. Taylor'!$K$10 -> - | C12: ='G. Taylor'!$K$11 -> 50 | D12: ='G. Taylor'!$K$12 -> 48 | E12: ='G. Taylor'!$K$13 -> 45 | F12: ='G. Taylor'!$K$14 -> 49 | G12: ='G. Taylor'!$K$21 -> 45 | H12: ='G. Taylor'!$K$22 -> 47 | I12: ='G. Taylor'!$K$23 -> 47 | J12: ='G. Taylor'!$K$24 -> 52 | K12: ='G. Taylor'!$K$25 -> 50 | M12: ='G. Taylor'!$K$34 -> 45 | N12: ='G. Taylor'!$K$35 -> 41 | O12: ='G. Taylor'!$K$36 -> 44 | P12: ='G. Taylor'!$K$37 -> 43 | Q12: ='G. Taylor'!$K$38 -> 43 | R12: ='G. Taylor'!$K$45 -> 49 | S12: ='G. Taylor'!$K$46 -> - | T12: ='G. Taylor'!$K$47 -> 42 | U12: ='G. Taylor'!$K$48 -> 46 | V12: ='G. Taylor'!$K$49 -> 45 | W12: =IF(ISERROR(AVERAGE(IF(B12:V12<>0,B12:V12,""))),"-",(AVERAGE(IF(B12:V12<>0,B12:V12,"")))) -> 46.166666666666664 | X12: =IF(ISERROR(W12-37),"-",(W12-37)) -> 9.1666666666666643 | Y12: ='G. Taylor'!$M$52 -> 37.555555555555557 | Z12: =IF(ISERROR(RANK(Y12,Y$6:Y$85,1)),"-",RANK(Y12,Y$6:Y$85,1)) -> 1 | AA12: =IF(MIN(B12:V12)=0,"-",MIN(B12:V12)) -> 41 | AB12: =IF(MAX(C12:W12)=0,"-",MAX(C12:W12)) -> 52 | AC12: ='G. Taylor'!$N$53 -> 32
A13: Avg | C13: =IF(ISERROR(AVERAGE(B12:C12)),"-",(AVERAGE(B12:C12))) -> 50 | D13: =IF(ISERROR(AVERAGE(B12:D12)),"-",(AVERAGE(B12:D12))) -> 49 | E13: =IF(ISERROR(AVERAGE(B12:E12)),"-",(AVERAGE(B12:E12))) -> 47.666666666666664 | F13: =IF(ISERROR(AVERAGE(B12:F12)),"-",(AVERAGE(B12:F12))) -> 48 | G13: =IF(ISERROR(AVERAGE(B12:G12)),"-",(AVERAGE(B12:G12))) -> 47.4 | H13: =IF(ISERROR(AVERAGE(B12:H12)),"-",(AVERAGE(B12:H12))) -> 47.333333333333336 | I13: =IF(ISERROR(AVERAGE(B12:I12)),"-",(AVERAGE(B12:I12))) -> 47.285714285714285 | J13: =IF(ISERROR(AVERAGE(B12:J12)),"-",(AVERAGE(B12:J12))) -> 47.875 | K13: =IF(ISERROR(AVERAGE(B12:K12)),"-",(AVERAGE(B12:K12))) -> 48.111111111111114 | M13: =IF(ISERROR(AVERAGE(B12:M12)),"-",(AVERAGE(B12:M12))) -> 47.8 | N13: =IF(ISERROR(AVERAGE(B12:N12)),"-",(AVERAGE(B12:N12))) -> 47.18181818181818 | O13: =IF(ISERROR(AVERAGE(B12:O12)),"-",(AVERAGE(B12:O12))) -> 46.916666666666664 | P13: =IF(ISERROR(AVERAGE(B12:P12)),"-",(AVERAGE(B12:P12))) -> 46.615384615384613 | Q13: =IF(ISERROR(AVERAGE(B12:Q12)),"-",(AVERAGE(B12:Q12))) -> 46.357142857142854 | R13: =IF(ISERROR(AVERAGE(B12:R12)),"-",(AVERAGE(B12:R12))) -> 46.533333333333331 | S13: =IF(ISERROR(AVERAGE(B12:S12)),"-",(AVERAGE(B12:S12))) -> 46.533333333333331 | T13: =IF(ISERROR(AVERAGE(B12:T12)),"-",(AVERAGE(B12:T12))) -> 46.25 | U13: =IF(ISERROR(AVERAGE(B12:U12)),"-",(AVERAGE(B12:U12))) -> 46.235294117647058 | V13: =IF(ISERROR(AVERAGE(B12:V12)),"-",(AVERAGE(B12:V12))) -> 46.166666666666664
A15: ='Mike McComas'!$A$1 -> Mike McComas | B15: ='Mike McComas'!$K$10 -> - | C15: ='Mike McComas'!$K$11 -> - | D15: ='Mike McComas'!$K$12 -> - | E15: ='Mike McComas'!$K$13 -> - | F15: ='Mike McComas'!$K$14 -> - | G15: ='Mike McComas'!$K$21 -> 56 | H15: ='Mike McComas'!$K$22 -> 57 | I15: ='Mike McComas'!$K$23 -> 58 | J15: ='Mike McComas'!$K$24 -> 55 | K15: ='Mike McComas'!$K$25 -> 54 | M15: ='Mike McComas'!$K$34 -> 55 | N15: ='Mike McComas'!$K$35 -> 53 | O15: ='Mike McComas'!$K$36 -> 58 | P15: ='Mike McComas'!$K$37 -> - | Q15: ='Mike McComas'!$K$38 -> 55 | R15: ='Mike McComas'!$K$45 -> - | S15: ='Mike McComas'!$K$46 -> 58 | T15: ='Mike McComas'!$K$47 -> 56 | U15: ='Mike McComas'!$K$48 -> 54 | V15: ='Mike McComas'!$K$49 -> 57 | W15: =IF(ISERROR(AVERAGE(IF(B15:V15<>0,B15:V15,""))),"-",(AVERAGE(IF(B15:V15<>0,B15:V15,"")))) -> 55.846153846153847 | X15: =IF(ISERROR(W15-37),"-",(W15-37)) -> 18.846153846153847 | Y15: ='Mike McComas'!$M$52 -> 39.307692307692307 | Z15: =IF(ISERROR(RANK(Y15,Y$6:Y$85,1)),"-",RANK(Y15,Y$6:Y$85,1)) -> 21 | AA15: =IF(MIN(B15:V15)=0,"-",MIN(B15:V15)) -> 53 | AB15: =IF(MAX(C15:W15)=0,"-",MAX(C15:W15)) -> 58 | AC15: ='Mike McComas'!$N$53 -> 35
A16: Avg | C16: =IF(ISERROR(AVERAGE(B15:C15)),"-",(AVERAGE(B15:C15))) -> - | D16: =IF(ISERROR(AVERAGE(B15:D15)),"-",(AVERAGE(B15:D15))) -> - | E16: =IF(ISERROR(AVERAGE(B15:E15)),"-",(AVERAGE(B15:E15))) -> - | F16: =IF(ISERROR(AVERAGE(B15:F15)),"-",(AVERAGE(B15:F15))) -> - | G16: =IF(ISERROR(AVERAGE(B15:G15)),"-",(AVERAGE(B15:G15))) -> 56 | H16: =IF(ISERROR(AVERAGE(B15:H15)),"-",(AVERAGE(B15:H15))) -> 56.5 | I16: =IF(ISERROR(AVERAGE(B15:I15)),"-",(AVERAGE(B15:I15))) -> 57 | J16: =IF(ISERROR(AVERAGE(B15:J15)),"-",(AVERAGE(B15:J15))) -> 56.5 | K16: =IF(ISERROR(AVERAGE(B15:K15)),"-",(AVERAGE(B15:K15))) -> 56 | M16: =IF(ISERROR(AVERAGE(B15:M15)),"-",(AVERAGE(B15:M15))) -> 55.833333333333336 | N16: =IF(ISERROR(AVERAGE(B15:N15)),"-",(AVERAGE(B15:N15))) -> 55.428571428571431 | O16: =IF(ISERROR(AVERAGE(B15:O15)),"-",(AVERAGE(B15:O15))) -> 55.75 | P16: =IF(ISERROR(AVERAGE(B15:P15)),"-",(AVERAGE(B15:P15))) -> 55.75 | Q16: =IF(ISERROR(AVERAGE(B15:Q15)),"-",(AVERAGE(B15:Q15))) -> 55.666666666666664 | R16: =IF(ISERROR(AVERAGE(B15:R15)),"-",(AVERAGE(B15:R15))) -> 55.666666666666664 | S16: =IF(ISERROR(AVERAGE(B15:S15)),"-",(AVERAGE(B15:S15))) -> 55.9 | T16: =IF(ISERROR(AVERAGE(B15:T15)),"-",(AVERAGE(B15:T15))) -> 55.909090909090907 | U16: =IF(ISERROR(AVERAGE(B15:U15)),"-",(AVERAGE(B15:U15))) -> 55.75 | V16: =IF(ISERROR(AVERAGE(B15:V15)),"-",(AVERAGE(B15:V15))) -> 55.846153846153847
A18: Team 2
A19: Week | B19: 1 | C19: 2 | D19: 3 | E19: 4 | F19: 5 | G19: 6 | H19: 7 | I19: 8 | J19: 9 | K19: 10 | M19: 11 | N19: 12 | O19: 13 | P19: 14 | Q19: 15 | R19: 16 | S19: 17 | T19: 18 | U19: 19 | V19: 20 | W19: Avg. | X19: Par | Y19: Net Avg. | Z19: Overall Rank | AA19: Low Rnd. | AB19: Max Rnd. | AC19: Low Net Rnd.
A20: ='G. White'!$A$1 -> G. White | B20: ='G. White'!$K$10 -> 42 | C20: ='G. White'!$K$11 -> 45 | D20: ='G. White'!$K$12 -> 42 | E20: ='G. White'!$K$13 -> 42 | F20: ='G. White'!$K$14 -> 48 | G20: ='G. White'!$K$21 -> 43 | H20: ='G. White'!$K$22 -> 48 | I20: ='G. White'!$K$23 -> 44 | J20: ='G. White'!$K$24 -> 39 | K20: ='G. White'!$K$25 -> 40 | M20: ='G. White'!$K$34 -> 43 | N20: ='G. White'!$K$35 -> 37 | O20: ='G. White'!$K$36 -> 48 | P20: ='G. White'!$K$37 -> - | Q20: ='G. White'!$K$38 -> 41 | R20: ='G. White'!$K$45 -> 47 | S20: ='G. White'!$K$46 -> 43 | T20: ='G. White'!$K$47 -> 45 | U20: ='G. White'!$K$48 -> 46 | V20: ='G. White'!$K$49 -> - | W20: =IF(ISERROR(AVERAGE(IF(B20:V20<>0,B20:V20,""))),"-",(AVERAGE(IF(B20:V20<>0,B20:V20,"")))) -> 43.50 | X20: =IF(ISERROR(W20-37),"-",(W20-37)) -> 6.50 | Y20: ='G. White'!$M$52 -> 39.722222222222221 | Z20: =IF(ISERROR(RANK(Y20,Y$6:Y$85,1)),"-",RANK(Y20,Y$6:Y$85,1)) -> 23 | AA20: =IF(MIN(B20:V20)=0,"-",MIN(B20:V20)) -> 37 | AB20: =IF(MAX(C20:W20)=0,"-",MAX(C20:W20)) -> 48 | AC20: ='G. White'!$N$53 -> 33
A21: Avg | C21: =IF(ISERROR(AVERAGE(IF(B20:C20<>0,B20:C20,""))),"-",(AVERAGE(IF(B20:C20<>0,B20:C20,"")))) -> 43.5 | D21: =IF(ISERROR(AVERAGE(IF(B20:D20<>0,B20:D20,""))),"-",(AVERAGE(IF(B20:D20<>0,B20:D20,"")))) -> 43 | E21: =IF(ISERROR(AVERAGE(IF(B20:E20<>0,B20:E20,""))),"-",(AVERAGE(IF(B20:E20<>0,B20:E20,"")))) -> 42.75 | F21: =IF(ISERROR(AVERAGE(IF(B20:F20<>0,B20:F20,""))),"-",(AVERAGE(IF(B20:F20<>0,B20:F20,"")))) -> 43.8 | G21: =IF(ISERROR(AVERAGE(IF(B20:G20<>0,B20:G20,""))),"-",(AVERAGE(IF(B20:G20<>0,B20:G20,"")))) -> 43.666666666666664 | H21: =IF(ISERROR(AVERAGE(IF(B20:H20<>0,B20:H20,""))),"-",(AVERAGE(IF(B20:H20<>0,B20:H20,"")))) -> 44.285714285714285 | I21: =IF(ISERROR(AVERAGE(IF(B20:I20<>0,B20:I20,""))),"-",(AVERAGE(IF(B20:I20<>0,B20:I20,"")))) -> 44.25 | J21: =IF(ISERROR(AVERAGE(IF(B20:J20<>0,B20:J20,""))),"-",(AVERAGE(IF(B20:J20<>0,B20:J20,"")))) -> 43.666666666666664 | K21: =IF(ISERROR(AVERAGE(IF(B20:K20<>0,B20:K20,""))),"-",(AVERAGE(IF(B20:K20<>0,B20:K20,"")))) -> 43.3 | M21: =IF(ISERROR(AVERAGE(IF(B20:M20<>0,B20:M20,""))),"-",(AVERAGE(IF(B20:M20<>0,B20:M20,"")))) -> 43.272727272727273 | N21: =IF(ISERROR(AVERAGE(IF(B20:N20<>0,B20:N20,""))),"-",(AVERAGE(IF(B20:N20<>0,B20:N20,"")))) -> 42.75 | O21: =IF(ISERROR(AVERAGE(IF(B20:O20<>0,B20:O20,""))),"-",(AVERAGE(IF(B20:O20<>0,B20:O20,"")))) -> 43.153846153846153 | P21: =IF(ISERROR(AVERAGE(IF(B20:P20<>0,B20:P20,""))),"-",(AVERAGE(IF(B20:P20<>0,B20:P20,"")))) -> 43.153846153846153 | Q21: =IF(ISERROR(AVERAGE(IF(B20:Q20<>0,B20:Q20,""))),"-",(AVERAGE(IF(B20:Q20<>0,B20:Q20,"")))) -> 43 | R21: =IF(ISERROR(AVERAGE(IF(B20:R20<>0,B20:R20,""))),"-",(AVERAGE(IF(B20:R20<>0,B20:R20,"")))) -> 43.266666666666666 | S21: =IF(ISERROR(AVERAGE(IF(B20:S20<>0,B20:S20,""))),"-",(AVERAGE(IF(B20:S20<>0,B20:S20,"")))) -> 43.25 | T21: =IF(ISERROR(AVERAGE(IF(B20:T20<>0,B20:T20,""))),"-",(AVERAGE(IF(B20:T20<>0,B20:T20,"")))) -> 43.352941176470587 | U21: =IF(ISERROR(AVERAGE(IF(B20:U20<>0,B20:U20,""))),"-",(AVERAGE(IF(B20:U20<>0,B20:U20,"")))) -> 43.5 | V21: =IF(ISERROR(AVERAGE(IF(B20:V20<>0,B20:V20,""))),"-",(AVERAGE(IF(B20:V20<>0,B20:V20,"")))) -> 43.5
A23: ='R. Crowder'!$A$1 -> R. Crowder | B23: ='R. Crowder'!$K$10 -> 46 | C23: ='R. Crowder'!$K$11 -> 44 | D23: ='R. Crowder'!$K$12 -> 43 | E23: ='R. Crowder'!$K$13 -> 44 | F23: ='R. Crowder'!$K$14 -> 43 | G23: ='R. Crowder'!$K$21 -> 45 | H23: ='R. Crowder'!$K$22 -> 41 | I23: ='R. Crowder'!$K$23 -> 43 | J23: ='R. Crowder'!$K$24 -> - | K23: ='R. Crowder'!$K$25 -> 39 | M23: ='R. Crowder'!$K$34 -> 40 | N23: ='R. Crowder'!$K$35 -> 41 | O23: ='R. Crowder'!$K$36 -> 44 | P23: ='R. Crowder'!$K$37 -> 44 | Q23: ='R. Crowder'!$K$38 -> 44 | R23: ='R. Crowder'!$K$45 -> 33 | S23: ='R. Crowder'!$K$46 -> 45 | T23: ='R. Crowder'!$K$47 -> 41 | U23: ='R. Crowder'!$K$48 -> 40 | V23: ='R. Crowder'!$K$49 -> 44 | W23: =IF(ISERROR(AVERAGE(IF(B23:V23<>0,B23:V23,""))),"-",(AVERAGE(IF(B23:V23<>0,B23:V23,"")))) -> 42.315789473684212 | X23: =IF(ISERROR(W23-37),"-",(W23-37)) -> 5.3157894736842124 | Y23: ='R. Crowder'!$M$52 -> 37.631578947368418 | Z23: =IF(ISERROR(RANK(Y23,Y$6:Y$85,1)),"-",RANK(Y23,Y$6:Y$85,1)) -> 2 | AA23: =IF(MIN(B23:V23)=0,"-",MIN(B23:V23)) -> 33 | AB23: =IF(MAX(C23:W23)=0,"-",MAX(C23:W23)) -> 45 | AC23: ='R. Crowder'!$N$53 -> 29
A24: Avg | C24: =IF(ISERROR(AVERAGE(IF(B23:C23<>0,B23:C23,""))),"-",(AVERAGE(IF(B23:C23<>0,B23:C23,"")))) -> 45 | D24: =IF(ISERROR(AVERAGE(IF(B23:D23<>0,B23:D23,""))),"-",(AVERAGE(IF(B23:D23<>0,B23:D23,"")))) -> 44.333333333333336 | E24: =IF(ISERROR(AVERAGE(IF(B23:E23<>0,B23:E23,""))),"-",(AVERAGE(IF(B23:E23<>0,B23:E23,"")))) -> 44.25 | F24: =IF(ISERROR(AVERAGE(IF(B23:F23<>0,B23:F23,""))),"-",(AVERAGE(IF(B23:F23<>0,B23:F23,"")))) -> 44 | G24: =IF(ISERROR(AVERAGE(IF(B23:G23<>0,B23:G23,""))),"-",(AVERAGE(IF(B23:G23<>0,B23:G23,"")))) -> 44.166666666666664 | H24: =IF(ISERROR(AVERAGE(IF(B23:H23<>0,B23:H23,""))),"-",(AVERAGE(IF(B23:H23<>0,B23:H23,"")))) -> 43.714285714285715 | I24: =IF(ISERROR(AVERAGE(IF(B23:I23<>0,B23:I23,""))),"-",(AVERAGE(IF(B23:I23<>0,B23:I23,"")))) -> 43.625 | J24: =IF(ISERROR(AVERAGE(IF(B23:J23<>0,B23:J23,""))),"-",(AVERAGE(IF(B23:J23<>0,B23:J23,"")))) -> 43.625 | K24: =IF(ISERROR(AVERAGE(IF(B23:K23<>0,B23:K23,""))),"-",(AVERAGE(IF(B23:K23<>0,B23:K23,"")))) -> 43.111111111111114 | M24: =IF(ISERROR(AVERAGE(IF(B23:M23<>0,B23:M23,""))),"-",(AVERAGE(IF(B23:M23<>0,B23:M23,"")))) -> 42.8 | N24: =IF(ISERROR(AVERAGE(IF(B23:N23<>0,B23:N23,""))),"-",(AVERAGE(IF(B23:N23<>0,B23:N23,"")))) -> 42.636363636363633 | O24: =IF(ISERROR(AVERAGE(IF(B23:O23<>0,B23:O23,""))),"-",(AVERAGE(IF(B23:O23<>0,B23:O23,"")))) -> 42.75 | P24: =IF(ISERROR(AVERAGE(IF(B23:P23<>0,B23:P23,""))),"-",(AVERAGE(IF(B23:P23<>0,B23:P23,"")))) -> 42.846153846153847 | Q24: =IF(ISERROR(AVERAGE(IF(B23:Q23<>0,B23:Q23,""))),"-",(AVERAGE(IF(B23:Q23<>0,B23:Q23,"")))) -> 42.928571428571431 | R24: =IF(ISERROR(AVERAGE(IF(B23:R23<>0,B23:R23,""))),"-",(AVERAGE(IF(B23:R23<>0,B23:R23,"")))) -> 42.266666666666666 | S24: =IF(ISERROR(AVERAGE(IF(B23:S23<>0,B23:S23,""))),"-",(AVERAGE(IF(B23:S23<>0,B23:S23,"")))) -> 42.4375 | T24: =IF(ISERROR(AVERAGE(IF(B23:T23<>0,B23:T23,""))),"-",(AVERAGE(IF(B23:T23<>0,B23:T23,"")))) -> 42.352941176470587 | U24: =IF(ISERROR(AVERAGE(IF(B23:U23<>0,B23:U23,""))),"-",(AVERAGE(IF(B23:U23<>0,B23:U23,"")))) -> 42.222222222222221 | V24: =IF(ISERROR(AVERAGE(IF(B23:V23<>0,B23:V23,""))),"-",(AVERAGE(IF(B23:V23<>0,B23:V23,"")))) -> 42.315789473684212
A26: ='R. Adkins'!$A$1 -> R. Adkins | B26: ='R. Adkins'!$K$10 -> - | C26: ='R. Adkins'!$K$11 -> 49 | D26: ='R. Adkins'!$K$12 -> 52 | E26: ='R. Adkins'!$K$13 -> 53 | F26: ='R. Adkins'!$K$14 -> 51 | G26: ='R. Adkins'!$K$21 -> 51 | H26: ='R. Adkins'!$K$22 -> 55 | I26: ='R. Adkins'!$K$23 -> 52 | J26: ='R. Adkins'!$K$24 -> 49 | K26: ='R. Adkins'!$K$25 -> 52 | M26: ='R. Adkins'!$K$34 -> 51 | N26: ='R. Adkins'!$K$35 -> 49 | O26: ='R. Adkins'!$K$36 -> 50 | P26: ='R. Adkins'!$K$37 -> 50 | Q26: ='R. Adkins'!$K$38 -> 49 | R26: ='R. Adkins'!$K$45 -> 49 | S26: ='R. Adkins'!$K$46 -> 49 | T26: ='R. Adkins'!$K$47 -> 46 | U26: ='R. Adkins'!$K$48 -> 49 | V26: ='R. Adkins'!$K$49 -> 49 | W26: =IF(ISERROR(AVERAGE(IF(B26:V26<>0,B26:V26,""))),"-",(AVERAGE(IF(B26:V26<>0,B26:V26,"")))) -> 50.263157894736842 | X26: =IF(ISERROR(W26-37),"-",(W26-37)) -> 13.263157894736842 | Y26: ='R. Adkins'!$M$52 -> 37.684210526315788 | Z26: =IF(ISERROR(RANK(Y26,Y$6:Y$85,1)),"-",RANK(Y26,Y$6:Y$85,1)) -> 5 | AA26: =IF(MIN(B26:V26)=0,"-",MIN(B26:V26)) -> 46 | AB26: =IF(MAX(C26:W26)=0,"-",MAX(C26:W26)) -> 55 | AC26: ='R. Adkins'!$N$53 -> 33
A27: Avg | C27: =IF(ISERROR(AVERAGE(IF(B26:C26<>0,B26:C26,""))),"-",(AVERAGE(IF(B26:C26<>0,B26:C26,"")))) -> 49 | D27: =IF(ISERROR(AVERAGE(IF(B26:D26<>0,B26:D26,""))),"-",(AVERAGE(IF(B26:D26<>0,B26:D26,"")))) -> 50.5 | E27: =IF(ISERROR(AVERAGE(IF(B26:E26<>0,B26:E26,""))),"-",(AVERAGE(IF(B26:E26<>0,B26:E26,"")))) -> 51.333333333333336 | F27: =IF(ISERROR(AVERAGE(IF(B26:F26<>0,B26:F26,""))),"-",(AVERAGE(IF(B26:F26<>0,B26:F26,"")))) -> 51.25 | G27: =IF(ISERROR(AVERAGE(IF(B26:G26<>0,B26:G26,""))),"-",(AVERAGE(IF(B26:G26<>0,B26:G26,"")))) -> 51.2 | H27: =IF(ISERROR(AVERAGE(IF(B26:H26<>0,B26:H26,""))),"-",(AVERAGE(IF(B26:H26<>0,B26:H26,"")))) -> 51.833333333333336 | I27: =IF(ISERROR(AVERAGE(IF(B26:I26<>0,B26:I26,""))),"-",(AVERAGE(IF(B26:I26<>0,B26:I26,"")))) -> 51.857142857142854 | J27: =IF(ISERROR(AVERAGE(IF(B26:J26<>0,B26:J26,""))),"-",(AVERAGE(IF(B26:J26<>0,B26:J26,"")))) -> 51.5 | K27: =IF(ISERROR(AVERAGE(IF(B26:K26<>0,B26:K26,""))),"-",(AVERAGE(IF(B26:K26<>0,B26:K26,"")))) -> 51.555555555555557 | M27: =IF(ISERROR(AVERAGE(IF(B26:M26<>0,B26:M26,""))),"-",(AVERAGE(IF(B26:M26<>0,B26:M26,"")))) -> 51.5 | N27: =IF(ISERROR(AVERAGE(IF(B26:N26<>0,B26:N26,""))),"-",(AVERAGE(IF(B26:N26<>0,B26:N26,"")))) -> 51.272727272727273 | O27: =IF(ISERROR(AVERAGE(IF(B26:O26<>0,B26:O26,""))),"-",(AVERAGE(IF(B26:O26<>0,B26:O26,"")))) -> 51.166666666666664 | P27: =IF(ISERROR(AVERAGE(IF(B26:P26<>0,B26:P26,""))),"-",(AVERAGE(IF(B26:P26<>0,B26:P26,"")))) -> 51.07692307692308 | Q27: =IF(ISERROR(AVERAGE(IF(B26:Q26<>0,B26:Q26,""))),"-",(AVERAGE(IF(B26:Q26<>0,B26:Q26,"")))) -> 50.928571428571431 | R27: =IF(ISERROR(AVERAGE(IF(B26:R26<>0,B26:R26,""))),"-",(AVERAGE(IF(B26:R26<>0,B26:R26,"")))) -> 50.8 | S27: =IF(ISERROR(AVERAGE(IF(B26:S26<>0,B26:S26,""))),"-",(AVERAGE(IF(B26:S26<>0,B26:S26,"")))) -> 50.6875 | T27: =IF(ISERROR(AVERAGE(IF(B26:T26<>0,B26:T26,""))),"-",(AVERAGE(IF(B26:T26<>0,B26:T26,"")))) -> 50.411764705882355 | U27: =IF(ISERROR(AVERAGE(IF(B26:U26<>0,B26:U26,""))),"-",(AVERAGE(IF(B26:U26<>0,B26:U26,"")))) -> 50.333333333333336 | V27: =IF(ISERROR(AVERAGE(IF(B26:V26<>0,B26:V26,""))),"-",(AVERAGE(IF(B26:V26<>0,B26:V26,"")))) -> 50.263157894736842
A29: ='G. Yablonsky'!$A$1 -> G. Yablonsky | B29: ='G. Yablonsky'!$K$10 -> - | C29: ='G. Yablonsky'!$K$11 -> - | D29: ='G. Yablonsky'!$K$12 -> - | E29: ='G. Yablonsky'!$K$13 -> - | F29: ='G. Yablonsky'!$K$14 -> - | G29: ='G. Yablonsky'!$K$21 -> - | H29: ='G. Yablonsky'!$K$22 -> - | I29: ='G. Yablonsky'!$K$23 -> - | J29: ='G. Yablonsky'!$K$24 -> - | K29: ='G. Yablonsky'!$K$25 -> - | M29: ='G. Yablonsky'!$K$34 -> - | N29: ='G. Yablonsky'!$K$35 -> - | O29: ='G. Yablonsky'!$K$36 -> - | P29: ='G. Yablonsky'!$K$37 -> - | Q29: ='G. Yablonsky'!$K$38 -> - | R29: ='G. Yablonsky'!$K$45 -> - | S29: ='G. Yablonsky'!$K$46 -> - | T29: ='G. Yablonsky'!$K$47 -> 44 | U29: ='G. Yablonsky'!$K$48 -> 44 | V29: ='G. Yablonsky'!$K$49 -> 52 | W29: =IF(ISERROR(AVERAGE(IF(B29:V29<>0,B29:V29,""))),"-",(AVERAGE(IF(B29:V29<>0,B29:V29,"")))) -> 46.666666666666664 | X29: =IF(ISERROR(W29-37),"-",(W29-37)) -> 9.6666666666666643 | Y29: ='G. Yablonsky'!$M$52 -> 38.666666666666664 | Z29: =IF(ISERROR(RANK(Y29,Y$6:Y$85,1)),"-",RANK(Y29,Y$6:Y$85,1)) -> 19 | AA29: =IF(MIN(B29:V29)=0,"-",MIN(B29:V29)) -> 44 | AB29: =IF(MAX(C29:W29)=0,"-",MAX(C29:W29)) -> 52 | AC29: ='G. Yablonsky'!$N$53 -> 36
A30: Avg | C30: =IF(ISERROR(AVERAGE(IF(B29:C29<>0,B29:C29,""))),"-",(AVERAGE(IF(B29:C29<>0,B29:C29,"")))) -> - | D30: =IF(ISERROR(AVERAGE(IF(B29:D29<>0,B29:D29,""))),"-",(AVERAGE(IF(B29:D29<>0,B29:D29,"")))) -> - | E30: =IF(ISERROR(AVERAGE(IF(B29:E29<>0,B29:E29,""))),"-",(AVERAGE(IF(B29:E29<>0,B29:E29,"")))) -> - | F30: =IF(ISERROR(AVERAGE(IF(B29:F29<>0,B29:F29,""))),"-",(AVERAGE(IF(B29:F29<>0,B29:F29,"")))) -> - | G30: =IF(ISERROR(AVERAGE(IF(B29:G29<>0,B29:G29,""))),"-",(AVERAGE(IF(B29:G29<>0,B29:G29,"")))) -> - | H30: =IF(ISERROR(AVERAGE(IF(B29:H29<>0,B29:H29,""))),"-",(AVERAGE(IF(B29:H29<>0,B29:H29,"")))) -> - | I30: =IF(ISERROR(AVERAGE(IF(B29:I29<>0,B29:I29,""))),"-",(AVERAGE(IF(B29:I29<>0,B29:I29,"")))) -> - | J30: =IF(ISERROR(AVERAGE(IF(B29:J29<>0,B29:J29,""))),"-",(AVERAGE(IF(B29:J29<>0,B29:J29,"")))) -> - | K30: =IF(ISERROR(AVERAGE(IF(B29:K29<>0,B29:K29,""))),"-",(AVERAGE(IF(B29:K29<>0,B29:K29,"")))) -> - | M30: =IF(ISERROR(AVERAGE(IF(B29:M29<>0,B29:M29,""))),"-",(AVERAGE(IF(B29:M29<>0,B29:M29,"")))) -> - | N30: =IF(ISERROR(AVERAGE(IF(B29:N29<>0,B29:N29,""))),"-",(AVERAGE(IF(B29:N29<>0,B29:N29,"")))) -> - | O30: =IF(ISERROR(AVERAGE(IF(B29:O29<>0,B29:O29,""))),"-",(AVERAGE(IF(B29:O29<>0,B29:O29,"")))) -> - | P30: =IF(ISERROR(AVERAGE(IF(B29:P29<>0,B29:P29,""))),"-",(AVERAGE(IF(B29:P29<>0,B29:P29,"")))) -> - | Q30: =IF(ISERROR(AVERAGE(IF(B29:Q29<>0,B29:Q29,""))),"-",(AVERAGE(IF(B29:Q29<>0,B29:Q29,"")))) -> - | R30: =IF(ISERROR(AVERAGE(IF(B29:R29<>0,B29:R29,""))),"-",(AVERAGE(IF(B29:R29<>0,B29:R29,"")))) -> - | S30: =IF(ISERROR(AVERAGE(IF(B29:S29<>0,B29:S29,""))),"-",(AVERAGE(IF(B29:S29<>0,B29:S29,"")))) -> - | T30: =IF(ISERROR(AVERAGE(IF(B29:T29<>0,B29:T29,""))),"-",(AVERAGE(IF(B29:T29<>0,B29:T29,"")))) -> 44 | U30: =IF(ISERROR(AVERAGE(IF(B29:U29<>0,B29:U29,""))),"-",(AVERAGE(IF(B29:U29<>0,B29:U29,"")))) -> 44 | V30: =IF(ISERROR(AVERAGE(IF(B29:V29<>0,B29:V29,""))),"-",(AVERAGE(IF(B29:V29<>0,B29:V29,"")))) -> 46.666666666666664
A32: Team 3
A33: Week | B33: 1 | C33: 2 | D33: 3 | E33: 4 | F33: 5 | G33: 6 | H33: 7 | I33: 8 | J33: 9 | K33: 10 | M33: 11 | N33: 12 | O33: 13 | P33: 14 | Q33: 15 | R33: 16 | S33: 17 | T33: 18 | U33: 19 | V33: 20 | W33: Avg. | X33: Par | Y33: Net Avg. | Z33: Overall Rank | AA33: Low Rnd. | AB33: Max Rnd. | AC33: Low Net Rnd.
A34: ='R. Keeney'!$A$1 -> R. Keeney | B34: ='R. Keeney'!$K$10 -> 35 | C34: ='R. Keeney'!$K$11 -> 40 | D34: ='R. Keeney'!$K$12 -> - | E34: ='R. Keeney'!$K$13 -> 41 | F34: ='R. Keeney'!$K$14 -> 41 | G34: ='R. Keeney'!$K$21 -> 38 | H34: ='R. Keeney'!$K$22 -> 47 | I34: ='R. Keeney'!$K$23 -> 41 | J34: ='R. Keeney'!$K$24 -> 36 | K34: ='R. Keeney'!$K$25 -> 38 | M34: ='R. Keeney'!$K$34 -> 40 | N34: ='R. Keeney'!$K$35 -> 41 | O34: ='R. Keeney'!$K$36 -> 38 | P34: ='R. Keeney'!$K$37 -> 42 | Q34: ='R. Keeney'!$K$38 -> - | R34: ='R. Keeney'!$K$45 -> 42 | S34: ='R. Keeney'!$K$46 -> 46 | T34: ='R. Keeney'!$K$47 -> 41 | U34: ='R. Keeney'!$K$48 -> 46 | V34: ='R. Keeney'!$K$49 -> 42 | W34: =IF(ISERROR(AVERAGE(IF(B34:V34<>0,B34:V34,""))),"-",(AVERAGE(IF(B34:V34<>0,B34:V34,"")))) -> 40.833333333333336 | X34: =IF(ISERROR(W34-37),"-",(W34-37)) -> 3.8333333333333357 | Y34: ='R. Keeney'!$M$52 -> 39.611111111111114 | Z34: =IF(ISERROR(RANK(Y34,Y$6:Y$85,1)),"-",RANK(Y34,Y$6:Y$85,1)) -> 22 | AA34: =IF(MIN(B34:V34)=0,"-",MIN(B34:V34)) -> 35 | AB34: =IF(MAX(C34:W34)=0,"-",MAX(C34:W34)) -> 47 | AC34: ='R. Keeney'!$N$53 -> 32
A35: Avg | C35: =IF(ISERROR(AVERAGE(IF(B34:C34<>0,B34:C34,""))),"-",(AVERAGE(IF(B34:C34<>0,B34:C34,"")))) -> 37.5 | D35: =IF(ISERROR(AVERAGE(IF(B34:D34<>0,B34:D34,""))),"-",(AVERAGE(IF(B34:D34<>0,B34:D34,"")))) -> 37.5 | E35: =IF(ISERROR(AVERAGE(IF(B34:E34<>0,B34:E34,""))),"-",(AVERAGE(IF(B34:E34<>0,B34:E34,"")))) -> 38.666666666666664 | F35: =IF(ISERROR(AVERAGE(IF(B34:F34<>0,B34:F34,""))),"-",(AVERAGE(IF(B34:F34<>0,B34:F34,"")))) -> 39.25 | G35: =IF(ISERROR(AVERAGE(IF(B34:G34<>0,B34:G34,""))),"-",(AVERAGE(IF(B34:G34<>0,B34:G34,"")))) -> 39 | H35: =IF(ISERROR(AVERAGE(IF(B34:H34<>0,B34:H34,""))),"-",(AVERAGE(IF(B34:H34<>0,B34:H34,"")))) -> 40.333333333333336 | I35: =IF(ISERROR(AVERAGE(IF(B34:I34<>0,B34:I34,""))),"-",(AVERAGE(IF(B34:I34<>0,B34:I34,"")))) -> 40.428571428571431 | J35: =IF(ISERROR(AVERAGE(IF(B34:J34<>0,B34:J34,""))),"-",(AVERAGE(IF(B34:J34<>0,B34:J34,"")))) -> 39.875 | K35: =IF(ISERROR(AVERAGE(IF(B34:K34<>0,B34:K34,""))),"-",(AVERAGE(IF(B34:K34<>0,B34:K34,"")))) -> 39.666666666666664 | M35: =IF(ISERROR(AVERAGE(IF(B34:M34<>0,B34:M34,""))),"-",(AVERAGE(IF(B34:M34<>0,B34:M34,"")))) -> 39.7 | N35: =IF(ISERROR(AVERAGE(IF(B34:N34<>0,B34:N34,""))),"-",(AVERAGE(IF(B34:N34<>0,B34:N34,"")))) -> 39.81818181818182 | O35: =IF(ISERROR(AVERAGE(IF(B34:O34<>0,B34:O34,""))),"-",(AVERAGE(IF(B34:O34<>0,B34:O34,"")))) -> 39.666666666666664 | P35: =IF(ISERROR(AVERAGE(IF(B34:P34<>0,B34:P34,""))),"-",(AVERAGE(IF(B34:P34<>0,B34:P34,"")))) -> 39.846153846153847 | Q35: =IF(ISERROR(AVERAGE(IF(B34:Q34<>0,B34:Q34,""))),"-",(AVERAGE(IF(B34:Q34<>0,B34:Q34,"")))) -> 39.846153846153847 | R35: =IF(ISERROR(AVERAGE(IF(B34:R34<>0,B34:R34,""))),"-",(AVERAGE(IF(B34:R34<>0,B34:R34,"")))) -> 40 | S35: =IF(ISERROR(AVERAGE(IF(B34:S34<>0,B34:S34,""))),"-",(AVERAGE(IF(B34:S34<>0,B34:S34,"")))) -> 40.4 | T35: =IF(ISERROR(AVERAGE(IF(B34:T34<>0,B34:T34,""))),"-",(AVERAGE(IF(B34:T34<>0,B34:T34,"")))) -> 40.4375 | U35: =IF(ISERROR(AVERAGE(IF(B34:U34<>0,B34:U34,""))),"-",(AVERAGE(IF(B34:U34<>0,B34:U34,"")))) -> 40.764705882352942 | V35: =IF(ISERROR(AVERAGE(IF(B34:V34<>0,B34:V34,""))),"-",(AVERAGE(IF(B34:V34<>0,B34:V34,"")))) -> 40.833333333333336
A37: ='M. Kyle'!$A$1 -> M. Kyle | B37: ='M. Kyle'!$K$10 -> 49 | C37: ='M. Kyle'!$K$11 -> 48 | D37: ='M. Kyle'!$K$12 -> 50 | E37: ='M. Kyle'!$K$13 -> 45 | F37: ='M. Kyle'!$K$14 -> - | G37: ='M. Kyle'!$K$21 -> 48 | H37: ='M. Kyle'!$K$22 -> 48 | I37: ='M. Kyle'!$K$23 -> - | J37: ='M. Kyle'!$K$24 -> 45 | K37: ='M. Kyle'!$K$25 -> 44 | M37: ='M. Kyle'!$K$34 -> 46 | N37: ='M. Kyle'!$K$35 -> 45 | O37: ='M. Kyle'!$K$36 -> 45 | P37: ='M. Kyle'!$K$37 -> - | Q37: ='M. Kyle'!$K$38 -> - | R37: ='M. Kyle'!$K$45 -> 46 | S37: ='M. Kyle'!$K$46 -> 43 | T37: ='M. Kyle'!$K$47 -> 46 | U37: ='M. Kyle'!$K$48 -> - | V37: ='M. Kyle'!$K$49 -> - | W37: =IF(ISERROR(AVERAGE(IF(B37:V37<>0,B37:V37,""))),"-",(AVERAGE(IF(B37:V37<>0,B37:V37,"")))) -> 46.285714285714285 | X37: =IF(ISERROR(W37-37),"-",(W37-37)) -> 9.2857142857142847 | Y37: ='M. Kyle'!$M$52 -> 38.642857142857146 | Z37: =IF(ISERROR(RANK(Y37,Y$6:Y$85,1)),"-",RANK(Y37,Y$6:Y$85,1)) -> 18 | AA37: =IF(MIN(B37:V37)=0,"-",MIN(B37:V37)) -> 43 | AB37: =IF(MAX(C37:W37)=0,"-",MAX(C37:W37)) -> 50 | AC37: ='M. Kyle'!$N$53 -> 34
A38: Avg | C38: =IF(ISERROR(AVERAGE(IF(B37:C37<>0,B37:C37,""))),"-",(AVERAGE(IF(B37:C37<>0,B37:C37,"")))) -> 48.5 | D38: =IF(ISERROR(AVERAGE(IF(B37:D37<>0,B37:D37,""))),"-",(AVERAGE(IF(B37:D37<>0,B37:D37,"")))) -> 49 | E38: =IF(ISERROR(AVERAGE(IF(B37:E37<>0,B37:E37,""))),"-",(AVERAGE(IF(B37:E37<>0,B37:E37,"")))) -> 48 | F38: =IF(ISERROR(AVERAGE(IF(B37:F37<>0,B37:F37,""))),"-",(AVERAGE(IF(B37:F37<>0,B37:F37,"")))) -> 48 | G38: =IF(ISERROR(AVERAGE(IF(B37:G37<>0,B37:G37,""))),"-",(AVERAGE(IF(B37:G37<>0,B37:G37,"")))) -> 48 | H38: =IF(ISERROR(AVERAGE(IF(B37:H37<>0,B37:H37,""))),"-",(AVERAGE(IF(B37:H37<>0,B37:H37,"")))) -> 48 | I38: =IF(ISERROR(AVERAGE(IF(B37:I37<>0,B37:I37,""))),"-",(AVERAGE(IF(B37:I37<>0,B37:I37,"")))) -> 48 | J38: =IF(ISERROR(AVERAGE(IF(B37:J37<>0,B37:J37,""))),"-",(AVERAGE(IF(B37:J37<>0,B37:J37,"")))) -> 47.571428571428569 | K38: =IF(ISERROR(AVERAGE(IF(B37:K37<>0,B37:K37,""))),"-",(AVERAGE(IF(B37:K37<>0,B37:K37,"")))) -> 47.125 | M38: =IF(ISERROR(AVERAGE(IF(B37:M37<>0,B37:M37,""))),"-",(AVERAGE(IF(B37:M37<>0,B37:M37,"")))) -> 47 | N38: =IF(ISERROR(AVERAGE(IF(B37:N37<>0,B37:N37,""))),"-",(AVERAGE(IF(B37:N37<>0,B37:N37,"")))) -> 46.8 | O38: =IF(ISERROR(AVERAGE(IF(B37:O37<>0,B37:O37,""))),"-",(AVERAGE(IF(B37:O37<>0,B37:O37,"")))) -> 46.636363636363633 | P38: =IF(ISERROR(AVERAGE(IF(B37:P37<>0,B37:P37,""))),"-",(AVERAGE(IF(B37:P37<>0,B37:P37,"")))) -> 46.636363636363633 | Q38: =IF(ISERROR(AVERAGE(IF(B37:Q37<>0,B37:Q37,""))),"-",(AVERAGE(IF(B37:Q37<>0,B37:Q37,"")))) -> 46.636363636363633 | R38: =IF(ISERROR(AVERAGE(IF(B37:R37<>0,B37:R37,""))),"-",(AVERAGE(IF(B37:R37<>0,B37:R37,"")))) -> 46.583333333333336 | S38: =IF(ISERROR(AVERAGE(IF(B37:S37<>0,B37:S37,""))),"-",(AVERAGE(IF(B37:S37<>0,B37:S37,"")))) -> 46.307692307692307 | T38: =IF(ISERROR(AVERAGE(IF(B37:T37<>0,B37:T37,""))),"-",(AVERAGE(IF(B37:T37<>0,B37:T37,"")))) -> 46.285714285714285 | U38: =IF(ISERROR(AVERAGE(IF(B37:U37<>0,B37:U37,""))),"-",(AVERAGE(IF(B37:U37<>0,B37:U37,"")))) -> 46.285714285714285 | V38: =IF(ISERROR(AVERAGE(IF(B37:V37<>0,B37:V37,""))),"-",(AVERAGE(IF(B37:V37<>0,B37:V37,"")))) -> 46.285714285714285
A40: ='D. Freeman'!$A$1 -> D. Freeman | B40: ='D. Freeman'!$K$10 -> 45 | C40: ='D. Freeman'!$K$11 -> 46 | D40: ='D. Freeman'!$K$12 -> 45 | E40: ='D. Freeman'!$K$13 -> 47 | F40: ='D. Freeman'!$K$14 -> 44 | G40: ='D. Freeman'!$K$21 -> 48 | H40: ='D. Freeman'!$K$22 -> 47 | I40: ='D. Freeman'!$K$23 -> 48 | J40: ='D. Freeman'!$K$24 -> 47 | K40: ='D. Freeman'!$K$25 -> 41 | M40: ='D. Freeman'!$K$34 -> 44 | N40: ='D. Freeman'!$K$35 -> 47 | O40: ='D. Freeman'!$K$36 -> 46 | P40: ='D. Freeman'!$K$37 -> 43 | Q40: ='D. Freeman'!$K$38 -> 49 | R40: ='D. Freeman'!$K$45 -> 47 | S40: ='D. Freeman'!$K$46 -> 40 | T40: ='D. Freeman'!$K$47 -> 40 | U40: ='D. Freeman'!$K$48 -> 46 | V40: ='D. Freeman'!$K$49 -> 48 | W40: =IF(ISERROR(AVERAGE(IF(B40:V40<>0,B40:V40,""))),"-",(AVERAGE(IF(B40:V40<>0,B40:V40,"")))) -> 45.40 | X40: =IF(ISERROR(W40-37),"-",(W40-37)) -> 8.40 | Y40: ='D. Freeman'!$M$52 -> 37.65 | Z40: =IF(ISERROR(RANK(Y40,Y$6:Y$85,1)),"-",RANK(Y40,Y$6:Y$85,1)) -> 3 | AA40: =IF(MIN(B40:V40)=0,"-",MIN(B40:V40)) -> 40 | AB40: =IF(MAX(C40:W40)=0,"-",MAX(C40:W40)) -> 49 | AC40: ='D. Freeman'!$N$53 -> 33
A41: Avg | C41: =IF(ISERROR(AVERAGE(IF(B40:C40<>0,B40:C40,""))),"-",(AVERAGE(IF(B40:C40<>0,B40:C40,"")))) -> 45.5 | D41: =IF(ISERROR(AVERAGE(IF(B40:D40<>0,B40:D40,""))),"-",(AVERAGE(IF(B40:D40<>0,B40:D40,"")))) -> 45.333333333333336 | E41: =IF(ISERROR(AVERAGE(IF(B40:E40<>0,B40:E40,""))),"-",(AVERAGE(IF(B40:E40<>0,B40:E40,"")))) -> 45.75 | F41: =IF(ISERROR(AVERAGE(IF(B40:F40<>0,B40:F40,""))),"-",(AVERAGE(IF(B40:F40<>0,B40:F40,"")))) -> 45.4 | G41: =IF(ISERROR(AVERAGE(IF(B40:G40<>0,B40:G40,""))),"-",(AVERAGE(IF(B40:G40<>0,B40:G40,"")))) -> 45.833333333333336 | H41: =IF(ISERROR(AVERAGE(IF(B40:H40<>0,B40:H40,""))),"-",(AVERAGE(IF(B40:H40<>0,B40:H40,"")))) -> 46 | I41: =IF(ISERROR(AVERAGE(IF(B40:I40<>0,B40:I40,""))),"-",(AVERAGE(IF(B40:I40<>0,B40:I40,"")))) -> 46.25 | J41: =IF(ISERROR(AVERAGE(IF(B40:J40<>0,B40:J40,""))),"-",(AVERAGE(IF(B40:J40<>0,B40:J40,"")))) -> 46.333333333333336 | K41: =IF(ISERROR(AVERAGE(IF(B40:K40<>0,B40:K40,""))),"-",(AVERAGE(IF(B40:K40<>0,B40:K40,"")))) -> 45.8 | M41: =IF(ISERROR(AVERAGE(IF(B40:M40<>0,B40:M40,""))),"-",(AVERAGE(IF(B40:M40<>0,B40:M40,"")))) -> 45.636363636363633 | N41: =IF(ISERROR(AVERAGE(IF(B40:N40<>0,B40:N40,""))),"-",(AVERAGE(IF(B40:N40<>0,B40:N40,"")))) -> 45.75 | O41: =IF(ISERROR(AVERAGE(IF(B40:O40<>0,B40:O40,""))),"-",(AVERAGE(IF(B40:O40<>0,B40:O40,"")))) -> 45.769230769230766 | P41: =IF(ISERROR(AVERAGE(IF(B40:P40<>0,B40:P40,""))),"-",(AVERAGE(IF(B40:P40<>0,B40:P40,"")))) -> 45.571428571428569 | Q41: =IF(ISERROR(AVERAGE(IF(B40:Q40<>0,B40:Q40,""))),"-",(AVERAGE(IF(B40:Q40<>0,B40:Q40,"")))) -> 45.8 | R41: =IF(ISERROR(AVERAGE(IF(B40:R40<>0,B40:R40,""))),"-",(AVERAGE(IF(B40:R40<>0,B40:R40,"")))) -> 45.875 | S41: =IF(ISERROR(AVERAGE(IF(B40:S40<>0,B40:S40,""))),"-",(AVERAGE(IF(B40:S40<>0,B40:S40,"")))) -> 45.529411764705884 | T41: =IF(ISERROR(AVERAGE(IF(B40:T40<>0,B40:T40,""))),"-",(AVERAGE(IF(B40:T40<>0,B40:T40,"")))) -> 45.222222222222221 | U41: =IF(ISERROR(AVERAGE(IF(B40:U40<>0,B40:U40,""))),"-",(AVERAGE(IF(B40:U40<>0,B40:U40,"")))) -> 45.263157894736842 | V41: =IF(ISERROR(AVERAGE(IF(B40:V40<>0,B40:V40,""))),"-",(AVERAGE(IF(B40:V40<>0,B40:V40,"")))) -> 45.4
A43: ='J. Landers'!$A$1 -> J. Landers | B43: ='J. Landers'!$K$10 -> 50 | C43: ='J. Landers'!$K$11 -> 53 | D43: ='J. Landers'!$K$12 -> 47 | E43: ='J. Landers'!$K$13 -> - | F43: ='J. Landers'!$K$14 -> 51 | G43: ='J. Landers'!$K$21 -> 57 | H43: ='J. Landers'!$K$22 -> - | I43: ='J. Landers'!$K$23 -> 58 | J43: ='J. Landers'!$K$24 -> 52 | K43: ='J. Landers'!$K$25 -> 50 | M43: ='J. Landers'!$K$34 -> 50 | N43: ='J. Landers'!$K$35 -> 45 | O43: ='J. Landers'!$K$36 -> 52 | P43: ='J. Landers'!$K$37 -> 54 | Q43: ='J. Landers'!$K$38 -> 49 | R43: ='J. Landers'!$K$45 -> - | S43: ='J. Landers'!$K$46 -> 46 | T43: ='J. Landers'!$K$47 -> 58 | U43: ='J. Landers'!$K$48 -> 48 | V43: ='J. Landers'!$K$49 -> 52 | W43: =IF(ISERROR(AVERAGE(IF(B43:V43<>0,B43:V43,""))),"-",(AVERAGE(IF(B43:V43<>0,B43:V43,"")))) -> 51.294117647058826 | X43: =IF(ISERROR(W43-37),"-",(W43-37)) -> 14.294117647058826 | Y43: ='J. Landers'!$M$52 -> 38.764705882352942 | Z43: =IF(ISERROR(RANK(Y43,Y$6:Y$85,1)),"-",RANK(Y43,Y$6:Y$85,1)) -> 20 | AA43: =IF(MIN(B43:V43)=0,"-",MIN(B43:V43)) -> 45 | AB43: =IF(MAX(C43:W43)=0,"-",MAX(C43:W43)) -> 58 | AC43: ='J. Landers'!$N$53 -> 32
A44: Avg | C44: =IF(ISERROR(AVERAGE(IF(B43:C43<>0,B43:C43,""))),"-",(AVERAGE(IF(B43:C43<>0,B43:C43,"")))) -> 51.5 | D44: =IF(ISERROR(AVERAGE(IF(B43:D43<>0,B43:D43,""))),"-",(AVERAGE(IF(B43:D43<>0,B43:D43,"")))) -> 50 | E44: =IF(ISERROR(AVERAGE(IF(B43:E43<>0,B43:E43,""))),"-",(AVERAGE(IF(B43:E43<>0,B43:E43,"")))) -> 50 | F44: =IF(ISERROR(AVERAGE(IF(B43:F43<>0,B43:F43,""))),"-",(AVERAGE(IF(B43:F43<>0,B43:F43,"")))) -> 50.25 | G44: =IF(ISERROR(AVERAGE(IF(B43:G43<>0,B43:G43,""))),"-",(AVERAGE(IF(B43:G43<>0,B43:G43,"")))) -> 51.6 | H44: =IF(ISERROR(AVERAGE(IF(B43:H43<>0,B43:H43,""))),"-",(AVERAGE(IF(B43:H43<>0,B43:H43,"")))) -> 51.6 | I44: =IF(ISERROR(AVERAGE(IF(B43:I43<>0,B43:I43,""))),"-",(AVERAGE(IF(B43:I43<>0,B43:I43,"")))) -> 52.666666666666664 | J44: =IF(ISERROR(AVERAGE(IF(B43:J43<>0,B43:J43,""))),"-",(AVERAGE(IF(B43:J43<>0,B43:J43,"")))) -> 52.571428571428569 | K44: =IF(ISERROR(AVERAGE(IF(B43:K43<>0,B43:K43,""))),"-",(AVERAGE(IF(B43:K43<>0,B43:K43,"")))) -> 52.25 | M44: =IF(ISERROR(AVERAGE(IF(B43:M43<>0,B43:M43,""))),"-",(AVERAGE(IF(B43:M43<>0,B43:M43,"")))) -> 52 | N44: =IF(ISERROR(AVERAGE(IF(B43:N43<>0,B43:N43,""))),"-",(AVERAGE(IF(B43:N43<>0,B43:N43,"")))) -> 51.3 | O44: =IF(ISERROR(AVERAGE(IF(B43:O43<>0,B43:O43,""))),"-",(AVERAGE(IF(B43:O43<>0,B43:O43,"")))) -> 51.363636363636367 | P44: =IF(ISERROR(AVERAGE(IF(B43:P43<>0,B43:P43,""))),"-",(AVERAGE(IF(B43:P43<>0,B43:P43,"")))) -> 51.583333333333336 | Q44: =IF(ISERROR(AVERAGE(IF(B43:Q43<>0,B43:Q43,""))),"-",(AVERAGE(IF(B43:Q43<>0,B43:Q43,"")))) -> 51.384615384615387 | R44: =IF(ISERROR(AVERAGE(IF(B43:R43<>0,B43:R43,""))),"-",(AVERAGE(IF(B43:R43<>0,B43:R43,"")))) -> 51.384615384615387 | S44: =IF(ISERROR(AVERAGE(IF(B43:S43<>0,B43:S43,""))),"-",(AVERAGE(IF(B43:S43<>0,B43:S43,"")))) -> 51 | T44: =IF(ISERROR(AVERAGE(IF(B43:T43<>0,B43:T43,""))),"-",(AVERAGE(IF(B43:T43<>0,B43:T43,"")))) -> 51.466666666666669 | U44: =IF(ISERROR(AVERAGE(IF(B43:U43<>0,B43:U43,""))),"-",(AVERAGE(IF(B43:U43<>0,B43:U43,"")))) -> 51.25 | V44: =IF(ISERROR(AVERAGE(IF(B43:V43<>0,B43:V43,""))),"-",(AVERAGE(IF(B43:V43<>0,B43:V43,"")))) -> 51.294117647058826
A46: Team 4
A47: Week | B47: 1 | C47: 2 | D47: 3 | E47: 4 | F47: 5 | G47: 6 | H47: 7 | I47: 8 | J47: 9 | K47: 10 | M47: 11 | N47: 12 | O47: 13 | P47: 14 | Q47: 15 | R47: 16 | S47: 17 | T47: 18 | U47: 19 | V47: 20 | W47: Avg. | X47: Par | Y47: Net Avg. | Z47: Overall Rank | AA47: Low Rnd. | AB47: Max Rnd. | AC47: Low Net Rnd.
A48: ='V. Bunn'!$A$1 -> V. Bunn | B48: ='V. Bunn'!$K$10 -> 40 | C48: ='V. Bunn'!$K$11 -> 40 | D48: ='V. Bunn'!$K$12 -> 41 | E48: ='V. Bunn'!$K$13 -> 41 | F48: ='V. Bunn'!$K$14 -> 42 | G48: ='V. Bunn'!$K$21 -> 37 | H48: ='V. Bunn'!$K$22 -> 43 | I48: ='V. Bunn'!$K$23 -> 45 | J48: ='V. Bunn'!$K$24 -> - | K48: ='V. Bunn'!$K$25 -> 39 | M48: ='V. Bunn'!$K$34 -> 41 | N48: ='V. Bunn'!$K$35 -> 38 | O48: ='V. Bunn'!$K$36 -> 41 | P48: ='V. Bunn'!$K$37 -> 36 | Q48: ='V. Bunn'!$K$38 -> 40 | R48: ='V. Bunn'!$K$45 -> 40 | S48: ='V. Bunn'!$K$46 -> 42 | T48: ='V. Bunn'!$K$47 -> 41 | U48: ='V. Bunn'!$K$48 -> 44 | V48: ='V. Bunn'!$K$49 -> 40 | W48: =IF(ISERROR(AVERAGE(IF(B48:V48<>0,B48:V48,""))),"-",(AVERAGE(IF(B48:V48<>0,B48:V48,"")))) -> 40.578947368421055 | X48: =IF(ISERROR(W48-37),"-",(W48-37)) -> 3.5789473684210549 | Y48: ='V. Bunn'!$M$52 -> 38.10526315789474 | Z48: =IF(ISERROR(RANK(Y48,Y$6:Y$85,1)),"-",RANK(Y48,Y$6:Y$85,1)) -> 9 | AA48: =IF(MIN(B48:V48)=0,"-",MIN(B48:V48)) -> 36 | AB48: =IF(MAX(C48:W48)=0,"-",MAX(C48:W48)) -> 45 | AC48: ='V. Bunn'!$N$53 -> 34
A49: Avg | C49: =IF(ISERROR(AVERAGE(IF(B48:C48<>0,B48:C48,""))),"-",(AVERAGE(IF(B48:C48<>0,B48:C48,"")))) -> 40 | D49: =IF(ISERROR(AVERAGE(IF(B48:D48<>0,B48:D48,""))),"-",(AVERAGE(IF(B48:D48<>0,B48:D48,"")))) -> 40.333333333333336 | E49: =IF(ISERROR(AVERAGE(IF(B48:E48<>0,B48:E48,""))),"-",(AVERAGE(IF(B48:E48<>0,B48:E48,"")))) -> 40.5 | F49: =IF(ISERROR(AVERAGE(IF(B48:F48<>0,B48:F48,""))),"-",(AVERAGE(IF(B48:F48<>0,B48:F48,"")))) -> 40.8 | G49: =IF(ISERROR(AVERAGE(IF(B48:G48<>0,B48:G48,""))),"-",(AVERAGE(IF(B48:G48<>0,B48:G48,"")))) -> 40.166666666666664 | H49: =IF(ISERROR(AVERAGE(IF(B48:H48<>0,B48:H48,""))),"-",(AVERAGE(IF(B48:H48<>0,B48:H48,"")))) -> 40.571428571428569 | I49: =IF(ISERROR(AVERAGE(IF(B48:I48<>0,B48:I48,""))),"-",(AVERAGE(IF(B48:I48<>0,B48:I48,"")))) -> 41.125 | J49: =IF(ISERROR(AVERAGE(IF(B48:J48<>0,B48:J48,""))),"-",(AVERAGE(IF(B48:J48<>0,B48:J48,"")))) -> 41.125 | K49: =IF(ISERROR(AVERAGE(IF(B48:K48<>0,B48:K48,""))),"-",(AVERAGE(IF(B48:K48<>0,B48:K48,"")))) -> 40.888888888888886 | M49: =IF(ISERROR(AVERAGE(IF(B48:M48<>0,B48:M48,""))),"-",(AVERAGE(IF(B48:M48<>0,B48:M48,"")))) -> 40.9 | N49: =IF(ISERROR(AVERAGE(IF(B48:N48<>0,B48:N48,""))),"-",(AVERAGE(IF(B48:N48<>0,B48:N48,"")))) -> 40.636363636363633 | O49: =IF(ISERROR(AVERAGE(IF(B48:O48<>0,B48:O48,""))),"-",(AVERAGE(IF(B48:O48<>0,B48:O48,"")))) -> 40.666666666666664 | P49: =IF(ISERROR(AVERAGE(IF(B48:P48<>0,B48:P48,""))),"-",(AVERAGE(IF(B48:P48<>0,B48:P48,"")))) -> 40.307692307692307 | Q49: =IF(ISERROR(AVERAGE(IF(B48:Q48<>0,B48:Q48,""))),"-",(AVERAGE(IF(B48:Q48<>0,B48:Q48,"")))) -> 40.285714285714285 | R49: =IF(ISERROR(AVERAGE(IF(B48:R48<>0,B48:R48,""))),"-",(AVERAGE(IF(B48:R48<>0,B48:R48,"")))) -> 40.266666666666666 | S49: =IF(ISERROR(AVERAGE(IF(B48:S48<>0,B48:S48,""))),"-",(AVERAGE(IF(B48:S48<>0,B48:S48,"")))) -> 40.375 | T49: =IF(ISERROR(AVERAGE(IF(B48:T48<>0,B48:T48,""))),"-",(AVERAGE(IF(B48:T48<>0,B48:T48,"")))) -> 40.411764705882355 | U49: =IF(ISERROR(AVERAGE(IF(B48:U48<>0,B48:U48,""))),"-",(AVERAGE(IF(B48:U48<>0,B48:U48,"")))) -> 40.611111111111114 | V49: =IF(ISERROR(AVERAGE(IF(B48:V48<>0,B48:V48,""))),"-",(AVERAGE(IF(B48:V48<>0,B48:V48,"")))) -> 40.578947368421055
A51: ='M. Rutherford'!$A$1 -> M. Rutherford | B51: ='M. Rutherford'!$K$10 -> 43 | C51: ='M. Rutherford'!$K$11 -> 44 | D51: ='M. Rutherford'!$K$12 -> 44 | E51: ='M. Rutherford'!$K$13 -> 42 | F51: ='M. Rutherford'!$K$14 -> 48 | G51: ='M. Rutherford'!$K$21 -> 44 | H51: ='M. Rutherford'!$K$22 -> - | I51: ='M. Rutherford'!$K$23 -> 40 | J51: ='M. Rutherford'!$K$24 -> 39 | K51: ='M. Rutherford'!$K$25 -> 39 | M51: ='M. Rutherford'!$K$34 -> 42 | N51: ='M. Rutherford'!$K$35 -> 38 | O51: ='M. Rutherford'!$K$36 -> 44 | P51: ='M. Rutherford'!$K$37 -> 41 | Q51: ='M. Rutherford'!$K$38 -> 42 | R51: ='M. Rutherford'!$K$45 -> 43 | S51: ='M. Rutherford'!$K$46 -> 47 | T51: ='M. Rutherford'!$K$47 -> 44 | U51: ='M. Rutherford'!$K$48 -> 39 | V51: ='M. Rutherford'!$K$49 -> 41 | W51: =IF(ISERROR(AVERAGE(IF(B51:V51<>0,B51:V51,""))),"-",(AVERAGE(IF(B51:V51<>0,B51:V51,"")))) -> 42.315789473684212 | X51: =IF(ISERROR(W51-37),"-",(W51-37)) -> 5.3157894736842124 | Y51: ='M. Rutherford'!$M$52 -> 38.157894736842103 | Z51: =IF(ISERROR(RANK(Y51,Y$6:Y$85,1)),"-",RANK(Y51,Y$6:Y$85,1)) -> 10 | AA51: =IF(MIN(B51:V51)=0,"-",MIN(B51:V51)) -> 38 | AB51: =IF(MAX(C51:W51)=0,"-",MAX(C51:W51)) -> 48 | AC51: ='M. Rutherford'!$N$53 -> 33
A52: Avg | C52: =IF(ISERROR(AVERAGE(IF(B51:C51<>0,B51:C51,""))),"-",(AVERAGE(IF(B51:C51<>0,B51:C51,"")))) -> 43.5 | D52: =IF(ISERROR(AVERAGE(IF(B51:D51<>0,B51:D51,""))),"-",(AVERAGE(IF(B51:D51<>0,B51:D51,"")))) -> 43.666666666666664 | E52: =IF(ISERROR(AVERAGE(IF(B51:E51<>0,B51:E51,""))),"-",(AVERAGE(IF(B51:E51<>0,B51:E51,"")))) -> 43.25 | F52: =IF(ISERROR(AVERAGE(IF(B51:F51<>0,B51:F51,""))),"-",(AVERAGE(IF(B51:F51<>0,B51:F51,"")))) -> 44.2 | G52: =IF(ISERROR(AVERAGE(IF(B51:G51<>0,B51:G51,""))),"-",(AVERAGE(IF(B51:G51<>0,B51:G51,"")))) -> 44.166666666666664 | H52: =IF(ISERROR(AVERAGE(IF(B51:H51<>0,B51:H51,""))),"-",(AVERAGE(IF(B51:H51<>0,B51:H51,"")))) -> 44.166666666666664 | I52: =IF(ISERROR(AVERAGE(IF(B51:I51<>0,B51:I51,""))),"-",(AVERAGE(IF(B51:I51<>0,B51:I51,"")))) -> 43.571428571428569 | J52: =IF(ISERROR(AVERAGE(IF(B51:J51<>0,B51:J51,""))),"-",(AVERAGE(IF(B51:J51<>0,B51:J51,"")))) -> 43 | K52: =IF(ISERROR(AVERAGE(IF(B51:K51<>0,B51:K51,""))),"-",(AVERAGE(IF(B51:K51<>0,B51:K51,"")))) -> 42.555555555555557 | M52: =IF(ISERROR(AVERAGE(IF(B51:M51<>0,B51:M51,""))),"-",(AVERAGE(IF(B51:M51<>0,B51:M51,"")))) -> 42.5 | N52: =IF(ISERROR(AVERAGE(IF(B51:N51<>0,B51:N51,""))),"-",(AVERAGE(IF(B51:N51<>0,B51:N51,"")))) -> 42.090909090909093 | O52: =IF(ISERROR(AVERAGE(IF(B51:O51<>0,B51:O51,""))),"-",(AVERAGE(IF(B51:O51<>0,B51:O51,"")))) -> 42.25 | P52: =IF(ISERROR(AVERAGE(IF(B51:P51<>0,B51:P51,""))),"-",(AVERAGE(IF(B51:P51<>0,B51:P51,"")))) -> 42.153846153846153 | Q52: =IF(ISERROR(AVERAGE(IF(B51:Q51<>0,B51:Q51,""))),"-",(AVERAGE(IF(B51:Q51<>0,B51:Q51,"")))) -> 42.142857142857146 | R52: =IF(ISERROR(AVERAGE(IF(B51:R51<>0,B51:R51,""))),"-",(AVERAGE(IF(B51:R51<>0,B51:R51,"")))) -> 42.2 | S52: =IF(ISERROR(AVERAGE(IF(B51:S51<>0,B51:S51,""))),"-",(AVERAGE(IF(B51:S51<>0,B51:S51,"")))) -> 42.5 | T52: =IF(ISERROR(AVERAGE(IF(B51:T51<>0,B51:T51,""))),"-",(AVERAGE(IF(B51:T51<>0,B51:T51,"")))) -> 42.588235294117645 | U52: =IF(ISERROR(AVERAGE(IF(B51:U51<>0,B51:U51,""))),"-",(AVERAGE(IF(B51:U51<>0,B51:U51,"")))) -> 42.388888888888886 | V52: =IF(ISERROR(AVERAGE(IF(B51:V51<>0,B51:V51,""))),"-",(AVERAGE(IF(B51:V51<>0,B51:V51,"")))) -> 42.315789473684212
A54: ='B. Hall'!$A$1 -> B. Hall | B54: ='B. Hall'!$K$10 -> 48 | C54: ='B. Hall'!$K$11 -> 52 | D54: ='B. Hall'!$K$12 -> 51 | E54: ='B. Hall'!$K$13 -> 51 | F54: ='B. Hall'!$K$14 -> 52 | G54: ='B. Hall'!$K$21 -> - | H54: ='B. Hall'!$K$22 -> 50 | I54: ='B. Hall'!$K$23 -> 46 | J54: ='B. Hall'!$K$24 -> 45 | K54: ='B. Hall'!$K$25 -> 49 | M54: ='B. Hall'!$K$34 -> 48 | N54: ='B. Hall'!$K$35 -> 48 | O54: ='B. Hall'!$K$36 -> 50 | P54: ='B. Hall'!$K$37 -> 50 | Q54: ='B. Hall'!$K$38 -> 45 | R54: ='B. Hall'!$K$45 -> 50 | S54: ='B. Hall'!$K$46 -> 49 | T54: ='B. Hall'!$K$47 -> 44 | U54: ='B. Hall'!$K$48 -> 44 | V54: ='B. Hall'!$K$49 -> 48 | W54: =IF(ISERROR(AVERAGE(IF(B54:V54<>0,B54:V54,""))),"-",(AVERAGE(IF(B54:V54<>0,B54:V54,"")))) -> 48.421052631578945 | X54: =IF(ISERROR(W54-37),"-",(W54-37)) -> 11.421052631578945 | Y54: ='B. Hall'!$M$52 -> 38.05263157894737 | Z54: =IF(ISERROR(RANK(Y54,Y$6:Y$85,1)),"-",RANK(Y54,Y$6:Y$85,1)) -> 8 | AA54: =IF(MIN(B54:V54)=0,"-",MIN(B54:V54)) -> 44 | AB54: =IF(MAX(C54:W54)=0,"-",MAX(C54:W54)) -> 52 | AC54: ='B. Hall'!$N$53 -> 32
A55: Avg | C55: =IF(ISERROR(AVERAGE(IF(B54:C54<>0,B54:C54,""))),"-",(AVERAGE(IF(B54:C54<>0,B54:C54,"")))) -> 50 | D55: =IF(ISERROR(AVERAGE(IF(B54:D54<>0,B54:D54,""))),"-",(AVERAGE(IF(B54:D54<>0,B54:D54,"")))) -> 50.333333333333336 | E55: =IF(ISERROR(AVERAGE(IF(B54:E54<>0,B54:E54,""))),"-",(AVERAGE(IF(B54:E54<>0,B54:E54,"")))) -> 50.5 | F55: =IF(ISERROR(AVERAGE(IF(B54:F54<>0,B54:F54,""))),"-",(AVERAGE(IF(B54:F54<>0,B54:F54,"")))) -> 50.8 | G55: =IF(ISERROR(AVERAGE(IF(B54:G54<>0,B54:G54,""))),"-",(AVERAGE(IF(B54:G54<>0,B54:G54,"")))) -> 50.8 | H55: =IF(ISERROR(AVERAGE(IF(B54:H54<>0,B54:H54,""))),"-",(AVERAGE(IF(B54:H54<>0,B54:H54,"")))) -> 50.666666666666664 | I55: =IF(ISERROR(AVERAGE(IF(B54:I54<>0,B54:I54,""))),"-",(AVERAGE(IF(B54:I54<>0,B54:I54,"")))) -> 50 | J55: =IF(ISERROR(AVERAGE(IF(B54:J54<>0,B54:J54,""))),"-",(AVERAGE(IF(B54:J54<>0,B54:J54,"")))) -> 49.375 | K55: =IF(ISERROR(AVERAGE(IF(B54:K54<>0,B54:K54,""))),"-",(AVERAGE(IF(B54:K54<>0,B54:K54,"")))) -> 49.333333333333336 | M55: =IF(ISERROR(AVERAGE(IF(B54:M54<>0,B54:M54,""))),"-",(AVERAGE(IF(B54:M54<>0,B54:M54,"")))) -> 49.2 | N55: =IF(ISERROR(AVERAGE(IF(B54:N54<>0,B54:N54,""))),"-",(AVERAGE(IF(B54:N54<>0,B54:N54,"")))) -> 49.090909090909093 | O55: =IF(ISERROR(AVERAGE(IF(B54:O54<>0,B54:O54,""))),"-",(AVERAGE(IF(B54:O54<>0,B54:O54,"")))) -> 49.166666666666664 | P55: =IF(ISERROR(AVERAGE(IF(B54:P54<>0,B54:P54,""))),"-",(AVERAGE(IF(B54:P54<>0,B54:P54,"")))) -> 49.230769230769234 | Q55: =IF(ISERROR(AVERAGE(IF(B54:Q54<>0,B54:Q54,""))),"-",(AVERAGE(IF(B54:Q54<>0,B54:Q54,"")))) -> 48.928571428571431 | R55: =IF(ISERROR(AVERAGE(IF(B54:R54<>0,B54:R54,""))),"-",(AVERAGE(IF(B54:R54<>0,B54:R54,"")))) -> 49 | S55: =IF(ISERROR(AVERAGE(IF(B54:S54<>0,B54:S54,""))),"-",(AVERAGE(IF(B54:S54<>0,B54:S54,"")))) -> 49 | T55: =IF(ISERROR(AVERAGE(IF(B54:T54<>0,B54:T54,""))),"-",(AVERAGE(IF(B54:T54<>0,B54:T54,"")))) -> 48.705882352941174 | U55: =IF(ISERROR(AVERAGE(IF(B54:U54<>0,B54:U54,""))),"-",(AVERAGE(IF(B54:U54<>0,B54:U54,"")))) -> 48.444444444444443 | V55: =IF(ISERROR(AVERAGE(IF(B54:V54<>0,B54:V54,""))),"-",(AVERAGE(IF(B54:V54<>0,B54:V54,"")))) -> 48.421052631578945
A57: ='B. Meadows'!$A$1 -> B. Meadows | B57: ='B. Meadows'!$K$10 -> 57 | C57: ='B. Meadows'!$K$11 -> 58 | D57: ='B. Meadows'!$K$12 -> 57 | E57: ='B. Meadows'!$K$13 -> 52 | F57: ='B. Meadows'!$K$14 -> 56 | G57: ='B. Meadows'!$K$21 -> 61 | H57: ='B. Meadows'!$K$22 -> 51 | I57: ='B. Meadows'!$K$23 -> 57 | J57: ='B. Meadows'!$K$24 -> - | K57: ='B. Meadows'!$K$25 -> 52 | M57: ='B. Meadows'!$K$34 -> 52 | N57: ='B. Meadows'!$K$35 -> - | O57: ='B. Meadows'!$K$36 -> 52 | P57: ='B. Meadows'!$K$37 -> 49 | Q57: ='B. Meadows'!$K$38 -> 58 | R57: ='B. Meadows'!$K$45 -> 54 | S57: ='B. Meadows'!$K$46 -> 55 | T57: ='B. Meadows'!$K$47 -> 56 | U57: ='B. Meadows'!$K$48 -> 46 | V57: ='B. Meadows'!$K$49 -> 55 | W57: =IF(ISERROR(AVERAGE(IF(B57:V57<>0,B57:V57,""))),"-",(AVERAGE(IF(B57:V57<>0,B57:V57,"")))) -> 54.333333333333336 | X57: =IF(ISERROR(W57-37),"-",(W57-37)) -> 17.333333333333336 | Y57: ='B. Meadows'!$M$52 -> 38.50 | Z57: =IF(ISERROR(RANK(Y57,Y$6:Y$85,1)),"-",RANK(Y57,Y$6:Y$85,1)) -> 15 | AA57: =IF(MIN(B57:V57)=0,"-",MIN(B57:V57)) -> 46 | AB57: =IF(MAX(C57:W57)=0,"-",MAX(C57:W57)) -> 61 | AC57: ='B. Meadows'!$N$53 -> 31
A58: Avg | C58: =IF(ISERROR(AVERAGE(IF(B57:C57<>0,B57:C57,""))),"-",(AVERAGE(IF(B57:C57<>0,B57:C57,"")))) -> 57.5 | D58: =IF(ISERROR(AVERAGE(IF(B57:D57<>0,B57:D57,""))),"-",(AVERAGE(IF(B57:D57<>0,B57:D57,"")))) -> 57.333333333333336 | E58: =IF(ISERROR(AVERAGE(IF(B57:E57<>0,B57:E57,""))),"-",(AVERAGE(IF(B57:E57<>0,B57:E57,"")))) -> 56 | F58: =IF(ISERROR(AVERAGE(IF(B57:F57<>0,B57:F57,""))),"-",(AVERAGE(IF(B57:F57<>0,B57:F57,"")))) -> 56 | G58: =IF(ISERROR(AVERAGE(IF(B57:G57<>0,B57:G57,""))),"-",(AVERAGE(IF(B57:G57<>0,B57:G57,"")))) -> 56.833333333333336 | H58: =IF(ISERROR(AVERAGE(IF(B57:H57<>0,B57:H57,""))),"-",(AVERAGE(IF(B57:H57<>0,B57:H57,"")))) -> 56 | I58: =IF(ISERROR(AVERAGE(IF(B57:I57<>0,B57:I57,""))),"-",(AVERAGE(IF(B57:I57<>0,B57:I57,"")))) -> 56.125 | J58: =IF(ISERROR(AVERAGE(IF(B57:J57<>0,B57:J57,""))),"-",(AVERAGE(IF(B57:J57<>0,B57:J57,"")))) -> 56.125 | K58: =IF(ISERROR(AVERAGE(IF(B57:K57<>0,B57:K57,""))),"-",(AVERAGE(IF(B57:K57<>0,B57:K57,"")))) -> 55.666666666666664 | M58: =IF(ISERROR(AVERAGE(IF(B57:M57<>0,B57:M57,""))),"-",(AVERAGE(IF(B57:M57<>0,B57:M57,"")))) -> 55.3 | N58: =IF(ISERROR(AVERAGE(IF(B57:N57<>0,B57:N57,""))),"-",(AVERAGE(IF(B57:N57<>0,B57:N57,"")))) -> 55.3 | O58: =IF(ISERROR(AVERAGE(IF(B57:O57<>0,B57:O57,""))),"-",(AVERAGE(IF(B57:O57<>0,B57:O57,"")))) -> 55 | P58: =IF(ISERROR(AVERAGE(IF(B57:P57<>0,B57:P57,""))),"-",(AVERAGE(IF(B57:P57<>0,B57:P57,"")))) -> 54.5 | Q58: =IF(ISERROR(AVERAGE(IF(B57:Q57<>0,B57:Q57,""))),"-",(AVERAGE(IF(B57:Q57<>0,B57:Q57,"")))) -> 54.769230769230766 | R58: =IF(ISERROR(AVERAGE(IF(B57:R57<>0,B57:R57,""))),"-",(AVERAGE(IF(B57:R57<>0,B57:R57,"")))) -> 54.714285714285715 | S58: =IF(ISERROR(AVERAGE(IF(B57:S57<>0,B57:S57,""))),"-",(AVERAGE(IF(B57:S57<>0,B57:S57,"")))) -> 54.733333333333334 | T58: =IF(ISERROR(AVERAGE(IF(B57:T57<>0,B57:T57,""))),"-",(AVERAGE(IF(B57:T57<>0,B57:T57,"")))) -> 54.8125 | U58: =IF(ISERROR(AVERAGE(IF(B57:U57<>0,B57:U57,""))),"-",(AVERAGE(IF(B57:U57<>0,B57:U57,"")))) -> 54.294117647058826 | V58: =IF(ISERROR(AVERAGE(IF(B57:V57<>0,B57:V57,""))),"-",(AVERAGE(IF(B57:V57<>0,B57:V57,"")))) -> 54.333333333333336
A59: Team 5
A61: Week | B61: 1 | C61: 2 | D61: 3 | E61: 4 | F61: 5 | G61: 6 | H61: 7 | I61: 8 | J61: 9 | K61: 10 | M61: 11 | N61: 12 | O61: 13 | P61: 14 | Q61: 15 | R61: 16 | S61: 17 | T61: 18 | U61: 19 | V61: 20 | W61: Avg. | X61: Par | Y61: Net Avg. | Z61: Overall Rank | AA61: Low Rnd. | AB61: Max Rnd. | AC61: Low Net Rnd.
A62: ='D. Smith'!$A$1 -> D. Smith | B62: ='D. Smith'!$K$10 -> 46 | C62: ='D. Smith'!$K$11 -> 46 | D62: ='D. Smith'!$K$12 -> 40 | E62: ='D. Smith'!$K$13 -> 45 | F62: ='D. Smith'!$K$14 -> 39 | G62: ='D. Smith'!$K$21 -> 37 | H62: ='D. Smith'!$K$22 -> 43 | I62: ='D. Smith'!$K$23 -> 44 | J62: ='D. Smith'!$K$24 -> 37 | K62: ='D. Smith'!$K$25 -> 41 | M62: ='D. Smith'!$K$34 -> 39 | N62: ='D. Smith'!$K$35 -> - | O62: ='D. Smith'!$K$36 -> 39 | P62: ='D. Smith'!$K$37 -> 39 | Q62: ='D. Smith'!$K$38 -> 40 | R62: ='D. Smith'!$K$45 -> 38 | S62: ='D. Smith'!$K$46 -> 38 | T62: ='D. Smith'!$K$47 -> 42 | U62: ='D. Smith'!$K$48 -> 41 | V62: ='D. Smith'!$K$49 -> 44 | W62: =IF(ISERROR(AVERAGE(IF(B62:V62<>0,B62:V62,""))),"-",(AVERAGE(IF(B62:V62<>0,B62:V62,"")))) -> 40.94736842105263 | X62: =IF(ISERROR(W62-37),"-",(W62-37)) -> 3.9473684210526301 | Y62: ='D. Smith'!$M$52 -> 37.89473684210526 | Z62: =IF(ISERROR(RANK(Y62,Y$6:Y$85,1)),"-",RANK(Y62,Y$6:Y$85,1)) -> 7 | AA62: =IF(MIN(B62:V62)=0,"-",MIN(B62:V62)) -> 37 | AB62: =IF(MAX(C62:W62)=0,"-",MAX(C62:W62)) -> 46 | AC62: ='D. Smith'!$N$53 -> 33
A63: Avg | C63: =IF(ISERROR(AVERAGE(IF(B62:C62<>0,B62:C62,""))),"-",(AVERAGE(IF(B62:C62<>0,B62:C62,"")))) -> 46 | D63: =IF(ISERROR(AVERAGE(IF(B62:D62<>0,B62:D62,""))),"-",(AVERAGE(IF(B62:D62<>0,B62:D62,"")))) -> 44 | E63: =IF(ISERROR(AVERAGE(IF(B62:E62<>0,B62:E62,""))),"-",(AVERAGE(IF(B62:E62<>0,B62:E62,"")))) -> 44.25 | F63: =IF(ISERROR(AVERAGE(IF(B62:F62<>0,B62:F62,""))),"-",(AVERAGE(IF(B62:F62<>0,B62:F62,"")))) -> 43.2 | G63: =IF(ISERROR(AVERAGE(IF(B62:G62<>0,B62:G62,""))),"-",(AVERAGE(IF(B62:G62<>0,B62:G62,"")))) -> 42.166666666666664 | H63: =IF(ISERROR(AVERAGE(IF(B62:H62<>0,B62:H62,""))),"-",(AVERAGE(IF(B62:H62<>0,B62:H62,"")))) -> 42.285714285714285 | I63: =IF(ISERROR(AVERAGE(IF(B62:I62<>0,B62:I62,""))),"-",(AVERAGE(IF(B62:I62<>0,B62:I62,"")))) -> 42.5 | J63: =IF(ISERROR(AVERAGE(IF(B62:J62<>0,B62:J62,""))),"-",(AVERAGE(IF(B62:J62<>0,B62:J62,"")))) -> 41.888888888888886 | K63: =IF(ISERROR(AVERAGE(IF(B62:K62<>0,B62:K62,""))),"-",(AVERAGE(IF(B62:K62<>0,B62:K62,"")))) -> 41.8 | M63: =IF(ISERROR(AVERAGE(IF(B62:M62<>0,B62:M62,""))),"-",(AVERAGE(IF(B62:M62<>0,B62:M62,"")))) -> 41.545454545454547 | N63: =IF(ISERROR(AVERAGE(IF(B62:N62<>0,B62:N62,""))),"-",(AVERAGE(IF(B62:N62<>0,B62:N62,"")))) -> 41.545454545454547 | O63: =IF(ISERROR(AVERAGE(IF(B62:O62<>0,B62:O62,""))),"-",(AVERAGE(IF(B62:O62<>0,B62:O62,"")))) -> 41.333333333333336 | P63: =IF(ISERROR(AVERAGE(IF(B62:P62<>0,B62:P62,""))),"-",(AVERAGE(IF(B62:P62<>0,B62:P62,"")))) -> 41.153846153846153 | Q63: =IF(ISERROR(AVERAGE(IF(B62:Q62<>0,B62:Q62,""))),"-",(AVERAGE(IF(B62:Q62<>0,B62:Q62,"")))) -> 41.071428571428569 | R63: =IF(ISERROR(AVERAGE(IF(B62:R62<>0,B62:R62,""))),"-",(AVERAGE(IF(B62:R62<>0,B62:R62,"")))) -> 40.866666666666667 | S63: =IF(ISERROR(AVERAGE(IF(B62:S62<>0,B62:S62,""))),"-",(AVERAGE(IF(B62:S62<>0,B62:S62,"")))) -> 40.6875 | T63: =IF(ISERROR(AVERAGE(IF(B62:T62<>0,B62:T62,""))),"-",(AVERAGE(IF(B62:T62<>0,B62:T62,"")))) -> 40.764705882352942 | U63: =IF(ISERROR(AVERAGE(IF(B62:U62<>0,B62:U62,""))),"-",(AVERAGE(IF(B62:U62<>0,B62:U62,"")))) -> 40.777777777777779 | V63: =IF(ISERROR(AVERAGE(IF(B62:V62<>0,B62:V62,""))),"-",(AVERAGE(IF(B62:V62<>0,B62:V62,"")))) -> 40.94736842105263
A65: ='T. Way'!$A$1 -> T. Way | B65: ='T. Way'!$K$10 -> - | C65: ='T. Way'!$K$11 -> 51 | D65: ='T. Way'!$K$12 -> 45 | E65: ='T. Way'!$K$13 -> 48 | F65: ='T. Way'!$K$14 -> 45 | G65: ='T. Way'!$K$21 -> 45 | H65: ='T. Way'!$K$22 -> 48 | I65: ='T. Way'!$K$23 -> 49 | J65: ='T. Way'!$K$24 -> 48 | K65: ='T. Way'!$K$25 -> 40 | M65: ='T. Way'!$K$34 -> 42 | N65: ='T. Way'!$K$35 -> 44 | O65: ='T. Way'!$K$36 -> - | P65: ='T. Way'!$K$37 -> 45 | Q65: ='T. Way'!$K$38 -> 42 | R65: ='T. Way'!$K$45 -> 46 | S65: ='T. Way'!$K$46 -> 43 | T65: ='T. Way'!$K$47 -> 43 | U65: ='T. Way'!$K$48 -> 44 | V65: ='T. Way'!$K$49 -> 46 | W65: =IF(ISERROR(AVERAGE(IF(B65:V65<>0,B65:V65,""))),"-",(AVERAGE(IF(B65:V65<>0,B65:V65,"")))) -> 45.222222222222221 | X65: =IF(ISERROR(W65-37),"-",(W65-37)) -> 8.2222222222222214 | Y65: ='T. Way'!$M$52 -> 38.222222222222221 | Z65: =IF(ISERROR(RANK(Y65,Y$6:Y$85,1)),"-",RANK(Y65,Y$6:Y$85,1)) -> 11 | AA65: =IF(MIN(B65:V65)=0,"-",MIN(B65:V65)) -> 40 | AB65: =IF(MAX(C65:W65)=0,"-",MAX(C65:W65)) -> 51 | AC65: ='T. Way'!$N$53 -> 32
C66: =IF(ISERROR(AVERAGE(IF(B65:C65<>0,B65:C65,""))),"-",(AVERAGE(IF(B65:C65<>0,B65:C65,"")))) -> 51 | D66: =IF(ISERROR(AVERAGE(IF(B65:D65<>0,B65:D65,""))),"-",(AVERAGE(IF(B65:D65<>0,B65:D65,"")))) -> 48 | E66: =IF(ISERROR(AVERAGE(IF(B65:E65<>0,B65:E65,""))),"-",(AVERAGE(IF(B65:E65<>0,B65:E65,"")))) -> 48 | F66: =IF(ISERROR(AVERAGE(IF(B65:F65<>0,B65:F65,""))),"-",(AVERAGE(IF(B65:F65<>0,B65:F65,"")))) -> 47.25 | G66: =IF(ISERROR(AVERAGE(IF(B65:G65<>0,B65:G65,""))),"-",(AVERAGE(IF(B65:G65<>0,B65:G65,"")))) -> 46.8 | H66: =IF(ISERROR(AVERAGE(IF(B65:H65<>0,B65:H65,""))),"-",(AVERAGE(IF(B65:H65<>0,B65:H65,"")))) -> 47 | I66: =IF(ISERROR(AVERAGE(IF(B65:I65<>0,B65:I65,""))),"-",(AVERAGE(IF(B65:I65<>0,B65:I65,"")))) -> 47.285714285714285 | J66: =IF(ISERROR(AVERAGE(IF(B65:J65<>0,B65:J65,""))),"-",(AVERAGE(IF(B65:J65<>0,B65:J65,"")))) -> 47.375 | K66: =IF(ISERROR(AVERAGE(IF(B65:K65<>0,B65:K65,""))),"-",(AVERAGE(IF(B65:K65<>0,B65:K65,"")))) -> 46.555555555555557 | M66: =IF(ISERROR(AVERAGE(IF(B65:M65<>0,B65:M65,""))),"-",(AVERAGE(IF(B65:M65<>0,B65:M65,"")))) -> 46.1 | N66: =IF(ISERROR(AVERAGE(IF(B65:N65<>0,B65:N65,""))),"-",(AVERAGE(IF(B65:N65<>0,B65:N65,"")))) -> 45.909090909090907 | O66: =IF(ISERROR(AVERAGE(IF(B65:O65<>0,B65:O65,""))),"-",(AVERAGE(IF(B65:O65<>0,B65:O65,"")))) -> 45.909090909090907 | P66: =IF(ISERROR(AVERAGE(IF(B65:P65<>0,B65:P65,""))),"-",(AVERAGE(IF(B65:P65<>0,B65:P65,"")))) -> 45.833333333333336 | Q66: =IF(ISERROR(AVERAGE(IF(B65:Q65<>0,B65:Q65,""))),"-",(AVERAGE(IF(B65:Q65<>0,B65:Q65,"")))) -> 45.53846153846154 | R66: =IF(ISERROR(AVERAGE(IF(B65:R65<>0,B65:R65,""))),"-",(AVERAGE(IF(B65:R65<>0,B65:R65,"")))) -> 45.571428571428569 | S66: =IF(ISERROR(AVERAGE(IF(B65:S65<>0,B65:S65,""))),"-",(AVERAGE(IF(B65:S65<>0,B65:S65,"")))) -> 45.4 | T66: =IF(ISERROR(AVERAGE(IF(B65:T65<>0,B65:T65,""))),"-",(AVERAGE(IF(B65:T65<>0,B65:T65,"")))) -> 45.25 | U66: =IF(ISERROR(AVERAGE(IF(B65:U65<>0,B65:U65,""))),"-",(AVERAGE(IF(B65:U65<>0,B65:U65,"")))) -> 45.176470588235297 | V66: =IF(ISERROR(AVERAGE(IF(B65:V65<>0,B65:V65,""))),"-",(AVERAGE(IF(B65:V65<>0,B65:V65,"")))) -> 45.222222222222221
A68: ='L. Baumgarner'!$A$1 -> L. Baumgarner | B68: ='L. Baumgarner'!$K$10 -> 49 | C68: ='L. Baumgarner'!$K$11 -> 52 | D68: ='L. Baumgarner'!$K$12 -> 54 | E68: ='L. Baumgarner'!$K$13 -> 50 | F68: ='L. Baumgarner'!$K$14 -> 52 | G68: ='L. Baumgarner'!$K$21 -> - | H68: ='L. Baumgarner'!$K$22 -> 49 | I68: ='L. Baumgarner'!$K$23 -> 53 | J68: ='L. Baumgarner'!$K$24 -> 52 | K68: ='L. Baumgarner'!$K$25 -> 50 | M68: ='L. Baumgarner'!$K$34 -> 52 | N68: ='L. Baumgarner'!$K$35 -> 48 | O68: ='L. Baumgarner'!$K$36 -> 48 | P68: ='L. Baumgarner'!$K$37 -> 49 | Q68: ='L. Baumgarner'!$K$38 -> 51 | R68: ='L. Baumgarner'!$K$45 -> 50 | S68: ='L. Baumgarner'!$K$46 -> 53 | T68: ='L. Baumgarner'!$K$47 -> 48 | U68: ='L. Baumgarner'!$K$48 -> 48 | V68: ='L. Baumgarner'!$K$49 -> 51 | W68: =IF(ISERROR(AVERAGE(IF(B68:V68<>0,B68:V68,""))),"-",(AVERAGE(IF(B68:V68<>0,B68:V68,"")))) -> 50.473684210526315 | X68: =IF(ISERROR(W68-37),"-",(W68-37)) -> 13.473684210526315 | Y68: ='L. Baumgarner'!$M$52 -> 38.526315789473685 | Z68: =IF(ISERROR(RANK(Y68,Y$6:Y$85,1)),"-",RANK(Y68,Y$6:Y$85,1)) -> 16 | AA68: =IF(MIN(B68:V68)=0,"-",MIN(B68:V68)) -> 48 | AB68: =IF(MAX(C68:W68)=0,"-",MAX(C68:W68)) -> 54 | AC68: ='L. Baumgarner'!$N$53 -> 35
A69: Avg | C69: =IF(ISERROR(AVERAGE(IF(B68:C68<>0,B68:C68,""))),"-",(AVERAGE(IF(B68:C68<>0,B68:C68,"")))) -> 50.5 | D69: =IF(ISERROR(AVERAGE(IF(B68:D68<>0,B68:D68,""))),"-",(AVERAGE(IF(B68:D68<>0,B68:D68,"")))) -> 51.666666666666664 | E69: =IF(ISERROR(AVERAGE(IF(B68:E68<>0,B68:E68,""))),"-",(AVERAGE(IF(B68:E68<>0,B68:E68,"")))) -> 51.25 | F69: =IF(ISERROR(AVERAGE(IF(B68:F68<>0,B68:F68,""))),"-",(AVERAGE(IF(B68:F68<>0,B68:F68,"")))) -> 51.4 | G69: =IF(ISERROR(AVERAGE(IF(B68:G68<>0,B68:G68,""))),"-",(AVERAGE(IF(B68:G68<>0,B68:G68,"")))) -> 51.4 | H69: =IF(ISERROR(AVERAGE(IF(B68:H68<>0,B68:H68,""))),"-",(AVERAGE(IF(B68:H68<>0,B68:H68,"")))) -> 51 | I69: =IF(ISERROR(AVERAGE(IF(B68:I68<>0,B68:I68,""))),"-",(AVERAGE(IF(B68:I68<>0,B68:I68,"")))) -> 51.285714285714285 | J69: =IF(ISERROR(AVERAGE(IF(B68:J68<>0,B68:J68,""))),"-",(AVERAGE(IF(B68:J68<>0,B68:J68,"")))) -> 51.375 | K69: =IF(ISERROR(AVERAGE(IF(B68:K68<>0,B68:K68,""))),"-",(AVERAGE(IF(B68:K68<>0,B68:K68,"")))) -> 51.222222222222221 | M69: =IF(ISERROR(AVERAGE(IF(B68:M68<>0,B68:M68,""))),"-",(AVERAGE(IF(B68:M68<>0,B68:M68,"")))) -> 51.3 | N69: =IF(ISERROR(AVERAGE(IF(B68:N68<>0,B68:N68,""))),"-",(AVERAGE(IF(B68:N68<>0,B68:N68,"")))) -> 51 | O69: =IF(ISERROR(AVERAGE(IF(B68:O68<>0,B68:O68,""))),"-",(AVERAGE(IF(B68:O68<>0,B68:O68,"")))) -> 50.75 | P69: =IF(ISERROR(AVERAGE(IF(B68:P68<>0,B68:P68,""))),"-",(AVERAGE(IF(B68:P68<>0,B68:P68,"")))) -> 50.615384615384613 | Q69: =IF(ISERROR(AVERAGE(IF(B68:Q68<>0,B68:Q68,""))),"-",(AVERAGE(IF(B68:Q68<>0,B68:Q68,"")))) -> 50.642857142857146 | R69: =IF(ISERROR(AVERAGE(IF(B68:R68<>0,B68:R68,""))),"-",(AVERAGE(IF(B68:R68<>0,B68:R68,"")))) -> 50.6 | S69: =IF(ISERROR(AVERAGE(IF(B68:S68<>0,B68:S68,""))),"-",(AVERAGE(IF(B68:S68<>0,B68:S68,"")))) -> 50.75 | T69: =IF(ISERROR(AVERAGE(IF(B68:T68<>0,B68:T68,""))),"-",(AVERAGE(IF(B68:T68<>0,B68:T68,"")))) -> 50.588235294117645 | U69: =IF(ISERROR(AVERAGE(IF(B68:U68<>0,B68:U68,""))),"-",(AVERAGE(IF(B68:U68<>0,B68:U68,"")))) -> 50.444444444444443 | V69: =IF(ISERROR(AVERAGE(IF(B68:V68<>0,B68:V68,""))),"-",(AVERAGE(IF(B68:V68<>0,B68:V68,"")))) -> 50.473684210526315
A71: ='J. Dodrill'!$A$1 -> J. Dodrill | B71: ='J. Dodrill'!$K$10 -> 53 | C71: ='J. Dodrill'!$K$11 -> 49 | D71: ='J. Dodrill'!$K$12 -> 54 | E71: ='J. Dodrill'!$K$13 -> 57 | F71: ='J. Dodrill'!$K$14 -> 55 | G71: ='J. Dodrill'!$K$21 -> 53 | H71: ='J. Dodrill'!$K$22 -> 51 | I71: ='J. Dodrill'!$K$23 -> 57 | J71: ='J. Dodrill'!$K$24 -> 55 | K71: ='J. Dodrill'!$K$25 -> - | M71: ='J. Dodrill'!$K$34 -> 54 | N71: ='J. Dodrill'!$K$35 -> 48 | O71: ='J. Dodrill'!$K$36 -> 49 | P71: ='J. Dodrill'!$K$37 -> 50 | Q71: ='J. Dodrill'!$K$38 -> 58 | R71: ='J. Dodrill'!$K$45 -> 52 | S71: ='J. Dodrill'!$K$46 -> 58 | T71: ='J. Dodrill'!$K$47 -> 48 | U71: ='J. Dodrill'!$K$48 -> 47 | V71: ='J. Dodrill'!$K$49 -> - | W71: =IF(ISERROR(AVERAGE(IF(B71:V71<>0,B71:V71,""))),"-",(AVERAGE(IF(B71:V71<>0,B71:V71,"")))) -> 52.666666666666664 | X71: =IF(ISERROR(W71-37),"-",(W71-37)) -> 15.666666666666664 | Y71: ='J. Dodrill'!$M$52 -> 38.388888888888886 | Z71: =IF(ISERROR(RANK(Y71,Y$6:Y$85,1)),"-",RANK(Y71,Y$6:Y$85,1)) -> 14 | AA71: =IF(MIN(B71:V71)=0,"-",MIN(B71:V71)) -> 47 | AB71: =IF(MAX(C71:W71)=0,"-",MAX(C71:W71)) -> 58 | AC71: ='J. Dodrill'!$N$53 -> 33
A72: Avg | C72: =IF(ISERROR(AVERAGE(IF(B71:C71<>0,B71:C71,""))),"-",(AVERAGE(IF(B71:C71<>0,B71:C71,"")))) -> 51 | D72: =IF(ISERROR(AVERAGE(IF(B71:D71<>0,B71:D71,""))),"-",(AVERAGE(IF(B71:D71<>0,B71:D71,"")))) -> 52 | E72: =IF(ISERROR(AVERAGE(IF(B71:E71<>0,B71:E71,""))),"-",(AVERAGE(IF(B71:E71<>0,B71:E71,"")))) -> 53.25 | F72: =IF(ISERROR(AVERAGE(IF(B71:F71<>0,B71:F71,""))),"-",(AVERAGE(IF(B71:F71<>0,B71:F71,"")))) -> 53.6 | G72: =IF(ISERROR(AVERAGE(IF(B71:G71<>0,B71:G71,""))),"-",(AVERAGE(IF(B71:G71<>0,B71:G71,"")))) -> 53.5 | H72: =IF(ISERROR(AVERAGE(IF(B71:H71<>0,B71:H71,""))),"-",(AVERAGE(IF(B71:H71<>0,B71:H71,"")))) -> 53.142857142857146 | I72: =IF(ISERROR(AVERAGE(IF(B71:I71<>0,B71:I71,""))),"-",(AVERAGE(IF(B71:I71<>0,B71:I71,"")))) -> 53.625 | J72: =IF(ISERROR(AVERAGE(IF(B71:J71<>0,B71:J71,""))),"-",(AVERAGE(IF(B71:J71<>0,B71:J71,"")))) -> 53.777777777777779 | K72: =IF(ISERROR(AVERAGE(IF(B71:K71<>0,B71:K71,""))),"-",(AVERAGE(IF(B71:K71<>0,B71:K71,"")))) -> 53.777777777777779 | M72: =IF(ISERROR(AVERAGE(IF(B71:M71<>0,B71:M71,""))),"-",(AVERAGE(IF(B71:M71<>0,B71:M71,"")))) -> 53.8 | N72: =IF(ISERROR(AVERAGE(IF(B71:N71<>0,B71:N71,""))),"-",(AVERAGE(IF(B71:N71<>0,B71:N71,"")))) -> 53.272727272727273 | O72: =IF(ISERROR(AVERAGE(IF(B71:O71<>0,B71:O71,""))),"-",(AVERAGE(IF(B71:O71<>0,B71:O71,"")))) -> 52.916666666666664 | P72: =IF(ISERROR(AVERAGE(IF(B71:P71<>0,B71:P71,""))),"-",(AVERAGE(IF(B71:P71<>0,B71:P71,"")))) -> 52.692307692307693 | Q72: =IF(ISERROR(AVERAGE(IF(B71:Q71<>0,B71:Q71,""))),"-",(AVERAGE(IF(B71:Q71<>0,B71:Q71,"")))) -> 53.071428571428569 | R72: =IF(ISERROR(AVERAGE(IF(B71:R71<>0,B71:R71,""))),"-",(AVERAGE(IF(B71:R71<>0,B71:R71,"")))) -> 53 | S72: =IF(ISERROR(AVERAGE(IF(B71:S71<>0,B71:S71,""))),"-",(AVERAGE(IF(B71:S71<>0,B71:S71,"")))) -> 53.3125 | T72: =IF(ISERROR(AVERAGE(IF(B71:T71<>0,B71:T71,""))),"-",(AVERAGE(IF(B71:T71<>0,B71:T71,"")))) -> 53 | U72: =IF(ISERROR(AVERAGE(IF(B71:U71<>0,B71:U71,""))),"-",(AVERAGE(IF(B71:U71<>0,B71:U71,"")))) -> 52.666666666666664 | V72: =IF(ISERROR(AVERAGE(IF(B71:V71<>0,B71:V71,""))),"-",(AVERAGE(IF(B71:V71<>0,B71:V71,"")))) -> 52.666666666666664
A73: Team 6
A75: Week | B75: 1 | C75: 2 | D75: 3 | E75: 4 | F75: 5 | G75: 6 | H75: 7 | I75: 8 | J75: 9 | K75: 10 | M75: 11 | N75: 12 | O75: 13 | P75: 14 | Q75: 15 | R75: 16 | S75: 17 | T75: 18 | U75: 19 | V75: 20 | W75: Avg. | X75: Par | Y75: Net Avg. | Z75: Overall Rank | AA75: Low Rnd. | AB75: Max Rnd. | AC75: Low Net Rnd.
A76: ='T. Proctor'!$A$1 -> T. Proctor | B76: ='T. Proctor'!$K$10 -> 42 | C76: ='T. Proctor'!$K$11 -> 41 | D76: ='T. Proctor'!$K$12 -> 43 | E76: ='T. Proctor'!$K$13 -> 44 | F76: ='T. Proctor'!$K$14 -> 44 | G76: ='T. Proctor'!$K$21 -> 43 | H76: ='T. Proctor'!$K$22 -> 42 | I76: ='T. Proctor'!$K$23 -> 45 | J76: ='T. Proctor'!$K$24 -> 42 | K76: ='T. Proctor'!$K$25 -> 44 | M76: ='T. Proctor'!$K$34 -> 42 | N76: ='T. Proctor'!$K$35 -> 41 | O76: ='T. Proctor'!$K$36 -> 47 | P76: ='T. Proctor'!$K$37 -> 46 | Q76: ='T. Proctor'!$K$38 -> 41 | R76: ='T. Proctor'!$K$45 -> 44 | S76: ='T. Proctor'!$K$46 -> 42 | T76: ='T. Proctor'!$K$47 -> 41 | U76: ='T. Proctor'!$K$48 -> 47 | V76: ='T. Proctor'!$K$49 -> 41 | W76: =IF(ISERROR(AVERAGE(IF(B76:V76<>0,B76:V76,""))),"-",(AVERAGE(IF(B76:V76<>0,B76:V76,"")))) -> 43.10 | X76: =IF(ISERROR(W76-37),"-",(W76-37)) -> 6.10 | Y76: ='T. Proctor'!$M$52 -> 38.35 | Z76: =IF(ISERROR(RANK(Y76,Y$6:Y$85,1)),"-",RANK(Y76,Y$6:Y$85,1)) -> 13 | AA76: =IF(MIN(B76:V76)=0,"-",MIN(B76:V76)) -> 41 | AB76: =IF(MAX(C76:W76)=0,"-",MAX(C76:W76)) -> 47 | AC76: ='T. Proctor'!$N$53 -> 36
A77: Avg | C77: =IF(ISERROR(AVERAGE(IF(B76:C76<>0,B76:C76,""))),"-",(AVERAGE(IF(B76:C76<>0,B76:C76,"")))) -> 41.5 | D77: =IF(ISERROR(AVERAGE(IF(B76:D76<>0,B76:D76,""))),"-",(AVERAGE(IF(B76:D76<>0,B76:D76,"")))) -> 42 | E77: =IF(ISERROR(AVERAGE(IF(B76:E76<>0,B76:E76,""))),"-",(AVERAGE(IF(B76:E76<>0,B76:E76,"")))) -> 42.5 | F77: =IF(ISERROR(AVERAGE(IF(B76:F76<>0,B76:F76,""))),"-",(AVERAGE(IF(B76:F76<>0,B76:F76,"")))) -> 42.8 | G77: =IF(ISERROR(AVERAGE(IF(B76:G76<>0,B76:G76,""))),"-",(AVERAGE(IF(B76:G76<>0,B76:G76,"")))) -> 42.833333333333336 | H77: =IF(ISERROR(AVERAGE(IF(B76:H76<>0,B76:H76,""))),"-",(AVERAGE(IF(B76:H76<>0,B76:H76,"")))) -> 42.714285714285715 | I77: =IF(ISERROR(AVERAGE(IF(B76:I76<>0,B76:I76,""))),"-",(AVERAGE(IF(B76:I76<>0,B76:I76,"")))) -> 43 | J77: =IF(ISERROR(AVERAGE(IF(B76:J76<>0,B76:J76,""))),"-",(AVERAGE(IF(B76:J76<>0,B76:J76,"")))) -> 42.888888888888886 | K77: =IF(ISERROR(AVERAGE(IF(B76:K76<>0,B76:K76,""))),"-",(AVERAGE(IF(B76:K76<>0,B76:K76,"")))) -> 43 | M77: =IF(ISERROR(AVERAGE(IF(B76:M76<>0,B76:M76,""))),"-",(AVERAGE(IF(B76:M76<>0,B76:M76,"")))) -> 42.909090909090907 | N77: =IF(ISERROR(AVERAGE(IF(B76:N76<>0,B76:N76,""))),"-",(AVERAGE(IF(B76:N76<>0,B76:N76,"")))) -> 42.75 | O77: =IF(ISERROR(AVERAGE(IF(B76:O76<>0,B76:O76,""))),"-",(AVERAGE(IF(B76:O76<>0,B76:O76,"")))) -> 43.07692307692308 | P77: =IF(ISERROR(AVERAGE(IF(B76:P76<>0,B76:P76,""))),"-",(AVERAGE(IF(B76:P76<>0,B76:P76,"")))) -> 43.285714285714285 | Q77: =IF(ISERROR(AVERAGE(IF(B76:Q76<>0,B76:Q76,""))),"-",(AVERAGE(IF(B76:Q76<>0,B76:Q76,"")))) -> 43.133333333333333 | R77: =IF(ISERROR(AVERAGE(IF(B76:R76<>0,B76:R76,""))),"-",(AVERAGE(IF(B76:R76<>0,B76:R76,"")))) -> 43.1875 | S77: =IF(ISERROR(AVERAGE(IF(B76:S76<>0,B76:S76,""))),"-",(AVERAGE(IF(B76:S76<>0,B76:S76,"")))) -> 43.117647058823529 | T77: =IF(ISERROR(AVERAGE(IF(B76:T76<>0,B76:T76,""))),"-",(AVERAGE(IF(B76:T76<>0,B76:T76,"")))) -> 43 | U77: =IF(ISERROR(AVERAGE(IF(B76:U76<>0,B76:U76,""))),"-",(AVERAGE(IF(B76:U76<>0,B76:U76,"")))) -> 43.210526315789473 | V77: =IF(ISERROR(AVERAGE(IF(B76:V76<>0,B76:V76,""))),"-",(AVERAGE(IF(B76:V76<>0,B76:V76,"")))) -> 43.1
A79: ='Matt McComas'!$A$1 -> Matt McComas | B79: ='Matt McComas'!$K$10 -> 42 | C79: ='Matt McComas'!$K$11 -> 46 | D79: ='Matt McComas'!$K$12 -> 43 | E79: ='Matt McComas'!$K$13 -> 43 | F79: ='Matt McComas'!$K$14 -> 40 | G79: ='Matt McComas'!$K$21 -> 50 | H79: ='Matt McComas'!$K$22 -> 50 | I79: ='Matt McComas'!$K$23 -> 42 | J79: ='Matt McComas'!$K$24 -> 47 | K79: ='Matt McComas'!$K$25 -> 44 | M79: ='Matt McComas'!$K$34 -> 44 | N79: ='Matt McComas'!$K$35 -> 43 | O79: ='Matt McComas'!$K$36 -> 46 | P79: ='Matt McComas'!$K$37 -> 39 | Q79: ='Matt McComas'!$K$38 -> 45 | R79: ='Matt McComas'!$K$45 -> 46 | S79: ='Matt McComas'!$K$46 -> 47 | T79: ='Matt McComas'!$K$47 -> 40 | U79: ='Matt McComas'!$K$48 -> 47 | V79: ='Matt McComas'!$K$49 -> 47 | W79: =IF(ISERROR(AVERAGE(IF(B79:V79<>0,B79:V79,""))),"-",(AVERAGE(IF(B79:V79<>0,B79:V79,"")))) -> 44.55 | X79: =IF(ISERROR(W79-37),"-",(W79-37)) -> 7.55 | Y79: ='Matt McComas'!$M$52 -> 39.80 | Z79: =IF(ISERROR(RANK(Y79,Y$6:Y$85,1)),"-",RANK(Y79,Y$6:Y$85,1)) -> 24 | AA79: =IF(MIN(B79:V79)=0,"-",MIN(B79:V79)) -> 39 | AB79: =IF(MAX(C79:W79)=0,"-",MAX(C79:W79)) -> 50 | AC79: ='Matt McComas'!$N$53 -> 34
C80: =IF(ISERROR(AVERAGE(IF(B79:C79<>0,B79:C79,""))),"-",(AVERAGE(IF(B79:C79<>0,B79:C79,"")))) -> 44 | D80: =IF(ISERROR(AVERAGE(IF(B79:D79<>0,B79:D79,""))),"-",(AVERAGE(IF(B79:D79<>0,B79:D79,"")))) -> 43.666666666666664 | E80: =IF(ISERROR(AVERAGE(IF(B79:E79<>0,B79:E79,""))),"-",(AVERAGE(IF(B79:E79<>0,B79:E79,"")))) -> 43.5 | F80: =IF(ISERROR(AVERAGE(IF(B79:F79<>0,B79:F79,""))),"-",(AVERAGE(IF(B79:F79<>0,B79:F79,"")))) -> 42.8 | G80: =IF(ISERROR(AVERAGE(IF(B79:G79<>0,B79:G79,""))),"-",(AVERAGE(IF(B79:G79<>0,B79:G79,"")))) -> 44 | H80: =IF(ISERROR(AVERAGE(IF(B79:H79<>0,B79:H79,""))),"-",(AVERAGE(IF(B79:H79<>0,B79:H79,"")))) -> 44.857142857142854 | I80: =IF(ISERROR(AVERAGE(IF(B79:I79<>0,B79:I79,""))),"-",(AVERAGE(IF(B79:I79<>0,B79:I79,"")))) -> 44.5 | J80: =IF(ISERROR(AVERAGE(IF(B79:J79<>0,B79:J79,""))),"-",(AVERAGE(IF(B79:J79<>0,B79:J79,"")))) -> 44.777777777777779 | K80: =IF(ISERROR(AVERAGE(IF(B79:K79<>0,B79:K79,""))),"-",(AVERAGE(IF(B79:K79<>0,B79:K79,"")))) -> 44.7 | M80: =IF(ISERROR(AVERAGE(IF(B79:M79<>0,B79:M79,""))),"-",(AVERAGE(IF(B79:M79<>0,B79:M79,"")))) -> 44.636363636363633 | N80: =IF(ISERROR(AVERAGE(IF(B79:N79<>0,B79:N79,""))),"-",(AVERAGE(IF(B79:N79<>0,B79:N79,"")))) -> 44.5 | O80: =IF(ISERROR(AVERAGE(IF(B79:O79<>0,B79:O79,""))),"-",(AVERAGE(IF(B79:O79<>0,B79:O79,"")))) -> 44.615384615384613 | P80: =IF(ISERROR(AVERAGE(IF(B79:P79<>0,B79:P79,""))),"-",(AVERAGE(IF(B79:P79<>0,B79:P79,"")))) -> 44.214285714285715 | Q80: =IF(ISERROR(AVERAGE(IF(B79:Q79<>0,B79:Q79,""))),"-",(AVERAGE(IF(B79:Q79<>0,B79:Q79,"")))) -> 44.266666666666666 | R80: =IF(ISERROR(AVERAGE(IF(B79:R79<>0,B79:R79,""))),"-",(AVERAGE(IF(B79:R79<>0,B79:R79,"")))) -> 44.375 | S80: =IF(ISERROR(AVERAGE(IF(B79:S79<>0,B79:S79,""))),"-",(AVERAGE(IF(B79:S79<>0,B79:S79,"")))) -> 44.529411764705884 | T80: =IF(ISERROR(AVERAGE(IF(B79:T79<>0,B79:T79,""))),"-",(AVERAGE(IF(B79:T79<>0,B79:T79,"")))) -> 44.277777777777779 | U80: =IF(ISERROR(AVERAGE(IF(B79:U79<>0,B79:U79,""))),"-",(AVERAGE(IF(B79:U79<>0,B79:U79,"")))) -> 44.421052631578945 | V80: =IF(ISERROR(AVERAGE(IF(B79:V79<>0,B79:V79,""))),"-",(AVERAGE(IF(B79:V79<>0,B79:V79,"")))) -> 44.55
A82: ='C. Edwards'!$A$1 -> C. Edwards | B82: ='C. Edwards'!$K$10 -> - | C82: ='C. Edwards'!$K$11 -> - | D82: ='C. Edwards'!$K$12 -> - | E82: ='C. Edwards'!$K$13 -> - | F82: ='C. Edwards'!$K$14 -> - | G82: ='C. Edwards'!$K$21 -> - | H82: ='C. Edwards'!$K$22 -> - | I82: ='C. Edwards'!$K$23 -> - | J82: ='C. Edwards'!$K$24 -> 48 | K82: ='C. Edwards'!$K$25 -> 50 | M82: ='C. Edwards'!$K$34 -> 47 | N82: ='C. Edwards'!$K$35 -> 50 | O82: ='C. Edwards'!$K$36 -> 46 | P82: ='C. Edwards'!$K$37 -> 46 | Q82: ='C. Edwards'!$K$38 -> 47 | R82: ='C. Edwards'!$K$45 -> 49 | S82: ='C. Edwards'!$K$46 -> 53 | T82: ='C. Edwards'!$K$47 -> 50 | U82: ='C. Edwards'!$K$48 -> 49 | V82: ='C. Edwards'!$K$49 -> 47 | W82: =IF(ISERROR(AVERAGE(IF(B82:V82<>0,B82:V82,""))),"-",(AVERAGE(IF(B82:V82<>0,B82:V82,"")))) -> 48.50 | X82: =IF(ISERROR(W82-37),"-",(W82-37)) -> 11.50 | Y82: ='C. Edwards'!$M$52 -> 37.833333333333336 | Z82: =IF(ISERROR(RANK(Y82,Y$6:Y$85,1)),"-",RANK(Y82,Y$6:Y$85,1)) -> 6 | AA82: =IF(MIN(B82:V82)=0,"-",MIN(B82:V82)) -> 46 | AB82: =IF(MAX(C82:W82)=0,"-",MAX(C82:W82)) -> 53 | AC82: ='C. Edwards'!$N$53 -> 34
A83: Avg | C83: =IF(ISERROR(AVERAGE(IF(B82:C82<>0,B82:C82,""))),"-",(AVERAGE(IF(B82:C82<>0,B82:C82,"")))) -> - | D83: =IF(ISERROR(AVERAGE(IF(B82:D82<>0,B82:D82,""))),"-",(AVERAGE(IF(B82:D82<>0,B82:D82,"")))) -> - | E83: =IF(ISERROR(AVERAGE(IF(B82:E82<>0,B82:E82,""))),"-",(AVERAGE(IF(B82:E82<>0,B82:E82,"")))) -> - | F83: =IF(ISERROR(AVERAGE(IF(B82:F82<>0,B82:F82,""))),"-",(AVERAGE(IF(B82:F82<>0,B82:F82,"")))) -> - | G83: =IF(ISERROR(AVERAGE(IF(B82:G82<>0,B82:G82,""))),"-",(AVERAGE(IF(B82:G82<>0,B82:G82,"")))) -> - | H83: =IF(ISERROR(AVERAGE(IF(B82:H82<>0,B82:H82,""))),"-",(AVERAGE(IF(B82:H82<>0,B82:H82,"")))) -> - | I83: =IF(ISERROR(AVERAGE(IF(B82:I82<>0,B82:I82,""))),"-",(AVERAGE(IF(B82:I82<>0,B82:I82,"")))) -> - | J83: =IF(ISERROR(AVERAGE(IF(B82:J82<>0,B82:J82,""))),"-",(AVERAGE(IF(B82:J82<>0,B82:J82,"")))) -> 48 | K83: =IF(ISERROR(AVERAGE(IF(B82:K82<>0,B82:K82,""))),"-",(AVERAGE(IF(B82:K82<>0,B82:K82,"")))) -> 49 | M83: =IF(ISERROR(AVERAGE(IF(B82:M82<>0,B82:M82,""))),"-",(AVERAGE(IF(B82:M82<>0,B82:M82,"")))) -> 48.333333333333336 | N83: =IF(ISERROR(AVERAGE(IF(B82:N82<>0,B82:N82,""))),"-",(AVERAGE(IF(B82:N82<>0,B82:N82,"")))) -> 48.75 | O83: =IF(ISERROR(AVERAGE(IF(B82:O82<>0,B82:O82,""))),"-",(AVERAGE(IF(B82:O82<>0,B82:O82,"")))) -> 48.2 | P83: =IF(ISERROR(AVERAGE(IF(B82:P82<>0,B82:P82,""))),"-",(AVERAGE(IF(B82:P82<>0,B82:P82,"")))) -> 47.833333333333336 | Q83: =IF(ISERROR(AVERAGE(IF(B82:Q82<>0,B82:Q82,""))),"-",(AVERAGE(IF(B82:Q82<>0,B82:Q82,"")))) -> 47.714285714285715 | R83: =IF(ISERROR(AVERAGE(IF(B82:R82<>0,B82:R82,""))),"-",(AVERAGE(IF(B82:R82<>0,B82:R82,"")))) -> 47.875 | S83: =IF(ISERROR(AVERAGE(IF(B82:S82<>0,B82:S82,""))),"-",(AVERAGE(IF(B82:S82<>0,B82:S82,"")))) -> 48.444444444444443 | T83: =IF(ISERROR(AVERAGE(IF(B82:T82<>0,B82:T82,""))),"-",(AVERAGE(IF(B82:T82<>0,B82:T82,"")))) -> 48.6 | U83: =IF(ISERROR(AVERAGE(IF(B82:U82<>0,B82:U82,""))),"-",(AVERAGE(IF(B82:U82<>0,B82:U82,"")))) -> 48.636363636363633 | V83: =IF(ISERROR(AVERAGE(IF(B82:V82<>0,B82:V82,""))),"-",(AVERAGE(IF(B82:V82<>0,B82:V82,"")))) -> 48.5
A85: ='Tres Baumgarner'!$A$1 -> Tres Baumgarner | B85: ='Tres Baumgarner'!$K$10 -> 50 | C85: ='Tres Baumgarner'!$K$11 -> 49 | D85: ='Tres Baumgarner'!$K$12 -> 49 | E85: ='Tres Baumgarner'!$K$13 -> 53 | F85: ='Tres Baumgarner'!$K$14 -> 54 | G85: ='Tres Baumgarner'!$K$21 -> - | H85: ='Tres Baumgarner'!$K$22 -> - | I85: ='Tres Baumgarner'!$K$23 -> - | J85: ='Tres Baumgarner'!$K$24 -> - | K85: ='Tres Baumgarner'!$K$25 -> - | M85: ='Tres Baumgarner'!$K$34 -> - | N85: ='Tres Baumgarner'!$K$35 -> - | O85: ='Tres Baumgarner'!$K$36 -> - | P85: ='Tres Baumgarner'!$K$37 -> - | Q85: ='Tres Baumgarner'!$K$38 -> - | R85: ='Tres Baumgarner'!$K$45 -> - | S85: ='Tres Baumgarner'!$K$46 -> - | T85: ='Tres Baumgarner'!$K$47 -> - | U85: ='Tres Baumgarner'!$K$48 -> - | V85: ='Tres Baumgarner'!$K$49 -> 53 | W85: =IF(ISERROR(AVERAGE(IF(B85:V85<>0,B85:V85,""))),"-",(AVERAGE(IF(B85:V85<>0,B85:V85,"")))) -> 51.333333333333336 | X85: =IF(ISERROR(W85-37),"-",(W85-37)) -> 14.333333333333336 | Y85: ='Tres Baumgarner'!$M$52 -> 37.666666666666664 | Z85: =IF(ISERROR(RANK(Y85,Y$6:Y$85,1)),"-",RANK(Y85,Y$6:Y$85,1)) -> 4 | AA85: =IF(MIN(B85:V85)=0,"-",MIN(B85:V85)) -> 49 | AB85: =IF(MAX(C85:W85)=0,"-",MAX(C85:W85)) -> 54 | AC85: ='Tres Baumgarner'!$N$53 -> 35
A86: Avg | C86: =IF(ISERROR(AVERAGE(IF(B85:C85<>0,B85:C85,""))),"-",(AVERAGE(IF(B85:C85<>0,B85:C85,"")))) -> 49.5 | D86: =IF(ISERROR(AVERAGE(IF(B85:D85<>0,B85:D85,""))),"-",(AVERAGE(IF(B85:D85<>0,B85:D85,"")))) -> 49.333333333333336 | E86: =IF(ISERROR(AVERAGE(IF(B85:E85<>0,B85:E85,""))),"-",(AVERAGE(IF(B85:E85<>0,B85:E85,"")))) -> 50.25 | F86: =IF(ISERROR(AVERAGE(IF(B85:F85<>0,B85:F85,""))),"-",(AVERAGE(IF(B85:F85<>0,B85:F85,"")))) -> 51 | G86: =IF(ISERROR(AVERAGE(IF(B85:G85<>0,B85:G85,""))),"-",(AVERAGE(IF(B85:G85<>0,B85:G85,"")))) -> 51 | H86: =IF(ISERROR(AVERAGE(IF(B85:H85<>0,B85:H85,""))),"-",(AVERAGE(IF(B85:H85<>0,B85:H85,"")))) -> 51 | I86: =IF(ISERROR(AVERAGE(IF(B85:I85<>0,B85:I85,""))),"-",(AVERAGE(IF(B85:I85<>0,B85:I85,"")))) -> 51 | J86: =IF(ISERROR(AVERAGE(IF(B85:J85<>0,B85:J85,""))),"-",(AVERAGE(IF(B85:J85<>0,B85:J85,"")))) -> 51 | K86: =IF(ISERROR(AVERAGE(IF(B85:K85<>0,B85:K85,""))),"-",(AVERAGE(IF(B85:K85<>0,B85:K85,"")))) -> 51 | M86: =IF(ISERROR(AVERAGE(IF(B85:M85<>0,B85:M85,""))),"-",(AVERAGE(IF(B85:M85<>0,B85:M85,"")))) -> 51 | N86: =IF(ISERROR(AVERAGE(IF(B85:N85<>0,B85:N85,""))),"-",(AVERAGE(IF(B85:N85<>0,B85:N85,"")))) -> 51 | O86: =IF(ISERROR(AVERAGE(IF(B85:O85<>0,B85:O85,""))),"-",(AVERAGE(IF(B85:O85<>0,B85:O85,"")))) -> 51 | P86: =IF(ISERROR(AVERAGE(IF(B85:P85<>0,B85:P85,""))),"-",(AVERAGE(IF(B85:P85<>0,B85:P85,"")))) -> 51 | Q86: =IF(ISERROR(AVERAGE(IF(B85:Q85<>0,B85:Q85,""))),"-",(AVERAGE(IF(B85:Q85<>0,B85:Q85,"")))) -> 51 | R86: =IF(ISERROR(AVERAGE(IF(B85:R85<>0,B85:R85,""))),"-",(AVERAGE(IF(B85:R85<>0,B85:R85,"")))) -> 51 | S86: =IF(ISERROR(AVERAGE(IF(B85:S85<>0,B85:S85,""))),"-",(AVERAGE(IF(B85:S85<>0,B85:S85,"")))) -> 51 | T86: =IF(ISERROR(AVERAGE(IF(B85:T85<>0,B85:T85,""))),"-",(AVERAGE(IF(B85:T85<>0,B85:T85,"")))) -> 51 | U86: =IF(ISERROR(AVERAGE(IF(B85:U85<>0,B85:U85,""))),"-",(AVERAGE(IF(B85:U85<>0,B85:U85,"")))) -> 51 | V86: =IF(ISERROR(AVERAGE(IF(B85:V85<>0,B85:V85,""))),"-",(AVERAGE(IF(B85:V85<>0,B85:V85,"")))) -> 51.333333333333336
X87: Lowest Round | AA87: =IF(MIN(AA6,AA9,AA12,AA15,AA20,AA23,AA26,AA29,AA34,AA37,AA40,AA43,AA48,AA51,AA54,AA57,AA62,AA65,AA68,AA71,AA76,AA79,AA82,AA85)=0,"-",MIN(AA6,AA9,AA12,AA15,AA20,AA23,AA26,AA29,AA34,AA37,AA40,AA43,AA48,AA51,AA54,AA57,AA62,AA65,AA68,AA71,AA76,AA79,AA82,AA85)) -> 33 | AB87: =IF(ISERROR(OFFSET(AA6,MATCH(AA87,$AA$6:$AA$85,0)-1,-26,1,1)),"-",OFFSET(AA6,MATCH(AA87,$AA$6:$AA$85,0)-1,-26,1,1)) -> R. Crowder
Y88: Lowest Average | AA88: =IF(MIN(W6,W9,W12,W15,W20,W23,W26,W29,W34,W37,W40,W43,W48,W51,W54,W57,W62,W65,W68,W71,W76,W79,W82,W85)=0,"-",MIN(W6,W9,W12,W15,W20,W23,W26,W29,W34,W37,W40,W43,W48,W51,W54,W57,W62,W65,W68,W71,W76,W79,W82,W85)) -> 40.555555555555557 | AB88: =IF(ISERROR(OFFSET(W6,MATCH(AA88,$W$6:$W$85,0)-1,-22,1,1)),"-",OFFSET(W6,MATCH(AA88,$W$6:$W$85,0)-1,-22,1,1)) -> R. Ours
X89: Lowest Net Round | AA89: =IF(MIN(AC6,AC9,AC12,AC15,AC20,AC23,AC26,AC29,AC34,AC37,AC40,AC43,AC48,AC51,AC54,AC57,AC62,AC65,AC68,AC71,AC76,AC79,AC82,AC85)=0,"-",MIN(AC6,AC9,AC12,AC15,AC20,AC23,AC26,AC29,AC34,AC37,AC40,AC43,AC48,AC51,AC54,AC57,AC62,AC65,AC68,AC71,AC76,AC79,AC82,AC85)) -> 29 | AB89: =IF(ISERROR(OFFSET(AC6,MATCH(AA89,$AC$6:$AC$85,0)-1,-28,1,1)),"-",OFFSET(AC6,MATCH(AA89,$AC$6:$AC$85,0)-1,-28,1,1)) -> R. Crowder
X90: Lowest Net Average | AA90: =IF(MIN(Y6,Y9,Y12,Y15,Y20,Y23,Y26,Y29,Y34,Y37,Y40,Y43,Y48,Y51,Y54,Y57,Y62,Y65,Y68,Y71,Y76,Y79,Y82,Y85)=0,"-",MIN(Y6,Y9,Y12,Y15,Y20,Y23,Y26,Y29,Y34,Y37,Y40,Y43,Y48,Y51,Y54,Y57,Y62,Y65,Y68,Y71,Y76,Y79,Y82,Y85)) -> 37.555555555555557 | AB90: =IF(ISERROR(OFFSET(Y6,MATCH(AA90,$Y$6:$Y$85,0)-1,-24,1,1)),"-",OFFSET(Y6,MATCH(AA90,$Y$6:$Y$85,0)-1,-24,1,1)) -> G. Taylor