A1: 2007 LEAGUE CHAMPIONS Team 1 - R. Ours, T. Proctor, G. Taylor, J. Landers 2nd Place - Team 4 - M. Rutherford, J. Smith, M. Kyle, B. Harbour 2007 YEAR END CHAMPIONSHIP RESULTS Individual Champion - V. Bunn with a net score of 68. 2nd Place - R. Ours 3rd Place - T. Baumgarner 4th Place - D. Smith 5th Place - Tie between R. Keeney and G. White Low Putts Champion - Tie between R. Ours and T. Way Closest to Pin (#6) - L. Baumgarner Closest to Pin (#13) - R. Keeney Closest to Pin (#17) - B. Hall Individual Stat Winners Low Net for the Year - Tie between R. Ours and L. Baumgarner with a net score of 30. Low Gross for the Year - R. Ours with a 35 Total Points for the Year - B. Hall - 25 pts. | B1: Officers Elected for 2008 President - Lewis Baumgarner Vice President - Vance Bunn Secretary/Treasurer - John Landers

A1: WEEKLY WINNERS FOR 2007
A2: Week 1 - Tom Proctor won low net with a net score of 34.
A3: Week 2 - Ralph Adkins won closest to pin.
A4: Week 3 - Dave Smith won putts with 13 total putts.
A5: Week 4 - Matt Kyle won low net with a net score of 31.
A6: Week 5 - Ralph Adkins won closest to pin.
A7: Week 6 - Rob Crowder won putts with 13 total putts.
A8: Week 7 - Butch Kyle won low new with a net score of 32.
A9: Week 8 - Dave Smith won closest to pin.
A10: Week 9 - Gary Taylor and Tom Proctor won putts with 13 total putts.
A11: Week 10 - Matt Kyle won low net with a net score of 33.
A12: Week 11 - Dave Smith won closest to pin.
A13: Week 12 - Vance Bunn won putts with 13 total putts.
A14: Week 13 - Alex Wilks won low net with a net score of 34.
A15: Week 14 - Tim Way won closest to pin.
A16: Week 15 - Gary Taylor, Benton Hall, Dave Smith, Steve Jones, Tom Proctor and Rob Crowder tied for putts with 13 total putts. Rob is not in the money since he played early but was worth the recognition.
A17: Week 16 - Dave Smith won low net with a net score of 33.

A1: The table below shows how close you were to moving up to the next player level

R0: =SUM(B1:O1)/14 -> 40.071428571428569 | S0: =SUM(I1:O1)/7-37 -> 1.1428571428571459 | T0: HC
1: 1 Players | A1: John | B1: 47 | C1: 42 | D1: 42 | E1: 42 | F1: 41 | G1: 40 | H1: 40 | I1: 40 | J1: 40 | K1: 38 | L1: 38 | M1: 38 | N1: 37 | O1: 36 | R1: =SUM(B1:O1)/14 -> 40.071428571428569 | S1: =SUM(I1:O1)/7-37 -> 1.1428571428571459 | T1: 1
A2: Ray | B2: 44 | C2: 44 | D2: 43 | E2: 43 | F2: 43 | G2: 41 | H2: 41 | I2: 40 | J2: 40 | K2: 39 | L2: 39 | M2: 38 | N2: 38 | O2: 37 | P2: 35 | R2: =SUM(B2:P2)/15 -> 40.333333333333336 | S2: =SUM(I2:P2)/8-37 -> 1.25 | T2: 1
A3: George | B3: 46 | C3: 43 | D3: 43 | E3: 42 | F3: 42 | G3: 42 | H3: 42 | I3: 42 | J3: 41 | K3: 41 | L3: 41 | M3: 40 | N3: 38 | O3: 38 | P3: 37 | R3: =SUM(B3:P3)/15 -> 41.200 | S3: =SUM(I3:P3)/8-37 -> 2.75 | T3: 3
A4: Randy | B4: 49 | C4: 47 | D4: 46 | E4: 44 | F4: 43 | G4: 43 | H4: 42 | I4: 42 | J4: 41 | K4: 41 | L4: 40 | M4: 40 | N4: 40 | O4: 39 | P4: 38 | R4: =SUM(B4:P4)/15 -> 42.333333333333336 | S4: =SUM(I4:P4)/8-37 -> 3.125 | T4: 3
A5: Vance | B5: 46 | C5: 45 | D5: 44 | E5: 44 | F5: 44 | G5: 44 | H5: 43 | I5: 42 | J5: 42 | K5: 42 | L5: 42 | M5: 40 | N5: 39 | O5: 38 | P5: 36 | R5: =SUM(B5:P5)/15 -> 42.06666666666667 | S5: =SUM(I5:P5)/8-37 -> 3.125 | T5: 3
A6: David | B6: 49 | C6: 45 | D6: 45 | E6: 44 | F6: 43 | G6: 43 | H6: 43 | I6: 43 | J6: 42 | K6: 41 | L6: 41 | M6: 41 | N6: 40 | O6: 39 | P6: 37 | R6: =SUM(B6:P6)/15 -> 42.400 | S6: =SUM(I6:P6)/8-37 -> 3.50 | T6: 4
7: 2 Players | A7: Tom | B7: 45 | C7: 45 | D7: 44 | E7: 44 | F7: 43 | G7: 43 | H7: 42 | I7: 42 | J7: 42 | K7: 41 | L7: 41 | M7: 41 | N7: 40 | O7: 40 | P7: 38 | R7: =SUM(B7:P7)/15 -> 42.06666666666667 | S7: =SUM(I7:P7)/8-37 -> 3.625 | T7: 4
A8: Matt K. | B8: 52 | C8: 52 | D8: 48 | E8: 48 | F8: 47 | G8: 47 | H8: 46 | I8: 43 | J8: 42 | K8: 42 | L8: 40 | M8: 40 | N8: 40 | O8: 39 | R8: =SUM(B8:P8)/16 -> 39.125 | S8: =SUM(I8:O8)/7-37 -> 3.8571428571428541 | T8: 4
A9: Marc | B9: 44 | C9: 44 | D9: 44 | E9: 44 | F9: 43 | G9: 43 | H9: 43 | I9: 43 | J9: 41 | K9: 41 | L9: 41 | M9: 39 | N9: 38 | R9: =SUM(B9:N9)/13 -> 42.153846153846153 | S9: =SUM(H9:N9)/7-37 -> 3.8571428571428541 | T9: 4
A10: Matt Mc. | B10: 49 | C10: 48 | D10: 47 | E10: 46 | F10: 46 | G10: 46 | H10: 45 | I10: 44 | J10: 43 | K10: 43 | L10: 42 | M10: 41 | N10: 41 | O10: 41 | P10: 40 | Q10: 38 | R10: =SUM(B10:Q10)/16 -> 43.750 | S10: =SUM(J10:Q10)/8-37 -> 4.125 | T10: 4
A11: Rob | B11: 47 | C11: 45 | D11: 45 | E11: 45 | F11: 44 | G11: 43 | H11: 43 | I11: 43 | J11: 43 | K11: 42 | L11: 41 | M11: 40 | N11: 40 | O11: 40 | R11: =SUM(B11:O11)/14 -> 42.928571428571431 | S11: =SUM(I11:O11)/7-37 -> 4.2857142857142847 | T11: 4
A12: Tim | B12: 49 | C12: 49 | D12: 48 | E12: 47 | F12: 46 | G12: 46 | H12: 46 | I12: 46 | J12: 45 | K12: 43 | L12: 43 | M12: 43 | N12: 41 | O12: 41 | R12: =SUM(B12:O12)/14 -> 45.214285714285715 | S12: =SUM(I12:O12)/7-37 -> 6.1428571428571459 | T12: 6
13: 3 Players | A13: Steve | B13: 51 | C13: 49 | D13: 47 | E13: 46 | F13: 46 | G13: 46 | H13: 46 | I13: 45 | J13: 45 | K13: 44 | L13: 43 | M13: 43 | N13: 42 | O13: 41 | R13: =SUM(B13:O13)/14 -> 45.285714285714285 | S13: =SUM(I13:O13)/7-37 -> 6.2857142857142847 | T13: 6
A14: Benton | B14: 52 | C14: 52 | D14: 50 | E14: 50 | F14: 48 | G14: 47 | H14: 47 | I14: 46 | J14: 46 | K14: 46 | L14: 46 | M14: 46 | N14: 45 | O14: 45 | P14: 45 | Q14: 43 | R14: =SUM(B14:Q14)/16 -> 47.125 | S14: =SUM(J14:Q14)/8-37 -> 8.25 | T14: 8
A15: Gary | B15: 51 | C15: 49 | D15: 48 | E15: 48 | F15: 48 | G15: 47 | H15: 47 | I15: 47 | J15: 47 | K15: 46 | L15: 46 | M15: 46 | N15: 45 | O15: 45 | P15: 44 | Q15: 44 | R15: =SUM(B15:Q15)/16 -> 46.750 | S15: =SUM(J15:Q15)/8-37 -> 8.375 | T15: 8
A16: Alex | B16: 54 | C16: 53 | D16: 51 | E16: 51 | F16: 51 | G16: 50 | H16: 50 | I16: 49 | J16: 47 | K16: 46 | L16: 46 | M16: 46 | N16: 45 | O16: 44 | R16: =SUM(B16:O16)/14 -> 48.785714285714285 | S16: =SUM(I16:O16)/7-37 -> 9.1428571428571459 | T16: 9
A17: Lew | B17: 56 | C17: 53 | D17: 52 | E17: 51 | F17: 51 | G17: 51 | H17: 51 | I17: 50 | J17: 50 | K17: 49 | L17: 49 | M17: 48 | N17: 47 | O17: 46 | P17: 45 | Q17: 43 | R17: =SUM(B17:Q17)/16 -> 49.500 | S17: =SUM(J17:Q17)/8-37 -> 10.125 | T17: 10
A18: Ralph | B18: 56 | C18: 52 | D18: 51 | E18: 51 | F18: 51 | G18: 51 | H18: 51 | I18: 50 | J18: 49 | K18: 49 | L18: 48 | M18: 47 | N18: 47 | O18: 46 | P18: 45 | R18: =SUM(B18:P18)/15 -> 49.600 | S18: =SUM(I18:P18)/8-37 -> 10.625 | T18: 11
19: 4 Players | A19: John | B19: 55 | C19: 52 | D19: 52 | E19: 52 | F19: 51 | G19: 50 | H19: 50 | I19: 50 | J19: 50 | K19: 50 | L19: 50 | M19: 47 | R19: =SUM(B19:M19)/12 -> 50.750 | S19: =SUM(H19:M19)/6-37 -> 12.50 | T19: 13
A20: Bill | M20: 53 | N20: 51 | O20: 50 | R20: =SUM(B20:O20)/3 -> 51.333333333333336 | S20: =SUM(N20:O20)/2-37 -> 13.50 | T20: 14
A21: Tres | B21: 58 | C21: 55 | D21: 53 | E21: 53 | F21: 53 | G21: 52 | H21: 52 | I21: 51 | J21: 50 | K21: 50 | R21: =SUM(B21:K21)/10 -> 52.700 | S21: =SUM(G21:K21)/5-37 -> 14.00 | T21: 14
A22: Jim | B22: 63 | C22: 62 | D22: 61 | E22: 56 | F22: 55 | G22: 55 | H22: 53 | I22: 53 | J22: 52 | K22: 52 | L22: 51 | M22: 50 | N22: 50 | O22: 49 | R22: =SUM(B22:O22)/14 -> 54.428571428571431 | S22: =SUM(I22:O22)/7-37 -> 14.00 | T22: 14
A23: Bob | B23: 58 | C23: 58 | D23: 57 | E23: 56 | F23: 54 | G23: 54 | H23: 54 | I23: 53 | J23: 53 | K23: 53 | L23: 52 | M23: 52 | N23: 51 | O23: 51 | P23: 50 | Q23: 49 | R23: =SUM(B23:Q23)/16 -> 53.4375 | S23: =SUM(J23:Q23)/8-37 -> 14.375 | T23: 14
A24: Butch | B24: 61 | C24: 60 | D24: 59 | E24: 58 | F24: 55 | G24: 54 | H24: 53 | I24: 53 | J24: 53 | K24: 53 | L24: 53 | M24: 52 | N24: 49 | O24: 49 | R24: =SUM(B24:O24)/14 -> 54.428571428571431 | S24: =SUM(I24:O24)/7-37 -> 14.714285714285715 | T24: 15
A25: WEEK | B25: 1 | C25: 2 | D25: 3 | E25: 4 | F25: 5 | G25: 6 | H25: 7 | I25: 8 | J25: 9 | K25: 10 | L25: 11 | M25: 12 | N25: 13 | O25: 14 | P25: 15 | Q25: 16 | R25: All Scores | S25: 50%+ | T25: 2008