A2: =MID(CELL("filename",A1),FIND("]",CELL("filename",A1))+1,LEN(CELL("filename",A1))-FIND("]",CELL("filename",A1))) -> Individual Stats by Group
A3: =Standings!$A$4 -> 2006
A4: One Players
A5: Week | B5: 1 | C5: 2 | D5: 3 | E5: 4 | F5: 5 | G5: 6 | H5: 7 | I5: 8 | J5: 9 | K5: 10 | M5: 11 | N5: 12 | O5: 13 | P5: 14 | Q5: 15 | R5: 16 | S5: 17 | T5: 18 | U5: 19 | V5: 20 | W5: Avg. | X5: Par | Y5: Net Avg. | Z5: Rank | AA5: Low Rnd. | AB5: Max Rnd. | AC5: Low Net Rnd.
A6: ='T. Reese'!$A$1 -> T. Reese | B6: ='T. Reese'!$K$10 -> 42 | C6: ='T. Reese'!$K$11 -> 40 | D6: ='T. Reese'!$K$12 -> 43 | E6: ='T. Reese'!$K$13 -> - | F6: ='T. Reese'!$K$14 -> - | G6: ='T. Reese'!$K$21 -> 47 | H6: ='T. Reese'!$K$22 -> 42 | I6: ='T. Reese'!$K$23 -> 46 | J6: ='T. Reese'!$K$24 -> 43 | K6: ='T. Reese'!$K$25 -> 42 | M6: ='T. Reese'!$K$34 -> 45 | N6: ='T. Reese'!$K$35 -> 47 | O6: ='T. Reese'!$K$36 -> 42 | P6: ='T. Reese'!$K$37 -> 41 | Q6: ='T. Reese'!$K$38 -> 41 | R6: ='T. Reese'!$K$45 -> 39 | S6: ='T. Reese'!$K$46 -> 42 | T6: ='T. Reese'!$K$47 -> 45 | U6: ='T. Reese'!$K$48 -> - | V6: ='T. Reese'!$K$49 -> - | W6: =IF(ISERROR(AVERAGE(IF(B6:V6<>0,B6:V6,""))),"-",(AVERAGE(IF(B6:V6<>0,B6:V6,"")))) -> 42.9375 | X6: =IF(ISERROR(W6-37),"-",(W6-37)) -> 5.9375 | Y6: ='T. Reese'!$M$52 -> 38.8125 | Z6: =IF(ISERROR(RANK(Y6,Y$6:Y$16,1)),"-",RANK(Y6,Y$6:Y$16,1)) -> 5 | AA6: =IF(MIN(B6:V6)=0,"-",MIN(B6:V6)) -> 39 | AB6: =IF(MAX(C6:W6)=0,"-",MAX(C6:W6)) -> 47 | AC6: ='T. Reese'!$N$53 -> 35
A8: ='T. Wilson'!$A$1 -> T. Wilson | B8: ='T. Wilson'!$K$10 -> 43 | C8: ='T. Wilson'!$K$11 -> - | D8: ='T. Wilson'!$K$12 -> 48 | E8: ='T. Wilson'!$K$13 -> - | F8: ='T. Wilson'!$K$14 -> - | G8: ='T. Wilson'!$K$21 -> 40 | H8: ='T. Wilson'!$K$22 -> - | I8: ='T. Wilson'!$K$23 -> - | J8: ='T. Wilson'!$K$24 -> - | K8: ='T. Wilson'!$K$25 -> 38 | M8: ='T. Wilson'!$K$34 -> 42 | N8: ='T. Wilson'!$K$35 -> 40 | O8: ='T. Wilson'!$K$36 -> 42 | P8: ='T. Wilson'!$K$37 -> 44 | Q8: ='T. Wilson'!$K$38 -> 39 | R8: ='T. Wilson'!$K$45 -> - | S8: ='T. Wilson'!$K$46 -> 48 | T8: ='T. Wilson'!$K$47 -> 40 | U8: ='T. Wilson'!$K$48 -> - | V8: ='T. Wilson'!$K$49 -> - | W8: =IF(ISERROR(AVERAGE(IF(B8:V8<>0,B8:V8,""))),"-",(AVERAGE(IF(B8:V8<>0,B8:V8,"")))) -> 42.18181818181818 | X8: =IF(ISERROR(W8-37),"-",(W8-37)) -> 5.1818181818181799 | Y8: ='T. Wilson'!$M$52 -> 39.090909090909093 | Z8: =IF(ISERROR(RANK(Y8,Y$6:Y$16,1)),"-",RANK(Y8,Y$6:Y$16,1)) -> 6 | AA8: =IF(MIN(B8:V8)=0,"-",MIN(B8:V8)) -> 38 | AB8: =IF(MAX(C8:W8)=0,"-",MAX(C8:W8)) -> 48 | AC8: ='T. Wilson'!$N$53 -> 32
A10: ='M. Rutherford'!$A$1 -> M. Rutherford | B10: ='M. Rutherford'!$K$10 -> 44 | C10: ='M. Rutherford'!$K$11 -> 44 | D10: ='M. Rutherford'!$K$12 -> 40 | E10: ='M. Rutherford'!$K$13 -> 39 | F10: ='M. Rutherford'!$K$14 -> 41 | G10: ='M. Rutherford'!$K$21 -> 43 | H10: ='M. Rutherford'!$K$22 -> 44 | I10: ='M. Rutherford'!$K$23 -> 44 | J10: ='M. Rutherford'!$K$24 -> 38 | K10: ='M. Rutherford'!$K$25 -> 41 | M10: ='M. Rutherford'!$K$34 -> 41 | N10: ='M. Rutherford'!$K$35 -> 44 | O10: ='M. Rutherford'!$K$36 -> 39 | P10: ='M. Rutherford'!$K$37 -> - | Q10: ='M. Rutherford'!$K$38 -> 44 | R10: ='M. Rutherford'!$K$45 -> 42 | S10: ='M. Rutherford'!$K$46 -> 38 | T10: ='M. Rutherford'!$K$47 -> 41 | U10: ='M. Rutherford'!$K$48 -> 43 | V10: ='M. Rutherford'!$K$49 -> - | W10: =IF(ISERROR(AVERAGE(IF(B10:V10<>0,B10:V10,""))),"-",(AVERAGE(IF(B10:V10<>0,B10:V10,"")))) -> 41.666666666666664 | X10: =IF(ISERROR(W10-37),"-",(W10-37)) -> 4.6666666666666643 | Y10: ='M. Rutherford'!$M$52 -> 38.666666666666664 | Z10: =IF(ISERROR(RANK(Y10,Y$6:Y$16,1)),"-",RANK(Y10,Y$6:Y$16,1)) -> 4 | AA10: =IF(MIN(B10:V10)=0,"-",MIN(B10:V10)) -> 38 | AB10: =IF(MAX(C10:W10)=0,"-",MAX(C10:W10)) -> 44 | AC10: ='M. Rutherford'!$N$53 -> 35
A12: ='R. Keeney'!$A$1 -> R. Keeney | B12: ='R. Keeney'!$K$10 -> 46 | C12: ='R. Keeney'!$K$11 -> 39 | D12: ='R. Keeney'!$K$12 -> 42 | E12: ='R. Keeney'!$K$13 -> 39 | F12: ='R. Keeney'!$K$14 -> 44 | G12: ='R. Keeney'!$K$21 -> 41 | H12: ='R. Keeney'!$K$22 -> 41 | I12: ='R. Keeney'!$K$23 -> 42 | J12: ='R. Keeney'!$K$24 -> 44 | K12: ='R. Keeney'!$K$25 -> 40 | M12: ='R. Keeney'!$K$34 -> 41 | N12: ='R. Keeney'!$K$35 -> 41 | O12: ='R. Keeney'!$K$36 -> 44 | P12: ='R. Keeney'!$K$37 -> - | Q12: ='R. Keeney'!$K$38 -> 41 | R12: ='R. Keeney'!$K$45 -> 39 | S12: ='R. Keeney'!$K$46 -> 41 | T12: ='R. Keeney'!$K$47 -> 41 | U12: ='R. Keeney'!$K$48 -> - | V12: ='R. Keeney'!$K$49 -> - | W12: =IF(ISERROR(AVERAGE(IF(B12:V12<>0,B12:V12,""))),"-",(AVERAGE(IF(B12:V12<>0,B12:V12,"")))) -> 41.529411764705884 | X12: =IF(ISERROR(W12-37),"-",(W12-37)) -> 4.529411764705884 | Y12: ='R. Keeney'!$M$52 -> 38.529411764705884 | Z12: =IF(ISERROR(RANK(Y12,Y$6:Y$16,1)),"-",RANK(Y12,Y$6:Y$16,1)) -> 3 | AA12: =IF(MIN(B12:V12)=0,"-",MIN(B12:V12)) -> 39 | AB12: =IF(MAX(C12:W12)=0,"-",MAX(C12:W12)) -> 44 | AC12: ='R. Keeney'!$N$53 -> 36
A14: ='D. Smith'!$A$1 -> D. Smith | B14: ='D. Smith'!$K$10 -> 42 | C14: ='D. Smith'!$K$11 -> 43 | D14: ='D. Smith'!$K$12 -> 45 | E14: ='D. Smith'!$K$13 -> 41 | F14: ='D. Smith'!$K$14 -> 46 | G14: ='D. Smith'!$K$21 -> 41 | H14: ='D. Smith'!$K$22 -> 45 | I14: ='D. Smith'!$K$23 -> 40 | J14: ='D. Smith'!$K$24 -> 41 | K14: ='D. Smith'!$K$25 -> 36 | M14: ='D. Smith'!$K$34 -> 43 | N14: ='D. Smith'!$K$35 -> 41 | O14: ='D. Smith'!$K$36 -> 43 | P14: ='D. Smith'!$K$37 -> 44 | Q14: ='D. Smith'!$K$38 -> 44 | R14: ='D. Smith'!$K$45 -> 37 | S14: ='D. Smith'!$K$46 -> 41 | T14: ='D. Smith'!$K$47 -> 44 | U14: ='D. Smith'!$K$48 -> - | V14: ='D. Smith'!$K$49 -> - | W14: =IF(ISERROR(AVERAGE(IF(B14:V14<>0,B14:V14,""))),"-",(AVERAGE(IF(B14:V14<>0,B14:V14,"")))) -> 42.055555555555557 | X14: =IF(ISERROR(W14-37),"-",(W14-37)) -> 5.0555555555555571 | Y14: ='D. Smith'!$M$52 -> 38.055555555555557 | Z14: =IF(ISERROR(RANK(Y14,Y$6:Y$16,1)),"-",RANK(Y14,Y$6:Y$16,1)) -> 2 | AA14: =IF(MIN(B14:V14)=0,"-",MIN(B14:V14)) -> 36 | AB14: =IF(MAX(C14:W14)=0,"-",MAX(C14:W14)) -> 46 | AC14: ='D. Smith'!$N$53 -> 31
A16: ='R. Ours'!$A$1 -> R. Ours | B16: ='R. Ours'!$K$10 -> 37 | C16: ='R. Ours'!$K$11 -> 41 | D16: ='R. Ours'!$K$12 -> 38 | E16: ='R. Ours'!$K$13 -> 39 | F16: ='R. Ours'!$K$14 -> 38 | G16: ='R. Ours'!$K$21 -> 38 | H16: ='R. Ours'!$K$22 -> 39 | I16: ='R. Ours'!$K$23 -> 45 | J16: ='R. Ours'!$K$24 -> 41 | K16: ='R. Ours'!$K$25 -> 38 | M16: ='R. Ours'!$K$34 -> 40 | N16: ='R. Ours'!$K$35 -> 40 | O16: ='R. Ours'!$K$36 -> 40 | P16: ='R. Ours'!$K$37 -> 40 | Q16: ='R. Ours'!$K$38 -> - | R16: ='R. Ours'!$K$45 -> 40 | S16: ='R. Ours'!$K$46 -> 38 | T16: ='R. Ours'!$K$47 -> 35 | U16: ='R. Ours'!$K$48 -> 39 | V16: ='R. Ours'!$K$49 -> - | W16: =IF(ISERROR(AVERAGE(IF(B16:V16<>0,B16:V16,""))),"-",(AVERAGE(IF(B16:V16<>0,B16:V16,"")))) -> 39.222222222222221 | X16: =IF(ISERROR(W16-37),"-",(W16-37)) -> 2.2222222222222214 | Y16: ='R. Ours'!$M$52 -> 37.666666666666664 | Z16: =IF(ISERROR(RANK(Y16,Y$6:Y$16,1)),"-",RANK(Y16,Y$6:Y$16,1)) -> 1 | AA16: =IF(MIN(B16:V16)=0,"-",MIN(B16:V16)) -> 35 | AB16: =IF(MAX(C16:W16)=0,"-",MAX(C16:W16)) -> 45 | AC16: ='R. Ours'!$N$53 -> 34
X17: Lowest Round | AA17: =IF(MIN(AA6,AA8,AA10,AA12,AA14,AA16)=0,"-",MIN(AA6,AA8,AA10,AA12,AA14,AA16)) -> 35 | AB17: =IF(ISERROR(OFFSET(AA6,MATCH(AA17,$AA$6:$AA$16,0)-1,-26,1,1)),"-",OFFSET(AA6,MATCH(AA17,$AA$6:$AA$16,0)-1,-26,1,1)) -> R. Ours
A18: Two Players
A19: Week | B19: 1 | C19: 2 | D19: 3 | E19: 4 | F19: 5 | G19: 6 | H19: 7 | I19: 8 | J19: 9 | K19: 10 | M19: 11 | N19: 12 | O19: 13 | P19: 14 | Q19: 15 | R19: 16 | S19: 17 | T19: 18 | U19: 19 | V19: 20 | W19: Avg. | X19: Par | Y19: Net Avg. | Z19: Rank | AA19: Low Rnd. | AB19: Max Rnd. | AC19: Low Net Rnd.
A20: ='A. Wilks'!$A$1 -> A. Wilks | B20: ='A. Wilks'!$K$10 -> 47 | C20: ='A. Wilks'!$K$11 -> 48 | D20: ='A. Wilks'!$K$12 -> 44 | E20: ='A. Wilks'!$K$13 -> 43 | F20: ='A. Wilks'!$K$14 -> 48 | G20: ='A. Wilks'!$K$21 -> 44 | H20: ='A. Wilks'!$K$22 -> 47 | I20: ='A. Wilks'!$K$23 -> 52 | J20: ='A. Wilks'!$K$24 -> 45 | K20: ='A. Wilks'!$K$25 -> 45 | M20: ='A. Wilks'!$K$34 -> 47 | N20: ='A. Wilks'!$K$35 -> 46 | O20: ='A. Wilks'!$K$36 -> 47 | P20: ='A. Wilks'!$K$37 -> 45 | Q20: ='A. Wilks'!$K$38 -> 45 | R20: ='A. Wilks'!$K$45 -> 50 | S20: ='A. Wilks'!$K$46 -> 51 | T20: ='A. Wilks'!$K$47 -> 42 | U20: ='A. Wilks'!$K$48 -> - | V20: ='A. Wilks'!$K$49 -> - | W20: =IF(ISERROR(AVERAGE(IF(B20:V20<>0,B20:V20,""))),"-",(AVERAGE(IF(B20:V20<>0,B20:V20,"")))) -> 46.444444444444443 | X20: =IF(ISERROR(W20-37),"-",(W20-37)) -> 9.4444444444444429 | Y20: ='A. Wilks'!$M$52 -> 39.00 | Z20: =IF(ISERROR(RANK(Y20,Y$20:Y$30,1)),"-",RANK(Y20,Y$20:Y$30,1)) -> 2 | AA20: =IF(MIN(B20:V20)=0,"-",MIN(B20:V20)) -> 42 | AB20: =IF(MAX(C20:W20)=0,"-",MAX(C20:W20)) -> 52 | AC20: ='A. Wilks'!$N$53 -> 34
A22: ='B. Craig'!$A$1 -> B. Craig | B22: ='B. Craig'!$K$10 -> 42 | C22: ='B. Craig'!$K$11 -> 49 | D22: ='B. Craig'!$K$12 -> 49 | E22: ='B. Craig'!$K$13 -> 44 | F22: ='B. Craig'!$K$14 -> 48 | G22: ='B. Craig'!$K$21 -> 42 | H22: ='B. Craig'!$K$22 -> 45 | I22: ='B. Craig'!$K$23 -> 46 | J22: ='B. Craig'!$K$24 -> - | K22: ='B. Craig'!$K$25 -> - | M22: ='B. Craig'!$K$34 -> 45 | N22: ='B. Craig'!$K$35 -> 44 | O22: ='B. Craig'!$K$36 -> 45 | P22: ='B. Craig'!$K$37 -> 45 | Q22: ='B. Craig'!$K$38 -> 43 | R22: ='B. Craig'!$K$45 -> 44 | S22: ='B. Craig'!$K$46 -> 47 | T22: ='B. Craig'!$K$47 -> - | U22: ='B. Craig'!$K$48 -> - | V22: ='B. Craig'!$K$49 -> - | W22: =IF(ISERROR(AVERAGE(IF(B22:V22<>0,B22:V22,""))),"-",(AVERAGE(IF(B22:V22<>0,B22:V22,"")))) -> 45.20 | X22: =IF(ISERROR(W22-37),"-",(W22-37)) -> 8.20 | Y22: ='B. Craig'!$M$52 -> 39.00 | Z22: =IF(ISERROR(RANK(Y22,Y$20:Y$30,1)),"-",RANK(Y22,Y$20:Y$30,1)) -> 2 | AA22: =IF(MIN(B22:V22)=0,"-",MIN(B22:V22)) -> 42 | AB22: =IF(MAX(C22:W22)=0,"-",MAX(C22:W22)) -> 49 | AC22: ='B. Craig'!$N$53 -> 34
A24: ='M. McComas'!$A$1 -> M. McComas | B24: ='M. McComas'!$K$10 -> 43 | C24: ='M. McComas'!$K$11 -> 42 | D24: ='M. McComas'!$K$12 -> 48 | E24: ='M. McComas'!$K$13 -> 41 | F24: ='M. McComas'!$K$14 -> - | G24: ='M. McComas'!$K$21 -> 47 | H24: ='M. McComas'!$K$22 -> 47 | I24: ='M. McComas'!$K$23 -> 42 | J24: ='M. McComas'!$K$24 -> 45 | K24: ='M. McComas'!$K$25 -> 43 | M24: ='M. McComas'!$K$34 -> 45 | N24: ='M. McComas'!$K$35 -> 50 | O24: ='M. McComas'!$K$36 -> 46 | P24: ='M. McComas'!$K$37 -> 42 | Q24: ='M. McComas'!$K$38 -> 48 | R24: ='M. McComas'!$K$45 -> - | S24: ='M. McComas'!$K$46 -> 45 | T24: ='M. McComas'!$K$47 -> 44 | U24: ='M. McComas'!$K$48 -> 41 | V24: ='M. McComas'!$K$49 -> - | W24: =IF(ISERROR(AVERAGE(IF(B24:V24<>0,B24:V24,""))),"-",(AVERAGE(IF(B24:V24<>0,B24:V24,"")))) -> 44.647058823529413 | X24: =IF(ISERROR(W24-37),"-",(W24-37)) -> 7.647058823529413 | Y24: ='M. McComas'!$M$52 -> 39.705882352941174 | Z24: =IF(ISERROR(RANK(Y24,Y$20:Y$30,1)),"-",RANK(Y24,Y$20:Y$30,1)) -> 6 | AA24: =IF(MIN(B24:V24)=0,"-",MIN(B24:V24)) -> 41 | AB24: =IF(MAX(C24:W24)=0,"-",MAX(C24:W24)) -> 50 | AC24: ='M. McComas'!$N$53 -> 35
A26: ='T. Proctor'!$A$1 -> T. Proctor | B26: ='T. Proctor'!$K$10 -> 41 | C26: ='T. Proctor'!$K$11 -> 50 | D26: ='T. Proctor'!$K$12 -> 44 | E26: ='T. Proctor'!$K$13 -> 41 | F26: ='T. Proctor'!$K$14 -> 44 | G26: ='T. Proctor'!$K$21 -> 47 | H26: ='T. Proctor'!$K$22 -> 42 | I26: ='T. Proctor'!$K$23 -> 43 | J26: ='T. Proctor'!$K$24 -> - | K26: ='T. Proctor'!$K$25 -> 45 | M26: ='T. Proctor'!$K$34 -> 45 | N26: ='T. Proctor'!$K$35 -> 46 | O26: ='T. Proctor'!$K$36 -> 46 | P26: ='T. Proctor'!$K$37 -> 43 | Q26: ='T. Proctor'!$K$38 -> 45 | R26: ='T. Proctor'!$K$45 -> 42 | S26: ='T. Proctor'!$K$46 -> 45 | T26: ='T. Proctor'!$K$47 -> 45 | U26: ='T. Proctor'!$K$48 -> 44 | V26: ='T. Proctor'!$K$49 -> - | W26: =IF(ISERROR(AVERAGE(IF(B26:V26<>0,B26:V26,""))),"-",(AVERAGE(IF(B26:V26<>0,B26:V26,"")))) -> 44.333333333333336 | X26: =IF(ISERROR(W26-37),"-",(W26-37)) -> 7.3333333333333357 | Y26: ='T. Proctor'!$M$52 -> 39.388888888888886 | Z26: =IF(ISERROR(RANK(Y26,Y$20:Y$30,1)),"-",RANK(Y26,Y$20:Y$30,1)) -> 5 | AA26: =IF(MIN(B26:V26)=0,"-",MIN(B26:V26)) -> 41 | AB26: =IF(MAX(C26:W26)=0,"-",MAX(C26:W26)) -> 50 | AC26: ='T. Proctor'!$N$53 -> 36
A28: ='G. White'!$A$1 -> G. White | B28: ='G. White'!$K$10 -> 44 | C28: ='G. White'!$K$11 -> 45 | D28: ='G. White'!$K$12 -> 42 | E28: ='G. White'!$K$13 -> - | F28: ='G. White'!$K$14 -> 40 | G28: ='G. White'!$K$21 -> 46 | H28: ='G. White'!$K$22 -> 45 | I28: ='G. White'!$K$23 -> 42 | J28: ='G. White'!$K$24 -> 41 | K28: ='G. White'!$K$25 -> 44 | M28: ='G. White'!$K$34 -> 43 | N28: ='G. White'!$K$35 -> 43 | O28: ='G. White'!$K$36 -> 43 | P28: ='G. White'!$K$37 -> 44 | Q28: ='G. White'!$K$38 -> 39 | R28: ='G. White'!$K$45 -> 44 | S28: ='G. White'!$K$46 -> 39 | T28: ='G. White'!$K$47 -> 43 | U28: ='G. White'!$K$48 -> 45 | V28: ='G. White'!$K$49 -> - | W28: =IF(ISERROR(AVERAGE(IF(B28:V28<>0,B28:V28,""))),"-",(AVERAGE(IF(B28:V28<>0,B28:V28,"")))) -> 42.888888888888886 | X28: =IF(ISERROR(W28-37),"-",(W28-37)) -> 5.8888888888888857 | Y28: ='G. White'!$M$52 -> 38.611111111111114 | Z28: =IF(ISERROR(RANK(Y28,Y$20:Y$30,1)),"-",RANK(Y28,Y$20:Y$30,1)) -> 1 | AA28: =IF(MIN(B28:V28)=0,"-",MIN(B28:V28)) -> 39 | AB28: =IF(MAX(C28:W28)=0,"-",MAX(C28:W28)) -> 46 | AC28: ='G. White'!$N$53 -> 34
A30: ='T. Way'!$A$1 -> T. Way | B30: ='T. Way'!$K$10 -> 41 | C30: ='T. Way'!$K$11 -> 45 | D30: ='T. Way'!$K$12 -> 49 | E30: ='T. Way'!$K$13 -> 43 | F30: ='T. Way'!$K$14 -> 47 | G30: ='T. Way'!$K$21 -> 45 | H30: ='T. Way'!$K$22 -> 46 | I30: ='T. Way'!$K$23 -> 44 | J30: ='T. Way'!$K$24 -> 45 | K30: ='T. Way'!$K$25 -> - | M30: ='T. Way'!$K$34 -> - | N30: ='T. Way'!$K$35 -> 47 | O30: ='T. Way'!$K$36 -> 48 | P30: ='T. Way'!$K$37 -> 41 | Q30: ='T. Way'!$K$38 -> 49 | R30: ='T. Way'!$K$45 -> 45 | S30: ='T. Way'!$K$46 -> 43 | T30: ='T. Way'!$K$47 -> 48 | U30: ='T. Way'!$K$48 -> 42 | V30: ='T. Way'!$K$49 -> - | W30: =IF(ISERROR(AVERAGE(IF(B30:V30<>0,B30:V30,""))),"-",(AVERAGE(IF(B30:V30<>0,B30:V30,"")))) -> 45.176470588235297 | X30: =IF(ISERROR(W30-37),"-",(W30-37)) -> 8.176470588235297 | Y30: ='T. Way'!$M$52 -> 39.235294117647058 | Z30: =IF(ISERROR(RANK(Y30,Y$20:Y$30,1)),"-",RANK(Y30,Y$20:Y$30,1)) -> 4 | AA30: =IF(MIN(B30:V30)=0,"-",MIN(B30:V30)) -> 41 | AB30: =IF(MAX(C30:W30)=0,"-",MAX(C30:W30)) -> 49 | AC30: ='T. Way'!$N$53 -> 34
X31: Lowest Round | AA31: =IF(MIN(AA20,AA22,AA24,AA26,AA28,AA30)=0,"-",MIN(AA20,AA22,AA24,AA26,AA28,AA30)) -> 39 | AB31: =IF(ISERROR(OFFSET(AA20,MATCH(AA31,$AA$20:$AA$30,0)-1,-26,1,1)),"-",OFFSET(AA20,MATCH(AA31,$AA$20:$AA$30,0)-1,-26,1,1)) -> G. White
A32: Three Players
A33: Week | B33: 1 | C33: 2 | D33: 3 | E33: 4 | F33: 5 | G33: 6 | H33: 7 | I33: 8 | J33: 9 | K33: 10 | M33: 11 | N33: 12 | O33: 13 | P33: 14 | Q33: 15 | R33: 16 | S33: 17 | T33: 18 | U33: 19 | V33: 20 | W33: Avg. | X33: Par | Y33: Net Avg. | Z33: Rank | AA33: Low Rnd. | AB33: Max Rnd. | AC33: Low Net Rnd.
A34: ='B. Meadows'!$A$1 -> B. Meadows | B34: ='B. Meadows'!$K$10 -> 49 | C34: ='B. Meadows'!$K$11 -> 51 | D34: ='B. Meadows'!$K$12 -> - | E34: ='B. Meadows'!$K$13 -> 56 | F34: ='B. Meadows'!$K$14 -> 51 | G34: ='B. Meadows'!$K$21 -> 50 | H34: ='B. Meadows'!$K$22 -> 51 | I34: ='B. Meadows'!$K$23 -> - | J34: ='B. Meadows'!$K$24 -> 47 | K34: ='B. Meadows'!$K$25 -> 49 | M34: ='B. Meadows'!$K$34 -> 52 | N34: ='B. Meadows'!$K$35 -> 50 | O34: ='B. Meadows'!$K$36 -> 50 | P34: ='B. Meadows'!$K$37 -> 48 | Q34: ='B. Meadows'!$K$38 -> 46 | R34: ='B. Meadows'!$K$45 -> 53 | S34: ='B. Meadows'!$K$46 -> 49 | T34: ='B. Meadows'!$K$47 -> 55 | U34: ='B. Meadows'!$K$48 -> - | V34: ='B. Meadows'!$K$49 -> - | W34: =IF(ISERROR(AVERAGE(IF(B34:V34<>0,B34:V34,""))),"-",(AVERAGE(IF(B34:V34<>0,B34:V34,"")))) -> 50.4375 | X34: =IF(ISERROR(W34-37),"-",(W34-37)) -> 13.4375 | Y34: ='B. Meadows'!$M$52 -> 39.125 | Z34: =IF(ISERROR(RANK(Y34,Y$34:Y$44,1)),"-",RANK(Y34,Y$34:Y$44,1)) -> 4 | AA34: =IF(MIN(B34:V34)=0,"-",MIN(B34:V34)) -> 46 | AB34: =IF(MAX(C34:W34)=0,"-",MAX(C34:W34)) -> 56 | AC34: ='B. Meadows'!$N$53 -> 34
A36: ='B. Hall'!$A$1 -> B. Hall | B36: ='B. Hall'!$K$10 -> 43 | C36: ='B. Hall'!$K$11 -> 49 | D36: ='B. Hall'!$K$12 -> 46 | E36: ='B. Hall'!$K$13 -> 49 | F36: ='B. Hall'!$K$14 -> 47 | G36: ='B. Hall'!$K$21 -> 52 | H36: ='B. Hall'!$K$22 -> 50 | I36: ='B. Hall'!$K$23 -> 57 | J36: ='B. Hall'!$K$24 -> 50 | K36: ='B. Hall'!$K$25 -> 51 | M36: ='B. Hall'!$K$34 -> 49 | N36: ='B. Hall'!$K$35 -> 52 | O36: ='B. Hall'!$K$36 -> 54 | P36: ='B. Hall'!$K$37 -> 51 | Q36: ='B. Hall'!$K$38 -> 48 | R36: ='B. Hall'!$K$45 -> 46 | S36: ='B. Hall'!$K$46 -> 50 | T36: ='B. Hall'!$K$47 -> 47 | U36: ='B. Hall'!$K$48 -> 52 | V36: ='B. Hall'!$K$49 -> - | W36: =IF(ISERROR(AVERAGE(IF(B36:V36<>0,B36:V36,""))),"-",(AVERAGE(IF(B36:V36<>0,B36:V36,"")))) -> 49.631578947368418 | X36: =IF(ISERROR(W36-37),"-",(W36-37)) -> 12.631578947368418 | Y36: ='B. Hall'!$M$52 -> 39.94736842105263 | Z36: =IF(ISERROR(RANK(Y36,Y$34:Y$44,1)),"-",RANK(Y36,Y$34:Y$44,1)) -> 6 | AA36: =IF(MIN(B36:V36)=0,"-",MIN(B36:V36)) -> 43 | AB36: =IF(MAX(C36:W36)=0,"-",MAX(C36:W36)) -> 57 | AC36: ='B. Hall'!$N$53 -> 33
A38: ='M. Kyle'!$A$1 -> M. Kyle | B38: ='M. Kyle'!$K$10 -> 52 | C38: ='M. Kyle'!$K$11 -> 46 | D38: ='M. Kyle'!$K$12 -> 48 | E38: ='M. Kyle'!$K$13 -> 46 | F38: ='M. Kyle'!$K$14 -> 45 | G38: ='M. Kyle'!$K$21 -> 49 | H38: ='M. Kyle'!$K$22 -> 49 | I38: ='M. Kyle'!$K$23 -> 51 | J38: ='M. Kyle'!$K$24 -> 46 | K38: ='M. Kyle'!$K$25 -> 44 | M38: ='M. Kyle'!$K$34 -> 52 | N38: ='M. Kyle'!$K$35 -> 55 | O38: ='M. Kyle'!$K$36 -> 42 | P38: ='M. Kyle'!$K$37 -> 47 | Q38: ='M. Kyle'!$K$38 -> 51 | R38: ='M. Kyle'!$K$45 -> 41 | S38: ='M. Kyle'!$K$46 -> - | T38: ='M. Kyle'!$K$47 -> 48 | U38: ='M. Kyle'!$K$48 -> 50 | V38: ='M. Kyle'!$K$49 -> - | W38: =IF(ISERROR(AVERAGE(IF(B38:V38<>0,B38:V38,""))),"-",(AVERAGE(IF(B38:V38<>0,B38:V38,"")))) -> 47.888888888888886 | X38: =IF(ISERROR(W38-37),"-",(W38-37)) -> 10.888888888888886 | Y38: ='M. Kyle'!$M$52 -> 39.166666666666664 | Z38: =IF(ISERROR(RANK(Y38,Y$34:Y$44,1)),"-",RANK(Y38,Y$34:Y$44,1)) -> 5 | AA38: =IF(MIN(B38:V38)=0,"-",MIN(B38:V38)) -> 41 | AB38: =IF(MAX(C38:W38)=0,"-",MAX(C38:W38)) -> 55 | AC38: ='M. Kyle'!$N$53 -> 32
A40: ='S. Jones'!$A$1 -> S. Jones | B40: ='S. Jones'!$K$10 -> 47 | C40: ='S. Jones'!$K$11 -> 48 | D40: ='S. Jones'!$K$12 -> 43 | E40: ='S. Jones'!$K$13 -> 44 | F40: ='S. Jones'!$K$14 -> 47 | G40: ='S. Jones'!$K$21 -> 50 | H40: ='S. Jones'!$K$22 -> 44 | I40: ='S. Jones'!$K$23 -> 47 | J40: ='S. Jones'!$K$24 -> 50 | K40: ='S. Jones'!$K$25 -> 42 | M40: ='S. Jones'!$K$34 -> 48 | N40: ='S. Jones'!$K$35 -> 42 | O40: ='S. Jones'!$K$36 -> 44 | P40: ='S. Jones'!$K$37 -> 47 | Q40: ='S. Jones'!$K$38 -> 46 | R40: ='S. Jones'!$K$45 -> 48 | S40: ='S. Jones'!$K$46 -> 46 | T40: ='S. Jones'!$K$47 -> 48 | U40: ='S. Jones'!$K$48 -> 46 | V40: ='S. Jones'!$K$49 -> - | W40: =IF(ISERROR(AVERAGE(IF(B40:V40<>0,B40:V40,""))),"-",(AVERAGE(IF(B40:V40<>0,B40:V40,"")))) -> 46.157894736842103 | X40: =IF(ISERROR(W40-37),"-",(W40-37)) -> 9.1578947368421026 | Y40: ='S. Jones'!$M$52 -> 38.631578947368418 | Z40: =IF(ISERROR(RANK(Y40,Y$34:Y$44,1)),"-",RANK(Y40,Y$34:Y$44,1)) -> 2 | AA40: =IF(MIN(B40:V40)=0,"-",MIN(B40:V40)) -> 42 | AB40: =IF(MAX(C40:W40)=0,"-",MAX(C40:W40)) -> 50 | AC40: ='S. Jones'!$N$53 -> 34
A42: ='G. Taylor'!$A$1 -> G. Taylor | B42: ='G. Taylor'!$K$10 -> 48 | C42: ='G. Taylor'!$K$11 -> 51 | D42: ='G. Taylor'!$K$12 -> 54 | E42: ='G. Taylor'!$K$13 -> 50 | F42: ='G. Taylor'!$K$14 -> 49 | G42: ='G. Taylor'!$K$21 -> 43 | H42: ='G. Taylor'!$K$22 -> 52 | I42: ='G. Taylor'!$K$23 -> 53 | J42: ='G. Taylor'!$K$24 -> 46 | K42: ='G. Taylor'!$K$25 -> 47 | M42: ='G. Taylor'!$K$34 -> 50 | N42: ='G. Taylor'!$K$35 -> 51 | O42: ='G. Taylor'!$K$36 -> 46 | P42: ='G. Taylor'!$K$37 -> 47 | Q42: ='G. Taylor'!$K$38 -> 45 | R42: ='G. Taylor'!$K$45 -> 49 | S42: ='G. Taylor'!$K$46 -> 47 | T42: ='G. Taylor'!$K$47 -> 48 | U42: ='G. Taylor'!$K$48 -> 50 | V42: ='G. Taylor'!$K$49 -> - | W42: =IF(ISERROR(AVERAGE(IF(B42:V42<>0,B42:V42,""))),"-",(AVERAGE(IF(B42:V42<>0,B42:V42,"")))) -> 48.736842105263158 | X42: =IF(ISERROR(W42-37),"-",(W42-37)) -> 11.736842105263158 | Y42: ='G. Taylor'!$M$52 -> 38.684210526315788 | Z42: =IF(ISERROR(RANK(Y42,Y$34:Y$44,1)),"-",RANK(Y42,Y$34:Y$44,1)) -> 3 | AA42: =IF(MIN(B42:V42)=0,"-",MIN(B42:V42)) -> 43 | AB42: =IF(MAX(C42:W42)=0,"-",MAX(C42:W42)) -> 54 | AC42: ='G. Taylor'!$N$53 -> 31
A44: ='L. Baumgarner'!$A$1 -> L. Baumgarner | B44: ='L. Baumgarner'!$K$10 -> 50 | C44: ='L. Baumgarner'!$K$11 -> 54 | D44: ='L. Baumgarner'!$K$12 -> 50 | E44: ='L. Baumgarner'!$K$13 -> 51 | F44: ='L. Baumgarner'!$K$14 -> 52 | G44: ='L. Baumgarner'!$K$21 -> 50 | H44: ='L. Baumgarner'!$K$22 -> 47 | I44: ='L. Baumgarner'!$K$23 -> 52 | J44: ='L. Baumgarner'!$K$24 -> 51 | K44: ='L. Baumgarner'!$K$25 -> 55 | M44: ='L. Baumgarner'!$K$34 -> 45 | N44: ='L. Baumgarner'!$K$35 -> 49 | O44: ='L. Baumgarner'!$K$36 -> 46 | P44: ='L. Baumgarner'!$K$37 -> 52 | Q44: ='L. Baumgarner'!$K$38 -> 47 | R44: ='L. Baumgarner'!$K$45 -> 49 | S44: ='L. Baumgarner'!$K$46 -> 48 | T44: ='L. Baumgarner'!$K$47 -> 53 | U44: ='L. Baumgarner'!$K$48 -> - | V44: ='L. Baumgarner'!$K$49 -> - | W44: =IF(ISERROR(AVERAGE(IF(B44:V44<>0,B44:V44,""))),"-",(AVERAGE(IF(B44:V44<>0,B44:V44,"")))) -> 50.055555555555557 | X44: =IF(ISERROR(W44-37),"-",(W44-37)) -> 13.055555555555557 | Y44: ='L. Baumgarner'!$M$52 -> 38.50 | Z44: =IF(ISERROR(RANK(Y44,Y$34:Y$44,1)),"-",RANK(Y44,Y$34:Y$44,1)) -> 1 | AA44: =IF(MIN(B44:V44)=0,"-",MIN(B44:V44)) -> 45 | AB44: =IF(MAX(C44:W44)=0,"-",MAX(C44:W44)) -> 55 | AC44: ='L. Baumgarner'!$N$53 -> 32
X45: Lowest Round | AA45: =IF(MIN(AA34,AA36,AA38,AA40,AA42,AA44)=0,"-",MIN(AA34,AA36,AA38,AA40,AA42,AA44)) -> 41 | AB45: =IF(ISERROR(OFFSET(AA34,MATCH(AA45,$AA$34:$AA$44,0)-1,-26,1,1)),"-",OFFSET(AA34,MATCH(AA45,$AA$34:$AA$44,0)-1,-26,1,1)) -> M. Kyle
A46: Four Players
A47: Week | B47: 1 | C47: 2 | D47: 3 | E47: 4 | F47: 5 | G47: 6 | H47: 7 | I47: 8 | J47: 9 | K47: 10 | M47: 11 | N47: 12 | O47: 13 | P47: 14 | Q47: 15 | R47: 16 | S47: 17 | T47: 18 | U47: 19 | V47: 20 | W47: Avg. | X47: Par | Y47: Net Avg. | Z47: Rank | AA47: Low Rnd. | AB47: Max Rnd. | AC47: Low Net Rnd.
A48: ='L. Chiles'!$A$1 -> L. Chiles | B48: ='L. Chiles'!$K$10 -> 54 | C48: ='L. Chiles'!$K$11 -> 57 | D48: ='L. Chiles'!$K$12 -> 50 | E48: ='L. Chiles'!$K$13 -> 54 | F48: ='L. Chiles'!$K$14 -> - | G48: ='L. Chiles'!$K$21 -> 57 | H48: ='L. Chiles'!$K$22 -> 53 | I48: ='L. Chiles'!$K$23 -> 55 | J48: ='L. Chiles'!$K$24 -> 51 | K48: ='L. Chiles'!$K$25 -> 53 | M48: ='L. Chiles'!$K$34 -> 55 | N48: ='L. Chiles'!$K$35 -> 55 | O48: ='L. Chiles'!$K$36 -> 52 | P48: ='L. Chiles'!$K$37 -> 51 | Q48: ='L. Chiles'!$K$38 -> 52 | R48: ='L. Chiles'!$K$45 -> 56 | S48: ='L. Chiles'!$K$46 -> - | T48: ='L. Chiles'!$K$47 -> - | U48: ='L. Chiles'!$K$48 -> - | V48: ='L. Chiles'!$K$49 -> - | W48: =IF(ISERROR(AVERAGE(IF(B48:V48<>0,B48:V48,""))),"-",(AVERAGE(IF(B48:V48<>0,B48:V48,"")))) -> 53.666666666666664 | X48: =IF(ISERROR(W48-37),"-",(W48-37)) -> 16.666666666666664 | Y48: ='L. Chiles'!$M$52 -> 38.93333333333333 | Z48: =IF(ISERROR(RANK(Y48,Y$48:Y$58,1)),"-",RANK(Y48,Y$48:Y$58,1)) -> 3 | AA48: =IF(MIN(B48:V48)=0,"-",MIN(B48:V48)) -> 50 | AB48: =IF(MAX(C48:W48)=0,"-",MAX(C48:W48)) -> 57 | AC48: ='L. Chiles'!$N$53 -> 36
A50: ='J. Landers'!$A$1 -> J. Landers | B50: ='J. Landers'!$K$10 -> 57 | C50: ='J. Landers'!$K$11 -> 48 | D50: ='J. Landers'!$K$12 -> 53 | E50: ='J. Landers'!$K$13 -> 51 | F50: ='J. Landers'!$K$14 -> 47 | G50: ='J. Landers'!$K$21 -> 50 | H50: ='J. Landers'!$K$22 -> 44 | I50: ='J. Landers'!$K$23 -> 50 | J50: ='J. Landers'!$K$24 -> 49 | K50: ='J. Landers'!$K$25 -> - | M50: ='J. Landers'!$K$34 -> 51 | N50: ='J. Landers'!$K$35 -> 52 | O50: ='J. Landers'!$K$36 -> - | P50: ='J. Landers'!$K$37 -> 52 | Q50: ='J. Landers'!$K$38 -> 64 | R50: ='J. Landers'!$K$45 -> 52 | S50: ='J. Landers'!$K$46 -> 50 | T50: ='J. Landers'!$K$47 -> 51 | U50: ='J. Landers'!$K$48 -> 58 | V50: ='J. Landers'!$K$49 -> - | W50: =IF(ISERROR(AVERAGE(IF(B50:V50<>0,B50:V50,""))),"-",(AVERAGE(IF(B50:V50<>0,B50:V50,"")))) -> 51.705882352941174 | X50: =IF(ISERROR(W50-37),"-",(W50-37)) -> 14.705882352941174 | Y50: ='J. Landers'!$M$52 -> 40.470588235294116 | Z50: =IF(ISERROR(RANK(Y50,Y$48:Y$58,1)),"-",RANK(Y50,Y$48:Y$58,1)) -> 6 | AA50: =IF(MIN(B50:V50)=0,"-",MIN(B50:V50)) -> 44 | AB50: =IF(MAX(C50:W50)=0,"-",MAX(C50:W50)) -> 64 | AC50: ='J. Landers'!$N$53 -> 32
A52: ='B. Kyle'!$A$1 -> B. Kyle | B52: ='B. Kyle'!$K$10 -> 54 | C52: ='B. Kyle'!$K$11 -> 53 | D52: ='B. Kyle'!$K$12 -> 60 | E52: ='B. Kyle'!$K$13 -> 55 | F52: ='B. Kyle'!$K$14 -> 50 | G52: ='B. Kyle'!$K$21 -> 52 | H52: ='B. Kyle'!$K$22 -> 52 | I52: ='B. Kyle'!$K$23 -> 53 | J52: ='B. Kyle'!$K$24 -> 47 | K52: ='B. Kyle'!$K$25 -> 51 | M52: ='B. Kyle'!$K$34 -> 51 | N52: ='B. Kyle'!$K$35 -> 55 | O52: ='B. Kyle'!$K$36 -> 49 | P52: ='B. Kyle'!$K$37 -> 56 | Q52: ='B. Kyle'!$K$38 -> 58 | R52: ='B. Kyle'!$K$45 -> 52 | S52: ='B. Kyle'!$K$46 -> 56 | T52: ='B. Kyle'!$K$47 -> 46 | U52: ='B. Kyle'!$K$48 -> - | V52: ='B. Kyle'!$K$49 -> - | W52: =IF(ISERROR(AVERAGE(IF(B52:V52<>0,B52:V52,""))),"-",(AVERAGE(IF(B52:V52<>0,B52:V52,"")))) -> 52.777777777777779 | X52: =IF(ISERROR(W52-37),"-",(W52-37)) -> 15.777777777777779 | Y52: ='B. Kyle'!$M$52 -> 38.50 | Z52: =IF(ISERROR(RANK(Y52,Y$48:Y$58,1)),"-",RANK(Y52,Y$48:Y$58,1)) -> 1 | AA52: =IF(MIN(B52:V52)=0,"-",MIN(B52:V52)) -> 46 | AB52: =IF(MAX(C52:W52)=0,"-",MAX(C52:W52)) -> 60 | AC52: ='B. Kyle'!$N$53 -> 32
A54: ='T. Baumgarner'!$A$1 -> T. Baumgarner | B54: ='T. Baumgarner'!$K$10 -> 43 | C54: ='T. Baumgarner'!$K$11 -> 54 | D54: ='T. Baumgarner'!$K$12 -> 50 | E54: ='T. Baumgarner'!$K$13 -> 52 | F54: ='T. Baumgarner'!$K$14 -> 57 | G54: ='T. Baumgarner'!$K$21 -> 49 | H54: ='T. Baumgarner'!$K$22 -> 52 | I54: ='T. Baumgarner'!$K$23 -> 47 | J54: ='T. Baumgarner'!$K$24 -> - | K54: ='T. Baumgarner'!$K$25 -> 48 | M54: ='T. Baumgarner'!$K$34 -> 52 | N54: ='T. Baumgarner'!$K$35 -> 51 | O54: ='T. Baumgarner'!$K$36 -> 49 | P54: ='T. Baumgarner'!$K$37 -> 50 | Q54: ='T. Baumgarner'!$K$38 -> 53 | R54: ='T. Baumgarner'!$K$45 -> 57 | S54: ='T. Baumgarner'!$K$46 -> 54 | T54: ='T. Baumgarner'!$K$47 -> 56 | U54: ='T. Baumgarner'!$K$48 -> - | V54: ='T. Baumgarner'!$K$49 -> - | W54: =IF(ISERROR(AVERAGE(IF(B54:V54<>0,B54:V54,""))),"-",(AVERAGE(IF(B54:V54<>0,B54:V54,"")))) -> 51.411764705882355 | X54: =IF(ISERROR(W54-37),"-",(W54-37)) -> 14.411764705882355 | Y54: ='T. Baumgarner'!$M$52 -> 40.411764705882355 | Z54: =IF(ISERROR(RANK(Y54,Y$48:Y$58,1)),"-",RANK(Y54,Y$48:Y$58,1)) -> 5 | AA54: =IF(MIN(B54:V54)=0,"-",MIN(B54:V54)) -> 43 | AB54: =IF(MAX(C54:W54)=0,"-",MAX(C54:W54)) -> 57 | AC54: ='T. Baumgarner'!$N$53 -> 31
A56: ='B. Harbour'!$A$1 -> B. Harbour | B56: ='B. Harbour'!$K$10 -> 54 | C56: ='B. Harbour'!$K$11 -> 57 | D56: ='B. Harbour'!$K$12 -> 58 | E56: ='B. Harbour'!$K$13 -> 51 | F56: ='B. Harbour'!$K$14 -> 55 | G56: ='B. Harbour'!$K$21 -> 60 | H56: ='B. Harbour'!$K$22 -> 53 | I56: ='B. Harbour'!$K$23 -> 54 | J56: ='B. Harbour'!$K$24 -> 55 | K56: ='B. Harbour'!$K$25 -> 58 | M56: ='B. Harbour'!$K$34 -> 50 | N56: ='B. Harbour'!$K$35 -> 58 | O56: ='B. Harbour'!$K$36 -> 58 | P56: ='B. Harbour'!$K$37 -> 50 | Q56: ='B. Harbour'!$K$38 -> 53 | R56: ='B. Harbour'!$K$45 -> 53 | S56: ='B. Harbour'!$K$46 -> 47 | T56: ='B. Harbour'!$K$47 -> 54 | U56: ='B. Harbour'!$K$48 -> 50 | V56: ='B. Harbour'!$K$49 -> - | W56: =IF(ISERROR(AVERAGE(IF(B56:V56<>0,B56:V56,""))),"-",(AVERAGE(IF(B56:V56<>0,B56:V56,"")))) -> 54.10526315789474 | X56: =IF(ISERROR(W56-37),"-",(W56-37)) -> 17.10526315789474 | Y56: ='B. Harbour'!$M$52 -> 38.89473684210526 | Z56: =IF(ISERROR(RANK(Y56,Y$48:Y$58,1)),"-",RANK(Y56,Y$48:Y$58,1)) -> 2 | AA56: =IF(MIN(B56:V56)=0,"-",MIN(B56:V56)) -> 47 | AB56: =IF(MAX(C56:W56)=0,"-",MAX(C56:W56)) -> 60 | AC56: ='B. Harbour'!$N$53 -> 31
A58: ='J. Dodrill'!$A$1 -> J. Dodrill | B58: ='J. Dodrill'!$K$10 -> 50 | C58: ='J. Dodrill'!$K$11 -> 57 | D58: ='J. Dodrill'!$K$12 -> 51 | E58: ='J. Dodrill'!$K$13 -> 53 | F58: ='J. Dodrill'!$K$14 -> - | G58: ='J. Dodrill'!$K$21 -> 55 | H58: ='J. Dodrill'!$K$22 -> - | I58: ='J. Dodrill'!$K$23 -> 52 | J58: ='J. Dodrill'!$K$24 -> 54 | K58: ='J. Dodrill'!$K$25 -> - | M58: ='J. Dodrill'!$K$34 -> 55 | N58: ='J. Dodrill'!$K$35 -> 56 | O58: ='J. Dodrill'!$K$36 -> 50 | P58: ='J. Dodrill'!$K$37 -> 53 | Q58: ='J. Dodrill'!$K$38 -> 58 | R58: ='J. Dodrill'!$K$45 -> 50 | S58: ='J. Dodrill'!$K$46 -> 51 | T58: ='J. Dodrill'!$K$47 -> 53 | U58: ='J. Dodrill'!$K$48 -> 58 | V58: ='J. Dodrill'!$K$49 -> - | W58: =IF(ISERROR(AVERAGE(IF(B58:V58<>0,B58:V58,""))),"-",(AVERAGE(IF(B58:V58<>0,B58:V58,"")))) -> 53.50 | X58: =IF(ISERROR(W58-37),"-",(W58-37)) -> 16.50 | Y58: ='J. Dodrill'!$M$52 -> 38.9375 | Z58: =IF(ISERROR(RANK(Y58,Y$48:Y$58,1)),"-",RANK(Y58,Y$48:Y$58,1)) -> 4 | AA58: =IF(MIN(B58:V58)=0,"-",MIN(B58:V58)) -> 50 | AB58: =IF(MAX(C58:W58)=0,"-",MAX(C58:W58)) -> 58 | AC58: ='J. Dodrill'!$N$53 -> 35
X59: Lowest Round | AA59: =IF(MIN(AA48,AA50,AA52,AA54,AA56,AA58)=0,"-",MIN(AA48,AA50,AA52,AA54,AA56,AA58)) -> 43 | AB59: =IF(ISERROR(OFFSET(AA48,MATCH(AA59,$AA$48:$AA$58,0)-1,-26,1,1)),"-",OFFSET(AA48,MATCH(AA59,$AA$48:$AA$58,0)-1,-26,1,1)) -> T. Baumgarner