A2: =MID(CELL("filename",A1),FIND("]",CELL("filename",A1))+1,LEN(CELL("filename",A1))-FIND("]",CELL("filename",A1))) -> Individual Stats by Team
A3: =Standings!$A$4 -> 2006
A4: Team 1
A5: Week | B5: 1 | C5: 2 | D5: 3 | E5: 4 | F5: 5 | G5: 6 | H5: 7 | I5: 8 | J5: 9 | K5: 10 | M5: 11 | N5: 12 | O5: 13 | P5: 14 | Q5: 15 | R5: 16 | S5: 17 | T5: 18 | U5: 19 | V5: 20 | W5: Avg. | X5: Par | Y5: Net Avg. | Z5: Overall Rank | AA5: Low Rnd. | AB5: Max Rnd. | AC5: Low Net Rnd.
A6: ='T. Reese'!$A$1 -> T. Reese | B6: ='T. Reese'!$K$10 -> 42 | C6: ='T. Reese'!$K$11 -> 40 | D6: ='T. Reese'!$K$12 -> 43 | E6: ='T. Reese'!$K$13 -> - | F6: ='T. Reese'!$K$14 -> - | G6: ='T. Reese'!$K$21 -> 47 | H6: ='T. Reese'!$K$22 -> 42 | I6: ='T. Reese'!$K$23 -> 46 | J6: ='T. Reese'!$K$24 -> 43 | K6: ='T. Reese'!$K$25 -> 42 | M6: ='T. Reese'!$K$34 -> 45 | N6: ='T. Reese'!$K$35 -> 47 | O6: ='T. Reese'!$K$36 -> 42 | P6: ='T. Reese'!$K$37 -> 41 | Q6: ='T. Reese'!$K$38 -> 41 | R6: ='T. Reese'!$K$45 -> 39 | S6: ='T. Reese'!$K$46 -> 42 | T6: ='T. Reese'!$K$47 -> 45 | U6: ='T. Reese'!$K$48 -> - | V6: ='T. Reese'!$K$49 -> - | W6: =IF(ISERROR(AVERAGE(IF(B6:V6<>0,B6:V6,""))),"-",(AVERAGE(IF(B6:V6<>0,B6:V6,"")))) -> 42.9375 | X6: =IF(ISERROR(W6-37),"-",(W6-37)) -> 5.9375 | Y6: ='T. Reese'!$M$52 -> 38.8125 | Z6: =IF(ISERROR(RANK(Y6,Y$6:Y$85,1)),"-",RANK(Y6,Y$6:Y$85,1)) -> 10 | AA6: =IF(MIN(B6:V6)=0,"-",MIN(B6:V6)) -> 39 | AB6: =IF(MAX(C6:W6)=0,"-",MAX(C6:W6)) -> 47 | AC6: ='T. Reese'!$N$53 -> 35
A7: Avg | C7: =IF(ISERROR(AVERAGE(IF(B6:C6<>0,B6:C6,""))),"-",(AVERAGE(IF(B6:C6<>0,B6:C6,"")))) -> 41 | D7: =IF(ISERROR(AVERAGE(IF(B6:D6<>0,B6:D6,""))),"-",(AVERAGE(IF(B6:D6<>0,B6:D6,"")))) -> 41.666666666666664 | E7: =IF(ISERROR(AVERAGE(IF(B6:E6<>0,B6:E6,""))),"-",(AVERAGE(IF(B6:E6<>0,B6:E6,"")))) -> 41.666666666666664 | F7: =IF(ISERROR(AVERAGE(IF(B6:F6<>0,B6:F6,""))),"-",(AVERAGE(IF(B6:F6<>0,B6:F6,"")))) -> 41.666666666666664 | G7: =IF(ISERROR(AVERAGE(IF(B6:G6<>0,B6:G6,""))),"-",(AVERAGE(IF(B6:G6<>0,B6:G6,"")))) -> 43 | H7: =IF(ISERROR(AVERAGE(IF(B6:H6<>0,B6:H6,""))),"-",(AVERAGE(IF(B6:H6<>0,B6:H6,"")))) -> 42.8 | I7: =IF(ISERROR(AVERAGE(IF(B6:I6<>0,B6:I6,""))),"-",(AVERAGE(IF(B6:I6<>0,B6:I6,"")))) -> 43.333333333333336 | J7: =IF(ISERROR(AVERAGE(IF(B6:J6<>0,B6:J6,""))),"-",(AVERAGE(IF(B6:J6<>0,B6:J6,"")))) -> 43.285714285714285 | K7: =IF(ISERROR(AVERAGE(IF(B6:K6<>0,B6:K6,""))),"-",(AVERAGE(IF(B6:K6<>0,B6:K6,"")))) -> 43.125 | M7: =IF(ISERROR(AVERAGE(IF(B6:M6<>0,B6:M6,""))),"-",(AVERAGE(IF(B6:M6<>0,B6:M6,"")))) -> 43.333333333333336 | N7: =IF(ISERROR(AVERAGE(IF(B6:N6<>0,B6:N6,""))),"-",(AVERAGE(IF(B6:N6<>0,B6:N6,"")))) -> 43.7 | O7: =IF(ISERROR(AVERAGE(IF(B6:O6<>0,B6:O6,""))),"-",(AVERAGE(IF(B6:O6<>0,B6:O6,"")))) -> 43.545454545454547 | P7: =IF(ISERROR(AVERAGE(IF(B6:P6<>0,B6:P6,""))),"-",(AVERAGE(IF(B6:P6<>0,B6:P6,"")))) -> 43.333333333333336 | Q7: =IF(ISERROR(AVERAGE(IF(B6:Q6<>0,B6:Q6,""))),"-",(AVERAGE(IF(B6:Q6<>0,B6:Q6,"")))) -> 43.153846153846153 | R7: =IF(ISERROR(AVERAGE(IF(B6:R6<>0,B6:R6,""))),"-",(AVERAGE(IF(B6:R6<>0,B6:R6,"")))) -> 42.857142857142854 | S7: =IF(ISERROR(AVERAGE(IF(B6:S6<>0,B6:S6,""))),"-",(AVERAGE(IF(B6:S6<>0,B6:S6,"")))) -> 42.8 | T7: =IF(ISERROR(AVERAGE(IF(B6:T6<>0,B6:T6,""))),"-",(AVERAGE(IF(B6:T6<>0,B6:T6,"")))) -> 42.9375 | U7: =IF(ISERROR(AVERAGE(IF(B6:U6<>0,B6:U6,""))),"-",(AVERAGE(IF(B6:U6<>0,B6:U6,"")))) -> 42.9375 | V7: =IF(ISERROR(AVERAGE(IF(B6:V6<>0,B6:V6,""))),"-",(AVERAGE(IF(B6:V6<>0,B6:V6,"")))) -> 42.9375
A9: ='A. Wilks'!$A$1 -> A. Wilks | B9: ='A. Wilks'!$K$10 -> 47 | C9: ='A. Wilks'!$K$11 -> 48 | D9: ='A. Wilks'!$K$12 -> 44 | E9: ='A. Wilks'!$K$13 -> 43 | F9: ='A. Wilks'!$K$14 -> 48 | G9: ='A. Wilks'!$K$21 -> 44 | H9: ='A. Wilks'!$K$22 -> 47 | I9: ='A. Wilks'!$K$23 -> 52 | J9: ='A. Wilks'!$K$24 -> 45 | K9: ='A. Wilks'!$K$25 -> 45 | M9: ='A. Wilks'!$K$34 -> 47 | N9: ='A. Wilks'!$K$35 -> 46 | O9: ='A. Wilks'!$K$36 -> 47 | P9: ='A. Wilks'!$K$37 -> 45 | Q9: ='A. Wilks'!$K$38 -> 45 | R9: ='A. Wilks'!$K$45 -> 50 | S9: ='A. Wilks'!$K$46 -> 51 | T9: ='A. Wilks'!$K$47 -> 42 | U9: ='A. Wilks'!$K$48 -> - | V9: ='A. Wilks'!$K$49 -> - | W9: =IF(ISERROR(AVERAGE(IF(B9:V9<>0,B9:V9,""))),"-",(AVERAGE(IF(B9:V9<>0,B9:V9,"")))) -> 46.444444444444443 | X9: =IF(ISERROR(W9-37),"-",(W9-37)) -> 9.4444444444444429 | Y9: ='A. Wilks'!$M$52 -> 39.00 | Z9: =IF(ISERROR(RANK(Y9,Y$6:Y$85,1)),"-",RANK(Y9,Y$6:Y$85,1)) -> 14 | AA9: =IF(MIN(B9:V9)=0,"-",MIN(B9:V9)) -> 42 | AB9: =IF(MAX(C9:W9)=0,"-",MAX(C9:W9)) -> 52 | AC9: ='A. Wilks'!$N$53 -> 34
A10: Avg | C10: =IF(ISERROR(AVERAGE(B9:C9)),"-",(AVERAGE(B9:C9))) -> 47.5 | D10: =IF(ISERROR(AVERAGE(B9:D9)),"-",(AVERAGE(B9:D9))) -> 46.333333333333336 | E10: =IF(ISERROR(AVERAGE(B9:E9)),"-",(AVERAGE(B9:E9))) -> 45.5 | F10: =IF(ISERROR(AVERAGE(B9:F9)),"-",(AVERAGE(B9:F9))) -> 46 | G10: =IF(ISERROR(AVERAGE(B9:G9)),"-",(AVERAGE(B9:G9))) -> 45.666666666666664 | H10: =IF(ISERROR(AVERAGE(B9:H9)),"-",(AVERAGE(B9:H9))) -> 45.857142857142854 | I10: =IF(ISERROR(AVERAGE(B9:I9)),"-",(AVERAGE(B9:I9))) -> 46.625 | J10: =IF(ISERROR(AVERAGE(B9:J9)),"-",(AVERAGE(B9:J9))) -> 46.444444444444443 | K10: =IF(ISERROR(AVERAGE(B9:K9)),"-",(AVERAGE(B9:K9))) -> 46.3 | M10: =IF(ISERROR(AVERAGE(B9:M9)),"-",(AVERAGE(B9:M9))) -> 46.363636363636367 | N10: =IF(ISERROR(AVERAGE(B9:N9)),"-",(AVERAGE(B9:N9))) -> 46.333333333333336 | O10: =IF(ISERROR(AVERAGE(B9:O9)),"-",(AVERAGE(B9:O9))) -> 46.384615384615387 | P10: =IF(ISERROR(AVERAGE(B9:P9)),"-",(AVERAGE(B9:P9))) -> 46.285714285714285 | Q10: =IF(ISERROR(AVERAGE(B9:Q9)),"-",(AVERAGE(B9:Q9))) -> 46.2 | R10: =IF(ISERROR(AVERAGE(B9:R9)),"-",(AVERAGE(B9:R9))) -> 46.4375 | S10: =IF(ISERROR(AVERAGE(B9:S9)),"-",(AVERAGE(B9:S9))) -> 46.705882352941174 | T10: =IF(ISERROR(AVERAGE(B9:T9)),"-",(AVERAGE(B9:T9))) -> 46.444444444444443 | U10: =IF(ISERROR(AVERAGE(B9:U9)),"-",(AVERAGE(B9:U9))) -> 46.444444444444443 | V10: =IF(ISERROR(AVERAGE(B9:V9)),"-",(AVERAGE(B9:V9))) -> 46.444444444444443
A12: ='B. Meadows'!$A$1 -> B. Meadows | B12: ='B. Meadows'!$K$10 -> 49 | C12: ='B. Meadows'!$K$11 -> 51 | D12: ='B. Meadows'!$K$12 -> - | E12: ='B. Meadows'!$K$13 -> 56 | F12: ='B. Meadows'!$K$14 -> 51 | G12: ='B. Meadows'!$K$21 -> 50 | H12: ='B. Meadows'!$K$22 -> 51 | I12: ='B. Meadows'!$K$23 -> - | J12: ='B. Meadows'!$K$24 -> 47 | K12: ='B. Meadows'!$K$25 -> 49 | M12: ='B. Meadows'!$K$34 -> 52 | N12: ='B. Meadows'!$K$35 -> 50 | O12: ='B. Meadows'!$K$36 -> 50 | P12: ='B. Meadows'!$K$37 -> 48 | Q12: ='B. Meadows'!$K$38 -> 46 | R12: ='B. Meadows'!$K$45 -> 53 | S12: ='B. Meadows'!$K$46 -> 49 | T12: ='B. Meadows'!$K$47 -> 55 | U12: ='B. Meadows'!$K$48 -> - | V12: ='B. Meadows'!$K$49 -> - | W12: =IF(ISERROR(AVERAGE(IF(B12:V12<>0,B12:V12,""))),"-",(AVERAGE(IF(B12:V12<>0,B12:V12,"")))) -> 50.4375 | X12: =IF(ISERROR(W12-37),"-",(W12-37)) -> 13.4375 | Y12: ='B. Meadows'!$M$52 -> 39.125 | Z12: =IF(ISERROR(RANK(Y12,Y$6:Y$85,1)),"-",RANK(Y12,Y$6:Y$85,1)) -> 17 | AA12: =IF(MIN(B12:V12)=0,"-",MIN(B12:V12)) -> 46 | AB12: =IF(MAX(C12:W12)=0,"-",MAX(C12:W12)) -> 56 | AC12: ='B. Meadows'!$N$53 -> 34
A13: Avg | C13: =IF(ISERROR(AVERAGE(B12:C12)),"-",(AVERAGE(B12:C12))) -> 50 | D13: =IF(ISERROR(AVERAGE(B12:D12)),"-",(AVERAGE(B12:D12))) -> 50 | E13: =IF(ISERROR(AVERAGE(B12:E12)),"-",(AVERAGE(B12:E12))) -> 52 | F13: =IF(ISERROR(AVERAGE(B12:F12)),"-",(AVERAGE(B12:F12))) -> 51.75 | G13: =IF(ISERROR(AVERAGE(B12:G12)),"-",(AVERAGE(B12:G12))) -> 51.4 | H13: =IF(ISERROR(AVERAGE(B12:H12)),"-",(AVERAGE(B12:H12))) -> 51.333333333333336 | I13: =IF(ISERROR(AVERAGE(B12:I12)),"-",(AVERAGE(B12:I12))) -> 51.333333333333336 | J13: =IF(ISERROR(AVERAGE(B12:J12)),"-",(AVERAGE(B12:J12))) -> 50.714285714285715 | K13: =IF(ISERROR(AVERAGE(B12:K12)),"-",(AVERAGE(B12:K12))) -> 50.5 | M13: =IF(ISERROR(AVERAGE(B12:M12)),"-",(AVERAGE(B12:M12))) -> 50.666666666666664 | N13: =IF(ISERROR(AVERAGE(B12:N12)),"-",(AVERAGE(B12:N12))) -> 50.6 | O13: =IF(ISERROR(AVERAGE(B12:O12)),"-",(AVERAGE(B12:O12))) -> 50.545454545454547 | P13: =IF(ISERROR(AVERAGE(B12:P12)),"-",(AVERAGE(B12:P12))) -> 50.333333333333336 | Q13: =IF(ISERROR(AVERAGE(B12:Q12)),"-",(AVERAGE(B12:Q12))) -> 50 | R13: =IF(ISERROR(AVERAGE(B12:R12)),"-",(AVERAGE(B12:R12))) -> 50.214285714285715 | S13: =IF(ISERROR(AVERAGE(B12:S12)),"-",(AVERAGE(B12:S12))) -> 50.133333333333333 | T13: =IF(ISERROR(AVERAGE(B12:T12)),"-",(AVERAGE(B12:T12))) -> 50.4375 | U13: =IF(ISERROR(AVERAGE(B12:U12)),"-",(AVERAGE(B12:U12))) -> 50.4375 | V13: =IF(ISERROR(AVERAGE(B12:V12)),"-",(AVERAGE(B12:V12))) -> 50.4375
A15: ='L. Chiles'!$A$1 -> L. Chiles | B15: ='L. Chiles'!$K$10 -> 54 | C15: ='L. Chiles'!$K$11 -> 57 | D15: ='L. Chiles'!$K$12 -> 50 | E15: ='L. Chiles'!$K$13 -> 54 | F15: ='L. Chiles'!$K$14 -> - | G15: ='L. Chiles'!$K$21 -> 57 | H15: ='L. Chiles'!$K$22 -> 53 | I15: ='L. Chiles'!$K$23 -> 55 | J15: ='L. Chiles'!$K$24 -> 51 | K15: ='L. Chiles'!$K$25 -> 53 | M15: ='L. Chiles'!$K$34 -> 55 | N15: ='L. Chiles'!$K$35 -> 55 | O15: ='L. Chiles'!$K$36 -> 52 | P15: ='L. Chiles'!$K$37 -> 51 | Q15: ='L. Chiles'!$K$38 -> 52 | R15: ='L. Chiles'!$K$45 -> 56 | S15: ='L. Chiles'!$K$46 -> - | T15: ='L. Chiles'!$K$47 -> - | U15: ='L. Chiles'!$K$48 -> - | V15: ='L. Chiles'!$K$49 -> - | W15: =IF(ISERROR(AVERAGE(IF(B15:V15<>0,B15:V15,""))),"-",(AVERAGE(IF(B15:V15<>0,B15:V15,"")))) -> 53.666666666666664 | X15: =IF(ISERROR(W15-37),"-",(W15-37)) -> 16.666666666666664 | Y15: ='L. Chiles'!$M$52 -> 38.93333333333333 | Z15: =IF(ISERROR(RANK(Y15,Y$6:Y$85,1)),"-",RANK(Y15,Y$6:Y$85,1)) -> 12 | AA15: =IF(MIN(B15:V15)=0,"-",MIN(B15:V15)) -> 50 | AB15: =IF(MAX(C15:W15)=0,"-",MAX(C15:W15)) -> 57 | AC15: ='L. Chiles'!$N$53 -> 36
A16: Avg | C16: =IF(ISERROR(AVERAGE(B15:C15)),"-",(AVERAGE(B15:C15))) -> 55.5 | D16: =IF(ISERROR(AVERAGE(B15:D15)),"-",(AVERAGE(B15:D15))) -> 53.666666666666664 | E16: =IF(ISERROR(AVERAGE(B15:E15)),"-",(AVERAGE(B15:E15))) -> 53.75 | F16: =IF(ISERROR(AVERAGE(B15:F15)),"-",(AVERAGE(B15:F15))) -> 53.75 | G16: =IF(ISERROR(AVERAGE(B15:G15)),"-",(AVERAGE(B15:G15))) -> 54.4 | H16: =IF(ISERROR(AVERAGE(B15:H15)),"-",(AVERAGE(B15:H15))) -> 54.166666666666664 | I16: =IF(ISERROR(AVERAGE(B15:I15)),"-",(AVERAGE(B15:I15))) -> 54.285714285714285 | J16: =IF(ISERROR(AVERAGE(B15:J15)),"-",(AVERAGE(B15:J15))) -> 53.875 | K16: =IF(ISERROR(AVERAGE(B15:K15)),"-",(AVERAGE(B15:K15))) -> 53.777777777777779 | M16: =IF(ISERROR(AVERAGE(B15:M15)),"-",(AVERAGE(B15:M15))) -> 53.9 | N16: =IF(ISERROR(AVERAGE(B15:N15)),"-",(AVERAGE(B15:N15))) -> 54 | O16: =IF(ISERROR(AVERAGE(B15:O15)),"-",(AVERAGE(B15:O15))) -> 53.833333333333336 | P16: =IF(ISERROR(AVERAGE(B15:P15)),"-",(AVERAGE(B15:P15))) -> 53.615384615384613 | Q16: =IF(ISERROR(AVERAGE(B15:Q15)),"-",(AVERAGE(B15:Q15))) -> 53.5 | R16: =IF(ISERROR(AVERAGE(B15:R15)),"-",(AVERAGE(B15:R15))) -> 53.666666666666664 | S16: =IF(ISERROR(AVERAGE(B15:S15)),"-",(AVERAGE(B15:S15))) -> 53.666666666666664 | T16: =IF(ISERROR(AVERAGE(B15:T15)),"-",(AVERAGE(B15:T15))) -> 53.666666666666664 | U16: =IF(ISERROR(AVERAGE(B15:U15)),"-",(AVERAGE(B15:U15))) -> 53.666666666666664 | V16: =IF(ISERROR(AVERAGE(B15:V15)),"-",(AVERAGE(B15:V15))) -> 53.666666666666664
A18: Team 2
A19: Week | B19: 1 | C19: 2 | D19: 3 | E19: 4 | F19: 5 | G19: 6 | H19: 7 | I19: 8 | J19: 9 | K19: 10 | M19: 11 | N19: 12 | O19: 13 | P19: 14 | Q19: 15 | R19: 16 | S19: 17 | T19: 18 | U19: 19 | V19: 20 | W19: Avg. | X19: Par | Y19: Net Avg. | Z19: Overall Rank | AA19: Low Rnd. | AB19: Max Rnd. | AC19: Low Net Rnd.
A20: ='T. Wilson'!$A$1 -> T. Wilson | B20: ='T. Wilson'!$K$10 -> 43 | C20: ='T. Wilson'!$K$11 -> - | D20: ='T. Wilson'!$K$12 -> 48 | E20: ='T. Wilson'!$K$13 -> - | F20: ='T. Wilson'!$K$14 -> - | G20: ='T. Wilson'!$K$21 -> 40 | H20: ='T. Wilson'!$K$22 -> - | I20: ='T. Wilson'!$K$23 -> - | J20: ='T. Wilson'!$K$24 -> - | K20: ='T. Wilson'!$K$25 -> 38 | M20: ='T. Wilson'!$K$34 -> 42 | N20: ='T. Wilson'!$K$35 -> 40 | O20: ='T. Wilson'!$K$36 -> 42 | P20: ='T. Wilson'!$K$37 -> 44 | Q20: ='T. Wilson'!$K$38 -> 39 | R20: ='T. Wilson'!$K$45 -> - | S20: ='T. Wilson'!$K$46 -> 48 | T20: ='T. Wilson'!$K$47 -> 40 | U20: ='T. Wilson'!$K$48 -> - | V20: ='T. Wilson'!$K$49 -> - | W20: =IF(ISERROR(AVERAGE(IF(B20:V20<>0,B20:V20,""))),"-",(AVERAGE(IF(B20:V20<>0,B20:V20,"")))) -> 42.18181818181818 | X20: =IF(ISERROR(W20-37),"-",(W20-37)) -> 5.1818181818181799 | Y20: ='T. Wilson'!$M$52 -> 39.090909090909093 | Z20: =IF(ISERROR(RANK(Y20,Y$6:Y$85,1)),"-",RANK(Y20,Y$6:Y$85,1)) -> 16 | AA20: =IF(MIN(B20:V20)=0,"-",MIN(B20:V20)) -> 38 | AB20: =IF(MAX(C20:W20)=0,"-",MAX(C20:W20)) -> 48 | AC20: ='T. Wilson'!$N$53 -> 32
A21: Avg | C21: =IF(ISERROR(AVERAGE(IF(B20:C20<>0,B20:C20,""))),"-",(AVERAGE(IF(B20:C20<>0,B20:C20,"")))) -> 43 | D21: =IF(ISERROR(AVERAGE(IF(B20:D20<>0,B20:D20,""))),"-",(AVERAGE(IF(B20:D20<>0,B20:D20,"")))) -> 45.5 | E21: =IF(ISERROR(AVERAGE(IF(B20:E20<>0,B20:E20,""))),"-",(AVERAGE(IF(B20:E20<>0,B20:E20,"")))) -> 45.5 | F21: =IF(ISERROR(AVERAGE(IF(B20:F20<>0,B20:F20,""))),"-",(AVERAGE(IF(B20:F20<>0,B20:F20,"")))) -> 45.5 | G21: =IF(ISERROR(AVERAGE(IF(B20:G20<>0,B20:G20,""))),"-",(AVERAGE(IF(B20:G20<>0,B20:G20,"")))) -> 43.666666666666664 | H21: =IF(ISERROR(AVERAGE(IF(B20:H20<>0,B20:H20,""))),"-",(AVERAGE(IF(B20:H20<>0,B20:H20,"")))) -> 43.666666666666664 | I21: =IF(ISERROR(AVERAGE(IF(B20:I20<>0,B20:I20,""))),"-",(AVERAGE(IF(B20:I20<>0,B20:I20,"")))) -> 43.666666666666664 | J21: =IF(ISERROR(AVERAGE(IF(B20:J20<>0,B20:J20,""))),"-",(AVERAGE(IF(B20:J20<>0,B20:J20,"")))) -> 43.666666666666664 | K21: =IF(ISERROR(AVERAGE(IF(B20:K20<>0,B20:K20,""))),"-",(AVERAGE(IF(B20:K20<>0,B20:K20,"")))) -> 42.25 | M21: =IF(ISERROR(AVERAGE(IF(B20:M20<>0,B20:M20,""))),"-",(AVERAGE(IF(B20:M20<>0,B20:M20,"")))) -> 42.2 | N21: =IF(ISERROR(AVERAGE(IF(B20:N20<>0,B20:N20,""))),"-",(AVERAGE(IF(B20:N20<>0,B20:N20,"")))) -> 41.833333333333336 | O21: =IF(ISERROR(AVERAGE(IF(B20:O20<>0,B20:O20,""))),"-",(AVERAGE(IF(B20:O20<>0,B20:O20,"")))) -> 41.857142857142854 | P21: =IF(ISERROR(AVERAGE(IF(B20:P20<>0,B20:P20,""))),"-",(AVERAGE(IF(B20:P20<>0,B20:P20,"")))) -> 42.125 | Q21: =IF(ISERROR(AVERAGE(IF(B20:Q20<>0,B20:Q20,""))),"-",(AVERAGE(IF(B20:Q20<>0,B20:Q20,"")))) -> 41.777777777777779 | R21: =IF(ISERROR(AVERAGE(IF(B20:R20<>0,B20:R20,""))),"-",(AVERAGE(IF(B20:R20<>0,B20:R20,"")))) -> 41.777777777777779 | S21: =IF(ISERROR(AVERAGE(IF(B20:S20<>0,B20:S20,""))),"-",(AVERAGE(IF(B20:S20<>0,B20:S20,"")))) -> 42.4 | T21: =IF(ISERROR(AVERAGE(IF(B20:T20<>0,B20:T20,""))),"-",(AVERAGE(IF(B20:T20<>0,B20:T20,"")))) -> 42.18181818181818 | U21: =IF(ISERROR(AVERAGE(IF(B20:U20<>0,B20:U20,""))),"-",(AVERAGE(IF(B20:U20<>0,B20:U20,"")))) -> 42.18181818181818 | V21: =IF(ISERROR(AVERAGE(IF(B20:V20<>0,B20:V20,""))),"-",(AVERAGE(IF(B20:V20<>0,B20:V20,"")))) -> 42.18181818181818
A23: ='B. Craig'!$A$1 -> B. Craig | B23: ='B. Craig'!$K$10 -> 42 | C23: ='B. Craig'!$K$11 -> 49 | D23: ='B. Craig'!$K$12 -> 49 | E23: ='B. Craig'!$K$13 -> 44 | F23: ='B. Craig'!$K$14 -> 48 | G23: ='B. Craig'!$K$21 -> 42 | H23: ='B. Craig'!$K$22 -> 45 | I23: ='B. Craig'!$K$23 -> 46 | J23: ='B. Craig'!$K$24 -> - | K23: ='B. Craig'!$K$25 -> - | M23: ='B. Craig'!$K$34 -> 45 | N23: ='B. Craig'!$K$35 -> 44 | O23: ='B. Craig'!$K$36 -> 45 | P23: ='B. Craig'!$K$37 -> 45 | Q23: ='B. Craig'!$K$38 -> 43 | R23: ='B. Craig'!$K$45 -> 44 | S23: ='B. Craig'!$K$46 -> 47 | T23: ='B. Craig'!$K$47 -> - | U23: ='B. Craig'!$K$48 -> - | V23: ='B. Craig'!$K$49 -> - | W23: =IF(ISERROR(AVERAGE(IF(B23:V23<>0,B23:V23,""))),"-",(AVERAGE(IF(B23:V23<>0,B23:V23,"")))) -> 45.20 | X23: =IF(ISERROR(W23-37),"-",(W23-37)) -> 8.20 | Y23: ='B. Craig'!$M$52 -> 39.00 | Z23: =IF(ISERROR(RANK(Y23,Y$6:Y$85,1)),"-",RANK(Y23,Y$6:Y$85,1)) -> 14 | AA23: =IF(MIN(B23:V23)=0,"-",MIN(B23:V23)) -> 42 | AB23: =IF(MAX(C23:W23)=0,"-",MAX(C23:W23)) -> 49 | AC23: ='B. Craig'!$N$53 -> 34
A24: Avg | C24: =IF(ISERROR(AVERAGE(IF(B23:C23<>0,B23:C23,""))),"-",(AVERAGE(IF(B23:C23<>0,B23:C23,"")))) -> 45.5 | D24: =IF(ISERROR(AVERAGE(IF(B23:D23<>0,B23:D23,""))),"-",(AVERAGE(IF(B23:D23<>0,B23:D23,"")))) -> 46.666666666666664 | E24: =IF(ISERROR(AVERAGE(IF(B23:E23<>0,B23:E23,""))),"-",(AVERAGE(IF(B23:E23<>0,B23:E23,"")))) -> 46 | F24: =IF(ISERROR(AVERAGE(IF(B23:F23<>0,B23:F23,""))),"-",(AVERAGE(IF(B23:F23<>0,B23:F23,"")))) -> 46.4 | G24: =IF(ISERROR(AVERAGE(IF(B23:G23<>0,B23:G23,""))),"-",(AVERAGE(IF(B23:G23<>0,B23:G23,"")))) -> 45.666666666666664 | H24: =IF(ISERROR(AVERAGE(IF(B23:H23<>0,B23:H23,""))),"-",(AVERAGE(IF(B23:H23<>0,B23:H23,"")))) -> 45.571428571428569 | I24: =IF(ISERROR(AVERAGE(IF(B23:I23<>0,B23:I23,""))),"-",(AVERAGE(IF(B23:I23<>0,B23:I23,"")))) -> 45.625 | J24: =IF(ISERROR(AVERAGE(IF(B23:J23<>0,B23:J23,""))),"-",(AVERAGE(IF(B23:J23<>0,B23:J23,"")))) -> 45.625 | K24: =IF(ISERROR(AVERAGE(IF(B23:K23<>0,B23:K23,""))),"-",(AVERAGE(IF(B23:K23<>0,B23:K23,"")))) -> 45.625 | M24: =IF(ISERROR(AVERAGE(IF(B23:M23<>0,B23:M23,""))),"-",(AVERAGE(IF(B23:M23<>0,B23:M23,"")))) -> 45.555555555555557 | N24: =IF(ISERROR(AVERAGE(IF(B23:N23<>0,B23:N23,""))),"-",(AVERAGE(IF(B23:N23<>0,B23:N23,"")))) -> 45.4 | O24: =IF(ISERROR(AVERAGE(IF(B23:O23<>0,B23:O23,""))),"-",(AVERAGE(IF(B23:O23<>0,B23:O23,"")))) -> 45.363636363636367 | P24: =IF(ISERROR(AVERAGE(IF(B23:P23<>0,B23:P23,""))),"-",(AVERAGE(IF(B23:P23<>0,B23:P23,"")))) -> 45.333333333333336 | Q24: =IF(ISERROR(AVERAGE(IF(B23:Q23<>0,B23:Q23,""))),"-",(AVERAGE(IF(B23:Q23<>0,B23:Q23,"")))) -> 45.153846153846153 | R24: =IF(ISERROR(AVERAGE(IF(B23:R23<>0,B23:R23,""))),"-",(AVERAGE(IF(B23:R23<>0,B23:R23,"")))) -> 45.071428571428569 | S24: =IF(ISERROR(AVERAGE(IF(B23:S23<>0,B23:S23,""))),"-",(AVERAGE(IF(B23:S23<>0,B23:S23,"")))) -> 45.2 | T24: =IF(ISERROR(AVERAGE(IF(B23:T23<>0,B23:T23,""))),"-",(AVERAGE(IF(B23:T23<>0,B23:T23,"")))) -> 45.2 | U24: =IF(ISERROR(AVERAGE(IF(B23:U23<>0,B23:U23,""))),"-",(AVERAGE(IF(B23:U23<>0,B23:U23,"")))) -> 45.2 | V24: =IF(ISERROR(AVERAGE(IF(B23:V23<>0,B23:V23,""))),"-",(AVERAGE(IF(B23:V23<>0,B23:V23,"")))) -> 45.2
A26: ='B. Hall'!$A$1 -> B. Hall | B26: ='B. Hall'!$K$10 -> 43 | C26: ='B. Hall'!$K$11 -> 49 | D26: ='B. Hall'!$K$12 -> 46 | E26: ='B. Hall'!$K$13 -> 49 | F26: ='B. Hall'!$K$14 -> 47 | G26: ='B. Hall'!$K$21 -> 52 | H26: ='B. Hall'!$K$22 -> 50 | I26: ='B. Hall'!$K$23 -> 57 | J26: ='B. Hall'!$K$24 -> 50 | K26: ='B. Hall'!$K$25 -> 51 | M26: ='B. Hall'!$K$34 -> 49 | N26: ='B. Hall'!$K$35 -> 52 | O26: ='B. Hall'!$K$36 -> 54 | P26: ='B. Hall'!$K$37 -> 51 | Q26: ='B. Hall'!$K$38 -> 48 | R26: ='B. Hall'!$K$45 -> 46 | S26: ='B. Hall'!$K$46 -> 50 | T26: ='B. Hall'!$K$47 -> 47 | U26: ='B. Hall'!$K$48 -> 52 | V26: ='B. Hall'!$K$49 -> - | W26: =IF(ISERROR(AVERAGE(IF(B26:V26<>0,B26:V26,""))),"-",(AVERAGE(IF(B26:V26<>0,B26:V26,"")))) -> 49.631578947368418 | X26: =IF(ISERROR(W26-37),"-",(W26-37)) -> 12.631578947368418 | Y26: ='B. Hall'!$M$52 -> 39.94736842105263 | Z26: =IF(ISERROR(RANK(Y26,Y$6:Y$85,1)),"-",RANK(Y26,Y$6:Y$85,1)) -> 22 | AA26: =IF(MIN(B26:V26)=0,"-",MIN(B26:V26)) -> 43 | AB26: =IF(MAX(C26:W26)=0,"-",MAX(C26:W26)) -> 57 | AC26: ='B. Hall'!$N$53 -> 33
A27: Avg | C27: =IF(ISERROR(AVERAGE(IF(B26:C26<>0,B26:C26,""))),"-",(AVERAGE(IF(B26:C26<>0,B26:C26,"")))) -> 46 | D27: =IF(ISERROR(AVERAGE(IF(B26:D26<>0,B26:D26,""))),"-",(AVERAGE(IF(B26:D26<>0,B26:D26,"")))) -> 46 | E27: =IF(ISERROR(AVERAGE(IF(B26:E26<>0,B26:E26,""))),"-",(AVERAGE(IF(B26:E26<>0,B26:E26,"")))) -> 46.75 | F27: =IF(ISERROR(AVERAGE(IF(B26:F26<>0,B26:F26,""))),"-",(AVERAGE(IF(B26:F26<>0,B26:F26,"")))) -> 46.8 | G27: =IF(ISERROR(AVERAGE(IF(B26:G26<>0,B26:G26,""))),"-",(AVERAGE(IF(B26:G26<>0,B26:G26,"")))) -> 47.666666666666664 | H27: =IF(ISERROR(AVERAGE(IF(B26:H26<>0,B26:H26,""))),"-",(AVERAGE(IF(B26:H26<>0,B26:H26,"")))) -> 48 | I27: =IF(ISERROR(AVERAGE(IF(B26:I26<>0,B26:I26,""))),"-",(AVERAGE(IF(B26:I26<>0,B26:I26,"")))) -> 49.125 | J27: =IF(ISERROR(AVERAGE(IF(B26:J26<>0,B26:J26,""))),"-",(AVERAGE(IF(B26:J26<>0,B26:J26,"")))) -> 49.222222222222221 | K27: =IF(ISERROR(AVERAGE(IF(B26:K26<>0,B26:K26,""))),"-",(AVERAGE(IF(B26:K26<>0,B26:K26,"")))) -> 49.4 | M27: =IF(ISERROR(AVERAGE(IF(B26:M26<>0,B26:M26,""))),"-",(AVERAGE(IF(B26:M26<>0,B26:M26,"")))) -> 49.363636363636367 | N27: =IF(ISERROR(AVERAGE(IF(B26:N26<>0,B26:N26,""))),"-",(AVERAGE(IF(B26:N26<>0,B26:N26,"")))) -> 49.583333333333336 | O27: =IF(ISERROR(AVERAGE(IF(B26:O26<>0,B26:O26,""))),"-",(AVERAGE(IF(B26:O26<>0,B26:O26,"")))) -> 49.92307692307692 | P27: =IF(ISERROR(AVERAGE(IF(B26:P26<>0,B26:P26,""))),"-",(AVERAGE(IF(B26:P26<>0,B26:P26,"")))) -> 50 | Q27: =IF(ISERROR(AVERAGE(IF(B26:Q26<>0,B26:Q26,""))),"-",(AVERAGE(IF(B26:Q26<>0,B26:Q26,"")))) -> 49.866666666666667 | R27: =IF(ISERROR(AVERAGE(IF(B26:R26<>0,B26:R26,""))),"-",(AVERAGE(IF(B26:R26<>0,B26:R26,"")))) -> 49.625 | S27: =IF(ISERROR(AVERAGE(IF(B26:S26<>0,B26:S26,""))),"-",(AVERAGE(IF(B26:S26<>0,B26:S26,"")))) -> 49.647058823529413 | T27: =IF(ISERROR(AVERAGE(IF(B26:T26<>0,B26:T26,""))),"-",(AVERAGE(IF(B26:T26<>0,B26:T26,"")))) -> 49.5 | U27: =IF(ISERROR(AVERAGE(IF(B26:U26<>0,B26:U26,""))),"-",(AVERAGE(IF(B26:U26<>0,B26:U26,"")))) -> 49.631578947368418 | V27: =IF(ISERROR(AVERAGE(IF(B26:V26<>0,B26:V26,""))),"-",(AVERAGE(IF(B26:V26<>0,B26:V26,"")))) -> 49.631578947368418
A29: ='J. Landers'!$A$1 -> J. Landers | B29: ='J. Landers'!$K$10 -> 57 | C29: ='J. Landers'!$K$11 -> 48 | D29: ='J. Landers'!$K$12 -> 53 | E29: ='J. Landers'!$K$13 -> 51 | F29: ='J. Landers'!$K$14 -> 47 | G29: ='J. Landers'!$K$21 -> 50 | H29: ='J. Landers'!$K$22 -> 44 | I29: ='J. Landers'!$K$23 -> 50 | J29: ='J. Landers'!$K$24 -> 49 | K29: ='J. Landers'!$K$25 -> - | M29: ='J. Landers'!$K$34 -> 51 | N29: ='J. Landers'!$K$35 -> 52 | O29: ='J. Landers'!$K$36 -> - | P29: ='J. Landers'!$K$37 -> 52 | Q29: ='J. Landers'!$K$38 -> 64 | R29: ='J. Landers'!$K$45 -> 52 | S29: ='J. Landers'!$K$46 -> 50 | T29: ='J. Landers'!$K$47 -> 51 | U29: ='J. Landers'!$K$48 -> 58 | V29: ='J. Landers'!$K$49 -> - | W29: =IF(ISERROR(AVERAGE(IF(B29:V29<>0,B29:V29,""))),"-",(AVERAGE(IF(B29:V29<>0,B29:V29,"")))) -> 51.705882352941174 | X29: =IF(ISERROR(W29-37),"-",(W29-37)) -> 14.705882352941174 | Y29: ='J. Landers'!$M$52 -> 40.470588235294116 | Z29: =IF(ISERROR(RANK(Y29,Y$6:Y$85,1)),"-",RANK(Y29,Y$6:Y$85,1)) -> 24 | AA29: =IF(MIN(B29:V29)=0,"-",MIN(B29:V29)) -> 44 | AB29: =IF(MAX(C29:W29)=0,"-",MAX(C29:W29)) -> 64 | AC29: ='J. Landers'!$N$53 -> 32
A30: Avg | C30: =IF(ISERROR(AVERAGE(IF(B29:C29<>0,B29:C29,""))),"-",(AVERAGE(IF(B29:C29<>0,B29:C29,"")))) -> 52.5 | D30: =IF(ISERROR(AVERAGE(IF(B29:D29<>0,B29:D29,""))),"-",(AVERAGE(IF(B29:D29<>0,B29:D29,"")))) -> 52.666666666666664 | E30: =IF(ISERROR(AVERAGE(IF(B29:E29<>0,B29:E29,""))),"-",(AVERAGE(IF(B29:E29<>0,B29:E29,"")))) -> 52.25 | F30: =IF(ISERROR(AVERAGE(IF(B29:F29<>0,B29:F29,""))),"-",(AVERAGE(IF(B29:F29<>0,B29:F29,"")))) -> 51.2 | G30: =IF(ISERROR(AVERAGE(IF(B29:G29<>0,B29:G29,""))),"-",(AVERAGE(IF(B29:G29<>0,B29:G29,"")))) -> 51 | H30: =IF(ISERROR(AVERAGE(IF(B29:H29<>0,B29:H29,""))),"-",(AVERAGE(IF(B29:H29<>0,B29:H29,"")))) -> 50 | I30: =IF(ISERROR(AVERAGE(IF(B29:I29<>0,B29:I29,""))),"-",(AVERAGE(IF(B29:I29<>0,B29:I29,"")))) -> 50 | J30: =IF(ISERROR(AVERAGE(IF(B29:J29<>0,B29:J29,""))),"-",(AVERAGE(IF(B29:J29<>0,B29:J29,"")))) -> 49.888888888888886 | K30: =IF(ISERROR(AVERAGE(IF(B29:K29<>0,B29:K29,""))),"-",(AVERAGE(IF(B29:K29<>0,B29:K29,"")))) -> 49.888888888888886 | M30: =IF(ISERROR(AVERAGE(IF(B29:M29<>0,B29:M29,""))),"-",(AVERAGE(IF(B29:M29<>0,B29:M29,"")))) -> 50 | N30: =IF(ISERROR(AVERAGE(IF(B29:N29<>0,B29:N29,""))),"-",(AVERAGE(IF(B29:N29<>0,B29:N29,"")))) -> 50.18181818181818 | O30: =IF(ISERROR(AVERAGE(IF(B29:O29<>0,B29:O29,""))),"-",(AVERAGE(IF(B29:O29<>0,B29:O29,"")))) -> 50.18181818181818 | P30: =IF(ISERROR(AVERAGE(IF(B29:P29<>0,B29:P29,""))),"-",(AVERAGE(IF(B29:P29<>0,B29:P29,"")))) -> 50.333333333333336 | Q30: =IF(ISERROR(AVERAGE(IF(B29:Q29<>0,B29:Q29,""))),"-",(AVERAGE(IF(B29:Q29<>0,B29:Q29,"")))) -> 51.384615384615387 | R30: =IF(ISERROR(AVERAGE(IF(B29:R29<>0,B29:R29,""))),"-",(AVERAGE(IF(B29:R29<>0,B29:R29,"")))) -> 51.428571428571431 | S30: =IF(ISERROR(AVERAGE(IF(B29:S29<>0,B29:S29,""))),"-",(AVERAGE(IF(B29:S29<>0,B29:S29,"")))) -> 51.333333333333336 | T30: =IF(ISERROR(AVERAGE(IF(B29:T29<>0,B29:T29,""))),"-",(AVERAGE(IF(B29:T29<>0,B29:T29,"")))) -> 51.3125 | U30: =IF(ISERROR(AVERAGE(IF(B29:U29<>0,B29:U29,""))),"-",(AVERAGE(IF(B29:U29<>0,B29:U29,"")))) -> 51.705882352941174 | V30: =IF(ISERROR(AVERAGE(IF(B29:V29<>0,B29:V29,""))),"-",(AVERAGE(IF(B29:V29<>0,B29:V29,"")))) -> 51.705882352941174
A32: Team 3
A33: Week | B33: 1 | C33: 2 | D33: 3 | E33: 4 | F33: 5 | G33: 6 | H33: 7 | I33: 8 | J33: 9 | K33: 10 | M33: 11 | N33: 12 | O33: 13 | P33: 14 | Q33: 15 | R33: 16 | S33: 17 | T33: 18 | U33: 19 | V33: 20 | W33: Avg. | X33: Par | Y33: Net Avg. | Z33: Overall Rank | AA33: Low Rnd. | AB33: Max Rnd. | AC33: Low Net Rnd.
A34: ='M. Rutherford'!$A$1 -> M. Rutherford | B34: ='M. Rutherford'!$K$10 -> 44 | C34: ='M. Rutherford'!$K$11 -> 44 | D34: ='M. Rutherford'!$K$12 -> 40 | E34: ='M. Rutherford'!$K$13 -> 39 | F34: ='M. Rutherford'!$K$14 -> 41 | G34: ='M. Rutherford'!$K$21 -> 43 | H34: ='M. Rutherford'!$K$22 -> 44 | I34: ='M. Rutherford'!$K$23 -> 44 | J34: ='M. Rutherford'!$K$24 -> 38 | K34: ='M. Rutherford'!$K$25 -> 41 | M34: ='M. Rutherford'!$K$34 -> 41 | N34: ='M. Rutherford'!$K$35 -> 44 | O34: ='M. Rutherford'!$K$36 -> 39 | P34: ='M. Rutherford'!$K$37 -> - | Q34: ='M. Rutherford'!$K$38 -> 44 | R34: ='M. Rutherford'!$K$45 -> 42 | S34: ='M. Rutherford'!$K$46 -> 38 | T34: ='M. Rutherford'!$K$47 -> 41 | U34: ='M. Rutherford'!$K$48 -> 43 | V34: ='M. Rutherford'!$K$49 -> - | W34: =IF(ISERROR(AVERAGE(IF(B34:V34<>0,B34:V34,""))),"-",(AVERAGE(IF(B34:V34<>0,B34:V34,"")))) -> 41.666666666666664 | X34: =IF(ISERROR(W34-37),"-",(W34-37)) -> 4.6666666666666643 | Y34: ='M. Rutherford'!$M$52 -> 38.666666666666664 | Z34: =IF(ISERROR(RANK(Y34,Y$6:Y$85,1)),"-",RANK(Y34,Y$6:Y$85,1)) -> 8 | AA34: =IF(MIN(B34:V34)=0,"-",MIN(B34:V34)) -> 38 | AB34: =IF(MAX(C34:W34)=0,"-",MAX(C34:W34)) -> 44 | AC34: ='M. Rutherford'!$N$53 -> 35
A35: Avg | C35: =IF(ISERROR(AVERAGE(IF(B34:C34<>0,B34:C34,""))),"-",(AVERAGE(IF(B34:C34<>0,B34:C34,"")))) -> 44 | D35: =IF(ISERROR(AVERAGE(IF(B34:D34<>0,B34:D34,""))),"-",(AVERAGE(IF(B34:D34<>0,B34:D34,"")))) -> 42.666666666666664 | E35: =IF(ISERROR(AVERAGE(IF(B34:E34<>0,B34:E34,""))),"-",(AVERAGE(IF(B34:E34<>0,B34:E34,"")))) -> 41.75 | F35: =IF(ISERROR(AVERAGE(IF(B34:F34<>0,B34:F34,""))),"-",(AVERAGE(IF(B34:F34<>0,B34:F34,"")))) -> 41.6 | G35: =IF(ISERROR(AVERAGE(IF(B34:G34<>0,B34:G34,""))),"-",(AVERAGE(IF(B34:G34<>0,B34:G34,"")))) -> 41.833333333333336 | H35: =IF(ISERROR(AVERAGE(IF(B34:H34<>0,B34:H34,""))),"-",(AVERAGE(IF(B34:H34<>0,B34:H34,"")))) -> 42.142857142857146 | I35: =IF(ISERROR(AVERAGE(IF(B34:I34<>0,B34:I34,""))),"-",(AVERAGE(IF(B34:I34<>0,B34:I34,"")))) -> 42.375 | J35: =IF(ISERROR(AVERAGE(IF(B34:J34<>0,B34:J34,""))),"-",(AVERAGE(IF(B34:J34<>0,B34:J34,"")))) -> 41.888888888888886 | K35: =IF(ISERROR(AVERAGE(IF(B34:K34<>0,B34:K34,""))),"-",(AVERAGE(IF(B34:K34<>0,B34:K34,"")))) -> 41.8 | M35: =IF(ISERROR(AVERAGE(IF(B34:M34<>0,B34:M34,""))),"-",(AVERAGE(IF(B34:M34<>0,B34:M34,"")))) -> 41.727272727272727 | N35: =IF(ISERROR(AVERAGE(IF(B34:N34<>0,B34:N34,""))),"-",(AVERAGE(IF(B34:N34<>0,B34:N34,"")))) -> 41.916666666666664 | O35: =IF(ISERROR(AVERAGE(IF(B34:O34<>0,B34:O34,""))),"-",(AVERAGE(IF(B34:O34<>0,B34:O34,"")))) -> 41.692307692307693 | P35: =IF(ISERROR(AVERAGE(IF(B34:P34<>0,B34:P34,""))),"-",(AVERAGE(IF(B34:P34<>0,B34:P34,"")))) -> 41.692307692307693 | Q35: =IF(ISERROR(AVERAGE(IF(B34:Q34<>0,B34:Q34,""))),"-",(AVERAGE(IF(B34:Q34<>0,B34:Q34,"")))) -> 41.857142857142854 | R35: =IF(ISERROR(AVERAGE(IF(B34:R34<>0,B34:R34,""))),"-",(AVERAGE(IF(B34:R34<>0,B34:R34,"")))) -> 41.866666666666667 | S35: =IF(ISERROR(AVERAGE(IF(B34:S34<>0,B34:S34,""))),"-",(AVERAGE(IF(B34:S34<>0,B34:S34,"")))) -> 41.625 | T35: =IF(ISERROR(AVERAGE(IF(B34:T34<>0,B34:T34,""))),"-",(AVERAGE(IF(B34:T34<>0,B34:T34,"")))) -> 41.588235294117645 | U35: =IF(ISERROR(AVERAGE(IF(B34:U34<>0,B34:U34,""))),"-",(AVERAGE(IF(B34:U34<>0,B34:U34,"")))) -> 41.666666666666664 | V35: =IF(ISERROR(AVERAGE(IF(B34:V34<>0,B34:V34,""))),"-",(AVERAGE(IF(B34:V34<>0,B34:V34,"")))) -> 41.666666666666664
A37: ='M. McComas'!$A$1 -> M. McComas | B37: ='M. McComas'!$K$10 -> 43 | C37: ='M. McComas'!$K$11 -> 42 | D37: ='M. McComas'!$K$12 -> 48 | E37: ='M. McComas'!$K$13 -> 41 | F37: ='M. McComas'!$K$14 -> - | G37: ='M. McComas'!$K$21 -> 47 | H37: ='M. McComas'!$K$22 -> 47 | I37: ='M. McComas'!$K$23 -> 42 | J37: ='M. McComas'!$K$24 -> 45 | K37: ='M. McComas'!$K$25 -> 43 | M37: ='M. McComas'!$K$34 -> 45 | N37: ='M. McComas'!$K$35 -> 50 | O37: ='M. McComas'!$K$36 -> 46 | P37: ='M. McComas'!$K$37 -> 42 | Q37: ='M. McComas'!$K$38 -> 48 | R37: ='M. McComas'!$K$45 -> - | S37: ='M. McComas'!$K$46 -> 45 | T37: ='M. McComas'!$K$47 -> 44 | U37: ='M. McComas'!$K$48 -> 41 | V37: ='M. McComas'!$K$49 -> - | W37: =IF(ISERROR(AVERAGE(IF(B37:V37<>0,B37:V37,""))),"-",(AVERAGE(IF(B37:V37<>0,B37:V37,"")))) -> 44.647058823529413 | X37: =IF(ISERROR(W37-37),"-",(W37-37)) -> 7.647058823529413 | Y37: ='M. McComas'!$M$52 -> 39.705882352941174 | Z37: =IF(ISERROR(RANK(Y37,Y$6:Y$85,1)),"-",RANK(Y37,Y$6:Y$85,1)) -> 21 | AA37: =IF(MIN(B37:V37)=0,"-",MIN(B37:V37)) -> 41 | AB37: =IF(MAX(C37:W37)=0,"-",MAX(C37:W37)) -> 50 | AC37: ='M. McComas'!$N$53 -> 35
A38: Avg | C38: =IF(ISERROR(AVERAGE(IF(B37:C37<>0,B37:C37,""))),"-",(AVERAGE(IF(B37:C37<>0,B37:C37,"")))) -> 42.5 | D38: =IF(ISERROR(AVERAGE(IF(B37:D37<>0,B37:D37,""))),"-",(AVERAGE(IF(B37:D37<>0,B37:D37,"")))) -> 44.333333333333336 | E38: =IF(ISERROR(AVERAGE(IF(B37:E37<>0,B37:E37,""))),"-",(AVERAGE(IF(B37:E37<>0,B37:E37,"")))) -> 43.5 | F38: =IF(ISERROR(AVERAGE(IF(B37:F37<>0,B37:F37,""))),"-",(AVERAGE(IF(B37:F37<>0,B37:F37,"")))) -> 43.5 | G38: =IF(ISERROR(AVERAGE(IF(B37:G37<>0,B37:G37,""))),"-",(AVERAGE(IF(B37:G37<>0,B37:G37,"")))) -> 44.2 | H38: =IF(ISERROR(AVERAGE(IF(B37:H37<>0,B37:H37,""))),"-",(AVERAGE(IF(B37:H37<>0,B37:H37,"")))) -> 44.666666666666664 | I38: =IF(ISERROR(AVERAGE(IF(B37:I37<>0,B37:I37,""))),"-",(AVERAGE(IF(B37:I37<>0,B37:I37,"")))) -> 44.285714285714285 | J38: =IF(ISERROR(AVERAGE(IF(B37:J37<>0,B37:J37,""))),"-",(AVERAGE(IF(B37:J37<>0,B37:J37,"")))) -> 44.375 | K38: =IF(ISERROR(AVERAGE(IF(B37:K37<>0,B37:K37,""))),"-",(AVERAGE(IF(B37:K37<>0,B37:K37,"")))) -> 44.222222222222221 | M38: =IF(ISERROR(AVERAGE(IF(B37:M37<>0,B37:M37,""))),"-",(AVERAGE(IF(B37:M37<>0,B37:M37,"")))) -> 44.3 | N38: =IF(ISERROR(AVERAGE(IF(B37:N37<>0,B37:N37,""))),"-",(AVERAGE(IF(B37:N37<>0,B37:N37,"")))) -> 44.81818181818182 | O38: =IF(ISERROR(AVERAGE(IF(B37:O37<>0,B37:O37,""))),"-",(AVERAGE(IF(B37:O37<>0,B37:O37,"")))) -> 44.916666666666664 | P38: =IF(ISERROR(AVERAGE(IF(B37:P37<>0,B37:P37,""))),"-",(AVERAGE(IF(B37:P37<>0,B37:P37,"")))) -> 44.692307692307693 | Q38: =IF(ISERROR(AVERAGE(IF(B37:Q37<>0,B37:Q37,""))),"-",(AVERAGE(IF(B37:Q37<>0,B37:Q37,"")))) -> 44.928571428571431 | R38: =IF(ISERROR(AVERAGE(IF(B37:R37<>0,B37:R37,""))),"-",(AVERAGE(IF(B37:R37<>0,B37:R37,"")))) -> 44.928571428571431 | S38: =IF(ISERROR(AVERAGE(IF(B37:S37<>0,B37:S37,""))),"-",(AVERAGE(IF(B37:S37<>0,B37:S37,"")))) -> 44.93333333333333 | T38: =IF(ISERROR(AVERAGE(IF(B37:T37<>0,B37:T37,""))),"-",(AVERAGE(IF(B37:T37<>0,B37:T37,"")))) -> 44.875 | U38: =IF(ISERROR(AVERAGE(IF(B37:U37<>0,B37:U37,""))),"-",(AVERAGE(IF(B37:U37<>0,B37:U37,"")))) -> 44.647058823529413 | V38: =IF(ISERROR(AVERAGE(IF(B37:V37<>0,B37:V37,""))),"-",(AVERAGE(IF(B37:V37<>0,B37:V37,"")))) -> 44.647058823529413
A40: ='M. Kyle'!$A$1 -> M. Kyle | B40: ='M. Kyle'!$K$10 -> 52 | C40: ='M. Kyle'!$K$11 -> 46 | D40: ='M. Kyle'!$K$12 -> 48 | E40: ='M. Kyle'!$K$13 -> 46 | F40: ='M. Kyle'!$K$14 -> 45 | G40: ='M. Kyle'!$K$21 -> 49 | H40: ='M. Kyle'!$K$22 -> 49 | I40: ='M. Kyle'!$K$23 -> 51 | J40: ='M. Kyle'!$K$24 -> 46 | K40: ='M. Kyle'!$K$25 -> 44 | M40: ='M. Kyle'!$K$34 -> 52 | N40: ='M. Kyle'!$K$35 -> 55 | O40: ='M. Kyle'!$K$36 -> 42 | P40: ='M. Kyle'!$K$37 -> 47 | Q40: ='M. Kyle'!$K$38 -> 51 | R40: ='M. Kyle'!$K$45 -> 41 | S40: ='M. Kyle'!$K$46 -> - | T40: ='M. Kyle'!$K$47 -> 48 | U40: ='M. Kyle'!$K$48 -> 50 | V40: ='M. Kyle'!$K$49 -> - | W40: =IF(ISERROR(AVERAGE(IF(B40:V40<>0,B40:V40,""))),"-",(AVERAGE(IF(B40:V40<>0,B40:V40,"")))) -> 47.888888888888886 | X40: =IF(ISERROR(W40-37),"-",(W40-37)) -> 10.888888888888886 | Y40: ='M. Kyle'!$M$52 -> 39.166666666666664 | Z40: =IF(ISERROR(RANK(Y40,Y$6:Y$85,1)),"-",RANK(Y40,Y$6:Y$85,1)) -> 18 | AA40: =IF(MIN(B40:V40)=0,"-",MIN(B40:V40)) -> 41 | AB40: =IF(MAX(C40:W40)=0,"-",MAX(C40:W40)) -> 55 | AC40: ='M. Kyle'!$N$53 -> 32
A41: Avg | C41: =IF(ISERROR(AVERAGE(IF(B40:C40<>0,B40:C40,""))),"-",(AVERAGE(IF(B40:C40<>0,B40:C40,"")))) -> 49 | D41: =IF(ISERROR(AVERAGE(IF(B40:D40<>0,B40:D40,""))),"-",(AVERAGE(IF(B40:D40<>0,B40:D40,"")))) -> 48.666666666666664 | E41: =IF(ISERROR(AVERAGE(IF(B40:E40<>0,B40:E40,""))),"-",(AVERAGE(IF(B40:E40<>0,B40:E40,"")))) -> 48 | F41: =IF(ISERROR(AVERAGE(IF(B40:F40<>0,B40:F40,""))),"-",(AVERAGE(IF(B40:F40<>0,B40:F40,"")))) -> 47.4 | G41: =IF(ISERROR(AVERAGE(IF(B40:G40<>0,B40:G40,""))),"-",(AVERAGE(IF(B40:G40<>0,B40:G40,"")))) -> 47.666666666666664 | H41: =IF(ISERROR(AVERAGE(IF(B40:H40<>0,B40:H40,""))),"-",(AVERAGE(IF(B40:H40<>0,B40:H40,"")))) -> 47.857142857142854 | I41: =IF(ISERROR(AVERAGE(IF(B40:I40<>0,B40:I40,""))),"-",(AVERAGE(IF(B40:I40<>0,B40:I40,"")))) -> 48.25 | J41: =IF(ISERROR(AVERAGE(IF(B40:J40<>0,B40:J40,""))),"-",(AVERAGE(IF(B40:J40<>0,B40:J40,"")))) -> 48 | K41: =IF(ISERROR(AVERAGE(IF(B40:K40<>0,B40:K40,""))),"-",(AVERAGE(IF(B40:K40<>0,B40:K40,"")))) -> 47.6 | M41: =IF(ISERROR(AVERAGE(IF(B40:M40<>0,B40:M40,""))),"-",(AVERAGE(IF(B40:M40<>0,B40:M40,"")))) -> 48 | N41: =IF(ISERROR(AVERAGE(IF(B40:N40<>0,B40:N40,""))),"-",(AVERAGE(IF(B40:N40<>0,B40:N40,"")))) -> 48.583333333333336 | O41: =IF(ISERROR(AVERAGE(IF(B40:O40<>0,B40:O40,""))),"-",(AVERAGE(IF(B40:O40<>0,B40:O40,"")))) -> 48.07692307692308 | P41: =IF(ISERROR(AVERAGE(IF(B40:P40<>0,B40:P40,""))),"-",(AVERAGE(IF(B40:P40<>0,B40:P40,"")))) -> 48 | Q41: =IF(ISERROR(AVERAGE(IF(B40:Q40<>0,B40:Q40,""))),"-",(AVERAGE(IF(B40:Q40<>0,B40:Q40,"")))) -> 48.2 | R41: =IF(ISERROR(AVERAGE(IF(B40:R40<>0,B40:R40,""))),"-",(AVERAGE(IF(B40:R40<>0,B40:R40,"")))) -> 47.75 | S41: =IF(ISERROR(AVERAGE(IF(B40:S40<>0,B40:S40,""))),"-",(AVERAGE(IF(B40:S40<>0,B40:S40,"")))) -> 47.75 | T41: =IF(ISERROR(AVERAGE(IF(B40:T40<>0,B40:T40,""))),"-",(AVERAGE(IF(B40:T40<>0,B40:T40,"")))) -> 47.764705882352942 | U41: =IF(ISERROR(AVERAGE(IF(B40:U40<>0,B40:U40,""))),"-",(AVERAGE(IF(B40:U40<>0,B40:U40,"")))) -> 47.888888888888886 | V41: =IF(ISERROR(AVERAGE(IF(B40:V40<>0,B40:V40,""))),"-",(AVERAGE(IF(B40:V40<>0,B40:V40,"")))) -> 47.888888888888886
A43: ='B. Kyle'!$A$1 -> B. Kyle | B43: ='B. Kyle'!$K$10 -> 54 | C43: ='B. Kyle'!$K$11 -> 53 | D43: ='B. Kyle'!$K$12 -> 60 | E43: ='B. Kyle'!$K$13 -> 55 | F43: ='B. Kyle'!$K$14 -> 50 | G43: ='B. Kyle'!$K$21 -> 52 | H43: ='B. Kyle'!$K$22 -> 52 | I43: ='B. Kyle'!$K$23 -> 53 | J43: ='B. Kyle'!$K$24 -> 47 | K43: ='B. Kyle'!$K$25 -> 51 | M43: ='B. Kyle'!$K$34 -> 51 | N43: ='B. Kyle'!$K$35 -> 55 | O43: ='B. Kyle'!$K$36 -> 49 | P43: ='B. Kyle'!$K$37 -> 56 | Q43: ='B. Kyle'!$K$38 -> 58 | R43: ='B. Kyle'!$K$45 -> 52 | S43: ='B. Kyle'!$K$46 -> 56 | T43: ='B. Kyle'!$K$47 -> 46 | U43: ='B. Kyle'!$K$48 -> - | V43: ='B. Kyle'!$K$49 -> - | W43: =IF(ISERROR(AVERAGE(IF(B43:V43<>0,B43:V43,""))),"-",(AVERAGE(IF(B43:V43<>0,B43:V43,"")))) -> 52.777777777777779 | X43: =IF(ISERROR(W43-37),"-",(W43-37)) -> 15.777777777777779 | Y43: ='B. Kyle'!$M$52 -> 38.50 | Z43: =IF(ISERROR(RANK(Y43,Y$6:Y$85,1)),"-",RANK(Y43,Y$6:Y$85,1)) -> 3 | AA43: =IF(MIN(B43:V43)=0,"-",MIN(B43:V43)) -> 46 | AB43: =IF(MAX(C43:W43)=0,"-",MAX(C43:W43)) -> 60 | AC43: ='B. Kyle'!$N$53 -> 32
A44: Avg | C44: =IF(ISERROR(AVERAGE(IF(B43:C43<>0,B43:C43,""))),"-",(AVERAGE(IF(B43:C43<>0,B43:C43,"")))) -> 53.5 | D44: =IF(ISERROR(AVERAGE(IF(B43:D43<>0,B43:D43,""))),"-",(AVERAGE(IF(B43:D43<>0,B43:D43,"")))) -> 55.666666666666664 | E44: =IF(ISERROR(AVERAGE(IF(B43:E43<>0,B43:E43,""))),"-",(AVERAGE(IF(B43:E43<>0,B43:E43,"")))) -> 55.5 | F44: =IF(ISERROR(AVERAGE(IF(B43:F43<>0,B43:F43,""))),"-",(AVERAGE(IF(B43:F43<>0,B43:F43,"")))) -> 54.4 | G44: =IF(ISERROR(AVERAGE(IF(B43:G43<>0,B43:G43,""))),"-",(AVERAGE(IF(B43:G43<>0,B43:G43,"")))) -> 54 | H44: =IF(ISERROR(AVERAGE(IF(B43:H43<>0,B43:H43,""))),"-",(AVERAGE(IF(B43:H43<>0,B43:H43,"")))) -> 53.714285714285715 | I44: =IF(ISERROR(AVERAGE(IF(B43:I43<>0,B43:I43,""))),"-",(AVERAGE(IF(B43:I43<>0,B43:I43,"")))) -> 53.625 | J44: =IF(ISERROR(AVERAGE(IF(B43:J43<>0,B43:J43,""))),"-",(AVERAGE(IF(B43:J43<>0,B43:J43,"")))) -> 52.888888888888886 | K44: =IF(ISERROR(AVERAGE(IF(B43:K43<>0,B43:K43,""))),"-",(AVERAGE(IF(B43:K43<>0,B43:K43,"")))) -> 52.7 | M44: =IF(ISERROR(AVERAGE(IF(B43:M43<>0,B43:M43,""))),"-",(AVERAGE(IF(B43:M43<>0,B43:M43,"")))) -> 52.545454545454547 | N44: =IF(ISERROR(AVERAGE(IF(B43:N43<>0,B43:N43,""))),"-",(AVERAGE(IF(B43:N43<>0,B43:N43,"")))) -> 52.75 | O44: =IF(ISERROR(AVERAGE(IF(B43:O43<>0,B43:O43,""))),"-",(AVERAGE(IF(B43:O43<>0,B43:O43,"")))) -> 52.46153846153846 | P44: =IF(ISERROR(AVERAGE(IF(B43:P43<>0,B43:P43,""))),"-",(AVERAGE(IF(B43:P43<>0,B43:P43,"")))) -> 52.714285714285715 | Q44: =IF(ISERROR(AVERAGE(IF(B43:Q43<>0,B43:Q43,""))),"-",(AVERAGE(IF(B43:Q43<>0,B43:Q43,"")))) -> 53.06666666666667 | R44: =IF(ISERROR(AVERAGE(IF(B43:R43<>0,B43:R43,""))),"-",(AVERAGE(IF(B43:R43<>0,B43:R43,"")))) -> 53 | S44: =IF(ISERROR(AVERAGE(IF(B43:S43<>0,B43:S43,""))),"-",(AVERAGE(IF(B43:S43<>0,B43:S43,"")))) -> 53.176470588235297 | T44: =IF(ISERROR(AVERAGE(IF(B43:T43<>0,B43:T43,""))),"-",(AVERAGE(IF(B43:T43<>0,B43:T43,"")))) -> 52.777777777777779 | U44: =IF(ISERROR(AVERAGE(IF(B43:U43<>0,B43:U43,""))),"-",(AVERAGE(IF(B43:U43<>0,B43:U43,"")))) -> 52.777777777777779 | V44: =IF(ISERROR(AVERAGE(IF(B43:V43<>0,B43:V43,""))),"-",(AVERAGE(IF(B43:V43<>0,B43:V43,"")))) -> 52.777777777777779
A46: Team 4
A47: Week | B47: 1 | C47: 2 | D47: 3 | E47: 4 | F47: 5 | G47: 6 | H47: 7 | I47: 8 | J47: 9 | K47: 10 | M47: 11 | N47: 12 | O47: 13 | P47: 14 | Q47: 15 | R47: 16 | S47: 17 | T47: 18 | U47: 19 | V47: 20 | W47: Avg. | X47: Par | Y47: Net Avg. | Z47: Overall Rank | AA47: Low Rnd. | AB47: Max Rnd. | AC47: Low Net Rnd.
A48: ='R. Keeney'!$A$1 -> R. Keeney | B48: ='R. Keeney'!$K$10 -> 46 | C48: ='R. Keeney'!$K$11 -> 39 | D48: ='R. Keeney'!$K$12 -> 42 | E48: ='R. Keeney'!$K$13 -> 39 | F48: ='R. Keeney'!$K$14 -> 44 | G48: ='R. Keeney'!$K$21 -> 41 | H48: ='R. Keeney'!$K$22 -> 41 | I48: ='R. Keeney'!$K$23 -> 42 | J48: ='R. Keeney'!$K$24 -> 44 | K48: ='R. Keeney'!$K$25 -> 40 | M48: ='R. Keeney'!$K$34 -> 41 | N48: ='R. Keeney'!$K$35 -> 41 | O48: ='R. Keeney'!$K$36 -> 44 | P48: ='R. Keeney'!$K$37 -> - | Q48: ='R. Keeney'!$K$38 -> 41 | R48: ='R. Keeney'!$K$45 -> 39 | S48: ='R. Keeney'!$K$46 -> 41 | T48: ='R. Keeney'!$K$47 -> 41 | U48: ='R. Keeney'!$K$48 -> - | V48: ='R. Keeney'!$K$49 -> - | W48: =IF(ISERROR(AVERAGE(IF(B48:V48<>0,B48:V48,""))),"-",(AVERAGE(IF(B48:V48<>0,B48:V48,"")))) -> 41.529411764705884 | X48: =IF(ISERROR(W48-37),"-",(W48-37)) -> 4.529411764705884 | Y48: ='R. Keeney'!$M$52 -> 38.529411764705884 | Z48: =IF(ISERROR(RANK(Y48,Y$6:Y$85,1)),"-",RANK(Y48,Y$6:Y$85,1)) -> 5 | AA48: =IF(MIN(B48:V48)=0,"-",MIN(B48:V48)) -> 39 | AB48: =IF(MAX(C48:W48)=0,"-",MAX(C48:W48)) -> 44 | AC48: ='R. Keeney'!$N$53 -> 36
A49: Avg | C49: =IF(ISERROR(AVERAGE(IF(B48:C48<>0,B48:C48,""))),"-",(AVERAGE(IF(B48:C48<>0,B48:C48,"")))) -> 42.5 | D49: =IF(ISERROR(AVERAGE(IF(B48:D48<>0,B48:D48,""))),"-",(AVERAGE(IF(B48:D48<>0,B48:D48,"")))) -> 42.333333333333336 | E49: =IF(ISERROR(AVERAGE(IF(B48:E48<>0,B48:E48,""))),"-",(AVERAGE(IF(B48:E48<>0,B48:E48,"")))) -> 41.5 | F49: =IF(ISERROR(AVERAGE(IF(B48:F48<>0,B48:F48,""))),"-",(AVERAGE(IF(B48:F48<>0,B48:F48,"")))) -> 42 | G49: =IF(ISERROR(AVERAGE(IF(B48:G48<>0,B48:G48,""))),"-",(AVERAGE(IF(B48:G48<>0,B48:G48,"")))) -> 41.833333333333336 | H49: =IF(ISERROR(AVERAGE(IF(B48:H48<>0,B48:H48,""))),"-",(AVERAGE(IF(B48:H48<>0,B48:H48,"")))) -> 41.714285714285715 | I49: =IF(ISERROR(AVERAGE(IF(B48:I48<>0,B48:I48,""))),"-",(AVERAGE(IF(B48:I48<>0,B48:I48,"")))) -> 41.75 | J49: =IF(ISERROR(AVERAGE(IF(B48:J48<>0,B48:J48,""))),"-",(AVERAGE(IF(B48:J48<>0,B48:J48,"")))) -> 42 | K49: =IF(ISERROR(AVERAGE(IF(B48:K48<>0,B48:K48,""))),"-",(AVERAGE(IF(B48:K48<>0,B48:K48,"")))) -> 41.8 | M49: =IF(ISERROR(AVERAGE(IF(B48:M48<>0,B48:M48,""))),"-",(AVERAGE(IF(B48:M48<>0,B48:M48,"")))) -> 41.727272727272727 | N49: =IF(ISERROR(AVERAGE(IF(B48:N48<>0,B48:N48,""))),"-",(AVERAGE(IF(B48:N48<>0,B48:N48,"")))) -> 41.666666666666664 | O49: =IF(ISERROR(AVERAGE(IF(B48:O48<>0,B48:O48,""))),"-",(AVERAGE(IF(B48:O48<>0,B48:O48,"")))) -> 41.846153846153847 | P49: =IF(ISERROR(AVERAGE(IF(B48:P48<>0,B48:P48,""))),"-",(AVERAGE(IF(B48:P48<>0,B48:P48,"")))) -> 41.846153846153847 | Q49: =IF(ISERROR(AVERAGE(IF(B48:Q48<>0,B48:Q48,""))),"-",(AVERAGE(IF(B48:Q48<>0,B48:Q48,"")))) -> 41.785714285714285 | R49: =IF(ISERROR(AVERAGE(IF(B48:R48<>0,B48:R48,""))),"-",(AVERAGE(IF(B48:R48<>0,B48:R48,"")))) -> 41.6 | S49: =IF(ISERROR(AVERAGE(IF(B48:S48<>0,B48:S48,""))),"-",(AVERAGE(IF(B48:S48<>0,B48:S48,"")))) -> 41.5625 | T49: =IF(ISERROR(AVERAGE(IF(B48:T48<>0,B48:T48,""))),"-",(AVERAGE(IF(B48:T48<>0,B48:T48,"")))) -> 41.529411764705884 | U49: =IF(ISERROR(AVERAGE(IF(B48:U48<>0,B48:U48,""))),"-",(AVERAGE(IF(B48:U48<>0,B48:U48,"")))) -> 41.529411764705884 | V49: =IF(ISERROR(AVERAGE(IF(B48:V48<>0,B48:V48,""))),"-",(AVERAGE(IF(B48:V48<>0,B48:V48,"")))) -> 41.529411764705884
A51: ='T. Proctor'!$A$1 -> T. Proctor | B51: ='T. Proctor'!$K$10 -> 41 | C51: ='T. Proctor'!$K$11 -> 50 | D51: ='T. Proctor'!$K$12 -> 44 | E51: ='T. Proctor'!$K$13 -> 41 | F51: ='T. Proctor'!$K$14 -> 44 | G51: ='T. Proctor'!$K$21 -> 47 | H51: ='T. Proctor'!$K$22 -> 42 | I51: ='T. Proctor'!$K$23 -> 43 | J51: ='T. Proctor'!$K$24 -> - | K51: ='T. Proctor'!$K$25 -> 45 | M51: ='T. Proctor'!$K$34 -> 45 | N51: ='T. Proctor'!$K$35 -> 46 | O51: ='T. Proctor'!$K$36 -> 46 | P51: ='T. Proctor'!$K$37 -> 43 | Q51: ='T. Proctor'!$K$38 -> 45 | R51: ='T. Proctor'!$K$45 -> 42 | S51: ='T. Proctor'!$K$46 -> 45 | T51: ='T. Proctor'!$K$47 -> 45 | U51: ='T. Proctor'!$K$48 -> 44 | V51: ='T. Proctor'!$K$49 -> - | W51: =IF(ISERROR(AVERAGE(IF(B51:V51<>0,B51:V51,""))),"-",(AVERAGE(IF(B51:V51<>0,B51:V51,"")))) -> 44.333333333333336 | X51: =IF(ISERROR(W51-37),"-",(W51-37)) -> 7.3333333333333357 | Y51: ='T. Proctor'!$M$52 -> 39.388888888888886 | Z51: =IF(ISERROR(RANK(Y51,Y$6:Y$85,1)),"-",RANK(Y51,Y$6:Y$85,1)) -> 20 | AA51: =IF(MIN(B51:V51)=0,"-",MIN(B51:V51)) -> 41 | AB51: =IF(MAX(C51:W51)=0,"-",MAX(C51:W51)) -> 50 | AC51: ='T. Proctor'!$N$53 -> 36
A52: Avg | C52: =IF(ISERROR(AVERAGE(IF(B51:C51<>0,B51:C51,""))),"-",(AVERAGE(IF(B51:C51<>0,B51:C51,"")))) -> 45.5 | D52: =IF(ISERROR(AVERAGE(IF(B51:D51<>0,B51:D51,""))),"-",(AVERAGE(IF(B51:D51<>0,B51:D51,"")))) -> 45 | E52: =IF(ISERROR(AVERAGE(IF(B51:E51<>0,B51:E51,""))),"-",(AVERAGE(IF(B51:E51<>0,B51:E51,"")))) -> 44 | F52: =IF(ISERROR(AVERAGE(IF(B51:F51<>0,B51:F51,""))),"-",(AVERAGE(IF(B51:F51<>0,B51:F51,"")))) -> 44 | G52: =IF(ISERROR(AVERAGE(IF(B51:G51<>0,B51:G51,""))),"-",(AVERAGE(IF(B51:G51<>0,B51:G51,"")))) -> 44.5 | H52: =IF(ISERROR(AVERAGE(IF(B51:H51<>0,B51:H51,""))),"-",(AVERAGE(IF(B51:H51<>0,B51:H51,"")))) -> 44.142857142857146 | I52: =IF(ISERROR(AVERAGE(IF(B51:I51<>0,B51:I51,""))),"-",(AVERAGE(IF(B51:I51<>0,B51:I51,"")))) -> 44 | J52: =IF(ISERROR(AVERAGE(IF(B51:J51<>0,B51:J51,""))),"-",(AVERAGE(IF(B51:J51<>0,B51:J51,"")))) -> 44 | K52: =IF(ISERROR(AVERAGE(IF(B51:K51<>0,B51:K51,""))),"-",(AVERAGE(IF(B51:K51<>0,B51:K51,"")))) -> 44.111111111111114 | M52: =IF(ISERROR(AVERAGE(IF(B51:M51<>0,B51:M51,""))),"-",(AVERAGE(IF(B51:M51<>0,B51:M51,"")))) -> 44.2 | N52: =IF(ISERROR(AVERAGE(IF(B51:N51<>0,B51:N51,""))),"-",(AVERAGE(IF(B51:N51<>0,B51:N51,"")))) -> 44.363636363636367 | O52: =IF(ISERROR(AVERAGE(IF(B51:O51<>0,B51:O51,""))),"-",(AVERAGE(IF(B51:O51<>0,B51:O51,"")))) -> 44.5 | P52: =IF(ISERROR(AVERAGE(IF(B51:P51<>0,B51:P51,""))),"-",(AVERAGE(IF(B51:P51<>0,B51:P51,"")))) -> 44.384615384615387 | Q52: =IF(ISERROR(AVERAGE(IF(B51:Q51<>0,B51:Q51,""))),"-",(AVERAGE(IF(B51:Q51<>0,B51:Q51,"")))) -> 44.428571428571431 | R52: =IF(ISERROR(AVERAGE(IF(B51:R51<>0,B51:R51,""))),"-",(AVERAGE(IF(B51:R51<>0,B51:R51,"")))) -> 44.266666666666666 | S52: =IF(ISERROR(AVERAGE(IF(B51:S51<>0,B51:S51,""))),"-",(AVERAGE(IF(B51:S51<>0,B51:S51,"")))) -> 44.3125 | T52: =IF(ISERROR(AVERAGE(IF(B51:T51<>0,B51:T51,""))),"-",(AVERAGE(IF(B51:T51<>0,B51:T51,"")))) -> 44.352941176470587 | U52: =IF(ISERROR(AVERAGE(IF(B51:U51<>0,B51:U51,""))),"-",(AVERAGE(IF(B51:U51<>0,B51:U51,"")))) -> 44.333333333333336 | V52: =IF(ISERROR(AVERAGE(IF(B51:V51<>0,B51:V51,""))),"-",(AVERAGE(IF(B51:V51<>0,B51:V51,"")))) -> 44.333333333333336
A54: ='S. Jones'!$A$1 -> S. Jones | B54: ='S. Jones'!$K$10 -> 47 | C54: ='S. Jones'!$K$11 -> 48 | D54: ='S. Jones'!$K$12 -> 43 | E54: ='S. Jones'!$K$13 -> 44 | F54: ='S. Jones'!$K$14 -> 47 | G54: ='S. Jones'!$K$21 -> 50 | H54: ='S. Jones'!$K$22 -> 44 | I54: ='S. Jones'!$K$23 -> 47 | J54: ='S. Jones'!$K$24 -> 50 | K54: ='S. Jones'!$K$25 -> 42 | M54: ='S. Jones'!$K$34 -> 48 | N54: ='S. Jones'!$K$35 -> 42 | O54: ='S. Jones'!$K$36 -> 44 | P54: ='S. Jones'!$K$37 -> 47 | Q54: ='S. Jones'!$K$38 -> 46 | R54: ='S. Jones'!$K$45 -> 48 | S54: ='S. Jones'!$K$46 -> 46 | T54: ='S. Jones'!$K$47 -> 48 | U54: ='S. Jones'!$K$48 -> 46 | V54: ='S. Jones'!$K$49 -> - | W54: =IF(ISERROR(AVERAGE(IF(B54:V54<>0,B54:V54,""))),"-",(AVERAGE(IF(B54:V54<>0,B54:V54,"")))) -> 46.157894736842103 | X54: =IF(ISERROR(W54-37),"-",(W54-37)) -> 9.1578947368421026 | Y54: ='S. Jones'!$M$52 -> 38.631578947368418 | Z54: =IF(ISERROR(RANK(Y54,Y$6:Y$85,1)),"-",RANK(Y54,Y$6:Y$85,1)) -> 7 | AA54: =IF(MIN(B54:V54)=0,"-",MIN(B54:V54)) -> 42 | AB54: =IF(MAX(C54:W54)=0,"-",MAX(C54:W54)) -> 50 | AC54: ='S. Jones'!$N$53 -> 34
A55: Avg | C55: =IF(ISERROR(AVERAGE(IF(B54:C54<>0,B54:C54,""))),"-",(AVERAGE(IF(B54:C54<>0,B54:C54,"")))) -> 47.5 | D55: =IF(ISERROR(AVERAGE(IF(B54:D54<>0,B54:D54,""))),"-",(AVERAGE(IF(B54:D54<>0,B54:D54,"")))) -> 46 | E55: =IF(ISERROR(AVERAGE(IF(B54:E54<>0,B54:E54,""))),"-",(AVERAGE(IF(B54:E54<>0,B54:E54,"")))) -> 45.5 | F55: =IF(ISERROR(AVERAGE(IF(B54:F54<>0,B54:F54,""))),"-",(AVERAGE(IF(B54:F54<>0,B54:F54,"")))) -> 45.8 | G55: =IF(ISERROR(AVERAGE(IF(B54:G54<>0,B54:G54,""))),"-",(AVERAGE(IF(B54:G54<>0,B54:G54,"")))) -> 46.5 | H55: =IF(ISERROR(AVERAGE(IF(B54:H54<>0,B54:H54,""))),"-",(AVERAGE(IF(B54:H54<>0,B54:H54,"")))) -> 46.142857142857146 | I55: =IF(ISERROR(AVERAGE(IF(B54:I54<>0,B54:I54,""))),"-",(AVERAGE(IF(B54:I54<>0,B54:I54,"")))) -> 46.25 | J55: =IF(ISERROR(AVERAGE(IF(B54:J54<>0,B54:J54,""))),"-",(AVERAGE(IF(B54:J54<>0,B54:J54,"")))) -> 46.666666666666664 | K55: =IF(ISERROR(AVERAGE(IF(B54:K54<>0,B54:K54,""))),"-",(AVERAGE(IF(B54:K54<>0,B54:K54,"")))) -> 46.2 | M55: =IF(ISERROR(AVERAGE(IF(B54:M54<>0,B54:M54,""))),"-",(AVERAGE(IF(B54:M54<>0,B54:M54,"")))) -> 46.363636363636367 | N55: =IF(ISERROR(AVERAGE(IF(B54:N54<>0,B54:N54,""))),"-",(AVERAGE(IF(B54:N54<>0,B54:N54,"")))) -> 46 | O55: =IF(ISERROR(AVERAGE(IF(B54:O54<>0,B54:O54,""))),"-",(AVERAGE(IF(B54:O54<>0,B54:O54,"")))) -> 45.846153846153847 | P55: =IF(ISERROR(AVERAGE(IF(B54:P54<>0,B54:P54,""))),"-",(AVERAGE(IF(B54:P54<>0,B54:P54,"")))) -> 45.928571428571431 | Q55: =IF(ISERROR(AVERAGE(IF(B54:Q54<>0,B54:Q54,""))),"-",(AVERAGE(IF(B54:Q54<>0,B54:Q54,"")))) -> 45.93333333333333 | R55: =IF(ISERROR(AVERAGE(IF(B54:R54<>0,B54:R54,""))),"-",(AVERAGE(IF(B54:R54<>0,B54:R54,"")))) -> 46.0625 | S55: =IF(ISERROR(AVERAGE(IF(B54:S54<>0,B54:S54,""))),"-",(AVERAGE(IF(B54:S54<>0,B54:S54,"")))) -> 46.058823529411768 | T55: =IF(ISERROR(AVERAGE(IF(B54:T54<>0,B54:T54,""))),"-",(AVERAGE(IF(B54:T54<>0,B54:T54,"")))) -> 46.166666666666664 | U55: =IF(ISERROR(AVERAGE(IF(B54:U54<>0,B54:U54,""))),"-",(AVERAGE(IF(B54:U54<>0,B54:U54,"")))) -> 46.157894736842103 | V55: =IF(ISERROR(AVERAGE(IF(B54:V54<>0,B54:V54,""))),"-",(AVERAGE(IF(B54:V54<>0,B54:V54,"")))) -> 46.157894736842103
A57: ='T. Baumgarner'!$A$1 -> T. Baumgarner | B57: ='T. Baumgarner'!$K$10 -> 43 | C57: ='T. Baumgarner'!$K$11 -> 54 | D57: ='T. Baumgarner'!$K$12 -> 50 | E57: ='T. Baumgarner'!$K$13 -> 52 | F57: ='T. Baumgarner'!$K$14 -> 57 | G57: ='T. Baumgarner'!$K$21 -> 49 | H57: ='T. Baumgarner'!$K$22 -> 52 | I57: ='T. Baumgarner'!$K$23 -> 47 | J57: ='T. Baumgarner'!$K$24 -> - | K57: ='T. Baumgarner'!$K$25 -> 48 | M57: ='T. Baumgarner'!$K$34 -> 52 | N57: ='T. Baumgarner'!$K$35 -> 51 | O57: ='T. Baumgarner'!$K$36 -> 49 | P57: ='T. Baumgarner'!$K$37 -> 50 | Q57: ='T. Baumgarner'!$K$38 -> 53 | R57: ='T. Baumgarner'!$K$45 -> 57 | S57: ='T. Baumgarner'!$K$46 -> 54 | T57: ='T. Baumgarner'!$K$47 -> 56 | U57: ='T. Baumgarner'!$K$48 -> - | V57: ='T. Baumgarner'!$K$49 -> - | W57: =IF(ISERROR(AVERAGE(IF(B57:V57<>0,B57:V57,""))),"-",(AVERAGE(IF(B57:V57<>0,B57:V57,"")))) -> 51.411764705882355 | X57: =IF(ISERROR(W57-37),"-",(W57-37)) -> 14.411764705882355 | Y57: ='T. Baumgarner'!$M$52 -> 40.411764705882355 | Z57: =IF(ISERROR(RANK(Y57,Y$6:Y$85,1)),"-",RANK(Y57,Y$6:Y$85,1)) -> 23 | AA57: =IF(MIN(B57:V57)=0,"-",MIN(B57:V57)) -> 43 | AB57: =IF(MAX(C57:W57)=0,"-",MAX(C57:W57)) -> 57 | AC57: ='T. Baumgarner'!$N$53 -> 31
A58: Avg | C58: =IF(ISERROR(AVERAGE(IF(B57:C57<>0,B57:C57,""))),"-",(AVERAGE(IF(B57:C57<>0,B57:C57,"")))) -> 48.5 | D58: =IF(ISERROR(AVERAGE(IF(B57:D57<>0,B57:D57,""))),"-",(AVERAGE(IF(B57:D57<>0,B57:D57,"")))) -> 49 | E58: =IF(ISERROR(AVERAGE(IF(B57:E57<>0,B57:E57,""))),"-",(AVERAGE(IF(B57:E57<>0,B57:E57,"")))) -> 49.75 | F58: =IF(ISERROR(AVERAGE(IF(B57:F57<>0,B57:F57,""))),"-",(AVERAGE(IF(B57:F57<>0,B57:F57,"")))) -> 51.2 | G58: =IF(ISERROR(AVERAGE(IF(B57:G57<>0,B57:G57,""))),"-",(AVERAGE(IF(B57:G57<>0,B57:G57,"")))) -> 50.833333333333336 | H58: =IF(ISERROR(AVERAGE(IF(B57:H57<>0,B57:H57,""))),"-",(AVERAGE(IF(B57:H57<>0,B57:H57,"")))) -> 51 | I58: =IF(ISERROR(AVERAGE(IF(B57:I57<>0,B57:I57,""))),"-",(AVERAGE(IF(B57:I57<>0,B57:I57,"")))) -> 50.5 | J58: =IF(ISERROR(AVERAGE(IF(B57:J57<>0,B57:J57,""))),"-",(AVERAGE(IF(B57:J57<>0,B57:J57,"")))) -> 50.5 | K58: =IF(ISERROR(AVERAGE(IF(B57:K57<>0,B57:K57,""))),"-",(AVERAGE(IF(B57:K57<>0,B57:K57,"")))) -> 50.222222222222221 | M58: =IF(ISERROR(AVERAGE(IF(B57:M57<>0,B57:M57,""))),"-",(AVERAGE(IF(B57:M57<>0,B57:M57,"")))) -> 50.4 | N58: =IF(ISERROR(AVERAGE(IF(B57:N57<>0,B57:N57,""))),"-",(AVERAGE(IF(B57:N57<>0,B57:N57,"")))) -> 50.454545454545453 | O58: =IF(ISERROR(AVERAGE(IF(B57:O57<>0,B57:O57,""))),"-",(AVERAGE(IF(B57:O57<>0,B57:O57,"")))) -> 50.333333333333336 | P58: =IF(ISERROR(AVERAGE(IF(B57:P57<>0,B57:P57,""))),"-",(AVERAGE(IF(B57:P57<>0,B57:P57,"")))) -> 50.307692307692307 | Q58: =IF(ISERROR(AVERAGE(IF(B57:Q57<>0,B57:Q57,""))),"-",(AVERAGE(IF(B57:Q57<>0,B57:Q57,"")))) -> 50.5 | R58: =IF(ISERROR(AVERAGE(IF(B57:R57<>0,B57:R57,""))),"-",(AVERAGE(IF(B57:R57<>0,B57:R57,"")))) -> 50.93333333333333 | S58: =IF(ISERROR(AVERAGE(IF(B57:S57<>0,B57:S57,""))),"-",(AVERAGE(IF(B57:S57<>0,B57:S57,"")))) -> 51.125 | T58: =IF(ISERROR(AVERAGE(IF(B57:T57<>0,B57:T57,""))),"-",(AVERAGE(IF(B57:T57<>0,B57:T57,"")))) -> 51.411764705882355 | U58: =IF(ISERROR(AVERAGE(IF(B57:U57<>0,B57:U57,""))),"-",(AVERAGE(IF(B57:U57<>0,B57:U57,"")))) -> 51.411764705882355 | V58: =IF(ISERROR(AVERAGE(IF(B57:V57<>0,B57:V57,""))),"-",(AVERAGE(IF(B57:V57<>0,B57:V57,"")))) -> 51.411764705882355
A59: Team 5
A61: Week | B61: 1 | C61: 2 | D61: 3 | E61: 4 | F61: 5 | G61: 6 | H61: 7 | I61: 8 | J61: 9 | K61: 10 | M61: 11 | N61: 12 | O61: 13 | P61: 14 | Q61: 15 | R61: 16 | S61: 17 | T61: 18 | U61: 19 | V61: 20 | W61: Avg. | X61: Par | Y61: Net Avg. | Z61: Overall Rank | AA61: Low Rnd. | AB61: Max Rnd. | AC61: Low Net Rnd.
A62: ='D. Smith'!$A$1 -> D. Smith | B62: ='D. Smith'!$K$10 -> 42 | C62: ='D. Smith'!$K$11 -> 43 | D62: ='D. Smith'!$K$12 -> 45 | E62: ='D. Smith'!$K$13 -> 41 | F62: ='D. Smith'!$K$14 -> 46 | G62: ='D. Smith'!$K$21 -> 41 | H62: ='D. Smith'!$K$22 -> 45 | I62: ='D. Smith'!$K$23 -> 40 | J62: ='D. Smith'!$K$24 -> 41 | K62: ='D. Smith'!$K$25 -> 36 | M62: ='D. Smith'!$K$34 -> 43 | N62: ='D. Smith'!$K$35 -> 41 | O62: ='D. Smith'!$K$36 -> 43 | P62: ='D. Smith'!$K$37 -> 44 | Q62: ='D. Smith'!$K$38 -> 44 | R62: ='D. Smith'!$K$45 -> 37 | S62: ='D. Smith'!$K$46 -> 41 | T62: ='D. Smith'!$K$47 -> 44 | U62: ='D. Smith'!$K$48 -> - | V62: ='D. Smith'!$K$49 -> - | W62: =IF(ISERROR(AVERAGE(IF(B62:V62<>0,B62:V62,""))),"-",(AVERAGE(IF(B62:V62<>0,B62:V62,"")))) -> 42.055555555555557 | X62: =IF(ISERROR(W62-37),"-",(W62-37)) -> 5.0555555555555571 | Y62: ='D. Smith'!$M$52 -> 38.055555555555557 | Z62: =IF(ISERROR(RANK(Y62,Y$6:Y$85,1)),"-",RANK(Y62,Y$6:Y$85,1)) -> 2 | AA62: =IF(MIN(B62:V62)=0,"-",MIN(B62:V62)) -> 36 | AB62: =IF(MAX(C62:W62)=0,"-",MAX(C62:W62)) -> 46 | AC62: ='D. Smith'!$N$53 -> 31
A63: Avg | C63: =IF(ISERROR(AVERAGE(IF(B62:C62<>0,B62:C62,""))),"-",(AVERAGE(IF(B62:C62<>0,B62:C62,"")))) -> 42.5 | D63: =IF(ISERROR(AVERAGE(IF(B62:D62<>0,B62:D62,""))),"-",(AVERAGE(IF(B62:D62<>0,B62:D62,"")))) -> 43.333333333333336 | E63: =IF(ISERROR(AVERAGE(IF(B62:E62<>0,B62:E62,""))),"-",(AVERAGE(IF(B62:E62<>0,B62:E62,"")))) -> 42.75 | F63: =IF(ISERROR(AVERAGE(IF(B62:F62<>0,B62:F62,""))),"-",(AVERAGE(IF(B62:F62<>0,B62:F62,"")))) -> 43.4 | G63: =IF(ISERROR(AVERAGE(IF(B62:G62<>0,B62:G62,""))),"-",(AVERAGE(IF(B62:G62<>0,B62:G62,"")))) -> 43 | H63: =IF(ISERROR(AVERAGE(IF(B62:H62<>0,B62:H62,""))),"-",(AVERAGE(IF(B62:H62<>0,B62:H62,"")))) -> 43.285714285714285 | I63: =IF(ISERROR(AVERAGE(IF(B62:I62<>0,B62:I62,""))),"-",(AVERAGE(IF(B62:I62<>0,B62:I62,"")))) -> 42.875 | J63: =IF(ISERROR(AVERAGE(IF(B62:J62<>0,B62:J62,""))),"-",(AVERAGE(IF(B62:J62<>0,B62:J62,"")))) -> 42.666666666666664 | K63: =IF(ISERROR(AVERAGE(IF(B62:K62<>0,B62:K62,""))),"-",(AVERAGE(IF(B62:K62<>0,B62:K62,"")))) -> 42 | M63: =IF(ISERROR(AVERAGE(IF(B62:M62<>0,B62:M62,""))),"-",(AVERAGE(IF(B62:M62<>0,B62:M62,"")))) -> 42.090909090909093 | N63: =IF(ISERROR(AVERAGE(IF(B62:N62<>0,B62:N62,""))),"-",(AVERAGE(IF(B62:N62<>0,B62:N62,"")))) -> 42 | O63: =IF(ISERROR(AVERAGE(IF(B62:O62<>0,B62:O62,""))),"-",(AVERAGE(IF(B62:O62<>0,B62:O62,"")))) -> 42.07692307692308 | P63: =IF(ISERROR(AVERAGE(IF(B62:P62<>0,B62:P62,""))),"-",(AVERAGE(IF(B62:P62<>0,B62:P62,"")))) -> 42.214285714285715 | Q63: =IF(ISERROR(AVERAGE(IF(B62:Q62<>0,B62:Q62,""))),"-",(AVERAGE(IF(B62:Q62<>0,B62:Q62,"")))) -> 42.333333333333336 | R63: =IF(ISERROR(AVERAGE(IF(B62:R62<>0,B62:R62,""))),"-",(AVERAGE(IF(B62:R62<>0,B62:R62,"")))) -> 42 | S63: =IF(ISERROR(AVERAGE(IF(B62:S62<>0,B62:S62,""))),"-",(AVERAGE(IF(B62:S62<>0,B62:S62,"")))) -> 41.941176470588232 | T63: =IF(ISERROR(AVERAGE(IF(B62:T62<>0,B62:T62,""))),"-",(AVERAGE(IF(B62:T62<>0,B62:T62,"")))) -> 42.055555555555557 | U63: =IF(ISERROR(AVERAGE(IF(B62:U62<>0,B62:U62,""))),"-",(AVERAGE(IF(B62:U62<>0,B62:U62,"")))) -> 42.055555555555557 | V63: =IF(ISERROR(AVERAGE(IF(B62:V62<>0,B62:V62,""))),"-",(AVERAGE(IF(B62:V62<>0,B62:V62,"")))) -> 42.055555555555557
A65: ='G. White'!$A$1 -> G. White | B65: ='G. White'!$K$10 -> 44 | C65: ='G. White'!$K$11 -> 45 | D65: ='G. White'!$K$12 -> 42 | E65: ='G. White'!$K$13 -> - | F65: ='G. White'!$K$14 -> 40 | G65: ='G. White'!$K$21 -> 46 | H65: ='G. White'!$K$22 -> 45 | I65: ='G. White'!$K$23 -> 42 | J65: ='G. White'!$K$24 -> 41 | K65: ='G. White'!$K$25 -> 44 | M65: ='G. White'!$K$34 -> 43 | N65: ='G. White'!$K$35 -> 43 | O65: ='G. White'!$K$36 -> 43 | P65: ='G. White'!$K$37 -> 44 | Q65: ='G. White'!$K$38 -> 39 | R65: ='G. White'!$K$45 -> 44 | S65: ='G. White'!$K$46 -> 39 | T65: ='G. White'!$K$47 -> 43 | U65: ='G. White'!$K$48 -> 45 | V65: ='G. White'!$K$49 -> - | W65: =IF(ISERROR(AVERAGE(IF(B65:V65<>0,B65:V65,""))),"-",(AVERAGE(IF(B65:V65<>0,B65:V65,"")))) -> 42.888888888888886 | X65: =IF(ISERROR(W65-37),"-",(W65-37)) -> 5.8888888888888857 | Y65: ='G. White'!$M$52 -> 38.611111111111114 | Z65: =IF(ISERROR(RANK(Y65,Y$6:Y$85,1)),"-",RANK(Y65,Y$6:Y$85,1)) -> 6 | AA65: =IF(MIN(B65:V65)=0,"-",MIN(B65:V65)) -> 39 | AB65: =IF(MAX(C65:W65)=0,"-",MAX(C65:W65)) -> 46 | AC65: ='G. White'!$N$53 -> 34
C66: =IF(ISERROR(AVERAGE(IF(B65:C65<>0,B65:C65,""))),"-",(AVERAGE(IF(B65:C65<>0,B65:C65,"")))) -> 44.5 | D66: =IF(ISERROR(AVERAGE(IF(B65:D65<>0,B65:D65,""))),"-",(AVERAGE(IF(B65:D65<>0,B65:D65,"")))) -> 43.666666666666664 | E66: =IF(ISERROR(AVERAGE(IF(B65:E65<>0,B65:E65,""))),"-",(AVERAGE(IF(B65:E65<>0,B65:E65,"")))) -> 43.666666666666664 | F66: =IF(ISERROR(AVERAGE(IF(B65:F65<>0,B65:F65,""))),"-",(AVERAGE(IF(B65:F65<>0,B65:F65,"")))) -> 42.75 | G66: =IF(ISERROR(AVERAGE(IF(B65:G65<>0,B65:G65,""))),"-",(AVERAGE(IF(B65:G65<>0,B65:G65,"")))) -> 43.4 | H66: =IF(ISERROR(AVERAGE(IF(B65:H65<>0,B65:H65,""))),"-",(AVERAGE(IF(B65:H65<>0,B65:H65,"")))) -> 43.666666666666664 | I66: =IF(ISERROR(AVERAGE(IF(B65:I65<>0,B65:I65,""))),"-",(AVERAGE(IF(B65:I65<>0,B65:I65,"")))) -> 43.428571428571431 | J66: =IF(ISERROR(AVERAGE(IF(B65:J65<>0,B65:J65,""))),"-",(AVERAGE(IF(B65:J65<>0,B65:J65,"")))) -> 43.125 | K66: =IF(ISERROR(AVERAGE(IF(B65:K65<>0,B65:K65,""))),"-",(AVERAGE(IF(B65:K65<>0,B65:K65,"")))) -> 43.222222222222221 | M66: =IF(ISERROR(AVERAGE(IF(B65:M65<>0,B65:M65,""))),"-",(AVERAGE(IF(B65:M65<>0,B65:M65,"")))) -> 43.2 | N66: =IF(ISERROR(AVERAGE(IF(B65:N65<>0,B65:N65,""))),"-",(AVERAGE(IF(B65:N65<>0,B65:N65,"")))) -> 43.18181818181818 | O66: =IF(ISERROR(AVERAGE(IF(B65:O65<>0,B65:O65,""))),"-",(AVERAGE(IF(B65:O65<>0,B65:O65,"")))) -> 43.166666666666664 | P66: =IF(ISERROR(AVERAGE(IF(B65:P65<>0,B65:P65,""))),"-",(AVERAGE(IF(B65:P65<>0,B65:P65,"")))) -> 43.230769230769234 | Q66: =IF(ISERROR(AVERAGE(IF(B65:Q65<>0,B65:Q65,""))),"-",(AVERAGE(IF(B65:Q65<>0,B65:Q65,"")))) -> 42.928571428571431 | R66: =IF(ISERROR(AVERAGE(IF(B65:R65<>0,B65:R65,""))),"-",(AVERAGE(IF(B65:R65<>0,B65:R65,"")))) -> 43 | S66: =IF(ISERROR(AVERAGE(IF(B65:S65<>0,B65:S65,""))),"-",(AVERAGE(IF(B65:S65<>0,B65:S65,"")))) -> 42.75 | T66: =IF(ISERROR(AVERAGE(IF(B65:T65<>0,B65:T65,""))),"-",(AVERAGE(IF(B65:T65<>0,B65:T65,"")))) -> 42.764705882352942 | U66: =IF(ISERROR(AVERAGE(IF(B65:U65<>0,B65:U65,""))),"-",(AVERAGE(IF(B65:U65<>0,B65:U65,"")))) -> 42.888888888888886 | V66: =IF(ISERROR(AVERAGE(IF(B65:V65<>0,B65:V65,""))),"-",(AVERAGE(IF(B65:V65<>0,B65:V65,"")))) -> 42.888888888888886
A68: ='G. Taylor'!$A$1 -> G. Taylor | B68: ='G. Taylor'!$K$10 -> 48 | C68: ='G. Taylor'!$K$11 -> 51 | D68: ='G. Taylor'!$K$12 -> 54 | E68: ='G. Taylor'!$K$13 -> 50 | F68: ='G. Taylor'!$K$14 -> 49 | G68: ='G. Taylor'!$K$21 -> 43 | H68: ='G. Taylor'!$K$22 -> 52 | I68: ='G. Taylor'!$K$23 -> 53 | J68: ='G. Taylor'!$K$24 -> 46 | K68: ='G. Taylor'!$K$25 -> 47 | M68: ='G. Taylor'!$K$34 -> 50 | N68: ='G. Taylor'!$K$35 -> 51 | O68: ='G. Taylor'!$K$36 -> 46 | P68: ='G. Taylor'!$K$37 -> 47 | Q68: ='G. Taylor'!$K$38 -> 45 | R68: ='G. Taylor'!$K$45 -> 49 | S68: ='G. Taylor'!$K$46 -> 47 | T68: ='G. Taylor'!$K$47 -> 48 | U68: ='G. Taylor'!$K$48 -> 50 | V68: ='G. Taylor'!$K$49 -> - | W68: =IF(ISERROR(AVERAGE(IF(B68:V68<>0,B68:V68,""))),"-",(AVERAGE(IF(B68:V68<>0,B68:V68,"")))) -> 48.736842105263158 | X68: =IF(ISERROR(W68-37),"-",(W68-37)) -> 11.736842105263158 | Y68: ='G. Taylor'!$M$52 -> 38.684210526315788 | Z68: =IF(ISERROR(RANK(Y68,Y$6:Y$85,1)),"-",RANK(Y68,Y$6:Y$85,1)) -> 9 | AA68: =IF(MIN(B68:V68)=0,"-",MIN(B68:V68)) -> 43 | AB68: =IF(MAX(C68:W68)=0,"-",MAX(C68:W68)) -> 54 | AC68: ='G. Taylor'!$N$53 -> 31
A69: Avg | C69: =IF(ISERROR(AVERAGE(IF(B68:C68<>0,B68:C68,""))),"-",(AVERAGE(IF(B68:C68<>0,B68:C68,"")))) -> 49.5 | D69: =IF(ISERROR(AVERAGE(IF(B68:D68<>0,B68:D68,""))),"-",(AVERAGE(IF(B68:D68<>0,B68:D68,"")))) -> 51 | E69: =IF(ISERROR(AVERAGE(IF(B68:E68<>0,B68:E68,""))),"-",(AVERAGE(IF(B68:E68<>0,B68:E68,"")))) -> 50.75 | F69: =IF(ISERROR(AVERAGE(IF(B68:F68<>0,B68:F68,""))),"-",(AVERAGE(IF(B68:F68<>0,B68:F68,"")))) -> 50.4 | G69: =IF(ISERROR(AVERAGE(IF(B68:G68<>0,B68:G68,""))),"-",(AVERAGE(IF(B68:G68<>0,B68:G68,"")))) -> 49.166666666666664 | H69: =IF(ISERROR(AVERAGE(IF(B68:H68<>0,B68:H68,""))),"-",(AVERAGE(IF(B68:H68<>0,B68:H68,"")))) -> 49.571428571428569 | I69: =IF(ISERROR(AVERAGE(IF(B68:I68<>0,B68:I68,""))),"-",(AVERAGE(IF(B68:I68<>0,B68:I68,"")))) -> 50 | J69: =IF(ISERROR(AVERAGE(IF(B68:J68<>0,B68:J68,""))),"-",(AVERAGE(IF(B68:J68<>0,B68:J68,"")))) -> 49.555555555555557 | K69: =IF(ISERROR(AVERAGE(IF(B68:K68<>0,B68:K68,""))),"-",(AVERAGE(IF(B68:K68<>0,B68:K68,"")))) -> 49.3 | M69: =IF(ISERROR(AVERAGE(IF(B68:M68<>0,B68:M68,""))),"-",(AVERAGE(IF(B68:M68<>0,B68:M68,"")))) -> 49.363636363636367 | N69: =IF(ISERROR(AVERAGE(IF(B68:N68<>0,B68:N68,""))),"-",(AVERAGE(IF(B68:N68<>0,B68:N68,"")))) -> 49.5 | O69: =IF(ISERROR(AVERAGE(IF(B68:O68<>0,B68:O68,""))),"-",(AVERAGE(IF(B68:O68<>0,B68:O68,"")))) -> 49.230769230769234 | P69: =IF(ISERROR(AVERAGE(IF(B68:P68<>0,B68:P68,""))),"-",(AVERAGE(IF(B68:P68<>0,B68:P68,"")))) -> 49.071428571428569 | Q69: =IF(ISERROR(AVERAGE(IF(B68:Q68<>0,B68:Q68,""))),"-",(AVERAGE(IF(B68:Q68<>0,B68:Q68,"")))) -> 48.8 | R69: =IF(ISERROR(AVERAGE(IF(B68:R68<>0,B68:R68,""))),"-",(AVERAGE(IF(B68:R68<>0,B68:R68,"")))) -> 48.8125 | S69: =IF(ISERROR(AVERAGE(IF(B68:S68<>0,B68:S68,""))),"-",(AVERAGE(IF(B68:S68<>0,B68:S68,"")))) -> 48.705882352941174 | T69: =IF(ISERROR(AVERAGE(IF(B68:T68<>0,B68:T68,""))),"-",(AVERAGE(IF(B68:T68<>0,B68:T68,"")))) -> 48.666666666666664 | U69: =IF(ISERROR(AVERAGE(IF(B68:U68<>0,B68:U68,""))),"-",(AVERAGE(IF(B68:U68<>0,B68:U68,"")))) -> 48.736842105263158 | V69: =IF(ISERROR(AVERAGE(IF(B68:V68<>0,B68:V68,""))),"-",(AVERAGE(IF(B68:V68<>0,B68:V68,"")))) -> 48.736842105263158
A71: ='B. Harbour'!$A$1 -> B. Harbour | B71: ='B. Harbour'!$K$10 -> 54 | C71: ='B. Harbour'!$K$11 -> 57 | D71: ='B. Harbour'!$K$12 -> 58 | E71: ='B. Harbour'!$K$13 -> 51 | F71: ='B. Harbour'!$K$14 -> 55 | G71: ='B. Harbour'!$K$21 -> 60 | H71: ='B. Harbour'!$K$22 -> 53 | I71: ='B. Harbour'!$K$23 -> 54 | J71: ='B. Harbour'!$K$24 -> 55 | K71: ='B. Harbour'!$K$25 -> 58 | M71: ='B. Harbour'!$K$34 -> 50 | N71: ='B. Harbour'!$K$35 -> 58 | O71: ='B. Harbour'!$K$36 -> 58 | P71: ='B. Harbour'!$K$37 -> 50 | Q71: ='B. Harbour'!$K$38 -> 53 | R71: ='B. Harbour'!$K$45 -> 53 | S71: ='B. Harbour'!$K$46 -> 47 | T71: ='B. Harbour'!$K$47 -> 54 | U71: ='B. Harbour'!$K$48 -> 50 | V71: ='B. Harbour'!$K$49 -> - | W71: =IF(ISERROR(AVERAGE(IF(B71:V71<>0,B71:V71,""))),"-",(AVERAGE(IF(B71:V71<>0,B71:V71,"")))) -> 54.10526315789474 | X71: =IF(ISERROR(W71-37),"-",(W71-37)) -> 17.10526315789474 | Y71: ='B. Harbour'!$M$52 -> 38.89473684210526 | Z71: =IF(ISERROR(RANK(Y71,Y$6:Y$85,1)),"-",RANK(Y71,Y$6:Y$85,1)) -> 11 | AA71: =IF(MIN(B71:V71)=0,"-",MIN(B71:V71)) -> 47 | AB71: =IF(MAX(C71:W71)=0,"-",MAX(C71:W71)) -> 60 | AC71: ='B. Harbour'!$N$53 -> 31
A72: Avg | C72: =IF(ISERROR(AVERAGE(IF(B71:C71<>0,B71:C71,""))),"-",(AVERAGE(IF(B71:C71<>0,B71:C71,"")))) -> 55.5 | D72: =IF(ISERROR(AVERAGE(IF(B71:D71<>0,B71:D71,""))),"-",(AVERAGE(IF(B71:D71<>0,B71:D71,"")))) -> 56.333333333333336 | E72: =IF(ISERROR(AVERAGE(IF(B71:E71<>0,B71:E71,""))),"-",(AVERAGE(IF(B71:E71<>0,B71:E71,"")))) -> 55 | F72: =IF(ISERROR(AVERAGE(IF(B71:F71<>0,B71:F71,""))),"-",(AVERAGE(IF(B71:F71<>0,B71:F71,"")))) -> 55 | G72: =IF(ISERROR(AVERAGE(IF(B71:G71<>0,B71:G71,""))),"-",(AVERAGE(IF(B71:G71<>0,B71:G71,"")))) -> 55.833333333333336 | H72: =IF(ISERROR(AVERAGE(IF(B71:H71<>0,B71:H71,""))),"-",(AVERAGE(IF(B71:H71<>0,B71:H71,"")))) -> 55.428571428571431 | I72: =IF(ISERROR(AVERAGE(IF(B71:I71<>0,B71:I71,""))),"-",(AVERAGE(IF(B71:I71<>0,B71:I71,"")))) -> 55.25 | J72: =IF(ISERROR(AVERAGE(IF(B71:J71<>0,B71:J71,""))),"-",(AVERAGE(IF(B71:J71<>0,B71:J71,"")))) -> 55.222222222222221 | K72: =IF(ISERROR(AVERAGE(IF(B71:K71<>0,B71:K71,""))),"-",(AVERAGE(IF(B71:K71<>0,B71:K71,"")))) -> 55.5 | M72: =IF(ISERROR(AVERAGE(IF(B71:M71<>0,B71:M71,""))),"-",(AVERAGE(IF(B71:M71<>0,B71:M71,"")))) -> 55 | N72: =IF(ISERROR(AVERAGE(IF(B71:N71<>0,B71:N71,""))),"-",(AVERAGE(IF(B71:N71<>0,B71:N71,"")))) -> 55.25 | O72: =IF(ISERROR(AVERAGE(IF(B71:O71<>0,B71:O71,""))),"-",(AVERAGE(IF(B71:O71<>0,B71:O71,"")))) -> 55.46153846153846 | P72: =IF(ISERROR(AVERAGE(IF(B71:P71<>0,B71:P71,""))),"-",(AVERAGE(IF(B71:P71<>0,B71:P71,"")))) -> 55.071428571428569 | Q72: =IF(ISERROR(AVERAGE(IF(B71:Q71<>0,B71:Q71,""))),"-",(AVERAGE(IF(B71:Q71<>0,B71:Q71,"")))) -> 54.93333333333333 | R72: =IF(ISERROR(AVERAGE(IF(B71:R71<>0,B71:R71,""))),"-",(AVERAGE(IF(B71:R71<>0,B71:R71,"")))) -> 54.8125 | S72: =IF(ISERROR(AVERAGE(IF(B71:S71<>0,B71:S71,""))),"-",(AVERAGE(IF(B71:S71<>0,B71:S71,"")))) -> 54.352941176470587 | T72: =IF(ISERROR(AVERAGE(IF(B71:T71<>0,B71:T71,""))),"-",(AVERAGE(IF(B71:T71<>0,B71:T71,"")))) -> 54.333333333333336 | U72: =IF(ISERROR(AVERAGE(IF(B71:U71<>0,B71:U71,""))),"-",(AVERAGE(IF(B71:U71<>0,B71:U71,"")))) -> 54.10526315789474 | V72: =IF(ISERROR(AVERAGE(IF(B71:V71<>0,B71:V71,""))),"-",(AVERAGE(IF(B71:V71<>0,B71:V71,"")))) -> 54.10526315789474
A73: Team 6
A75: Week | B75: 1 | C75: 2 | D75: 3 | E75: 4 | F75: 5 | G75: 6 | H75: 7 | I75: 8 | J75: 9 | K75: 10 | M75: 11 | N75: 12 | O75: 13 | P75: 14 | Q75: 15 | R75: 16 | S75: 17 | T75: 18 | U75: 19 | V75: 20 | W75: Avg. | X75: Par | Y75: Net Avg. | Z75: Overall Rank | AA75: Low Rnd. | AB75: Max Rnd. | AC75: Low Net Rnd.
A76: ='R. Ours'!$A$1 -> R. Ours | B76: ='R. Ours'!$K$10 -> 37 | C76: ='R. Ours'!$K$11 -> 41 | D76: ='R. Ours'!$K$12 -> 38 | E76: ='R. Ours'!$K$13 -> 39 | F76: ='R. Ours'!$K$14 -> 38 | G76: ='R. Ours'!$K$21 -> 38 | H76: ='R. Ours'!$K$22 -> 39 | I76: ='R. Ours'!$K$23 -> 45 | J76: ='R. Ours'!$K$24 -> 41 | K76: ='R. Ours'!$K$25 -> 38 | M76: ='R. Ours'!$K$34 -> 40 | N76: ='R. Ours'!$K$35 -> 40 | O76: ='R. Ours'!$K$36 -> 40 | P76: ='R. Ours'!$K$37 -> 40 | Q76: ='R. Ours'!$K$38 -> - | R76: ='R. Ours'!$K$45 -> 40 | S76: ='R. Ours'!$K$46 -> 38 | T76: ='R. Ours'!$K$47 -> 35 | U76: ='R. Ours'!$K$48 -> 39 | V76: ='R. Ours'!$K$49 -> - | W76: =IF(ISERROR(AVERAGE(IF(B76:V76<>0,B76:V76,""))),"-",(AVERAGE(IF(B76:V76<>0,B76:V76,"")))) -> 39.222222222222221 | X76: =IF(ISERROR(W76-37),"-",(W76-37)) -> 2.2222222222222214 | Y76: ='R. Ours'!$M$52 -> 37.666666666666664 | Z76: =IF(ISERROR(RANK(Y76,Y$6:Y$85,1)),"-",RANK(Y76,Y$6:Y$85,1)) -> 1 | AA76: =IF(MIN(B76:V76)=0,"-",MIN(B76:V76)) -> 35 | AB76: =IF(MAX(C76:W76)=0,"-",MAX(C76:W76)) -> 45 | AC76: ='R. Ours'!$N$53 -> 34
A77: Avg | C77: =IF(ISERROR(AVERAGE(IF(B76:C76<>0,B76:C76,""))),"-",(AVERAGE(IF(B76:C76<>0,B76:C76,"")))) -> 39 | D77: =IF(ISERROR(AVERAGE(IF(B76:D76<>0,B76:D76,""))),"-",(AVERAGE(IF(B76:D76<>0,B76:D76,"")))) -> 38.666666666666664 | E77: =IF(ISERROR(AVERAGE(IF(B76:E76<>0,B76:E76,""))),"-",(AVERAGE(IF(B76:E76<>0,B76:E76,"")))) -> 38.75 | F77: =IF(ISERROR(AVERAGE(IF(B76:F76<>0,B76:F76,""))),"-",(AVERAGE(IF(B76:F76<>0,B76:F76,"")))) -> 38.6 | G77: =IF(ISERROR(AVERAGE(IF(B76:G76<>0,B76:G76,""))),"-",(AVERAGE(IF(B76:G76<>0,B76:G76,"")))) -> 38.5 | H77: =IF(ISERROR(AVERAGE(IF(B76:H76<>0,B76:H76,""))),"-",(AVERAGE(IF(B76:H76<>0,B76:H76,"")))) -> 38.571428571428569 | I77: =IF(ISERROR(AVERAGE(IF(B76:I76<>0,B76:I76,""))),"-",(AVERAGE(IF(B76:I76<>0,B76:I76,"")))) -> 39.375 | J77: =IF(ISERROR(AVERAGE(IF(B76:J76<>0,B76:J76,""))),"-",(AVERAGE(IF(B76:J76<>0,B76:J76,"")))) -> 39.555555555555557 | K77: =IF(ISERROR(AVERAGE(IF(B76:K76<>0,B76:K76,""))),"-",(AVERAGE(IF(B76:K76<>0,B76:K76,"")))) -> 39.4 | M77: =IF(ISERROR(AVERAGE(IF(B76:M76<>0,B76:M76,""))),"-",(AVERAGE(IF(B76:M76<>0,B76:M76,"")))) -> 39.454545454545453 | N77: =IF(ISERROR(AVERAGE(IF(B76:N76<>0,B76:N76,""))),"-",(AVERAGE(IF(B76:N76<>0,B76:N76,"")))) -> 39.5 | O77: =IF(ISERROR(AVERAGE(IF(B76:O76<>0,B76:O76,""))),"-",(AVERAGE(IF(B76:O76<>0,B76:O76,"")))) -> 39.53846153846154 | P77: =IF(ISERROR(AVERAGE(IF(B76:P76<>0,B76:P76,""))),"-",(AVERAGE(IF(B76:P76<>0,B76:P76,"")))) -> 39.571428571428569 | Q77: =IF(ISERROR(AVERAGE(IF(B76:Q76<>0,B76:Q76,""))),"-",(AVERAGE(IF(B76:Q76<>0,B76:Q76,"")))) -> 39.571428571428569 | R77: =IF(ISERROR(AVERAGE(IF(B76:R76<>0,B76:R76,""))),"-",(AVERAGE(IF(B76:R76<>0,B76:R76,"")))) -> 39.6 | S77: =IF(ISERROR(AVERAGE(IF(B76:S76<>0,B76:S76,""))),"-",(AVERAGE(IF(B76:S76<>0,B76:S76,"")))) -> 39.5 | T77: =IF(ISERROR(AVERAGE(IF(B76:T76<>0,B76:T76,""))),"-",(AVERAGE(IF(B76:T76<>0,B76:T76,"")))) -> 39.235294117647058 | U77: =IF(ISERROR(AVERAGE(IF(B76:U76<>0,B76:U76,""))),"-",(AVERAGE(IF(B76:U76<>0,B76:U76,"")))) -> 39.222222222222221 | V77: =IF(ISERROR(AVERAGE(IF(B76:V76<>0,B76:V76,""))),"-",(AVERAGE(IF(B76:V76<>0,B76:V76,"")))) -> 39.222222222222221
A79: ='T. Way'!$A$1 -> T. Way | B79: ='T. Way'!$K$10 -> 41 | C79: ='T. Way'!$K$11 -> 45 | D79: ='T. Way'!$K$12 -> 49 | E79: ='T. Way'!$K$13 -> 43 | F79: ='T. Way'!$K$14 -> 47 | G79: ='T. Way'!$K$21 -> 45 | H79: ='T. Way'!$K$22 -> 46 | I79: ='T. Way'!$K$23 -> 44 | J79: ='T. Way'!$K$24 -> 45 | K79: ='T. Way'!$K$25 -> - | M79: ='T. Way'!$K$34 -> - | N79: ='T. Way'!$K$35 -> 47 | O79: ='T. Way'!$K$36 -> 48 | P79: ='T. Way'!$K$37 -> 41 | Q79: ='T. Way'!$K$38 -> 49 | R79: ='T. Way'!$K$45 -> 45 | S79: ='T. Way'!$K$46 -> 43 | T79: ='T. Way'!$K$47 -> 48 | U79: ='T. Way'!$K$48 -> 42 | V79: ='T. Way'!$K$49 -> - | W79: =IF(ISERROR(AVERAGE(IF(B79:V79<>0,B79:V79,""))),"-",(AVERAGE(IF(B79:V79<>0,B79:V79,"")))) -> 45.176470588235297 | X79: =IF(ISERROR(W79-37),"-",(W79-37)) -> 8.176470588235297 | Y79: ='T. Way'!$M$52 -> 39.235294117647058 | Z79: =IF(ISERROR(RANK(Y79,Y$6:Y$85,1)),"-",RANK(Y79,Y$6:Y$85,1)) -> 19 | AA79: =IF(MIN(B79:V79)=0,"-",MIN(B79:V79)) -> 41 | AB79: =IF(MAX(C79:W79)=0,"-",MAX(C79:W79)) -> 49 | AC79: ='T. Way'!$N$53 -> 34
C80: =IF(ISERROR(AVERAGE(IF(B79:C79<>0,B79:C79,""))),"-",(AVERAGE(IF(B79:C79<>0,B79:C79,"")))) -> 43 | D80: =IF(ISERROR(AVERAGE(IF(B79:D79<>0,B79:D79,""))),"-",(AVERAGE(IF(B79:D79<>0,B79:D79,"")))) -> 45 | E80: =IF(ISERROR(AVERAGE(IF(B79:E79<>0,B79:E79,""))),"-",(AVERAGE(IF(B79:E79<>0,B79:E79,"")))) -> 44.5 | F80: =IF(ISERROR(AVERAGE(IF(B79:F79<>0,B79:F79,""))),"-",(AVERAGE(IF(B79:F79<>0,B79:F79,"")))) -> 45 | G80: =IF(ISERROR(AVERAGE(IF(B79:G79<>0,B79:G79,""))),"-",(AVERAGE(IF(B79:G79<>0,B79:G79,"")))) -> 45 | H80: =IF(ISERROR(AVERAGE(IF(B79:H79<>0,B79:H79,""))),"-",(AVERAGE(IF(B79:H79<>0,B79:H79,"")))) -> 45.142857142857146 | I80: =IF(ISERROR(AVERAGE(IF(B79:I79<>0,B79:I79,""))),"-",(AVERAGE(IF(B79:I79<>0,B79:I79,"")))) -> 45 | J80: =IF(ISERROR(AVERAGE(IF(B79:J79<>0,B79:J79,""))),"-",(AVERAGE(IF(B79:J79<>0,B79:J79,"")))) -> 45 | K80: =IF(ISERROR(AVERAGE(IF(B79:K79<>0,B79:K79,""))),"-",(AVERAGE(IF(B79:K79<>0,B79:K79,"")))) -> 45 | M80: =IF(ISERROR(AVERAGE(IF(B79:M79<>0,B79:M79,""))),"-",(AVERAGE(IF(B79:M79<>0,B79:M79,"")))) -> 45 | N80: =IF(ISERROR(AVERAGE(IF(B79:N79<>0,B79:N79,""))),"-",(AVERAGE(IF(B79:N79<>0,B79:N79,"")))) -> 45.2 | O80: =IF(ISERROR(AVERAGE(IF(B79:O79<>0,B79:O79,""))),"-",(AVERAGE(IF(B79:O79<>0,B79:O79,"")))) -> 45.454545454545453 | P80: =IF(ISERROR(AVERAGE(IF(B79:P79<>0,B79:P79,""))),"-",(AVERAGE(IF(B79:P79<>0,B79:P79,"")))) -> 45.083333333333336 | Q80: =IF(ISERROR(AVERAGE(IF(B79:Q79<>0,B79:Q79,""))),"-",(AVERAGE(IF(B79:Q79<>0,B79:Q79,"")))) -> 45.384615384615387 | R80: =IF(ISERROR(AVERAGE(IF(B79:R79<>0,B79:R79,""))),"-",(AVERAGE(IF(B79:R79<>0,B79:R79,"")))) -> 45.357142857142854 | S80: =IF(ISERROR(AVERAGE(IF(B79:S79<>0,B79:S79,""))),"-",(AVERAGE(IF(B79:S79<>0,B79:S79,"")))) -> 45.2 | T80: =IF(ISERROR(AVERAGE(IF(B79:T79<>0,B79:T79,""))),"-",(AVERAGE(IF(B79:T79<>0,B79:T79,"")))) -> 45.375 | U80: =IF(ISERROR(AVERAGE(IF(B79:U79<>0,B79:U79,""))),"-",(AVERAGE(IF(B79:U79<>0,B79:U79,"")))) -> 45.176470588235297 | V80: =IF(ISERROR(AVERAGE(IF(B79:V79<>0,B79:V79,""))),"-",(AVERAGE(IF(B79:V79<>0,B79:V79,"")))) -> 45.176470588235297
A82: ='L. Baumgarner'!$A$1 -> L. Baumgarner | B82: ='L. Baumgarner'!$K$10 -> 50 | C82: ='L. Baumgarner'!$K$11 -> 54 | D82: ='L. Baumgarner'!$K$12 -> 50 | E82: ='L. Baumgarner'!$K$13 -> 51 | F82: ='L. Baumgarner'!$K$14 -> 52 | G82: ='L. Baumgarner'!$K$21 -> 50 | H82: ='L. Baumgarner'!$K$22 -> 47 | I82: ='L. Baumgarner'!$K$23 -> 52 | J82: ='L. Baumgarner'!$K$24 -> 51 | K82: ='L. Baumgarner'!$K$25 -> 55 | M82: ='L. Baumgarner'!$K$34 -> 45 | N82: ='L. Baumgarner'!$K$35 -> 49 | O82: ='L. Baumgarner'!$K$36 -> 46 | P82: ='L. Baumgarner'!$K$37 -> 52 | Q82: ='L. Baumgarner'!$K$38 -> 47 | R82: ='L. Baumgarner'!$K$45 -> 49 | S82: ='L. Baumgarner'!$K$46 -> 48 | T82: ='L. Baumgarner'!$K$47 -> 53 | U82: ='L. Baumgarner'!$K$48 -> - | V82: ='L. Baumgarner'!$K$49 -> - | W82: =IF(ISERROR(AVERAGE(IF(B82:V82<>0,B82:V82,""))),"-",(AVERAGE(IF(B82:V82<>0,B82:V82,"")))) -> 50.055555555555557 | X82: =IF(ISERROR(W82-37),"-",(W82-37)) -> 13.055555555555557 | Y82: ='L. Baumgarner'!$M$52 -> 38.50 | Z82: =IF(ISERROR(RANK(Y82,Y$6:Y$85,1)),"-",RANK(Y82,Y$6:Y$85,1)) -> 3 | AA82: =IF(MIN(B82:V82)=0,"-",MIN(B82:V82)) -> 45 | AB82: =IF(MAX(C82:W82)=0,"-",MAX(C82:W82)) -> 55 | AC82: ='L. Baumgarner'!$N$53 -> 32
A83: Avg | C83: =IF(ISERROR(AVERAGE(IF(B82:C82<>0,B82:C82,""))),"-",(AVERAGE(IF(B82:C82<>0,B82:C82,"")))) -> 52 | D83: =IF(ISERROR(AVERAGE(IF(B82:D82<>0,B82:D82,""))),"-",(AVERAGE(IF(B82:D82<>0,B82:D82,"")))) -> 51.333333333333336 | E83: =IF(ISERROR(AVERAGE(IF(B82:E82<>0,B82:E82,""))),"-",(AVERAGE(IF(B82:E82<>0,B82:E82,"")))) -> 51.25 | F83: =IF(ISERROR(AVERAGE(IF(B82:F82<>0,B82:F82,""))),"-",(AVERAGE(IF(B82:F82<>0,B82:F82,"")))) -> 51.4 | G83: =IF(ISERROR(AVERAGE(IF(B82:G82<>0,B82:G82,""))),"-",(AVERAGE(IF(B82:G82<>0,B82:G82,"")))) -> 51.166666666666664 | H83: =IF(ISERROR(AVERAGE(IF(B82:H82<>0,B82:H82,""))),"-",(AVERAGE(IF(B82:H82<>0,B82:H82,"")))) -> 50.571428571428569 | I83: =IF(ISERROR(AVERAGE(IF(B82:I82<>0,B82:I82,""))),"-",(AVERAGE(IF(B82:I82<>0,B82:I82,"")))) -> 50.75 | J83: =IF(ISERROR(AVERAGE(IF(B82:J82<>0,B82:J82,""))),"-",(AVERAGE(IF(B82:J82<>0,B82:J82,"")))) -> 50.777777777777779 | K83: =IF(ISERROR(AVERAGE(IF(B82:K82<>0,B82:K82,""))),"-",(AVERAGE(IF(B82:K82<>0,B82:K82,"")))) -> 51.2 | M83: =IF(ISERROR(AVERAGE(IF(B82:M82<>0,B82:M82,""))),"-",(AVERAGE(IF(B82:M82<>0,B82:M82,"")))) -> 50.636363636363633 | N83: =IF(ISERROR(AVERAGE(IF(B82:N82<>0,B82:N82,""))),"-",(AVERAGE(IF(B82:N82<>0,B82:N82,"")))) -> 50.5 | O83: =IF(ISERROR(AVERAGE(IF(B82:O82<>0,B82:O82,""))),"-",(AVERAGE(IF(B82:O82<>0,B82:O82,"")))) -> 50.153846153846153 | P83: =IF(ISERROR(AVERAGE(IF(B82:P82<>0,B82:P82,""))),"-",(AVERAGE(IF(B82:P82<>0,B82:P82,"")))) -> 50.285714285714285 | Q83: =IF(ISERROR(AVERAGE(IF(B82:Q82<>0,B82:Q82,""))),"-",(AVERAGE(IF(B82:Q82<>0,B82:Q82,"")))) -> 50.06666666666667 | R83: =IF(ISERROR(AVERAGE(IF(B82:R82<>0,B82:R82,""))),"-",(AVERAGE(IF(B82:R82<>0,B82:R82,"")))) -> 50 | S83: =IF(ISERROR(AVERAGE(IF(B82:S82<>0,B82:S82,""))),"-",(AVERAGE(IF(B82:S82<>0,B82:S82,"")))) -> 49.882352941176471 | T83: =IF(ISERROR(AVERAGE(IF(B82:T82<>0,B82:T82,""))),"-",(AVERAGE(IF(B82:T82<>0,B82:T82,"")))) -> 50.055555555555557 | U83: =IF(ISERROR(AVERAGE(IF(B82:U82<>0,B82:U82,""))),"-",(AVERAGE(IF(B82:U82<>0,B82:U82,"")))) -> 50.055555555555557 | V83: =IF(ISERROR(AVERAGE(IF(B82:V82<>0,B82:V82,""))),"-",(AVERAGE(IF(B82:V82<>0,B82:V82,"")))) -> 50.055555555555557
A85: ='J. Dodrill'!$A$1 -> J. Dodrill | B85: ='J. Dodrill'!$K$10 -> 50 | C85: ='J. Dodrill'!$K$11 -> 57 | D85: ='J. Dodrill'!$K$12 -> 51 | E85: ='J. Dodrill'!$K$13 -> 53 | F85: ='J. Dodrill'!$K$14 -> - | G85: ='J. Dodrill'!$K$21 -> 55 | H85: ='J. Dodrill'!$K$22 -> - | I85: ='J. Dodrill'!$K$23 -> 52 | J85: ='J. Dodrill'!$K$24 -> 54 | K85: ='J. Dodrill'!$K$25 -> - | M85: ='J. Dodrill'!$K$34 -> 55 | N85: ='J. Dodrill'!$K$35 -> 56 | O85: ='J. Dodrill'!$K$36 -> 50 | P85: ='J. Dodrill'!$K$37 -> 53 | Q85: ='J. Dodrill'!$K$38 -> 58 | R85: ='J. Dodrill'!$K$45 -> 50 | S85: ='J. Dodrill'!$K$46 -> 51 | T85: ='J. Dodrill'!$K$47 -> 53 | U85: ='J. Dodrill'!$K$48 -> 58 | V85: ='J. Dodrill'!$K$49 -> - | W85: =IF(ISERROR(AVERAGE(IF(B85:V85<>0,B85:V85,""))),"-",(AVERAGE(IF(B85:V85<>0,B85:V85,"")))) -> 53.50 | X85: =IF(ISERROR(W85-37),"-",(W85-37)) -> 16.50 | Y85: ='J. Dodrill'!$M$52 -> 38.9375 | Z85: =IF(ISERROR(RANK(Y85,Y$6:Y$85,1)),"-",RANK(Y85,Y$6:Y$85,1)) -> 13 | AA85: =IF(MIN(B85:V85)=0,"-",MIN(B85:V85)) -> 50 | AB85: =IF(MAX(C85:W85)=0,"-",MAX(C85:W85)) -> 58 | AC85: ='J. Dodrill'!$N$53 -> 35
A86: Avg | C86: =IF(ISERROR(AVERAGE(IF(B85:C85<>0,B85:C85,""))),"-",(AVERAGE(IF(B85:C85<>0,B85:C85,"")))) -> 53.5 | D86: =IF(ISERROR(AVERAGE(IF(B85:D85<>0,B85:D85,""))),"-",(AVERAGE(IF(B85:D85<>0,B85:D85,"")))) -> 52.666666666666664 | E86: =IF(ISERROR(AVERAGE(IF(B85:E85<>0,B85:E85,""))),"-",(AVERAGE(IF(B85:E85<>0,B85:E85,"")))) -> 52.75 | F86: =IF(ISERROR(AVERAGE(IF(B85:F85<>0,B85:F85,""))),"-",(AVERAGE(IF(B85:F85<>0,B85:F85,"")))) -> 52.75 | G86: =IF(ISERROR(AVERAGE(IF(B85:G85<>0,B85:G85,""))),"-",(AVERAGE(IF(B85:G85<>0,B85:G85,"")))) -> 53.2 | H86: =IF(ISERROR(AVERAGE(IF(B85:H85<>0,B85:H85,""))),"-",(AVERAGE(IF(B85:H85<>0,B85:H85,"")))) -> 53.2 | I86: =IF(ISERROR(AVERAGE(IF(B85:I85<>0,B85:I85,""))),"-",(AVERAGE(IF(B85:I85<>0,B85:I85,"")))) -> 53 | J86: =IF(ISERROR(AVERAGE(IF(B85:J85<>0,B85:J85,""))),"-",(AVERAGE(IF(B85:J85<>0,B85:J85,"")))) -> 53.142857142857146 | K86: =IF(ISERROR(AVERAGE(IF(B85:K85<>0,B85:K85,""))),"-",(AVERAGE(IF(B85:K85<>0,B85:K85,"")))) -> 53.142857142857146 | M86: =IF(ISERROR(AVERAGE(IF(B85:M85<>0,B85:M85,""))),"-",(AVERAGE(IF(B85:M85<>0,B85:M85,"")))) -> 53.375 | N86: =IF(ISERROR(AVERAGE(IF(B85:N85<>0,B85:N85,""))),"-",(AVERAGE(IF(B85:N85<>0,B85:N85,"")))) -> 53.666666666666664 | O86: =IF(ISERROR(AVERAGE(IF(B85:O85<>0,B85:O85,""))),"-",(AVERAGE(IF(B85:O85<>0,B85:O85,"")))) -> 53.3 | P86: =IF(ISERROR(AVERAGE(IF(B85:P85<>0,B85:P85,""))),"-",(AVERAGE(IF(B85:P85<>0,B85:P85,"")))) -> 53.272727272727273 | Q86: =IF(ISERROR(AVERAGE(IF(B85:Q85<>0,B85:Q85,""))),"-",(AVERAGE(IF(B85:Q85<>0,B85:Q85,"")))) -> 53.666666666666664 | R86: =IF(ISERROR(AVERAGE(IF(B85:R85<>0,B85:R85,""))),"-",(AVERAGE(IF(B85:R85<>0,B85:R85,"")))) -> 53.384615384615387 | S86: =IF(ISERROR(AVERAGE(IF(B85:S85<>0,B85:S85,""))),"-",(AVERAGE(IF(B85:S85<>0,B85:S85,"")))) -> 53.214285714285715 | T86: =IF(ISERROR(AVERAGE(IF(B85:T85<>0,B85:T85,""))),"-",(AVERAGE(IF(B85:T85<>0,B85:T85,"")))) -> 53.2 | U86: =IF(ISERROR(AVERAGE(IF(B85:U85<>0,B85:U85,""))),"-",(AVERAGE(IF(B85:U85<>0,B85:U85,"")))) -> 53.5 | V86: =IF(ISERROR(AVERAGE(IF(B85:V85<>0,B85:V85,""))),"-",(AVERAGE(IF(B85:V85<>0,B85:V85,"")))) -> 53.5
X87: Lowest Round | AA87: =IF(MIN(AA6,AA9,AA12,AA15,AA20,AA23,AA26,AA29,AA34,AA37,AA40,AA43,AA48,AA51,AA54,AA57,AA62,AA65,AA68,AA71,AA76,AA79,AA82,AA85)=0,"-",MIN(AA6,AA9,AA12,AA15,AA20,AA23,AA26,AA29,AA34,AA37,AA40,AA43,AA48,AA51,AA54,AA57,AA62,AA65,AA68,AA71,AA76,AA79,AA82,AA85)) -> 35 | AB87: =IF(ISERROR(OFFSET(AA6,MATCH(AA87,$AA$6:$AA$85,0)-1,-26,1,1)),"-",OFFSET(AA6,MATCH(AA87,$AA$6:$AA$85,0)-1,-26,1,1)) -> R. Ours
Y88: Lowest Average | AA88: =IF(MIN(W6,W9,W12,W15,W20,W23,W26,W29,W34,W37,W40,W43,W48,W51,W54,W57,W62,W65,W68,W71,W76,W79,W82,W85)=0,"-",MIN(W6,W9,W12,W15,W20,W23,W26,W29,W34,W37,W40,W43,W48,W51,W54,W57,W62,W65,W68,W71,W76,W79,W82,W85)) -> 39.222222222222221 | AB88: =IF(ISERROR(OFFSET(W6,MATCH(AA88,$W$6:$W$85,0)-1,-22,1,1)),"-",OFFSET(W6,MATCH(AA88,$W$6:$W$85,0)-1,-22,1,1)) -> R. Ours
X89: Lowest Net Round | AA89: =IF(MIN(AC6,AC9,AC12,AC15,AC20,AC23,AC26,AC29,AC34,AC37,AC40,AC43,AC48,AC51,AC54,AC57,AC62,AC65,AC68,AC71,AC76,AC79,AC82,AC85)=0,"-",MIN(AC6,AC9,AC12,AC15,AC20,AC23,AC26,AC29,AC34,AC37,AC40,AC43,AC48,AC51,AC54,AC57,AC62,AC65,AC68,AC71,AC76,AC79,AC82,AC85)) -> 31 | AB89: =IF(ISERROR(OFFSET(AC6,MATCH(AA89,$AC$6:$AC$85,0)-1,-28,1,1)),"-",OFFSET(AC6,MATCH(AA89,$AC$6:$AC$85,0)-1,-28,1,1)) -> T. Baumgarner
X90: Lowest Net Average | AA90: =IF(MIN(Y6,Y9,Y12,Y15,Y20,Y23,Y26,Y29,Y34,Y37,Y40,Y43,Y48,Y51,Y54,Y57,Y62,Y65,Y68,Y71,Y76,Y79,Y82,Y85)=0,"-",MIN(Y6,Y9,Y12,Y15,Y20,Y23,Y26,Y29,Y34,Y37,Y40,Y43,Y48,Y51,Y54,Y57,Y62,Y65,Y68,Y71,Y76,Y79,Y82,Y85)) -> 37.666666666666664 | AB90: =IF(ISERROR(OFFSET(Y6,MATCH(AA90,$Y$6:$Y$85,0)-1,-24,1,1)),"-",OFFSET(Y6,MATCH(AA90,$Y$6:$Y$85,0)-1,-24,1,1)) -> R. Ours