A2: =MID(CELL("filename",A1),FIND("]",CELL("filename",A1))+1,LEN(CELL("filename",A1))-FIND("]",CELL("filename",A1))) -> Handicaps
A4: =Standings!$A$4 -> 2006
A5: One Players
B6: 1st 5 Weeks | C6: 2nd 5 Weeks | D6: 3rd 5 Weeks | E6: 4th 5 Weeks | F6: EOY | G6: 18 Hole
A7: ='T. Reese'!$A$1 -> T. Reese | B7: =IF('T. Reese'!$C$7=" ","-",'T. Reese'!$C$7) -> 3 | C7: ='T. Reese'!$C$18 -> 4 | D7: ='T. Reese'!$C$31 -> 5 | E7: ='T. Reese'!$C$42 -> 4 | F7: ='T. Reese'!$T$53 -> 4.2222222222222214 | G7: =IF(ISERROR(F7*1.5),"-",F7*1.5) -> 6.3333333333333321
A8: ='T. Wilson'!$A$1 -> T. Wilson | B8: =IF('T. Wilson'!$C$7=" ","-",'T. Wilson'!$C$7) -> 3 | C8: ='T. Wilson'!$C$18 -> 6 | D8: ='T. Wilson'!$C$31 -> 2 | E8: ='T. Wilson'!$C$42 -> 3 | F8: ='T. Wilson'!$T$53 -> 3.1428571428571459 | G8: =IF(ISERROR(F8*1.5),"-",F8*1.5) -> 4.7142857142857189
A9: ='M. Rutherford'!$A$1 -> M. Rutherford | B9: =IF('M. Rutherford'!$C$7=" ","-",'M. Rutherford'!$C$7) -> 3 | C9: ='M. Rutherford'!$C$18 -> 3 | D9: ='M. Rutherford'!$C$31 -> 3 | E9: ='M. Rutherford'!$C$42 -> 3 | F9: ='M. Rutherford'!$T$53 -> 3 | G9: =IF(ISERROR(F9*1.5),"-",F9*1.5) -> 4.5
A10: ='R. Keeney'!$A$1 -> R. Keeney | B10: =IF('R. Keeney'!$C$7=" ","-",'R. Keeney'!$C$7) -> 3 | C10: ='R. Keeney'!$C$18 -> 3 | D10: ='R. Keeney'!$C$31 -> 3 | E10: ='R. Keeney'!$C$42 -> 3 | F10: ='R. Keeney'!$T$53 -> 3.3 | G10: =IF(ISERROR(F10*1.5),"-",F10*1.5) -> 4.95
A11: ='D. Smith'!$A$1 -> D. Smith | B11: =IF('D. Smith'!$C$7=" ","-",'D. Smith'!$C$7) -> 4 | C11: ='D. Smith'!$C$18 -> 5 | D11: ='D. Smith'!$C$31 -> 3 | E11: ='D. Smith'!$C$42 -> 4 | F11: ='D. Smith'!$T$53 -> 3.3 | G11: =IF(ISERROR(F11*1.5),"-",F11*1.5) -> 4.95
A12: ='R. Ours'!$A$1 -> R. Ours | B12: =IF('R. Ours'!$C$7=" ","-",'R. Ours'!$C$7) -> 3 | C12: ='R. Ours'!$C$18 -> 1 | D12: ='R. Ours'!$C$31 -> 1 | E12: ='R. Ours'!$C$42 -> 1 | F12: ='R. Ours'!$T$53 -> 0.89999999999999858 | G12: =IF(ISERROR(F12*1.5),"-",F12*1.5) -> 1.35
A14: Two Players
B15: 1st 5 Weeks | C15: 2nd 5 Weeks | D15: 3rd 5 Weeks | E15: 4th 5 Weeks | F15: EOY | G15: 18 Hole
A16: ='A. Wilks'!$A$1 -> A. Wilks | B16: =IF('A. Wilks'!$C$7=" ","-",'A. Wilks'!$C$7) -> 7 | C16: ='A. Wilks'!$C$18 -> 8 | D16: ='A. Wilks'!$C$31 -> 7 | E16: ='A. Wilks'!$C$42 -> 8 | F16: ='A. Wilks'!$T$53 -> 7.6 | G16: =IF(ISERROR(F16*1.5),"-",F16*1.5) -> 11.4
A17: ='B. Craig'!$A$1 -> B. Craig | B17: =IF('B. Craig'!$C$7=" ","-",'B. Craig'!$C$7) -> 5 | C17: ='B. Craig'!$C$18 -> 8 | D17: ='B. Craig'!$C$31 -> 6 | E17: ='B. Craig'!$C$42 -> 7 | F17: ='B. Craig'!$T$53 -> 6.7777777777777786 | G17: =IF(ISERROR(F17*1.5),"-",F17*1.5) -> 10.166666666666668
A18: ='M. McComas'!$A$1 -> M. McComas | B18: =IF('M. McComas'!$C$7=" ","-",'M. McComas'!$C$7) -> 4 | C18: ='M. McComas'!$C$18 -> 5 | D18: ='M. McComas'!$C$31 -> 5 | E18: ='M. McComas'!$C$42 -> 6 | F18: ='M. McComas'!$T$53 -> 5.5555555555555571 | G18: =IF(ISERROR(F18*1.5),"-",F18*1.5) -> 8.3333333333333357
A19: ='T. Proctor'!$A$1 -> T. Proctor | B19: =IF('T. Proctor'!$C$7=" ","-",'T. Proctor'!$C$7) -> 4 | C19: ='T. Proctor'!$C$18 -> 5 | D19: ='T. Proctor'!$C$31 -> 5 | E19: ='T. Proctor'!$C$42 -> 6 | F19: ='T. Proctor'!$T$53 -> 5.9 | G19: =IF(ISERROR(F19*1.5),"-",F19*1.5) -> 8.85
A20: ='G. White'!$A$1 -> G. White | B20: =IF('G. White'!$C$7=" ","-",'G. White'!$C$7) -> 4 | C20: ='G. White'!$C$18 -> 4 | D20: ='G. White'!$C$31 -> 5 | E20: ='G. White'!$C$42 -> 4 | F20: ='G. White'!$T$53 -> 4.5 | G20: =IF(ISERROR(F20*1.5),"-",F20*1.5) -> 6.75
A21: ='T. Way'!$A$1 -> T. Way | B21: =IF('T. Way'!$C$7=" ","-",'T. Way'!$C$7) -> 5 | C21: ='T. Way'!$C$18 -> 6 | D21: ='T. Way'!$C$31 -> 7 | E21: ='T. Way'!$C$42 -> 6 | F21: ='T. Way'!$T$53 -> 6.2222222222222214 | G21: =IF(ISERROR(F21*1.5),"-",F21*1.5) -> 9.3333333333333321
A23: Three Players
B24: 1st 5 Weeks | C24: 2nd 5 Weeks | D24: 3rd 5 Weeks | E24: 4th 5 Weeks | F24: EOY | G24: 18 Hole
A25: ='B. Meadows'!$A$1 -> B. Meadows | B25: =IF('B. Meadows'!$C$7=" ","-",'B. Meadows'!$C$7) -> 9 | C25: ='B. Meadows'!$C$18 -> 13 | D25: ='B. Meadows'!$C$31 -> 12 | E25: ='B. Meadows'!$C$42 -> 11 | F25: ='B. Meadows'!$T$53 -> 11.666666666666664 | G25: =IF(ISERROR(F25*1.5),"-",F25*1.5) -> 17.5
A26: ='B. Hall'!$A$1 -> B. Hall | B26: =IF('B. Hall'!$C$7=" ","-",'B. Hall'!$C$7) -> 10 | C26: ='B. Hall'!$C$18 -> 8 | D26: ='B. Hall'!$C$31 -> 10 | E26: ='B. Hall'!$C$42 -> 11 | F26: ='B. Hall'!$T$53 -> 10.4 | G26: =IF(ISERROR(F26*1.5),"-",F26*1.5) -> 15.6
A27: ='M. Kyle'!$A$1 -> M. Kyle | B27: =IF('M. Kyle'!$C$7=" ","-",'M. Kyle'!$C$7) -> 9 | C27: ='M. Kyle'!$C$18 -> 9 | D27: ='M. Kyle'!$C$31 -> 8 | E27: ='M. Kyle'!$C$42 -> 9 | F27: ='M. Kyle'!$T$53 -> 8.3 | G27: =IF(ISERROR(F27*1.5),"-",F27*1.5) -> 12.45
A28: ='S. Jones'!$A$1 -> S. Jones | B28: =IF('S. Jones'!$C$7=" ","-",'S. Jones'!$C$7) -> 8 | C28: ='S. Jones'!$C$18 -> 8 | D28: ='S. Jones'!$C$31 -> 7 | E28: ='S. Jones'!$C$42 -> 7 | F28: ='S. Jones'!$T$53 -> 7.4 | G28: =IF(ISERROR(F28*1.5),"-",F28*1.5) -> 11.1
A29: ='G. Taylor'!$A$1 -> G. Taylor | B29: =IF('G. Taylor'!$C$7=" ","-",'G. Taylor'!$C$7) -> 9 | C29: ='G. Taylor'!$C$18 -> 12 | D29: ='G. Taylor'!$C$31 -> 10 | E29: ='G. Taylor'!$C$42 -> 9 | F29: ='G. Taylor'!$T$53 -> 9.6 | G29: =IF(ISERROR(F29*1.5),"-",F29*1.5) -> 14.4
A30: ='L. Baumgarner'!$A$1 -> L. Baumgarner | B30: =IF('L. Baumgarner'!$C$7=" ","-",'L. Baumgarner'!$C$7) -> 9 | C30: ='L. Baumgarner'!$C$18 -> 13 | D30: ='L. Baumgarner'!$C$31 -> 13 | E30: ='L. Baumgarner'!$C$42 -> 11 | F30: ='L. Baumgarner'!$T$53 -> 11.1 | G30: =IF(ISERROR(F30*1.5),"-",F30*1.5) -> 16.65
A32: Four Players
B33: 1st 5 Weeks | C33: 2nd 5 Weeks | D33: 3rd 5 Weeks | E33: 4th 5 Weeks | F33: EOY | G33: 18 Hole
A34: ='L. Chiles'!$A$1 -> L. Chiles | B34: =IF('L. Chiles'!$C$7=" ","-",'L. Chiles'!$C$7) -> 14 | C34: ='L. Chiles'!$C$18 -> 15 | D34: ='L. Chiles'!$C$31 -> 15 | E34: ='L. Chiles'!$C$42 -> 15 | F34: ='L. Chiles'!$T$53 -> 15.222222222222221 | G34: =IF(ISERROR(F34*1.5),"-",F34*1.5) -> 22.833333333333332
A35: ='J. Landers'!$A$1 -> J. Landers | B35: =IF('J. Landers'!$C$7=" ","-",'J. Landers'!$C$7) -> 11 | C35: ='J. Landers'!$C$18 -> 12 | D35: ='J. Landers'!$C$31 -> 11 | E35: ='J. Landers'!$C$42 -> 11 | F35: ='J. Landers'!$T$53 -> 11.888888888888886 | G35: =IF(ISERROR(F35*1.5),"-",F35*1.5) -> 17.833333333333329
A36: ='B. Kyle'!$A$1 -> B. Kyle | B36: =IF('B. Kyle'!$C$7=" ","-",'B. Kyle'!$C$7) -> 15 | C36: ='B. Kyle'!$C$18 -> 15 | D36: ='B. Kyle'!$C$31 -> 13 | E36: ='B. Kyle'!$C$42 -> 14 | F36: ='B. Kyle'!$T$53 -> 13.3 | G36: =IF(ISERROR(F36*1.5),"-",F36*1.5) -> 19.95
A37: ='T. Baumgarner'!$A$1 -> T. Baumgarner | B37: =IF('T. Baumgarner'!$C$7=" ","-",'T. Baumgarner'!$C$7) -> 12 | C37: ='T. Baumgarner'!$C$18 -> 11 | D37: ='T. Baumgarner'!$C$31 -> 10 | E37: ='T. Baumgarner'!$C$42 -> 11 | F37: ='T. Baumgarner'!$T$53 -> 12.1 | G37: =IF(ISERROR(F37*1.5),"-",F37*1.5) -> 18.15
A38: ='B. Harbour'!$A$1 -> B. Harbour | B38: =IF('B. Harbour'!$C$7=" ","-",'B. Harbour'!$C$7) -> 13 | C38: ='B. Harbour'!$C$18 -> 16 | D38: ='B. Harbour'!$C$31 -> 16 | E38: ='B. Harbour'!$C$42 -> 16 | F38: ='B. Harbour'!$T$53 -> 14.5 | G38: =IF(ISERROR(F38*1.5),"-",F38*1.5) -> 21.75
A39: ='J. Dodrill'!$A$1 -> J. Dodrill | B39: =IF('J. Dodrill'!$C$7=" ","-",'J. Dodrill'!$C$7) -> 14 | C39: ='J. Dodrill'!$C$18 -> 14 | D39: ='J. Dodrill'!$C$31 -> 15 | E39: ='J. Dodrill'!$C$42 -> 15 | F39: ='J. Dodrill'!$T$53 -> 14.444444444444443 | G39: =IF(ISERROR(F39*1.5),"-",F39*1.5) -> 21.666666666666664