A2: =MID(CELL("filename",A1),FIND("]",CELL("filename",A1))+1,LEN(CELL("filename",A1))-FIND("]",CELL("filename",A1))) -> Year End Championship Round
A4: =Standings!$A$4 -> 2006
A8: One Players
A9: Par | B9: 4 | C9: 3 | D9: 4 | E9: 4 | F9: 5 | G9: 3 | H9: 5 | I9: 4 | J9: 5 | K9: 37 | L9: 4 | M9: 4 | N9: 4 | O9: 3 | P9: 4 | Q9: 4 | R9: 3 | S9: 3 | T9: 4 | U9: 33
A10: Hole | B10: 1 | C10: 2 | D10: 3 | E10: 4 | F10: 5 | G10: 6 | H10: 7 | I10: 8 | J10: 9 | L10: 10 | M10: 11 | N10: 12 | O10: 13 | P10: 14 | Q10: 15 | R10: 16 | S10: 17 | T10: 18 | V10: Actual | W10: Par | X10: HC | Y10: Net | Z10: Par | AA10: Rank | AB10: Putts
A11: ='T. Reese'!$A$1 -> T. Reese | K11: =IF(SUM(B11:J11)=0,"-",SUM(B11:J11)) -> - | U11: =IF(SUM(L11:T11)=0,"-",SUM(L11:T11)) -> - | V11: =IF(SUM(K11,U11)=0,"-",SUM(K11,U11)) -> - | W11: =IF(ISERROR(IF(V11-37=-70, "-", V11-70)),"-",(IF(V11-70=-70,"-",V11-70))) -> - | X11: =IF(ISERROR(ROUND('T. Reese'!$T$54,0)),"-",ROUND('T. Reese'!$T$54,0)) -> 6 | Y11: =IF(ISERROR(IF(V11-X11=-X11, 0, V11-X11)),"-",(IF(V11-X11=-X11, 0, V11-X11))) -> - | Z11: =IF(ISERROR(IF(Y11-70=-70, "-", Y11-70)),"-",(IF(Y11-70=-70,"-",Y11-70))) -> - | AA11: =IF(ISERROR(COUNT(Z$11:Z$46)-(RANK(Z11,Z$11:Z$46)+COUNTIF(Z$11:Z11,Z11))+2),"-",COUNT(Z$11:Z$46)-(RANK(Z11,Z$1:Z$46)+COUNTIF(Z$11:Z11,Z11))+2) -> -
A12: ='T. Wilson'!$A$1 -> T. Wilson | K12: =IF(SUM(B12:J12)=0,"-",SUM(B12:J12)) -> - | U12: =IF(SUM(L12:T12)=0,"-",SUM(L12:T12)) -> - | V12: =IF(SUM(K12,U12)=0,"-",SUM(K12,U12)) -> - | W12: =IF(ISERROR(IF(V12-37=-70, "-", V12-70)),"-",(IF(V12-70=-70,"-",V12-70))) -> - | X12: =IF(ISERROR(ROUND('T. Wilson'!$T$54,0)),"-",ROUND('T. Wilson'!$T$54,0)) -> 5 | Y12: =IF(ISERROR(IF(V12-X12=-X12, 0, V12-X12)),"-",(IF(V12-X12=-X12, 0, V12-X12))) -> - | Z12: =IF(ISERROR(IF(Y12-70=-70, "-", Y12-70)),"-",(IF(Y12-70=-70,"-",Y12-70))) -> - | AA12: =IF(ISERROR(COUNT(Z$11:Z$46)-(RANK(Z12,Z$11:Z$46)+COUNTIF(Z$11:Z12,Z12))+2),"-",COUNT(Z$11:Z$46)-(RANK(Z12,Z$1:Z$46)+COUNTIF(Z$11:Z12,Z12))+2) -> -
A13: ='M. Rutherford'!$A$1 -> M. Rutherford | B13: 4 | C13: 3 | D13: 4 | E13: 4 | F13: 5 | G13: 4 | H13: 6 | I13: 5 | J13: 5 | K13: =IF(SUM(B13:J13)=0,"-",SUM(B13:J13)) -> 40 | L13: 4 | M13: 6 | N13: 4 | O13: 3 | P13: 5 | Q13: 5 | R13: 6 | S13: 4 | T13: 5 | U13: =IF(SUM(L13:T13)=0,"-",SUM(L13:T13)) -> 42 | V13: =IF(SUM(K13,U13)=0,"-",SUM(K13,U13)) -> 82 | W13: =IF(ISERROR(IF(V13-37=-70, "-", V13-70)),"-",(IF(V13-70=-70,"-",V13-70))) -> 12 | X13: =IF(ISERROR(ROUND('M. Rutherford'!$T$54,0)),"-",ROUND('M. Rutherford'!$T$54,0)) -> 5 | Y13: =IF(ISERROR(IF(V13-X13=-X13, 0, V13-X13)),"-",(IF(V13-X13=-X13, 0, V13-X13))) -> 77 | Z13: =IF(ISERROR(IF(Y13-70=-70, "-", Y13-70)),"-",(IF(Y13-70=-70,"-",Y13-70))) -> 7 | AA13: =IF(ISERROR(COUNT(Z$11:Z$46)-(RANK(Z13,Z$11:Z$46)+COUNTIF(Z$11:Z13,Z13))+2),"-",COUNT(Z$11:Z$46)-(RANK(Z13,Z$1:Z$46)+COUNTIF(Z$11:Z13,Z13))+2) -> 10
A14: ='R. Keeney'!$A$1 -> R. Keeney | B14: 4 | C14: 4 | D14: 5 | E14: 6 | F14: 6 | G14: 3 | H14: 5 | I14: 5 | J14: 5 | K14: =IF(SUM(B14:J14)=0,"-",SUM(B14:J14)) -> 43 | L14: 4 | M14: 4 | N14: 5 | O14: 3 | P14: 4 | Q14: 5 | R14: 6 | S14: 4 | T14: 4 | U14: =IF(SUM(L14:T14)=0,"-",SUM(L14:T14)) -> 39 | V14: =IF(SUM(K14,U14)=0,"-",SUM(K14,U14)) -> 82 | W14: =IF(ISERROR(IF(V14-37=-70, "-", V14-70)),"-",(IF(V14-70=-70,"-",V14-70))) -> 12 | X14: =IF(ISERROR(ROUND('R. Keeney'!$T$54,0)),"-",ROUND('R. Keeney'!$T$54,0)) -> 5 | Y14: =IF(ISERROR(IF(V14-X14=-X14, 0, V14-X14)),"-",(IF(V14-X14=-X14, 0, V14-X14))) -> 77 | Z14: =IF(ISERROR(IF(Y14-70=-70, "-", Y14-70)),"-",(IF(Y14-70=-70,"-",Y14-70))) -> 7 | AA14: =IF(ISERROR(COUNT(Z$11:Z$46)-(RANK(Z14,Z$11:Z$46)+COUNTIF(Z$11:Z14,Z14))+2),"-",COUNT(Z$11:Z$46)-(RANK(Z14,Z$1:Z$46)+COUNTIF(Z$11:Z14,Z14))+2) -> 9
A15: ='D. Smith'!$A$1 -> D. Smith | B15: 4 | C15: 5 | D15: 5 | E15: 5 | F15: 6 | G15: 3 | H15: 4 | I15: 5 | J15: 5 | K15: =IF(SUM(B15:J15)=0,"-",SUM(B15:J15)) -> 42 | L15: 4 | M15: 4 | N15: 4 | O15: 4 | P15: 3 | Q15: 4 | R15: 5 | S15: 3 | T15: 4 | U15: =IF(SUM(L15:T15)=0,"-",SUM(L15:T15)) -> 35 | V15: =IF(SUM(K15,U15)=0,"-",SUM(K15,U15)) -> 77 | W15: =IF(ISERROR(IF(V15-37=-70, "-", V15-70)),"-",(IF(V15-70=-70,"-",V15-70))) -> 7 | X15: =IF(ISERROR(ROUND('D. Smith'!$T$54,0)),"-",ROUND('D. Smith'!$T$54,0)) -> 5 | Y15: =IF(ISERROR(IF(V15-X15=-X15, 0, V15-X15)),"-",(IF(V15-X15=-X15, 0, V15-X15))) -> 72 | Z15: =IF(ISERROR(IF(Y15-70=-70, "-", Y15-70)),"-",(IF(Y15-70=-70,"-",Y15-70))) -> 2 | AA15: =IF(ISERROR(COUNT(Z$11:Z$46)-(RANK(Z15,Z$11:Z$46)+COUNTIF(Z$11:Z15,Z15))+2),"-",COUNT(Z$11:Z$46)-(RANK(Z15,Z$1:Z$46)+COUNTIF(Z$11:Z15,Z15))+2) -> 4 | AB15: 31
A16: ='R. Ours'!$A$1 -> R. Ours | B16: 6 | C16: 3 | D16: 4 | E16: 5 | F16: 5 | G16: 4 | H16: 6 | I16: 4 | J16: 5 | K16: =IF(SUM(B16:J16)=0,"-",SUM(B16:J16)) -> 42 | L16: 6 | M16: 3 | N16: 8 | O16: 4 | P16: 6 | Q16: 5 | R16: 4 | S16: 4 | T16: 3 | U16: =IF(SUM(L16:T16)=0,"-",SUM(L16:T16)) -> 43 | V16: =IF(SUM(K16,U16)=0,"-",SUM(K16,U16)) -> 85 | W16: =IF(ISERROR(IF(V16-37=-70, "-", V16-70)),"-",(IF(V16-70=-70,"-",V16-70))) -> 15 | X16: =IF(ISERROR(ROUND('R. Ours'!$T$54,0)),"-",ROUND('R. Ours'!$T$54,0)) -> 1 | Y16: =IF(ISERROR(IF(V16-X16=-X16, 0, V16-X16)),"-",(IF(V16-X16=-X16, 0, V16-X16))) -> 84 | Z16: =IF(ISERROR(IF(Y16-70=-70, "-", Y16-70)),"-",(IF(Y16-70=-70,"-",Y16-70))) -> 14 | AA16: =IF(ISERROR(COUNT(Z$11:Z$46)-(RANK(Z16,Z$11:Z$46)+COUNTIF(Z$11:Z16,Z16))+2),"-",COUNT(Z$11:Z$46)-(RANK(Z16,Z$1:Z$46)+COUNTIF(Z$11:Z16,Z16))+2) -> 16
A18: Two Players
A19: Par | B19: 4 | C19: 3 | D19: 4 | E19: 4 | F19: 5 | G19: 3 | H19: 5 | I19: 4 | J19: 5 | K19: 37 | L19: 4 | M19: 4 | N19: 4 | O19: 3 | P19: 4 | Q19: 4 | R19: 3 | S19: 3 | T19: 4 | U19: 33
A20: Hole | B20: 1 | C20: 2 | D20: 3 | E20: 4 | F20: 5 | G20: 6 | H20: 7 | I20: 8 | J20: 9 | L20: 10 | M20: 11 | N20: 12 | O20: 13 | P20: 14 | Q20: 15 | R20: 16 | S20: 17 | T20: 18 | V20: Actual | W20: Par | X20: HC | Y20: Net | Z20: Par | AA20: Rank | AB20: Putts
A21: ='A. Wilks'!$A$1 -> A. Wilks | B21: 5 | C21: 5 | D21: 4 | E21: 6 | F21: 6 | G21: 4 | H21: 5 | I21: 8 | J21: 8 | K21: =IF(SUM(B21:J21)=0,"-",SUM(B21:J21)) -> 51 | L21: 4 | M21: 5 | N21: 4 | O21: 3 | P21: 4 | Q21: 4 | R21: 5 | S21: 3 | T21: 4 | U21: =IF(SUM(L21:T21)=0,"-",SUM(L21:T21)) -> 36 | V21: =IF(SUM(K21,U21)=0,"-",SUM(K21,U21)) -> 87 | W21: =IF(ISERROR(IF(V21-37=-70, "-", V21-70)),"-",(IF(V21-70=-70,"-",V21-70))) -> 17 | X21: =IF(ISERROR(ROUND('A. Wilks'!$T$54,0)),"-",ROUND('A. Wilks'!$T$54,0)) -> 11 | Y21: =IF(ISERROR(IF(V21-X21=-X21, 0, V21-X21)),"-",(IF(V21-X21=-X21, 0, V21-X21))) -> 76 | Z21: =IF(ISERROR(IF(Y21-70=-70, "-", Y21-70)),"-",(IF(Y21-70=-70,"-",Y21-70))) -> 6 | AA21: =IF(ISERROR(COUNT(Z$11:Z$46)-(RANK(Z21,Z$11:Z$46)+COUNTIF(Z$11:Z21,Z21))+2),"-",COUNT(Z$11:Z$46)-(RANK(Z21,Z$1:Z$46)+COUNTIF(Z$11:Z21,Z21))+2) -> 8 | AB21: 27
A22: ='B. Craig'!$A$1 -> B. Craig | K22: =IF(SUM(B22:J22)=0,"-",SUM(B22:J22)) -> - | U22: =IF(SUM(L22:T22)=0,"-",SUM(L22:T22)) -> - | V22: =IF(SUM(K22,U22)=0,"-",SUM(K22,U22)) -> - | W22: =IF(ISERROR(IF(V22-37=-70, "-", V22-70)),"-",(IF(V22-70=-70,"-",V22-70))) -> - | X22: =IF(ISERROR(ROUND('B. Craig'!$T$54,0)),"-",ROUND('B. Craig'!$T$54,0)) -> 10 | Y22: =IF(ISERROR(IF(V22-X22=-X22, 0, V22-X22)),"-",(IF(V22-X22=-X22, 0, V22-X22))) -> - | Z22: =IF(ISERROR(IF(Y22-70=-70, "-", Y22-70)),"-",(IF(Y22-70=-70,"-",Y22-70))) -> - | AA22: =IF(ISERROR(COUNT(Z$11:Z$46)-(RANK(Z22,Z$11:Z$46)+COUNTIF(Z$11:Z22,Z22))+2),"-",COUNT(Z$11:Z$46)-(RANK(Z22,Z$1:Z$46)+COUNTIF(Z$11:Z22,Z22))+2) -> -
A23: ='M. McComas'!$A$1 -> M. McComas | B23: 4 | C23: 4 | D23: 5 | E23: 5 | F23: 6 | G23: 3 | H23: 5 | I23: 4 | J23: 5 | K23: =IF(SUM(B23:J23)=0,"-",SUM(B23:J23)) -> 41 | L23: 4 | M23: 5 | N23: 5 | O23: 3 | P23: 5 | Q23: 5 | R23: 4 | S23: 4 | T23: 4 | U23: =IF(SUM(L23:T23)=0,"-",SUM(L23:T23)) -> 39 | V23: =IF(SUM(K23,U23)=0,"-",SUM(K23,U23)) -> 80 | W23: =IF(ISERROR(IF(V23-37=-70, "-", V23-70)),"-",(IF(V23-70=-70,"-",V23-70))) -> 10 | X23: =IF(ISERROR(ROUND('M. McComas'!$T$54,0)),"-",ROUND('M. McComas'!$T$54,0)) -> 8 | Y23: =IF(ISERROR(IF(V23-X23=-X23, 0, V23-X23)),"-",(IF(V23-X23=-X23, 0, V23-X23))) -> 72 | Z23: =IF(ISERROR(IF(Y23-70=-70, "-", Y23-70)),"-",(IF(Y23-70=-70,"-",Y23-70))) -> 2 | AA23: =IF(ISERROR(COUNT(Z$11:Z$46)-(RANK(Z23,Z$11:Z$46)+COUNTIF(Z$11:Z23,Z23))+2),"-",COUNT(Z$11:Z$46)-(RANK(Z23,Z$1:Z$46)+COUNTIF(Z$11:Z23,Z23))+2) -> 3 | AB23: 27
A24: ='T. Proctor'!$A$1 -> T. Proctor | B24: 5 | C24: 4 | D24: 4 | E24: 5 | F24: 6 | G24: 3 | H24: 6 | I24: 4 | J24: 6 | K24: =IF(SUM(B24:J24)=0,"-",SUM(B24:J24)) -> 43 | L24: 5 | M24: 4 | N24: 4 | O24: 4 | P24: 4 | Q24: 4 | R24: 4 | S24: 4 | T24: 4 | U24: =IF(SUM(L24:T24)=0,"-",SUM(L24:T24)) -> 37 | V24: =IF(SUM(K24,U24)=0,"-",SUM(K24,U24)) -> 80 | W24: =IF(ISERROR(IF(V24-37=-70, "-", V24-70)),"-",(IF(V24-70=-70,"-",V24-70))) -> 10 | X24: =IF(ISERROR(ROUND('T. Proctor'!$T$54,0)),"-",ROUND('T. Proctor'!$T$54,0)) -> 9 | Y24: =IF(ISERROR(IF(V24-X24=-X24, 0, V24-X24)),"-",(IF(V24-X24=-X24, 0, V24-X24))) -> 71 | Z24: =IF(ISERROR(IF(Y24-70=-70, "-", Y24-70)),"-",(IF(Y24-70=-70,"-",Y24-70))) -> 1 | AA24: =IF(ISERROR(COUNT(Z$11:Z$46)-(RANK(Z24,Z$11:Z$46)+COUNTIF(Z$11:Z24,Z24))+2),"-",COUNT(Z$11:Z$46)-(RANK(Z24,Z$1:Z$46)+COUNTIF(Z$11:Z24,Z24))+2) -> 2 | AB24: 32
A25: ='G. White'!$A$1 -> G. White | B25: 5 | C25: 4 | D25: 5 | E25: 5 | F25: 6 | G25: 3 | H25: 5 | I25: 4 | J25: 5 | K25: =IF(SUM(B25:J25)=0,"-",SUM(B25:J25)) -> 42 | L25: 4 | M25: 4 | N25: 4 | O25: 3 | P25: 5 | Q25: 4 | R25: 4 | S25: 3 | T25: 4 | U25: =IF(SUM(L25:T25)=0,"-",SUM(L25:T25)) -> 35 | V25: =IF(SUM(K25,U25)=0,"-",SUM(K25,U25)) -> 77 | W25: =IF(ISERROR(IF(V25-37=-70, "-", V25-70)),"-",(IF(V25-70=-70,"-",V25-70))) -> 7 | X25: =IF(ISERROR(ROUND('G. White'!$T$54,0)),"-",ROUND('G. White'!$T$54,0)) -> 7 | Y25: =IF(ISERROR(IF(V25-X25=-X25, 0, V25-X25)),"-",(IF(V25-X25=-X25, 0, V25-X25))) -> 70 | Z25: =IF(ISERROR(IF(Y25-70=-70, "-", Y25-70)),"-",(IF(Y25-70=-70,"-",Y25-70))) -> 0 | AA25: =IF(ISERROR(COUNT(Z$11:Z$46)-(RANK(Z25,Z$11:Z$46)+COUNTIF(Z$11:Z25,Z25))+2),"-",COUNT(Z$11:Z$46)-(RANK(Z25,Z$1:Z$46)+COUNTIF(Z$11:Z25,Z25))+2) -> 1 | AB25: 33
A26: ='T. Way'!$A$1 -> T. Way | K26: =IF(SUM(B26:J26)=0,"-",SUM(B26:J26)) -> - | U26: =IF(SUM(L26:T26)=0,"-",SUM(L26:T26)) -> - | V26: =IF(SUM(K26,U26)=0,"-",SUM(K26,U26)) -> - | W26: =IF(ISERROR(IF(V26-37=-70, "-", V26-70)),"-",(IF(V26-70=-70,"-",V26-70))) -> - | X26: =IF(ISERROR(ROUND('T. Way'!$T$54,0)),"-",ROUND('T. Way'!$T$54,0)) -> 9 | Y26: =IF(ISERROR(IF(V26-X26=-X26, 0, V26-X26)),"-",(IF(V26-X26=-X26, 0, V26-X26))) -> - | Z26: =IF(ISERROR(IF(Y26-70=-70, "-", Y26-70)),"-",(IF(Y26-70=-70,"-",Y26-70))) -> - | AA26: =IF(ISERROR(COUNT(Z$11:Z$46)-(RANK(Z26,Z$11:Z$46)+COUNTIF(Z$11:Z26,Z26))+2),"-",COUNT(Z$11:Z$46)-(RANK(Z26,Z$1:Z$46)+COUNTIF(Z$11:Z26,Z26))+2) -> -
A28: Three Players
A29: Par | B29: 4 | C29: 3 | D29: 4 | E29: 4 | F29: 5 | G29: 3 | H29: 5 | I29: 4 | J29: 5 | K29: 37 | L29: 4 | M29: 4 | N29: 4 | O29: 3 | P29: 4 | Q29: 4 | R29: 3 | S29: 3 | T29: 4 | U29: 33
A30: Hole | B30: 1 | C30: 2 | D30: 3 | E30: 4 | F30: 5 | G30: 6 | H30: 7 | I30: 8 | J30: 9 | L30: 10 | M30: 11 | N30: 12 | O30: 13 | P30: 14 | Q30: 15 | R30: 16 | S30: 17 | T30: 18 | V30: Actual | W30: Par | X30: HC | Y30: Net | Z30: Par | AA30: Rank | AB30: Putts
A31: ='B. Meadows'!$A$1 -> B. Meadows | K31: =IF(SUM(B31:J31)=0,"-",SUM(B31:J31)) -> - | U31: =IF(SUM(L31:T31)=0,"-",SUM(L31:T31)) -> - | V31: =IF(SUM(K31,U31)=0,"-",SUM(K31,U31)) -> - | W31: =IF(ISERROR(IF(V31-37=-70, "-", V31-70)),"-",(IF(V31-70=-70,"-",V31-70))) -> - | X31: =IF(ISERROR(ROUND('B. Meadows'!$T$54,0)),"-",ROUND('B. Meadows'!$T$54,0)) -> 18 | Y31: =IF(ISERROR(IF(V31-X31=-X31, 0, V31-X31)),"-",(IF(V31-X31=-X31, 0, V31-X31))) -> - | Z31: =IF(ISERROR(IF(Y31-70=-70, "-", Y31-70)),"-",(IF(Y31-70=-70,"-",Y31-70))) -> - | AA31: =IF(ISERROR(COUNT(Z$11:Z$46)-(RANK(Z31,Z$11:Z$46)+COUNTIF(Z$11:Z31,Z31))+2),"-",COUNT(Z$11:Z$46)-(RANK(Z31,Z$1:Z$46)+COUNTIF(Z$11:Z31,Z31))+2) -> -
A32: ='B. Hall'!$A$1 -> B. Hall | B32: 4 | C32: 5 | D32: 5 | E32: 6 | F32: 7 | G32: 3 | H32: 8 | I32: 5 | J32: 8 | K32: =IF(SUM(B32:J32)=0,"-",SUM(B32:J32)) -> 51 | L32: 5 | M32: 6 | N32: 5 | O32: 6 | P32: 6 | Q32: 5 | R32: 5 | S32: 5 | T32: 5 | U32: =IF(SUM(L32:T32)=0,"-",SUM(L32:T32)) -> 48 | V32: =IF(SUM(K32,U32)=0,"-",SUM(K32,U32)) -> 99 | W32: =IF(ISERROR(IF(V32-37=-70, "-", V32-70)),"-",(IF(V32-70=-70,"-",V32-70))) -> 29 | X32: =IF(ISERROR(ROUND('B. Hall'!$T$54,0)),"-",ROUND('B. Hall'!$T$54,0)) -> 16 | Y32: =IF(ISERROR(IF(V32-X32=-X32, 0, V32-X32)),"-",(IF(V32-X32=-X32, 0, V32-X32))) -> 83 | Z32: =IF(ISERROR(IF(Y32-70=-70, "-", Y32-70)),"-",(IF(Y32-70=-70,"-",Y32-70))) -> 13 | AA32: =IF(ISERROR(COUNT(Z$11:Z$46)-(RANK(Z32,Z$11:Z$46)+COUNTIF(Z$11:Z32,Z32))+2),"-",COUNT(Z$11:Z$46)-(RANK(Z32,Z$1:Z$46)+COUNTIF(Z$11:Z32,Z32))+2) -> 14 | AB32: 35
A33: ='M. Kyle'!$A$1 -> M. Kyle | B33: 5 | C33: 4 | D33: 4 | E33: 5 | F33: 4 | G33: 4 | H33: 6 | I33: 6 | J33: 5 | K33: =IF(SUM(B33:J33)=0,"-",SUM(B33:J33)) -> 43 | L33: 4 | M33: 4 | N33: 4 | O33: 6 | P33: 5 | Q33: 5 | R33: 5 | S33: 4 | T33: 5 | U33: =IF(SUM(L33:T33)=0,"-",SUM(L33:T33)) -> 42 | V33: =IF(SUM(K33,U33)=0,"-",SUM(K33,U33)) -> 85 | W33: =IF(ISERROR(IF(V33-37=-70, "-", V33-70)),"-",(IF(V33-70=-70,"-",V33-70))) -> 15 | X33: =IF(ISERROR(ROUND('M. Kyle'!$T$54,0)),"-",ROUND('M. Kyle'!$T$54,0)) -> 12 | Y33: =IF(ISERROR(IF(V33-X33=-X33, 0, V33-X33)),"-",(IF(V33-X33=-X33, 0, V33-X33))) -> 73 | Z33: =IF(ISERROR(IF(Y33-70=-70, "-", Y33-70)),"-",(IF(Y33-70=-70,"-",Y33-70))) -> 3 | AA33: =IF(ISERROR(COUNT(Z$11:Z$46)-(RANK(Z33,Z$11:Z$46)+COUNTIF(Z$11:Z33,Z33))+2),"-",COUNT(Z$11:Z$46)-(RANK(Z33,Z$1:Z$46)+COUNTIF(Z$11:Z33,Z33))+2) -> 6 | AB33: 33
A34: ='S. Jones'!$A$1 -> S. Jones | B34: 4 | C34: 4 | D34: 4 | E34: 4 | F34: 6 | G34: 5 | H34: 4 | I34: 6 | J34: 6 | K34: =IF(SUM(B34:J34)=0,"-",SUM(B34:J34)) -> 43 | L34: 5 | M34: 5 | N34: 7 | O34: 3 | P34: 5 | Q34: 6 | R34: 4 | S34: 4 | T34: 5 | U34: =IF(SUM(L34:T34)=0,"-",SUM(L34:T34)) -> 44 | V34: =IF(SUM(K34,U34)=0,"-",SUM(K34,U34)) -> 87 | W34: =IF(ISERROR(IF(V34-37=-70, "-", V34-70)),"-",(IF(V34-70=-70,"-",V34-70))) -> 17 | X34: =IF(ISERROR(ROUND('S. Jones'!$T$54,0)),"-",ROUND('S. Jones'!$T$54,0)) -> 11 | Y34: =IF(ISERROR(IF(V34-X34=-X34, 0, V34-X34)),"-",(IF(V34-X34=-X34, 0, V34-X34))) -> 76 | Z34: =IF(ISERROR(IF(Y34-70=-70, "-", Y34-70)),"-",(IF(Y34-70=-70,"-",Y34-70))) -> 6 | AA34: =IF(ISERROR(COUNT(Z$11:Z$46)-(RANK(Z34,Z$11:Z$46)+COUNTIF(Z$11:Z34,Z34))+2),"-",COUNT(Z$11:Z$46)-(RANK(Z34,Z$1:Z$46)+COUNTIF(Z$11:Z34,Z34))+2) -> 7 | AB34: 30
A35: ='G. Taylor'!$A$1 -> G. Taylor | B35: 6 | C35: 3 | D35: 4 | E35: 5 | F35: 5 | G35: 4 | H35: 6 | I35: 6 | J35: 5 | K35: =IF(SUM(B35:J35)=0,"-",SUM(B35:J35)) -> 44 | L35: 5 | M35: 6 | N35: 5 | O35: 3 | P35: 4 | Q35: 5 | R35: 5 | S35: 4 | T35: 6 | U35: =IF(SUM(L35:T35)=0,"-",SUM(L35:T35)) -> 43 | V35: =IF(SUM(K35,U35)=0,"-",SUM(K35,U35)) -> 87 | W35: =IF(ISERROR(IF(V35-37=-70, "-", V35-70)),"-",(IF(V35-70=-70,"-",V35-70))) -> 17 | X35: =IF(ISERROR(ROUND('G. Taylor'!$T$54,0)),"-",ROUND('G. Taylor'!$T$54,0)) -> 14 | Y35: =IF(ISERROR(IF(V35-X35=-X35, 0, V35-X35)),"-",(IF(V35-X35=-X35, 0, V35-X35))) -> 73 | Z35: =IF(ISERROR(IF(Y35-70=-70, "-", Y35-70)),"-",(IF(Y35-70=-70,"-",Y35-70))) -> 3 | AA35: =IF(ISERROR(COUNT(Z$11:Z$46)-(RANK(Z35,Z$11:Z$46)+COUNTIF(Z$11:Z35,Z35))+2),"-",COUNT(Z$11:Z$46)-(RANK(Z35,Z$1:Z$46)+COUNTIF(Z$11:Z35,Z35))+2) -> 5 | AB35: 31
A36: ='L. Baumgarner'!$A$1 -> L. Baumgarner | B36: 7 | C36: 4 | D36: 5 | E36: 7 | F36: 7 | G36: 4 | H36: 4 | I36: 6 | J36: 7 | K36: =IF(SUM(B36:J36)=0,"-",SUM(B36:J36)) -> 51 | L36: 4 | M36: 7 | N36: 5 | O36: 3 | P36: 7 | Q36: 4 | R36: 4 | S36: 7 | T36: 5 | U36: =IF(SUM(L36:T36)=0,"-",SUM(L36:T36)) -> 46 | V36: =IF(SUM(K36,U36)=0,"-",SUM(K36,U36)) -> 97 | W36: =IF(ISERROR(IF(V36-37=-70, "-", V36-70)),"-",(IF(V36-70=-70,"-",V36-70))) -> 27 | X36: =IF(ISERROR(ROUND('L. Baumgarner'!$T$54,0)),"-",ROUND('L. Baumgarner'!$T$54,0)) -> 17 | Y36: =IF(ISERROR(IF(V36-X36=-X36, 0, V36-X36)),"-",(IF(V36-X36=-X36, 0, V36-X36))) -> 80 | Z36: =IF(ISERROR(IF(Y36-70=-70, "-", Y36-70)),"-",(IF(Y36-70=-70,"-",Y36-70))) -> 10 | AA36: =IF(ISERROR(COUNT(Z$11:Z$46)-(RANK(Z36,Z$11:Z$46)+COUNTIF(Z$11:Z36,Z36))+2),"-",COUNT(Z$11:Z$46)-(RANK(Z36,Z$1:Z$46)+COUNTIF(Z$11:Z36,Z36))+2) -> 11 | AB36: 31
A38: Four Players
A39: Par | B39: 4 | C39: 3 | D39: 4 | E39: 4 | F39: 5 | G39: 3 | H39: 5 | I39: 4 | J39: 5 | K39: 37 | L39: 4 | M39: 4 | N39: 4 | O39: 3 | P39: 4 | Q39: 4 | R39: 3 | S39: 3 | T39: 4 | U39: 33
A40: Hole | B40: 1 | C40: 2 | D40: 3 | E40: 4 | F40: 5 | G40: 6 | H40: 7 | I40: 8 | J40: 9 | L40: 10 | M40: 11 | N40: 12 | O40: 13 | P40: 14 | Q40: 15 | R40: 16 | S40: 17 | T40: 18 | V40: Actual | W40: Par | X40: HC | Y40: Net | Z40: Par | AA40: Rank | AB40: Putts
A41: ='L. Chiles'!$A$1 -> L. Chiles | K41: =IF(SUM(B41:J41)=0,"-",SUM(B41:J41)) -> - | U41: =IF(SUM(L41:T41)=0,"-",SUM(L41:T41)) -> - | V41: =IF(SUM(K41,U41)=0,"-",SUM(K41,U41)) -> - | W41: =IF(ISERROR(IF(V41-37=-70, "-", V41-70)),"-",(IF(V41-70=-70,"-",V41-70))) -> - | X41: =IF(ISERROR(ROUND('L. Chiles'!$T$54,0)),"-",ROUND('L. Chiles'!$T$54,0)) -> 23 | Y41: =IF(ISERROR(IF(V41-X41=-X41, 0, V41-X41)),"-",(IF(V41-X41=-X41, 0, V41-X41))) -> - | Z41: =IF(ISERROR(IF(Y41-70=-70, "-", Y41-70)),"-",(IF(Y41-70=-70,"-",Y41-70))) -> - | AA41: =IF(ISERROR(COUNT(Z$11:Z$46)-(RANK(Z41,Z$11:Z$46)+COUNTIF(Z$11:Z41,Z41))+2),"-",COUNT(Z$11:Z$46)-(RANK(Z41,Z$1:Z$46)+COUNTIF(Z$11:Z41,Z41))+2) -> -
A42: ='J. Landers'!$A$1 -> J. Landers | B42: 6 | C42: 5 | D42: 5 | E42: 6 | F42: 8 | G42: 5 | H42: 6 | I42: 4 | J42: 7 | K42: =IF(SUM(B42:J42)=0,"-",SUM(B42:J42)) -> 52 | L42: 5 | M42: 5 | N42: 4 | O42: 4 | P42: 6 | Q42: 7 | R42: 5 | S42: 6 | T42: 6 | U42: =IF(SUM(L42:T42)=0,"-",SUM(L42:T42)) -> 48 | V42: =IF(SUM(K42,U42)=0,"-",SUM(K42,U42)) -> 100 | W42: =IF(ISERROR(IF(V42-37=-70, "-", V42-70)),"-",(IF(V42-70=-70,"-",V42-70))) -> 30 | X42: =IF(ISERROR(ROUND('J. Landers'!$T$54,0)),"-",ROUND('J. Landers'!$T$54,0)) -> 18 | Y42: =IF(ISERROR(IF(V42-X42=-X42, 0, V42-X42)),"-",(IF(V42-X42=-X42, 0, V42-X42))) -> 82 | Z42: =IF(ISERROR(IF(Y42-70=-70, "-", Y42-70)),"-",(IF(Y42-70=-70,"-",Y42-70))) -> 12 | AA42: =IF(ISERROR(COUNT(Z$11:Z$46)-(RANK(Z42,Z$11:Z$46)+COUNTIF(Z$11:Z42,Z42))+2),"-",COUNT(Z$11:Z$46)-(RANK(Z42,Z$1:Z$46)+COUNTIF(Z$11:Z42,Z42))+2) -> 12 | AB42: 35
A43: ='B. Kyle'!$A$1 -> B. Kyle | K43: =IF(SUM(B43:J43)=0,"-",SUM(B43:J43)) -> - | U43: =IF(SUM(L43:T43)=0,"-",SUM(L43:T43)) -> - | V43: =IF(SUM(K43,U43)=0,"-",SUM(K43,U43)) -> - | W43: =IF(ISERROR(IF(V43-37=-70, "-", V43-70)),"-",(IF(V43-70=-70,"-",V43-70))) -> - | X43: =IF(ISERROR(ROUND('B. Kyle'!$T$54,0)),"-",ROUND('B. Kyle'!$T$54,0)) -> 20 | Y43: =IF(ISERROR(IF(V43-X43=-X43, 0, V43-X43)),"-",(IF(V43-X43=-X43, 0, V43-X43))) -> - | Z43: =IF(ISERROR(IF(Y43-70=-70, "-", Y43-70)),"-",(IF(Y43-70=-70,"-",Y43-70))) -> - | AA43: =IF(ISERROR(COUNT(Z$11:Z$46)-(RANK(Z43,Z$11:Z$46)+COUNTIF(Z$11:Z43,Z43))+2),"-",COUNT(Z$11:Z$46)-(RANK(Z43,Z$1:Z$46)+COUNTIF(Z$11:Z43,Z43))+2) -> -
A44: ='T. Baumgarner'!$A$1 -> T. Baumgarner | B44: 5 | C44: 4 | D44: 5 | E44: 7 | F44: 6 | G44: 5 | H44: 7 | I44: 8 | J44: 8 | K44: =IF(SUM(B44:J44)=0,"-",SUM(B44:J44)) -> 55 | L44: 6 | M44: 7 | N44: 5 | O44: 3 | P44: 6 | Q44: 6 | R44: 5 | S44: 4 | T44: 5 | U44: =IF(SUM(L44:T44)=0,"-",SUM(L44:T44)) -> 47 | V44: =IF(SUM(K44,U44)=0,"-",SUM(K44,U44)) -> 102 | W44: =IF(ISERROR(IF(V44-37=-70, "-", V44-70)),"-",(IF(V44-70=-70,"-",V44-70))) -> 32 | X44: =IF(ISERROR(ROUND('T. Baumgarner'!$T$54,0)),"-",ROUND('T. Baumgarner'!$T$54,0)) -> 18 | Y44: =IF(ISERROR(IF(V44-X44=-X44, 0, V44-X44)),"-",(IF(V44-X44=-X44, 0, V44-X44))) -> 84 | Z44: =IF(ISERROR(IF(Y44-70=-70, "-", Y44-70)),"-",(IF(Y44-70=-70,"-",Y44-70))) -> 14 | AA44: =IF(ISERROR(COUNT(Z$11:Z$46)-(RANK(Z44,Z$11:Z$46)+COUNTIF(Z$11:Z44,Z44))+2),"-",COUNT(Z$11:Z$46)-(RANK(Z44,Z$1:Z$46)+COUNTIF(Z$11:Z44,Z44))+2) -> 15 | AB44: 35
A45: ='B. Harbour'!$A$1 -> B. Harbour | B45: 7 | C45: 5 | D45: 5 | E45: 7 | F45: 7 | G45: 5 | H45: 7 | I45: 6 | J45: 8 | K45: =IF(SUM(B45:J45)=0,"-",SUM(B45:J45)) -> 57 | L45: 7 | M45: 6 | N45: 3 | O45: 3 | P45: 6 | Q45: 5 | R45: 8 | S45: 3 | T45: 7 | U45: =IF(SUM(L45:T45)=0,"-",SUM(L45:T45)) -> 48 | V45: =IF(SUM(K45,U45)=0,"-",SUM(K45,U45)) -> 105 | W45: =IF(ISERROR(IF(V45-37=-70, "-", V45-70)),"-",(IF(V45-70=-70,"-",V45-70))) -> 35 | X45: =IF(ISERROR(ROUND('B. Harbour'!$T$54,0)),"-",ROUND('B. Harbour'!$T$54,0)) -> 22 | Y45: =IF(ISERROR(IF(V45-X45=-X45, 0, V45-X45)),"-",(IF(V45-X45=-X45, 0, V45-X45))) -> 83 | Z45: =IF(ISERROR(IF(Y45-70=-70, "-", Y45-70)),"-",(IF(Y45-70=-70,"-",Y45-70))) -> 13 | AA45: =IF(ISERROR(COUNT(Z$11:Z$46)-(RANK(Z45,Z$11:Z$46)+COUNTIF(Z$11:Z45,Z45))+2),"-",COUNT(Z$11:Z$46)-(RANK(Z45,Z$1:Z$46)+COUNTIF(Z$11:Z45,Z45))+2) -> 13 | AB45: 32
A46: ='J. Dodrill'!$A$1 -> J. Dodrill | B46: 7 | C46: 6 | D46: 5 | E46: 6 | F46: 7 | G46: 5 | H46: 8 | I46: 7 | J46: 8 | K46: =IF(SUM(B46:J46)=0,"-",SUM(B46:J46)) -> 59 | L46: 7 | M46: 6 | N46: 5 | O46: 5 | P46: 9 | Q46: 6 | R46: 6 | S46: 3 | T46: 5 | U46: =IF(SUM(L46:T46)=0,"-",SUM(L46:T46)) -> 52 | V46: =IF(SUM(K46,U46)=0,"-",SUM(K46,U46)) -> 111 | W46: =IF(ISERROR(IF(V46-37=-70, "-", V46-70)),"-",(IF(V46-70=-70,"-",V46-70))) -> 41 | X46: =IF(ISERROR(ROUND('J. Dodrill'!$T$54,0)),"-",ROUND('J. Dodrill'!$T$54,0)) -> 22 | Y46: =IF(ISERROR(IF(V46-X46=-X46, 0, V46-X46)),"-",(IF(V46-X46=-X46, 0, V46-X46))) -> 89 | Z46: =IF(ISERROR(IF(Y46-70=-70, "-", Y46-70)),"-",(IF(Y46-70=-70,"-",Y46-70))) -> 19 | AA46: =IF(ISERROR(COUNT(Z$11:Z$46)-(RANK(Z46,Z$11:Z$46)+COUNTIF(Z$11:Z46,Z46))+2),"-",COUNT(Z$11:Z$46)-(RANK(Z46,Z$1:Z$46)+COUNTIF(Z$11:Z46,Z46))+2) -> 17 | AB46: 36
Z47: Low Putts | AB47: =IF(MIN(AB11,AB12,AB13,AB13,AB14,AB15,AB16,AB21,AB22,AB23,AB24,AB25,AB26,AB31,AB32,AB33,AB34,AB35,AB36,AB41,AB42,AB43,AB44,AB45,AB46)=0,"-",MIN(AB11,AB12,AB13,AB13,AB14,AB15,AB16,AB21,AB22,AB23,AB24,AB25,AB26,AB31,AB32,AB33,AB34,AB35,AB36,AB41,AB42,AB43,AB44,AB45,AB46)) -> 27 | AC47: =IF(ISERROR(OFFSET(AB11,MATCH(AB47,$AB$11:$AB$46,0)-1,-27,1,1)),"-",OFFSET(AB11,MATCH(AB47,$AB$11:$AB$46,0)-1,-27,1,1)) -> A. Wilks